Organisation Chain,Tender Reference Number,Tender ID,Withdrawal Allowed,Tender Type,Form of contract,Tender Category,No. of Covers,General Technical Evaluation Allowed,ItemWise Technical Evaluation Allowed,Payment Mode,Is Multi Currency Allowed For BOQ,Is Multi Currency Allowed For Fee,Allow Two Stage Bidding,Cover No,Cover,Document Type,Description,Publish Date,Bid Opening Date,Document Download / Sale Start Date,Document Download / Sale End Date,Clarification Start Date,Clarification End Date,Bid Submission Start Date,Bid Submission End Date,Financial Bid Opening Date,EMD Amount in ₹,EMD Exemption Allowed,EMD Fee Type,EMD Percentage,EMD Payable To,EMD Payable At,S.No,Corrigendum Title,Corrigendum Type,View,S.No.1,Bank Name,Tender Fee in ₹,Fee Payable To,Fee Payable At,Tender Fee Exemption Allowed,Name,Address,Title,Work Description,Pre Qualification Details,Independent External Monitor/Remarks,Tender Value in ₹,Product Category,Sub category,Contract Type,Bid Validity(Days),Period Of Work(Days),Location,Pincode,Pre Bid Meeting Place,Pre Bid Meeting Address,Pre Bid Meeting Date,Bid Opening Place,Should Allow NDA Tender,Allow Preferential Bidder,Tender Stage,Contract Date :,Contract Value :,Work Completion Period in days :,Updated By :,Updated on :,AOC document :,S.No,Bid Number,Bidder Name,Awarded Currency,Awarded Value,S.No.1,Bid Number.1,Bidder Name.1,Submitted Date,Status,Remarks,Status Updated On,Type :,Summary :,Updated By :.1,Updated On :,Document :,BOQ Comparative Chart :,Committee Chairperson/Co-ordinator Name :,Committee Chairperson/Co-ordinator Type :,Committee Members :,Updated By :.2,Updated on :.1,Document :.1,Organisation Chain :,Tender ID :,Tender Ref No :,Tender Title :,Type :.1,Summary :.1,Updated By :.3,Updated On :.1,Document :.2,Committee Chairperson/Co-ordinator Name :.1,Committee Chairperson/Co-ordinator Type :.1,Committee Members :.1,Updated By :.4,Updated On :.2,Financial Bid Opening Date:,Document :.3,Tender Stage
"Pr. Chief Conservator of Forest and Head of Forest Force||Chief Conservator of Forests (Upper Assam Zone)||Northern Assam Circle, Tezpur||Nagaon South Division",FNST/B/MPA/Sale/2025/4270,2025_PCCF_47284_1,Yes,Open Tender,Lump-sum,Works,2.0,No,No,Online,No,No,No,1.0,Fee/PreQual/Technical,.pdf,BID Documents.,05-Sep-2025 09:00 AM,12-Sep-2025 12:00 PM,05-Sep-2025 10:00 AM,12-Sep-2025 09:00 AM,05-Sep-2025 10:30 AM ,08-Sep-2025 05:30 PM ,05-Sep-2025 12:00 PM,12-Sep-2025 09:00 AM,15-Sep-2025 01:00 PM,"3,27,721",Yes,percentage,2.0%,Nil,Nil,1.0,Correction in the schedule of work in the Bid Documents.,Financial Bid,,1.0,SBI Bank,"1,000",Nil,Nil,No,Divisional Forest Officer,"Adarsha Bazar, PO/PS- Hojai, Dist- Hojai, Assam",Execution of Roadside/AvenuePlantation and Maintenance of Doboka to Lanka section of NH-27,Execution of Roadside/Avenue Plantation and Maintenance of Doboka to Lanka section of NH-27,Please refer Tender documents. ,NA ,"1,63,86,060",Agricultural or Forestry,NA ,Tender,45.0,1825.0,Doboka to Lanka NH-27 (7 km),782440.0,Hojai ,"Adarsha Bazar, PO/PS- Hojai, Dist- Hojai, Assam ",05-Sep-2025 10:00 AM ,Hojai,No ,No,AOC,15-Sep-2025,"INR 19,335,551",1825.0,DEBOJYOTI NATH,06-Oct-2025 02:40 PM,workorder.pdf (1435.00 KB),1.0,281411.0,M/S BHOWMIK ENTERPRISE,INR,"17,401,995.9",1,281411,M/S BHOWMIK ENTERPRISE,11-Sep-2025 08:54 PM,Accepted-AOC,Lowest Bid.,06-Oct-2025 02:41 PM,Finance,Admitted.,DEBOJYOTI NATH,15-Sep-2025 02:08 PM,finance_75452.pdf,BOQ Comparative Chart,Sri Debojyoti Nath,Internal,"Sri Manik Ch. Baruah, Sri Bijit Bhattacharjee, Sri Dulal Ch. Borah.",DEBOJYOTI NATH,15-Sep-2025 02:14 PM,finsummary_75452.pdf (933.86 KB),"Pr. Chief Conservator of Forest and Head of Forest Force||Chief Conservator of Forests (Upper Assam Zone)||Northern Assam Circle, Tezpur||Nagaon South Division",2025_PCCF_47284_1,FNST/B/MPA/Sale/2025/4270,Execution of Roadside/AvenuePlantation and Maintenance of Doboka to Lanka section of NH-27,Technical,Admitted for Technical Evaluation.,DEBOJYOTI NATH,12-Sep-2025 02:00 PM,,Sri Debojyoti Nath,Internal,"Sri Manik Ch. Baruah, Sri Bijit Bhattacharjee, Sri Dulal Ch. Borah.",DEBOJYOTI NATH,15-Sep-2025 12:53 PM,15-Sep-2025 01:00 PM,techsummary_75452.pdf (933.86 KB),AOC
,,,,,,,,,,,,,,,,.pdf,NIT,,,,,,,,,,,,,,,,,,,,,,,,,,,,,,,,,,,,,,,,,,,,,,AOC,,,,,,,,,,,,2,281358,M/s Rahman Enterprise,11-Sep-2025 03:04 PM,Rejected-Technical,"PAN details not readable, Form B4 and B6 not submitted.",15-Sep-2025 12:53 PM,,,,,,,,,,,,,,,,,,,,,,,,,,,,,AOC
,,,,,,,,,,,,,,,,.pdf,Estimate.,,,,,,,,,,,,,,,,,,,,,,,,,,,,,,,,,,,,,,,,,,,,,,AOC,,,,,,,,,,,,3,280886,Nandalal Seal,12-Sep-2025 12:41 AM,Rejected-Technical,Filled up forms not uploaded.,15-Sep-2025 12:53 PM,,,,,,,,,,,,,,,,,,,,,,,,,,,,,AOC
,,,,,,,,,,,,,,2.0,Finance,.xls,DOQ,,,,,,,,,,,,,,,,,,,,,,,,,,,,,,,,,,,,,,,,,,,,,,AOC,,,,,,,,,,,,4,280195,NORTH EAST ORGANISED FLORITECH PVT. LTD.,12-Sep-2025 08:39 AM,Rejected-Technical,Forms mentioned in the Bid Documents not filled up before submission.,15-Sep-2025 12:53 PM,,,,,,,,,,,,,,,,,,,,,,,,,,,,,AOC
,,,,,,,,,,,,,,,,,,,,,,,,,,,,,,,,,,,,,,,,,,,,,,,,,,,,,,,,,,,,,,,AOC,,,,,,,,,,,,5,280813,RAIHAN ENTERPRISE,11-Sep-2025 05:50 PM,Rejected-Technical,Form B3 and Form B4 not submitted.,15-Sep-2025 12:53 PM,,,,,,,,,,,,,,,,,,,,,,,,,,,,,AOC
