Organisation Chain,Tender Reference Number,Tender ID,Withdrawal Allowed,Tender Type,Form of contract,Tender Category,No. of Covers,General Technical Evaluation Allowed,ItemWise Technical Evaluation Allowed,Payment Mode,Is Multi Currency Allowed For BOQ,Is Multi Currency Allowed For Fee,Allow Two Stage Bidding,Cover No,Cover,Document Type,Description,Publish Date,Bid Opening Date,Document Download / Sale Start Date,Document Download / Sale End Date,Clarification Start Date,Clarification End Date,Bid Submission Start Date,Bid Submission End Date,Financial Bid Opening Date,EMD Amount in ₹,EMD Exemption Allowed,EMD Fee Type,EMD Percentage,EMD Payable To,EMD Payable At,S.No,Bank Name,Tender Fee in ₹,Fee Payable To,Fee Payable At,Tender Fee Exemption Allowed,Name,Address,Title,Work Description,Pre Qualification Details,Independent External Monitor/Remarks,Tender Value in ₹,Product Category,Sub category,Contract Type,Bid Validity(Days),Period Of Work(Days),Location,Pincode,Pre Bid Meeting Place,Pre Bid Meeting Address,Pre Bid Meeting Date,Bid Opening Place,Should Allow NDA Tender,Allow Preferential Bidder,Tender Stage,Contract Date :,Contract Value :,Work Completion Period in days :,Updated By :,Updated on :,AOC document :,AOC Description :,S.No,Bid Number,Bidder Name,Awarded Currency,Awarded Value,S.No.1,Bid Number.1,Bidder Name.1,Submitted Date,Status,Remarks,Status Updated On,Type :,Summary :,Updated By :.1,Updated On :,Document :,BOQ Comparative Chart :,Committee Chairperson/Co-ordinator Name :,Committee Chairperson/Co-ordinator Type :,Committee Members :,Updated By :.2,Updated on :.1,Document :.1,Organisation Chain :,Tender ID :,Tender Ref No :,Tender Title :,Type :.1,Summary :.1,Updated By :.3,Updated On :.1,Document :.2,Committee Chairperson/Co-ordinator Name :.1,Committee Chairperson/Co-ordinator Type :.1,Committee Members :.1,Updated By :.4,Updated On :.2,Financial Bid Opening Date:,Document :.3,Tender Stage
Industries and Commerce Department||DNP Limited,PCB/EM/DNPL/12/73/Pt.III/25,2024_ICD_40574_1,Yes,Open Tender,Works,Services,2.0,No,No,Online,No,No,No,1.0,Fee/PreQual/Technical,.pdf,NIT,25-Nov-2024 04:00 PM,09-Dec-2024 01:00 PM,25-Nov-2024 04:00 PM,07-Dec-2024 11:00 AM,25-Nov-2024 04:00 PM ,30-Nov-2024 11:00 AM ,25-Nov-2024 04:00 PM,07-Dec-2024 11:00 AM,04-Jan-2025 11:00 AM,0.0,No,fixed,,Nil,Nil,1.0,SBI Bank,200.0,Nil,Nil,Yes,"Director and CEO, DNP Ltd","1 No. Borpathar, Madhuban, Duliajan- 786602",Environmental Monitoring for the DNP Ltd Gas Pipeline,Environmental Monitoring for the DNP Ltd Gas Pipeline,Please refer Tender documents. ,NA ,,Miscellaneous Services,NA ,Tender,180.0,30.0,Duliajan,786602.0,NA ,NA ,NA ,"DNP Ltd, Duliajan",No ,No,AOC,07-Oct-2025,"INR 177,000",30.0,Birendra Nath Moran,07-Oct-2025 11:44 AM,AOC.pdf (4129.00 KB),Award of contract,1.0,250026.0,ALKOM SYNERGY PRIVATE LIMITED,INR,"177,000",1,250026,ALKOM SYNERGY PRIVATE LIMITED,06-Dec-2024 04:25 PM,Accepted-AOC,Qualified as L1 Bidder,07-Oct-2025 11:44 AM,Finance,Price bids summary,Birendra Nath Moran,07-Oct-2025 11:34 AM,finance_65692.pdf,BOQ Comparative Chart,Kalpajit Das,Internal,"K. Das, P.J. Mahanta, G. Neog, U. Kashyap",Birendra Nath Moran,07-Oct-2025 11:40 AM,finsummary_65692.pdf (396.76 KB),Industries and Commerce Department||DNP Limited,2024_ICD_40574_1,PCB/EM/DNPL/12/73/Pt.III/25,Environmental Monitoring for the DNP Ltd Gas Pipeline,Technical,Technical bids summary.,Bristi Bakul Barua,04-Jan-2025 10:51 AM,technical_65692.pdf,Kalpajit Das,Internal,"K. Das, P.J. Mahanta, B.B. Baruah, U. Kashyap.",Bristi Bakul Barua,04-Jan-2025 10:56 AM,04-Jan-2025 11:00 AM,techsummary_65692.pdf (546.46 KB),AOC
,,,,,,,,,,,,,,2.0,Finance,.xls,Price bid,,,,,,,,,,,,,,,,,,,,,,,,,,,,,,,,,,,,,,,,,,AOC,,,,,,,,,,,,,2,249797,Arihant Analytical Laboratory Pvt Ltd,05-Dec-2024 04:29 PM,Rejected-Finance,As L2 bidder,07-Oct-2025 11:40 AM,,,,,,,,,,,,,,,,,,,,,,,,,,,,,AOC
,,,,,,,,,,,,,,,,,,,,,,,,,,,,,,,,,,,,,,,,,,,,,,,,,,,,,,,,,,,AOC,,,,,,,,,,,,,3,250222,ENVIRO TESTING SERVICES,07-Dec-2024 10:36 AM,Rejected-Finance,As L3 bidder,07-Oct-2025 11:40 AM,,,,,,,,,,,,,,,,,,,,,,,,,,,,,AOC
,,,,,,,,,,,,,,,,,,,,,,,,,,,,,,,,,,,,,,,,,,,,,,,,,,,,,,,,,,,AOC,,,,,,,,,,,,,4,249442,MAHABAL ENVIRO ENGINEERS PVT LTD,28-Nov-2024 12:02 PM,Rejected-Finance,As L5 bidder,07-Oct-2025 11:40 AM,,,,,,,,,,,,,,,,,,,,,,,,,,,,,AOC
,,,,,,,,,,,,,,,,,,,,,,,,,,,,,,,,,,,,,,,,,,,,,,,,,,,,,,,,,,,AOC,,,,,,,,,,,,,5,249751,Sabz Care Environmental Consultancy Private Limited,02-Dec-2024 02:03 PM,Rejected-Finance,As L4 bidder,07-Oct-2025 11:40 AM,,,,,,,,,,,,,,,,,,,,,,,,,,,,,AOC
,,,,,,,,,,,,,,,,,,,,,,,,,,,,,,,,,,,,,,,,,,,,,,,,,,,,,,,,,,,AOC,,,,,,,,,,,,,6,249928,SAWEN PROJECTS AND LABORATORIES PVT LTD,04-Dec-2024 05:02 PM,Rejected-Technical,Disqualified,04-Jan-2025 10:56 AM,,,,,,,,,,,,,,,,,,,,,,,,,,,,,AOC
