Organisation Chain,Tender Reference Number,Tender ID,Withdrawal Allowed,Tender Type,Form of contract,Tender Category,No. of Covers,General Technical Evaluation Allowed,ItemWise Technical Evaluation Allowed,Payment Mode,Is Multi Currency Allowed For BOQ,Is Multi Currency Allowed For Fee,Allow Two Stage Bidding,Cover No,Cover,Document Type,Description,Publish Date,Bid Opening Date,Document Download / Sale Start Date,Document Download / Sale End Date,Clarification Start Date,Clarification End Date,Bid Submission Start Date,Bid Submission End Date,Financial Bid Opening Date,EMD Amount in ₹,EMD Exemption Allowed,EMD Fee Type,EMD Percentage,EMD Payable To,EMD Payable At,S.No,Bank Name,Tender Fee in ₹,Fee Payable To,Fee Payable At,Tender Fee Exemption Allowed,Name,Address,Title,Work Description,Pre Qualification Details,Independent External Monitor/Remarks,Tender Value in ₹,Product Category,Sub category,Contract Type,Bid Validity(Days),Period Of Work(Days),Location,Pincode,Pre Bid Meeting Place,Pre Bid Meeting Address,Pre Bid Meeting Date,Bid Opening Place,Should Allow NDA Tender,Allow Preferential Bidder,Tender Stage,Contract Date :,Contract Value :,Work Completion Period in days :,Updated By :,Updated on :,AOC document :,AOC Description :,S.No,Bid Number,Bidder Name,Awarded Currency,Awarded Value,S.No.1,Bid Number.1,Bidder Name.1,Submitted Date,Status,Remarks,Status Updated On,Type :,Summary :,Updated By :.1,Updated On :,Document :,BOQ Comparative Chart :,Committee Chairperson/Co-ordinator Name :,Committee Chairperson/Co-ordinator Type :,Committee Members :,Updated By :.2,Updated on :.1,Document :.1,Organisation Chain :,Tender ID :,Tender Ref No :,Tender Title :,Type :.1,Summary :.1,Updated By :.3,Updated On :.1,Document :.2,Committee Chairperson/Co-ordinator Name :.1,Committee Chairperson/Co-ordinator Type :.1,Committee Members :.1,Updated By :.4,Updated On :.2,Financial Bid Opening Date:,Document :.3,Tender Stage
Public Works Building and NH Department||Chief Engineer-Building - PWBNH||SE-Guwahati Circle-2 - PWBNH,SE/BII/Chemlaboratory/ASTU,2025_PWBNH_47358_1,Yes,Open Tender,Item Wise,Works,2.0,No,No,Online,No,No,No,1.0,Fee/PreQual/Technical,.pdf,Bidding Document,09-Sep-2025 12:00 PM,08-Oct-2025 11:30 AM,09-Sep-2025 12:00 PM,07-Oct-2025 02:00 PM,NA ,NA ,15-Sep-2025 02:30 PM,07-Oct-2025 02:00 PM,13-Oct-2025 11:00 AM,"45,497",Yes,percentage,2.0%,Nil,Nil,1.0,SBI Bank,"1,000",Nil,Nil,No,SE PWD Ghy Bldg Circle-II Chandmari Ghy-3,O/o the SE PWD Ghy Bldg Circle-II Chandmari Ghy-3,Construction and Development of Proposed Chemistry Laboratory at Assam Science and Technology University,Construction and Development of Proposed Chemistry Laboratory at Assam Science and Technology University,Please refer Tender documents. ,NA ,"22,74,852",Civil Works - Building,NA ,Tender,180.0,120.0,"Tetelia, Jalukbari",781013.0,O/o the SE PWD Ghy Bldg Circle-II Chandmari Ghy-3 ,O/o the SE PWD Ghy Bldg Circle-II Chandmari Ghy-3 ,15-Sep-2025 12:00 PM ,O/o the SE PWD Ghy Bldg Circle-II Chandmari Ghy-3,No ,No,AOC,30-Oct-2025,"INR 1,911,705",120.0,Kanak Chandra Roy,30-Oct-2025 06:06 PM,AoC_Chemlab_ASTU.pdf (2055.00 KB),AoC_Agreement,1.0,283679.0,Md. Karamat Ansari,INR,"1,911,705",1,283391,Balen Roy Medhi,07-Oct-2025 11:17 AM,Rejected-AOC,Unsuccessful bidder,30-Oct-2025 06:06 PM,Finance,Minutes,Kanak Chandra Roy,13-Oct-2025 05:01 PM,finance_75601.pdf,BOQ Comparative Chart,Chairperson,Internal,Member Secretary Members,Kanak Chandra Roy,17-Oct-2025 11:58 AM,finsummary_75601.pdf (348.42 KB),Public Works Building and NH Department||Chief Engineer-Building - PWBNH||SE-Guwahati Circle-2 - PWBNH,2025_PWBNH_47358_1,SE/BII/Chemlaboratory/ASTU,Construction and Development of Proposed Chemistry Laboratory at Assam Science and Technology University,Technical,Minutes,Kanak Chandra Roy,09-Oct-2025 06:18 PM,technical_75601.pdf,Chairperson,Internal,Member Secretary Members,Kanak Chandra Roy,10-Oct-2025 05:21 PM,13-Oct-2025 11:00 AM,techsummary_75601.pdf (1030.72 KB),AOC
,,,,,,,,,,,,,,,,.pdf,Technical Qualification,,,,,,,,,,,,,,,,,,,,,,,,,,,,,,,,,,,,,,,,,,AOC,,,,,,,,,,,,,2,283679,Md. Karamat Ansari,07-Oct-2025 12:33 PM,Accepted-AOC,Successful bidder being L1,30-Oct-2025 06:06 PM,,,,,,,,,,,,,,,,,,,,,,,,,,,,,AOC
,,,,,,,,,,,,,,2.0,Finance,.xls,BOQ,,,,,,,,,,,,,,,,,,,,,,,,,,,,,,,,,,,,,,,,,,AOC,,,,,,,,,,,,,3,283682,M/S Dulu Mani Rajkhowa,07-Oct-2025 12:38 PM,Rejected-AOC,Unsuccessful bidder,30-Oct-2025 06:06 PM,,,,,,,,,,,,,,,,,,,,,,,,,,,,,AOC
,,,,,,,,,,,,,,,,.pdf,Form of Bid,,,,,,,,,,,,,,,,,,,,,,,,,,,,,,,,,,,,,,,,,,AOC,,,,,,,,,,,,,4,283753,Ranjit Das,07-Oct-2025 01:59 PM,Rejected-Technical,Technically not qualified,10-Oct-2025 05:21 PM,,,,,,,,,,,,,,,,,,,,,,,,,,,,,AOC
,,,,,,,,,,,,,,,,,,,,,,,,,,,,,,,,,,,,,,,,,,,,,,,,,,,,,,,,,,,AOC,,,,,,,,,,,,,5,283640,SRI KRISHANT BHARALI,06-Oct-2025 07:57 PM,Rejected-Technical,Technically not qualified,10-Oct-2025 05:21 PM,,,,,,,,,,,,,,,,,,,,,,,,,,,,,AOC
