Organisation Chain,Tender Reference Number,Tender ID,Withdrawal Allowed,Tender Type,Form of contract,Tender Category,No. of Covers,General Technical Evaluation Allowed,ItemWise Technical Evaluation Allowed,Payment Mode,Is Multi Currency Allowed For BOQ,Is Multi Currency Allowed For Fee,Allow Two Stage Bidding,Cover No,Cover,Document Type,Description,Publish Date,Bid Opening Date,Document Download / Sale Start Date,Document Download / Sale End Date,Clarification Start Date,Clarification End Date,Bid Submission Start Date,Bid Submission End Date,Financial Bid Opening Date,EMD Amount in ₹,EMD Exemption Allowed,EMD Fee Type,EMD Percentage,EMD Payable To,EMD Payable At,S.No,Bank Name,Tender Fee in ₹,Fee Payable To,Fee Payable At,Tender Fee Exemption Allowed,Name,Address,Title,Work Description,Pre Qualification Details,Independent External Monitor/Remarks,Tender Value in ₹,Product Category,Sub category,Contract Type,Bid Validity(Days),Period Of Work(Days),Location,Pincode,Pre Bid Meeting Place,Pre Bid Meeting Address,Pre Bid Meeting Date,Bid Opening Place,Should Allow NDA Tender,Allow Preferential Bidder,Tender Stage,Contract Date :,Contract Value :,Work Completion Period in days :,Updated By :,Updated on :,AOC document :,S.No,Bid Number,Bidder Name,Awarded Currency,Awarded Value,S.No.1,Bid Number.1,Bidder Name.1,Submitted Date,Status,Remarks,Status Updated On,Type :,Summary :,Updated By :.1,Updated On :,Document :,BOQ Comparative Chart :,Committee Chairperson/Co-ordinator Name :,Committee Chairperson/Co-ordinator Type :,Committee Members :,Updated By :.2,Updated on :.1,Document :.1,Organisation Chain :,Tender ID :,Tender Ref No :,Tender Title :,Type :.1,Summary :.1,Updated By :.3,Updated On :.1,Document :.2,Committee Chairperson/Co-ordinator Name :.1,Committee Chairperson/Co-ordinator Type :.1,Committee Members :.1,Updated By :.4,Updated On :.2,Financial Bid Opening Date:,Document :.3,Tender Stage
SECONDARY EDUCATION DEPARTMENT ASSAM||Board of Secondary Education Assam,ASSEBD1STOREPRINTBAB2025501,2025_SE_47145_1,Yes,Open Tender,Supply,Goods,2.0,No,No,Online,No,No,No,1.0,Fee/PreQual/Technical,.pdf,Technical,30-Aug-2025 04:00 PM,24-Sep-2025 12:00 PM,31-Aug-2025 11:00 AM,19-Sep-2025 02:00 PM,NA ,NA ,10-Sep-2025 11:00 AM,19-Sep-2025 02:00 PM,09-Oct-2025 12:00 PM,"1,00,000",No,fixed,,Nil,Nil,1.0,SBI Bank,"2,000",Nil,Nil,No,Secretary ASSEB,Bamumimaidam Guwahati,Printing and Supply of Blank Answer Scripts,"Printing and Supply of Blank Answer Scripts and Additional Sheet for Class-X Board Examination, 2026",Please refer Tender documents. ,NA ,"1,10,00,000",Supply of Materials,NA ,Tender,90.0,60.0,Bamumimaidam Guwahati,781021.0,NA ,NA ,NA ,Bamumimaidam Guwahati,No ,No,AOC,15-Oct-2025,"INR 8,928,000",60.0,Abhijit Saloi,29-Oct-2025 02:00 PM,AOC_Printing_AnswerBook.pdf (390.00 KB),1.0,282391.0,SARAIGHAT PHOTO TYPES PRIVATE LIMITED,INR,"8,928,000",1,281873,AURORA FINE ARTS,19-Sep-2025 12:19 PM,Rejected-AOC,L4,29-Oct-2025 02:00 PM,Finance,financial bid opening summary,Abhijit Saloi,14-Oct-2025 04:23 PM,finance_75201.pdf,BOQ Comparative Chart,NN NATH,Internal,ABHIJIT SALOI BINOY K MISRA NAYANJYOTI SARMAH,Abhijit Saloi,15-Oct-2025 11:51 AM,finsummary_75201.pdf (223.25 KB),SECONDARY EDUCATION DEPARTMENT ASSAM||Board of Secondary Education Assam,2025_SE_47145_1,ASSEBD1STOREPRINTBAB2025501,Printing and Supply of Blank Answer Scripts,Technical,Bid Opening Summary,Abhijit Saloi,25-Sep-2025 05:14 PM,technical_75201.pdf,NN NATH,Internal,BIBOY K MISRA ABHIJIT SALOI NAYAN J SARMAH,Abhijit Saloi,08-Oct-2025 01:35 PM,09-Oct-2025 12:00 PM,techsummary_75201.pdf (818.37 KB),AOC
,,,,,,,,,,,,,,2.0,Finance,.xls,Financial,,,,,,,,,,,,,,,,,,,,,,,,,,,,,,,,,,,,,,,,,,AOC,,,,,,,,,,,,2,282105,BINDIYA ENTERPRISE,19-Sep-2025 12:54 PM,Rejected-AOC,L3,29-Oct-2025 02:00 PM,,,,,,,,,,,,,,,,,,,,,,,,,,,,,AOC
,,,,,,,,,,,,,,,,,,,,,,,,,,,,,,,,,,,,,,,,,,,,,,,,,,,,,,,,,,,AOC,,,,,,,,,,,,3,282288,F M Printers,18-Sep-2025 09:01 PM,Rejected-AOC,L2,29-Oct-2025 02:00 PM,,,,,,,,,,,,,,,,,,,,,,,,,,,,,AOC
,,,,,,,,,,,,,,,,,,,,,,,,,,,,,,,,,,,,,,,,,,,,,,,,,,,,,,,,,,,AOC,,,,,,,,,,,,4,282271,FUTURE EDUCARE PVT LTD,19-Sep-2025 12:47 PM,Rejected-AOC,L5,29-Oct-2025 02:00 PM,,,,,,,,,,,,,,,,,,,,,,,,,,,,,AOC
,,,,,,,,,,,,,,,,,,,,,,,,,,,,,,,,,,,,,,,,,,,,,,,,,,,,,,,,,,,AOC,,,,,,,,,,,,5,282424,Gemini Graaphics Private Limited,19-Sep-2025 01:38 PM,Rejected-AOC,L6,29-Oct-2025 02:00 PM,,,,,,,,,,,,,,,,,,,,,,,,,,,,,AOC
,,,,,,,,,,,,,,,,,,,,,,,,,,,,,,,,,,,,,,,,,,,,,,,,,,,,,,,,,,,AOC,,,,,,,,,,,,6,282391,SARAIGHAT PHOTO TYPES PRIVATE LIMITED,19-Sep-2025 12:44 PM,Accepted-AOC,L1,29-Oct-2025 02:00 PM,,,,,,,,,,,,,,,,,,,,,,,,,,,,,AOC
