Organisation Chain,Tender Reference Number,Tender ID,Withdrawal Allowed,Tender Type,Form of contract,Tender Category,No. of Covers,General Technical Evaluation Allowed,ItemWise Technical Evaluation Allowed,Payment Mode,Is Multi Currency Allowed For BOQ,Is Multi Currency Allowed For Fee,Allow Two Stage Bidding,Cover No,Cover,Document Type,Description,Publish Date,Bid Opening Date,Document Download / Sale Start Date,Document Download / Sale End Date,Clarification Start Date,Clarification End Date,Bid Submission Start Date,Bid Submission End Date,Financial Bid Opening Date,EMD Amount in ₹,EMD Exemption Allowed,EMD Fee Type,EMD Percentage,EMD Payable To,EMD Payable At,S.No,Corrigendum Title,Corrigendum Type,View,S.No.1,Bank Name,Tender Fee in ₹,Fee Payable To,Fee Payable At,Tender Fee Exemption Allowed,Name,Address,Title,Work Description,Pre Qualification Details,Independent External Monitor/Remarks,Tender Value in ₹,Product Category,Sub category,Contract Type,Bid Validity(Days),Period Of Work(Days),Location,Pincode,Pre Bid Meeting Place,Pre Bid Meeting Address,Pre Bid Meeting Date,Bid Opening Place,Should Allow NDA Tender,Allow Preferential Bidder,Organisation Chain,Tender Reference Number,Tender ID,Withdrawal Allowed,Tender Type,Form of contract,Tender Category,No. of Covers,General Technical Evaluation Allowed,ItemWise Technical Evaluation Allowed,Payment Mode,Is Multi Currency Allowed For BOQ,Is Multi Currency Allowed For Fee,Allow Two Stage Bidding,Cover No,Cover,Document Type,Description,Publish Date,Bid Opening Date,Document Download / Sale Start Date,Document Download / Sale End Date,Clarification Start Date,Clarification End Date,Bid Submission Start Date,Bid Submission End Date,Financial Bid Opening Date,EMD Amount in ₹,EMD Exemption Allowed,EMD Fee Type,EMD Percentage,EMD Payable To,EMD Payable At,S.No,Corrigendum Title,Corrigendum Type,View,S.No.1,Bank Name,Tender Fee in ₹,Fee Payable To,Fee Payable At,Tender Fee Exemption Allowed,Name,Address,Title,Work Description,Pre Qualification Details,Independent External Monitor/Remarks,Tender Value in ₹,Product Category,Sub category,Contract Type,Bid Validity(Days),Period Of Work(Days),Location,Pincode,Pre Bid Meeting Place,Pre Bid Meeting Address,Pre Bid Meeting Date,Bid Opening Place,Should Allow NDA Tender,Allow Preferential Bidder,Contract Date :,Contract Value :,Work Completion Period in days :,Updated By :,Updated on :,AOC document :,AOC Description :,S.No.2,Bid Number,Bidder Name,Awarded Currency,Awarded Value,S.No.3,Bid Number.1,Bidder Name.1,Submitted Date,Status,Remarks,Status Updated On,Type :,Summary :,Updated By :.1,Updated On :,Document :,BOQ Comparative Chart :,Committee Chairperson/Co-ordinator Name :,Committee Chairperson/Co-ordinator Type :,Committee Members :,Updated By :.2,Updated on :.1,Document :.1,S.No.4,Bid Number.2,Bidder Name.2,Value,Rank,Type :.1,Summary :.1,Updated By :.3,Updated On :.1,Document :.2,Committee Chairperson/Co-ordinator Name :.1,Committee Chairperson/Co-ordinator Type :.1,Committee Members :.1,Updated By :.4,Updated On :.2,Financial Bid Opening Date:,Document :.3,Tender ID :,Tender Ref No :,Tender Title :
Excise Department||Commissioner of Excise - ED||O/o SE-Bongaigaon - ED,EXCI-12/1114/2023-EXC-BNG,2023_ED_34746_1,Yes,Open Tender,Item Wise,Services,2.0,No,No,Online,No,No,No,1.0,Fee/PreQual/Technical,.pdf,Technical Bid qualification documents,16-Dec-2023 11:15 AM,18-Jan-2024 11:00 AM,16-Dec-2023 11:15 AM,15-Jan-2024 05:00 PM,16-Dec-2023 11:15 AM ,22-Dec-2023 05:00 PM ,27-Dec-2023 10:00 AM,15-Jan-2024 05:00 PM,27-Feb-2024 11:00 AM,"5,00,000",No,fixed,,Nil,Nil,1.0,CORRIGENDUM ON IMFL OFF SHOP BID DOCUMENTS,Technical Bid,,1.0,SBI Bank,0.0,Nil,Nil,No,"District Collector, Bongaigaon","O/o The District Collector, Bongaigaon","GRANT OF IMFL OFF SHOP NO. BGN3 AT BONGAIGAON TOWN WARD NO. 05 AND 06, BONGAIGAON","GRANT OF IMFL OFF SHOP NO. BGN3 AT BONGAIGAON TOWN WARD NO. 05 AND 06, BONGAIGAON",Please refer tender documents ,NA ,,Miscellaneous Services,NA ,Tender,180.0,NA ,BONGAIGAON,783380.0,"O/o The Superintendent of Excise, Bongaigaon ","O/o The District Collector, Excise Branch, Bongaigaon ",26-Dec-2023 11:30 AM ,"O/o The Superintendent of Excise, Bongaigaon",No ,No,Excise Department||Commissioner of Excise - ED||O/o SE-Bongaigaon - ED,EXCI-12/1114/2023-EXC-BNG,2023_ED_34746_1,Yes,Open Tender,Item Wise,Services,2.0,No,No,Online,No,No,No,1.0,Fee/PreQual/Technical,.pdf,Technical Bid qualification documents,16-Dec-2023 11:15 AM,18-Jan-2024 11:00 AM,16-Dec-2023 11:15 AM,15-Jan-2024 05:00 PM,16-Dec-2023 11:15 AM ,22-Dec-2023 05:00 PM ,27-Dec-2023 10:00 AM,15-Jan-2024 05:00 PM,27-Feb-2024 11:00 AM,"5,00,000",No,fixed,,Nil,Nil,1.0,CORRIGENDUM ON IMFL OFF SHOP BID DOCUMENTS,Technical Bid,,1.0,SBI Bank,0.0,Nil,Nil,No,"District Collector, Bongaigaon","O/o The District Collector, Bongaigaon","GRANT OF IMFL OFF SHOP NO. BGN3 AT BONGAIGAON TOWN WARD NO. 05 AND 06, BONGAIGAON","GRANT OF IMFL OFF SHOP NO. BGN3 AT BONGAIGAON TOWN WARD NO. 05 AND 06, BONGAIGAON",Please refer tender documents ,NA ,,Miscellaneous Services,NA ,Tender,180.0,NA ,BONGAIGAON,783380.0,"O/o The Superintendent of Excise, Bongaigaon ","O/o The District Collector, Excise Branch, Bongaigaon ",26-Dec-2023 11:30 AM ,"O/o The Superintendent of Excise, Bongaigaon",No ,No,27-Sep-2024,"INR 4,517,989",125.0,Bidyut Bikash Pathak,27-Nov-2024 03:08 PM,NirmaliSinghaLicense.pdf (729.00 KB),H1 Bidder,1.0,220666.0,NIRMALI SINGHA,INR,"4,517,989",1.0,220916.0,Haripriya Nath,15-Jan-2024 04:08 PM,Rejected-Technical,Required documents not submitted. Kindly refer Minutes of Technical Evaluation,26-Feb-2024 07:48 PM,Finance,Financial Bid Open,Bidyut Bikash Pathak,27-Feb-2024 01:51 PM,None,BOQ Comparative Chart,Bidyut Bikash Pathak FAO Bongaigaon and Member,Internal,,Bidyut Bikash Pathak,01-Jun-2024 03:48 PM,finsummary_56255.pdf (1272.89 KB),1.0,219284.0,M/S WHITE HOUSE COMMERCIAL,"21,00,001.00",H2,Technical,Minutes of Technical Evaluation,Dipanjali Das,26-Feb-2024 07:02 PM,technical_56255.pdf,"Shri Nabadeep Pathak, ACS, District Commissioner, Bongaigaon",Internal,,Dipanjali Das,26-Feb-2024 07:48 PM,27-Feb-2024 11:00 AM,techsummary_56255.pdf (1107.93 KB),,,
,,,,,,,,,,,,,,,,.pdf,Signed Bid Documents downloaded from the portal,,,,,,,,,,,,,,,,,,,,,,,,,,,,,,,,,,,,,,,,,,,,,,,,,,,,,,,,,,,,,,.pdf,Signed Bid Documents downloaded from the portal,,,,,,,,,,,,,,,,,,,,,,,,,,,,,,,,,,,,,,,,,,,,,,,,,,,,,,,,,,2.0,219284.0,M/S WHITE HOUSE COMMERCIAL,15-Jan-2024 01:57 PM,Rejected-Finance,H2 bidder with second highest bid for BGN3 Ward No 5 and 6 Bongaigaon Town,01-Jun-2024 03:48 PM,,,,,,,,,,,,,2.0,220666.0,NIRMALI SINGHA,"45,17,989.00",H1,,,,,,,,,,,,,,,
,,,,,,,,,,,,,,2.0,Finance,.xls,BOQ,,,,,,,,,,,,,,,,,,,,,,,,,,,,,,,,,,,,,,,,,,,,,,,,,,,,,,,,,,,,2.0,Finance,.xls,BOQ,,,,,,,,,,,,,,,,,,,,,,,,,,,,,,,,,,,,,,,,,,,,,,,,,,,,,,,,,,3.0,220666.0,NIRMALI SINGHA,15-Jan-2024 12:32 PM,Accepted-AOC,H1 Bidder,27-Nov-2024 03:08 PM,,,,,,,,,,,,,,,,,,,,,,,,,,,,,,,,
,,,,,,,,,,,,,,,,,,,,,,,,,,,,,,,,,,,,,,,,,,,,,,,,,,,,,,,,,,,,,,,,,,,,,,,,,,,,,,,,,,,,,,,,,,,,,,,,,,,,,,,,,,,,,,,,,,,,,,,,,,,,,,,,,,,,,,,,,,4.0,220865.0,NIRMAL KUMAR SINGHA,15-Jan-2024 11:58 AM,Rejected-Technical,Required documents not submitted. Kindly refer minutes of Technical Evaluation,26-Feb-2024 07:48 PM,,,,,,,,,,,,,,,,,,,,,,,,,,,,,,,,
,,,,,,,,,,,,,,,,,,,,,,,,,,,,,,,,,,,,,,,,,,,,,,,,,,,,,,,,,,,,,,,,,,,,,,,,,,,,,,,,,,,,,,,,,,,,,,,,,,,,,,,,,,,,,,,,,,,,,,,,,,,,,,,,,,,,,,,,,,,,,,,,,,,,,,,,,,,,,,,,,,,,,,,,,,,,,,2023_ED_34746_1,EXCI-12/1114/2023-EXC-BNG,"GRANT OF IMFL OFF SHOP NO. BGN3 AT BONGAIGAON TOWN WARD NO. 05 AND 06, BONGAIGAON"
