Organisation Chain,Tender Reference Number,Tender ID,Withdrawal Allowed,Tender Type,Form of contract,Tender Category,No. of Covers,General Technical Evaluation Allowed,ItemWise Technical Evaluation Allowed,Payment Mode,Is Multi Currency Allowed For BOQ,Is Multi Currency Allowed For Fee,Allow Two Stage Bidding,Cover No,Cover,Document Type,Description,Publish Date,Bid Opening Date,Document Download / Sale Start Date,Document Download / Sale End Date,Clarification Start Date,Clarification End Date,Bid Submission Start Date,Bid Submission End Date,Financial Bid Opening Date,EMD Amount in ₹,EMD Exemption Allowed,EMD Fee Type,EMD Percentage,EMD Payable To,EMD Payable At,S.No,Bank Name,Tender Fee in ₹,Fee Payable To,Fee Payable At,Tender Fee Exemption Allowed,Name,Address,Title,Work Description,Pre Qualification Details,Independent External Monitor/Remarks,Tender Value in ₹,Product Category,Sub category,Contract Type,Bid Validity(Days),Period Of Work(Days),Location,Pincode,Pre Bid Meeting Place,Pre Bid Meeting Address,Pre Bid Meeting Date,Bid Opening Place,Should Allow NDA Tender,Allow Preferential Bidder,Organisation Chain,Tender Reference Number,Tender ID,Withdrawal Allowed,Tender Type,Form of contract,Tender Category,No. of Covers,General Technical Evaluation Allowed,ItemWise Technical Evaluation Allowed,Payment Mode,Is Multi Currency Allowed For BOQ,Is Multi Currency Allowed For Fee,Allow Two Stage Bidding,Cover No,Cover,Document Type,Description,Publish Date,Bid Opening Date,Document Download / Sale Start Date,Document Download / Sale End Date,Clarification Start Date,Clarification End Date,Bid Submission Start Date,Bid Submission End Date,Financial Bid Opening Date,EMD Amount in ₹,EMD Exemption Allowed,EMD Fee Type,EMD Percentage,EMD Payable To,EMD Payable At,S.No,Bank Name,Tender Fee in ₹,Fee Payable To,Fee Payable At,Tender Fee Exemption Allowed,Name,Address,Title,Work Description,Pre Qualification Details,Independent External Monitor/Remarks,Tender Value in ₹,Product Category,Sub category,Contract Type,Bid Validity(Days),Period Of Work(Days),Location,Pincode,Pre Bid Meeting Place,Pre Bid Meeting Address,Pre Bid Meeting Date,Bid Opening Place,Should Allow NDA Tender,Allow Preferential Bidder,Contract Date :,Contract Value :,Work Completion Period in days :,Updated By :,Updated on :,AOC document :,AOC Description :,S.No.1,Bid Number,Bidder Name,Awarded Currency,Awarded Value,S.No.2,Bid Number.1,Bidder Name.1,Submitted Date,Status,Remarks,Status Updated On,Type :,Summary :,Updated By :.1,Updated On :,Document :,BOQ Comparative Chart :,Committee Chairperson/Co-ordinator Name :,Committee Chairperson/Co-ordinator Type :,Committee Members :,Updated By :.2,Updated on :.1,Document :.1,S.No.3,Bid Number.2,Bidder Name.2,Value,Rank,Type :.1,Summary :.1,Updated By :.3,Updated On :.1,Document :.2,Committee Chairperson/Co-ordinator Name :.1,Committee Chairperson/Co-ordinator Type :.1,Committee Members :.1,Updated By :.4,Updated On :.2,Financial Bid Opening Date:,Document :.3,Tender ID :,Tender Ref No :,Tender Title :
Bodoland Territorial Council||Panchayat and Rural Development-BTC,DPRD/BTC/SOPD/Udl-02/2024/09,2024_BoTC_39056_1,Yes,Open Tender,Item Rate,Works,2.0,No,No,Online,No,No,No,1.0,Fee/PreQual/Technical,.pdf,SBD,18-Sep-2024 10:30 AM,14-Oct-2024 02:30 PM,18-Sep-2024 10:30 AM,09-Oct-2024 02:30 PM,18-Sep-2024 10:30 AM ,09-Oct-2024 02:00 PM ,18-Sep-2024 10:30 AM,09-Oct-2024 02:30 PM,29-Oct-2024 09:00 AM,"39,646",Yes,fixed,,Nil,Nil,1.0,SBI Bank,400.0,Nil,Nil,Yes,Director PNRD BTC Kokrajhar,Director PNRD BTC Kokrajhar,Const of road with EF and SG from Khwolapur main road to Alabari VCDC Office under SOPD for the year 2024-25.,DPRD/BTC/SOPD/Udl-02/2024/09,Refer to Bid Document ,NA ,"19,82,300",Civil Works,NA ,Tender,180.0,90.0,Udalguri,784509.0,NA ,NA ,NA ,Director PNRD BTC Kokrajhar,No ,No,Bodoland Territorial Council||Panchayat and Rural Development-BTC,DPRD/BTC/SOPD/Udl-02/2024/09,2024_BoTC_39056_1,Yes,Open Tender,Item Rate,Works,2.0,No,No,Online,No,No,No,1.0,Fee/PreQual/Technical,.pdf,SBD,18-Sep-2024 10:30 AM,14-Oct-2024 02:30 PM,18-Sep-2024 10:30 AM,09-Oct-2024 02:30 PM,18-Sep-2024 10:30 AM ,09-Oct-2024 02:00 PM ,18-Sep-2024 10:30 AM,09-Oct-2024 02:30 PM,29-Oct-2024 09:00 AM,"39,646",Yes,fixed,,Nil,Nil,1.0,SBI Bank,400.0,Nil,Nil,Yes,Director PNRD BTC Kokrajhar,Director PNRD BTC Kokrajhar,Const of road with EF and SG from Khwolapur main road to Alabari VCDC Office under SOPD for the year 2024-25.,DPRD/BTC/SOPD/Udl-02/2024/09,Refer to Bid Document ,NA ,"19,82,300",Civil Works,NA ,Tender,180.0,90.0,Udalguri,784509.0,NA ,NA ,NA ,Director PNRD BTC Kokrajhar,No ,No,04-Nov-2024,"INR 1,982,300",150.0,Bhaskar Jyoti Rajbongshi,25-Nov-2024 12:24 AM,Work_order.pdf (1262.00 KB),Const of road with EF and SG from Khwolapur main road to Alabari VCDC Office under SOPD for the year 2024-25.,1.0,240702.0,Sri Birgrang Basumatary,INR,"1,982,300.03",1.0,240773.0,Raju Brahma,09-Oct-2024 12:39 PM,Rejected-AOC,Higher Rate Quoted among the others,25-Nov-2024 12:24 AM,Finance,"The Financial Documents submitted by the Bidders SRI BIRGRANG BASUMATARY, SRI RAJU BRAHMA are verified and found in order against the Tender ID 2024_BoTC_39056_1",Bhaskar Jyoti Rajbongshi,29-Oct-2024 09:48 AM,finance_63284.pdf,BOQ Comparative Chart,Sri Bhaskar Jyoti Rajbongshi,Internal,"Director P and RD BTC Kokrajhar Sr. FA BTC, Kokrajhar, Superintendent,P and RD, BTC, Kokrajhar, Accredited Engineer, P and RD, BTC, Kokrajhar",Bhaskar Jyoti Rajbongshi,29-Oct-2024 10:42 AM,finsummary_63284.pdf (212.70 KB),1.0,240702.0,Sri Birgrang Basumatary,"19,82,300.03",L1,Technical,"The Technical Documents submitted by the Bidders SRI BIRGRANG BASUMATARY, SRI RAJU BRAHMA are verified and found in order against the Tender ID 2024_BoTC_39056_1.",Bhaskar Jyoti Rajbongshi,25-Oct-2024 10:54 AM,technical_63284.pdf,Sri Bhaskar Jyoti Rajbongshi,Internal,"Director P and RD BTC Kokrajhar Sr. FA BTC, Kokrajhar, Superintendent,P and RD, BTC, Kokrajhar, Accredited Engineer, P and RD, BTC, Kokrajhar",Bhaskar Jyoti Rajbongshi,28-Oct-2024 11:13 PM,29-Oct-2024 09:00 AM,techsummary_63284.pdf (156.60 KB),,,
,,,,,,,,,,,,,,,,.pdf,Technical Qualifications,,,,,,,,,,,,,,,,,,,,,,,,,,,,,,,,,,,,,,,,,,,,,,,,,,,,,,,,,,.pdf,Technical Qualifications,,,,,,,,,,,,,,,,,,,,,,,,,,,,,,,,,,,,,,,,,,,,,,,,,,,,,,2.0,240702.0,Sri Birgrang Basumatary,09-Oct-2024 01:02 PM,Accepted-AOC,Lowest Rate Quoted among the others,25-Nov-2024 12:24 AM,,,,,,,,,,,,,2.0,240773.0,Raju Brahma,"19,91,939.47",L2,,,,,,,,,,,,,,,
,,,,,,,,,,,,,,2.0,Finance,.xls,BOQ,,,,,,,,,,,,,,,,,,,,,,,,,,,,,,,,,,,,,,,,,,,,,,,,,,,,,,,,2.0,Finance,.xls,BOQ,,,,,,,,,,,,,,,,,,,,,,,,,,,,,,,,,,,,,,,,,,,,,,,,,,,,,,,,,,,,,,,,,,,,,,,,,,,,,,,,,,,,,,,,,,,,
,,,,,,,,,,,,,,,,.pdf,FOB,,,,,,,,,,,,,,,,,,,,,,,,,,,,,,,,,,,,,,,,,,,,,,,,,,,,,,,,,,.pdf,FOB,,,,,,,,,,,,,,,,,,,,,,,,,,,,,,,,,,,,,,,,,,,,,,,,,,,,,,,,,,,,,,,,,,,,,,,,,,,,,,,,,,,,,,,,,,,,
,,,,,,,,,,,,,,,,,,,,,,,,,,,,,,,,,,,,,,,,,,,,,,,,,,,,,,,,,,,,,,,,,,,,,,,,,,,,,,,,,,,,,,,,,,,,,,,,,,,,,,,,,,,,,,,,,,,,,,,,,,,,,,,,,,,,,,,,,,,,,,,,,,,,,,,,,,,,,,,,,,,,,,2024_BoTC_39056_1,DPRD/BTC/SOPD/Udl-02/2024/09,Const of road with EF and SG from Khwolapur main road to Alabari VCDC Office under SOPD for the year 2024-25.
