Organisation Chain,Tender Reference Number,Tender ID,Withdrawal Allowed,Tender Type,Form of contract,Tender Category,No. of Covers,General Technical Evaluation Allowed,ItemWise Technical Evaluation Allowed,Payment Mode,Is Multi Currency Allowed For BOQ,Is Multi Currency Allowed For Fee,Allow Two Stage Bidding,Cover No,Cover,Document Type,Description,Publish Date,Bid Opening Date,Document Download / Sale Start Date,Document Download / Sale End Date,Clarification Start Date,Clarification End Date,Bid Submission Start Date,Bid Submission End Date,Financial Bid Opening Date,EMD Amount in ₹,EMD Exemption Allowed,EMD Fee Type,EMD Percentage,EMD Payable To,EMD Payable At,S.No,Bank Name,Tender Fee in ₹,Fee Payable To,Fee Payable At,Tender Fee Exemption Allowed,Name,Address,Title,Work Description,Pre Qualification Details,Independent External Monitor/Remarks,Tender Value in ₹,Product Category,Sub category,Contract Type,Bid Validity(Days),Period Of Work(Days),Location,Pincode,Pre Bid Meeting Place,Pre Bid Meeting Address,Pre Bid Meeting Date,Bid Opening Place,Should Allow NDA Tender,Allow Preferential Bidder,Organisation Chain,Tender Reference Number,Tender ID,Withdrawal Allowed,Tender Type,Form of contract,Tender Category,No. of Covers,General Technical Evaluation Allowed,ItemWise Technical Evaluation Allowed,Payment Mode,Is Multi Currency Allowed For BOQ,Is Multi Currency Allowed For Fee,Allow Two Stage Bidding,Cover No,Cover,Document Type,Description,Publish Date,Bid Opening Date,Document Download / Sale Start Date,Document Download / Sale End Date,Clarification Start Date,Clarification End Date,Bid Submission Start Date,Bid Submission End Date,Financial Bid Opening Date,EMD Amount in ₹,EMD Exemption Allowed,EMD Fee Type,EMD Percentage,EMD Payable To,EMD Payable At,S.No,Bank Name,Tender Fee in ₹,Fee Payable To,Fee Payable At,Tender Fee Exemption Allowed,Name,Address,Title,Work Description,Pre Qualification Details,Independent External Monitor/Remarks,Tender Value in ₹,Product Category,Sub category,Contract Type,Bid Validity(Days),Period Of Work(Days),Location,Pincode,Pre Bid Meeting Place,Pre Bid Meeting Address,Pre Bid Meeting Date,Bid Opening Place,Should Allow NDA Tender,Allow Preferential Bidder,Contract Date :,Contract Value :,Work Completion Period in days :,Updated By :,Updated on :,AOC document :,AOC Description :,S.No.1,Bid Number,Bidder Name,Awarded Currency,Awarded Value,S.No.2,Bid Number.1,Bidder Name.1,Submitted Date,Status,Remarks,Status Updated On,Type :,Summary :,Updated By :.1,Updated On :,Document :,BOQ Comparative Chart :,Committee Chairperson/Co-ordinator Name :,Committee Chairperson/Co-ordinator Type :,Committee Members :,Updated By :.2,Updated on :.1,Document :.1,S.No.3,Bid Number.2,Bidder Name.2,Value,Rank,Type :.1,Summary :.1,Updated By :.3,Updated On :.1,Document :.2,Committee Chairperson/Co-ordinator Name :.1,Committee Chairperson/Co-ordinator Type :.1,Committee Members :.1,Updated By :.4,Updated On :.2,Financial Bid Opening Date:,Document :.3,Tender ID :,Tender Ref No :,Tender Title :
Public Works Roads Department,Dibrugarh/CRIF/2023-24/04,2024_PWD_38264_1,Yes,Open Tender,Item Rate,Works,2.0,No,No,Online,No,No,No,1.0,Fee/PreQual/Technical,.pdf,Technical Qualification Information,31-Jul-2024 11:00 AM,07-Aug-2024 12:00 PM,31-Jul-2024 11:30 AM,06-Aug-2024 02:00 PM,31-Jul-2024 11:30 AM ,06-Aug-2024 02:00 PM ,31-Jul-2024 11:30 AM,06-Aug-2024 02:00 PM,31-Aug-2024 02:45 PM,"1,31,22,000",Yes,fixed,,Nil,Nil,1.0,SBI Bank,"30,000",Nil,Nil,No,CE PWD(Boarder Roads and NEC Works) ASSAM,"O/o the CE, Border Roads, PWD Assam, chandmari, Guwahati-03",Dibrugarh/CRIF/2023-24/04 Widening and Strengthening of old NH 37,Dibrugarh/CRIF/2023-24/04 Widening and Strengthening of old NH 37 at Ch 598.976Km Seujpur to Ch. 618.60 Km Nadua TE and Ch. 633.60Km Panitula to Ch.636.80 Km Laipuli total length 22.824 km.,Please refer Tender documents. ,NA ,"65,60,79,000",Civil Works – Roads,NA ,Rate Contract,180.0,730.0,Dibrugarh,786001.0,"O/o the CE, Border Roads, PWD Assam, chandmari, Gu ","O/o the CE, Border Roads, PWD Assam, chandmari, Guwahati-03 ",02-Aug-2024 02:00 PM ,"O/o the CE, Border Roads, PWD Assam, chandmari, Gu",No ,No,Public Works Roads Department,Dibrugarh/CRIF/2023-24/04,2024_PWD_38264_1,Yes,Open Tender,Item Rate,Works,2.0,No,No,Online,No,No,No,1.0,Fee/PreQual/Technical,.pdf,Technical Qualification Information,31-Jul-2024 11:00 AM,07-Aug-2024 12:00 PM,31-Jul-2024 11:30 AM,06-Aug-2024 02:00 PM,31-Jul-2024 11:30 AM ,06-Aug-2024 02:00 PM ,31-Jul-2024 11:30 AM,06-Aug-2024 02:00 PM,31-Aug-2024 02:45 PM,"1,31,22,000",Yes,fixed,,Nil,Nil,1.0,SBI Bank,"30,000",Nil,Nil,No,CE PWD(Boarder Roads and NEC Works) ASSAM,"O/o the CE, Border Roads, PWD Assam, chandmari, Guwahati-03",Dibrugarh/CRIF/2023-24/04 Widening and Strengthening of old NH 37,Dibrugarh/CRIF/2023-24/04 Widening and Strengthening of old NH 37 at Ch 598.976Km Seujpur to Ch. 618.60 Km Nadua TE and Ch. 633.60Km Panitula to Ch.636.80 Km Laipuli total length 22.824 km.,Please refer Tender documents. ,NA ,"65,60,79,000",Civil Works – Roads,NA ,Rate Contract,180.0,730.0,Dibrugarh,786001.0,"O/o the CE, Border Roads, PWD Assam, chandmari, Gu ","O/o the CE, Border Roads, PWD Assam, chandmari, Guwahati-03 ",02-Aug-2024 02:00 PM ,"O/o the CE, Border Roads, PWD Assam, chandmari, Gu",No ,No,16-Nov-2024,"INR 590,471,100",730.0,Jnyandeep choudhury,16-Nov-2024 05:17 PM,Order_04.pdf (361.00 KB),Awarded cost of Contract,1.0,235903.0,SHREE GAUTAM CONSTRUCTION CO. LTD.,INR,"590,471,100",1.0,236015.0,Allied Infrastructures And Projects Private Limited,05-Aug-2024 01:52 PM,Rejected-Finance,Rejected by BEC,16-Nov-2024 05:14 PM,Finance,Recommended by bid evaluation committee,Jnyandeep choudhury,16-Nov-2024 05:00 PM,None,BOQ Comparative Chart,Chandan_Sarma_Spl_Comm_and_Spl_Secy_Gov_of_Assam_PWRD,Internal,AE_IBRC_Branch_AEE_IBRC__Branch_AEE_IBRC__Branch_EE_IBRC_Branch_SE_IBRC_branch_ Deputy_Secretary_Govt_of_Assam _Works_Chief_Engineer_PWD_ Border_Roads_and_NEC_Works _Department_Assam,Jnyandeep choudhury,16-Nov-2024 05:13 PM,finsummary_62038.pdf (869.25 KB),1.0,235903.0,SHREE GAUTAM CONSTRUCTION CO. LTD.,"59,04,71,100.00",L1,Technical,Technical Bid evaluation report uploaded,Jnyandeep choudhury,31-Aug-2024 02:42 PM,technical_62038.pdf,Chandan_Sarma_Spl_Comm_and_Spl_Secy_Gov_of_Assam_PWRD,Internal,AE_IBRC_Branch_AEE_IBRC__Branch_AEE_IBRC__Branch_EE_IBRC_Branch_SE_IBRC_branch_ Deputy_Secretary_Govt_of_Assam _Works_Chief_Engineer_PWD_ Border_Roads_and_NEC_Works _Department_Assam,Jnyandeep choudhury,31-Aug-2024 02:44 PM,31-Aug-2024 02:45 PM,techsummary_62038.pdf (678.20 KB),,,
,,,,,,,,,,,,,,,,.pdf,Standard Bidding Document,,,,,,,,,,,,,,,,,,,,,,,,,,,,,,,,,,,,,,,,,,,,,,,,,,,,,,,,,,.pdf,Standard Bidding Document,,,,,,,,,,,,,,,,,,,,,,,,,,,,,,,,,,,,,,,,,,,,,,,,,,,,,,2.0,236175.0,Ganpati Bharat Private Limited,06-Aug-2024 08:18 AM,Rejected-Finance,Rejected by BEC,16-Nov-2024 05:14 PM,,,,,,,,,,,,,2.0,236015.0,Allied Infrastructures And Projects Private Limited,"59,04,71,100.00",L1,,,,,,,,,,,,,,,
,,,,,,,,,,,,,,2.0,Finance,.xls,Bill of Quantities,,,,,,,,,,,,,,,,,,,,,,,,,,,,,,,,,,,,,,,,,,,,,,,,,,,,,,,,2.0,Finance,.xls,Bill of Quantities,,,,,,,,,,,,,,,,,,,,,,,,,,,,,,,,,,,,,,,,,,,,,,,,,,,,,,3.0,236173.0,KAUSHAL SHARMA,05-Aug-2024 09:13 PM,Rejected-Finance,Rejected by BEC,16-Nov-2024 05:14 PM,,,,,,,,,,,,,3.0,236127.0,SKS-SG (JV),"59,04,71,100.00",L1,,,,,,,,,,,,,,,
,,,,,,,,,,,,,,,,.pdf,FOB,,,,,,,,,,,,,,,,,,,,,,,,,,,,,,,,,,,,,,,,,,,,,,,,,,,,,,,,,,.pdf,FOB,,,,,,,,,,,,,,,,,,,,,,,,,,,,,,,,,,,,,,,,,,,,,,,,,,,,,,4.0,236192.0,MS MANAB JYOTI GOGOI AND CO.,06-Aug-2024 11:28 AM,Rejected-Finance,Rejected by BEC,16-Nov-2024 05:14 PM,,,,,,,,,,,,,4.0,236173.0,KAUSHAL SHARMA,"59,04,71,100.00",L1,,,,,,,,,,,,,,,
,,,,,,,,,,,,,,,,,,,,,,,,,,,,,,,,,,,,,,,,,,,,,,,,,,,,,,,,,,,,,,,,,,,,,,,,,,,,,,,,,,,,,,,,,,,,,,,,,,,,,,,,,,,,,,,,,,,,,,,,,,,,,,,,,,5.0,235903.0,SHREE GAUTAM CONSTRUCTION CO. LTD.,06-Aug-2024 12:57 PM,Accepted-AOC,Accepted by BEC,16-Nov-2024 05:19 PM,,,,,,,,,,,,,5.0,236175.0,Ganpati Bharat Private Limited,"56,35,06,419.64",L2,,,,,,,,,,,,,,,
,,,,,,,,,,,,,,,,,,,,,,,,,,,,,,,,,,,,,,,,,,,,,,,,,,,,,,,,,,,,,,,,,,,,,,,,,,,,,,,,,,,,,,,,,,,,,,,,,,,,,,,,,,,,,,,,,,,,,,,,,,,,,,,,,,6.0,236127.0,SKS-SG (JV),06-Aug-2024 11:12 AM,Rejected-Finance,Rejected by BEC,16-Nov-2024 05:14 PM,,,,,,,,,,,,,6.0,236192.0,MS MANAB JYOTI GOGOI AND CO.,"59,04,71,100.00",L1,,,,,,,,,,,,,,,
,,,,,,,,,,,,,,,,,,,,,,,,,,,,,,,,,,,,,,,,,,,,,,,,,,,,,,,,,,,,,,,,,,,,,,,,,,,,,,,,,,,,,,,,,,,,,,,,,,,,,,,,,,,,,,,,,,,,,,,,,,,,,,,,,,,,,,,,,,,,,,,,,,,,,,,,,,,,,,,,,,,,,,2024_PWD_38264_1,Dibrugarh/CRIF/2023-24/04,Dibrugarh/CRIF/2023-24/04 Widening and Strengthening of old NH 37
