Organisation Chain,Tender Reference Number,Tender ID,Withdrawal Allowed,Tender Type,Form of contract,Tender Category,No. of Covers,General Technical Evaluation Allowed,ItemWise Technical Evaluation Allowed,Payment Mode,Is Multi Currency Allowed For BOQ,Is Multi Currency Allowed For Fee,Allow Two Stage Bidding,Cover No,Cover,Document Type,Description,Publish Date,Bid Opening Date,Document Download / Sale Start Date,Document Download / Sale End Date,Clarification Start Date,Clarification End Date,Bid Submission Start Date,Bid Submission End Date,EMD Amount in ₹,EMD Exemption Allowed,EMD Fee Type,EMD Percentage,EMD Payable To,EMD Payable At,S.No,Corrigendum Title,Corrigendum Type,View,S.No.1,Bank Name,Tender Fee in ₹,Fee Payable To,Fee Payable At,Tender Fee Exemption Allowed,Name,Address,Title,Work Description,Pre Qualification Details,Independent External Monitor/Remarks,Tender Value in ₹,Product Category,Sub category,Contract Type,Bid Validity(Days),Period Of Work(Days),Location,Pincode,Pre Bid Meeting Place,Pre Bid Meeting Address,Pre Bid Meeting Date,Bid Opening Place,Should Allow NDA Tender,Allow Preferential Bidder,Organisation Chain,Tender Reference Number,Tender ID,Withdrawal Allowed,Tender Type,Form of contract,Tender Category,No. of Covers,General Technical Evaluation Allowed,ItemWise Technical Evaluation Allowed,Payment Mode,Is Multi Currency Allowed For BOQ,Is Multi Currency Allowed For Fee,Allow Two Stage Bidding,Cover No,Cover,Document Type,Description,Publish Date,Bid Opening Date,Document Download / Sale Start Date,Document Download / Sale End Date,Clarification Start Date,Clarification End Date,Bid Submission Start Date,Bid Submission End Date,EMD Amount in ₹,EMD Exemption Allowed,EMD Fee Type,EMD Percentage,EMD Payable To,EMD Payable At,S.No,Corrigendum Title,Corrigendum Type,View,S.No.1,Bank Name,Tender Fee in ₹,Fee Payable To,Fee Payable At,Tender Fee Exemption Allowed,Name,Address,Title,Work Description,Pre Qualification Details,Independent External Monitor/Remarks,Tender Value in ₹,Product Category,Sub category,Contract Type,Bid Validity(Days),Period Of Work(Days),Location,Pincode,Pre Bid Meeting Place,Pre Bid Meeting Address,Pre Bid Meeting Date,Bid Opening Place,Should Allow NDA Tender,Allow Preferential Bidder,Contract Date :,Contract Value :,Work Completion Period in days :,Updated By :,Updated on :,AOC document :,AOC Description :,S.No.2,Bid Number,Bidder Name,Awarded Currency,Awarded Value,S.No.3,Bid Number.1,Bidder Name.1,Submitted Date,Status,Remarks,Status Updated On,Type :,Summary :,Updated By :.1,Updated On :,Document :,BOQ Comparative Chart :,Committee Chairperson/Co-ordinator Name :,Committee Chairperson/Co-ordinator Type :,Committee Members :,Updated By :.2,Updated on :.1,Document :.1,S.No.4,Bid Number.2,Bidder Name.2,Value,Rank,Committee Chairperson/Co-ordinator Name :.1,Committee Chairperson/Co-ordinator Type :.1,Committee Members :.1,Updated By :.3,Updated On :.1,Document :.2,Tender ID :,Tender Ref No :,Tender Title :
Industries and Commerce Department||Assam Petro-Chemicals Ltd.||Head office Namrup||Materials Management Department,APL/CnP/500TPD/Mech/24-25/335,2024_ICD_38402_1,Yes,Limited,Item Rate,Works,1.0,No,No,Online,No,No,No,1.0,Fee/PreQual/Technical/Finance,.pdf,Unpriced Bid,09-Aug-2024 03:00 PM,24-Aug-2024 11:00 AM,09-Aug-2024 03:00 PM,23-Aug-2024 03:00 PM,NA ,NA ,09-Aug-2024 03:00 PM,23-Aug-2024 03:00 PM,"43,470",Yes,fixed,,Nil,Nil,1.0,corrigendum,Date,,1.0,SBI Bank,450.0,Nil,Nil,Yes,DGM Contract and Purchase,"Assam pETROCHEMICALS limited , nAMRUP , DIBRUGARH ASSAM 786623",Troubleshooting Activities of Syngas Compresor,Troubleshooting Activities of Syngas Compresor and fulfillment of shutdown activities with manpower and tools for Syngas compressor at 500 TPD Methanol Plant of APL,As per Tender Documents  ,NA ,,Metals,NA ,Tender,180.0,30.0,APL Namrup,786623.0,NA ,NA ,NA ,APL Namrup,No ,No,Industries and Commerce Department||Assam Petro-Chemicals Ltd.||Head office Namrup||Materials Management Department,APL/CnP/500TPD/Mech/24-25/335,2024_ICD_38402_1,Yes,Limited,Item Rate,Works,1.0,No,No,Online,No,No,No,1.0,Fee/PreQual/Technical/Finance,.pdf,Unpriced Bid,09-Aug-2024 03:00 PM,24-Aug-2024 11:00 AM,09-Aug-2024 03:00 PM,23-Aug-2024 03:00 PM,NA ,NA ,09-Aug-2024 03:00 PM,23-Aug-2024 03:00 PM,"43,470",Yes,fixed,,Nil,Nil,1.0,corrigendum,Date,,1.0,SBI Bank,450.0,Nil,Nil,Yes,DGM Contract and Purchase,"Assam pETROCHEMICALS limited , nAMRUP , DIBRUGARH ASSAM 786623",Troubleshooting Activities of Syngas Compresor,Troubleshooting Activities of Syngas Compresor and fulfillment of shutdown activities with manpower and tools for Syngas compressor at 500 TPD Methanol Plant of APL,As per Tender Documents  ,NA ,,Metals,NA ,Tender,180.0,30.0,APL Namrup,786623.0,NA ,NA ,NA ,APL Namrup,No ,No,14-Nov-2024,"INR 1,608,750",30.0,Pranab Barman,14-Nov-2024 04:27 PM,WO_344.pdf (3052.00 KB),WO No -APL/C&P/500TPD/Mech/24-25/335/344 dated 16.09.2024 for an amount of Rs 1608750.00 plus GST extra at the rate 18 percent was issued to M/s Dharani Turbo Engg Spares and Services Pvt Ltd,1.0,236525.0,DHARANI TURBO ENGG SPARES AND SERVICES PVT LTD,INR,"1,608,750",1.0,236525.0,DHARANI TURBO ENGG SPARES AND SERVICES PVT LTD,12-Aug-2024 01:19 PM,Accepted-AOC,L1 Bidder,14-Nov-2024 04:27 PM,Finance,Prima facie the bids from all the bidders have been admitted for evaluation .,Pranab Barman,24-Aug-2024 11:29 AM,None,BOQ Comparative Chart,S.Chetia,Internal,"N.B.Borah , N.J.Phukan, P.S.Paul, J.Borgohain, P.Barman",Pranab Barman,14-Nov-2024 04:19 PM,finsummary_62236.pdf (7061.89 KB),1.0,236511.0,GAS / steam turbine/ compressor service providers,"21,00,580.00",L2,S.Chetia,Internal,"N.B.Borah, N.J.Phukan, P.S.Paul, J.Borgohain, P.Barman",Pranab Barman,14-Nov-2024 04:13 PM,techsummary_62236.pdf (7061.89 KB),,,
,,,,,,,,,,,,,,,,.pdf,EMD and Integrity Pact,,,,,,,,,,,,,,,,,,,,,,,,,,,,,,,,,,,,,,,,,,,,,,,,,,,,,,,,,,,,,.pdf,EMD and Integrity Pact,,,,,,,,,,,,,,,,,,,,,,,,,,,,,,,,,,,,,,,,,,,,,,,,,,,,,,,,,2.0,236511.0,GAS / steam turbine/ compressor service providers,14-Aug-2024 03:01 PM,Rejected-Finance,L2 Bidder,14-Nov-2024 04:19 PM,,,,,,,,,,,,,2.0,236525.0,DHARANI TURBO ENGG SPARES AND SERVICES PVT LTD,"16,50,000.00",L1,,,,,,,,,
,,,,,,,,,,,,,,,,.xls,Price Bid,,,,,,,,,,,,,,,,,,,,,,,,,,,,,,,,,,,,,,,,,,,,,,,,,,,,,,,,,,,,,.xls,Price Bid,,,,,,,,,,,,,,,,,,,,,,,,,,,,,,,,,,,,,,,,,,,,,,,,,,,,,,,,,3.0,236761.0,Quality Profiles Private Limited,17-Aug-2024 07:34 PM,Rejected-Finance,L1 Bidder,14-Nov-2024 04:19 PM,,,,,,,,,,,,,3.0,236761.0,Quality Profiles Private Limited,"26,49,600.00",L4,,,,,,,,,
,,,,,,,,,,,,,,,,,,,,,,,,,,,,,,,,,,,,,,,,,,,,,,,,,,,,,,,,,,,,,,,,,,,,,,,,,,,,,,,,,,,,,,,,,,,,,,,,,,,,,,,,,,,,,,,,,,,,,,,,,,,,,,,,,,,,,,,,4.0,237400.0,SWAMINA INTERNATIONAL PRIVATE LIMITED,21-Aug-2024 06:37 PM,Rejected-Finance,L3 Bidder,14-Nov-2024 04:19 PM,,,,,,,,,,,,,4.0,237400.0,SWAMINA INTERNATIONAL PRIVATE LIMITED,"22,50,000.00",L3,,,,,,,,,
,,,,,,,,,,,,,,,,,,,,,,,,,,,,,,,,,,,,,,,,,,,,,,,,,,,,,,,,,,,,,,,,,,,,,,,,,,,,,,,,,,,,,,,,,,,,,,,,,,,,,,,,,,,,,,,,,,,,,,,,,,,,,,,,,,,,,,,,,,,,,,,,,,,,,,,,,,,,,,,,,,,,,,2024_ICD_38402_1,APL/CnP/500TPD/Mech/24-25/335,Troubleshooting Activities of Syngas Compresor
