Organisation Chain,Tender Reference Number,Tender ID,Withdrawal Allowed,Tender Type,Form of contract,Tender Category,No. of Covers,General Technical Evaluation Allowed,ItemWise Technical Evaluation Allowed,Payment Mode,Is Multi Currency Allowed For BOQ,Is Multi Currency Allowed For Fee,Allow Two Stage Bidding,Cover No,Cover,Document Type,Description,Publish Date,Bid Opening Date,Document Download / Sale Start Date,Document Download / Sale End Date,Clarification Start Date,Clarification End Date,Bid Submission Start Date,Bid Submission End Date,Financial Bid Opening Date,EMD Amount in ₹,EMD Exemption Allowed,EMD Fee Type,EMD Percentage,EMD Payable To,EMD Payable At,S.No,Bank Name,Tender Fee in ₹,Fee Payable To,Fee Payable At,Tender Fee Exemption Allowed,Name,Address,Title,Work Description,Pre Qualification Details,Independent External Monitor/Remarks,Tender Value in ₹,Product Category,Sub category,Contract Type,Bid Validity(Days),Period Of Work(Days),Location,Pincode,Pre Bid Meeting Place,Pre Bid Meeting Address,Pre Bid Meeting Date,Bid Opening Place,Should Allow NDA Tender,Allow Preferential Bidder,Organisation Chain,Tender Reference Number,Tender ID,Withdrawal Allowed,Tender Type,Form of contract,Tender Category,No. of Covers,General Technical Evaluation Allowed,ItemWise Technical Evaluation Allowed,Payment Mode,Is Multi Currency Allowed For BOQ,Is Multi Currency Allowed For Fee,Allow Two Stage Bidding,Cover No,Cover,Document Type,Description,Publish Date,Bid Opening Date,Document Download / Sale Start Date,Document Download / Sale End Date,Clarification Start Date,Clarification End Date,Bid Submission Start Date,Bid Submission End Date,Financial Bid Opening Date,EMD Amount in ₹,EMD Exemption Allowed,EMD Fee Type,EMD Percentage,EMD Payable To,EMD Payable At,S.No,Bank Name,Tender Fee in ₹,Fee Payable To,Fee Payable At,Tender Fee Exemption Allowed,Name,Address,Title,Work Description,Pre Qualification Details,Independent External Monitor/Remarks,Tender Value in ₹,Product Category,Sub category,Contract Type,Bid Validity(Days),Period Of Work(Days),Location,Pincode,Pre Bid Meeting Place,Pre Bid Meeting Address,Pre Bid Meeting Date,Bid Opening Place,Should Allow NDA Tender,Allow Preferential Bidder,Contract Date :,Contract Value :,Work Completion Period in days :,Updated By :,Updated on :,AOC document :,S.No.1,Bid Number,Bidder Name,Awarded Currency,Awarded Value,S.No.2,Bid Number.1,Bidder Name.1,Submitted Date,Status,Remarks,Status Updated On,Type :,Summary :,Updated By :.1,Updated On :,Document :,BOQ Comparative Chart :,Committee Chairperson/Co-ordinator Name :,Committee Chairperson/Co-ordinator Type :,Committee Members :,Updated By :.2,Updated on :.1,Document :.1,S.No.3,Bid Number.2,Bidder Name.2,Value,Rank,Type :.1,Summary :.1,Updated By :.3,Updated On :.1,Document :.2,Committee Chairperson/Co-ordinator Name :.1,Committee Chairperson/Co-ordinator Type :.1,Committee Members :.1,Updated By :.4,Updated On :.2,Financial Bid Opening Date:,Document :.3,Tender ID :,Tender Ref No :,Tender Title :
Soil Conservation Department||Director - SCD,Tender/NIT/Pt/2023-24/870,2024_SCD_37893_6,Yes,Open Tender,Item Rate,Works,2.0,No,No,Online,No,No,No,1.0,Fee/PreQual/Technical,.pdf,Bid Document downloaded from the portal,08-Jul-2024 11:00 AM,30-Jul-2024 12:00 PM,08-Jul-2024 01:00 PM,29-Jul-2024 12:30 PM,NA ,NA ,15-Jul-2024 10:00 AM,29-Jul-2024 12:30 PM,03-Sep-2024 04:55 PM,"60,000",Yes,percentage,2.0%,Nil,Nil,1.0,SBI Bank,600.0,Nil,Nil,No,Director of Soil Conservation,"Bhumi Sangrakshan Bhavan, RG Baruah Road, Ghy - 05",2 No. Baijayantipur Gully Control Project under RIDF XXIX,2 No. Baijayantipur Gully Control Project under RIDF XXIX,Please Refer Technical Documents ,NA ,"30,00,000",Civil Works,NA ,Tender,180.0,120.0,Dhemaji-Jonai,787060.0,NA ,NA ,NA ,"O/o The DSC, Assam",No ,No,Soil Conservation Department||Director - SCD,Tender/NIT/Pt/2023-24/870,2024_SCD_37893_6,Yes,Open Tender,Item Rate,Works,2.0,No,No,Online,No,No,No,1.0,Fee/PreQual/Technical,.pdf,Bid Document downloaded from the portal,08-Jul-2024 11:00 AM,30-Jul-2024 12:00 PM,08-Jul-2024 01:00 PM,29-Jul-2024 12:30 PM,NA ,NA ,15-Jul-2024 10:00 AM,29-Jul-2024 12:30 PM,03-Sep-2024 04:55 PM,"60,000",Yes,percentage,2.0%,Nil,Nil,1.0,SBI Bank,600.0,Nil,Nil,No,Director of Soil Conservation,"Bhumi Sangrakshan Bhavan, RG Baruah Road, Ghy - 05",2 No. Baijayantipur Gully Control Project under RIDF XXIX,2 No. Baijayantipur Gully Control Project under RIDF XXIX,Please Refer Technical Documents ,NA ,"30,00,000",Civil Works,NA ,Tender,180.0,120.0,Dhemaji-Jonai,787060.0,NA ,NA ,NA ,"O/o The DSC, Assam",No ,No,26-Nov-2024,"INR 2,850,000",120.0,Chandan Ranjan Das,26-Nov-2024 04:16 PM,2NoBaijayantipur_AOC.pdf (184.00 KB),1.0,235574.0,SYED FAZLUR RAHMAN,INR,"2,850,000",1.0,235740.0,Khagen Konch,29-Jul-2024 12:08 PM,Rejected-Technical,Not Admitted. Refer Technical minutes,03-Sep-2024 04:37 PM,Finance,Financial Bid has been opened.,Chandan Ranjan Das,03-Sep-2024 05:08 PM,None,BOQ Comparative Chart,Director of Soil Conservation Department,Internal,,Chandan Ranjan Das,26-Nov-2024 03:54 PM,finsummary_61580.pdf (1564.65 KB),1.0,235348.0,SRI JAYANTA SAIKIA,"28,50,000.00",L1,Technical,Technical Bid has been opened,Chandan Ranjan Das,30-Jul-2024 01:22 PM,None,Director of Soil Conservation Department,Internal,,Jyoti Medhi,03-Sep-2024 04:37 PM,03-Sep-2024 04:55 PM,techsummary_61580.pdf (1436.02 KB),,,
,,,,,,,,,,,,,,,,.pdf,Technical Documents,,,,,,,,,,,,,,,,,,,,,,,,,,,,,,,,,,,,,,,,,,,,,,,,,,,,,,,,,,.pdf,Technical Documents,,,,,,,,,,,,,,,,,,,,,,,,,,,,,,,,,,,,,,,,,,,,,,,,,,,,,2.0,235737.0,Raju Khanikar,29-Jul-2024 12:27 PM,Rejected-Technical,Not Admitted. Refer Technical minutes,03-Sep-2024 04:37 PM,,,,,,,,,,,,,2.0,235574.0,SYED FAZLUR RAHMAN,"28,50,000.00",L1,,,,,,,,,,,,,,,
,,,,,,,,,,,,,,2.0,Finance,.xls,BOQ,,,,,,,,,,,,,,,,,,,,,,,,,,,,,,,,,,,,,,,,,,,,,,,,,,,,,,,,2.0,Finance,.xls,BOQ,,,,,,,,,,,,,,,,,,,,,,,,,,,,,,,,,,,,,,,,,,,,,,,,,,,,,3.0,235604.0,SANJEEB BORUAH,29-Jul-2024 11:25 AM,Rejected-Finance,Rejected. Refer Financial Minutes,26-Nov-2024 03:54 PM,,,,,,,,,,,,,3.0,235604.0,SANJEEB BORUAH,"28,50,000.00",L1,,,,,,,,,,,,,,,
,,,,,,,,,,,,,,,,,,,,,,,,,,,,,,,,,,,,,,,,,,,,,,,,,,,,,,,,,,,,,,,,,,,,,,,,,,,,,,,,,,,,,,,,,,,,,,,,,,,,,,,,,,,,,,,,,,,,,,,,,,,,,,,,,4.0,235348.0,SRI JAYANTA SAIKIA,29-Jul-2024 09:22 AM,Rejected-Finance,Rejected. Refer Financial Minutes,26-Nov-2024 03:54 PM,,,,,,,,,,,,,,,,,,,,,,,,,,,,,,,,
,,,,,,,,,,,,,,,,,,,,,,,,,,,,,,,,,,,,,,,,,,,,,,,,,,,,,,,,,,,,,,,,,,,,,,,,,,,,,,,,,,,,,,,,,,,,,,,,,,,,,,,,,,,,,,,,,,,,,,,,,,,,,,,,,5.0,235574.0,SYED FAZLUR RAHMAN,26-Jul-2024 07:21 PM,Accepted-AOC,Awarded,26-Nov-2024 04:16 PM,,,,,,,,,,,,,,,,,,,,,,,,,,,,,,,,
,,,,,,,,,,,,,,,,,,,,,,,,,,,,,,,,,,,,,,,,,,,,,,,,,,,,,,,,,,,,,,,,,,,,,,,,,,,,,,,,,,,,,,,,,,,,,,,,,,,,,,,,,,,,,,,,,,,,,,,,,,,,,,,,,,,,,,,,,,,,,,,,,,,,,,,,,,,,,,,,,,,,,2024_SCD_37893_6,Tender/NIT/Pt/2023-24/870,2 No. Baijayantipur Gully Control Project under RIDF XXIX
