Organisation Chain,Tender Reference Number,Tender ID,Withdrawal Allowed,Tender Type,Form of contract,Tender Category,No. of Covers,General Technical Evaluation Allowed,ItemWise Technical Evaluation Allowed,Payment Mode,Is Multi Currency Allowed For BOQ,Is Multi Currency Allowed For Fee,Allow Two Stage Bidding,Cover No,Cover,Document Type,Description,Publish Date,Bid Opening Date,Document Download / Sale Start Date,Document Download / Sale End Date,Clarification Start Date,Clarification End Date,Bid Submission Start Date,Bid Submission End Date,Financial Bid Opening Date,EMD Amount in ₹,EMD Exemption Allowed,EMD Fee Type,EMD Percentage,EMD Payable To,EMD Payable At,S.No,Corrigendum Title,Corrigendum Type,View,S.No.1,Bank Name,Tender Fee in ₹,Fee Payable To,Fee Payable At,Tender Fee Exemption Allowed,Name,Address,Title,Work Description,Pre Qualification Details,Independent External Monitor/Remarks,Tender Value in ₹,Product Category,Sub category,Contract Type,Bid Validity(Days),Period Of Work(Days),Location,Pincode,Pre Bid Meeting Place,Pre Bid Meeting Address,Pre Bid Meeting Date,Bid Opening Place,Should Allow NDA Tender,Allow Preferential Bidder,Organisation Chain,Tender Reference Number,Tender ID,Withdrawal Allowed,Tender Type,Form of contract,Tender Category,No. of Covers,General Technical Evaluation Allowed,ItemWise Technical Evaluation Allowed,Payment Mode,Is Multi Currency Allowed For BOQ,Is Multi Currency Allowed For Fee,Allow Two Stage Bidding,Cover No,Cover,Document Type,Description,Publish Date,Bid Opening Date,Document Download / Sale Start Date,Document Download / Sale End Date,Clarification Start Date,Clarification End Date,Bid Submission Start Date,Bid Submission End Date,Financial Bid Opening Date,EMD Amount in ₹,EMD Exemption Allowed,EMD Fee Type,EMD Percentage,EMD Payable To,EMD Payable At,S.No,Corrigendum Title,Corrigendum Type,View,S.No.1,Bank Name,Tender Fee in ₹,Fee Payable To,Fee Payable At,Tender Fee Exemption Allowed,Name,Address,Title,Work Description,Pre Qualification Details,Independent External Monitor/Remarks,Tender Value in ₹,Product Category,Sub category,Contract Type,Bid Validity(Days),Period Of Work(Days),Location,Pincode,Pre Bid Meeting Place,Pre Bid Meeting Address,Pre Bid Meeting Date,Bid Opening Place,Should Allow NDA Tender,Allow Preferential Bidder,Contract Date :,Contract Value :,Work Completion Period in days :,Updated By :,Updated on :,AOC document :,S.No.2,Bid Number,Bidder Name,Awarded Currency,Awarded Value,S.No.3,Bid Number.1,Bidder Name.1,Submitted Date,Status,Remarks,Status Updated On,Type :,Summary :,Updated By :.1,Updated On :,Document :,BOQ Comparative Chart :,Committee Chairperson/Co-ordinator Name :,Committee Chairperson/Co-ordinator Type :,Committee Members :,Updated By :.2,Updated on :.1,Document :.1,S.No.4,Bid Number.2,Bidder Name.2,Value,Rank,Type :.1,Summary :.1,Updated By :.3,Updated On :.1,Document :.2,Committee Chairperson/Co-ordinator Name :.1,Committee Chairperson/Co-ordinator Type :.1,Committee Members :.1,Updated By :.4,Updated On :.2,Financial Bid Opening Date:,Document :.3,Tender ID :,Tender Ref No :,Tender Title :
Health and Family Welfare Department||Directorate of Medical Education-HFWD||Guwahati Medical College Hospital-HFWD,No. MCH/HMS/2024/330/25,2024_HFWD_38172_1,Yes,Open Tender,Item Wise,Goods,2.0,No,No,Online,No,No,No,1.0,Fee/PreQual/Technical,.pdf,Technical qualification document,24-Jul-2024 12:00 PM,14-Aug-2024 04:00 PM,24-Jul-2024 12:00 PM,14-Aug-2024 02:00 PM,NA ,NA ,06-Aug-2024 04:00 PM,14-Aug-2024 02:00 PM,16-Oct-2024 12:00 PM,"20,000",No,fixed,,Nil,Nil,1.0,Corrigendum notice,Terms and Conditions,,1.0,SBI Bank,"2,000",Nil,Nil,No,Superintendent cum Member Secretary,"GMCH, Bhangagarh, Guwahati","Supply of Instruments, Reagents, etc. related to organ transplantation in the HLA Laboratory and Multidisciplinary Research Unit (MRU) of GMCH, Guwahati","Supply of Instruments, Reagents, etc. related to organ transplantation in the HLA Laboratory and Multidisciplinary Research Unit (MRU) of GMCH, Guwahati",Please refer Tender documents. ,NA ,,Laboratory and scientific equipment,NA ,Tender,365.0,365.0,"GMCH, Bhangagarh, Guwahati",781032.0,"Office of the Superintendent, GMCH ","Office of the Superintendent, GMCH ",30-Jul-2024 12:00 PM ,"Office of the Superintendent, GMCH",No ,No,Health and Family Welfare Department||Directorate of Medical Education-HFWD||Guwahati Medical College Hospital-HFWD,No. MCH/HMS/2024/330/25,2024_HFWD_38172_1,Yes,Open Tender,Item Wise,Goods,2.0,No,No,Online,No,No,No,1.0,Fee/PreQual/Technical,.pdf,Technical qualification document,24-Jul-2024 12:00 PM,14-Aug-2024 04:00 PM,24-Jul-2024 12:00 PM,14-Aug-2024 02:00 PM,NA ,NA ,06-Aug-2024 04:00 PM,14-Aug-2024 02:00 PM,16-Oct-2024 12:00 PM,"20,000",No,fixed,,Nil,Nil,1.0,Corrigendum notice,Terms and Conditions,,1.0,SBI Bank,"2,000",Nil,Nil,No,Superintendent cum Member Secretary,"GMCH, Bhangagarh, Guwahati","Supply of Instruments, Reagents, etc. related to organ transplantation in the HLA Laboratory and Multidisciplinary Research Unit (MRU) of GMCH, Guwahati","Supply of Instruments, Reagents, etc. related to organ transplantation in the HLA Laboratory and Multidisciplinary Research Unit (MRU) of GMCH, Guwahati",Please refer Tender documents. ,NA ,,Laboratory and scientific equipment,NA ,Tender,365.0,365.0,"GMCH, Bhangagarh, Guwahati",781032.0,"Office of the Superintendent, GMCH ","Office of the Superintendent, GMCH ",30-Jul-2024 12:00 PM ,"Office of the Superintendent, GMCH",No ,No,28-Nov-2024,"INR 1,815,077.1",365.0,Kumar Partha Pratim,28-Nov-2024 04:29 PM,appls.pdf (1327.00 KB),1.0,236708.0,North East Enterprise,INR,469.68,1.0,236668.0,BIO-CARE ASSOCIATES,13-Aug-2024 05:36 PM,Accepted-AOC,L1 s per item wise,28-Nov-2024 04:29 PM,Finance,Financial Bids have been opened for evaluation,Arun Bikash Hazarika,18-Oct-2024 05:35 PM,None,BOQ Comparative Chart,Superintendent cum Member Secretary,Internal,,Lipseeta Deka,20-Nov-2024 05:21 PM,finsummary_61933.pdf (2262.16 KB),1.0,236223.0,Biogenuix Medsystems Pvt. Ltd.,"3,54,314.46",1.0,Technical,Technical bids have been opened for evaluation,Kumar Partha Pratim,17-Aug-2024 05:04 PM,None,Superintendent cum Member Secretary,Internal,,Lipseeta Deka,16-Oct-2024 11:51 AM,16-Oct-2024 12:00 PM,techsummary_61933.pdf (2580.00 KB),,,
,,,,,,,,,,,,,,,,.pdf,Bid document downloaded from the portal,,,,,,,,,,,,,,,,,,,,,,,,,,,,,,,,,,,,,,,,,,,,,,,,,,,,,,,,,,,,,,.pdf,Bid document downloaded from the portal,,,,,,,,,,,,,,,,,,,,,,,,,,,,,,,,,,,,,,,,,,,,,,,,,,,,2.0,236668.0,BIO-CARE ASSOCIATES,INR,"1,455,542",2.0,236223.0,Biogenuix Medsystems Pvt. Ltd.,06-Aug-2024 05:16 PM,Accepted-AOC,L1 s per item wise,28-Nov-2024 04:29 PM,,,,,,,,,,,,,2.0,236512.0,Jyoti Pharmaceuticals,"16,22,227.82",1.0,,,,,,,,,,,,,,,
,,,,,,,,,,,,,,2.0,Finance,.xls,Price bid,,,,,,,,,,,,,,,,,,,,,,,,,,,,,,,,,,,,,,,,,,,,,,,,,,,,,,,,,,,,2.0,Finance,.xls,Price bid,,,,,,,,,,,,,,,,,,,,,,,,,,,,,,,,,,,,,,,,,,,,,,,,,,,,3.0,236512.0,Jyoti Pharmaceuticals,INR,"4,750.96",3.0,236512.0,Jyoti Pharmaceuticals,12-Aug-2024 10:48 AM,Accepted-AOC,L1 s per item wise,28-Nov-2024 04:29 PM,,,,,,,,,,,,,3.0,236668.0,BIO-CARE ASSOCIATES,"14,58,465.00",1.0,,,,,,,,,,,,,,,
,,,,,,,,,,,,,,,,,,,,,,,,,,,,,,,,,,,,,,,,,,,,,,,,,,,,,,,,,,,,,,,,,,,,,,,,,,,,,,,,,,,,,,,,,,,,,,,,,,,,,,,,,,,,,,,,,,,,,,,,,,,,,,,,,,,,4.0,236223.0,Biogenuix Medsystems Pvt. Ltd.,INR,"354,314.46",4.0,236708.0,North East Enterprise,13-Aug-2024 07:27 PM,Accepted-AOC,L1 s per item wise,28-Nov-2024 04:29 PM,,,,,,,,,,,,,4.0,236708.0,North East Enterprise,"27,45,548.00",1.0,,,,,,,,,,,,,,,
,,,,,,,,,,,,,,,,,,,,,,,,,,,,,,,,,,,,,,,,,,,,,,,,,,,,,,,,,,,,,,,,,,,,,,,,,,,,,,,,,,,,,,,,,,,,,,,,,,,,,,,,,,,,,,,,,,,,,,,,,,,,,,,,,,,,,,,,,,,,,,,,,,,,,,,,,,,,,,,,,,,,,,,,,,,,,2024_HFWD_38172_1,No. MCH/HMS/2024/330/25,"Supply of Instruments, Reagents, etc. related to organ transplantation in the HLA Laboratory and Multidisciplinary Research Unit (MRU) of GMCH, Guwahati"
