Organisation Chain,Tender Reference Number,Tender ID,Withdrawal Allowed,Tender Type,Form of contract,Tender Category,No. of Covers,General Technical Evaluation Allowed,ItemWise Technical Evaluation Allowed,Payment Mode,Is Multi Currency Allowed For BOQ,Is Multi Currency Allowed For Fee,Allow Two Stage Bidding,Cover No,Cover,Document Type,Description,Publish Date,Bid Opening Date,Document Download / Sale Start Date,Document Download / Sale End Date,Clarification Start Date,Clarification End Date,Bid Submission Start Date,Bid Submission End Date,Financial Bid Opening Date,EMD Amount in ₹,EMD Exemption Allowed,EMD Fee Type,EMD Percentage,EMD Payable To,EMD Payable At,S.No,Bank Name,Tender Fee in ₹,Fee Payable To,Fee Payable At,Tender Fee Exemption Allowed,Name,Address,Title,Work Description,Pre Qualification Details,Independent External Monitor/Remarks,Tender Value in ₹,Product Category,Sub category,Contract Type,Bid Validity(Days),Period Of Work(Days),Location,Pincode,Pre Bid Meeting Place,Pre Bid Meeting Address,Pre Bid Meeting Date,Bid Opening Place,Should Allow NDA Tender,Allow Preferential Bidder,Organisation Chain,Tender Reference Number,Tender ID,Withdrawal Allowed,Tender Type,Form of contract,Tender Category,No. of Covers,General Technical Evaluation Allowed,ItemWise Technical Evaluation Allowed,Payment Mode,Is Multi Currency Allowed For BOQ,Is Multi Currency Allowed For Fee,Allow Two Stage Bidding,Cover No,Cover,Document Type,Description,Publish Date,Bid Opening Date,Document Download / Sale Start Date,Document Download / Sale End Date,Clarification Start Date,Clarification End Date,Bid Submission Start Date,Bid Submission End Date,Financial Bid Opening Date,EMD Amount in ₹,EMD Exemption Allowed,EMD Fee Type,EMD Percentage,EMD Payable To,EMD Payable At,S.No,Bank Name,Tender Fee in ₹,Fee Payable To,Fee Payable At,Tender Fee Exemption Allowed,Name,Address,Title,Work Description,Pre Qualification Details,Independent External Monitor/Remarks,Tender Value in ₹,Product Category,Sub category,Contract Type,Bid Validity(Days),Period Of Work(Days),Location,Pincode,Pre Bid Meeting Place,Pre Bid Meeting Address,Pre Bid Meeting Date,Bid Opening Place,Should Allow NDA Tender,Allow Preferential Bidder,Contract Date :,Contract Value :,Work Completion Period in days :,Updated By :,Updated on :,AOC document :,AOC Description :,S.No.1,Bid Number,Bidder Name,Awarded Currency,Awarded Value,S.No.2,Bid Number.1,Bidder Name.1,Submitted Date,Status,Remarks,Status Updated On,Type :,Summary :,Updated By :.1,Updated On :,Document :,BOQ Comparative Chart :,Committee Chairperson/Co-ordinator Name :,Committee Chairperson/Co-ordinator Type :,Committee Members :,Updated By :.2,Updated on :.1,Document :.1,S.No.3,Bid Number.2,Bidder Name.2,Value,Rank,Type :.1,Summary :.1,Updated By :.3,Updated On :.1,Document :.2,Committee Chairperson/Co-ordinator Name :.1,Committee Chairperson/Co-ordinator Type :.1,Committee Members :.1,Updated By :.4,Updated On :.2,Financial Bid Opening Date:,Document :.3,Tender ID :,Tender Ref No :,Tender Title :
Public Works Building and NH Department||Chief Engineer-Building - PWBNH||SE-Guwahati Circle-2 - PWBNH,SE/BII_Sankardev Vidya Niketan_Ph-II_Hengerabari,2024_PWBNH_39043_1,Yes,Open Tender,Item Wise,Works,2.0,No,No,Online,No,No,No,1.0,Fee/PreQual/Technical,.pdf,Bidding Document,17-Sep-2024 12:00 PM,08-Oct-2024 04:30 PM,17-Sep-2024 12:00 PM,08-Oct-2024 02:00 PM,NA ,NA ,19-Sep-2024 02:30 PM,08-Oct-2024 02:00 PM,13-Nov-2024 11:00 AM,"2,91,263",Yes,percentage,2.0%,Nil,Nil,1.0,SBI Bank,"3,000",Nil,Nil,No,SE PWD Ghy Bldg. Circle-II Chandmari Ghy-3,O/o the SE PWD Guwahati Building Circle-II Chandmari Ghy-3,"Construction for Development of School Infrastructure Phase-II of Sankardev Vidya Niketan, Hengrabari, Guwahati under Untied Fund (State Specific Scheme) for the year 2023-24","Construction for Development of School Infrastructure Phase-II of Sankardev Vidya Niketan, Hengrabari, Guwahati under Untied Fund (State Specific Scheme) for the year 2023-24",Please refer Tender documents. ,NA ,"1,45,63,170",Civil Works - Building,NA ,Tender,180.0,180.0,Hengerabari Guwahati,781036.0,O/o the SE PWD Ghy Bldg. Circle-II Chandmari Ghy-3 ,O/o the SE PWD Guwahati Building Circle-II Chandmari Ghy-3 ,19-Sep-2024 12:00 PM ,O/o the SE PWD Ghy Bldg. Circle-II Chandmari Ghy-3,No ,No,Public Works Building and NH Department||Chief Engineer-Building - PWBNH||SE-Guwahati Circle-2 - PWBNH,SE/BII_Sankardev Vidya Niketan_Ph-II_Hengerabari,2024_PWBNH_39043_1,Yes,Open Tender,Item Wise,Works,2.0,No,No,Online,No,No,No,1.0,Fee/PreQual/Technical,.pdf,Bidding Document,17-Sep-2024 12:00 PM,08-Oct-2024 04:30 PM,17-Sep-2024 12:00 PM,08-Oct-2024 02:00 PM,NA ,NA ,19-Sep-2024 02:30 PM,08-Oct-2024 02:00 PM,13-Nov-2024 11:00 AM,"2,91,263",Yes,percentage,2.0%,Nil,Nil,1.0,SBI Bank,"3,000",Nil,Nil,No,SE PWD Ghy Bldg. Circle-II Chandmari Ghy-3,O/o the SE PWD Guwahati Building Circle-II Chandmari Ghy-3,"Construction for Development of School Infrastructure Phase-II of Sankardev Vidya Niketan, Hengrabari, Guwahati under Untied Fund (State Specific Scheme) for the year 2023-24","Construction for Development of School Infrastructure Phase-II of Sankardev Vidya Niketan, Hengrabari, Guwahati under Untied Fund (State Specific Scheme) for the year 2023-24",Please refer Tender documents. ,NA ,"1,45,63,170",Civil Works - Building,NA ,Tender,180.0,180.0,Hengerabari Guwahati,781036.0,O/o the SE PWD Ghy Bldg. Circle-II Chandmari Ghy-3 ,O/o the SE PWD Guwahati Building Circle-II Chandmari Ghy-3 ,19-Sep-2024 12:00 PM ,O/o the SE PWD Ghy Bldg. Circle-II Chandmari Ghy-3,No ,No,18-Nov-2024,"INR 14,563,170",180.0,Bulu Bharali,19-Nov-2024 06:01 PM,Aocsankar.pdf (2433.00 KB),AoC_Agreement,1.0,242837.0,M/S DHANSIRI ASSOCIATES,INR,"14,563,170",1.0,242778.0,DIPANKAR BORA,08-Oct-2024 12:43 PM,Not Admitted-Fee/PreQual/Technical,Not Complied with technical specification,08-Oct-2024 05:45 PM,Finance,Financial,Kanak Chandra Roy,13-Nov-2024 04:56 PM,finance_63254.pdf,BOQ Comparative Chart,Chairperson,Internal,member secretary and members,Kanak Chandra Roy,14-Nov-2024 03:58 PM,finsummary_63254.pdf (1683.31 KB),1.0,242837.0,M/S DHANSIRI ASSOCIATES,14563170.0,L-1,Technical,Minutes,Kanak Chandra Roy,08-Oct-2024 05:44 PM,technical_63254.pdf,Chairperson,Internal,Member Secretary and Members,Kanak Chandra Roy,12-Nov-2024 01:22 PM,13-Nov-2024 11:00 AM,techsummary_63254.pdf (1699.01 KB),,,
,,,,,,,,,,,,,,,,.pdf,Technical Qualification,,,,,,,,,,,,,,,,,,,,,,,,,,,,,,,,,,,,,,,,,,,,,,,,,,,,,,,,,,.pdf,Technical Qualification,,,,,,,,,,,,,,,,,,,,,,,,,,,,,,,,,,,,,,,,,,,,,,,,,,,,,,2.0,242837.0,M/S DHANSIRI ASSOCIATES,07-Oct-2024 07:03 PM,Accepted-AOC,Successful bidder being L1,19-Nov-2024 06:02 PM,,,,,,,,,,,,,2.0,242846.0,M/S Manab Jyoti Gogoi & Co.,15384148.0,L-3,,,,,,,,,,,,,,,
,,,,,,,,,,,,,,2.0,Finance,.xls,BOQ,,,,,,,,,,,,,,,,,,,,,,,,,,,,,,,,,,,,,,,,,,,,,,,,,,,,,,,,2.0,Finance,.xls,BOQ,,,,,,,,,,,,,,,,,,,,,,,,,,,,,,,,,,,,,,,,,,,,,,,,,,,,,,3.0,242846.0,M/S Manab Jyoti Gogoi & Co.,07-Oct-2024 07:29 PM,Rejected-AOC,Unsuccessful bidder,19-Nov-2024 06:02 PM,,,,,,,,,,,,,3.0,242868.0,SWARAJ INFRA,15084159.0,L-2,,,,,,,,,,,,,,,
,,,,,,,,,,,,,,,,.pdf,Form of bid,,,,,,,,,,,,,,,,,,,,,,,,,,,,,,,,,,,,,,,,,,,,,,,,,,,,,,,,,,.pdf,Form of bid,,,,,,,,,,,,,,,,,,,,,,,,,,,,,,,,,,,,,,,,,,,,,,,,,,,,,,4.0,242868.0,SWARAJ INFRA,08-Oct-2024 11:13 AM,Rejected-AOC,Unsuccessful bidder,19-Nov-2024 06:02 PM,,,,,,,,,,,,,,,,,,,,,,,,,,,,,,,,
,,,,,,,,,,,,,,,,,,,,,,,,,,,,,,,,,,,,,,,,,,,,,,,,,,,,,,,,,,,,,,,,,,,,,,,,,,,,,,,,,,,,,,,,,,,,,,,,,,,,,,,,,,,,,,,,,,,,,,,,,,,,,,,,,,,,,,,,,,,,,,,,,,,,,,,,,,,,,,,,,,,,,,2024_PWBNH_39043_1,SE/BII_Sankardev Vidya Niketan_Ph-II_Hengerabari,"Construction for Development of School Infrastructure Phase-II of Sankardev Vidya Niketan, Hengrabari, Guwahati under Untied Fund (State Specific Scheme) for the year 2023-24"
