Organisation Chain,Tender Reference Number,Tender ID,Withdrawal Allowed,Tender Type,Form of contract,Tender Category,No. of Covers,General Technical Evaluation Allowed,ItemWise Technical Evaluation Allowed,Payment Mode,Is Multi Currency Allowed For BOQ,Is Multi Currency Allowed For Fee,Allow Two Stage Bidding,Cover No,Cover,Document Type,Description,Publish Date,Bid Opening Date,Document Download / Sale Start Date,Document Download / Sale End Date,Clarification Start Date,Clarification End Date,Bid Submission Start Date,Bid Submission End Date,Financial Bid Opening Date,EMD Amount in ₹,EMD Exemption Allowed,EMD Fee Type,EMD Percentage,EMD Payable To,EMD Payable At,S.No,Bank Name,Tender Fee in ₹,Fee Payable To,Fee Payable At,Tender Fee Exemption Allowed,Name,Address,Title,Work Description,Pre Qualification Details,Independent External Monitor/Remarks,Tender Value in ₹,Product Category,Sub category,Contract Type,Bid Validity(Days),Period Of Work(Days),Location,Pincode,Pre Bid Meeting Place,Pre Bid Meeting Address,Pre Bid Meeting Date,Bid Opening Place,Should Allow NDA Tender,Allow Preferential Bidder,Organisation Chain,Tender Reference Number,Tender ID,Withdrawal Allowed,Tender Type,Form of contract,Tender Category,No. of Covers,General Technical Evaluation Allowed,ItemWise Technical Evaluation Allowed,Payment Mode,Is Multi Currency Allowed For BOQ,Is Multi Currency Allowed For Fee,Allow Two Stage Bidding,Cover No,Cover,Document Type,Description,Publish Date,Bid Opening Date,Document Download / Sale Start Date,Document Download / Sale End Date,Clarification Start Date,Clarification End Date,Bid Submission Start Date,Bid Submission End Date,Financial Bid Opening Date,EMD Amount in ₹,EMD Exemption Allowed,EMD Fee Type,EMD Percentage,EMD Payable To,EMD Payable At,S.No,Bank Name,Tender Fee in ₹,Fee Payable To,Fee Payable At,Tender Fee Exemption Allowed,Name,Address,Title,Work Description,Pre Qualification Details,Independent External Monitor/Remarks,Tender Value in ₹,Product Category,Sub category,Contract Type,Bid Validity(Days),Period Of Work(Days),Location,Pincode,Pre Bid Meeting Place,Pre Bid Meeting Address,Pre Bid Meeting Date,Bid Opening Place,Should Allow NDA Tender,Allow Preferential Bidder,Contract Date :,Contract Value :,Work Completion Period in days :,Updated By :,Updated on :,AOC document :,S.No.1,Bid Number,Bidder Name,Awarded Currency,Awarded Value,S.No.2,Bid Number.1,Bidder Name.1,Submitted Date,Status,Remarks,Status Updated On,Type :,Summary :,Updated By :.1,Updated On :,Document :,BOQ Comparative Chart :,Committee Chairperson/Co-ordinator Name :,Committee Chairperson/Co-ordinator Type :,Committee Members :,Updated By :.2,Updated on :.1,Document :.1,S.No.3,Bid Number.2,Bidder Name.2,Value,Rank,Type :.1,Summary :.1,Updated By :.3,Updated On :.1,Document :.2,Committee Chairperson/Co-ordinator Name :.1,Committee Chairperson/Co-ordinator Type :.1,Committee Members :.1,Updated By :.4,Updated On :.2,Financial Bid Opening Date:,Document :.3,Tender ID :,Tender Ref No :,Tender Title :
Bodoland Territorial Council||Fisheries-BTC,FSHRY/BTC/2024-25/008/1,2024_BoTC_38604_1,Yes,Open Tender,Supply,Goods,2.0,No,No,Online,No,No,No,1.0,Fee/PreQual/Technical,.pdf,Tender Documents,22-Aug-2024 01:50 PM,11-Sep-2024 12:00 PM,22-Aug-2024 02:00 PM,10-Sep-2024 04:00 PM,NA ,NA ,23-Aug-2024 02:00 PM,10-Sep-2024 04:00 PM,17-Sep-2024 04:35 PM,"2,00,000",Yes,fixed,,Nil,Nil,1.0,SBI Bank,"2,500",Nil,Nil,No,"Joint-Director CUM CHD, Fishery Department.","O/o Joint-Director CUM CHD, Fishery Department.",Supply of inputs for Pig cum Fish culture in BTR,Supply of inputs for Pig cum Fish culture in BTR,Please refer Tender documents. ,NA ,"1,00,00,000",Supply of Materials,Livestocks ,Tender,180.0,60.0,in BTR,783370.0,NA ,NA ,NA ,"O/o Joint-Director CUM CHD, Fishery Department.",No ,No,Bodoland Territorial Council||Fisheries-BTC,FSHRY/BTC/2024-25/008/1,2024_BoTC_38604_1,Yes,Open Tender,Supply,Goods,2.0,No,No,Online,No,No,No,1.0,Fee/PreQual/Technical,.pdf,Tender Documents,22-Aug-2024 01:50 PM,11-Sep-2024 12:00 PM,22-Aug-2024 02:00 PM,10-Sep-2024 04:00 PM,NA ,NA ,23-Aug-2024 02:00 PM,10-Sep-2024 04:00 PM,17-Sep-2024 04:35 PM,"2,00,000",Yes,fixed,,Nil,Nil,1.0,SBI Bank,"2,500",Nil,Nil,No,"Joint-Director CUM CHD, Fishery Department.","O/o Joint-Director CUM CHD, Fishery Department.",Supply of inputs for Pig cum Fish culture in BTR,Supply of inputs for Pig cum Fish culture in BTR,Please refer Tender documents. ,NA ,"1,00,00,000",Supply of Materials,Livestocks ,Tender,180.0,60.0,in BTR,783370.0,NA ,NA ,NA ,"O/o Joint-Director CUM CHD, Fishery Department.",No ,No,15-Nov-2024,"INR 9,993,840",60.0,Nilo Das,15-Nov-2024 11:11 AM,FWO_PIGcumFISH.pdf (109.00 KB),1.0,238981.0,Sri Jatish Ray,INR,"9,993,840",1.0,238984.0,M/S HIMRAJ ENTERPRISE,10-Sep-2024 11:02 AM,Rejected-Finance,Rate accepted L1 bidder by BTC authority,15-Nov-2024 11:03 AM,Finance,All responsive bids are accepted and open for Financial Evalution,Ratan Kumar Debnath,17-Sep-2024 05:14 PM,None,BOQ Comparative Chart,Nilo Das,Internal,Chairperson,Nilo Das,15-Nov-2024 11:03 AM,finsummary_62454.pdf (597.09 KB),1.0,238981.0,Sri Jatish Ray,"99,93,840.00",L1,Technical,All Bids are accepted for Technical Evalution,Ratan Kumar Debnath,11-Sep-2024 10:05 PM,None,Nilo Das,Internal,Chairperson,Nabin Barman,17-Sep-2024 04:28 PM,17-Sep-2024 04:35 PM,techsummary_62454.pdf (662.21 KB),,,
,,,,,,,,,,,,,,,,.pdf,Technical Qualification,,,,,,,,,,,,,,,,,,,,,,,,,,,,,,,,,,,,,,,,,,,,,,,,,,,,,,,,,,.pdf,Technical Qualification,,,,,,,,,,,,,,,,,,,,,,,,,,,,,,,,,,,,,,,,,,,,,,,,,,,,,2.0,238981.0,Sri Jatish Ray,10-Sep-2024 09:33 AM,Accepted-AOC,Acceptance letter Accepted by Contractor,15-Nov-2024 11:12 AM,,,,,,,,,,,,,2.0,238984.0,M/S HIMRAJ ENTERPRISE,"99,96,300.00",L2,,,,,,,,,,,,,,,
,,,,,,,,,,,,,,2.0,Finance,.xls,BOQ,,,,,,,,,,,,,,,,,,,,,,,,,,,,,,,,,,,,,,,,,,,,,,,,,,,,,,,,2.0,Finance,.xls,BOQ,,,,,,,,,,,,,,,,,,,,,,,,,,,,,,,,,,,,,,,,,,,,,,,,,,,,,,,,,,,,,,,,,,,,,,,,,,,,,,,,,,,,,,,,,,,
,,,,,,,,,,,,,,,,.pdf,Additional Documents,,,,,,,,,,,,,,,,,,,,,,,,,,,,,,,,,,,,,,,,,,,,,,,,,,,,,,,,,,.pdf,Additional Documents,,,,,,,,,,,,,,,,,,,,,,,,,,,,,,,,,,,,,,,,,,,,,,,,,,,,,,,,,,,,,,,,,,,,,,,,,,,,,,,,,,,,,,,,,,,
,,,,,,,,,,,,,,,,,,,,,,,,,,,,,,,,,,,,,,,,,,,,,,,,,,,,,,,,,,,,,,,,,,,,,,,,,,,,,,,,,,,,,,,,,,,,,,,,,,,,,,,,,,,,,,,,,,,,,,,,,,,,,,,,,,,,,,,,,,,,,,,,,,,,,,,,,,,,,,,,,,,,,2024_BoTC_38604_1,FSHRY/BTC/2024-25/008/1,Supply of inputs for Pig cum Fish culture in BTR
