Organisation Chain,Tender Reference Number,Tender ID,Withdrawal Allowed,Tender Type,Form of contract,Tender Category,No. of Covers,General Technical Evaluation Allowed,ItemWise Technical Evaluation Allowed,Payment Mode,Is Multi Currency Allowed For BOQ,Is Multi Currency Allowed For Fee,Allow Two Stage Bidding,Cover No,Cover,Document Type,Description,Publish Date,Bid Opening Date,Document Download / Sale Start Date,Document Download / Sale End Date,Clarification Start Date,Clarification End Date,Bid Submission Start Date,Bid Submission End Date,Financial Bid Opening Date,EMD Amount in ₹,EMD Exemption Allowed,EMD Fee Type,EMD Percentage,EMD Payable To,EMD Payable At,S.No,Bank Name,Tender Fee in ₹,Fee Payable To,Fee Payable At,Tender Fee Exemption Allowed,Name,Address,Title,Work Description,Pre Qualification Details,Independent External Monitor/Remarks,Tender Value in ₹,Product Category,Sub category,Contract Type,Bid Validity(Days),Period Of Work(Days),Location,Pincode,Pre Bid Meeting Place,Pre Bid Meeting Address,Pre Bid Meeting Date,Bid Opening Place,Should Allow NDA Tender,Allow Preferential Bidder,Organisation Chain,Tender Reference Number,Tender ID,Withdrawal Allowed,Tender Type,Form of contract,Tender Category,No. of Covers,General Technical Evaluation Allowed,ItemWise Technical Evaluation Allowed,Payment Mode,Is Multi Currency Allowed For BOQ,Is Multi Currency Allowed For Fee,Allow Two Stage Bidding,Cover No,Cover,Document Type,Description,Publish Date,Bid Opening Date,Document Download / Sale Start Date,Document Download / Sale End Date,Clarification Start Date,Clarification End Date,Bid Submission Start Date,Bid Submission End Date,Financial Bid Opening Date,EMD Amount in ₹,EMD Exemption Allowed,EMD Fee Type,EMD Percentage,EMD Payable To,EMD Payable At,S.No,Bank Name,Tender Fee in ₹,Fee Payable To,Fee Payable At,Tender Fee Exemption Allowed,Name,Address,Title,Work Description,Pre Qualification Details,Independent External Monitor/Remarks,Tender Value in ₹,Product Category,Sub category,Contract Type,Bid Validity(Days),Period Of Work(Days),Location,Pincode,Pre Bid Meeting Place,Pre Bid Meeting Address,Pre Bid Meeting Date,Bid Opening Place,Should Allow NDA Tender,Allow Preferential Bidder,Contract Date :,Contract Value :,Work Completion Period in days :,Updated By :,Updated on :,AOC document :,AOC Description :,S.No.1,Bid Number,Bidder Name,Awarded Currency,Awarded Value,S.No.2,Bid Number.1,Bidder Name.1,Submitted Date,Status,Remarks,Status Updated On,Type :,Summary :,Updated By :.1,Updated On :,Document :,BOQ Comparative Chart :,Committee Chairperson/Co-ordinator Name :,Committee Chairperson/Co-ordinator Type :,Committee Members :,Updated By :.2,Updated on :.1,Document :.1,S.No.3,Bid Number.2,Bidder Name.2,Value,Rank,Type :.1,Summary :.1,Updated By :.3,Updated On :.1,Document :.2,Committee Chairperson/Co-ordinator Name :.1,Committee Chairperson/Co-ordinator Type :.1,Committee Members :.1,Updated By :.4,Updated On :.2,Financial Bid Opening Date:,Document :.3,Tender ID :,Tender Ref No :,Tender Title :
National Health Mission||State Programme Management Unit - NHM,NHM-32043/1/2024-CONS-NHM,2024_NHM_36513_11,Yes,Open Tender,Turn-key,Works,2.0,No,No,Online,No,No,No,1.0,Fee/PreQual/Technical,.pdf,SBD,23-Feb-2024 09:00 AM,05-Mar-2024 03:30 PM,23-Feb-2024 09:00 AM,04-Mar-2024 02:00 PM,NA ,NA ,23-Feb-2024 09:00 AM,04-Mar-2024 02:00 PM,28-May-2024 02:05 PM,"3,00,000",Yes,percentage,2.0%,Nil,Nil,1.0,SBI Bank,"2,000",Nil,Nil,No,"O/o MD, NHM, Assam","MD, NHM, Assam","Construction of BPHU at Moirabari CHC, Chabukdhara CHC and Bhurbandha MH in Marigaon District under PM ABHIM for the FY 2023-24 under NHM, Assam on Turnkey Basis Group no-16 (3 nos. of Scheme in Marigaon District)","Construction of BPHU at Moirabari CHC, Chabukdhara CHC and Bhurbandha MH in Marigaon District under PM ABHIM for the FY 2023-24 under NHM, Assam on Turnkey Basis Group no-16 (3 nos. of Scheme in Marigaon District)",Please refer Tender documents. ,NA ,"1,50,00,000",Civil Works - Building,NA ,Tender,180.0,270.0,Marigaon,781005.0,NA ,NA ,NA ,"O/o MD, NHM, Assam",No ,No,National Health Mission||State Programme Management Unit - NHM,NHM-32043/1/2024-CONS-NHM,2024_NHM_36513_11,Yes,Open Tender,Turn-key,Works,2.0,No,No,Online,No,No,No,1.0,Fee/PreQual/Technical,.pdf,SBD,23-Feb-2024 09:00 AM,05-Mar-2024 03:30 PM,23-Feb-2024 09:00 AM,04-Mar-2024 02:00 PM,NA ,NA ,23-Feb-2024 09:00 AM,04-Mar-2024 02:00 PM,28-May-2024 02:05 PM,"3,00,000",Yes,percentage,2.0%,Nil,Nil,1.0,SBI Bank,"2,000",Nil,Nil,No,"O/o MD, NHM, Assam","MD, NHM, Assam","Construction of BPHU at Moirabari CHC, Chabukdhara CHC and Bhurbandha MH in Marigaon District under PM ABHIM for the FY 2023-24 under NHM, Assam on Turnkey Basis Group no-16 (3 nos. of Scheme in Marigaon District)","Construction of BPHU at Moirabari CHC, Chabukdhara CHC and Bhurbandha MH in Marigaon District under PM ABHIM for the FY 2023-24 under NHM, Assam on Turnkey Basis Group no-16 (3 nos. of Scheme in Marigaon District)",Please refer Tender documents. ,NA ,"1,50,00,000",Civil Works - Building,NA ,Tender,180.0,270.0,Marigaon,781005.0,NA ,NA ,NA ,"O/o MD, NHM, Assam",No ,No,13-Nov-2024,"INR 13,999,999",270.0,Dipankar Barman,13-Nov-2024 12:47 PM,WOMoirabariMorigaon.pdf (163.00 KB),Work order,1.0,228747.0,YEASMIN SULTANA,INR,"13,999,999",1.0,228703.0,khalilur rahman,04-Mar-2024 01:45 PM,Not Admitted-Fee/PreQual/Technical,Not Complied with technical specification,28-May-2024 02:00 PM,Finance,Technical,Dipankar Barman,13-Nov-2024 12:42 PM,None,BOQ Comparative Chart,OSD,Internal,,Dipankar Barman,13-Nov-2024 12:45 PM,finsummary_59786.pdf (162.63 KB),1.0,228747.0,YEASMIN SULTANA,"1,39,99,999.00",L1,Technical,FINANSIAL BID OPEN,Manas Pratim Mahanta,28-May-2024 02:00 PM,None,ED,Internal,"SP,SPCON,CON,FA,DF,ADM",Manas Pratim Mahanta,28-May-2024 02:02 PM,28-May-2024 02:05 PM,techsummary_59786.pdf (8546.51 KB),,,
,,,,,,,,,,,,,,,,.pdf,EMD AND TENDER FEE,,,,,,,,,,,,,,,,,,,,,,,,,,,,,,,,,,,,,,,,,,,,,,,,,,,,,,,,,,.pdf,EMD AND TENDER FEE,,,,,,,,,,,,,,,,,,,,,,,,,,,,,,,,,,,,,,,,,,,,,,,,,,,,,,2.0,228399.0,M/S B.M. Enterprise,04-Mar-2024 12:42 PM,Not Admitted-Fee/PreQual/Technical,Not Complied with technical specification,28-May-2024 02:00 PM,,,,,,,,,,,,,,,,,,,,,,,,,,,,,,,,
,,,,,,,,,,,,,,,,.pdf,TECHNICAL QUALIFICATION,,,,,,,,,,,,,,,,,,,,,,,,,,,,,,,,,,,,,,,,,,,,,,,,,,,,,,,,,,.pdf,TECHNICAL QUALIFICATION,,,,,,,,,,,,,,,,,,,,,,,,,,,,,,,,,,,,,,,,,,,,,,,,,,,,,,3.0,228704.0,M/s Synergy Enterprise,03-Mar-2024 10:04 PM,Not Admitted-Fee/PreQual/Technical,Not Complied with technical specification,28-May-2024 02:00 PM,,,,,,,,,,,,,,,,,,,,,,,,,,,,,,,,
,,,,,,,,,,,,,,2.0,Finance,.xls,BOQ,,,,,,,,,,,,,,,,,,,,,,,,,,,,,,,,,,,,,,,,,,,,,,,,,,,,,,,,2.0,Finance,.xls,BOQ,,,,,,,,,,,,,,,,,,,,,,,,,,,,,,,,,,,,,,,,,,,,,,,,,,,,,,4.0,228743.0,Sanjib Barman,03-Mar-2024 10:52 PM,Not Admitted-Fee/PreQual/Technical,Not Complied with technical specification,28-May-2024 02:00 PM,,,,,,,,,,,,,,,,,,,,,,,,,,,,,,,,
,,,,,,,,,,,,,,,,.pdf,FOB,,,,,,,,,,,,,,,,,,,,,,,,,,,,,,,,,,,,,,,,,,,,,,,,,,,,,,,,,,.pdf,FOB,,,,,,,,,,,,,,,,,,,,,,,,,,,,,,,,,,,,,,,,,,,,,,,,,,,,,,5.0,228747.0,YEASMIN SULTANA,04-Mar-2024 12:28 PM,Accepted-AOC,L1,13-Nov-2024 12:47 PM,,,,,,,,,,,,,,,,,,,,,,,,,,,,,,,,
,,,,,,,,,,,,,,,,,,,,,,,,,,,,,,,,,,,,,,,,,,,,,,,,,,,,,,,,,,,,,,,,,,,,,,,,,,,,,,,,,,,,,,,,,,,,,,,,,,,,,,,,,,,,,,,,,,,,,,,,,,,,,,,,,,,,,,,,,,,,,,,,,,,,,,,,,,,,,,,,,,,,,,2024_NHM_36513_11,NHM-32043/1/2024-CONS-NHM,"Construction of BPHU at Moirabari CHC, Chabukdhara CHC and Bhurbandha MH in Marigaon District under PM ABHIM for the FY 2023-24 under NHM, Assam on Turnkey Basis Group no-16 (3 nos. of Scheme in Marigaon District)"
