Organisation Chain,Tender Reference Number,Tender ID,Withdrawal Allowed,Tender Type,Form of contract,Tender Category,No. of Covers,General Technical Evaluation Allowed,ItemWise Technical Evaluation Allowed,Payment Mode,Is Multi Currency Allowed For BOQ,Is Multi Currency Allowed For Fee,Allow Two Stage Bidding,Cover No,Cover,Document Type,Description,Publish Date,Bid Opening Date,Document Download / Sale Start Date,Document Download / Sale End Date,Clarification Start Date,Clarification End Date,Bid Submission Start Date,Bid Submission End Date,Financial Bid Opening Date,EMD Amount in ₹,EMD Exemption Allowed,EMD Fee Type,EMD Percentage,EMD Payable To,EMD Payable At,S.No,Bank Name,Tender Fee in ₹,Fee Payable To,Fee Payable At,Tender Fee Exemption Allowed,Name,Address,Title,Work Description,Pre Qualification Details,Independent External Monitor/Remarks,Tender Value in ₹,Product Category,Sub category,Contract Type,Bid Validity(Days),Period Of Work(Days),Location,Pincode,Pre Bid Meeting Place,Pre Bid Meeting Address,Pre Bid Meeting Date,Bid Opening Place,Should Allow NDA Tender,Allow Preferential Bidder,Tender Stage,Contract Date :,Contract Value :,Work Completion Period in days :,Updated By :,Updated on :,AOC document :,S.No,Bid Number,Bidder Name,Awarded Currency,Awarded Value,S.No.1,Bid Number.1,Bidder Name.1,Submitted Date,Status,Remarks,Status Updated On,Type :,Summary :,Updated By :.1,Updated On :,Document :,BOQ Comparative Chart :,Committee Chairperson/Co-ordinator Name :,Committee Chairperson/Co-ordinator Type :,Committee Members :,Updated By :.2,Updated on :.1,Document :.1,Organisation Chain :,Tender ID :,Tender Ref No :,Tender Title :,Type :.1,Summary :.1,Updated By :.3,Updated On :.1,Document :.2,Committee Chairperson/Co-ordinator Name :.1,Committee Chairperson/Co-ordinator Type :.1,Committee Members :.1,Updated By :.4,Updated On :.2,Financial Bid Opening Date:,Document :.3,Tender Stage
Irrigation Department||Chief Engineer(Major)-Irrigation Dept||Tinsukia Circle||Tinsukia Digboi Margherita Division,02/2024-25,2024_ID_40404_1,Yes,Open Tender,Item Rate,Works,2.0,No,No,Online,No,No,No,1.0,Fee/PreQual/Technical,.pdf,NIT,18-Nov-2024 05:00 PM,10-Dec-2024 12:30 PM,18-Nov-2024 05:00 PM,10-Dec-2024 11:30 AM,NA ,NA ,18-Nov-2024 05:00 PM,10-Dec-2024 11:30 AM,23-Dec-2024 04:30 PM,"84,848",Yes,percentage,2.0%,Nil,Nil,1.0,SBI Bank,900.0,Nil,Nil,No,"EE, TinsukiaDigboi-Margherita div (Irrigation)","O/O the Executive Engineer, Tinsukia-Digboi-Margherita Division (Irrigation), Tinsukia",Installation of Solar operated Tube Well scheme (5 points) at Matiakhana and Dharia Raitak Gaon under SOPD-G for the year 2024-25,"Boring, installation of solar pump",Please refer Tender documents. ,NA ,"42,42,401",Water Equipments/ Meter/ Drilling/ Boring,NA ,Tender,180.0,NA ,Tinsukia LAC,786126.0,NA ,NA ,NA ,"O/O the EE, Tinsukia-Digboi-Margherita div (I)",No ,No,AOC,06-Jan-2025,"INR 4,242,401",180.0,Gitumoni Gogoi,06-Jan-2025 02:01 PM,AOCtinsukia.pdf (1111.00 KB),1.0,250280.0,LAKHYA KONWAR,INR,"2,545,441",1.0,250282.0,HEMANTA SAIKIA,07-Dec-2024 09:03 PM,Rejected-Technical,As decided by tender evaluation committee,23-Dec-2024 04:24 PM,Finance,Provisionally admitted,Rituporno Borgohain,23-Dec-2024 04:40 PM,,BOQ Comparative Chart,"Se, Tinsukia Circle(Irrigation) Tinsukia",Internal,,Gitumoni Gogoi,23-Dec-2024 06:06 PM,finsummary_65512.pdf (742.63 KB),Irrigation Department||Chief Engineer(Major)-Irrigation Dept||Tinsukia Circle||Tinsukia Digboi Margherita Division,2024_ID_40404_1,02/2024-25,Installation of Solar operated Tube Well scheme (5 points) at Matiakhana and Dharia Raitak Gaon under SOPD-G for the year 2024-25,Technical,Provisionally admitted,Diganta Kumar Sarma,10-Dec-2024 01:24 PM,,"Superintending Engineer, TinsukiaCircle (Irrigation) Tinsukia",Internal,,Gitumoni Gogoi,23-Dec-2024 04:24 PM,23-Dec-2024 04:30 PM,techsummary_65512.pdf (1052.95 KB),AOC
,,,,,,,,,,,,,,,,.pdf,BID Document and EMD,,,,,,,,,,,,,,,,,,,,,,,,,,,,,,,,,,,,,,,,,,AOC,,,,,,,2.0,250230.0,Rajen Singha,INR,"1,696,960",2.0,250280.0,LAKHYA KONWAR,07-Dec-2024 09:00 PM,Accepted-AOC,As instructed by TIA,06-Jan-2025 02:01 PM,,,,,,,,,,,,,,,,,,,,,,,,,,,,,AOC
,,,,,,,,,,,,,,,,.pdf,Qualification,,,,,,,,,,,,,,,,,,,,,,,,,,,,,,,,,,,,,,,,,,AOC,,,,,,,,,,,,3.0,250230.0,Rajen Singha,09-Dec-2024 02:56 PM,Accepted-AOC,As instructed by TIA,06-Jan-2025 02:01 PM,,,,,,,,,,,,,,,,,,,,,,,,,,,,,AOC
,,,,,,,,,,,,,,2.0,Finance,.xls,BOQ,,,,,,,,,,,,,,,,,,,,,,,,,,,,,,,,,,,,,,,,,,AOC,,,,,,,,,,,,,,,,,,,,,,,,,,,,,,,,,,,,,,,,,,,,,,,AOC
,,,,,,,,,,,,,,,,.pdf,FOB,,,,,,,,,,,,,,,,,,,,,,,,,,,,,,,,,,,,,,,,,,AOC,,,,,,,,,,,,,,,,,,,,,,,,,,,,,,,,,,,,,,,,,,,,,,,AOC
