Organisation Chain,Tender Reference Number,Tender ID,Withdrawal Allowed,Tender Type,Form of contract,Tender Category,No. of Covers,General Technical Evaluation Allowed,ItemWise Technical Evaluation Allowed,Payment Mode,Is Multi Currency Allowed For BOQ,Is Multi Currency Allowed For Fee,Allow Two Stage Bidding,Cover No,Cover,Document Type,Description,Publish Date,Bid Opening Date,Document Download / Sale Start Date,Document Download / Sale End Date,Clarification Start Date,Clarification End Date,Bid Submission Start Date,Bid Submission End Date,Financial Bid Opening Date,EMD Amount in ₹,EMD Exemption Allowed,EMD Fee Type,EMD Percentage,EMD Payable To,EMD Payable At,S.No,Bank Name,Tender Fee in ₹,Fee Payable To,Fee Payable At,Tender Fee Exemption Allowed,Name,Address,Title,Work Description,Pre Qualification Details,Independent External Monitor/Remarks,Tender Value in ₹,Product Category,Sub category,Contract Type,Bid Validity(Days),Period Of Work(Days),Location,Pincode,Pre Bid Meeting Place,Pre Bid Meeting Address,Pre Bid Meeting Date,Bid Opening Place,Should Allow NDA Tender,Allow Preferential Bidder,Tender Stage,Contract Date :,Contract Value :,Work Completion Period in days :,Updated By :,Updated on :,AOC document :,S.No,Bid Number,Bidder Name,Awarded Currency,Awarded Value,S.No.1,Bid Number.1,Bidder Name.1,Submitted Date,Status,Remarks,Status Updated On,Type :,Summary :,Updated By :.1,Updated On :,Document :,BOQ Comparative Chart :,Committee Chairperson/Co-ordinator Name :,Committee Chairperson/Co-ordinator Type :,Committee Members :,Updated By :.2,Updated on :.1,Document :.1,Organisation Chain :,Tender ID :,Tender Ref No :,Tender Title :,Type :.1,Summary :.1,Updated By :.3,Updated On :.1,Document :.2,Committee Chairperson/Co-ordinator Name :.1,Committee Chairperson/Co-ordinator Type :.1,Committee Members :.1,Updated By :.4,Updated On :.2,Financial Bid Opening Date:,Document :.3,Tender Stage
Health and Family Welfare Department||Directorate of Medical Education-HFWD||Guwahati Medical College Hospital-HFWD,MCH/HMS/2024/336/33,2024_HFWD_40973_1,Yes,Open Tender,Item Rate,Services,2.0,No,No,Online,No,No,No,1.0,Fee/PreQual/Technical,.pdf,Technical qualification documents,09-Dec-2024 04:00 PM,23-Dec-2024 04:00 PM,09-Dec-2024 04:00 PM,23-Dec-2024 02:00 PM,NA ,NA ,17-Dec-2024 04:00 PM,23-Dec-2024 02:00 PM,07-Jan-2025 05:15 PM,"10,000",No,fixed,,Nil,Nil,1.0,SBI Bank,"2,000",Nil,Nil,No,Superintendent cum Member Secretary,"GMCH, Bhangagarh, Guwahati",lease of the Pay and Use Toilet services,lease of the Pay and Use Toilet services,Please refer Tender documents. ,NA ,,Miscellaneous Services,NA ,Tender,365.0,365.0,"GMCH, Bhangagarh, Guwahati",781032.0,"Office of the Superintendent, GMCH ","Office of the Superintendent, GMCH ",13-Dec-2024 12:00 PM ,"Office of the Superintendent, GMCH",No ,No,AOC,10-Jan-2025,"INR 59,601",365.0,Lipseeta Deka,10-Jan-2025 12:52 PM,apprvd.pdf (2061.00 KB),1.0,252239.0,K SANDHYA,INR,"31,999",1,252239,K SANDHYA,23-Dec-2024 01:51 PM,Accepted-AOC,H1,10-Jan-2025 12:52 PM,Finance,Financial bid has been opened for ebvaluation,Kumar Partha Pratim,07-Jan-2025 05:20 PM,,BOQ Comparative Chart,Superintendent cum Member Secretary,Internal,,Lipseeta Deka,10-Jan-2025 12:44 PM,finsummary_66148.pdf (2061.12 KB),Health and Family Welfare Department||Directorate of Medical Education-HFWD||Guwahati Medical College Hospital-HFWD,2024_HFWD_40973_1,MCH/HMS/2024/336/33,lease of the Pay and Use Toilet services,Technical,Technical bid has been opened for evaluation,Kumar Partha Pratim,23-Dec-2024 04:59 PM,,Superintendent cum Member Secretary,Internal,,Lipseeta Deka,07-Jan-2025 05:12 PM,07-Jan-2025 05:15 PM,techsummary_66148.pdf (639.35 KB),AOC
,,,,,,,,,,,,,,,,.pdf,Bid document downloaded from the portal,,,,,,,,,,,,,,,,,,,,,,,,,,,,,,,,,,,,,,,,,,AOC,,,,,,,2.0,252199.0,NASHIM AKHTAR HUSSAIN HAZARIKA,INR,"15,501",2,251692,MD NASIR KHAN,21-Dec-2024 02:29 PM,Rejected-Technical,Technically disqualiied,07-Jan-2025 05:12 PM,,,,,,,,,,,,,,,,,,,,,,,,,,,,,AOC
,,,,,,,,,,,,,,2.0,Finance,.xls,Price bid,,,,,,,,,,,,,,,,,,,,,,,,,,,,,,,,,,,,,,,,,,AOC,,,,,,,3.0,252188.0,RUSTAM ALI,INR,"12,101",3,252199,NASHIM AKHTAR HUSSAIN HAZARIKA,21-Dec-2024 12:52 PM,Accepted-AOC,H1,10-Jan-2025 12:52 PM,,,,,,,,,,,,,,,,,,,,,,,,,,,,,AOC
,,,,,,,,,,,,,,,,,,,,,,,,,,,,,,,,,,,,,,,,,,,,,,,,,,,,,,,,,,,AOC,,,,,,,,,,,,4,252401,Ranjit Das,23-Dec-2024 01:30 PM,Rejected-Technical,Technically disqualiied,07-Jan-2025 05:12 PM,,,,,,,,,,,,,,,,,,,,,,,,,,,,,AOC
,,,,,,,,,,,,,,,,,,,,,,,,,,,,,,,,,,,,,,,,,,,,,,,,,,,,,,,,,,,AOC,,,,,,,,,,,,5,252188,RUSTAM ALI,21-Dec-2024 11:59 AM,Accepted-AOC,H1,10-Jan-2025 12:52 PM,,,,,,,,,,,,,,,,,,,,,,,,,,,,,AOC
