Organisation Chain,Tender Reference Number,Tender ID,Withdrawal Allowed,Tender Type,Form of contract,Tender Category,No. of Covers,General Technical Evaluation Allowed,ItemWise Technical Evaluation Allowed,Payment Mode,Is Multi Currency Allowed For BOQ,Is Multi Currency Allowed For Fee,Allow Two Stage Bidding,Cover No,Cover,Document Type,Description,Publish Date,Bid Opening Date,Document Download / Sale Start Date,Document Download / Sale End Date,Clarification Start Date,Clarification End Date,Bid Submission Start Date,Bid Submission End Date,Financial Bid Opening Date,EMD Amount in ₹,EMD Exemption Allowed,EMD Fee Type,EMD Percentage,EMD Payable To,EMD Payable At,S.No,Corrigendum Title,Corrigendum Type,View,S.No.1,Bank Name,Tender Fee in ₹,Fee Payable To,Fee Payable At,Tender Fee Exemption Allowed,Name,Address,Title,Work Description,Pre Qualification Details,Independent External Monitor/Remarks,Tender Value in ₹,Product Category,Sub category,Contract Type,Bid Validity(Days),Period Of Work(Days),Location,Pincode,Pre Bid Meeting Place,Pre Bid Meeting Address,Pre Bid Meeting Date,Bid Opening Place,Should Allow NDA Tender,Allow Preferential Bidder,Tender Stage,Contract Date :,Contract Value :,Work Completion Period in days :,Updated By :,Updated on :,AOC document :,S.No,Bid Number,Bidder Name,Awarded Currency,Awarded Value,S.No.1,Bid Number.1,Bidder Name.1,Submitted Date,Status,Remarks,Status Updated On,Type :,Summary :,Updated By :.1,Updated On :,Document :,BOQ Comparative Chart :,Committee Chairperson/Co-ordinator Name :,Committee Chairperson/Co-ordinator Type :,Committee Members :,Updated By :.2,Updated on :.1,Document :.1,Organisation Chain :,Tender ID :,Tender Ref No :,Tender Title :,Type :.1,Summary :.1,Updated By :.3,Updated On :.1,Document :.2,Committee Chairperson/Co-ordinator Name :.1,Committee Chairperson/Co-ordinator Type :.1,Committee Members :.1,Updated By :.4,Updated On :.2,Financial Bid Opening Date:,Document :.3,Tender Stage
Assam Electricity Grid Corporation Ltd||CGM (T and T),AEGCL/DGM(Civil)/2024-25/01,2024_AEGCL_38344_1,Yes,Open Tender,Works,Works,2.0,No,No,Online,No,No,No,1.0,Fee/PreQual/Technical,.rar,Techno Commercial Bid,06-Aug-2024 02:00 PM,03-Sep-2024 03:00 PM,06-Aug-2024 02:00 PM,02-Sep-2024 12:00 PM,06-Aug-2024 02:00 PM ,31-Aug-2024 02:00 PM ,10-Aug-2024 02:00 PM,02-Sep-2024 12:00 PM,20-Sep-2024 01:55 PM,"9,380",No,fixed,,Nil,Nil,1.0,Time Extension,Date,,1.0,SBI Bank,500.0,Nil,Nil,No,Deputy General Manager (Civil),"Bijulee Bhawan, Paltanbazar, Guwahati","Providing aluminium partition along with Air conditioner in the office of the AGM, Design and Projects, AEGCL, Kahilipara","Providing aluminium partition along with Air conditioner in the office of the AGM, Design and Projects, AEGCL, Kahilipara",Please refer Tender documents. ,NA ,"3,97,380",Civil Works,NA ,Tender,180.0,30.0,"Kahilipara, Guawhati",781019.0,NA ,NA ,NA ,"Bijulee Bhawan, Paltanbazar, Guwahati",No ,No,AOC,27-Jan-2025,"INR 389,152",30.0,DAVID BATHARI,27-Jan-2025 12:02 PM,wo-24-25_01.pdf (430.00 KB),1.0,237373.0,BASANTA KUMAR KAKATI,INR,"389,152",1,237373,BASANTA KUMAR KAKATI,20-Aug-2024 01:16 PM,Accepted-AOC,L1,27-Jan-2025 12:03 PM,Finance,Financial bids have been opened.,Rahul Satnami,20-Sep-2024 03:42 PM,,BOQ Comparative Chart,"Chief General Manager,OandM,LAR",Internal,,DAVID BATHARI,27-Jan-2025 11:51 AM,finsummary_62150.pdf (252.17 KB),Assam Electricity Grid Corporation Ltd||CGM (T and T),2024_AEGCL_38344_1,AEGCL/DGM(Civil)/2024-25/01,"Providing aluminium partition along with Air conditioner in the office of the AGM, Design and Projects, AEGCL, Kahilipara",Technical,Technical bids have been opened.,Rahul Satnami,06-Sep-2024 01:44 PM,,"Chief General Mangager, OandM, LAR",Internal,,DAVID BATHARI,20-Sep-2024 01:53 PM,20-Sep-2024 01:55 PM,techsummary_62150.pdf (373.03 KB),AOC
,,,,,,,,,,,,,,2.0,Finance,.xls,Price Bid,,,,,,,,,,,,,,,,,,,,,,,,,,,,,,,,,,,,,,,,,,,,,,AOC,,,,,,,,,,,,2,238400,ENAJORI ENTERPRISE,02-Sep-2024 11:12 AM,Rejected-AOC,L3,27-Jan-2025 12:03 PM,,,,,,,,,,,,,,,,,,,,,,,,,,,,,AOC
,,,,,,,,,,,,,,,,,,,,,,,,,,,,,,,,,,,,,,,,,,,,,,,,,,,,,,,,,,,,,,,AOC,,,,,,,,,,,,3,237632,Hemanta Baishya,31-Aug-2024 05:14 PM,Rejected-Technical,Techno Commercially non responsive,20-Sep-2024 01:53 PM,,,,,,,,,,,,,,,,,,,,,,,,,,,,,AOC
,,,,,,,,,,,,,,,,,,,,,,,,,,,,,,,,,,,,,,,,,,,,,,,,,,,,,,,,,,,,,,,AOC,,,,,,,,,,,,4,238124,R. A. ASSOCIATES,01-Sep-2024 12:12 AM,Rejected-Technical,Techno Commercially non responsive,20-Sep-2024 01:53 PM,,,,,,,,,,,,,,,,,,,,,,,,,,,,,AOC
,,,,,,,,,,,,,,,,,,,,,,,,,,,,,,,,,,,,,,,,,,,,,,,,,,,,,,,,,,,,,,,AOC,,,,,,,,,,,,5,237358,SAHIL CHOUDHURY,27-Aug-2024 11:06 AM,Rejected-AOC,L2,27-Jan-2025 12:03 PM,,,,,,,,,,,,,,,,,,,,,,,,,,,,,AOC
