Organisation Chain,Tender Reference Number,Tender ID,Withdrawal Allowed,Tender Type,Form of contract,Tender Category,No. of Covers,General Technical Evaluation Allowed,ItemWise Technical Evaluation Allowed,Payment Mode,Is Multi Currency Allowed For BOQ,Is Multi Currency Allowed For Fee,Allow Two Stage Bidding,Cover No,Cover,Document Type,Description,Publish Date,Bid Opening Date,Document Download / Sale Start Date,Document Download / Sale End Date,Clarification Start Date,Clarification End Date,Bid Submission Start Date,Bid Submission End Date,Financial Bid Opening Date,EMD Amount in ₹,EMD Exemption Allowed,EMD Fee Type,EMD Percentage,EMD Payable To,EMD Payable At,S.No,Bank Name,Tender Fee in ₹,Fee Payable To,Fee Payable At,Tender Fee Exemption Allowed,Name,Address,Title,Work Description,Pre Qualification Details,Independent External Monitor/Remarks,Tender Value in ₹,Product Category,Sub category,Contract Type,Bid Validity(Days),Period Of Work(Days),Location,Pincode,Pre Bid Meeting Place,Pre Bid Meeting Address,Pre Bid Meeting Date,Bid Opening Place,Should Allow NDA Tender,Allow Preferential Bidder,Tender Stage,Contract Date :,Contract Value :,Work Completion Period in days :,Updated By :,Updated on :,AOC document :,AOC Description :,S.No,Bid Number,Bidder Name,Awarded Currency,Awarded Value,S.No.1,Bid Number.1,Bidder Name.1,Submitted Date,Status,Remarks,Status Updated On,Type :,Summary :,Updated By :.1,Updated On :,Document :,BOQ Comparative Chart :,Committee Chairperson/Co-ordinator Name :,Committee Chairperson/Co-ordinator Type :,Committee Members :,Updated By :.2,Updated on :.1,Document :.1,Organisation Chain :,Tender ID :,Tender Ref No :,Tender Title :,Type :.1,Summary :.1,Updated By :.3,Updated On :.1,Document :.2,Committee Chairperson/Co-ordinator Name :.1,Committee Chairperson/Co-ordinator Type :.1,Committee Members :.1,Updated By :.4,Updated On :.2,Financial Bid Opening Date:,Document :.3,Tender Stage
Pr. Chief Conservator of Forest and Head of Forest Force||Chief Conservator of Forestes (T) (Lower Assam Zone)||Southern Assam Circle||Cachar Forest Division,CAC/EPA/Re-tender/11,2024_PCCF_40666_1,Yes,Open Tender,Works,Works,2.0,No,No,Online,No,No,No,1.0,Fee/PreQual/Technical,.pdf,NIT,28-Nov-2024 10:00 AM,19-Dec-2024 10:00 AM,28-Nov-2024 10:00 AM,18-Dec-2024 06:00 PM,28-Nov-2024 10:00 AM ,08-Dec-2024 06:00 PM ,28-Nov-2024 10:00 AM,18-Dec-2024 06:00 PM,30-Dec-2024 06:50 PM,"40,000",Yes,percentage,2.0%,Nil,Nil,1.0,SBI Bank,"1,000",Nil,Nil,No,DFO Cachar,O/O the DFO Cachar Division Silchar,Construction of Community Hall,Construction of Community Hall,As per SBD ,NA ,"20,00,000",Civil Works,NA ,Tender,180.0,NA ,Hawaithang Range Dholai,788114.0,O/O the DFO Cachar Division Silchar ,O/O the DFO Cachar Division Silchar ,30-Nov-2024 11:00 AM ,O/O the DFO Cachar Division Silchar,No ,No,AOC,10-Mar-2025,"INR 1,800,000",120.0,VIJAY PALVE,02-Apr-2025 01:47 PM,BhubandharJFMC.pdf (881.00 KB),"Work order for Construction of Community Hall at Bhubandhar JFMC under Hawaithang Range, Dholai as part of Entry Point Activity",1.0,251676.0,M/S BHOWMIK ENTERPRISE,INR,"1,800,000",1,250959,Airsense,15-Dec-2024 12:31 AM,Rejected-AOC,Rejected as per experience,02-Apr-2025 01:48 PM,Finance,As per minutes of the evaluation committee,VIJAY PALVE,08-Jan-2025 03:29 PM,finance_65792.pdf,BOQ Comparative Chart,Vijay Palve,Internal,Rowel Rongphar,VIJAY PALVE,08-Jan-2025 03:49 PM,finsummary_65792.pdf (351.79 KB),Pr. Chief Conservator of Forest and Head of Forest Force||Chief Conservator of Forestes (T) (Lower Assam Zone)||Southern Assam Circle||Cachar Forest Division,2024_PCCF_40666_1,CAC/EPA/Re-tender/11,Construction of Community Hall,Technical,Out of 7 Nos of tenderer all are qualified as per technical specification,VIJAY PALVE,30-Dec-2024 05:22 PM,technical_65792.pdf,Vijay Palve,Internal,Rowel Rongphar,VIJAY PALVE,30-Dec-2024 06:31 PM,30-Dec-2024 06:50 PM,techsummary_65792.pdf (1736.01 KB),AOC
,,,,,,,,,,,,,,,,.pdf,SBD,,,,,,,,,,,,,,,,,,,,,,,,,,,,,,,,,,,,,,,,,,AOC,,,,,,,,,,,,,2,250387,BHUSAN PAUL,14-Dec-2024 12:09 PM,Rejected-AOC,Rejected as per experience,02-Apr-2025 01:48 PM,,,,,,,,,,,,,,,,,,,,,,,,,,,,,AOC
,,,,,,,,,,,,,,,,.pdf,Estimate,,,,,,,,,,,,,,,,,,,,,,,,,,,,,,,,,,,,,,,,,,AOC,,,,,,,,,,,,,3,251420,MODHAN MOHAN PAUL,18-Dec-2024 05:41 AM,Rejected-AOC,Rejected as per experience,02-Apr-2025 01:48 PM,,,,,,,,,,,,,,,,,,,,,,,,,,,,,AOC
,,,,,,,,,,,,,,2.0,Finance,.xls,BOQ,,,,,,,,,,,,,,,,,,,,,,,,,,,,,,,,,,,,,,,,,,AOC,,,,,,,,,,,,,4,251676,M/S BHOWMIK ENTERPRISE,18-Dec-2024 09:17 AM,Accepted-AOC,Accepted as per experience,02-Apr-2025 01:48 PM,,,,,,,,,,,,,,,,,,,,,,,,,,,,,AOC
,,,,,,,,,,,,,,,,.pdf,FOB,,,,,,,,,,,,,,,,,,,,,,,,,,,,,,,,,,,,,,,,,,AOC,,,,,,,,,,,,,5,251075,M/S J C CONSTRUCTION,18-Dec-2024 02:33 PM,Rejected-AOC,Rejected as per experience,02-Apr-2025 01:48 PM,,,,,,,,,,,,,,,,,,,,,,,,,,,,,AOC
,,,,,,,,,,,,,,,,,,,,,,,,,,,,,,,,,,,,,,,,,,,,,,,,,,,,,,,,,,,AOC,,,,,,,,,,,,,6,250794,MS JYOTI CONSTRO COMMERCIALS,16-Dec-2024 11:48 PM,Rejected-AOC,Rejected as per experience,02-Apr-2025 01:48 PM,,,,,,,,,,,,,,,,,,,,,,,,,,,,,AOC
,,,,,,,,,,,,,,,,,,,,,,,,,,,,,,,,,,,,,,,,,,,,,,,,,,,,,,,,,,,AOC,,,,,,,,,,,,,7,251738,Nripendra Chandra Mandal and Company,18-Dec-2024 03:20 PM,Rejected-AOC,Rejected as per experience,02-Apr-2025 01:48 PM,,,,,,,,,,,,,,,,,,,,,,,,,,,,,AOC
