Organisation Chain,Tender Reference Number,Tender ID,Withdrawal Allowed,Tender Type,Form of contract,Tender Category,No. of Covers,General Technical Evaluation Allowed,ItemWise Technical Evaluation Allowed,Payment Mode,Is Multi Currency Allowed For BOQ,Is Multi Currency Allowed For Fee,Allow Two Stage Bidding,Cover No,Cover,Document Type,Description,Publish Date,Bid Opening Date,Document Download / Sale Start Date,Document Download / Sale End Date,Clarification Start Date,Clarification End Date,Bid Submission Start Date,Bid Submission End Date,Financial Bid Opening Date,EMD Amount in ₹,EMD Exemption Allowed,EMD Fee Type,EMD Percentage,EMD Payable To,EMD Payable At,S.No,Bank Name,Tender Fee in ₹,Fee Payable To,Fee Payable At,Tender Fee Exemption Allowed,Name,Address,Title,Work Description,Pre Qualification Details,Independent External Monitor/Remarks,Tender Value in ₹,Product Category,Sub category,Contract Type,Bid Validity(Days),Period Of Work(Days),Location,Pincode,Pre Bid Meeting Place,Pre Bid Meeting Address,Pre Bid Meeting Date,Bid Opening Place,Should Allow NDA Tender,Allow Preferential Bidder,Tender Stage,Contract Date :,Contract Value :,Work Completion Period in days :,Updated By :,Updated on :,AOC document :,AOC Description :,S.No,Bid Number,Bidder Name,Awarded Currency,Awarded Value,S.No.1,Bid Number.1,Bidder Name.1,Submitted Date,Status,Remarks,Status Updated On,Type :,Summary :,Updated By :.1,Updated On :,Document :,BOQ Comparative Chart :,Committee Chairperson/Co-ordinator Name :,Committee Chairperson/Co-ordinator Type :,Committee Members :,Updated By :.2,Updated on :.1,Document :.1,Organisation Chain :,Tender ID :,Tender Ref No :,Tender Title :,Type :.1,Summary :.1,Updated By :.3,Updated On :.1,Document :.2,Committee Chairperson/Co-ordinator Name :.1,Committee Chairperson/Co-ordinator Type :.1,Committee Members :.1,Updated By :.4,Updated On :.2,Financial Bid Opening Date:,Document :.3,Tender Stage
Pr. Chief Conservator of Forest and Head of Forest Force||Chief Conservator of Forestes (T) (Lower Assam Zone)||Southern Assam Circle||Cachar Forest Division,CAC/EPA/Re-tender/03,2024_PCCF_40647_1,Yes,Open Tender,Works,Works,2.0,No,No,Online,No,No,No,1.0,Fee/PreQual/Technical,.pdf,NIT,27-Nov-2024 06:55 PM,19-Dec-2024 10:00 AM,27-Nov-2024 06:55 PM,18-Dec-2024 06:00 PM,27-Nov-2024 06:55 PM ,08-Dec-2024 06:00 PM ,27-Nov-2024 06:55 PM,18-Dec-2024 06:00 PM,30-Dec-2024 06:30 PM,"40,000",Yes,percentage,2.0%,Nil,Nil,1.0,SBI Bank,"1,000",Nil,Nil,No,DFO Cachar,O/O. the DFO Cachar Division Silchar,Construction of Road,Construction of Road,As per SBD ,NA ,"20,00,000",Civil Works,NA ,Tender,180.0,NA ,Hawaithang Range Dholai,788114.0,O/O. the DFO Cachar Division Silchar ,O/O. the DFO Cachar Division Silchar ,30-Nov-2024 11:00 AM ,O/O. the DFO Cachar Division Silchar,No ,No,AOC,10-Mar-2025,"INR 1,800,000",120.0,VIJAY PALVE,01-Apr-2025 06:49 PM,RadhanagarJFMC.pdf (932.00 KB),"Work order for Construction of Road 600(Mtrs.) at Radhanagar JFMC Hawaithang Range, Dholai as part of Entry Point Activity",1.0,251628.0,M/S BHOWMIK ENTERPRISE,INR,"1,800,000",1,250393,BHUSAN PAUL,14-Dec-2024 12:33 PM,Rejected-AOC,Rejected as per experience,01-Apr-2025 06:50 PM,Finance,As per minutes of the evaluation committee,VIJAY PALVE,07-Jan-2025 06:02 PM,finance_65773.pdf,BOQ Comparative Chart,Vijay Palve,Internal,Rowel Rongphar,VIJAY PALVE,07-Jan-2025 06:19 PM,finsummary_65773.pdf (351.27 KB),Pr. Chief Conservator of Forest and Head of Forest Force||Chief Conservator of Forestes (T) (Lower Assam Zone)||Southern Assam Circle||Cachar Forest Division,2024_PCCF_40647_1,CAC/EPA/Re-tender/03,Construction of Road,Technical,Out of 8 Nos of tenderer 6 are qualified ss per technical specification,VIJAY PALVE,30-Dec-2024 04:18 PM,technical_65773.pdf,Vijay Palve,Internal,Rowel Rongphar,VIJAY PALVE,30-Dec-2024 06:03 PM,30-Dec-2024 06:30 PM,techsummary_65773.pdf (1698.63 KB),AOC
,,,,,,,,,,,,,,,,.pdf,SBD,,,,,,,,,,,,,,,,,,,,,,,,,,,,,,,,,,,,,,,,,,AOC,,,,,,,,,,,,,2,250577,BISHNU DEB,18-Dec-2024 12:05 AM,Rejected-AOC,Rejected as per experience,01-Apr-2025 06:50 PM,,,,,,,,,,,,,,,,,,,,,,,,,,,,,AOC
,,,,,,,,,,,,,,,,.pdf,Estimate,,,,,,,,,,,,,,,,,,,,,,,,,,,,,,,,,,,,,,,,,,AOC,,,,,,,,,,,,,3,251677,Manbir Associates,18-Dec-2024 12:06 PM,Not Admitted-Fee/PreQual/Technical,Not Complied with technical specification,30-Dec-2024 04:18 PM,,,,,,,,,,,,,,,,,,,,,,,,,,,,,AOC
,,,,,,,,,,,,,,2.0,Finance,.xls,BOQ,,,,,,,,,,,,,,,,,,,,,,,,,,,,,,,,,,,,,,,,,,AOC,,,,,,,,,,,,,4,250438,MODHAN MOHAN PAUL,17-Dec-2024 02:11 AM,Rejected-AOC,Rejected as per experience,01-Apr-2025 06:50 PM,,,,,,,,,,,,,,,,,,,,,,,,,,,,,AOC
,,,,,,,,,,,,,,,,.pdf,FOB,,,,,,,,,,,,,,,,,,,,,,,,,,,,,,,,,,,,,,,,,,AOC,,,,,,,,,,,,,5,251628,M/S BHOWMIK ENTERPRISE,18-Dec-2024 10:52 AM,Accepted-AOC,Accepted as per experience,01-Apr-2025 06:50 PM,,,,,,,,,,,,,,,,,,,,,,,,,,,,,AOC
,,,,,,,,,,,,,,,,,,,,,,,,,,,,,,,,,,,,,,,,,,,,,,,,,,,,,,,,,,,AOC,,,,,,,,,,,,,6,250803,MS JYOTI CONSTRO COMMERCIALS,16-Dec-2024 10:56 PM,Rejected-AOC,Rejected as per experience,01-Apr-2025 06:50 PM,,,,,,,,,,,,,,,,,,,,,,,,,,,,,AOC
,,,,,,,,,,,,,,,,,,,,,,,,,,,,,,,,,,,,,,,,,,,,,,,,,,,,,,,,,,,AOC,,,,,,,,,,,,,7,251742,Nripendra Chandra Mandal and Company,18-Dec-2024 03:41 PM,Rejected-AOC,Rejected as per experience,01-Apr-2025 06:50 PM,,,,,,,,,,,,,,,,,,,,,,,,,,,,,AOC
,,,,,,,,,,,,,,,,,,,,,,,,,,,,,,,,,,,,,,,,,,,,,,,,,,,,,,,,,,,AOC,,,,,,,,,,,,,8,251745,RAJU CHANDRA DAS,18-Dec-2024 04:29 PM,Not Admitted-Fee/PreQual/Technical,Not Complied with technical specification,30-Dec-2024 04:18 PM,,,,,,,,,,,,,,,,,,,,,,,,,,,,,AOC
