Organisation Chain,Tender Reference Number,Tender ID,Withdrawal Allowed,Tender Type,Form of contract,Tender Category,No. of Covers,General Technical Evaluation Allowed,ItemWise Technical Evaluation Allowed,Payment Mode,Is Multi Currency Allowed For BOQ,Is Multi Currency Allowed For Fee,Allow Two Stage Bidding,Cover No,Cover,Document Type,Description,Publish Date,Bid Opening Date,Document Download / Sale Start Date,Document Download / Sale End Date,Clarification Start Date,Clarification End Date,Bid Submission Start Date,Bid Submission End Date,Financial Bid Opening Date,EMD Amount in ₹,EMD Exemption Allowed,EMD Fee Type,EMD Percentage,EMD Payable To,EMD Payable At,S.No,Corrigendum Title,Corrigendum Type,View,S.No.1,Bank Name,Tender Fee in ₹,Fee Payable To,Fee Payable At,Tender Fee Exemption Allowed,Name,Address,Title,Work Description,Pre Qualification Details,Independent External Monitor/Remarks,Tender Value in ₹,Product Category,Sub category,Contract Type,Bid Validity(Days),Period Of Work(Days),Location,Pincode,Pre Bid Meeting Place,Pre Bid Meeting Address,Pre Bid Meeting Date,Bid Opening Place,Should Allow NDA Tender,Allow Preferential Bidder,Tender Stage,Contract Date :,Contract Value :,Work Completion Period in days :,Updated By :,Updated on :,AOC document :,AOC Description :,S.No,Bid Number,Bidder Name,Awarded Currency,Awarded Value,S.No.1,Bid Number.1,Bidder Name.1,Submitted Date,Status,Remarks,Status Updated On,Type :,Summary :,Updated By :.1,Updated On :,Document :,BOQ Comparative Chart :,Committee Chairperson/Co-ordinator Name :,Committee Chairperson/Co-ordinator Type :,Committee Members :,Updated By :.2,Updated on :.1,Document :.1,Organisation Chain :,Tender ID :,Tender Ref No :,Tender Title :,Type :.1,Summary :.1,Updated By :.3,Updated On :.1,Document :.2,Committee Chairperson/Co-ordinator Name :.1,Committee Chairperson/Co-ordinator Type :.1,Committee Members :.1,Updated By :.4,Updated On :.2,Financial Bid Opening Date:,Document :.3,Tender Stage
Assam Power Distribution Company Ltd||CGM(Rural Electrification) - APDCL,APDCL/CGM_RE/RDSS_Addl_HH-19,2024_APDCL_41032_1,Yes,Open Tender,Turn-key,Works,2.0,No,No,Online,No,No,No,1.0,Fee/PreQual/Technical,.rar,Techno Commercial Bid,10-Dec-2024 03:00 PM,10-Jan-2025 12:00 PM,10-Dec-2024 03:00 PM,09-Jan-2025 12:00 PM,NA ,NA ,14-Dec-2024 02:00 PM,09-Jan-2025 12:00 PM,24-Jan-2025 03:30 PM,"3,54,335",Yes,fixed,,Nil,Nil,1.0,EXTENSION NOTICE 02,Date,,1.0,SBI Bank,"4,000",Nil,Nil,No,"CGM (RE), APDCL","Bijulee Bhawan, (Annex. Building), Paltan Bazar, Ghy 1",Electrification of UE households in Jorhat Dist. of Assam under RDSS,"Electrification of additional un-electrified households at Jorhat District of Assam under the Revamped Reforms-based and Results-linked, Distribution Sector Scheme",Please refer Tender documents ,NA ,"1,77,16,751",Electrical Works,NA ,Tender,180.0,365.0,Jorhat,785001.0,Guwahati ,"O/o the CGM (RE), APDCL, Bijulee Bhawan (Annex. Building), Paltan Bazar, Ghy 1 ",13-Dec-2024 11:00 AM ,"O/o the CGM (RE), APDCL, Bijulee Bhawan",No ,No,AOC,01-Apr-2025,"INR 15,709,799.69",365.0,Manoj Sarkar,07-Apr-2025 12:41 PM,PKG19Jorhat.pdf (9030.00 KB),"Electrification of additional un-electrified households under the Revamped Reforms-based and Results-linked, Distribution Sector Scheme (RDSS) in Jorhat District of Assam",1.0,254790.0,M/S SUBANSIRI TRADING COMPANY,INR,"15,709,799.69",1,254808,M/S KRISHTI SIKHA ELECTRICAL ENTERPRISE,09-Jan-2025 01:34 AM,Rejected-AOC,Higher Quoted Value,07-Apr-2025 12:41 PM,Finance,The price bid of the subject package have been admitted and proceed for evaluation.,Manoj Sarkar,21-Mar-2025 04:23 PM,finance_66218.pdf,BOQ Comparative Chart,CGM RE APDCL,Internal,,Manoj Sarkar,01-Apr-2025 05:20 PM,finsummary_66218.pdf (613.68 KB),Assam Power Distribution Company Ltd||CGM(Rural Electrification) - APDCL,2024_APDCL_41032_1,APDCL/CGM_RE/RDSS_Addl_HH-19,Electrification of UE households in Jorhat Dist. of Assam under RDSS,Technical,The tenders of the subject package have been admitted and proceed for evaluation,Amitava Samajpati,21-Jan-2025 02:26 PM,technical_66218.pdf,CGM RE APDCL,Internal,,Amitava Samajpati,21-Jan-2025 03:11 PM,24-Jan-2025 03:30 PM,techsummary_66218.pdf (1060.24 KB),AOC
,,,,,,,,,,,,,,2.0,Finance,.xls,Price Bid,,,,,,,,,,,,,,,,2.0,NOTICE FOR PRE BID MEETING,Other,,,,,,,,,,,,,,,,,,,,,,,,,,,,AOC,,,,,,,,,,,,,2,254790,M/S SUBANSIRI TRADING COMPANY,08-Jan-2025 10:17 PM,Accepted-AOC,Lowest Quoted Value,07-Apr-2025 12:41 PM,,,,,,,,,,,,,,,,,,,,,,,,,,,,,AOC
,,,,,,,,,,,,,,,,,,,,,,,,,,,,,,,,,3.0,CORRIGENDUM 03,Technical Bid,,,,,,,,,,,,,,,,,,,,,,,,,,,,AOC,,,,,,,,,,,,,3,254832,OK Enterprise,09-Jan-2025 11:12 AM,Rejected-Finance,Non Responsive bidder,01-Apr-2025 05:20 PM,,,,,,,,,,,,,,,,,,,,,,,,,,,,,AOC
,,,,,,,,,,,,,,,,,,,,,,,,,,,,,,,,,,,,,,,,,,,,,,,,,,,,,,,,,,,,,,,AOC,,,,,,,,,,,,,4,254825,SINGHI INFRAPOWER PROJECTS PRIVATE LIMITED,09-Jan-2025 11:44 AM,Rejected-AOC,Higher Quoted Value,07-Apr-2025 12:41 PM,,,,,,,,,,,,,,,,,,,,,,,,,,,,,AOC
,,,,,,,,,,,,,,,,,,,,,,,,,,,,,,,,,,,,,,,,,,,,,,,,,,,,,,,,,,,,,,,AOC,,,,,,,,,,,,,5,252270,SURAJ KUMAR SHARMA,01-Jan-2025 03:11 PM,Rejected-AOC,Higher Quoted Value,07-Apr-2025 12:41 PM,,,,,,,,,,,,,,,,,,,,,,,,,,,,,AOC
,,,,,,,,,,,,,,,,,,,,,,,,,,,,,,,,,,,,,,,,,,,,,,,,,,,,,,,,,,,,,,,AOC,,,,,,,,,,,,,6,253745,Win Power Infracon LLP,01-Jan-2025 10:51 PM,Rejected-Technical,Failed to comply with technical eligibility criteria of the BID,21-Jan-2025 03:11 PM,,,,,,,,,,,,,,,,,,,,,,,,,,,,,AOC
