Organisation Chain,Tender Reference Number,Tender ID,Withdrawal Allowed,Tender Type,Form of contract,Tender Category,No. of Covers,General Technical Evaluation Allowed,ItemWise Technical Evaluation Allowed,Payment Mode,Is Multi Currency Allowed For BOQ,Is Multi Currency Allowed For Fee,Allow Two Stage Bidding,Cover No,Cover,Document Type,Description,Publish Date,Bid Opening Date,Document Download / Sale Start Date,Document Download / Sale End Date,Clarification Start Date,Clarification End Date,Bid Submission Start Date,Bid Submission End Date,Financial Bid Opening Date,EMD Amount in ₹,EMD Exemption Allowed,EMD Fee Type,EMD Percentage,EMD Payable To,EMD Payable At,S.No,Corrigendum Title,Corrigendum Type,View,S.No.1,Bank Name,Tender Fee in ₹,Fee Payable To,Fee Payable At,Tender Fee Exemption Allowed,Name,Address,Title,Work Description,Pre Qualification Details,Independent External Monitor/Remarks,Tender Value in ₹,Product Category,Sub category,Contract Type,Bid Validity(Days),Period Of Work(Days),Location,Pincode,Pre Bid Meeting Place,Pre Bid Meeting Address,Pre Bid Meeting Date,Bid Opening Place,Should Allow NDA Tender,Allow Preferential Bidder,Tender Stage,Contract Date :,Contract Value :,Work Completion Period in days :,Updated By :,Updated on :,AOC document :,S.No,Bid Number,Bidder Name,Awarded Currency,Awarded Value,S.No.1,Bid Number.1,Bidder Name.1,Submitted Date,Status,Remarks,Status Updated On,Type :,Summary :,Updated By :.1,Updated On :,Document :,BOQ Comparative Chart :,Committee Chairperson/Co-ordinator Name :,Committee Chairperson/Co-ordinator Type :,Committee Members :,Updated By :.2,Updated on :.1,Document :.1,Organisation Chain :,Tender ID :,Tender Ref No :,Tender Title :,Type :.1,Summary :.1,Updated By :.3,Updated On :.1,Document :.2,Committee Chairperson/Co-ordinator Name :.1,Committee Chairperson/Co-ordinator Type :.1,Committee Members :.1,Updated By :.4,Updated On :.2,Financial Bid Opening Date:,Document :.3,Tender Stage
Assam Power Distribution Company Ltd||CGM(PP and D) - APDCL,APDCL/CGM(PPD)/AIreading/23/01,2023_APDCL_34273_1,Yes,Open Tender,Turn-key,Services,2.0,No,No,Online,No,No,No,1.0,Fee/PreQual/Technical,.rar,Techno commercial documents,29-Nov-2023 01:00 PM,03-Jan-2024 03:00 PM,29-Nov-2023 01:00 PM,02-Jan-2024 02:00 PM,29-Nov-2023 01:00 PM ,04-Dec-2023 04:00 PM ,21-Dec-2023 12:00 PM,02-Jan-2024 02:00 PM,21-Jun-2024 12:00 PM,"10,00,000",Yes,fixed,,Nil,Nil,1.0,Date Extension Corrigendum,Date,,1.0,SBI Bank,"7,000",Nil,Nil,Yes,Chief General Manager PPnD APDCL,Office of CGM PPnD APDCL 6th floor Bijulee Bhawan Paltanbazar Guwahati,Implementation of Artificial Intelligence Based Meter Reading Solution in APDCL,Implementation of Artificial Intelligence Based Meter Reading Solution in APDCL,Please refer Tender documents. ,NA ,,Information Technology,NA ,Tender,180.0,730.0,Bijulee Bhawan Guwahati,781001.0,Online mode ,The link for the online pre-bid meeting to be uploaded in due course of time ,07-Dec-2023 12:00 PM ,Office of the CGM PPnD APDCL,No ,No,AOC,01-Apr-2025,INR 22.42,730.0,Sanidhya Baruah,01-Apr-2025 05:02 PM,PragyawareLOA.pdf (844.00 KB),1.0,217441.0,Pragyaware Informatics Private Limited,INR,22.42,1,217335,ALTRU MANAGEMENT ENTERPRISES PRIVATE LIMITED,02-Jan-2024 01:40 PM,Rejected-Technical,Non Responsive,18-Jun-2024 04:13 PM,Finance,Bid opened on 21-Jun-2024,Asif Nasir,21-Jun-2024 12:24 PM,,BOQ Comparative Chart,MD APDCL,Internal,,Sanidhya Baruah,01-Apr-2025 04:59 PM,finsummary_55425.pdf (843.90 KB),Assam Power Distribution Company Ltd||CGM(PP and D) - APDCL,2023_APDCL_34273_1,APDCL/CGM(PPD)/AIreading/23/01,Implementation of Artificial Intelligence Based Meter Reading Solution in APDCL,Technical,Bid Opening Summary,Chayanika Gogoi,04-Jan-2024 02:35 PM,technical_55425.pdf,MD APDCL,Internal,,Chayanika Gogoi,18-Jun-2024 04:13 PM,21-Jun-2024 12:00 PM,techsummary_55425.pdf (1369.91 KB),AOC
,,,,,,,,,,,,,,2.0,Finance,.xls,Price bid schedule,,,,,,,,,,,,,,,,2.0,Prebid Meeting Link,Other,,,,,,,,,,,,,,,,,,,,,,,,,,,,AOC,,,,,,,,,,,,2,217464,INVENTIVE SOFTWARE SOLUTIONS PVT LTD,02-Jan-2024 10:33 AM,Rejected-Technical,Non Responsive,18-Jun-2024 04:13 PM,,,,,,,,,,,,,,,,,,,,,,,,,,,,,AOC
,,,,,,,,,,,,,,,,,,,,,,,,,,,,,,,,,3.0,Technical Corrigendum,Technical Bid,,,,,,,,,,,,,,,,,,,,,,,,,,,,AOC,,,,,,,,,,,,3,218435,Medhaj Techno Concept Private Limited,02-Jan-2024 01:44 PM,Rejected-Technical,Non Responsive,18-Jun-2024 04:13 PM,,,,,,,,,,,,,,,,,,,,,,,,,,,,,AOC
,,,,,,,,,,,,,,,,,,,,,,,,,,,,,,,,,,,,,,,,,,,,,,,,,,,,,,,,,,,,,,,AOC,,,,,,,,,,,,4,217441,Pragyaware Informatics Private Limited,02-Jan-2024 11:29 AM,Accepted-AOC,L1,01-Apr-2025 05:02 PM,,,,,,,,,,,,,,,,,,,,,,,,,,,,,AOC
,,,,,,,,,,,,,,,,,,,,,,,,,,,,,,,,,,,,,,,,,,,,,,,,,,,,,,,,,,,,,,,AOC,,,,,,,,,,,,5,218394,Purbanchal Enterprise,02-Jan-2024 01:37 PM,Rejected-Finance,L2,01-Apr-2025 04:59 PM,,,,,,,,,,,,,,,,,,,,,,,,,,,,,AOC
,,,,,,,,,,,,,,,,,,,,,,,,,,,,,,,,,,,,,,,,,,,,,,,,,,,,,,,,,,,,,,,AOC,,,,,,,,,,,,6,218087,SAI COMPUTERS LIMITED,02-Jan-2024 12:24 PM,Rejected-Technical,Non Responsive,18-Jun-2024 04:13 PM,,,,,,,,,,,,,,,,,,,,,,,,,,,,,AOC
