Organisation Chain,Tender Reference Number,Tender ID,Withdrawal Allowed,Tender Type,Form of contract,Tender Category,No. of Covers,General Technical Evaluation Allowed,ItemWise Technical Evaluation Allowed,Payment Mode,Is Multi Currency Allowed For BOQ,Is Multi Currency Allowed For Fee,Allow Two Stage Bidding,Cover No,Cover,Document Type,Description,Publish Date,Bid Opening Date,Document Download / Sale Start Date,Document Download / Sale End Date,Clarification Start Date,Clarification End Date,Bid Submission Start Date,Bid Submission End Date,Financial Bid Opening Date,EMD Amount in ₹,EMD Exemption Allowed,EMD Fee Type,EMD Percentage,EMD Payable To,EMD Payable At,S.No,Bank Name,Tender Fee in ₹,Fee Payable To,Fee Payable At,Tender Fee Exemption Allowed,Name,Address,Title,Work Description,Pre Qualification Details,Independent External Monitor/Remarks,Tender Value in ₹,Product Category,Sub category,Contract Type,Bid Validity(Days),Period Of Work(Days),Location,Pincode,Pre Bid Meeting Place,Pre Bid Meeting Address,Pre Bid Meeting Date,Bid Opening Place,Should Allow NDA Tender,Allow Preferential Bidder,Tender Stage,Contract Date :,Contract Value :,Work Completion Period in days :,Updated By :,Updated on :,AOC document :,AOC Description :,S.No,Bid Number,Bidder Name,Awarded Currency,Awarded Value,S.No.1,Bid Number.1,Bidder Name.1,Submitted Date,Status,Remarks,Status Updated On,Type :,Summary :,Updated By :.1,Updated On :,Document :,BOQ Comparative Chart :,Committee Chairperson/Co-ordinator Name :,Committee Chairperson/Co-ordinator Type :,Committee Members :,Updated By :.2,Updated on :.1,Document :.1,Organisation Chain :,Tender ID :,Tender Ref No :,Tender Title :,Type :.1,Summary :.1,Updated By :.3,Updated On :.1,Document :.2,Committee Chairperson/Co-ordinator Name :.1,Committee Chairperson/Co-ordinator Type :.1,Committee Members :.1,Updated By :.4,Updated On :.2,Financial Bid Opening Date:,Document :.3,Tender Stage
Dibrugarh University,DU/PC/TQ/187/1838,2025_DU_42293_1,Yes,Open Tender,Works,Works,2.0,No,No,Online,No,No,No,1.0,Fee/PreQual/Technical,.pdf,Tender Fee and EMD Fee,22-Jan-2025 05:00 PM,13-Feb-2025 12:00 PM,22-Jan-2025 06:00 PM,12-Feb-2025 05:00 PM,22-Jan-2025 05:00 PM ,12-Feb-2025 05:00 PM ,23-Jan-2025 09:00 AM,12-Feb-2025 05:00 PM,13-Feb-2025 04:30 PM,"1,94,247",No,percentage,2.0%,Nil,Nil,1.0,SBI Bank,"1,000",Nil,Nil,No,"The Registrar, Dibrugarh University","Office of The Registrar, Dibrugarh University",Raising Low Laying Area by Earth Filling (Right side) Leading from Jyoti Batchara to Guest House Road at D.U. (Civil works),Raising Low Laying Area by Earth Filling (Right side) Leading from Jyoti Batchara to Guest House Road at D.U. (Civil works),Please Refer Tender Documents ,NA ,"97,12,335",Civil Works,NA ,Tender,45.0,90.0,Dibrugarh University,786004.0,NA ,NA ,NA ,Dibrugarh University,No ,No,AOC,09-Apr-2025,"INR 8,012,729.55",90.0,Paramananda Sonowal,09-Apr-2025 04:44 PM,AOC.pdf (3342.00 KB),AOC,1.0,257971.0,Sri Shyamal Kumar Gogoi,INR,"8,012,729.55",1,258111,Dhiraj Gogoi,12-Feb-2025 04:48 PM,Rejected-AOC,L2 bidder,09-Apr-2025 04:45 PM,Finance,4 bids has been evaluated for the financial statement.,Diganta Saikia,13-Feb-2025 05:28 PM,finance_67981.pdf,BOQ Comparative Chart,Prof. L.R.Saikia,Internal,"Dr. Mukul Chandra Bora, Dr. Manash Pratim Barman, Dr. Bhaskar jyoti Saikia, Mr. P.P. Bora",Paramananda Sonowal,13-Feb-2025 05:37 PM,finsummary_67981.pdf (2524.06 KB),Dibrugarh University,2025_DU_42293_1,DU/PC/TQ/187/1838,Raising Low Laying Area by Earth Filling (Right side) Leading from Jyoti Batchara to Guest House Road at D.U. (Civil works),Technical,5 bids submitted. 4 bids found to be technically qualified.,Paramananda Sonowal,13-Feb-2025 04:16 PM,technical_67981.pdf,Prof. L.R.Saikia,Internal,"Dr. Mukul Chandra Bora, Dr. Manash Pratim Barman, Dr. Bhaskar Jyoti Saikia, Mr. P.P. Bora",Paramananda Sonowal,13-Feb-2025 04:27 PM,13-Feb-2025 04:30 PM,techsummary_67981.pdf (2524.06 KB),AOC
,,,,,,,,,,,,,,,,.pdf,Technical Bid /SBD,,,,,,,,,,,,,,,,,,,,,,,,,,,,,,,,,,,,,,,,,,AOC,,,,,,,,,,,,,2,258199,KUSHAL HAZARIKA,12-Feb-2025 02:42 PM,Rejected-AOC,L3 bidder,09-Apr-2025 04:45 PM,,,,,,,,,,,,,,,,,,,,,,,,,,,,,AOC
,,,,,,,,,,,,,,2.0,Finance,.xls,BOQ,,,,,,,,,,,,,,,,,,,,,,,,,,,,,,,,,,,,,,,,,,AOC,,,,,,,,,,,,,3,258068,Probin Dutta,12-Feb-2025 03:06 PM,Rejected-AOC,L4 bidder,09-Apr-2025 04:45 PM,,,,,,,,,,,,,,,,,,,,,,,,,,,,,AOC
,,,,,,,,,,,,,,,,.pdf,FOB,,,,,,,,,,,,,,,,,,,,,,,,,,,,,,,,,,,,,,,,,,AOC,,,,,,,,,,,,,4,257971,Sri Shyamal Kumar Gogoi,12-Feb-2025 03:44 PM,Accepted-AOC,L1 bidder,09-Apr-2025 04:45 PM,,,,,,,,,,,,,,,,,,,,,,,,,,,,,AOC
,,,,,,,,,,,,,,,,,,,,,,,,,,,,,,,,,,,,,,,,,,,,,,,,,,,,,,,,,,,AOC,,,,,,,,,,,,,5,258109,Sri Sunil Kr. Borah,12-Feb-2025 04:09 PM,Not Admitted-Fee/PreQual/Technical,Not Complied with technical specification,13-Feb-2025 04:16 PM,,,,,,,,,,,,,,,,,,,,,,,,,,,,,AOC
