Organisation Chain,Tender Reference Number,Tender ID,Withdrawal Allowed,Tender Type,Form of contract,Tender Category,No. of Covers,General Technical Evaluation Allowed,ItemWise Technical Evaluation Allowed,Payment Mode,Is Multi Currency Allowed For BOQ,Is Multi Currency Allowed For Fee,Allow Two Stage Bidding,Cover No,Cover,Document Type,Description,Publish Date,Bid Opening Date,Document Download / Sale Start Date,Document Download / Sale End Date,Clarification Start Date,Clarification End Date,Bid Submission Start Date,Bid Submission End Date,Financial Bid Opening Date,EMD Amount in ₹,EMD Exemption Allowed,EMD Fee Type,EMD Percentage,EMD Payable To,EMD Payable At,S.No,Corrigendum Title,Corrigendum Type,View,S.No.1,Bank Name,Tender Fee in ₹,Fee Payable To,Fee Payable At,Tender Fee Exemption Allowed,Name,Address,Title,Work Description,Pre Qualification Details,Independent External Monitor/Remarks,Tender Value in ₹,Product Category,Sub category,Contract Type,Bid Validity(Days),Period Of Work(Days),Location,Pincode,Pre Bid Meeting Place,Pre Bid Meeting Address,Pre Bid Meeting Date,Bid Opening Place,Should Allow NDA Tender,Allow Preferential Bidder,Tender Stage,Contract Date :,Contract Value :,Work Completion Period in days :,Updated By :,Updated on :,AOC document :,AOC Description :,S.No,Bid Number,Bidder Name,Awarded Currency,Awarded Value,S.No.1,Bid Number.1,Bidder Name.1,Submitted Date,Status,Remarks,Status Updated On,Type :,Summary :,Updated By :.1,Updated On :,Document :,BOQ Comparative Chart :,Committee Chairperson/Co-ordinator Name :,Committee Chairperson/Co-ordinator Type :,Committee Members :,Updated By :.2,Updated on :.1,Document :.1,Organisation Chain :,Tender ID :,Tender Ref No :,Tender Title :,Type :.1,Summary :.1,Updated By :.3,Updated On :.1,Document :.2,Committee Chairperson/Co-ordinator Name :.1,Committee Chairperson/Co-ordinator Type :.1,Committee Members :.1,Updated By :.4,Updated On :.2,Financial Bid Opening Date:,Document :.3,Tender Stage
Assam Electricity Grid Corporation Ltd||CGM (T and T),Tech-250/Railways/Deepor Beel/(Pkg-A)/BID,2024_AEGCL_39031_1,Yes,Open Tender,Works,Works,2.0,No,No,Online,No,No,No,1.0,Fee/PreQual/Technical,.rar,Technocommercial,16-Sep-2024 06:00 PM,19-Oct-2024 05:00 PM,16-Sep-2024 06:00 PM,18-Oct-2024 12:00 PM,16-Sep-2024 06:00 PM ,23-Sep-2024 05:00 PM ,16-Sep-2024 06:00 PM,18-Oct-2024 12:00 PM,11-Dec-2024 02:00 PM,"8,64,000",Yes,fixed,,Nil,Nil,1.0,Corrigendum I,Date,,1.0,SBI Bank,"2,000",Nil,Nil,No,"Chief General Manager, OnM (LAR)","Bijulee Bhawan, Platan Bazar",Height Raising/ Shifting of 220KV Mirza-Sarusajai D/C Transmission line for elevated corridor of Railway line near Deepor Beel area under Deposit Scheme-PACKAGE A,Height Raising/ Shifting of 220KV Mirza-Sarusajai D/C Transmission line for elevated corridor of Railway line near Deepor Beel area under Deposit Scheme-PACKAGE A,Please refer Tender documents. ,NA ,"4,31,70,073",Electrical Works,NA ,Tender,180.0,450.0,Deepor Beel area near Pamuhi,781131.0,NA ,NA ,NA ,"Bijulee Bhawan, Platan Bazar",No ,No,AOC,02-Apr-2025,"INR 40,424,154",450.0,PRIYABRATA DEB,02-Apr-2025 03:44 PM,Contract_Pkg_A.pdf (12528.00 KB),Including GST @ 18%,1.0,242480.0,GANAPATI ENTERPRISE,INR,"40,424,154",1.0,242480.0,GANAPATI ENTERPRISE,17-Oct-2024 05:22 PM,Accepted-AOC,L1 Bidder,02-Apr-2025 03:45 PM,Finance,Financial bid opened on 11.12.2024,ASISH DAS,11-Dec-2024 05:36 PM,,BOQ Comparative Chart,CGM (OnM) LAR,Internal,,PRIYABRATA DEB,02-Apr-2025 03:39 PM,finsummary_63238.pdf (178.31 KB),Assam Electricity Grid Corporation Ltd||CGM (T and T),2024_AEGCL_39031_1,Tech-250/Railways/Deepor Beel/(Pkg-A)/BID,Height Raising/ Shifting of 220KV Mirza-Sarusajai D/C Transmission line for elevated corridor of Railway line near Deepor Beel area under Deposit Scheme-PACKAGE A,Technical,Technical bid opened on 19.10.2024,Rahul Satnami,19-Oct-2024 05:17 PM,,CGM(OnM)LAR,Internal,,PRIYABRATA DEB,11-Dec-2024 11:39 AM,11-Dec-2024 02:00 PM,techsummary_63238.pdf (155.10 KB),AOC
,,,,,,,,,,,,,,,,.rar,MA,,,,,,,,,,,,,,,,,,,,,,,,,,,,,,,,,,,,,,,,,,,,,,AOC,,,,,,,,,,,,,2.0,245246.0,Krishna Urja Construction LLP,18-Oct-2024 11:21 AM,Rejected-Finance,L3 Bidder,02-Apr-2025 03:39 PM,,,,,,,,,,,,,,,,,,,,,,,,,,,,,AOC
,,,,,,,,,,,,,,,,.rar,Type test and GTP,,,,,,,,,,,,,,,,,,,,,,,,,,,,,,,,,,,,,,,,,,,,,,AOC,,,,,,,,,,,,,3.0,241499.0,Mega Electricals,06-Oct-2024 04:29 PM,Rejected-Finance,L2 Bidder,02-Apr-2025 03:39 PM,,,,,,,,,,,,,,,,,,,,,,,,,,,,,AOC
,,,,,,,,,,,,,,,,.rar,Experience,,,,,,,,,,,,,,,,,,,,,,,,,,,,,,,,,,,,,,,,,,,,,,AOC,,,,,,,,,,,,,4.0,245168.0,M/S ABU BAKKAR SIDDIK,18-Oct-2024 11:48 AM,Rejected-Technical,Non responsive to the requirement of the bidding document,11-Dec-2024 11:39 AM,,,,,,,,,,,,,,,,,,,,,,,,,,,,,AOC
,,,,,,,,,,,,,,,,.rar,Financial,,,,,,,,,,,,,,,,,,,,,,,,,,,,,,,,,,,,,,,,,,,,,,AOC,,,,,,,,,,,,,,,,,,,,,,,,,,,,,,,,,,,,,,,,,,,,,,,,AOC
,,,,,,,,,,,,,,2.0,Finance,.xls,BOQ,,,,,,,,,,,,,,,,,,,,,,,,,,,,,,,,,,,,,,,,,,,,,,AOC,,,,,,,,,,,,,,,,,,,,,,,,,,,,,,,,,,,,,,,,,,,,,,,,AOC
