Organisation Chain,Tender Reference Number,Tender ID,Withdrawal Allowed,Tender Type,Form of contract,Tender Category,No. of Covers,General Technical Evaluation Allowed,ItemWise Technical Evaluation Allowed,Payment Mode,Is Multi Currency Allowed For BOQ,Is Multi Currency Allowed For Fee,Allow Two Stage Bidding,Cover No,Cover,Document Type,Description,Publish Date,Bid Opening Date,Document Download / Sale Start Date,Document Download / Sale End Date,Clarification Start Date,Clarification End Date,Bid Submission Start Date,Bid Submission End Date,Financial Bid Opening Date,EMD Amount in ₹,EMD Exemption Allowed,EMD Fee Type,EMD Percentage,EMD Payable To,EMD Payable At,S.No,Conversion rate in ₹,1,NA,2,NA.1,3,NA.2,4,NA.3,5,NA.4,S.No.1,Corrigendum Title,Corrigendum Type,View,S.No.2,Bank Name,Tender Fee in ₹,Fee Payable To,Fee Payable At,Tender Fee Exemption Allowed,Name,Address,Title,Work Description,Pre Qualification Details,Independent External Monitor/Remarks,Tender Value in ₹,Product Category,Sub category,Contract Type,Bid Validity(Days),Period Of Work(Days),Location,Pincode,Pre Bid Meeting Place,Pre Bid Meeting Address,Pre Bid Meeting Date,Bid Opening Place,Should Allow NDA Tender,Allow Preferential Bidder,Tender Stage,S.No,Bid Number,Bidder Name,Submitted Date,Status,Remarks,Status Updated On,Organisation Chain :,Tender ID :,Tender Ref No :,Tender Title :,Tender Stage
Department of Water Resources-Externally Aided Project||WRD-ADB Funded Procurements,WRD/ADB/OCB-Goods/03,2023_WREAP_32081_1,Yes,Open Tender,Supply,Goods,2.0,No,No,Online,Yes,No,No,1.0,Fee/PreQual/Technical,.pdf,TECHNICAL DOCUMENTS,14-Aug-2023 05:00 PM,06-Oct-2023 04:15 PM,14-Aug-2023 05:00 PM,06-Oct-2023 04:00 PM,14-Aug-2023 05:00 PM ,21-Aug-2023 02:00 PM ,25-Sep-2023 10:00 AM,06-Oct-2023 04:00 PM,18-Dec-2023 03:00 PM,"28,00,000",Yes,fixed,,Nil,Nil,Currency,US Dollar,European Dollar,AustriliaDollar,Japanese Yen,British Pound,,,,,,,1.0,ADDENDUM III,BOQ,,1.0,SBI Bank,0.0,Nil,Nil,No,Chief Engineer Water Resources Department,"O/O Chief Engineer Water Resources Department, Basistha, Guwahati 29","Supply of Geo-bags Type-A, Geo-textile fabric sheet and Sewing Thread for Palashbari and Gumi/ Guwahati West subproject Lot 3","Supply of Geo-bags Type-A, Geo-textile fabric sheet and Sewing Thread for Palashbari and Gumi/ Guwahati West subproject Lot 3",Please refer Tender documents. ,NA ,,Supply of Materials,NA ,Tender,120.0,540.0,"Palashbari, Guwahati West",781128.0,GUWAHATI ,"Conference Hall, Water Resources Department, 1stFloor, Assam Water Centre Kundil Nagar, Basistha, Guwahati 781029, Assam, India ",22-Aug-2023 02:00 PM ,"Assam Water Centre Kundil Nagar, Basistha, Guwahat",No ,No,AOC,1,202929,B. J. Geo-Textile Ltd.,06-Oct-2023 07:02 AM,Rejected-Technical,Technically Non Responsive,16-Dec-2023 11:29 PM,Department of Water Resources-Externally Aided Project||WRD-ADB Funded Procurements,2023_WREAP_32081_1,WRD/ADB/OCB-Goods/03,"Supply of Geo-bags Type-A, Geo-textile fabric sheet and Sewing Thread for Palashbari and Gumi/ Guwahati West subproject Lot 3",AOC
,,,,,,,,,,,,,,2.0,Finance,.xls,FINANCIAL BID,,,,,,,,,,,,,,,,,,,,,,,,,,,,2.0,ADDENDUM V,Date,,,,,,,,,,,,,,,,,,,,,,,,,,,,AOC,2,202808,Confidence Infrastructure Ltd.,06-Oct-2023 01:54 PM,Rejected-Technical,Technically Non Responsive,16-Dec-2023 11:29 PM,,,,,AOC
,,,,,,,,,,,,,,,,.pdf,Price Bid Submission Sheet,,,,,,,,,,,,,,,,,,,,,,,,,,,,3.0,ADDENDUM VI,Technical Bid,,,,,,,,,,,,,,,,,,,,,,,,,,,,AOC,3,202844,SKAPS INDIA USA JV,04-Oct-2023 06:30 PM,Rejected-AOC,NOT QUALIFIED FOR AOC,15-May-2024 04:12 PM,,,,,AOC
,,,,,,,,,,,,,,,,,,,,,,,,,,,,,,,,,,,,,,,,,,,,,,,,,,,,,,,,,,,,,,,,,,,,,,,,,,,AOC,4,202896,SUNTECH GEOTEXTILE PVT. LTD.,05-Oct-2023 07:11 PM,Rejected-AOC,NOT QUALIFIED FOR AOC,15-May-2024 04:12 PM,,,,,AOC
,,,,,,,,,,,,,,,,,,,,,,,,,,,,,,,,,,,,,,,,,,,,,,,,,,,,,,,,,,,,,,,,,,,,,,,,,,,AOC,5,202625,TECHFAB INDIA INDUSTRIES LIMITED,04-Oct-2023 02:45 PM,Accepted-AOC,AWARDED,15-May-2024 04:12 PM,,,,,AOC
