Tender ID,tender_externalreference,tender_title,Work Description,Tender Category,Tender Type,Form of contract,Product Category,Is Multi Currency Allowed For BOQ,Allow Two Stage Bidding,Independent External Monitor/Remarks,Published Date,Pre Bid Meeting Date,Bid Validity(Days),Should Allow NDA Tender,Allow Preferential Bidder,Payment Mode,Bid Opening Date,Organisation Chain,location,Pincode,No of Bids Received,Tender Value in ₹,Bidder Name,Awarded Value,Status,Contract Date :,Tender Stage,Department,is_flood_tender,positive_keywords_dict,negative_keywords_dict,Season,Scheme,Erosion,Roads_Bridges_Embkt,Response Type,Flood Response - Subhead
2019_AEGCL_15506_1,AEGCL/MD/CGM (O AND M) / Flood /2019(G),Construction of Flood Effected Towers and associated Works (220KV and 132 KV) on pile/normal foundation in place of river eroded tower due to flash flood in the year 2019,Construction of Flood Effected Towers and associated Works (220KV and 132 KV) on pile/normal foundation in place of river eroded tower due to flash flood in the year 2019,Works,Open Tender,Works,Electrical Works,No,No,NA ,24-Dec-2019 10:00 AM,NA ,180.0,No ,No,Online,19-Feb-2020 02:00 PM,Assam Electricity Grid Corporation Ltd||CGM (T and T),ASSAM,781001.0,2.0,"2,43,91,345",DABJIT GOGOI,22454738.0,Accepted-AOC,18-Nov-2020,AOC,Assam Electricity Grid Corporation Ltd||CGM (T and T),True,"{'Flood': 5, 'Embankment': 0, 'embkt': 0, 'Relief': 0, 'Erosion': 0, 'SDRF': 0, 'Inundation': 0, 'Hydrology': 0, 'Silt': 0, 'Siltation': 0, 'Bund': 0, 'Trench': 0, 'Breach': 0, 'Culvert': 0, 'Sluice': 0, 'Dyke': 0, 'Storm water drain': 0, 'Emergency': 0, 'Immediate': 0, 'IM': 0, 'AE': 0, 'A E': 0, 'AAPDA MITRA': 0}","{'Floodlight': 0, 'Flood Light': 0, 'GAS': 0, 'FIFA': 0, 'pipe': 0, 'pipes': 0, 'covid': 0}",Post-Monsoon,,True,False,Others,
2019_PWBNH_14304_1,PWD-NH(R )/RAN /SOPD/2019-20/15,Construction of CC Cover Drain with RCC slab and Box Culvert for feeder road from Ch-102.552 to Ch-105.602 km of NH-15 under SOPD for the year 2019-20 under Rangia NH Division in the state of Assam,Construction of CC Cover Drain with RCC slab and Box Culvert for feeder road from Ch-102.552 to Ch-105.602 km of NH-15 under SOPD for the year 2019-20 under Rangia NH Division in the state of Assam,Works,Open Tender,Item Rate,Civil Works – Highways,No,No,NA ,01-Oct-2019 04:30 PM,04-Oct-2019 12:00 PM ,180.0,No ,No,Offline,09-Oct-2019 04:00 PM,Public Works Building and NH Department||Chief Engineer-Building - PWBNH||SE-Planning - PWBNH,Rangia,781354.0,2.0,"19,71,99,258",ANIL DAS,197195922.6,Accepted-AOC,19-Nov-2020,AOC,Public Works Building and NH Department||Chief Engineer-Building - PWBNH||SE-Planning - PWBNH,True,"{'Flood': 0, 'Embankment': 0, 'embkt': 0, 'Relief': 0, 'Erosion': 0, 'SDRF': 0, 'Inundation': 0, 'Hydrology': 0, 'Silt': 0, 'Siltation': 0, 'Bund': 0, 'Trench': 0, 'Breach': 0, 'Culvert': 2, 'Sluice': 0, 'Dyke': 0, 'Storm water drain': 0, 'Emergency': 0, 'Immediate': 0, 'IM': 0, 'AE': 0, 'A E': 0, 'AAPDA MITRA': 0}","{'Floodlight': 0, 'Flood Light': 0, 'GAS': 0, 'FIFA': 0, 'pipe': 0, 'pipes': 0, 'covid': 0}",Monsoon,SOPD,False,True,Others,
2020_BTCWR_18858_2,NIT Addl.CE/KZ/WR/E-T/AC/104/718-A dt.03.10.2020,Anti erosion measures at different reaches Kadamtola Adibashi Chuba Bholichuba from river Kawadanga on its banks under RIDF NABARD-XXV,Anti erosion measures at different reaches Kadamtola Adibashi Chuba Bholichuba from river Kawadanga on its banks under RIDF NABARD-XXV,Works,Open Tender,Works,Civil Works,No,No,NA ,05-Oct-2020 10:00 AM,NA ,180.0,No ,No,Online,28-Oct-2020 04:00 PM,Bodoland Territorial Council-WRD,At Kadamtola Adibashi village area,783372.0,2.0,"1,48,51,337",Bichitra Baruah,14842014.36,Accepted-AOC,31-Oct-2020,AOC,Bodoland Territorial Council-WRD,True,"{'Flood': 0, 'Embankment': 0, 'embkt': 0, 'Relief': 0, 'Erosion': 2, 'SDRF': 0, 'Inundation': 0, 'Hydrology': 0, 'Silt': 0, 'Siltation': 0, 'Bund': 0, 'Trench': 0, 'Breach': 0, 'Culvert': 0, 'Sluice': 0, 'Dyke': 0, 'Storm water drain': 0, 'Emergency': 0, 'Immediate': 0, 'IM': 0, 'AE': 0, 'A E': 0, 'AAPDA MITRA': 0}","{'Floodlight': 0, 'Flood Light': 0, 'GAS': 0, 'FIFA': 0, 'pipe': 0, 'pipes': 0, 'covid': 0}",Monsoon,RIDF,True,False,Others,
2020_DoWR_16728_2,HAILAKANDI/2019-20/SDRF/II,Immediate measures for restoration of damages on L/B of river Katakhal at Mohammedpur area for the year 2019-20 under SDRF RETENDER,Immediate measures for restoration of damages on L/B of river Katakhal at Mohammedpur area for the year 2019-20 under SDRF,Works,Open Tender,Works,Civil Works,No,No,NA ,19-Mar-2020 06:00 PM,NA ,180.0,No ,No,Online,30-Apr-2020 02:00 PM,Department of Water Resources||Chief Engineer - DoWR,HAILAKANDI,788152.0,3.0,"2,39,99,975",CMCASSOCIATESNURULISLAM JV,23519924.75,Accepted-AOC,02-Nov-2020,AOC,Department of Water Resources||Chief Engineer - DoWR,True,"{'Flood': 0, 'Embankment': 0, 'embkt': 0, 'Relief': 0, 'Erosion': 0, 'SDRF': 3, 'Inundation': 0, 'Hydrology': 0, 'Silt': 0, 'Siltation': 0, 'Bund': 0, 'Trench': 0, 'Breach': 0, 'Culvert': 0, 'Sluice': 0, 'Dyke': 0, 'Storm water drain': 0, 'Emergency': 0, 'Immediate': 2, 'IM': 0, 'AE': 0, 'A E': 0, 'AAPDA MITRA': 0}","{'Floodlight': 0, 'Flood Light': 0, 'GAS': 0, 'FIFA': 0, 'pipe': 0, 'pipes': 0, 'covid': 0}",Pre-Monsoon,SDRF,False,False,Repair and Restoration,{'restoration': 2}
2020_DoWR_17841_1,NALBARI /2019-20/SDRF/I,Pagladia from G.K. Ali to N.T. Road Ph-I,Immediate measures to M.E. along BB of river Pagladia from G.K. Ali to N.T. Road -Ph-I (US) (Bank Restoration works at 17th Km Moriadonga RB) for 2019-20,Works,Open Tender,Works,Civil Works,No,No,NA ,09-Jun-2020 06:00 PM,NA ,180.0,No ,No,Online,19-Jun-2020 02:05 PM,Department of Water Resources||Chief Engineer - DoWR,Nalbari,781335.0,2.0,"1,89,09,357",Ashok Kumar Agarwalla,,Accepted-AOC,,AOC,Department of Water Resources||Chief Engineer - DoWR,True,"{'Flood': 0, 'Embankment': 0, 'embkt': 0, 'Relief': 0, 'Erosion': 0, 'SDRF': 1, 'Inundation': 0, 'Hydrology': 0, 'Silt': 0, 'Siltation': 0, 'Bund': 0, 'Trench': 0, 'Breach': 0, 'Culvert': 0, 'Sluice': 0, 'Dyke': 0, 'Storm water drain': 0, 'Emergency': 0, 'Immediate': 1, 'IM': 0, 'AE': 0, 'A E': 0, 'AAPDA MITRA': 0}","{'Floodlight': 0, 'Flood Light': 0, 'GAS': 0, 'FIFA': 0, 'pipe': 0, 'pipes': 0, 'covid': 0}",Monsoon,SDRF,False,True,Repair and Restoration,{'restoration': 1}
2020_DoWR_17847_1,DIB/RIDF/ROMAIGHAT/2020-21/1,Anti-erosion measures to Tengakhat bund section -III on R/B of river Buridehing up to Jokai R.F. at 11th and 12th km,Anti-erosion measures to Tengakhat bund section -III on R/B of river Buridehing up to Jokai R.F. at 11th and 12th km,Works,Open Tender,Works,Civil Works,No,No,NA ,09-Jun-2020 06:00 PM,16-Jun-2020 12:00 PM ,180.0,No ,No,Online,15-Jul-2020 02:00 PM,Department of Water Resources||Chief Engineer - DoWR,Dibrugarh,786005.0,2.0,"2,49,99,882",AMRIT CHETIA,,Accepted-AOC,,AOC,Department of Water Resources||Chief Engineer - DoWR,True,"{'Flood': 0, 'Embankment': 0, 'embkt': 0, 'Relief': 0, 'Erosion': 2, 'SDRF': 0, 'Inundation': 0, 'Hydrology': 0, 'Silt': 0, 'Siltation': 0, 'Bund': 2, 'Trench': 0, 'Breach': 0, 'Culvert': 0, 'Sluice': 0, 'Dyke': 0, 'Storm water drain': 0, 'Emergency': 0, 'Immediate': 0, 'IM': 0, 'AE': 0, 'A E': 0, 'AAPDA MITRA': 0}","{'Floodlight': 0, 'Flood Light': 0, 'GAS': 0, 'FIFA': 0, 'pipe': 0, 'pipes': 0, 'covid': 0}",Monsoon,RIDF,True,True,Others,
2020_DoWR_17978_1,HKD/2020-21/CMSPLPKG/4,R/S to dyke along R/B of river Katakhal from Burniebrease T.E. to Burniepar Ferryghat for 2019-20 (Under C.M. Special package),R/S to dyke along R/B of river Katakhal from Burniebrease T.E. to Burniepar Ferryghat for 2019-20 (Under C.M. Special package),Works,Open Tender,Works,Civil Works,No,No,NA ,18-Jun-2020 06:55 PM,NA ,180.0,No ,No,Online,15-Jul-2020 02:00 PM,Department of Water Resources||Chief Engineer - DoWR,"BURNIEBREASE T.E., HAILAKANDI",788801.0,3.0,"1,99,99,629",DILWAR HUSSAIN LASKAR,14409625.33,Accepted-AOC,05-Nov-2020,AOC,Department of Water Resources||Chief Engineer - DoWR,True,"{'Flood': 0, 'Embankment': 0, 'embkt': 0, 'Relief': 0, 'Erosion': 0, 'SDRF': 0, 'Inundation': 0, 'Hydrology': 0, 'Silt': 0, 'Siltation': 0, 'Bund': 0, 'Trench': 0, 'Breach': 0, 'Culvert': 0, 'Sluice': 0, 'Dyke': 2, 'Storm water drain': 0, 'Emergency': 0, 'Immediate': 0, 'IM': 0, 'AE': 0, 'A E': 0, 'AAPDA MITRA': 0}","{'Floodlight': 0, 'Flood Light': 0, 'GAS': 0, 'FIFA': 0, 'pipe': 0, 'pipes': 0, 'covid': 0}",Monsoon,,False,True,Repair and Restoration,{'r s': 2}
2020_DoWR_18033_1,KARIMGANJ/2020-21/CMSPLPKG/1,Anti-Erosion measures to protect Sarif Nagar area from the erosion of River Kakra.,Anti-Erosion measures to protect Sarif Nagar area from the erosion of River Kakra.,Works,Open Tender,Works,Civil Works,No,No,NA ,23-Jun-2020 03:00 PM,NA ,180.0,No ,No,Online,18-Jul-2020 02:00 PM,Department of Water Resources||Chief Engineer - DoWR,SARIF NAGAR,788712.0,2.0,"1,46,00,609",MOINUL HOQUE,14582135.79,Accepted-AOC,04-Nov-2020,AOC,Department of Water Resources||Chief Engineer - DoWR,True,"{'Flood': 0, 'Embankment': 0, 'embkt': 0, 'Relief': 0, 'Erosion': 4, 'SDRF': 0, 'Inundation': 0, 'Hydrology': 0, 'Silt': 0, 'Siltation': 0, 'Bund': 0, 'Trench': 0, 'Breach': 0, 'Culvert': 0, 'Sluice': 0, 'Dyke': 0, 'Storm water drain': 0, 'Emergency': 0, 'Immediate': 0, 'IM': 0, 'AE': 0, 'A E': 0, 'AAPDA MITRA': 0}","{'Floodlight': 0, 'Flood Light': 0, 'GAS': 0, 'FIFA': 0, 'pipe': 0, 'pipes': 0, 'covid': 0}",Monsoon,,True,False,Others,
2020_ID_18831_1,GDI_TECH_E_TDR_18_19_164_23,"CONSTRUCTION OF APPROACH ROAD, OPERATOR SHED, DIVERSION CHANNEL, GUIDE BUND, AFFLUX BUND AND CANAL STRUCTURES OF DOLBARI KANIHA FLOW IRRIGATION SCHEME UNDER SOPD DURING THE YEAR 2019-2020","CONSTRUCTION OF APPROACH ROAD, OPERATOR SHED, DIVERSION CHANNEL, GUIDE BUND, AFFLUX BUND AND CANAL STRUCTURES OF DOLBARI KANIHA FLOW IRRIGATION SCHEME UNDER SOPD DURING THE YEAR 2019-2020",Works,Open Tender,Item Rate,Civil Works,No,No,NA ,30-Sep-2020 06:00 PM,NA ,365.0,No ,No,Online,21-Oct-2020 03:00 PM,Irrigation Department||Chief Engineer(Minor Irrigation)-Irrigation Dept,Nalbari,781369.0,2.0,"1,00,20,100",Monoj Kumar Kalita,5125637.0,Accepted-AOC,26-Nov-2020,AOC,Irrigation Department||Chief Engineer(Minor Irrigation)-Irrigation Dept,True,"{'Flood': 0, 'Embankment': 0, 'embkt': 0, 'Relief': 0, 'Erosion': 0, 'SDRF': 0, 'Inundation': 0, 'Hydrology': 0, 'Silt': 0, 'Siltation': 0, 'Bund': 4, 'Trench': 0, 'Breach': 0, 'Culvert': 0, 'Sluice': 0, 'Dyke': 0, 'Storm water drain': 0, 'Emergency': 0, 'Immediate': 0, 'IM': 0, 'AE': 0, 'A E': 0, 'AAPDA MITRA': 0}","{'Floodlight': 0, 'Flood Light': 0, 'GAS': 0, 'FIFA': 0, 'pipe': 0, 'pipes': 0, 'covid': 0}",Monsoon,SOPD,False,True,Others,
