Tender ID,tender_externalreference,tender_title,Work Description,Tender Category,Tender Type,Form of contract,Product Category,Is Multi Currency Allowed For BOQ,Allow Two Stage Bidding,Independent External Monitor/Remarks,Published Date,Pre Bid Meeting Date,Bid Validity(Days),Should Allow NDA Tender,Allow Preferential Bidder,Payment Mode,Bid Opening Date,Organisation Chain,location,Pincode,No of Bids Received,Tender Value in ₹,Bidder Name,Awarded Value,Status,Contract Date :,Tender Stage,Department,is_flood_tender,positive_keywords_dict,negative_keywords_dict,Season,Scheme,Erosion,Roads_Bridges_Embkt,Response Type,Flood Response - Subhead
2019_ICD_14485_3,AIIDC/2040/2019/48/22538 dt. 23/10/19,Drain_and_Culvert,Construction_of_Drain_and_Culvert_for_the_New_Industrial_Estate_at_Belkhuti_Kumarikata_Dist_Baksa_Section_B_C,Works,Open Tender,Item Rate,Civil Works,No,No,NA ,25-Oct-2019 02:00 PM,NA ,180.0,No ,No,Offline,11-Nov-2019 11:00 AM,Industries and Commerce Department||Assam Industrial Infrastructure Development Corporation,"Kumarikata, Baksa",781360.0,2.0,"1,25,89,500",Ganesh Daimary,10071599.51,Accepted-AOC,07-Aug-2020,AOC,Industries and Commerce Department||Assam Industrial Infrastructure Development Corporation,True,"{'Flood': 0, 'Embankment': 0, 'embkt': 0, 'Relief': 0, 'Erosion': 0, 'SDRF': 0, 'Inundation': 0, 'Hydrology': 0, 'Silt': 0, 'Siltation': 0, 'Bund': 0, 'Trench': 0, 'Breach': 0, 'Culvert': 2, 'Sluice': 0, 'Dyke': 0, 'Storm water drain': 0, 'Emergency': 0, 'Immediate': 0, 'IM': 0, 'AE': 0, 'A E': 0, 'AAPDA MITRA': 0}","{'Floodlight': 0, 'Flood Light': 0, 'GAS': 0, 'FIFA': 0, 'pipe': 0, 'pipes': 0, 'covid': 0}",Post-Monsoon,,False,True,Others,
2019_ICD_15296_1,AIIDC/2049/2019/22787 date 7/12/19,Construction of RCC outlet storm water drain from IGC Chaygaon Chatabari to Dimly River (Western side) under Upgradation of IGC Chaygaon project,Construction of RCC outlet storm water drain from IGC Chaygaon Chatabari to Dimly River (Western side) under Upgradation of IGC Chaygaon project,Works,Open Tender,Item Rate,Civil Works,No,No,NA ,10-Dec-2019 10:00 AM,NA ,180.0,No ,No,Offline,27-Dec-2019 03:00 PM,Industries and Commerce Department||Assam Industrial Infrastructure Development Corporation,IGC Chaigaon,781124.0,2.0,"1,71,86,943",M/S Dhunu Construction,14869340.0,Accepted-AOC,17-Aug-2020,AOC,Industries and Commerce Department||Assam Industrial Infrastructure Development Corporation,True,"{'Flood': 0, 'Embankment': 0, 'embkt': 0, 'Relief': 0, 'Erosion': 0, 'SDRF': 0, 'Inundation': 0, 'Hydrology': 0, 'Silt': 0, 'Siltation': 0, 'Bund': 0, 'Trench': 0, 'Breach': 0, 'Culvert': 0, 'Sluice': 0, 'Dyke': 0, 'Storm water drain': 2, 'Emergency': 0, 'Immediate': 0, 'IM': 0, 'AE': 0, 'A E': 0, 'AAPDA MITRA': 0}","{'Floodlight': 0, 'Flood Light': 0, 'GAS': 0, 'FIFA': 0, 'pipe': 0, 'pipes': 0, 'covid': 0}",Post-Monsoon,,False,True,Repair and Restoration,{'upgradation': 2}
2019_PWD_11137_1,ACE/EZ/SOPD/Dhaiali2/THOWRA,SOPD work for 2018-19,"Imp or Constn of i. Construction of Dhai Ali Road cum Bund from Desang Ghat to Demow Bridge via Saragua From Ch. 3.00 km to Ch. 5.40 km, under SOPD for 2018-19 under Sivasagar Rural Roads Division in Thowra LAC",Works,Open Tender,Item Rate,Civil Works,No,No,NA ,17-Jan-2019 11:00 AM,NA ,180.0,No ,No,Offline,24-Jan-2019 03:30 PM,Public Works Roads Department,Demow,785662.0,2.0,"2,34,09,251",MS RANJIT BORGOHAIN,23965187.0,Accepted-AOC,10-Aug-2020,AOC,Public Works Roads Department,True,"{'Flood': 0, 'Embankment': 0, 'embkt': 0, 'Relief': 0, 'Erosion': 0, 'SDRF': 0, 'Inundation': 0, 'Hydrology': 0, 'Silt': 0, 'Siltation': 0, 'Bund': 1, 'Trench': 0, 'Breach': 0, 'Culvert': 0, 'Sluice': 0, 'Dyke': 0, 'Storm water drain': 0, 'Emergency': 0, 'Immediate': 0, 'IM': 0, 'AE': 0, 'A E': 0, 'AAPDA MITRA': 0}","{'Floodlight': 0, 'Flood Light': 0, 'GAS': 0, 'FIFA': 0, 'pipe': 0, 'pipes': 0, 'covid': 0}",Pre-Monsoon,SOPD,False,True,Repair and Restoration,{'imp.': 1}
2019_PWD_15033_1,CE/Commn/34/19-20/2_Fulkumari,Fulkumari Chapghar Road,Reconstruction of Flood Damaged of Fulkumari Chapghar Road (From Ch.000m to Ch.470.00m) (Package No-AS-05-51) under SOPD (FDR) for the year 2019-20.,Works,Open Tender,Item Rate,Civil Works – Roads,No,No,NA ,28-Nov-2019 02:00 PM,NA ,180.0,No ,No,Offline,26-Dec-2019 02:10 PM,Public Works Roads Department||CE PWD(R) - PWD||Traffic Engineering Cell - PWD,Dhubri,783301.0,2.0,"1,44,00,000",ABUL FAZAL ABDULLAH,13389106.0,Accepted-AOC,05-Aug-2020,AOC,Public Works Roads Department||CE PWD(R) - PWD||Traffic Engineering Cell - PWD,True,"{'Flood': 1, 'Embankment': 0, 'embkt': 0, 'Relief': 0, 'Erosion': 0, 'SDRF': 0, 'Inundation': 0, 'Hydrology': 0, 'Silt': 0, 'Siltation': 0, 'Bund': 0, 'Trench': 0, 'Breach': 0, 'Culvert': 0, 'Sluice': 0, 'Dyke': 0, 'Storm water drain': 0, 'Emergency': 0, 'Immediate': 0, 'IM': 0, 'AE': 0, 'A E': 0, 'AAPDA MITRA': 0}","{'Floodlight': 0, 'Flood Light': 0, 'GAS': 0, 'FIFA': 0, 'pipe': 0, 'pipes': 0, 'covid': 0}",Post-Monsoon,SOPD,False,True,Repair and Restoration,{'reconstruction': 1}
2019_PWD_15034_1,CE/COmmn/34/19-20/2_Khudimari,Khudimari to Gauripur Bashbari Road,Reconstruction of Flood Damaged of Khudimari to Gauripur Bashbari Road (From Ch.0.00 m to 3500.00 m) (Package No-AS-05-51) under SOPD (FDR) for the year 2019-20.,Works,Open Tender,Item Rate,Civil Works – Roads,No,No,NA ,28-Nov-2019 02:00 PM,NA ,180.0,No ,No,Offline,26-Dec-2019 02:10 PM,Public Works Roads Department||CE PWD(R) - PWD||Traffic Engineering Cell - PWD,Dhubri,783301.0,2.0,"1,11,90,000",ABUL FAZAL ABDULLAH,10513413.0,Accepted-AOC,06-Aug-2020,AOC,Public Works Roads Department||CE PWD(R) - PWD||Traffic Engineering Cell - PWD,True,"{'Flood': 1, 'Embankment': 0, 'embkt': 0, 'Relief': 0, 'Erosion': 0, 'SDRF': 0, 'Inundation': 0, 'Hydrology': 0, 'Silt': 0, 'Siltation': 0, 'Bund': 0, 'Trench': 0, 'Breach': 0, 'Culvert': 0, 'Sluice': 0, 'Dyke': 0, 'Storm water drain': 0, 'Emergency': 0, 'Immediate': 0, 'IM': 0, 'AE': 0, 'A E': 0, 'AAPDA MITRA': 0}","{'Floodlight': 0, 'Flood Light': 0, 'GAS': 0, 'FIFA': 0, 'pipe': 0, 'pipes': 0, 'covid': 0}",Post-Monsoon,SOPD,False,True,Repair and Restoration,{'reconstruction': 1}
2019_PWD_15039_1,CE/Commn//34/19-20/2_Alamganj,Alamganj to Fulkatari road,Reconstruction of Flood damage road from Alamganj to Fulkatari road under SOPD-FDR for the year 2019-20,Works,Open Tender,Item Rate,Civil Works – Roads,No,No,NA ,28-Nov-2019 02:00 PM,NA ,180.0,No ,No,Offline,26-Dec-2019 02:10 PM,Public Works Roads Department||CE PWD(R) - PWD||Traffic Engineering Cell - PWD,Dhubri,783301.0,2.0,"1,06,48,000",Alimuddin Mondal,9583200.0,Accepted-AOC,05-Aug-2020,AOC,Public Works Roads Department||CE PWD(R) - PWD||Traffic Engineering Cell - PWD,True,"{'Flood': 1, 'Embankment': 0, 'embkt': 0, 'Relief': 0, 'Erosion': 0, 'SDRF': 0, 'Inundation': 0, 'Hydrology': 0, 'Silt': 0, 'Siltation': 0, 'Bund': 0, 'Trench': 0, 'Breach': 0, 'Culvert': 0, 'Sluice': 0, 'Dyke': 0, 'Storm water drain': 0, 'Emergency': 0, 'Immediate': 0, 'IM': 0, 'AE': 0, 'A E': 0, 'AAPDA MITRA': 0}","{'Floodlight': 0, 'Flood Light': 0, 'GAS': 0, 'FIFA': 0, 'pipe': 0, 'pipes': 0, 'covid': 0}",Post-Monsoon,SOPD,False,True,Repair and Restoration,{'reconstruction': 1}
2019_PWD_15080_1,CE/commn/34/19-20/2_HM_Road,HM road to Dhanua,Reconstruction of flood damaged road from HM road to Dhanua (From Ch. 0.00 m to Ch. 4000.00 m ) under SOPD (FDR) for the year 2019-20.,Works,Open Tender,Item Rate,Civil Works – Roads,No,No,NA ,29-Nov-2019 09:00 AM,NA ,180.0,No ,No,Offline,26-Dec-2019 02:10 PM,Public Works Roads Department||CE PWD(R) - PWD||Traffic Engineering Cell - PWD,Dhubri,783323.0,2.0,"1,25,46,000",Mahmud Hassan,12545000.0,Accepted-AOC,05-Aug-2020,AOC,Public Works Roads Department||CE PWD(R) - PWD||Traffic Engineering Cell - PWD,True,"{'Flood': 1, 'Embankment': 0, 'embkt': 0, 'Relief': 0, 'Erosion': 0, 'SDRF': 0, 'Inundation': 0, 'Hydrology': 0, 'Silt': 0, 'Siltation': 0, 'Bund': 0, 'Trench': 0, 'Breach': 0, 'Culvert': 0, 'Sluice': 0, 'Dyke': 0, 'Storm water drain': 0, 'Emergency': 0, 'Immediate': 0, 'IM': 0, 'AE': 0, 'A E': 0, 'AAPDA MITRA': 0}","{'Floodlight': 0, 'Flood Light': 0, 'GAS': 0, 'FIFA': 0, 'pipe': 0, 'pipes': 0, 'covid': 0}",Post-Monsoon,SOPD,False,True,Repair and Restoration,{'reconstruction': 1}
2019_PWD_15130_14,CT-82/89/2016/76 dated 28.11.2019,SOPD(FDR)_WAC_14,Reconstruction of flood damaged of Balajan Sahebganj Road (Ch. 0.00m to Ch. 2600.00m) under SOPD(FDR) for the year 2019-20.,Works,Open Tender,Item Rate,Civil Works – Roads,No,No,NA ,30-Nov-2019 06:00 PM,NA ,90.0,No ,No,Offline,04-Jan-2020 10:00 AM,Public Works Roads Department,24 Gauripur,783121.0,2.0,"80,69,992",Abdul Jobber Ali,7663451.0,Accepted-AOC,02-Aug-2020,AOC,Public Works Roads Department,True,"{'Flood': 1, 'Embankment': 0, 'embkt': 0, 'Relief': 0, 'Erosion': 0, 'SDRF': 0, 'Inundation': 0, 'Hydrology': 0, 'Silt': 0, 'Siltation': 0, 'Bund': 0, 'Trench': 0, 'Breach': 0, 'Culvert': 0, 'Sluice': 0, 'Dyke': 0, 'Storm water drain': 0, 'Emergency': 0, 'Immediate': 0, 'IM': 0, 'AE': 0, 'A E': 0, 'AAPDA MITRA': 0}","{'Floodlight': 0, 'Flood Light': 0, 'GAS': 0, 'FIFA': 0, 'pipe': 0, 'pipes': 0, 'covid': 0}",Post-Monsoon,SOPD,False,True,Repair and Restoration,{'reconstruction': 1}
2019_PWD_15130_16,CT-82/89/2016/76 dated 28.11.2019,SOPD(FDR)_WAC_16,Reconstruction of flood damaged Road from Pachim Gaikhowa Pt-III to Kanuri Dimakuri Road under SOPD (FDR) for the year 2019-20.,Works,Open Tender,Item Rate,Civil Works – Roads,No,No,NA ,30-Nov-2019 06:00 PM,NA ,90.0,No ,No,Offline,04-Jan-2020 10:00 AM,Public Works Roads Department,24 Gauripur,783121.0,2.0,"55,81,992",Abdul Monnaf Mondal,5302644.0,Accepted-AOC,02-Aug-2020,AOC,Public Works Roads Department,True,"{'Flood': 1, 'Embankment': 0, 'embkt': 0, 'Relief': 0, 'Erosion': 0, 'SDRF': 0, 'Inundation': 0, 'Hydrology': 0, 'Silt': 0, 'Siltation': 0, 'Bund': 0, 'Trench': 0, 'Breach': 0, 'Culvert': 0, 'Sluice': 0, 'Dyke': 0, 'Storm water drain': 0, 'Emergency': 0, 'Immediate': 0, 'IM': 0, 'AE': 0, 'A E': 0, 'AAPDA MITRA': 0}","{'Floodlight': 0, 'Flood Light': 0, 'GAS': 0, 'FIFA': 0, 'pipe': 0, 'pipes': 0, 'covid': 0}",Post-Monsoon,SOPD,False,True,Repair and Restoration,{'reconstruction': 1}
2019_PWD_15130_3,CT-82/89/2016/76 dated 28.11.2019,SOPD(FDR)_WAC_03,Reconstruction of Flood damagedof HM Road to Diara under SOPD (FDR) for the year 2019-20.,Works,Open Tender,Item Rate,Civil Works – Roads,No,No,NA ,30-Nov-2019 09:00 AM,NA ,90.0,No ,No,Offline,04-Jan-2020 10:00 AM,Public Works Roads Department,Mankachar,783121.0,2.0,"67,36,987",ALTAB HOSSAON,6398117.0,Accepted-AOC,02-Aug-2020,AOC,Public Works Roads Department,True,"{'Flood': 1, 'Embankment': 0, 'embkt': 0, 'Relief': 0, 'Erosion': 0, 'SDRF': 0, 'Inundation': 0, 'Hydrology': 0, 'Silt': 0, 'Siltation': 0, 'Bund': 0, 'Trench': 0, 'Breach': 0, 'Culvert': 0, 'Sluice': 0, 'Dyke': 0, 'Storm water drain': 0, 'Emergency': 0, 'Immediate': 0, 'IM': 0, 'AE': 0, 'A E': 0, 'AAPDA MITRA': 0}","{'Floodlight': 0, 'Flood Light': 0, 'GAS': 0, 'FIFA': 0, 'pipe': 0, 'pipes': 0, 'covid': 0}",Post-Monsoon,SOPD,False,True,Repair and Restoration,{'reconstruction': 1}
2019_PWD_15130_6,CT-82/89/2016/76 dated 28.11.2019,SOPD(FDR)_WAC_06,Reconstruction of Flood damaged of Fakiraghat Sadartilla via Jhagrarchar under SOPD (FDR) for the year 2019-20.,Works,Open Tender,Item Rate,Civil Works – Roads,No,No,NA ,30-Nov-2019 06:00 PM,NA ,90.0,No ,No,Offline,04-Jan-2020 10:00 AM,Public Works Roads Department,South Salmara,783121.0,2.0,"52,24,945",Innus Ali,4963243.32,Accepted-AOC,02-Aug-2020,AOC,Public Works Roads Department,True,"{'Flood': 1, 'Embankment': 0, 'embkt': 0, 'Relief': 0, 'Erosion': 0, 'SDRF': 0, 'Inundation': 0, 'Hydrology': 0, 'Silt': 0, 'Siltation': 0, 'Bund': 0, 'Trench': 0, 'Breach': 0, 'Culvert': 0, 'Sluice': 0, 'Dyke': 0, 'Storm water drain': 0, 'Emergency': 0, 'Immediate': 0, 'IM': 0, 'AE': 0, 'A E': 0, 'AAPDA MITRA': 0}","{'Floodlight': 0, 'Flood Light': 0, 'GAS': 0, 'FIFA': 0, 'pipe': 0, 'pipes': 0, 'covid': 0}",Post-Monsoon,SOPD,False,False,Repair and Restoration,{'reconstruction': 1}
2019_PWD_15130_7,CT-82/89/2016/76 dated 28.11.2019,SOPD(FDR)_WAC_07,Reconstruction of flood damaged to Alomganj Fulkatary Road to Borochirakhowa Pt-V (Rep to SPT Br. No. 1/1) under SOPD(FDR) for the year 2019-20.,Works,Open Tender,Item Rate,Civil Works – Roads,No,No,NA ,30-Nov-2019 06:00 PM,NA ,90.0,No ,No,Offline,04-Jan-2020 10:00 AM,Public Works Roads Department,South Salmara,783121.0,2.0,"84,89,959",Alimuddin Mondal,8062597.0,Accepted-AOC,02-Aug-2020,AOC,Public Works Roads Department,True,"{'Flood': 1, 'Embankment': 0, 'embkt': 0, 'Relief': 0, 'Erosion': 0, 'SDRF': 0, 'Inundation': 0, 'Hydrology': 0, 'Silt': 0, 'Siltation': 0, 'Bund': 0, 'Trench': 0, 'Breach': 0, 'Culvert': 0, 'Sluice': 0, 'Dyke': 0, 'Storm water drain': 0, 'Emergency': 0, 'Immediate': 0, 'IM': 0, 'AE': 0, 'A E': 0, 'AAPDA MITRA': 0}","{'Floodlight': 0, 'Flood Light': 0, 'GAS': 0, 'FIFA': 0, 'pipe': 0, 'pipes': 0, 'covid': 0}",Post-Monsoon,SOPD,False,True,Repair and Restoration,{'reconstruction': 1}
2019_PWD_15130_8,CT-82/89/2016/76 dated 28.11.2019,SOPD(FDR)_WAC_08,Reconstruction of Flood damaged of Bondihana Majerchar Road (Breached portion from Ch. 5200.00m to 6500.00m) under SOPD(FDR) for 2019-20.,Works,Open Tender,Item Rate,Civil Works – Roads,No,No,NA ,30-Nov-2019 06:00 PM,NA ,90.0,No ,No,Offline,04-Jan-2020 10:00 AM,Public Works Roads Department,South Salmara,783121.0,2.0,"73,48,948",ABDUL GOFUR MOLLAH,6977833.0,Accepted-AOC,02-Aug-2020,AOC,Public Works Roads Department,True,"{'Flood': 1, 'Embankment': 0, 'embkt': 0, 'Relief': 0, 'Erosion': 0, 'SDRF': 0, 'Inundation': 0, 'Hydrology': 0, 'Silt': 0, 'Siltation': 0, 'Bund': 0, 'Trench': 0, 'Breach': 0, 'Culvert': 0, 'Sluice': 0, 'Dyke': 0, 'Storm water drain': 0, 'Emergency': 0, 'Immediate': 0, 'IM': 0, 'AE': 0, 'A E': 0, 'AAPDA MITRA': 0}","{'Floodlight': 0, 'Flood Light': 0, 'GAS': 0, 'FIFA': 0, 'pipe': 0, 'pipes': 0, 'covid': 0}",Post-Monsoon,SOPD,False,True,Repair and Restoration,{'reconstruction': 1}
2019_PWD_15218_1,CE/Commn/37/19-20/2_Sapekhati,Sapekhati Cholong Pathar Road,Reconstruction with protection work of flood damaged of Sapekhati Cholong Pathar Road with RCC Retaining wall under SOPD(FDR) for the year 2019-20 in Golaghat Rural Road Division (Length 200 RM) Ch. 0 m to ch. 200 m,Works,Open Tender,Item Rate,Civil Works – Roads,No,No,NA ,05-Dec-2019 09:00 AM,NA ,180.0,No ,No,Offline,27-Dec-2019 02:10 PM,Public Works Roads Department||CE PWD(R) - PWD||Traffic Engineering Cell - PWD,Golaghat,785621.0,2.0,"1,05,23,000",Bedanta Protim Hazarika,9470700.0,Accepted-AOC,06-Aug-2020,AOC,Public Works Roads Department||CE PWD(R) - PWD||Traffic Engineering Cell - PWD,True,"{'Flood': 1, 'Embankment': 0, 'embkt': 0, 'Relief': 0, 'Erosion': 0, 'SDRF': 0, 'Inundation': 0, 'Hydrology': 0, 'Silt': 0, 'Siltation': 0, 'Bund': 0, 'Trench': 0, 'Breach': 0, 'Culvert': 0, 'Sluice': 0, 'Dyke': 0, 'Storm water drain': 0, 'Emergency': 0, 'Immediate': 0, 'IM': 0, 'AE': 0, 'A E': 0, 'AAPDA MITRA': 0}","{'Floodlight': 0, 'Flood Light': 0, 'GAS': 0, 'FIFA': 0, 'pipe': 0, 'pipes': 0, 'covid': 0}",Post-Monsoon,SOPD,False,True,Repair and Restoration,{'reconstruction': 1}
2019_PWD_15307_1,CE/Commn/39 /2019-20/2-Paliguri,Paliguri Chakumaku PWD Road to Sutradol,Restoration of flood damages to Paliguri Chakumaku PWD Road to Sutradol via Kakarjalah under SOPD-FDR for the year 2019-20,Works,Open Tender,Item Rate,Civil Works – Roads,No,No,NA ,11-Dec-2019 05:00 PM,NA ,180.0,No ,No,Offline,27-Dec-2019 02:10 PM,Public Works Roads Department||CE PWD(R) - PWD||Traffic Engineering Cell - PWD,Morigaon,782105.0,2.0,"1,24,15,000",M/S Gobinda Upadhyaya,12414971.0,Accepted-AOC,06-Aug-2020,AOC,Public Works Roads Department||CE PWD(R) - PWD||Traffic Engineering Cell - PWD,True,"{'Flood': 1, 'Embankment': 0, 'embkt': 0, 'Relief': 0, 'Erosion': 0, 'SDRF': 0, 'Inundation': 0, 'Hydrology': 0, 'Silt': 0, 'Siltation': 0, 'Bund': 0, 'Trench': 0, 'Breach': 0, 'Culvert': 0, 'Sluice': 0, 'Dyke': 0, 'Storm water drain': 0, 'Emergency': 0, 'Immediate': 0, 'IM': 0, 'AE': 0, 'A E': 0, 'AAPDA MITRA': 0}","{'Floodlight': 0, 'Flood Light': 0, 'GAS': 0, 'FIFA': 0, 'pipe': 0, 'pipes': 0, 'covid': 0}",Post-Monsoon,SOPD,False,True,Repair and Restoration,{'restoration': 1}
2020_DoWR_16419_1,BARPETA/2019-20/SOPD-FDR/VI,Recoupment of breach like damages of B/Dyke from Bahari to Baghbar at different reaches,"Recoupment of breach like damages of B/Dyke from Bahari to Baghbar at different reaches (At Fulbari, Dokreswar, Chesra and Dighirpam) from Ch.41700m to Ch.42700m, Ch.44800m to ch.45800m , ch.58240m to ch.61240m.",Works,Open Tender,Works,Civil Works,No,No,NA ,11-Feb-2020 06:00 PM,NA ,180.0,No ,No,Online,04-Mar-2020 02:00 PM,Department of Water Resources||Chief Engineer - DoWR,BARPETA,781301.0,3.0,"5,94,05,490",ROHIN BASUMATARY _ ABDUIR REZZAK,53457600.03,Accepted-AOC,12-Aug-2020,AOC,Department of Water Resources||Chief Engineer - DoWR,True,"{'Flood': 0, 'Embankment': 0, 'embkt': 0, 'Relief': 0, 'Erosion': 0, 'SDRF': 0, 'Inundation': 0, 'Hydrology': 0, 'Silt': 0, 'Siltation': 0, 'Bund': 0, 'Trench': 0, 'Breach': 2, 'Culvert': 0, 'Sluice': 0, 'Dyke': 2, 'Storm water drain': 0, 'Emergency': 0, 'Immediate': 0, 'IM': 0, 'AE': 0, 'A E': 0, 'AAPDA MITRA': 0}","{'Floodlight': 0, 'Flood Light': 0, 'GAS': 0, 'FIFA': 0, 'pipe': 0, 'pipes': 0, 'covid': 0}",Pre-Monsoon,SOPD,False,True,Repair and Restoration,{'recoupment': 2}
2020_DoWR_16599_1,DIPHU/2019-20/SOPD-FDR/I,Protection of Neparpatty and Naojan areas from erosion of river Dhansiri in Karbi Anglong District. PACKAGE 2,Protection of Neparpatty and Naojan areas from erosion of river Dhansiri in Karbi Anglong District.,Works,Open Tender,Works,Civil Works,No,No,NA ,17-Feb-2020 06:00 PM,NA ,180.0,No ,No,Online,10-Mar-2020 02:00 PM,Department of Water Resources||Chief Engineer - DoWR,DIPHU,782460.0,3.0,"3,57,52,953",M/S. M.P. AGARWALLA,35394929.82,Accepted-AOC,04-Aug-2020,AOC,Department of Water Resources||Chief Engineer - DoWR,True,"{'Flood': 0, 'Embankment': 0, 'embkt': 0, 'Relief': 0, 'Erosion': 2, 'SDRF': 0, 'Inundation': 0, 'Hydrology': 0, 'Silt': 0, 'Siltation': 0, 'Bund': 0, 'Trench': 0, 'Breach': 0, 'Culvert': 0, 'Sluice': 0, 'Dyke': 0, 'Storm water drain': 0, 'Emergency': 0, 'Immediate': 0, 'IM': 0, 'AE': 0, 'A E': 0, 'AAPDA MITRA': 0}","{'Floodlight': 0, 'Flood Light': 0, 'GAS': 0, 'FIFA': 0, 'pipe': 0, 'pipes': 0, 'covid': 0}",Pre-Monsoon,SOPD,True,False,Immediate Measures,{'package': 1}
2020_DoWR_16773_2,MANGALDAI/2019-20/SDRF/II,I/M for restoration of damages at Barjhar area by river Mangaldai (Kawadanga) under SDRF for 2019-20 PACKAGE 1 RETENDER,I/M for restoration of damages at Barjhar area by river Mangaldai (Kawadanga) under SDRF for 2019-20,Works,Open Tender,Works,Civil Works,No,No,NA ,18-May-2020 06:00 PM,NA ,180.0,No ,No,Online,26-May-2020 02:05 PM,Department of Water Resources||Chief Engineer - DoWR,MANGALDAI,784125.0,3.0,"42,85,550",KUMUD DEKA,3383421.0,Accepted-AOC,11-Aug-2020,AOC,Department of Water Resources||Chief Engineer - DoWR,True,"{'Flood': 0, 'Embankment': 0, 'embkt': 0, 'Relief': 0, 'Erosion': 0, 'SDRF': 3, 'Inundation': 0, 'Hydrology': 0, 'Silt': 0, 'Siltation': 0, 'Bund': 0, 'Trench': 0, 'Breach': 0, 'Culvert': 0, 'Sluice': 0, 'Dyke': 0, 'Storm water drain': 0, 'Emergency': 0, 'Immediate': 0, 'IM': 0, 'AE': 0, 'A E': 0, 'AAPDA MITRA': 0}","{'Floodlight': 0, 'Flood Light': 0, 'GAS': 0, 'FIFA': 0, 'pipe': 0, 'pipes': 0, 'covid': 0}",Monsoon,SDRF,False,False,Repair and Restoration,{'restoration': 2}
2020_DoWR_17402_1,NALBARI/2019-20/SOPD-G/II,Anti erosion measures to protect the erosion of river Tihu at Pacca under SOPD for the year 2019-20,Anti erosion measures to protect the erosion of river Tihu at Pacca under SOPD for the year 2019-20,Works,Open Tender,Works,Civil Works,No,No,NA ,05-May-2020 06:00 PM,NA ,180.0,No ,No,Online,27-May-2020 02:00 PM,Department of Water Resources||Chief Engineer - DoWR,NALBARI,781335.0,3.0,"54,99,998",RAJIB KUMAR CHOUDHURY,4313388.0,Accepted-AOC,04-Aug-2020,AOC,Department of Water Resources||Chief Engineer - DoWR,True,"{'Flood': 0, 'Embankment': 0, 'embkt': 0, 'Relief': 0, 'Erosion': 4, 'SDRF': 0, 'Inundation': 0, 'Hydrology': 0, 'Silt': 0, 'Siltation': 0, 'Bund': 0, 'Trench': 0, 'Breach': 0, 'Culvert': 0, 'Sluice': 0, 'Dyke': 0, 'Storm water drain': 0, 'Emergency': 0, 'Immediate': 0, 'IM': 0, 'AE': 0, 'A E': 0, 'AAPDA MITRA': 0}","{'Floodlight': 0, 'Flood Light': 0, 'GAS': 0, 'FIFA': 0, 'pipe': 0, 'pipes': 0, 'covid': 0}",Pre-Monsoon,SOPD,True,False,Others,
2020_DoWR_17612_1,DHM/SDRF/CHENGAJAN/2020-21/1,Immediate measures for restoration of Chengajanghat and its adjoining areas under SDRF for 2019-20 (Phase-II),Immediate measures for restoration of Chengajanghat and its adjoining areas under SDRF for 2019-20 (Phase-II),Works,Open Tender,Works,Civil Works,No,No,NA ,20-May-2020 06:00 PM,NA ,180.0,No ,No,Online,30-May-2020 02:00 PM,Department of Water Resources||Chief Engineer - DoWR,Dhemaji,787057.0,3.0,"1,99,95,433",Ashok Kumar Agarwalla,15893820.6,Accepted-AOC,04-Aug-2020,AOC,Department of Water Resources||Chief Engineer - DoWR,True,"{'Flood': 0, 'Embankment': 0, 'embkt': 0, 'Relief': 0, 'Erosion': 0, 'SDRF': 3, 'Inundation': 0, 'Hydrology': 0, 'Silt': 0, 'Siltation': 0, 'Bund': 0, 'Trench': 0, 'Breach': 0, 'Culvert': 0, 'Sluice': 0, 'Dyke': 0, 'Storm water drain': 0, 'Emergency': 0, 'Immediate': 2, 'IM': 0, 'AE': 0, 'A E': 0, 'AAPDA MITRA': 0}","{'Floodlight': 0, 'Flood Light': 0, 'GAS': 0, 'FIFA': 0, 'pipe': 0, 'pipes': 0, 'covid': 0}",Monsoon,SDRF,False,False,Repair and Restoration,{'restoration': 2}
2020_DoWR_17671_1,DIB/SDRF/8THMILE/2020-21/1,Immediate measures to restore damage due to flood on the L/B of river Kundil at 8th mile RCC bridge for 2019-20,Immediate measures to restore damage due to flood on the L/B of river Kundil at 8th mile RCC bridge for 2019-20,Works,Open Tender,Works,Civil Works,No,No,NA ,21-May-2020 06:00 PM,NA ,180.0,No ,No,Online,01-Jun-2020 02:00 PM,Department of Water Resources||Chief Engineer - DoWR,Dibrugarh,786005.0,3.0,"2,07,48,709",M/S East India Construction,18672665.7,Accepted-AOC,12-Aug-2020,AOC,Department of Water Resources||Chief Engineer - DoWR,True,"{'Flood': 2, 'Embankment': 0, 'embkt': 0, 'Relief': 0, 'Erosion': 0, 'SDRF': 1, 'Inundation': 0, 'Hydrology': 0, 'Silt': 0, 'Siltation': 0, 'Bund': 0, 'Trench': 0, 'Breach': 0, 'Culvert': 0, 'Sluice': 0, 'Dyke': 0, 'Storm water drain': 0, 'Emergency': 0, 'Immediate': 2, 'IM': 0, 'AE': 0, 'A E': 0, 'AAPDA MITRA': 0}","{'Floodlight': 0, 'Flood Light': 0, 'GAS': 0, 'FIFA': 0, 'pipe': 0, 'pipes': 0, 'covid': 0}",Monsoon,SDRF,False,True,Immediate Measures,"{'sdrf': 1, 'immediate': 2}"
2020_DoWR_17748_1,JOR/SDRF/RIRI/2020-21/1,Immediate measures for restoration of West Riri Gaon area from the flood damages of river Brahmaputra under SDRF for the year 2019-20,Immediate measures for restoration of West Riri Gaon area from the flood damages of river Brahmaputra under SDRF for the year 2019-20,Works,Open Tender,Works,Civil Works,No,No,NA ,01-Jun-2020 06:00 PM,NA ,180.0,No ,No,Online,10-Jun-2020 02:00 PM,Department of Water Resources||Chief Engineer - DoWR,Jorhat,785001.0,2.0,"1,89,84,400",BITUPON DUTTA,15636033.0,Accepted-AOC,06-Aug-2020,AOC,Department of Water Resources||Chief Engineer - DoWR,True,"{'Flood': 2, 'Embankment': 0, 'embkt': 0, 'Relief': 0, 'Erosion': 0, 'SDRF': 3, 'Inundation': 0, 'Hydrology': 0, 'Silt': 0, 'Siltation': 0, 'Bund': 0, 'Trench': 0, 'Breach': 0, 'Culvert': 0, 'Sluice': 0, 'Dyke': 0, 'Storm water drain': 0, 'Emergency': 0, 'Immediate': 2, 'IM': 0, 'AE': 0, 'A E': 0, 'AAPDA MITRA': 0}","{'Floodlight': 0, 'Flood Light': 0, 'GAS': 0, 'FIFA': 0, 'pipe': 0, 'pipes': 0, 'covid': 0}",Monsoon,SDRF,False,False,Repair and Restoration,{'restoration': 2}
2020_DoWR_17750_1,JOR/SDRF/KURUABAHI/2020-21/1,Immediate measures for restoration of Kuruabahi Satra area from flood damages of river Dhansiri under SDRF for the year 2019-20,Immediate measures for restoration of Kuruabahi Satra area from flood damages of river Dhansiri under SDRF for the year 2019-20,Works,Open Tender,Works,Civil Works,No,No,NA ,01-Jun-2020 06:00 PM,NA ,180.0,No ,No,Online,11-Jun-2020 02:00 PM,Department of Water Resources||Chief Engineer - DoWR,Jorhat,785001.0,2.0,"1,49,94,674",PRAJIB DUTTA,14994674.0,Accepted-AOC,19-Aug-2020,AOC,Department of Water Resources||Chief Engineer - DoWR,True,"{'Flood': 2, 'Embankment': 0, 'embkt': 0, 'Relief': 0, 'Erosion': 0, 'SDRF': 3, 'Inundation': 0, 'Hydrology': 0, 'Silt': 0, 'Siltation': 0, 'Bund': 0, 'Trench': 0, 'Breach': 0, 'Culvert': 0, 'Sluice': 0, 'Dyke': 0, 'Storm water drain': 0, 'Emergency': 0, 'Immediate': 2, 'IM': 0, 'AE': 0, 'A E': 0, 'AAPDA MITRA': 0}","{'Floodlight': 0, 'Flood Light': 0, 'GAS': 0, 'FIFA': 0, 'pipe': 0, 'pipes': 0, 'covid': 0}",Monsoon,SDRF,False,False,Repair and Restoration,{'restoration': 2}
