2020_ID_16046_1,MCI_TEN_2_2019-20_102 Date_ 24_01_2020,Improvement and Construction of Godhabil Dong Bund F_I_S_ under TSP for the year2019_2020,Improvement and Construction of Godhabil Dong Bund F_I_S_ under TSP for the year2019_2020,Works,Open Tender,Percentage,Civil Works,No,No,NA ,24-Jan-2020 06:00 PM,NA ,180.0,No ,No,Offline,03-Feb-2020 03:00 PM,Irrigation Department||Chief Engineer(Minor Irrigation)-Irrigation Dept,Udalguri,784509.0,2.0,"82,05,543",BHISMA KR DANGAL,7384700.0,Accepted-AOC,07-Aug-2020,AOC,Irrigation Department||Chief Engineer(Minor Irrigation)-Irrigation Dept,True,"{'Flood': 0, 'Embankment': 0, 'embkt': 0, 'Relief': 0, 'Erosion': 0, 'SDRF': 0, 'Inundation': 0, 'Hydrology': 0, 'Silt': 0, 'Siltation': 0, 'Bund': 2, 'Trench': 0, 'Breach': 0, 'Culvert': 0, 'Sluice': 0, 'Dyke': 0, 'Storm water drain': 0, 'Emergency': 0, 'Immediate': 0, 'IM': 0, 'AE': 0, 'A E': 0, 'AAPDA MITRA': 0}","{'Floodlight': 0, 'Flood Light': 0, 'GAS': 0, 'FIFA': 0, 'pipe': 0, 'pipes': 0, 'covid': 0}",Pre-Monsoon,,False,True,Repair and Restoration,{'improvement': 2}
2020_PWD_15715_1,SENL/NIT/N/298/2009-10/Pt-II,SENL/SOPD-FDR/2019-20/NAL-36,(a) Reconstruction of flood damaged Bagals Road from Sonkuriha to Banganabari under SOPD -FDR for the yearr 2019-20 (b) Reconstruction of flood damaged Bagals Road at Kalag Hatkhola Chowk under SOPD -FDR for the year 2019-20,Works,Open Tender,Item Rate,Civil Works – Roads,No,No,NA ,06-Jan-2020 11:00 AM,NA ,180.0,No ,No,Offline,22-Jan-2020 11:00 AM,Public Works Roads Department,"S.E. PWD Nalbari Road Circle, Nalbari",781335.0,2.0,"73,22,000",Aswini Kumar Bhatta,6589800.0,Accepted-AOC,29-Feb-2020,AOC,Public Works Roads Department,True,"{'Flood': 2, 'Embankment': 0, 'embkt': 0, 'Relief': 0, 'Erosion': 0, 'SDRF': 0, 'Inundation': 0, 'Hydrology': 0, 'Silt': 0, 'Siltation': 0, 'Bund': 0, 'Trench': 0, 'Breach': 0, 'Culvert': 0, 'Sluice': 0, 'Dyke': 0, 'Storm water drain': 0, 'Emergency': 0, 'Immediate': 0, 'IM': 0, 'AE': 0, 'A E': 0, 'AAPDA MITRA': 0}","{'Floodlight': 0, 'Flood Light': 0, 'GAS': 0, 'FIFA': 0, 'pipe': 0, 'pipes': 0, 'covid': 0}",Pre-Monsoon,SOPD,False,True,Repair and Restoration,{'reconstruction': 2}
2020_PWD_15715_3,SENL/NIT/N/298/2009-10/Pt-II,SENL/SOPD-FDR/2019-20/NAL-38,Reconstruction of flood damaged Adabari -Arikuchi PMGSY Road under SOPD -FDR for the year 2019-20,Works,Open Tender,Item Rate,Civil Works – Roads,No,No,NA ,06-Jan-2020 11:00 AM,NA ,180.0,No ,No,Offline,22-Jan-2020 11:00 AM,Public Works Roads Department,"S.E. PWD Nalbari Road CIrcle, Nalbari",781335.0,2.0,"74,99,000",Diganta Kr. Kalita-Somla Daimari-JV,6749100.0,Accepted-AOC,21-Mar-2020,AOC,Public Works Roads Department,True,"{'Flood': 1, 'Embankment': 0, 'embkt': 0, 'Relief': 0, 'Erosion': 0, 'SDRF': 0, 'Inundation': 0, 'Hydrology': 0, 'Silt': 0, 'Siltation': 0, 'Bund': 0, 'Trench': 0, 'Breach': 0, 'Culvert': 0, 'Sluice': 0, 'Dyke': 0, 'Storm water drain': 0, 'Emergency': 0, 'Immediate': 0, 'IM': 0, 'AE': 0, 'A E': 0, 'AAPDA MITRA': 0}","{'Floodlight': 0, 'Flood Light': 0, 'GAS': 0, 'FIFA': 0, 'pipe': 0, 'pipes': 0, 'covid': 0}",Pre-Monsoon,SOPD,False,True,Repair and Restoration,{'reconstruction': 1}
2020_PWD_15715_4,SENL/NIT/N/298/2009-10/Pt-II,SENL/SOPD-FDR/2019-20/NAL-39,Reconstruction of flood damaged Bartola Barnibari PMGSY Road under SOPD -FDR for the year 2019-20,Works,Open Tender,Item Rate,Civil Works – Roads,No,No,NA ,06-Jan-2020 11:00 AM,NA ,180.0,No ,No,Offline,22-Jan-2020 11:00 AM,Public Works Roads Department,"S.E. PWD Nalbari Road Circle, Nalbari",781335.0,2.0,"78,62,000",ABDUL KHAYAM AHMED,7075800.0,Accepted-AOC,20-Mar-2020,AOC,Public Works Roads Department,True,"{'Flood': 1, 'Embankment': 0, 'embkt': 0, 'Relief': 0, 'Erosion': 0, 'SDRF': 0, 'Inundation': 0, 'Hydrology': 0, 'Silt': 0, 'Siltation': 0, 'Bund': 0, 'Trench': 0, 'Breach': 0, 'Culvert': 0, 'Sluice': 0, 'Dyke': 0, 'Storm water drain': 0, 'Emergency': 0, 'Immediate': 0, 'IM': 0, 'AE': 0, 'A E': 0, 'AAPDA MITRA': 0}","{'Floodlight': 0, 'Flood Light': 0, 'GAS': 0, 'FIFA': 0, 'pipe': 0, 'pipes': 0, 'covid': 0}",Pre-Monsoon,SOPD,False,True,Repair and Restoration,{'reconstruction': 1}
2020_PWD_15857_1,CE/Commn/31/19-20/5_DhodarAli,Approaches of RCC Bridge No. 196/5,"Reconstruction of Approaches of RCC Bridge No. 196/5 on Dhodar Ali including Protection of River bank and clearing of deposited components of old RCC bridge Charaideo R R Division, under SOPD for flood damage for the year 2019-20",Works,Open Tender,Item Rate,Civil Works – Roads,No,No,NA ,11-Jan-2020 02:00 PM,NA ,180.0,No ,No,Offline,24-Jan-2020 02:10 PM,Public Works Roads Department||CE PWD(R) - PWD||Traffic Engineering Cell - PWD,Sonari,782445.0,2.0,"1,62,52,000",Santosh Garodia,16252000.0,Accepted-AOC,06-Aug-2020,AOC,Public Works Roads Department||CE PWD(R) - PWD||Traffic Engineering Cell - PWD,True,"{'Flood': 1, 'Embankment': 0, 'embkt': 0, 'Relief': 0, 'Erosion': 0, 'SDRF': 0, 'Inundation': 0, 'Hydrology': 0, 'Silt': 0, 'Siltation': 0, 'Bund': 0, 'Trench': 0, 'Breach': 0, 'Culvert': 0, 'Sluice': 0, 'Dyke': 0, 'Storm water drain': 0, 'Emergency': 0, 'Immediate': 0, 'IM': 0, 'AE': 0, 'A E': 0, 'AAPDA MITRA': 0}","{'Floodlight': 0, 'Flood Light': 0, 'GAS': 0, 'FIFA': 0, 'pipe': 0, 'pipes': 0, 'covid': 0}",Pre-Monsoon,SOPD,False,True,Repair and Restoration,{'reconstruction': 1}
2020_PWD_16307_1,CE/Commn/42/19-20/6_Rajartilla,Rajartilla on Katigorah Harinagar Road,Reconstruction of flood damage under SOPD(FDR) for the year 2019-20 (Reconstruction of Breach at Rajartilla on Katigorah Harinagar Road from Ch.7238.00M to Ch.7493.00M) Length 255.00m,Works,Open Tender,Item Rate,Civil Works – Roads,No,No,NA ,05-Feb-2020 06:00 PM,NA ,180.0,No ,No,Offline,19-Feb-2020 02:10 PM,Public Works Roads Department||CE PWD(R) - PWD||Traffic Engineering Cell - PWD,Cachar,788805.0,2.0,"2,81,07,000",Alok Kumar Paul,28107000.0,Accepted-AOC,07-Aug-2020,AOC,Public Works Roads Department||CE PWD(R) - PWD||Traffic Engineering Cell - PWD,True,"{'Flood': 1, 'Embankment': 0, 'embkt': 0, 'Relief': 0, 'Erosion': 0, 'SDRF': 0, 'Inundation': 0, 'Hydrology': 0, 'Silt': 0, 'Siltation': 0, 'Bund': 0, 'Trench': 0, 'Breach': 1, 'Culvert': 0, 'Sluice': 0, 'Dyke': 0, 'Storm water drain': 0, 'Emergency': 0, 'Immediate': 0, 'IM': 0, 'AE': 0, 'A E': 0, 'AAPDA MITRA': 0}","{'Floodlight': 0, 'Flood Light': 0, 'GAS': 0, 'FIFA': 0, 'pipe': 0, 'pipes': 0, 'covid': 0}",Pre-Monsoon,SOPD,False,True,Repair and Restoration,{'reconstruction': 2}
2020_PWD_16325_1,CE/Commn/42 /2019-20/6_Sonai,Sonai Banskandi Road,Reconstruction of flood damage under SOPD(FDR) for the year 2019-20 (Reconstruction of Sonai Banskandi Road from Ch.2200.00M to Ch.6500.00M) Length 4.30Km,Works,Open Tender,Item Rate,Civil Works – Roads,No,No,NA ,05-Feb-2020 06:00 PM,NA ,180.0,No ,No,Offline,19-Feb-2020 02:10 PM,Public Works Roads Department||CE PWD(R) - PWD||Traffic Engineering Cell - PWD,Nagaon,782001.0,2.0,"2,49,31,000",M/S MIDAS GRANITES,24921325.0,Accepted-AOC,11-Aug-2020,AOC,Public Works Roads Department||CE PWD(R) - PWD||Traffic Engineering Cell - PWD,True,"{'Flood': 1, 'Embankment': 0, 'embkt': 0, 'Relief': 0, 'Erosion': 0, 'SDRF': 0, 'Inundation': 0, 'Hydrology': 0, 'Silt': 0, 'Siltation': 0, 'Bund': 0, 'Trench': 0, 'Breach': 0, 'Culvert': 0, 'Sluice': 0, 'Dyke': 0, 'Storm water drain': 0, 'Emergency': 0, 'Immediate': 0, 'IM': 0, 'AE': 0, 'A E': 0, 'AAPDA MITRA': 0}","{'Floodlight': 0, 'Flood Light': 0, 'GAS': 0, 'FIFA': 0, 'pipe': 0, 'pipes': 0, 'covid': 0}",Pre-Monsoon,SOPD,False,True,Repair and Restoration,{'reconstruction': 2}
2020_PWD_16330_5,SENL/NIT/N/298/2009-10/Pt-II,SENL/SOPD-FDR/2019-20/NAL-57,Reconstruction of flood damaged road from Balikoria to Dhekiabari under SOPD -FDR,Works,Open Tender,Item Rate,Civil Works – Roads,No,No,NA ,07-Feb-2020 11:00 AM,NA ,180.0,No ,No,Offline,19-Feb-2020 11:00 AM,Public Works Roads Department,"S.E. PWD Nalbari Road Circle, Nalbari",781335.0,2.0,"78,32,000",Nur Hussain,7831850.0,Accepted-AOC,19-Mar-2020,AOC,Public Works Roads Department,True,"{'Flood': 1, 'Embankment': 0, 'embkt': 0, 'Relief': 0, 'Erosion': 0, 'SDRF': 0, 'Inundation': 0, 'Hydrology': 0, 'Silt': 0, 'Siltation': 0, 'Bund': 0, 'Trench': 0, 'Breach': 0, 'Culvert': 0, 'Sluice': 0, 'Dyke': 0, 'Storm water drain': 0, 'Emergency': 0, 'Immediate': 0, 'IM': 0, 'AE': 0, 'A E': 0, 'AAPDA MITRA': 0}","{'Floodlight': 0, 'Flood Light': 0, 'GAS': 0, 'FIFA': 0, 'pipe': 0, 'pipes': 0, 'covid': 0}",Pre-Monsoon,SOPD,False,True,Repair and Restoration,{'reconstruction': 1}
2020_PWD_17261_5,NLRC/T/2019-20/7596,SOPD(G)/NLB/11,"Construction of RCC Box Culvert 3x3x3 at 29th Km of North lakhimpur Kamalabari Road under SOPD-G for the year 2019-20, Lakhimpur LAC",Works,Open Tender,Works,Civil Works – Roads,No,No,NA ,23-Mar-2020 02:00 PM,NA ,180.0,No ,No,Offline,16-May-2020 10:00 AM,Public Works Roads Department,North lakhimpur Kamalabari Road,787001.0,2.0,"66,28,231",Ajoy Morang,6296819.36,Accepted-AOC,29-May-2020,AOC,Public Works Roads Department,True,"{'Flood': 0, 'Embankment': 0, 'embkt': 0, 'Relief': 0, 'Erosion': 0, 'SDRF': 0, 'Inundation': 0, 'Hydrology': 0, 'Silt': 0, 'Siltation': 0, 'Bund': 0, 'Trench': 0, 'Breach': 0, 'Culvert': 1, 'Sluice': 0, 'Dyke': 0, 'Storm water drain': 0, 'Emergency': 0, 'Immediate': 0, 'IM': 0, 'AE': 0, 'A E': 0, 'AAPDA MITRA': 0}","{'Floodlight': 0, 'Flood Light': 0, 'GAS': 0, 'FIFA': 0, 'pipe': 0, 'pipes': 0, 'covid': 0}",Pre-Monsoon,SOPD,False,True,Others,
2020_PWD_17949_1,T/CC/ETN/SIL/2020-21/596(T),SE/SIL/CIDF/19-20/1,Construction of RCC Culvert at Ambicapatty Point at Silchar under CIDF.,Works,Open Tender,Item Rate,Civil Works – Roads,No,No,NA ,15-Jun-2020 10:00 AM,NA ,180.0,No ,No,Offline,11-Jul-2020 03:00 PM,Public Works Roads Department,Cachar District,788001.0,2.0,"68,31,378",Hrishiraj Paul,6830000.0,Accepted-AOC,05-Aug-2020,AOC,Public Works Roads Department,True,"{'Flood': 0, 'Embankment': 0, 'embkt': 0, 'Relief': 0, 'Erosion': 0, 'SDRF': 0, 'Inundation': 0, 'Hydrology': 0, 'Silt': 0, 'Siltation': 0, 'Bund': 0, 'Trench': 0, 'Breach': 0, 'Culvert': 1, 'Sluice': 0, 'Dyke': 0, 'Storm water drain': 0, 'Emergency': 0, 'Immediate': 0, 'IM': 0, 'AE': 0, 'A E': 0, 'AAPDA MITRA': 0}","{'Floodlight': 0, 'Flood Light': 0, 'GAS': 0, 'FIFA': 0, 'pipe': 0, 'pipes': 0, 'covid': 0}",Monsoon,CIDF,False,True,Others,
