Tender ID,tender_externalreference,tender_title,Work Description,Tender Category,Tender Type,Form of contract,Product Category,Is Multi Currency Allowed For BOQ,Allow Two Stage Bidding,Independent External Monitor/Remarks,Published Date,Pre Bid Meeting Date,Bid Validity(Days),Should Allow NDA Tender,Allow Preferential Bidder,Payment Mode,Bid Opening Date,Organisation Chain,location,Pincode,No of Bids Received,Tender Value in ₹,Bidder Name,Awarded Value,Status,Contract Date :,Tender Stage,Department,is_flood_tender,positive_keywords_dict,negative_keywords_dict,Season,Scheme,Erosion,Roads_Bridges_Embkt,Response Type,Flood Response - Subhead
2017_BoTC_4181_1,TN-103/1,Impr of Road from Bangsibari to Gameriguri Chowk (Ch.0.00 m to 1850.00m_Ch.0.00m to 730.00 m and Ch 1030.00m to 1380.00 m) (Sub-way_Bye Pass Road due to River Beki Erosion at 10th km. of Barpeta Road Bashbari Road) under Mashalpur (R and B) Divsion,Impr of Road from Bangsibari to Gameriguri Chowk (Ch.0.00 m to 1850.00m_Ch.0.00m to 730.00 m and Ch 1030.00m to 1380.00 m) (Sub-way_Bye Pass Road due to River Beki Erosion at 10th km. of Barpeta Road Bashbari Road) under Mashalpur (R and B) Divsion,Works,Open Tender,Item Rate,Civil Works,No,No,NA ,06-Dec-2017 12:00 PM,NA ,180.0,No ,No,Offline,22-Dec-2017 11:00 AM,Bodoland Territorial Council||PWD-BTC,Mushalpur,781372.0,2.0,"39,79,000",BANESWAR WARY,3979000.0,Accepted-AOC,01-Feb-2022,AOC,Bodoland Territorial Council||PWD-BTC,True,"{'Flood': 0, 'Embankment': 0, 'embkt': 0, 'Relief': 0, 'Erosion': 2, 'SDRF': 0, 'Inundation': 0, 'Hydrology': 0, 'Silt': 0, 'Siltation': 0, 'Bund': 0, 'Trench': 0, 'Breach': 0, 'Culvert': 0, 'Sluice': 0, 'Dyke': 0, 'Storm water drain': 0, 'Emergency': 0, 'Immediate': 0, 'IM': 0, 'AE': 0, 'A E': 0, 'AAPDA MITRA': 0}","{'Floodlight': 0, 'Flood Light': 0, 'GAS': 0, 'FIFA': 0, 'pipe': 0, 'pipes': 0, 'covid': 0}",Post-Monsoon,,True,True,Repair and Restoration,{'imp.': 2}
2021_BoTC_23387_1,TN 168 of 2021-22 - 168/2,Restoration of Flood Damged road from Fakiragram Ravapara road,Restoration of Flood Damged road from Fakiragram Ravapara road (Road fromation from Ch.1100.00m to Ch.1280.00m and approach of RCC Br. no 2 /1) under SDRF (FDR) for the year 2020-21.,Works,Open Tender,Works,Civil Works – Roads,No,No,NA ,15-Nov-2021 09:00 AM,NA ,180.0,No ,No,Offline,26-Nov-2021 03:30 PM,Bodoland Territorial Council||PWD-BTC,FAKIRAGRAM,783346.0,2.0,"55,78,566",ACHINTA BASUMATARY,5578368.0,Accepted-AOC,07-Feb-2022,AOC,Bodoland Territorial Council||PWD-BTC,True,"{'Flood': 2, 'Embankment': 0, 'embkt': 0, 'Relief': 0, 'Erosion': 0, 'SDRF': 1, 'Inundation': 0, 'Hydrology': 0, 'Silt': 0, 'Siltation': 0, 'Bund': 0, 'Trench': 0, 'Breach': 0, 'Culvert': 0, 'Sluice': 0, 'Dyke': 0, 'Storm water drain': 0, 'Emergency': 0, 'Immediate': 0, 'IM': 0, 'AE': 0, 'A E': 0, 'AAPDA MITRA': 0}","{'Floodlight': 0, 'Flood Light': 0, 'GAS': 0, 'FIFA': 0, 'pipe': 0, 'pipes': 0, 'covid': 0}",Post-Monsoon,SDRF,False,True,Repair and Restoration,{'restoration': 2}
2021_DoWR_23145_1,GHY.EAST/2021-22/RIDF/II,Anti Erosion (A/E) measures to protect Pandu Sadilapur area from the erosion of river Brahmaputra,Anti Erosion (A/E) measures to protect Pandu Sadilapur area from the erosion of river Brahmaputra,Works,Open Tender,Works,Civil Works,No,No,NA ,09-Oct-2021 06:00 PM,NA ,180.0,No ,No,Online,01-Nov-2021 02:00 PM,Department of Water Resources||Chief Engineer - DoWR,GUWAHATI,781012.0,2.0,"4,08,77,818",Ashit Roy,36790037.0,Accepted-AOC,05-Feb-2022,AOC,Department of Water Resources||Chief Engineer - DoWR,True,"{'Flood': 0, 'Embankment': 0, 'embkt': 0, 'Relief': 0, 'Erosion': 4, 'SDRF': 0, 'Inundation': 0, 'Hydrology': 0, 'Silt': 0, 'Siltation': 0, 'Bund': 0, 'Trench': 0, 'Breach': 0, 'Culvert': 0, 'Sluice': 0, 'Dyke': 0, 'Storm water drain': 0, 'Emergency': 0, 'Immediate': 0, 'IM': 0, 'AE': 0, 'A E': 2, 'AAPDA MITRA': 0}","{'Floodlight': 0, 'Flood Light': 0, 'GAS': 0, 'FIFA': 0, 'pipe': 0, 'pipes': 0, 'covid': 0}",Monsoon,RIDF,True,False,Others,
2021_DoWR_23148_1,TEZPUR/2021-22/RIDF/I,Construction of Retaining wall to save Gohpur Area from flood devastation of river Chatrang at both banks from NH-15 to Madhya Chatrang.,Construction of Retaining wall to save Gohpur Area from flood devastation of river Chatrang at both banks from NH-15 to Madhya Chatrang.,Works,Open Tender,Works,Civil Works,No,No,NA ,09-Oct-2021 06:00 PM,NA ,180.0,No ,No,Online,01-Nov-2021 02:00 PM,Department of Water Resources||Chief Engineer - DoWR,TEZPUR,784001.0,2.0,"14,92,91,426",m/s shiva harlalka,134362284.21,Accepted-AOC,22-Feb-2022,AOC,Department of Water Resources||Chief Engineer - DoWR,True,"{'Flood': 2, 'Embankment': 0, 'embkt': 0, 'Relief': 0, 'Erosion': 0, 'SDRF': 0, 'Inundation': 0, 'Hydrology': 0, 'Silt': 0, 'Siltation': 0, 'Bund': 0, 'Trench': 0, 'Breach': 0, 'Culvert': 0, 'Sluice': 0, 'Dyke': 0, 'Storm water drain': 0, 'Emergency': 0, 'Immediate': 0, 'IM': 0, 'AE': 0, 'A E': 0, 'AAPDA MITRA': 0}","{'Floodlight': 0, 'Flood Light': 0, 'GAS': 0, 'FIFA': 0, 'pipe': 0, 'pipes': 0, 'covid': 0}",Monsoon,RIDF,False,False,Others,
2021_DoWR_23660_1,DHM/SOPD/JIADHAL/2021-22/1,Closing of Avulsion Channel of River Jiadhal on its L/B by constructing Embankment along with bank protection works in the breach portion including Channelisation,Closing of Avulsion Channel of River Jiadhal on its L/B by constructing Embankment along with bank protection works in the breach portion including Channelisation,Works,Open Tender,Works,Civil Works,No,No,NA ,10-Dec-2021 06:00 PM,NA ,180.0,No ,No,Online,07-Jan-2022 03:00 PM,Department of Water Resources||Chief Engineer - DoWR,Dhemaji,787057.0,2.0,"49,29,11,345",Flexituff Ventures International Ltd.,443620211.0,Accepted-AOC,21-Feb-2022,AOC,Department of Water Resources||Chief Engineer - DoWR,True,"{'Flood': 0, 'Embankment': 2, 'embkt': 0, 'Relief': 0, 'Erosion': 0, 'SDRF': 0, 'Inundation': 0, 'Hydrology': 0, 'Silt': 0, 'Siltation': 0, 'Bund': 0, 'Trench': 0, 'Breach': 2, 'Culvert': 0, 'Sluice': 0, 'Dyke': 0, 'Storm water drain': 0, 'Emergency': 0, 'Immediate': 0, 'IM': 0, 'AE': 0, 'A E': 0, 'AAPDA MITRA': 0}","{'Floodlight': 0, 'Flood Light': 0, 'GAS': 0, 'FIFA': 0, 'pipe': 0, 'pipes': 0, 'covid': 0}",Post-Monsoon,SOPD,False,True,Others,
2021_ICD_21047_1,AIIDC/2078/2018/178/1483 dt 4/2/2021,"Up gradation of Industrial Estate, Dorikapar Sivasagar District Sivasagar (Erosion Protection works) Group No I","Up gradation of Industrial Estate, Dorikapar Sivasagar District Sivasagar (Erosion Protection works) Group No I",Works,Open Tender,Item Rate,Civil Works,No,No,NA ,08-Feb-2021 02:00 PM,NA ,180.0,No ,No,Offline,18-Feb-2021 03:00 PM,Industries and Commerce Department||Assam Industrial Infrastructure Development Corporation,IE Sivsagar,785640.0,2.0,,MS UNIQUE CONSTRUCTION AND SUPPLY,6041701.0,Accepted-AOC,19-Feb-2022,AOC,Industries and Commerce Department||Assam Industrial Infrastructure Development Corporation,True,"{'Flood': 0, 'Embankment': 0, 'embkt': 0, 'Relief': 0, 'Erosion': 2, 'SDRF': 0, 'Inundation': 0, 'Hydrology': 0, 'Silt': 0, 'Siltation': 0, 'Bund': 0, 'Trench': 0, 'Breach': 0, 'Culvert': 0, 'Sluice': 0, 'Dyke': 0, 'Storm water drain': 0, 'Emergency': 0, 'Immediate': 0, 'IM': 0, 'AE': 0, 'A E': 0, 'AAPDA MITRA': 0}","{'Floodlight': 0, 'Flood Light': 0, 'GAS': 0, 'FIFA': 0, 'pipe': 0, 'pipes': 0, 'covid': 0}",Pre-Monsoon,,True,False,Others,
2022_PWD_24346_1,DSTRD/DHO/SDRF/2115-22,Repair Restoration of Silchar Hailakandi Road from Ch. 18.00 Km. to Ch. 30.00 Km under SDRF for the year 2020_21,Repair Restoration of Silchar Hailakandi Road from Ch. 18.00 Km. to Ch. 30.00 Km under SDRF for the year 2020_21,Works,Open Tender,Item Rate,Civil Works – Roads,No,No,NA ,15-Feb-2022 11:00 AM,NA ,180.0,No ,No,Offline,21-Feb-2022 02:10 PM,Public Works Roads Department,"Dholai LAC, Cachar",788114.0,2.0,"23,84,000",JYOTI RANJAN DEY,2383999.0,Accepted-AOC,22-Feb-2022,AOC,Public Works Roads Department,True,"{'Flood': 0, 'Embankment': 0, 'embkt': 0, 'Relief': 0, 'Erosion': 0, 'SDRF': 3, 'Inundation': 0, 'Hydrology': 0, 'Silt': 0, 'Siltation': 0, 'Bund': 0, 'Trench': 0, 'Breach': 0, 'Culvert': 0, 'Sluice': 0, 'Dyke': 0, 'Storm water drain': 0, 'Emergency': 0, 'Immediate': 0, 'IM': 0, 'AE': 0, 'A E': 0, 'AAPDA MITRA': 0}","{'Floodlight': 0, 'Flood Light': 0, 'GAS': 0, 'FIFA': 0, 'pipe': 0, 'pipes': 0, 'covid': 0}",Pre-Monsoon,SDRF,False,True,Repair and Restoration,"{'repair': 2, 'restoration': 2}"
