Tender ID,tender_externalreference,tender_title,Work Description,Tender Category,Tender Type,Form of contract,Product Category,Is Multi Currency Allowed For BOQ,Allow Two Stage Bidding,Independent External Monitor/Remarks,Published Date,Pre Bid Meeting Date,Bid Validity(Days),Should Allow NDA Tender,Allow Preferential Bidder,Payment Mode,Bid Opening Date,Organisation Chain,location,Pincode,No of Bids Received,Tender Value in ₹,Bidder Name,Awarded Value,Status,Contract Date :,Tender Stage,Department,is_flood_tender,positive_keywords_dict,negative_keywords_dict,Season,Scheme,Erosion,Roads_Bridges_Embkt,Response Type,Flood Response - Subhead
2023_DoWR_30121_1,KOKRAJHAR/2022-23/SOPDG-II/IV,A/E measures to protect Naowarbita and its adjoining areas from the erosion of river Longa on R/B.,A/E measures to protect Naowarbita and its adjoining areas from the erosion of river Longa on R/B.,Works,Open Tender,Works,Civil Works,No,No,NA ,24-Mar-2023 06:00 PM,NA ,180.0,No ,No,Online,13-Apr-2023 03:00 PM,Department of Water Resources||Chief Engineer - DoWR,KOKRAJHAR,783370.0,2.0,"1,49,82,946",DHILAN BASUMATARY,13484651.0,Accepted-AOC,24-Jul-2023,AOC,Department of Water Resources||Chief Engineer - DoWR,True,"{'Flood': 0, 'Embankment': 0, 'embkt': 0, 'Relief': 0, 'Erosion': 2, 'SDRF': 0, 'Inundation': 0, 'Hydrology': 0, 'Silt': 0, 'Siltation': 0, 'Bund': 0, 'Trench': 0, 'Breach': 0, 'Culvert': 0, 'Sluice': 0, 'Dyke': 0, 'Storm water drain': 0, 'Emergency': 0, 'Immediate': 0, 'IM': 0, 'AE': 0, 'A E': 2, 'AAPDA MITRA': 0}","{'Floodlight': 0, 'Flood Light': 0, 'GAS': 0, 'FIFA': 0, 'pipe': 0, 'pipes': 0, 'covid': 0}",Pre-Monsoon,,True,False,Others,
2023_DoWR_30174_2,GHY EAST/2022-23/SOPD-ODS/II,Procurement of flood fighting materials (E.C Bag) for Water Resources Department for the year 2023-24 ( Zone-1) RETENDER,Procurement of flood fighting materials (E.C Bag) for Water Resources Department for the year 2023-24 ( Zone-1),Goods,Open Tender,Supply,Supply of Materials,No,No,NA ,29-May-2023 06:30 PM,NA ,180.0,No ,No,Online,06-Jun-2023 03:00 PM,Department of Water Resources||Chief Engineer - DoWR,Guwahati,781029.0,2.0,"1,29,63,350",SKH VENTURE LLP,11670550.0,Accepted-AOC,25-Jul-2023,AOC,Department of Water Resources||Chief Engineer - DoWR,True,"{'Flood': 2, 'Embankment': 0, 'embkt': 0, 'Relief': 0, 'Erosion': 0, 'SDRF': 0, 'Inundation': 0, 'Hydrology': 0, 'Silt': 0, 'Siltation': 0, 'Bund': 0, 'Trench': 0, 'Breach': 0, 'Culvert': 0, 'Sluice': 0, 'Dyke': 0, 'Storm water drain': 0, 'Emergency': 0, 'Immediate': 0, 'IM': 0, 'AE': 0, 'A E': 0, 'AAPDA MITRA': 0}","{'Floodlight': 0, 'Flood Light': 0, 'GAS': 0, 'FIFA': 0, 'pipe': 0, 'pipes': 0, 'covid': 0}",Monsoon,SOPD,False,False,Others,
2023_DoWR_30177_2,GHY EAST/2022-23/SOPD-ODS/III,Procurement of flood fighting materials (Geo Mega Bag) for Water Resources Department for the year 2023-24. RETENDER,Procurement of flood fighting materials (Geo Mega Bag) for Water Resources Department for the year 2023-24.,Goods,Open Tender,Supply,Supply of Materials,No,No,NA ,21-Apr-2023 06:00 PM,NA ,180.0,No ,No,Online,29-Apr-2023 03:00 PM,Department of Water Resources||Chief Engineer - DoWR,GUWAHATI,781029.0,2.0,"1,99,95,944",Chandit Kumar Baro,19395807.6,Accepted-AOC,25-Jul-2023,AOC,Department of Water Resources||Chief Engineer - DoWR,True,"{'Flood': 2, 'Embankment': 0, 'embkt': 0, 'Relief': 0, 'Erosion': 0, 'SDRF': 0, 'Inundation': 0, 'Hydrology': 0, 'Silt': 0, 'Siltation': 0, 'Bund': 0, 'Trench': 0, 'Breach': 0, 'Culvert': 0, 'Sluice': 0, 'Dyke': 0, 'Storm water drain': 0, 'Emergency': 0, 'Immediate': 0, 'IM': 0, 'AE': 0, 'A E': 0, 'AAPDA MITRA': 0}","{'Floodlight': 0, 'Flood Light': 0, 'GAS': 0, 'FIFA': 0, 'pipe': 0, 'pipes': 0, 'covid': 0}",Pre-Monsoon,SOPD,False,False,Others,
2023_DoWR_30353_1,JORHAT/2022-23/SOPDG-II/I,Protection of Merapani Town including de-siltation of Mera river,Protection of Merapani Town including de-siltation of Mera river,Works,Open Tender,Works,Civil Works,No,No,NA ,04-Apr-2023 06:50 PM,NA ,180.0,No ,No,Online,25-Apr-2023 03:00 PM,Department of Water Resources||Chief Engineer - DoWR,JORHAT,785001.0,2.0,"1,94,99,946",Ashok Kumar Jain,17549952.0,Accepted-AOC,27-Jul-2023,AOC,Department of Water Resources||Chief Engineer - DoWR,True,"{'Flood': 0, 'Embankment': 0, 'embkt': 0, 'Relief': 0, 'Erosion': 0, 'SDRF': 0, 'Inundation': 0, 'Hydrology': 0, 'Silt': 0, 'Siltation': 2, 'Bund': 0, 'Trench': 0, 'Breach': 0, 'Culvert': 0, 'Sluice': 0, 'Dyke': 0, 'Storm water drain': 0, 'Emergency': 0, 'Immediate': 0, 'IM': 0, 'AE': 0, 'A E': 0, 'AAPDA MITRA': 0}","{'Floodlight': 0, 'Flood Light': 0, 'GAS': 0, 'FIFA': 0, 'pipe': 0, 'pipes': 0, 'covid': 0}",Pre-Monsoon,,False,True,Others,
2023_GMC_29214_9,GER/CE/1806/2019/Part-A/17 Dated 01/02/2023,Construction of road and drain at Kalimandir Path Sati joy Moti Nagar. Construction of Silt chamber with approach Road at Milanpur Pani path. Construction of silt chamber at GMCH road near Hanu Boro path,Improvement of various works under Guwahati Municipal Corporation,Works,Open Tender,Lump-sum,Civil Works,No,No,NA ,08-Feb-2023 09:00 AM,NA ,90.0,No ,No,Online,27-Feb-2023 02:30 PM,Guwahati Municipal Corporation,GUWAHATI,781005.0,2.0,"1,75,09,000",Dilip patowary,13622002.0,Accepted-AOC,20-Jul-2023,AOC,Guwahati Municipal Corporation,True,"{'Flood': 0, 'Embankment': 0, 'embkt': 0, 'Relief': 0, 'Erosion': 0, 'SDRF': 0, 'Inundation': 0, 'Hydrology': 0, 'Silt': 2, 'Siltation': 0, 'Bund': 0, 'Trench': 0, 'Breach': 0, 'Culvert': 0, 'Sluice': 0, 'Dyke': 0, 'Storm water drain': 0, 'Emergency': 0, 'Immediate': 0, 'IM': 0, 'AE': 0, 'A E': 0, 'AAPDA MITRA': 0}","{'Floodlight': 0, 'Flood Light': 0, 'GAS': 0, 'FIFA': 0, 'pipe': 0, 'pipes': 0, 'covid': 0}",Pre-Monsoon,,False,True,Repair and Restoration,{'improvement': 1}
2023_PWD_30302_10,CE/Commn/01/ RIDF-XXVIII/2022-23/5,RE/RIDF-XXVIII/Dharmapur/1,Road cum Embankment M/E along L/B Nadla Drainage Channel from Railway line to its outfall at river Buradiya under RIDF-XXVIII of NABARD for the year 2022-23 (From Ch 0m to 3650m),Works,Open Tender,Item Rate,Civil Works – Roads,No,No,NA ,03-Apr-2023 03:00 PM,NA ,180.0,No ,No,Online,24-Apr-2023 02:30 PM,Public Works Roads Department||CE PWD(R) - PWD||Traffic Engineering Cell - PWD,Dharmapur,781335.0,2.0,"5,55,86,700",Dhaneswar Kalita,50028030.0,Accepted-AOC,24-Jul-2023,AOC,Public Works Roads Department||CE PWD(R) - PWD||Traffic Engineering Cell - PWD,True,"{'Flood': 0, 'Embankment': 1, 'embkt': 0, 'Relief': 0, 'Erosion': 0, 'SDRF': 0, 'Inundation': 0, 'Hydrology': 0, 'Silt': 0, 'Siltation': 0, 'Bund': 0, 'Trench': 0, 'Breach': 0, 'Culvert': 0, 'Sluice': 0, 'Dyke': 0, 'Storm water drain': 0, 'Emergency': 0, 'Immediate': 0, 'IM': 0, 'AE': 0, 'A E': 0, 'AAPDA MITRA': 0}","{'Floodlight': 0, 'Flood Light': 0, 'GAS': 0, 'FIFA': 0, 'pipe': 0, 'pipes': 0, 'covid': 0}",Pre-Monsoon,RIDF,False,True,Others,
2023_PWD_30321_16,CE/Commn/01/ RIDF-XXVIII/2022-23/5,RE/RIDF-XXVIII/Sadiya/1,Construction of road cum embankment Saikhowa Protection Bund Ph-II River Brahmaputra under RIDF-XXVIII of NABARD (Mukhya Mantri Mothauri Pokikaran Achani) for the year 2022-23,Works,Open Tender,Item Rate,Civil Works – Roads,No,No,NA ,04-Apr-2023 04:00 PM,NA ,180.0,No ,No,Online,24-Apr-2023 02:30 PM,Public Works Roads Department||CE PWD(R) - PWD||Traffic Engineering Cell - PWD,Sadiya,786155.0,2.0,"12,11,98,000",Sanjay Kumar Singh,121197821.0,Accepted-AOC,19-Jul-2023,AOC,Public Works Roads Department||CE PWD(R) - PWD||Traffic Engineering Cell - PWD,True,"{'Flood': 0, 'Embankment': 1, 'embkt': 0, 'Relief': 0, 'Erosion': 0, 'SDRF': 0, 'Inundation': 0, 'Hydrology': 0, 'Silt': 0, 'Siltation': 0, 'Bund': 1, 'Trench': 0, 'Breach': 0, 'Culvert': 0, 'Sluice': 0, 'Dyke': 0, 'Storm water drain': 0, 'Emergency': 0, 'Immediate': 0, 'IM': 0, 'AE': 0, 'A E': 0, 'AAPDA MITRA': 0}","{'Floodlight': 0, 'Flood Light': 0, 'GAS': 0, 'FIFA': 0, 'pipe': 0, 'pipes': 0, 'covid': 0}",Pre-Monsoon,RIDF,False,True,Others,
2023_PWD_30321_40,CE/Commn/01/ RIDF-XXVIII/2022-23/5,RE/RIDF-XXVIII/Patharkandi/4,Flood Protection Drainage in Patherkandi Ph-II ( From Sipergoan PMGSY Package end to Kalkalighat Railway Bridge via Jamirala Village (Length - 2.80KM) under RIDF-XXVIII of NABARD (MMMPA) for the year 2022-23 of District Karimganj (Patherkandi LAC),Works,Open Tender,Item Rate,Civil Works – Roads,No,No,NA ,04-Apr-2023 04:00 PM,NA ,180.0,No ,No,Online,24-Apr-2023 02:30 PM,Public Works Roads Department||CE PWD(R) - PWD||Traffic Engineering Cell - PWD,Patharkandi,788724.0,2.0,"3,83,32,000",KABIR UDDIN,38316000.0,Accepted-AOC,10-Jul-2023,AOC,Public Works Roads Department||CE PWD(R) - PWD||Traffic Engineering Cell - PWD,True,"{'Flood': 1, 'Embankment': 0, 'embkt': 0, 'Relief': 0, 'Erosion': 0, 'SDRF': 0, 'Inundation': 0, 'Hydrology': 0, 'Silt': 0, 'Siltation': 0, 'Bund': 0, 'Trench': 0, 'Breach': 0, 'Culvert': 0, 'Sluice': 0, 'Dyke': 0, 'Storm water drain': 0, 'Emergency': 0, 'Immediate': 0, 'IM': 0, 'AE': 0, 'A E': 0, 'AAPDA MITRA': 0}","{'Floodlight': 0, 'Flood Light': 0, 'GAS': 0, 'FIFA': 0, 'pipe': 0, 'pipes': 0, 'covid': 0}",Pre-Monsoon,RIDF,False,True,Immediate Measures,{'package': 1}
2023_PWD_30656_1,CE/Commn/1/RIDF-28/22-23/12,RE/RIDF-XXVIII/Kamalpur/1,"Construction of road cum embankment RG Railway Line to Boromboi on L/B Embankment of Puthimari, Puthimari River under RIDF-XXVIII of NABARD (MMMPA) for the year 2022-23 of District-Kamrup (Kamalpur LAC) Phase-II",Works,Open Tender,Item Rate,Civil Works – Roads,No,No,NA ,02-May-2023 02:00 PM,NA ,180.0,No ,No,Online,09-May-2023 02:15 PM,Public Works Roads Department||CE PWD(R) - PWD||Traffic Engineering Cell - PWD,Kamalpur,781380.0,2.0,"13,63,30,000",M/S Bright Engineer,136330000.0,Accepted-AOC,12-Jul-2023,AOC,Public Works Roads Department||CE PWD(R) - PWD||Traffic Engineering Cell - PWD,True,"{'Flood': 0, 'Embankment': 2, 'embkt': 0, 'Relief': 0, 'Erosion': 0, 'SDRF': 0, 'Inundation': 0, 'Hydrology': 0, 'Silt': 0, 'Siltation': 0, 'Bund': 0, 'Trench': 0, 'Breach': 0, 'Culvert': 0, 'Sluice': 0, 'Dyke': 0, 'Storm water drain': 0, 'Emergency': 0, 'Immediate': 0, 'IM': 0, 'AE': 0, 'A E': 0, 'AAPDA MITRA': 0}","{'Floodlight': 0, 'Flood Light': 0, 'GAS': 0, 'FIFA': 0, 'pipe': 0, 'pipes': 0, 'covid': 0}",Pre-Monsoon,RIDF,False,True,Others,
