Tender ID,tender_externalreference,tender_title,Work Description,Tender Category,Tender Type,Form of contract,Product Category,Is Multi Currency Allowed For BOQ,Allow Two Stage Bidding,Independent External Monitor/Remarks,Published Date,Pre Bid Meeting Date,Bid Validity(Days),Should Allow NDA Tender,Allow Preferential Bidder,Payment Mode,Bid Opening Date,Organisation Chain,location,Pincode,No of Bids Received,Tender Value in ₹,Bidder Name,Awarded Value,Status,Contract Date :,Department,is_flood_tender,positive_keywords_dict,negative_keywords_dict,Season,Scheme,Erosion,Roads_Bridges_Embkt,Response Type,Flood Response - Subhead
2023_DoWR_31698_2,MANGALDOI/2023-24/SDMF/I,Mitigation of erosion of Mangaldoi town and its adjoining areas from the river Mangaldoi. Package 1 RETENDER,Mitigation of erosion of Mangaldoi town and its adjoining areas from the river Mangaldoi.,Works,Open Tender,Works,Civil Works,No,No,NA ,22-Dec-2023 06:30 PM,NA ,180.0,No ,No,Online,29-Dec-2023 03:00 PM,Department of Water Resources||Chief Engineer - DoWR,MANGALDAI,784125.0,2.0,"2,53,21,357",JYOTIRMOY SARMA,,Accepted-AOC,,Department of Water Resources||Chief Engineer - DoWR,True,"{'Flood': 0, 'Embankment': 0, 'embkt': 0, 'Relief': 0, 'Erosion': 2, 'SDRF': 0, 'Inundation': 0, 'Hydrology': 0, 'Silt': 0, 'Siltation': 0, 'Bund': 0, 'Trench': 0, 'Breach': 0, 'Culvert': 0, 'Sluice': 0, 'Dyke': 0, 'Storm water drain': 0, 'Emergency': 0, 'Immediate': 0, 'IM': 0, 'AE': 0, 'A E': 0, 'AAPDA MITRA': 0}","{'Floodlight': 0, 'Flood Light': 0, 'GAS': 0, 'FIFA': 0, 'pipe': 0, 'pipes': 0, 'covid': 0}",Post-Monsoon,,True,False,Immediate Measures,{'package': 1}
2023_DoWR_33033_2,BARPETA/2023-24/RIDF/I,Pro-siltation measures to protect B/Dyke from Bahari to Baghbar at Dokreswar-Belortari area on R/B of river Brahmaputra.,Pro-siltation measures to protect B/Dyke from Bahari to Baghbar at Dokreswar-Belortari area on R/B of river Brahmaputra.,Works,Open Tender,Works,Civil Works,No,No,NA ,06-Jan-2024 06:30 PM,NA ,180.0,No ,No,Online,17-Jan-2024 03:00 PM,Department of Water Resources||Chief Engineer - DoWR,BARPETA,781301.0,2.0,"4,44,99,937",Ashit Roy,,Accepted-AOC,,Department of Water Resources||Chief Engineer - DoWR,True,"{'Flood': 0, 'Embankment': 0, 'embkt': 0, 'Relief': 0, 'Erosion': 0, 'SDRF': 0, 'Inundation': 0, 'Hydrology': 0, 'Silt': 0, 'Siltation': 2, 'Bund': 0, 'Trench': 0, 'Breach': 0, 'Culvert': 0, 'Sluice': 0, 'Dyke': 2, 'Storm water drain': 0, 'Emergency': 0, 'Immediate': 0, 'IM': 0, 'AE': 0, 'A E': 0, 'AAPDA MITRA': 0}","{'Floodlight': 0, 'Flood Light': 0, 'GAS': 0, 'FIFA': 0, 'pipe': 0, 'pipes': 0, 'covid': 0}",Pre-Monsoon,RIDF,False,True,Others,
2023_DoWR_33195_2,MORIGAON/2023-24/RIDF/IV,Construction of new embankment on the right bank of river Killing from NH-way to Killing-Kopilli junction. RETENDER,Construction of new embankment on the right bank of river Killing from NH-way to Killing-Kopilli junction.,Works,Open Tender,Works,Civil Works,No,No,NA ,06-Jan-2024 06:30 PM,NA ,180.0,No ,No,Online,17-Jan-2024 03:00 PM,Department of Water Resources||Chief Engineer - DoWR,Morigaon,782105.0,2.0,"13,99,99,974",D KUMAR AND COMPANY,"125,999,977",Accepted-AOC,12-Apr-2024,Department of Water Resources||Chief Engineer - DoWR,True,"{'Flood': 0, 'Embankment': 2, 'embkt': 0, 'Relief': 0, 'Erosion': 0, 'SDRF': 0, 'Inundation': 0, 'Hydrology': 0, 'Silt': 0, 'Siltation': 0, 'Bund': 0, 'Trench': 0, 'Breach': 0, 'Culvert': 0, 'Sluice': 0, 'Dyke': 0, 'Storm water drain': 0, 'Emergency': 0, 'Immediate': 0, 'IM': 0, 'AE': 0, 'A E': 0, 'AAPDA MITRA': 0}","{'Floodlight': 0, 'Flood Light': 0, 'GAS': 0, 'FIFA': 0, 'pipe': 0, 'pipes': 0, 'covid': 0}",Pre-Monsoon,RIDF,False,True,Others,
2023_DoWR_33254_2,SIVASAGAR/2023-24/RIDF/V,"Protection of Kokilamari Soniboria Bazar area of B/dyke from Laibeel to Tengapani from the erosion of river Brahmaputra, RETENDER.",Protection of Kokilamari Soniboria Bazar area of B/dyke from Laibeel to Tengapani from the erosion of river Brahmaputra.,Works,Open Tender,Works,Civil Works,No,No,NA ,08-Jan-2024 06:30 PM,NA ,180.0,No ,No,Online,17-Jan-2024 03:00 PM,Department of Water Resources||Chief Engineer - DoWR,SIVASAGAR,785640.0,2.0,"7,89,81,915",SANJIB BORUAH,"78,981,331",Accepted-AOC,06-Apr-2024,Department of Water Resources||Chief Engineer - DoWR,True,"{'Flood': 0, 'Embankment': 0, 'embkt': 0, 'Relief': 0, 'Erosion': 2, 'SDRF': 0, 'Inundation': 0, 'Hydrology': 0, 'Silt': 0, 'Siltation': 0, 'Bund': 0, 'Trench': 0, 'Breach': 0, 'Culvert': 0, 'Sluice': 0, 'Dyke': 2, 'Storm water drain': 0, 'Emergency': 0, 'Immediate': 0, 'IM': 0, 'AE': 0, 'A E': 0, 'AAPDA MITRA': 0}","{'Floodlight': 0, 'Flood Light': 0, 'GAS': 0, 'FIFA': 0, 'pipe': 0, 'pipes': 0, 'covid': 0}",Pre-Monsoon,RIDF,True,True,Others,
2023_DoWR_34771_1,GHY EAST/2023-24/M AND R/II,Procurement of flood fighting materials (Geo-textile Bag of Type-B and PSC Porcupine) for Water Resources Department for the year 2023-24.,Procurement of flood fighting materials (Geo-textile Bag of Type-B and PSC Porcupine) for Water Resources Department for the year 2023-24.,Works,Open Tender,Works,Civil Works,No,No,NA ,18-Dec-2023 06:30 PM,NA ,180.0,No ,No,Online,26-Dec-2023 03:00 PM,Department of Water Resources||Chief Engineer - DoWR,GUWAHATI EAST,781029.0,2.0,"1,99,92,917",Ashit Roy,,Accepted-AOC,,Department of Water Resources||Chief Engineer - DoWR,True,"{'Flood': 2, 'Embankment': 0, 'embkt': 0, 'Relief': 0, 'Erosion': 0, 'SDRF': 0, 'Inundation': 0, 'Hydrology': 0, 'Silt': 0, 'Siltation': 0, 'Bund': 0, 'Trench': 0, 'Breach': 0, 'Culvert': 0, 'Sluice': 0, 'Dyke': 0, 'Storm water drain': 0, 'Emergency': 0, 'Immediate': 0, 'IM': 0, 'AE': 0, 'A E': 0, 'AAPDA MITRA': 0}","{'Floodlight': 0, 'Flood Light': 0, 'GAS': 0, 'FIFA': 0, 'pipe': 0, 'pipes': 0, 'covid': 0}",Post-Monsoon,,False,False,Repair and Restoration,{'m and r': 1}
2023_DoWR_34977_1,MORIGAON/2023-24/RIDF/V,"Construction of T/Dyke on left bank of river Kollong from Dighaliati to Telahi including construction of sluice gates, PACKAGE 1",Construction of T/Dyke on left bank of river Kollong from Dighaliati to Telahi including construction of sluice gates.,Works,Open Tender,Works,Civil Works,No,No,NA ,26-Dec-2023 06:35 PM,NA ,180.0,No ,No,Online,12-Jan-2024 03:00 PM,Department of Water Resources||Chief Engineer - DoWR,Morigaon,782105.0,2.0,"30,86,35,750",D KUMAR AND COMPANY,"277,780,467.38",Accepted-AOC,10-Apr-2024,Department of Water Resources||Chief Engineer - DoWR,True,"{'Flood': 0, 'Embankment': 0, 'embkt': 0, 'Relief': 0, 'Erosion': 0, 'SDRF': 0, 'Inundation': 0, 'Hydrology': 0, 'Silt': 0, 'Siltation': 0, 'Bund': 0, 'Trench': 0, 'Breach': 0, 'Culvert': 0, 'Sluice': 2, 'Dyke': 2, 'Storm water drain': 0, 'Emergency': 0, 'Immediate': 0, 'IM': 0, 'AE': 0, 'A E': 0, 'AAPDA MITRA': 0}","{'Floodlight': 0, 'Flood Light': 0, 'GAS': 0, 'FIFA': 0, 'pipe': 0, 'pipes': 0, 'covid': 0}",Post-Monsoon,RIDF,False,True,Immediate Measures,{'package': 1}
2023_DoWR_34978_1,MORIGAON/2023-24/RIDF/V,"Construction of T/Dyke on left bank of river Kollong from Dighaliati to Telahi including construction of sluice gates, PACKAGE 2",Construction of T/Dyke on left bank of river Kollong from Dighaliati to Telahi including construction of sluice gates.,Works,Open Tender,Works,Civil Works,No,No,NA ,26-Dec-2023 06:35 PM,NA ,180.0,No ,No,Online,12-Jan-2024 03:00 PM,Department of Water Resources||Chief Engineer - DoWR,Morigaon,782105.0,2.0,"4,94,20,956",D KUMAR AND COMPANY,"44,478,861",Accepted-AOC,10-Apr-2024,Department of Water Resources||Chief Engineer - DoWR,True,"{'Flood': 0, 'Embankment': 0, 'embkt': 0, 'Relief': 0, 'Erosion': 0, 'SDRF': 0, 'Inundation': 0, 'Hydrology': 0, 'Silt': 0, 'Siltation': 0, 'Bund': 0, 'Trench': 0, 'Breach': 0, 'Culvert': 0, 'Sluice': 2, 'Dyke': 2, 'Storm water drain': 0, 'Emergency': 0, 'Immediate': 0, 'IM': 0, 'AE': 0, 'A E': 0, 'AAPDA MITRA': 0}","{'Floodlight': 0, 'Flood Light': 0, 'GAS': 0, 'FIFA': 0, 'pipe': 0, 'pipes': 0, 'covid': 0}",Post-Monsoon,RIDF,False,True,Immediate Measures,{'package': 1}
2023_PWD_32684_125,CE/DEV/TB/08/2023-24/14,"MMNPPNA_23_24_86 (i) Construction of RCC drain at Paruj Bora road(Sechabat), (ii) Construction of Choukat Ali road including both side drain (Ch-0.00 m to Ch-140.00 m), (iii) Construction of drain by the side of R.D.M. road including culvert, (iv)","MMNPPNA_23_24_86 (i) Construction of RCC drain at Paruj Bora road(Sechabat), (ii) Construction of Choukat Ali road including both side drain (Ch-0.00 m to Ch-140.00 m), (iii) Construction of drain by the side of R.D.M. road including culvert, (iv)",Works,Open Tender,Item Rate,Civil Works,No,No,NA ,07-Oct-2023 03:00 PM,09-Oct-2023 12:00 PM ,180.0,No ,No,Online,17-Oct-2023 02:00 PM,Public Works Roads Department,Nagaon MB,781003.0,2.0,"6,40,95,000",GUNJ ASSOCIATES,"64,090,585",Accepted-AOC,18-Apr-2024,Public Works Roads Department,True,"{'Flood': 0, 'Embankment': 0, 'embkt': 0, 'Relief': 0, 'Erosion': 0, 'SDRF': 0, 'Inundation': 0, 'Hydrology': 0, 'Silt': 0, 'Siltation': 0, 'Bund': 0, 'Trench': 0, 'Breach': 0, 'Culvert': 2, 'Sluice': 0, 'Dyke': 0, 'Storm water drain': 0, 'Emergency': 0, 'Immediate': 0, 'IM': 0, 'AE': 0, 'A E': 0, 'AAPDA MITRA': 0}","{'Floodlight': 0, 'Flood Light': 0, 'GAS': 0, 'FIFA': 0, 'pipe': 0, 'pipes': 0, 'covid': 0}",Monsoon,,False,True,Others,
2023_PWD_32885_51,CE/DEV/TB/08/2023-24/16,"MMNPPNA_23_24_186 CONSTRUCTION OF STORM WATER DRAIN FROM DIPHU CANCER CARE HOSPITAL TO DIPHU RIVER under Mukhya Mantrir Nagariya Pakipath Nirman Achani (MMNPPNA) for the year 2023-24, Diphu MB","MMNPPNA_23_24_186 CONSTRUCTION OF STORM WATER DRAIN FROM DIPHU CANCER CARE HOSPITAL TO DIPHU RIVER under Mukhya Mantrir Nagariya Pakipath Nirman Achani (MMNPPNA) for the year 2023-24, Diphu MB",Works,Open Tender,Item Rate,Civil Works,No,No,NA ,11-Oct-2023 06:55 PM,19-Oct-2023 12:00 PM ,180.0,No ,No,Online,27-Oct-2023 02:00 PM,Public Works Roads Department,Diphu MB,781003.0,2.0,"3,81,53,000",Anowar Hussain,"34,337,701",Accepted-AOC,04-Apr-2024,Public Works Roads Department,True,"{'Flood': 0, 'Embankment': 0, 'embkt': 0, 'Relief': 0, 'Erosion': 0, 'SDRF': 0, 'Inundation': 0, 'Hydrology': 0, 'Silt': 0, 'Siltation': 0, 'Bund': 0, 'Trench': 0, 'Breach': 0, 'Culvert': 0, 'Sluice': 0, 'Dyke': 0, 'Storm water drain': 2, 'Emergency': 0, 'Immediate': 0, 'IM': 0, 'AE': 0, 'A E': 0, 'AAPDA MITRA': 0}","{'Floodlight': 0, 'Flood Light': 0, 'GAS': 0, 'FIFA': 0, 'pipe': 0, 'pipes': 0, 'covid': 0}",Monsoon,,False,True,Others,
2023_PWD_33242_8,CE/CW/20/2023-24-Nagariya(GMC),Gr. No. MMNPPNA/GMC/05/8,"Impt of 1) Durga mandir Rd,Drain, Ananda nagar, 2) Boripara Rd (Reconst of RCC Cross Culvert, Cattle Bridge),3) GRPF Colony Rd, 4) Const of Byelanes With Drain at Boripara under Mukhya Mantrir Nagoriya Paki Path Nirman Achani for 2023-24.",Works,Open Tender,Item Rate,Civil Works – Roads,No,No,NA ,25-Oct-2023 12:00 PM,NA ,180.0,No ,No,Online,14-Nov-2023 02:30 PM,Public Works Roads Department,Guwahati,781014.0,2.0,"1,85,58,000",NARAYAN DAS,,Accepted-AOC,,Public Works Roads Department,True,"{'Flood': 0, 'Embankment': 0, 'embkt': 0, 'Relief': 0, 'Erosion': 0, 'SDRF': 0, 'Inundation': 0, 'Hydrology': 0, 'Silt': 0, 'Siltation': 0, 'Bund': 0, 'Trench': 0, 'Breach': 0, 'Culvert': 1, 'Sluice': 0, 'Dyke': 0, 'Storm water drain': 0, 'Emergency': 0, 'Immediate': 0, 'IM': 0, 'AE': 0, 'A E': 0, 'AAPDA MITRA': 0}","{'Floodlight': 0, 'Flood Light': 0, 'GAS': 0, 'FIFA': 0, 'pipe': 0, 'pipes': 0, 'covid': 0}",Post-Monsoon,,False,True,Repair and Restoration,"{'imp.': 1, 'impt.': 1}"
2023_PWD_33245_13,CE/CW/20/23-24/1_Nagariya_GMC1,MMNPPNA/GMC/34/69,"Re-construction of Bhupen Hazarika House to Kailashpur at Nizarapar Road including construction of Load Bearing Drain, 3 nos. of RCC Box Culvert with Iron Cover and restoration of damaged culvert under MMNPPNA for the year 2023-24",Works,Open Tender,Item Rate,Civil Works – Roads,No,No,NA ,25-Oct-2023 04:00 PM,31-Oct-2023 04:00 PM ,180.0,No ,No,Online,14-Nov-2023 02:30 PM,Public Works Roads Department||CE PWD(R) - PWD||Traffic Engineering Cell - PWD,Guwahati,781032.0,2.0,"1,98,23,000",Madhab Sarmah,"17,840,700",Accepted-AOC,03-Apr-2024,Public Works Roads Department||CE PWD(R) - PWD||Traffic Engineering Cell - PWD,True,"{'Flood': 0, 'Embankment': 0, 'embkt': 0, 'Relief': 0, 'Erosion': 0, 'SDRF': 0, 'Inundation': 0, 'Hydrology': 0, 'Silt': 0, 'Siltation': 0, 'Bund': 0, 'Trench': 0, 'Breach': 0, 'Culvert': 2, 'Sluice': 0, 'Dyke': 0, 'Storm water drain': 0, 'Emergency': 0, 'Immediate': 0, 'IM': 0, 'AE': 0, 'A E': 0, 'AAPDA MITRA': 0}","{'Floodlight': 0, 'Flood Light': 0, 'GAS': 0, 'FIFA': 0, 'pipe': 0, 'pipes': 0, 'covid': 0}",Post-Monsoon,,False,True,Repair and Restoration,{'restoration': 1}
2023_PWD_33797_257,CE/Maint/MMPNA/01/2023-24/03,MMPNA/2023-24/74,"MMPNA/2023-24/74_Periodic Renewal of MDR NH 15 at Gandhjuli to Belsiri Rly. Station Road ( Ch. From 1000.00m to 2930.00m), Repairing of Culvert No.2/2and 3/2 on Garmara to Gangapur Road (Ch.From 0.00 to 2500.00m), Culvert No.4/1 NH-15 Gejengaguri to",Works,Open Tender,Item Rate,Civil Works – Roads,No,No,NA ,14-Nov-2023 09:00 AM,22-Nov-2023 12:00 PM ,180.0,No ,No,Online,01-Dec-2023 03:00 PM,Public Works Roads Department,Dhekiajuli,781003.0,2.0,"1,20,13,000",Mousum Bora,"12,010,000",Accepted-AOC,08-Apr-2024,Public Works Roads Department,True,"{'Flood': 0, 'Embankment': 0, 'embkt': 0, 'Relief': 0, 'Erosion': 0, 'SDRF': 0, 'Inundation': 0, 'Hydrology': 0, 'Silt': 0, 'Siltation': 0, 'Bund': 0, 'Trench': 0, 'Breach': 0, 'Culvert': 2, 'Sluice': 0, 'Dyke': 0, 'Storm water drain': 0, 'Emergency': 0, 'Immediate': 0, 'IM': 0, 'AE': 0, 'A E': 0, 'AAPDA MITRA': 0}","{'Floodlight': 0, 'Flood Light': 0, 'GAS': 0, 'FIFA': 0, 'pipe': 0, 'pipes': 0, 'covid': 0}",Post-Monsoon,,False,True,Repair and Restoration,{'repairing': 1}
2023_PWD_34868_51,CE/Maint/MMPPNA/01/2023-24/1,Maint/MMPPNA/2023-24/120,"Maint/MMPPNA/2023-24/120_Construction of Road from Chepti Bihdia Road via Ghakucchi Chuburi to Puthimari Embankment , Bihdia Jayantipur road via Chaturvuz Satra to 2 No Bihdia LP School and Kalajal Balahati Road Haradutta Panchayat Office Titkuri",Works,Open Tender,Item Rate,Civil Works – Roads,No,No,NA ,21-Dec-2023 02:00 PM,21-Dec-2023 02:00 PM ,180.0,No ,No,Online,02-Jan-2024 11:00 AM,Public Works Roads Department,Kamrup,781003.0,2.0,"2,11,15,000",Bubul Bharali,"19,068,100",Accepted-AOC,03-Apr-2024,Public Works Roads Department,True,"{'Flood': 0, 'Embankment': 1, 'embkt': 0, 'Relief': 0, 'Erosion': 0, 'SDRF': 0, 'Inundation': 0, 'Hydrology': 0, 'Silt': 0, 'Siltation': 0, 'Bund': 0, 'Trench': 0, 'Breach': 0, 'Culvert': 0, 'Sluice': 0, 'Dyke': 0, 'Storm water drain': 0, 'Emergency': 0, 'Immediate': 0, 'IM': 0, 'AE': 0, 'A E': 0, 'AAPDA MITRA': 0}","{'Floodlight': 0, 'Flood Light': 0, 'GAS': 0, 'FIFA': 0, 'pipe': 0, 'pipes': 0, 'covid': 0}",Post-Monsoon,,False,True,Others,
2023_PWD_34868_56,CE/Maint/MMPPNA/01/2023-24/1,Maint/MMPPNA/2023-24/182,Maint/MMPPNA/2023-24/182_Construction of RCC Bridge cum Sluice Gate of 1_10m on Sahpur on Chamata-Kaithalkuchi Road under Mukhya Mantrir Pakipath Nirman Aachani for the year 2023-24 in Nalbari District,Works,Open Tender,Item Rate,Civil Works – Roads,No,No,NA ,21-Dec-2023 06:00 PM,22-Dec-2023 02:00 PM ,180.0,No ,No,Online,02-Jan-2024 11:00 AM,Public Works Roads Department,Nalbari,781003.0,2.0,"2,02,89,000",M/S Barman Traders,"18,260,100",Accepted-AOC,08-Apr-2024,Public Works Roads Department,True,"{'Flood': 0, 'Embankment': 0, 'embkt': 0, 'Relief': 0, 'Erosion': 0, 'SDRF': 0, 'Inundation': 0, 'Hydrology': 0, 'Silt': 0, 'Siltation': 0, 'Bund': 0, 'Trench': 0, 'Breach': 0, 'Culvert': 0, 'Sluice': 1, 'Dyke': 0, 'Storm water drain': 0, 'Emergency': 0, 'Immediate': 0, 'IM': 0, 'AE': 0, 'A E': 0, 'AAPDA MITRA': 0}","{'Floodlight': 0, 'Flood Light': 0, 'GAS': 0, 'FIFA': 0, 'pipe': 0, 'pipes': 0, 'covid': 0}",Post-Monsoon,,False,True,Others,
2023_PWD_34868_90,CE/Maint/MMPPNA/01/2023-24/1,Maint/MMPPNA/2023-24/48,"Maint/MMPPNA/2023-24/48_Construction of Road from Ravatary Modertary road to Chinabari from Ch. 250.00m to Ch. 950.00m, Salkata busmara via Bahnkanda road Ch.0.00 m to Ch. 1100.00m, RCC Box culvert at bandihana Majerchar PMGSY Road Ch. 0.00 m to Ch.",Works,Open Tender,Item Rate,Civil Works – Roads,No,No,NA ,22-Dec-2023 02:00 PM,22-Dec-2023 02:00 PM ,180.0,No ,No,Online,02-Jan-2024 11:00 AM,Public Works Roads Department,Dhubri,781003.0,2.0,"2,28,29,000",Aminur Rahman,"22,829,000",Accepted-AOC,06-Apr-2024,Public Works Roads Department,True,"{'Flood': 0, 'Embankment': 0, 'embkt': 0, 'Relief': 0, 'Erosion': 0, 'SDRF': 0, 'Inundation': 0, 'Hydrology': 0, 'Silt': 0, 'Siltation': 0, 'Bund': 0, 'Trench': 0, 'Breach': 0, 'Culvert': 1, 'Sluice': 0, 'Dyke': 0, 'Storm water drain': 0, 'Emergency': 0, 'Immediate': 0, 'IM': 0, 'AE': 0, 'A E': 0, 'AAPDA MITRA': 0}","{'Floodlight': 0, 'Flood Light': 0, 'GAS': 0, 'FIFA': 0, 'pipe': 0, 'pipes': 0, 'covid': 0}",Post-Monsoon,,False,True,Others,
2024_BoTC_35901_1,FMB.1/2023/15 FC/Until/20,"Const. of RCC Drain with Slab Culvert at Totpara, W/No. 1, Famiragram Municipal Board under the Untied grant (2nd installment) for the year 2021-22.","Const. of RCC Drain with Slab Culvert at Totpara, W/No. 1, Famiragram Municipal Board under the Untied grant (2nd installment) for the year 2021-22.",Works,Open Tender,Works,Civil Works,No,No,NA ,03-Feb-2024 11:00 AM,NA ,180.0,No ,No,Online,12-Feb-2024 03:30 PM,Bodoland Territorial Council||Urban Development Town and Country Planning-BTC,Kokrajhar,783370.0,2.0,"23,26,624",Arjun Saha,"2,324,999.07",Accepted-AOC,25-Apr-2024,Bodoland Territorial Council||Urban Development Town and Country Planning-BTC,True,"{'Flood': 0, 'Embankment': 0, 'embkt': 0, 'Relief': 0, 'Erosion': 0, 'SDRF': 0, 'Inundation': 0, 'Hydrology': 0, 'Silt': 0, 'Siltation': 0, 'Bund': 0, 'Trench': 0, 'Breach': 0, 'Culvert': 2, 'Sluice': 0, 'Dyke': 0, 'Storm water drain': 0, 'Emergency': 0, 'Immediate': 0, 'IM': 0, 'AE': 0, 'A E': 0, 'AAPDA MITRA': 0}","{'Floodlight': 0, 'Flood Light': 0, 'GAS': 0, 'FIFA': 0, 'pipe': 0, 'pipes': 0, 'covid': 0}",Pre-Monsoon,,False,True,Others,
2024_DoWR_36878_1,KAMRUPRURAL/2023-24/SOPD-G/I,Anti Erosion measures to protect Dakuapara and its D/S reach on L/B of river Kulsi.,Anti Erosion measures to protect Dakuapara and its D/S reach on L/B of river Kulsi.,Works,Open Tender,Works,Civil Works,No,No,NA ,04-Mar-2024 01:00 PM,NA ,180.0,No ,No,Online,08-Mar-2024 03:00 PM,Department of Water Resources||Chief Engineer - DoWR,Kamrup Rural,781123.0,2.0,"1,08,61,751",Ashit Roy,,Accepted-AOC,,Department of Water Resources||Chief Engineer - DoWR,True,"{'Flood': 0, 'Embankment': 0, 'embkt': 0, 'Relief': 0, 'Erosion': 2, 'SDRF': 0, 'Inundation': 0, 'Hydrology': 0, 'Silt': 0, 'Siltation': 0, 'Bund': 0, 'Trench': 0, 'Breach': 0, 'Culvert': 0, 'Sluice': 0, 'Dyke': 0, 'Storm water drain': 0, 'Emergency': 0, 'Immediate': 0, 'IM': 0, 'AE': 0, 'A E': 0, 'AAPDA MITRA': 0}","{'Floodlight': 0, 'Flood Light': 0, 'GAS': 0, 'FIFA': 0, 'pipe': 0, 'pipes': 0, 'covid': 0}",Pre-Monsoon,SOPD,True,False,Others,
2024_PWD_35504_1,DTRD/TB/15/2022-23/140,Construction of RCC slab culvert (4.0m) at Rambhamadhab over Lahkimijaan at Hatigaon for flood mitigation under SOPD G for the year 2023-24.,Construction of RCC slab culvert (4.0m) at Rambhamadhab over Lahkimijaan at Hatigaon for flood mitigation under SOPD G for the year 2023-24.,Works,Open Tender,Item Rate,Civil Works – Roads,No,No,NA ,18-Jan-2024 02:00 PM,20-Jan-2024 02:00 PM ,180.0,No ,No,Online,25-Jan-2024 11:00 AM,Public Works Roads Department,Hatigaon.,781006.0,2.0,"39,30,000",M/s Manisha Construction,"3,929,746",Accepted-AOC,29-Apr-2024,Public Works Roads Department,True,"{'Flood': 2, 'Embankment': 0, 'embkt': 0, 'Relief': 0, 'Erosion': 0, 'SDRF': 0, 'Inundation': 0, 'Hydrology': 0, 'Silt': 0, 'Siltation': 0, 'Bund': 0, 'Trench': 0, 'Breach': 0, 'Culvert': 2, 'Sluice': 0, 'Dyke': 0, 'Storm water drain': 0, 'Emergency': 0, 'Immediate': 0, 'IM': 0, 'AE': 0, 'A E': 0, 'AAPDA MITRA': 0}","{'Floodlight': 0, 'Flood Light': 0, 'GAS': 0, 'FIFA': 0, 'pipe': 0, 'pipes': 0, 'covid': 0}",Pre-Monsoon,SOPD,False,True,Others,
2024_PWD_36732_4,CE/DEV/RIDFXXIX/405/2023-24/22,"RIDF_XXIX_23_24_134 Improvement of road from Itkhola Tri-Junction to Mediland Nursing Home Road via Malugram Bairabbari, E D Dyke, Panchanan Shibbari Samayik Prasangha under RIDF-XXIX of NABARD for the year 2023-24","RIDF_XXIX_23_24_134 Improvement of road from Itkhola Tri-Junction to Mediland Nursing Home Road via Malugram Bairabbari, E D Dyke, Panchanan Shibbari Samayik Prasangha under RIDF-XXIX of NABARD for the year 2023-24",Works,Open Tender,Item Rate,Civil Works,No,No,NA ,28-Feb-2024 05:00 PM,29-Feb-2024 12:00 PM ,180.0,No ,No,Online,05-Mar-2024 02:00 PM,Public Works Roads Department,Cachar,781003.0,2.0,"2,81,33,000",M/S CMC ASSOCIATES,"25,319,700",Accepted-AOC,10-Apr-2024,Public Works Roads Department,True,"{'Flood': 0, 'Embankment': 0, 'embkt': 0, 'Relief': 0, 'Erosion': 0, 'SDRF': 0, 'Inundation': 0, 'Hydrology': 0, 'Silt': 0, 'Siltation': 0, 'Bund': 0, 'Trench': 0, 'Breach': 0, 'Culvert': 0, 'Sluice': 0, 'Dyke': 2, 'Storm water drain': 0, 'Emergency': 0, 'Immediate': 0, 'IM': 0, 'AE': 0, 'A E': 0, 'AAPDA MITRA': 0}","{'Floodlight': 0, 'Flood Light': 0, 'GAS': 0, 'FIFA': 0, 'pipe': 0, 'pipes': 0, 'covid': 0}",Pre-Monsoon,RIDF,False,True,Repair and Restoration,{'improvement': 2}
