2024_PWD_41754_2,BandKTRD/TB/NIT/2024-25/887,"Construction of damaged Road by Flood from NH-53 to Sridharpur (In Stretches) under SOPD-G for the year 2024-25, Borkhola LAC","Construction of damaged Road by Flood from NH-53 to Sridharpur (In Stretches) under SOPD-G for the year 2024-25, Borkhola LAC, P/No.EE/BOR/FDR-SOPD-G/24-25/2",Works,Open Tender,Item Rate,Civil Works – Roads,No,No,NA ,30-Dec-2024 09:00 AM,03-Jan-2025 02:00 PM ,180.0,No ,No,Online,06-Jan-2025 03:10 PM,Public Works Roads Department,Cachar District.,788114.0,2.0,"64,99,900",Hifzur Rahman Barbhuiya,"5,849,148",Accepted-AOC,16-May-2025,Public Works Roads Department,True,"{'Flood': 2, 'Embankment': 0, 'embkt': 0, 'Relief': 0, 'Erosion': 0, 'SDRF': 0, 'Inundation': 0, 'Hydrology': 0, 'Silt': 0, 'Siltation': 0, 'Bund': 0, 'Trench': 0, 'Breach': 0, 'Culvert': 0, 'Sluice': 0, 'Dyke': 0, 'Storm water drain': 0, 'Emergency': 0, 'Immediate': 0, 'IM': 0, 'AE': 0, 'A E': 0, 'AAPDA MITRA': 0}","{'Floodlight': 0, 'Flood Light': 0, 'GAS': 0, 'FIFA': 0, 'pipe': 0, 'pipes': 0, 'covid': 0}",Post-Monsoon,SOPD,False,True,Others,
2025_PWD_42719_1,2022-23/1071,Restoration of flood damaged roa1 no chaharikata gaon road,Restoration of flood damaged roa1 no chaharikata gaon road,Works,Open Tender,Item Rate,Civil Works – Roads,No,No,NA ,14-Feb-2025 06:00 PM,17-Feb-2025 02:00 PM ,180.0,No ,No,Online,20-Feb-2025 02:00 PM,Public Works Roads Department,Duliajan,786602.0,2.0,"49,36,845",JUN GOGOI,"4,933,787",Accepted-AOC,29-Apr-2025,Public Works Roads Department,True,"{'Flood': 2, 'Embankment': 0, 'embkt': 0, 'Relief': 0, 'Erosion': 0, 'SDRF': 0, 'Inundation': 0, 'Hydrology': 0, 'Silt': 0, 'Siltation': 0, 'Bund': 0, 'Trench': 0, 'Breach': 0, 'Culvert': 0, 'Sluice': 0, 'Dyke': 0, 'Storm water drain': 0, 'Emergency': 0, 'Immediate': 0, 'IM': 0, 'AE': 0, 'A E': 0, 'AAPDA MITRA': 0}","{'Floodlight': 0, 'Flood Light': 0, 'GAS': 0, 'FIFA': 0, 'pipe': 0, 'pipes': 0, 'covid': 0}",Pre-Monsoon,,False,True,Repair and Restoration,{'restoration': 2}
2024_PWD_41365_5,BandKTRD/TB/NIT/2024-25/856,"Constructioon of damaged Road by Flood from Kathal Barsangan PWRD Road near Kathal Bagan Nachghar to Vitor Line under SOPD-G for the year 2024-25, Borkhola LAC","Constructioon of damaged Road by Flood from Kathal Barsangan PWRD Road near Kathal Bagan Nachghar to Vitor Line under SOPD-G for the year 2024-25, Borkhola LAC P/No.EE/KAT/FDR-SOPD-G/24-25/5",Works,Open Tender,Item Rate,Civil Works – Roads,No,No,NA ,19-Dec-2024 09:00 AM,23-Dec-2024 02:00 PM ,180.0,No ,No,Online,26-Dec-2024 03:10 PM,Public Works Roads Department,Cachar District,788005.0,2.0,"24,52,076",NAZMUL HUSSAIN MAZARBHUIYA,"2,206,868",Accepted-AOC,16-May-2025,Public Works Roads Department,True,"{'Flood': 2, 'Embankment': 0, 'embkt': 0, 'Relief': 0, 'Erosion': 0, 'SDRF': 0, 'Inundation': 0, 'Hydrology': 0, 'Silt': 0, 'Siltation': 0, 'Bund': 0, 'Trench': 0, 'Breach': 0, 'Culvert': 0, 'Sluice': 0, 'Dyke': 0, 'Storm water drain': 0, 'Emergency': 0, 'Immediate': 0, 'IM': 0, 'AE': 0, 'A E': 0, 'AAPDA MITRA': 0}","{'Floodlight': 0, 'Flood Light': 0, 'GAS': 0, 'FIFA': 0, 'pipe': 0, 'pipes': 0, 'covid': 0}",Post-Monsoon,SOPD,False,True,Others,
2025_DoWR_42527_1,SIVASAGAR/2024-25/RIDF-II/III,R/S to DRDA bund from Sessamukh Tiniali to Laibeel and construction of sluice culvert.Phase-I,R/S to DRDA bund from Sessamukh Tiniali to Laibeel and construction of sluice culvert.Phase-I,Works,Open Tender,Works,Civil Works,No,No,NA ,05-Feb-2025 06:55 PM,NA ,180.0,No ,No,Online,25-Feb-2025 03:00 PM,Department of Water Resources||Chief Engineer - DoWR,SIVASAGAR,785640.0,2.0,"6,88,14,506",SANJIB BORUAH,"68,813,488.85",Accepted-AOC,21-May-2025,Department of Water Resources||Chief Engineer - DoWR,True,"{'Flood': 0, 'Embankment': 0, 'embkt': 0, 'Relief': 0, 'Erosion': 0, 'SDRF': 0, 'Inundation': 0, 'Hydrology': 0, 'Silt': 0, 'Siltation': 0, 'Bund': 2, 'Trench': 0, 'Breach': 0, 'Culvert': 2, 'Sluice': 2, 'Dyke': 0, 'Storm water drain': 0, 'Emergency': 0, 'Immediate': 0, 'IM': 0, 'AE': 0, 'A E': 0, 'AAPDA MITRA': 0}","{'Floodlight': 0, 'Flood Light': 0, 'GAS': 0, 'FIFA': 0, 'pipe': 0, 'pipes': 0, 'covid': 0}",Pre-Monsoon,RIDF,False,True,Repair and Restoration,{'r s': 2}
2025_PWD_42719_2,2022-23/1071,Restoration of flood damaged road 2 no chaharikata gaon,Restoration of flood damaged road 2 no chaharikata gaon,Works,Open Tender,Item Rate,Civil Works – Roads,No,No,NA ,14-Feb-2025 06:00 PM,17-Feb-2025 02:00 PM ,180.0,No ,No,Online,20-Feb-2025 02:00 PM,Public Works Roads Department,Duliajan,786602.0,2.0,"49,36,845",RITURAJ SONOWAL,"4,956,437",Accepted-AOC,29-Apr-2025,Public Works Roads Department,True,"{'Flood': 2, 'Embankment': 0, 'embkt': 0, 'Relief': 0, 'Erosion': 0, 'SDRF': 0, 'Inundation': 0, 'Hydrology': 0, 'Silt': 0, 'Siltation': 0, 'Bund': 0, 'Trench': 0, 'Breach': 0, 'Culvert': 0, 'Sluice': 0, 'Dyke': 0, 'Storm water drain': 0, 'Emergency': 0, 'Immediate': 0, 'IM': 0, 'AE': 0, 'A E': 0, 'AAPDA MITRA': 0}","{'Floodlight': 0, 'Flood Light': 0, 'GAS': 0, 'FIFA': 0, 'pipe': 0, 'pipes': 0, 'covid': 0}",Pre-Monsoon,,False,True,Repair and Restoration,{'restoration': 2}
2025_DoWR_42934_1,KAMRUP METRO/2024-25/RIDF-II/II,Construction of RCC Flood Wall along R/B of Khanajan Channel from downstream of Sluice outfall including allied works.,Construction of RCC Flood Wall along R/B of Khanajan Channel from downstream of Sluice outfall including allied works.,Works,Open Tender,Works,Civil Works,No,No,NA ,19-Feb-2025 06:30 PM,NA ,180.0,No ,No,Online,11-Mar-2025 03:00 PM,Department of Water Resources||Chief Engineer - DoWR,KAMRUP METRO,781008.0,2.0,"15,42,90,181",KEA CONSULTANTS PRIVATE LIMITED,"154,189,580.11",Accepted-AOC,31-May-2025,Department of Water Resources||Chief Engineer - DoWR,True,"{'Flood': 2, 'Embankment': 0, 'embkt': 0, 'Relief': 0, 'Erosion': 0, 'SDRF': 0, 'Inundation': 0, 'Hydrology': 0, 'Silt': 0, 'Siltation': 0, 'Bund': 0, 'Trench': 0, 'Breach': 0, 'Culvert': 0, 'Sluice': 2, 'Dyke': 0, 'Storm water drain': 0, 'Emergency': 0, 'Immediate': 0, 'IM': 0, 'AE': 0, 'A E': 0, 'AAPDA MITRA': 0}","{'Floodlight': 0, 'Flood Light': 0, 'GAS': 0, 'FIFA': 0, 'pipe': 0, 'pipes': 0, 'covid': 0}",Pre-Monsoon,RIDF,False,True,Others,
2025_BoTC_44113_1,TECH-17/SE(B)/E-Tdr/2025-26/02,Construction of District Emergency Operation Centre (DEOC)Building in Tamulpur District.(Ground Floor with G1 provision) TN_626,Construction of District Emergency Operation Centre (DEOC)Building in Tamulpur District.(Ground Floor with G1 provision) TN_626,Works,Open Tender,Works,Civil Works - Building,No,No,NA ,23-Apr-2025 04:00 PM,NA ,180.0,No ,No,Online,14-May-2025 02:00 PM,Bodoland Territorial Council||PWD-BTC,Tamulpur,781367.0,2.0,"34,99,949",BISHNU DEV UZIR,"3,499,869",Accepted-AOC,23-May-2025,Bodoland Territorial Council||PWD-BTC,True,"{'Flood': 0, 'Embankment': 0, 'embkt': 0, 'Relief': 0, 'Erosion': 0, 'SDRF': 0, 'Inundation': 0, 'Hydrology': 0, 'Silt': 0, 'Siltation': 0, 'Bund': 0, 'Trench': 0, 'Breach': 0, 'Culvert': 0, 'Sluice': 0, 'Dyke': 0, 'Storm water drain': 0, 'Emergency': 2, 'Immediate': 0, 'IM': 0, 'AE': 0, 'A E': 0, 'AAPDA MITRA': 0}","{'Floodlight': 0, 'Flood Light': 0, 'GAS': 0, 'FIFA': 0, 'pipe': 0, 'pipes': 0, 'covid': 0}",Pre-Monsoon,,False,False,Immediate Measures,{'emergency': 2}
2024_DoWR_41571_1,WRD/SURVEY/ACE/EAP/DATA/2022,"Survey of Riverbanks, Embankment Dikes and Erosion Protection Works in Beki, Buridehing and Jiadhal River Basin Lot 1","Survey of Riverbanks, Embankment Dikes and Erosion Protection Works in Beki, Buridehing and Jiadhal River Basin Lot 1",Works,Open Tender,Works,Civil Works,No,No,NA ,21-Dec-2024 06:55 PM,26-Dec-2024 11:30 AM ,90.0,No ,No,Online,17-Jan-2025 03:30 PM,Department of Water Resources||Chief Engineer - DoWR,BARPETA,781301.0,2.0,"95,20,500",AM DATA LAB PRIVATE LIMITED,"6,345,000",Accepted-AOC,21-May-2025,Department of Water Resources||Chief Engineer - DoWR,True,"{'Flood': 0, 'Embankment': 2, 'embkt': 0, 'Relief': 0, 'Erosion': 2, 'SDRF': 0, 'Inundation': 0, 'Hydrology': 0, 'Silt': 0, 'Siltation': 0, 'Bund': 0, 'Trench': 0, 'Breach': 0, 'Culvert': 0, 'Sluice': 0, 'Dyke': 0, 'Storm water drain': 0, 'Emergency': 0, 'Immediate': 0, 'IM': 0, 'AE': 0, 'A E': 0, 'AAPDA MITRA': 0}","{'Floodlight': 0, 'Flood Light': 0, 'GAS': 0, 'FIFA': 0, 'pipe': 0, 'pipes': 0, 'covid': 0}",Post-Monsoon,,True,True,Others,
2025_DoWR_41981_1,RFN No. 01 of 2025-26,Selection of Consultant for Consultancy Services for the Project Restoration and rejuvenation of wetlands of Assam to enhance the water retention capacity and to mitigate the risks of flooding and erosion,Selection of Consultant for Consultancy Services for the Project Restoration and rejuvenation of wetlands of Assam to enhance the water retention capacity and to mitigate the risks of flooding and erosion,Services,Open Tender,Lump-sum,Consultancy,No,No,NA ,08-Jan-2025 06:30 PM,13-Jan-2025 01:00 PM ,180.0,No ,No,Online,18-Jan-2025 05:00 PM,Department of Water Resources||Chief Engineer - DoWR,Guwahati,781029.0,2.0,,A G Horizon Pvt. Ltd.,1.0,Accepted-AOC,19-May-2025,Department of Water Resources||Chief Engineer - DoWR,True,"{'Flood': 0, 'Embankment': 0, 'embkt': 0, 'Relief': 0, 'Erosion': 2, 'SDRF': 0, 'Inundation': 0, 'Hydrology': 0, 'Silt': 0, 'Siltation': 0, 'Bund': 0, 'Trench': 0, 'Breach': 0, 'Culvert': 0, 'Sluice': 0, 'Dyke': 0, 'Storm water drain': 0, 'Emergency': 0, 'Immediate': 0, 'IM': 0, 'AE': 0, 'A E': 0, 'AAPDA MITRA': 0}","{'Floodlight': 0, 'Flood Light': 0, 'GAS': 0, 'FIFA': 0, 'pipe': 0, 'pipes': 0, 'covid': 0}",Pre-Monsoon,,True,False,Repair and Restoration,{'restoration': 2}
