Organisation Chain,Tender Reference Number,Tender ID,Withdrawal Allowed,Tender Type,Form of contract,Tender Category,No. of Covers,General Technical Evaluation Allowed,ItemWise Technical Evaluation Allowed,Payment Mode,Is Multi Currency Allowed For BOQ,Is Multi Currency Allowed For Fee,Allow Two Stage Bidding,Cover No,Cover,Document Type,Description,Publish Date,Bid Opening Date,Document Download / Sale Start Date,Document Download / Sale End Date,Clarification Start Date,Clarification End Date,Bid Submission Start Date,Bid Submission End Date,Financial Bid Opening Date,EMD Amount in ₹,EMD Exemption Allowed,EMD Fee Type,EMD Percentage,EMD Payable To,EMD Payable At,S.No,Bank Name,Tender Fee in ₹,Fee Payable To,Fee Payable At,Tender Fee Exemption Allowed,Name,Address,Title,Work Description,Pre Qualification Details,Independent External Monitor/Remarks,Tender Value in ₹,Product Category,Sub category,Contract Type,Bid Validity(Days),Period Of Work(Days),Location,Pincode,Pre Bid Meeting Place,Pre Bid Meeting Address,Pre Bid Meeting Date,Bid Opening Place,Should Allow NDA Tender,Allow Preferential Bidder,Tender Stage,Contract Date :,Contract Value :,Work Completion Period in days :,Updated By :,Updated on :,AOC document :,AOC Description :,S.No,Bid Number,Bidder Name,Awarded Currency,Awarded Value,S.No.1,Bid Number.1,Bidder Name.1,Submitted Date,Status,Remarks,Status Updated On,Type :,Summary :,Updated By :.1,Updated On :,Document :,BOQ Comparative Chart :,Committee Chairperson/Co-ordinator Name :,Committee Chairperson/Co-ordinator Type :,Committee Members :,Updated By :.2,Updated on :.1,Document :.1,Organisation Chain :,Tender ID :,Tender Ref No :,Tender Title :,Type :.1,Summary :.1,Updated By :.3,Updated On :.1,Document :.2,Committee Chairperson/Co-ordinator Name :.1,Committee Chairperson/Co-ordinator Type :.1,Committee Members :.1,Updated By :.4,Updated On :.2,Financial Bid Opening Date:,Document :.3,Tender Stage
Department of Tourism||Assam Tourism Development Corporation Ltd. - DOT||HO-Guwahati-ATDCL - DOT,ATDC/CS/644/2023/2862 dt. 12.09.2023,2023_DOT_32636_1,Yes,Open Tender,Item Rate,Works,2.0,No,No,Online,No,No,No,1.0,Fee/PreQual/Technical,.pdf,Detail Notice Inviting Bid with seal and sign in each page,22-Sep-2023 06:00 PM,04-Oct-2023 01:00 PM,22-Sep-2023 06:05 PM,03-Oct-2023 02:00 PM,NA ,NA ,27-Sep-2023 11:00 AM,03-Oct-2023 02:00 PM,19-Oct-2023 04:25 PM,"17,29,340",Yes,fixed,,Nil,Nil,1.0,SBI Bank,"3,000",Nil,Nil,No,"Managing Director, ATDC Ltd.","Office of the Managing Director, ATDC Ltd., Guwahati-8","Establishment of a Yatri Niwas and a Guest House at Silghat, Nagaon, Assam under NEC","Establishment of a Yatri Niwas and a Guest House at Silghat, Nagaon, Assam under NEC",Please refer Tender documents. ,NA ,"8,64,67,000",Civil Works - Others,NA ,Tender,180.0,540.0,"Silghat, Nagaon, Assam",782143.0,Guwahati ,"Office of the Managing Director, ATDC Ltd., Guwahati-8 ",26-Sep-2023 12:00 PM ,Guwahati,No ,No,AOC,28-Nov-2023,"INR 86,467,000",540.0,SANJIB KUMAR DUTTA,28-Nov-2023 02:29 PM,FWO.pdf (270.00 KB),"Issue of Notice to Proceed with the work for Establishment of a Yatri Niwas and a Guest House at Silghat, Nagaon, Assam under NEC",1.0,202447.0,ABHIJIT PATOWARY,INR,"86,467,000",1.0,202447.0,ABHIJIT PATOWARY,03-Oct-2023 12:31 PM,Accepted-AOC,Quoted lowest rate,28-Nov-2023 02:31 PM,Finance,Comparative Statement,SANJIB KUMAR DUTTA,28-Nov-2023 02:21 PM,finance_52361.pdf,BOQ Comparative Chart,Bhaskar Jyoti Baruah,Internal,Kishore Dutta Kushal Sarma,SANJIB KUMAR DUTTA,28-Nov-2023 02:26 PM,finsummary_52361.pdf (175.45 KB),Department of Tourism||Assam Tourism Development Corporation Ltd. - DOT||HO-Guwahati-ATDCL - DOT,2023_DOT_32636_1,ATDC/CS/644/2023/2862 dt. 12.09.2023,"Establishment of a Yatri Niwas and a Guest House at Silghat, Nagaon, Assam under NEC",Technical,Report of Technical Evaluation Committee,SANJIB KUMAR DUTTA,19-Oct-2023 04:06 PM,technical_52361.pdf,Prabhash Ch. Sarma,Internal,R.L. Das Tina Mitra,SANJIB KUMAR DUTTA,19-Oct-2023 04:07 PM,19-Oct-2023 04:25 PM,techsummary_52361.pdf (181.96 KB),AOC
,,,,,,,,,,,,,,,,.pdf,Bid Document with seal and sign in each page,,,,,,,,,,,,,,,,,,,,,,,,,,,,,,,,,,,,,,,,,,AOC,,,,,,,,,,,,,2.0,202748.0,OM CONSTRUCTIONS,03-Oct-2023 12:08 PM,Rejected-AOC,Quoted second lowest rate,28-Nov-2023 02:31 PM,,,,,,,,,,,,,,,,,,,,,,,,,,,,,AOC
,,,,,,,,,,,,,,,,.pdf,Drawings with seal and sign in each page,,,,,,,,,,,,,,,,,,,,,,,,,,,,,,,,,,,,,,,,,,AOC,,,,,,,,,,,,,3.0,202519.0,SHREE GAUTAM CONSTRUCTION CO. LTD.,02-Oct-2023 08:18 PM,Rejected-AOC,Quoted highest rate,28-Nov-2023 02:31 PM,,,,,,,,,,,,,,,,,,,,,,,,,,,,,AOC
,,,,,,,,,,,,,,,,.pdf,Scope of work with seal and sign in each page,,,,,,,,,,,,,,,,,,,,,,,,,,,,,,,,,,,,,,,,,,AOC,,,,,,,,,,,,,,,,,,,,,,,,,,,,,,,,,,,,,,,,,,,,,,,,AOC
,,,,,,,,,,,,,,,,.pdf,Special Conditions of Contract,,,,,,,,,,,,,,,,,,,,,,,,,,,,,,,,,,,,,,,,,,AOC,,,,,,,,,,,,,,,,,,,,,,,,,,,,,,,,,,,,,,,,,,,,,,,,AOC
,,,,,,,,,,,,,,,,.pdf,Technical Specifications,,,,,,,,,,,,,,,,,,,,,,,,,,,,,,,,,,,,,,,,,,AOC,,,,,,,,,,,,,,,,,,,,,,,,,,,,,,,,,,,,,,,,,,,,,,,,AOC
,,,,,,,,,,,,,,2.0,Finance,.xls,BOQ,,,,,,,,,,,,,,,,,,,,,,,,,,,,,,,,,,,,,,,,,,AOC,,,,,,,,,,,,,,,,,,,,,,,,,,,,,,,,,,,,,,,,,,,,,,,,AOC
