Organisation Chain,Tender Reference Number,Tender ID,Withdrawal Allowed,Tender Type,Form of contract,Tender Category,No. of Covers,General Technical Evaluation Allowed,ItemWise Technical Evaluation Allowed,Payment Mode,Is Multi Currency Allowed For BOQ,Is Multi Currency Allowed For Fee,Allow Two Stage Bidding,Cover No,Cover,Document Type,Description,Publish Date,Bid Opening Date,Document Download / Sale Start Date,Document Download / Sale End Date,Clarification Start Date,Clarification End Date,Bid Submission Start Date,Bid Submission End Date,Financial Bid Opening Date,EMD Amount in ₹,EMD Exemption Allowed,EMD Fee Type,EMD Percentage,EMD Payable To,EMD Payable At,S.No,Corrigendum Title,Corrigendum Type,View,S.No.1,Bank Name,Tender Fee in ₹,Fee Payable To,Fee Payable At,Tender Fee Exemption Allowed,Name,Address,Title,Work Description,Pre Qualification Details,Independent External Monitor/Remarks,Tender Value in ₹,Product Category,Sub category,Contract Type,Bid Validity(Days),Period Of Work(Days),Location,Pincode,Pre Bid Meeting Place,Pre Bid Meeting Address,Pre Bid Meeting Date,Bid Opening Place,Should Allow NDA Tender,Allow Preferential Bidder,Tender Stage,Contract Date :,Contract Value :,Work Completion Period in days :,Updated By :,Updated on :,AOC document :,AOC Description :,S.No,Bid Number,Bidder Name,Awarded Currency,Awarded Value,S.No.1,Bid Number.1,Bidder Name.1,Submitted Date,Status,Remarks,Status Updated On,Type :,Summary :,Updated By :.1,Updated On :,Document :,BOQ Comparative Chart :,Committee Chairperson/Co-ordinator Name :,Committee Chairperson/Co-ordinator Type :,Committee Members :,Updated By :.2,Updated on :.1,Document :.1,Organisation Chain :,Tender ID :,Tender Ref No :,Tender Title :,Type :.1,Summary :.1,Updated By :.3,Updated On :.1,Document :.2,Committee Chairperson/Co-ordinator Name :.1,Committee Chairperson/Co-ordinator Type :.1,Committee Members :.1,Updated By :.4,Updated On :.2,Financial Bid Opening Date:,Document :.3,Tender Stage
National Health Mission||State Programme Management Unit - NHM,NHM-32023/33/2023-CONS-NHM/413,2023_NHM_31270_6,Yes,Open Tender,Turn-key,Works,2.0,No,No,Online,No,No,No,1.0,Fee/PreQual/Technical,.pdf,SBD,19-Jun-2023 12:00 PM,19-Jul-2023 03:30 PM,19-Jun-2023 12:00 PM,18-Jul-2023 02:00 PM,NA ,NA ,19-Jun-2023 12:00 PM,18-Jul-2023 02:00 PM,24-Aug-2023 03:55 PM,"1,04,060",Yes,percentage,2.0%,Nil,Nil,1.0,1st Extension,Date,,1.0,SBI Bank,"1,500",Nil,Nil,No,"MD,NHM,Assam","O/O MD,NHM Christian Basti, Ghy-05",Construction of Buildingless Sub Health Centre at HARINTILA SC in Cachar District under PM ABHIM for the FY 2021-22 and FY 2022-23 under NHM on Turnkey Basis,Construction of Buildingless Sub Health Centre at HARINTILA SC in Cachar District under PM ABHIM for the FY 2021-22 and FY 2022-23 under NHM on Turnkey Basis,Please refer Tender documents. ,NA ,"52,03,000",Civil Works - Building,NA ,Tender,180.0,180.0,Cachar District,788817.0,NA ,NA ,NA ,"O/O MD,NHM,Assam",No ,No,AOC,03-Nov-2023,"INR 4,942,850",180.0,Anupam Choudhury,03-Nov-2023 04:57 PM,HarintilaWO.pdf (2171.00 KB),WORK ORDER,1.0,192151.0,ASHOK KUMAR DAS,INR,"4,942,850",1.0,192151.0,ASHOK KUMAR DAS,18-Jul-2023 01:15 PM,Accepted-AOC,L1,03-Nov-2023 04:57 PM,Finance,office order,Anupam Choudhury,24-Aug-2023 04:22 PM,finance_50026.pdf,BOQ Comparative Chart,ED,Internal,,Anupam Choudhury,03-Nov-2023 04:56 PM,finsummary_50026.pdf (1527.67 KB),National Health Mission||State Programme Management Unit - NHM,2023_NHM_31270_6,NHM-32023/33/2023-CONS-NHM/413,Construction of Buildingless Sub Health Centre at HARINTILA SC in Cachar District under PM ABHIM for the FY 2021-22 and FY 2022-23 under NHM on Turnkey Basis,Technical,Technical Bid Opend,Himangshu Kalita,24-Aug-2023 03:49 PM,,ed,Internal,,Himangshu Kalita,24-Aug-2023 03:54 PM,24-Aug-2023 03:55 PM,techsummary_50026.pdf (12464.02 KB),AOC
,,,,,,,,,,,,,,,,.pdf,Cost of tender and bid security,,,,,,,,,,,,,,,,,,,,,,,,,,,,,,,,,,,,,,,,,,,,,,AOC,,,,,,,,,,,,,2.0,189884.0,EKON CONSTRUCTIONS,18-Jul-2023 01:36 PM,Not Admitted-Fee/PreQual/Technical,Not Complied with technical specification,24-Aug-2023 03:49 PM,,,,,,,,,,,,,,,,,,,,,,,,,,,,,AOC
,,,,,,,,,,,,,,,,.pdf,Technical qualification,,,,,,,,,,,,,,,,,,,,,,,,,,,,,,,,,,,,,,,,,,,,,,AOC,,,,,,,,,,,,,3.0,192164.0,NIKHILESH CHOUDHURY,17-Jul-2023 04:56 PM,Not Admitted-Fee/PreQual/Technical,Not Complied with technical specification,24-Aug-2023 03:49 PM,,,,,,,,,,,,,,,,,,,,,,,,,,,,,AOC
,,,,,,,,,,,,,,2.0,Finance,.xls,BOQ,,,,,,,,,,,,,,,,,,,,,,,,,,,,,,,,,,,,,,,,,,,,,,AOC,,,,,,,,,,,,,,,,,,,,,,,,,,,,,,,,,,,,,,,,,,,,,,,,AOC
,,,,,,,,,,,,,,,,.pdf,FOB,,,,,,,,,,,,,,,,,,,,,,,,,,,,,,,,,,,,,,,,,,,,,,AOC,,,,,,,,,,,,,,,,,,,,,,,,,,,,,,,,,,,,,,,,,,,,,,,,AOC
