Organisation Chain,Tender Reference Number,Tender ID,Withdrawal Allowed,Tender Type,Form of contract,Tender Category,No. of Covers,General Technical Evaluation Allowed,ItemWise Technical Evaluation Allowed,Payment Mode,Is Multi Currency Allowed For BOQ,Is Multi Currency Allowed For Fee,Allow Two Stage Bidding,Cover No,Cover,Document Type,Description,Publish Date,Bid Opening Date,Document Download / Sale Start Date,Document Download / Sale End Date,Clarification Start Date,Clarification End Date,Bid Submission Start Date,Bid Submission End Date,Financial Bid Opening Date,EMD Amount in ₹,EMD Exemption Allowed,EMD Fee Type,EMD Percentage,EMD Payable To,EMD Payable At,S.No,Bank Name,Tender Fee in ₹,Fee Payable To,Fee Payable At,Tender Fee Exemption Allowed,Name,Address,Title,Work Description,Pre Qualification Details,Independent External Monitor/Remarks,Tender Value in ₹,Product Category,Sub category,Contract Type,Bid Validity(Days),Period Of Work(Days),Location,Pincode,Pre Bid Meeting Place,Pre Bid Meeting Address,Pre Bid Meeting Date,Bid Opening Place,Should Allow NDA Tender,Allow Preferential Bidder,Tender Stage,Contract Date :,Contract Value :,Work Completion Period in days :,Updated By :,Updated on :,AOC document :,S.No,Bid Number,Bidder Name,Awarded Currency,Awarded Value,S.No.1,Bid Number.1,Bidder Name.1,Submitted Date,Status,Remarks,Status Updated On,Type :,Summary :,Updated By :.1,Updated On :,Document :,BOQ Comparative Chart :,Committee Chairperson/Co-ordinator Name :,Committee Chairperson/Co-ordinator Type :,Committee Members :,Updated By :.2,Updated on :.1,Document :.1,Organisation Chain :,Tender ID :,Tender Ref No :,Tender Title :,Type :.1,Summary :.1,Updated By :.3,Updated On :.1,Document :.2,Committee Chairperson/Co-ordinator Name :.1,Committee Chairperson/Co-ordinator Type :.1,Committee Members :.1,Updated By :.4,Updated On :.2,Financial Bid Opening Date:,Document :.3,Tender Stage
Gauhati University,T/23-24/35 Dated 17.05.2023,2023_GU_30889_1,Yes,Open Tender,Item Rate,Works,2.0,No,No,Online,No,No,No,1.0,Fee/PreQual/Technical,.pdf,Tender Document,19-May-2023 02:00 PM,09-Jun-2023 02:00 PM,19-May-2023 02:00 PM,08-Jun-2023 02:00 PM,NA ,NA ,19-May-2023 02:00 PM,08-Jun-2023 02:00 PM,11-Jul-2023 02:00 PM,"70,239",Yes,fixed,,Nil,Nil,1.0,SBI Bank,700.0,Nil,Nil,No,Superintending Engineer GU,Office of the Superintending Engineer GU,"Repair, Renovation, Painting and Raising of floor level for AT 9 Boys Hostel at Gauhati University 4 blocks","Repair, Renovation, Painting and Raising of floor level for AT 9 Boys Hostel at Gauhati University 4 blocks",Please refer Tender documents. ,NA ,"35,11,962",Composite Works,NA ,Tender,180.0,180.0,Gauhati University,781014.0,Office of the Superintending Engineer GU ,Office of the Superintending Engineer GU ,01-Jun-2023 02:00 PM ,Office of the Superintending Engineer GU,No ,No,AOC,10-Nov-2023,"INR 2,785,213",180.0,Sanjib Boruah,10-Nov-2023 11:07 AM,LOI.pdf (676.00 KB),1.0,187091.0,Jayanta Kumar Das,INR,"2,785,213",1,187268,ANGARAJ HAZARIKA,08-Jun-2023 11:50 AM,Rejected-Finance,Not being the lowest bidder,20-Sep-2023 11:35 AM,Finance,The financial evaluation of the submitted price bids will be carried out and summary of the financial evaluation will be uploaded later.,Sanjib Boruah,11-Jul-2023 03:31 PM,finance_49544.pdf,BOQ Comparative Chart,Superintending Engineer GU,Internal,,Sanjib Boruah,20-Sep-2023 11:35 AM,finsummary_49544.pdf (439.06 KB),Gauhati University,2023_GU_30889_1,T/23-24/35 Dated 17.05.2023,"Repair, Renovation, Painting and Raising of floor level for AT 9 Boys Hostel at Gauhati University 4 blocks",Technical,Technical Evaluation of the submitted bid will be carried out and summary of Technical Evaluation will be uploaded later.,Sanjib Boruah,09-Jun-2023 04:42 PM,technical_49544.pdf,Superintending Engineer GU,Internal,,Sanjib Boruah,10-Jul-2023 03:42 PM,11-Jul-2023 02:00 PM,techsummary_49544.pdf (380.59 KB),AOC
,,,,,,,,,,,,,,,,.pdf,Technical Qualification Document,,,,,,,,,,,,,,,,,,,,,,,,,,,,,,,,,,,,,,,,,,AOC,,,,,,,,,,,,2,187068,Astech Incorporation,03-Jun-2023 02:49 PM,Rejected-Technical,Technically disqualified,10-Jul-2023 03:42 PM,,,,,,,,,,,,,,,,,,,,,,,,,,,,,AOC
,,,,,,,,,,,,,,,,.pdf,Annexures,,,,,,,,,,,,,,,,,,,,,,,,,,,,,,,,,,,,,,,,,,AOC,,,,,,,,,,,,3,187261,Harunur Rashid,08-Jun-2023 12:24 PM,Rejected-Finance,Not being the lowest bidder,20-Sep-2023 11:35 AM,,,,,,,,,,,,,,,,,,,,,,,,,,,,,AOC
,,,,,,,,,,,,,,2.0,Finance,.xls,BOQ,,,,,,,,,,,,,,,,,,,,,,,,,,,,,,,,,,,,,,,,,,AOC,,,,,,,,,,,,4,187091,Jayanta Kumar Das,07-Jun-2023 06:46 PM,Accepted-AOC,Being the lowest bidder,10-Nov-2023 11:07 AM,,,,,,,,,,,,,,,,,,,,,,,,,,,,,AOC
,,,,,,,,,,,,,,,,.pdf,Form of bid,,,,,,,,,,,,,,,,,,,,,,,,,,,,,,,,,,,,,,,,,,AOC,,,,,,,,,,,,5,186943,J. N. ASSOCIATES,07-Jun-2023 04:48 PM,Rejected-Finance,Not being the lowest bidder,20-Sep-2023 11:35 AM,,,,,,,,,,,,,,,,,,,,,,,,,,,,,AOC
,,,,,,,,,,,,,,,,,,,,,,,,,,,,,,,,,,,,,,,,,,,,,,,,,,,,,,,,,,,AOC,,,,,,,,,,,,6,187109,Rupam Chakraborty,07-Jun-2023 06:27 PM,Rejected-Finance,Not being the lowest bidder,20-Sep-2023 11:35 AM,,,,,,,,,,,,,,,,,,,,,,,,,,,,,AOC
