Organisation Chain,Tender Reference Number,Tender ID,Withdrawal Allowed,Tender Type,Form of contract,Tender Category,No. of Covers,General Technical Evaluation Allowed,ItemWise Technical Evaluation Allowed,Payment Mode,Is Multi Currency Allowed For BOQ,Is Multi Currency Allowed For Fee,Allow Two Stage Bidding,Cover No,Cover,Document Type,Description,Publish Date,Bid Opening Date,Document Download / Sale Start Date,Document Download / Sale End Date,Clarification Start Date,Clarification End Date,Bid Submission Start Date,Bid Submission End Date,Financial Bid Opening Date,EMD Amount in ₹,EMD Exemption Allowed,EMD Fee Type,EMD Percentage,EMD Payable To,EMD Payable At,S.No,Bank Name,Tender Fee in ₹,Fee Payable To,Fee Payable At,Tender Fee Exemption Allowed,Name,Address,Title,Work Description,Pre Qualification Details,Independent External Monitor/Remarks,Tender Value in ₹,Product Category,Sub category,Contract Type,Bid Validity(Days),Period Of Work(Days),Location,Pincode,Pre Bid Meeting Place,Pre Bid Meeting Address,Pre Bid Meeting Date,Bid Opening Place,Should Allow NDA Tender,Allow Preferential Bidder,Tender Stage,Contract Date :,Contract Value :,Work Completion Period in days :,Updated By :,Updated on :,AOC document :,S.No,Bid Number,Bidder Name,Awarded Currency,Awarded Value,S.No.1,Bid Number.1,Bidder Name.1,Submitted Date,Status,Remarks,Status Updated On,Type :,Summary :,Updated By :.1,Updated On :,Document :,BOQ Comparative Chart :,Committee Chairperson/Co-ordinator Name :,Committee Chairperson/Co-ordinator Type :,Committee Members :,Updated By :.2,Updated on :.1,Document :.1,Organisation Chain :,Tender ID :,Tender Ref No :,Tender Title :,Type :.1,Summary :.1,Updated By :.3,Updated On :.1,Document :.2,Committee Chairperson/Co-ordinator Name :.1,Committee Chairperson/Co-ordinator Type :.1,Committee Members :.1,Updated By :.4,Updated On :.2,Financial Bid Opening Date:,Document :.3,Tender Stage
Guwahati Municipal Corporation,GER/CE/2016/2022/30 Dt. 06/05/2023,2023_GMC_30724_5,Yes,Open Tender,Lump-sum,Works,2.0,No,No,Online,No,No,No,1.0,Fee/PreQual/Technical,.pdf,SBD,09-May-2023 02:00 PM,20-May-2023 02:00 PM,09-May-2023 02:00 PM,19-May-2023 02:00 PM,NA ,NA ,09-May-2023 02:00 PM,19-May-2023 02:00 PM,04-Sep-2023 09:00 AM,"50,000",Yes,fixed,,Nil,Nil,1.0,SBI Bank,500.0,Nil,Nil,No,"The Commissioner, GMC","Office of the Commissioner, GMC, Bhangagarh, Guwahati-5",Construction of box drain at Simantapur infront of DGP anticoruption,Improvement of various works under 2nd Installment of Untied Basic Grant under the award of 15th Finance Commission for the year 2020-21 during the Financial year 2021-22,Please refer Tender documents. ,NA ,"25,00,000",Civil Works,NA ,Tender,90.0,90.0,GUWAHATI,781005.0,NA ,NA ,NA ,"Office of the Commissioner, Bhangagarh, Guwahati-5",No ,No,AOC,04-Nov-2023,"INR 1,857,500",90.0,Nabajyoti Bordoloi,06-Nov-2023 07:44 PM,DGP.pdf (272.00 KB),1.0,186055.0,SRI SAMUJJAL KUMAR DAS,INR,"1,857,500",1,186017,M/S jaykrity,19-May-2023 12:43 PM,Rejected-AOC,Work allotted to the L1 bidder,06-Nov-2023 07:45 PM,Finance,Financial Bids submitted by the bidders have been considered for further Evaluation.,Nabajyoti Bordoloi,04-Sep-2023 12:41 PM,finance_49352.pdf,BOQ Comparative Chart,"Additional Commissioner, GMC",Internal,"Chief Engineer, Superintending Engineer, CAAO, Divisional Engineer, Procurement Officer",Nabajyoti Bordoloi,16-Sep-2023 10:37 AM,finsummary_49352.pdf (2882.12 KB),Guwahati Municipal Corporation,2023_GMC_30724_5,GER/CE/2016/2022/30 Dt. 06/05/2023,Construction of box drain at Simantapur infront of DGP anticoruption,Technical,Bid has been opened and admitted for technical evaluation .,Chandan Talukdar,20-May-2023 06:22 PM,,"Additional Commissioner, GMC",Internal,"Chief Engineer, Superintending Engineer, CAAO, Divisional Engineer, Procurement Officer",Nabajyoti Bordoloi,30-Aug-2023 10:57 AM,04-Sep-2023 09:00 AM,techsummary_49352.pdf (5372.12 KB),AOC
,,,,,,,,,,,,,,,,.pdf,TECHNICAL DOCUMENTS,,,,,,,,,,,,,,,,,,,,,,,,,,,,,,,,,,,,,,,,,,AOC,,,,,,,,,,,,2,186045,M/S MAYA ENTERPRISE,19-May-2023 10:50 AM,Rejected-Technical,Details Mentioned in the Minutes,30-Aug-2023 10:57 AM,,,,,,,,,,,,,,,,,,,,,,,,,,,,,AOC
,,,,,,,,,,,,,,2.0,Finance,.xls,BOQ,,,,,,,,,,,,,,,,,,,,,,,,,,,,,,,,,,,,,,,,,,AOC,,,,,,,,,,,,3,185841,Ranjan Barman,18-May-2023 09:00 PM,Rejected-AOC,Work allotted to the L1 bidder,06-Nov-2023 07:45 PM,,,,,,,,,,,,,,,,,,,,,,,,,,,,,AOC
,,,,,,,,,,,,,,,,,,,,,,,,,,,,,,,,,,,,,,,,,,,,,,,,,,,,,,,,,,,AOC,,,,,,,,,,,,4,186022,SRI DEEPANKAR DAIMARY,18-May-2023 10:41 PM,Rejected-AOC,Work allotted to the L1 bidder,06-Nov-2023 07:45 PM,,,,,,,,,,,,,,,,,,,,,,,,,,,,,AOC
,,,,,,,,,,,,,,,,,,,,,,,,,,,,,,,,,,,,,,,,,,,,,,,,,,,,,,,,,,,AOC,,,,,,,,,,,,5,186055,SRI SAMUJJAL KUMAR DAS,19-May-2023 12:56 PM,Accepted-AOC,Work allotted to the L1 bidder,06-Nov-2023 07:45 PM,,,,,,,,,,,,,,,,,,,,,,,,,,,,,AOC
