Organisation Chain,Tender Reference Number,Tender ID,Withdrawal Allowed,Tender Type,Form of contract,Tender Category,No. of Covers,General Technical Evaluation Allowed,ItemWise Technical Evaluation Allowed,Payment Mode,Is Multi Currency Allowed For BOQ,Is Multi Currency Allowed For Fee,Allow Two Stage Bidding,Cover No,Cover,Document Type,Description,Publish Date,Bid Opening Date,Document Download / Sale Start Date,Document Download / Sale End Date,Clarification Start Date,Clarification End Date,Bid Submission Start Date,Bid Submission End Date,Financial Bid Opening Date,EMD Amount in ₹,EMD Exemption Allowed,EMD Fee Type,EMD Percentage,EMD Payable To,EMD Payable At,S.No,Bank Name,Tender Fee in ₹,Fee Payable To,Fee Payable At,Tender Fee Exemption Allowed,Name,Address,Title,Work Description,Pre Qualification Details,Independent External Monitor/Remarks,Tender Value in ₹,Product Category,Sub category,Contract Type,Bid Validity(Days),Period Of Work(Days),Location,Pincode,Pre Bid Meeting Place,Pre Bid Meeting Address,Pre Bid Meeting Date,Bid Opening Place,Should Allow NDA Tender,Allow Preferential Bidder,Tender Stage,Contract Date :,Contract Value :,Work Completion Period in days :,Updated By :,Updated on :,AOC document :,AOC Description :,S.No,Bid Number,Bidder Name,Awarded Currency,Awarded Value,S.No.1,Bid Number.1,Bidder Name.1,Submitted Date,Status,Remarks,Status Updated On,Type :,Summary :,Updated By :.1,Updated On :,Document :,BOQ Comparative Chart :,Committee Chairperson/Co-ordinator Name :,Committee Chairperson/Co-ordinator Type :,Committee Members :,Updated By :.2,Updated on :.1,Document :.1,Organisation Chain :,Tender ID :,Tender Ref No :,Tender Title :,Type :.1,Summary :.1,Updated By :.3,Updated On :.1,Document :.2,Committee Chairperson/Co-ordinator Name :.1,Committee Chairperson/Co-ordinator Type :.1,Committee Members :.1,Updated By :.4,Updated On :.2,Financial Bid Opening Date:,Document :.3,Tender Stage
National Health Mission||State Programme Management Unit - NHM,NHM-32023/2/2022-CONS-NHM/47,2023_NHM_30326_1,Yes,Open Tender,Turn-key,Works,2.0,No,No,Online,No,No,No,1.0,Fee/PreQual/Technical,.pdf,TECHNICALQUALIFICATION,04-Apr-2023 09:00 AM,26-Apr-2023 03:30 PM,04-Apr-2023 09:00 AM,25-Apr-2023 02:00 PM,NA ,NA ,04-Apr-2023 09:00 AM,25-Apr-2023 02:00 PM,13-Jul-2023 09:00 AM,"1,04,060",Yes,percentage,2.0%,Nil,Nil,1.0,SBI Bank,"1,100",Nil,Nil,No,"MD, NHM, Assam","Office of Mission Director, NHM, Assam, Christianbasti, NHM, Assam","Construction of Sub Health Centre at Kachamari in Nagaon District under NHM, Assam.","Construction of Sub Health Centre at Kachamari in Nagaon District under NHM, Assam.",Please refer Tender documents. ,NA ,"52,03,000",Civil Works - Building,NA ,Tender,180.0,180.0,Kachamari in Nagaon District,782001.0,NA ,NA ,NA ,"O/O Mission Director, NHM, Assam",No ,No,AOC,30-Nov-2023,"INR 4,422,550",180.0,Himangshu Kalita,30-Nov-2023 05:47 PM,WOKACHAMARI.pdf (553.00 KB),AOC,1.0,184582.0,Ramesh Kr. Agarwalla,INR,"4,422,550",1,184596,Dilip Kumar Bora,24-Apr-2023 08:22 PM,Rejected-Finance,L7 rate is not accepted,17-Oct-2023 04:05 PM,Finance,Financial bid is opened,Anupam Choudhury,11-Sep-2023 01:11 PM,,BOQ Comparative Chart,ED,Internal,,Himangshu Kalita,17-Oct-2023 04:05 PM,finsummary_48684.pdf (460.97 KB),National Health Mission||State Programme Management Unit - NHM,2023_NHM_30326_1,NHM-32023/2/2022-CONS-NHM/47,"Construction of Sub Health Centre at Kachamari in Nagaon District under NHM, Assam.",Technical,Technical Evaluation,Anupam Choudhury,12-Jul-2023 08:14 PM,technical_48684.pdf,OSD,Internal,"DF, FA, CC(CW), SE(C), SE(E)",Anupam Choudhury,12-Jul-2023 08:16 PM,13-Jul-2023 09:00 AM,techsummary_48684.pdf (364.12 KB),AOC
,,,,,,,,,,,,,,,,.pdf,BIDDING DOCUMENT,,,,,,,,,,,,,,,,,,,,,,,,,,,,,,,,,,,,,,,,,,AOC,,,,,,,,,,,,,2,182907,INTAZ ALI,25-Apr-2023 01:44 PM,Rejected-Finance,L3 rate is not accepted,17-Oct-2023 04:05 PM,,,,,,,,,,,,,,,,,,,,,,,,,,,,,AOC
,,,,,,,,,,,,,,,,.pdf,TENDER FEE RECEIPT,,,,,,,,,,,,,,,,,,,,,,,,,,,,,,,,,,,,,,,,,,AOC,,,,,,,,,,,,,3,184478,MINTU KUMAR BHUYAN,25-Apr-2023 11:30 AM,Rejected-Finance,L3 rate is not accepted,17-Oct-2023 04:05 PM,,,,,,,,,,,,,,,,,,,,,,,,,,,,,AOC
,,,,,,,,,,,,,,2.0,Finance,.xls,BOQ,,,,,,,,,,,,,,,,,,,,,,,,,,,,,,,,,,,,,,,,,,AOC,,,,,,,,,,,,,4,184025,MS S B B Associates,20-Apr-2023 09:42 PM,Rejected-Finance,L3 rate is not accepted,17-Oct-2023 04:05 PM,,,,,,,,,,,,,,,,,,,,,,,,,,,,,AOC
,,,,,,,,,,,,,,,,.pdf,FOB,,,,,,,,,,,,,,,,,,,,,,,,,,,,,,,,,,,,,,,,,,AOC,,,,,,,,,,,,,5,184576,MS Unique Construction,24-Apr-2023 07:00 PM,Rejected-Finance,L3 rate is not accepted,17-Oct-2023 04:05 PM,,,,,,,,,,,,,,,,,,,,,,,,,,,,,AOC
,,,,,,,,,,,,,,,,,,,,,,,,,,,,,,,,,,,,,,,,,,,,,,,,,,,,,,,,,,,AOC,,,,,,,,,,,,,6,184597,Nabajyoti Baruah,25-Apr-2023 01:10 PM,Rejected-Finance,L6 rate is not accepted,17-Oct-2023 04:05 PM,,,,,,,,,,,,,,,,,,,,,,,,,,,,,AOC
,,,,,,,,,,,,,,,,,,,,,,,,,,,,,,,,,,,,,,,,,,,,,,,,,,,,,,,,,,,AOC,,,,,,,,,,,,,7,184582,Ramesh Kr. Agarwalla,24-Apr-2023 08:32 PM,Accepted-AOC,L1 bidder is awarded,30-Nov-2023 05:48 PM,,,,,,,,,,,,,,,,,,,,,,,,,,,,,AOC
,,,,,,,,,,,,,,,,,,,,,,,,,,,,,,,,,,,,,,,,,,,,,,,,,,,,,,,,,,,AOC,,,,,,,,,,,,,8,184600,SWAPAN KUMAR SAHA,24-Apr-2023 09:07 PM,Not Admitted-Fee/PreQual/Technical,Not Complied with technical specification,12-Jul-2023 08:14 PM,,,,,,,,,,,,,,,,,,,,,,,,,,,,,AOC
