Organisation Chain,Tender Reference Number,Tender ID,Withdrawal Allowed,Tender Type,Form of contract,Tender Category,No. of Covers,General Technical Evaluation Allowed,ItemWise Technical Evaluation Allowed,Payment Mode,Is Multi Currency Allowed For BOQ,Is Multi Currency Allowed For Fee,Allow Two Stage Bidding,Cover No,Cover,Document Type,Description,Publish Date,Bid Opening Date,Document Download / Sale Start Date,Document Download / Sale End Date,Clarification Start Date,Clarification End Date,Bid Submission Start Date,Bid Submission End Date,Financial Bid Opening Date,EMD Amount in ₹,EMD Exemption Allowed,EMD Fee Type,EMD Percentage,EMD Payable To,EMD Payable At,S.No,Bank Name,Tender Fee in ₹,Fee Payable To,Fee Payable At,Tender Fee Exemption Allowed,Name,Address,Title,Work Description,Pre Qualification Details,Independent External Monitor/Remarks,Tender Value in ₹,Product Category,Sub category,Contract Type,Bid Validity(Days),Period Of Work(Days),Location,Pincode,Pre Bid Meeting Place,Pre Bid Meeting Address,Pre Bid Meeting Date,Bid Opening Place,Should Allow NDA Tender,Allow Preferential Bidder,Tender Stage,Contract Date :,Contract Value :,Work Completion Period in days :,Updated By :,Updated on :,AOC document :,S.No,Bid Number,Bidder Name,Awarded Currency,Awarded Value,S.No.1,Bid Number.1,Bidder Name.1,Submitted Date,Status,Remarks,Status Updated On,Type :,Summary :,Updated By :.1,Updated On :,Document :,BOQ Comparative Chart :,Committee Chairperson/Co-ordinator Name :,Committee Chairperson/Co-ordinator Type :,Committee Members :,Updated By :.2,Updated on :.1,Document :.1,Organisation Chain :,Tender ID :,Tender Ref No :,Tender Title :,Type :.1,Summary :.1,Updated By :.3,Updated On :.1,Document :.2,Committee Chairperson/Co-ordinator Name :.1,Committee Chairperson/Co-ordinator Type :.1,Committee Members :.1,Updated By :.4,Updated On :.2,Financial Bid Opening Date:,Document :.3,Tender Stage
Axom Sarba Siksha Abhijan Mission,SS/CW/RETENDER/333/2023/39,2023_SSA_31975_14,Yes,Open Tender,Works,Works,2.0,No,No,Online,No,No,No,1.0,Fee/PreQual/Technical,.pdf,TENDER FEE AND EMD,08-Aug-2023 06:00 PM,19-Aug-2023 03:00 PM,08-Aug-2023 06:00 PM,19-Aug-2023 02:00 PM,08-Aug-2023 06:00 PM ,10-Aug-2023 03:00 PM ,08-Aug-2023 06:00 PM,19-Aug-2023 02:00 PM,22-Sep-2023 09:00 AM,"1,07,400",Yes,percentage,2.0%,Nil,Nil,1.0,SBI Bank,"1,074",Nil,Nil,Yes,MISSION DIRECTOR SAMAGRA SHIKSHA ASSAM,KAHILIPARA GUWAHATI-19,"Construction of various civil work interventions for strengthening of existing secondary schools under Samagra Shiksha, Assam at Tilapara High School under Chapor block in Dhubri district","Construction of various civil work interventions for strengthening of existing secondary schools under Samagra Shiksha, Assam at Tilapara High School under Chapor block in Dhubri district",Please refer Tender documents. ,NA ,"53,70,000",Civil Works - Building,NA ,Tender,180.0,180.0,CHAPOR,781019.0,OFFICE OF THE MD SAMAGRA SHIKSHA ASSAM ,"OFFICE OF THE MD SAMAGRA SHIKSHA ASSAM, KAHILIPARA, GHY-19 ",10-Aug-2023 03:00 PM ,OFFICE OF THE MD SAMAGRA SHIKSHA ASSAM,No ,No,AOC,12-Oct-2023,"INR 4,833,000",300.0,Kamal Das,12-Oct-2023 06:42 PM,Tilapara_Dhubri_Sailen.pdf (308.00 KB),1.0,195352.0,SAILEN BAISHYA,INR,"4,833,000",1,195730,HTM Enterprise,19-Aug-2023 01:35 AM,Rejected-Technical,Non-responsive,21-Sep-2023 06:57 PM,Finance,Admitted,Azim Hussain,22-Sep-2023 07:07 PM,,BOQ Comparative Chart,"Sanjoy Dutta, ACS",Internal,,Kamal Das,12-Oct-2023 06:41 PM,finsummary_51298.pdf (576.58 KB),Axom Sarba Siksha Abhijan Mission,2023_SSA_31975_14,SS/CW/RETENDER/333/2023/39,"Construction of various civil work interventions for strengthening of existing secondary schools under Samagra Shiksha, Assam at Tilapara High School under Chapor block in Dhubri district",Technical,Admitted for technical evaluation,Kamal Das,21-Sep-2023 06:55 PM,,"Sanjoy Das, ACS",Internal,,Kamal Das,21-Sep-2023 06:57 PM,22-Sep-2023 09:00 AM,techsummary_51298.pdf (1212.09 KB),AOC
,,,,,,,,,,,,,,,,.pdf,PRE QUALIFICATION DOCUMENTS,,,,,,,,,,,,,,,,,,,,,,,,,,,,,,,,,,,,,,,,,,AOC,,,,,,,,,,,,2,195707,M/S. S.F. ENTERPRISE,18-Aug-2023 07:02 PM,Rejected-AOC,Non-responsive as per clause 30 under ITB-sub section E,12-Oct-2023 06:42 PM,,,,,,,,,,,,,,,,,,,,,,,,,,,,,AOC
,,,,,,,,,,,,,,,,.pdf,SIGNED BID DOCUMENT,,,,,,,,,,,,,,,,,,,,,,,,,,,,,,,,,,,,,,,,,,AOC,,,,,,,,,,,,3,195740,RJ TECH DEVELOPERS LLP,18-Aug-2023 09:36 PM,Rejected-AOC,Non-responsive as per clause 30 under ITB-sub section E,12-Oct-2023 06:42 PM,,,,,,,,,,,,,,,,,,,,,,,,,,,,,AOC
,,,,,,,,,,,,,,2.0,Finance,.xls,BOQ,,,,,,,,,,,,,,,,,,,,,,,,,,,,,,,,,,,,,,,,,,AOC,,,,,,,,,,,,4,195710,Saiful Enterprise,18-Aug-2023 08:17 PM,Rejected-AOC,Non-responsive as per clause 30 under ITB-sub section E,12-Oct-2023 06:42 PM,,,,,,,,,,,,,,,,,,,,,,,,,,,,,AOC
,,,,,,,,,,,,,,,,.pdf,FORM OF BID,,,,,,,,,,,,,,,,,,,,,,,,,,,,,,,,,,,,,,,,,,AOC,,,,,,,,,,,,5,195352,SAILEN BAISHYA,18-Aug-2023 06:22 PM,Accepted-AOC,Awarded as per clause 30 under ITB-sub section E,12-Oct-2023 06:42 PM,,,,,,,,,,,,,,,,,,,,,,,,,,,,,AOC
,,,,,,,,,,,,,,,,,,,,,,,,,,,,,,,,,,,,,,,,,,,,,,,,,,,,,,,,,,,AOC,,,,,,,,,,,,6,195799,Zabed Ali,19-Aug-2023 11:34 AM,Rejected-AOC,Non-responsive as per clause 30 under ITB-sub section E,12-Oct-2023 06:42 PM,,,,,,,,,,,,,,,,,,,,,,,,,,,,,AOC
