Organisation Chain,Tender Reference Number,Tender ID,Withdrawal Allowed,Tender Type,Form of contract,Tender Category,No. of Covers,General Technical Evaluation Allowed,ItemWise Technical Evaluation Allowed,Payment Mode,Is Multi Currency Allowed For BOQ,Is Multi Currency Allowed For Fee,Allow Two Stage Bidding,Cover No,Cover,Document Type,Description,Publish Date,Bid Opening Date,Document Download / Sale Start Date,Document Download / Sale End Date,Clarification Start Date,Clarification End Date,Bid Submission Start Date,Bid Submission End Date,Financial Bid Opening Date,EMD Amount in ₹,EMD Exemption Allowed,EMD Fee Type,EMD Percentage,EMD Payable To,EMD Payable At,S.No,Bank Name,Tender Fee in ₹,Fee Payable To,Fee Payable At,Tender Fee Exemption Allowed,Name,Address,Title,Work Description,Pre Qualification Details,Independent External Monitor/Remarks,Tender Value in ₹,Product Category,Sub category,Contract Type,Bid Validity(Days),Period Of Work(Days),Location,Pincode,Pre Bid Meeting Place,Pre Bid Meeting Address,Pre Bid Meeting Date,Bid Opening Place,Should Allow NDA Tender,Allow Preferential Bidder,Tender Stage,Contract Date :,Contract Value :,Work Completion Period in days :,Updated By :,Updated on :,AOC document :,AOC Description :,S.No,Bid Number,Bidder Name,Awarded Currency,Awarded Value,S.No.1,Bid Number.1,Bidder Name.1,Submitted Date,Status,Remarks,Status Updated On,Type :,Summary :,Updated By :.1,Updated On :,Document :,BOQ Comparative Chart :,Committee Chairperson/Co-ordinator Name :,Committee Chairperson/Co-ordinator Type :,Committee Members :,Updated By :.2,Updated on :.1,Document :.1,Organisation Chain :,Tender ID :,Tender Ref No :,Tender Title :,Type :.1,Summary :.1,Updated By :.3,Updated On :.1,Document :.2,Committee Chairperson/Co-ordinator Name :.1,Committee Chairperson/Co-ordinator Type :.1,Committee Members :.1,Updated By :.4,Updated On :.2,Financial Bid Opening Date:,Document :.3,Tender Stage
Irrigation Department||Chief Engineer(Major)-Irrigation Dept||Barpeta Circle,BCI/TECH/NIT/31/38,2023_ID_32127_1,Yes,Open Tender,Item Rate,Works,2.0,No,No,Online,No,No,No,1.0,Fee/PreQual/Technical,.pdf,Bid document EMD and other details,18-Aug-2023 06:00 PM,01-Sep-2023 11:00 AM,18-Aug-2023 06:00 PM,31-Aug-2023 02:00 PM,NA ,NA ,18-Aug-2023 06:00 PM,31-Aug-2023 02:00 PM,14-Sep-2023 11:00 AM,"1,78,234",Yes,percentage,2.0%,Nil,Nil,1.0,SBI Bank,"1,800",Nil,Nil,No,Superintending Engineer,"O/o the Superintending Engineer, Barpeta Circle, Irrigation, Barpeta Road",Installation of Nichuka Solar Powered MDTW (3 points) Irrigation Scheme under RIDF-XXVIII (NABARD) for the year 2022-23,As per BOQ,As per Bid document ,NA ,"89,11,713",Civil Works,Irrigation ,Tender,180.0,90.0,Sorbhog,781317.0,NA ,NA ,NA ,Barpeta Road,No ,No,AOC,26-Oct-2023,"INR 8,020,542",120.0,Dhrubajyoti Talukdar,26-Oct-2023 05:09 PM,aocdetails_nichuka.pdf (2928.00 KB),"Formal Work Order issued vide No. BCI/TECH/CS/NABARD-XXVIII/41/34, Dtd. 03/10/2023",1.0,196646.0,ASM BROTHERS,INR,"8,020,542",1,196646,ASM BROTHERS,30-Aug-2023 01:21 PM,Accepted-AOC,Accepted and work order issued,26-Oct-2023 05:11 PM,Finance,"As the bidders at Sl. No. 1, 2 and 3 above are technically qualified, so their financial bids may be opened",Dhrubajyoti Talukdar,25-Oct-2023 04:50 PM,finance_51589.pdf,BOQ Comparative Chart,"Superintending Engineer, Barpeta Circle, Irrigation, Barpeta Road",Internal,"EE (i) Sorbhog-Jania Divn (I) Sorbhog, (ii) Barpeta-Baghbar Divn (I) Barpeta(iii) Sarukhetri-Chenga Divn (I)Sarthebari, EE(TC) Barpeta Circle(I) Barpeta Road and A.O, Sorbhog-Jania Divn (I) Sorbhog",Dhrubajyoti Talukdar,26-Oct-2023 04:18 PM,finsummary_51589.pdf (454.03 KB),Irrigation Department||Chief Engineer(Major)-Irrigation Dept||Barpeta Circle,2023_ID_32127_1,BCI/TECH/NIT/31/38,Installation of Nichuka Solar Powered MDTW (3 points) Irrigation Scheme under RIDF-XXVIII (NABARD) for the year 2022-23,Technical,"Sl. No. 1,3 and 6 are technically responsive due to submission of valid documents as per bid document. Sl. No. 2,4 and 5 are technically non responsive due to not submitting valid documents as per bid document.",Dhrubajyoti Talukdar,13-Sep-2023 12:03 PM,technical_51589.pdf,"Dhrubajyoti Talukdar, SE - Barpeta Circle",Internal,"Sanjib Kr. Das,EE - Sorbhog Jania Div, Kishor Barman,EE - Barpeta Baghbar Div, Manik Dutta,EE - Sarukhetri Chenga Div, Mrinal Das,EE(TC) - Barpeta Circle, Kumarendra Patgiri, Acc. Off., Sorbhog Jania",Dhrubajyoti Talukdar,13-Sep-2023 12:09 PM,14-Sep-2023 11:00 AM,techsummary_51589.pdf (2871.32 KB),AOC
,,,,,,,,,,,,,,2.0,Finance,.xls,BOQ,,,,,,,,,,,,,,,,,,,,,,,,,,,,,,,,,,,,,,,,,,AOC,,,,,,,,,,,,,2,196876,Bhrigujit Choudhury,31-Aug-2023 12:49 PM,Not Admitted-Fee/PreQual/Technical,Not Complied with technical specification,13-Sep-2023 12:03 PM,,,,,,,,,,,,,,,,,,,,,,,,,,,,,AOC
,,,,,,,,,,,,,,,,,,,,,,,,,,,,,,,,,,,,,,,,,,,,,,,,,,,,,,,,,,,AOC,,,,,,,,,,,,,3,197364,DEBAJIT PATGIRI,31-Aug-2023 12:42 PM,Rejected-Finance,Stood in position-III in tender evaluation though L1,26-Oct-2023 04:18 PM,,,,,,,,,,,,,,,,,,,,,,,,,,,,,AOC
,,,,,,,,,,,,,,,,,,,,,,,,,,,,,,,,,,,,,,,,,,,,,,,,,,,,,,,,,,,AOC,,,,,,,,,,,,,4,195929,M/S J. G. Associatates,30-Aug-2023 03:35 PM,Rejected-Finance,Stood in position-II in tender evaluation but L2,26-Oct-2023 04:18 PM,,,,,,,,,,,,,,,,,,,,,,,,,,,,,AOC
,,,,,,,,,,,,,,,,,,,,,,,,,,,,,,,,,,,,,,,,,,,,,,,,,,,,,,,,,,,AOC,,,,,,,,,,,,,5,197053,Siddhartha Bhakta,29-Aug-2023 05:53 PM,Not Admitted-Fee/PreQual/Technical,Not Complied with technical specification,13-Sep-2023 12:03 PM,,,,,,,,,,,,,,,,,,,,,,,,,,,,,AOC
,,,,,,,,,,,,,,,,,,,,,,,,,,,,,,,,,,,,,,,,,,,,,,,,,,,,,,,,,,,AOC,,,,,,,,,,,,,6,196241,Sri Manash Jyoti Deka,30-Aug-2023 03:31 PM,Not Admitted-Fee/PreQual/Technical,Not Complied with technical specification,13-Sep-2023 12:03 PM,,,,,,,,,,,,,,,,,,,,,,,,,,,,,AOC
