Organisation Chain,Tender Reference Number,Tender ID,Withdrawal Allowed,Tender Type,Form of contract,Tender Category,No. of Covers,General Technical Evaluation Allowed,ItemWise Technical Evaluation Allowed,Payment Mode,Is Multi Currency Allowed For BOQ,Is Multi Currency Allowed For Fee,Allow Two Stage Bidding,Cover No,Cover,Document Type,Description,Publish Date,Bid Opening Date,Document Download / Sale Start Date,Document Download / Sale End Date,Clarification Start Date,Clarification End Date,Bid Submission Start Date,Bid Submission End Date,Financial Bid Opening Date,EMD Amount in ₹,EMD Exemption Allowed,EMD Fee Type,EMD Percentage,EMD Payable To,EMD Payable At,S.No,Corrigendum Title,Corrigendum Type,View,S.No.1,Bank Name,Tender Fee in ₹,Fee Payable To,Fee Payable At,Tender Fee Exemption Allowed,Name,Address,Title,Work Description,Pre Qualification Details,Independent External Monitor/Remarks,Tender Value in ₹,Product Category,Sub category,Contract Type,Bid Validity(Days),Period Of Work(Days),Location,Pincode,Pre Bid Meeting Place,Pre Bid Meeting Address,Pre Bid Meeting Date,Bid Opening Place,Should Allow NDA Tender,Allow Preferential Bidder,Tender Stage,Contract Date :,Contract Value :,Work Completion Period in days :,Updated By :,Updated on :,AOC document :,AOC Description :,S.No,Bid Number,Bidder Name,Awarded Currency,Awarded Value,S.No.1,Bid Number.1,Bidder Name.1,Submitted Date,Status,Remarks,Status Updated On,Type :,Summary :,Updated By :.1,Updated On :,Document :,BOQ Comparative Chart :,Committee Chairperson/Co-ordinator Name :,Committee Chairperson/Co-ordinator Type :,Committee Members :,Updated By :.2,Updated on :.1,Document :.1,Organisation Chain :,Tender ID :,Tender Ref No :,Tender Title :,Type :.1,Summary :.1,Updated By :.3,Updated On :.1,Document :.2,Committee Chairperson/Co-ordinator Name :.1,Committee Chairperson/Co-ordinator Type :.1,Committee Members :.1,Updated By :.4,Updated On :.2,Financial Bid Opening Date:,Document :.3,Tender Stage
Welfare of Plain Tribes and Backward Classes||Director - WPT and BC,"DW/NIT/77/2022-23/25-26, Dated, Guwahati, 7th of J",2022_WPTBC_25980_1,Yes,Open Tender,Item Rate,Goods,2.0,No,No,Online,No,No,No,1.0,Fee/PreQual/Technical,.pdf,Bid Document,16-Jun-2022 04:00 PM,06-Jul-2022 04:00 PM,16-Jun-2022 04:00 PM,06-Jul-2022 02:00 PM,NA ,NA ,16-Jun-2022 04:00 PM,06-Jul-2022 02:00 PM,02-Nov-2022 02:00 PM,"2,00,000",No,fixed,,Nil,Nil,1.0,Corrigendum and Extension of Dates,Date,,1.0,SBI Bank,"5,000",Nil,Nil,No,"Director, WPT and BC, Assam","Directorate of WPT and BC Assam, Rukmini Nagar, Guwahati 6",FIXATION OF RATE OF 2HP HAMMER MILL,FIXATION OF RATE OF 2HP HAMMER MILL,Please refer Tender documents. ,NA ,,Farm Machinery and Equipments,NA ,Rate Contract,365.0,120.0,All Districts of Assam,781006.0,Directorate of WPT and BC Assam ,"Directorate of WPT and BC Assam, Rukmini Nagar, Guwahati 6 ",21-Jun-2022 11:00 AM ,Directorate of WPT and BC Assam,No ,No,AOC,12-Oct-2023,INR 0,120.0,Darendra Singha,12-Oct-2023 04:43 PM,2HPHammerMill.pdf (1527.00 KB),Fixation of rate,1,151257,Trade Supply India,INR,0,1,152231,M/s. Eureka Trade,05-Jul-2022 10:06 PM,Accepted-AOC,Fixation of rate,12-Oct-2023 04:44 PM,Finance,Evaluation processed,Darendra Singha,12-Oct-2023 04:28 PM,finance_40137.pdf,BOQ Comparative Chart,Director Tribal Affairs Plain,Internal,Director Deputy Director Joint Secretary FAO of Tribal Affairs Plain Supt State GST Industries and Commerce Deptt,Darendra Singha,12-Oct-2023 04:34 PM,finsummary_40137.pdf (1068.65 KB),Welfare of Plain Tribes and Backward Classes||Director - WPT and BC,2022_WPTBC_25980_1,"DW/NIT/77/2022-23/25-26, Dated, Guwahati, 7th of J",FIXATION OF RATE OF 2HP HAMMER MILL,Technical,Technical Evaluation,Sajen Langthasa,01-Nov-2022 03:35 PM,technical_40137.pdf,Director of Tribal Affairs Plain,Internal,Director Joint Secretary Deputy Director F and AO of Tribal Affairs Plain etc,Sajen Langthasa,02-Nov-2022 10:24 AM,02-Nov-2022 02:00 PM,techsummary_40137.pdf (434.94 KB),AOC
,,,,,,,,,,,,,,,,.pdf,Technical Documents,,,,,,,,,,,,,,,,,,,,,,,,,,,,,,,,,,,,,,,,,,,,,,AOC,,,,,,,,2,152231,M/s. Eureka Trade,INR,0,2,152394,M/S J.K ENGINEERING AND AGRO SERVICE,05-Jul-2022 08:53 PM,Accepted-AOC,Fixation of rate,12-Oct-2023 04:44 PM,,,,,,,,,,,,,,,,,,,,,,,,,,,,,AOC
,,,,,,,,,,,,,,,,.pdf,Additional Documents,,,,,,,,,,,,,,,,,,,,,,,,,,,,,,,,,,,,,,,,,,,,,,AOC,,,,,,,,3,152254,S S ENTERPRISE,INR,0,3,152254,S S ENTERPRISE,05-Jul-2022 09:37 PM,Accepted-AOC,Fixation of rate,12-Oct-2023 04:44 PM,,,,,,,,,,,,,,,,,,,,,,,,,,,,,AOC
,,,,,,,,,,,,,,2.0,Finance,.xls,BoQ,,,,,,,,,,,,,,,,,,,,,,,,,,,,,,,,,,,,,,,,,,,,,,AOC,,,,,,,,4,152360,SURYA ENTERPRISES,INR,0,4,152360,SURYA ENTERPRISES,05-Jul-2022 09:22 PM,Accepted-AOC,Fixation of rate,12-Oct-2023 04:44 PM,,,,,,,,,,,,,,,,,,,,,,,,,,,,,AOC
,,,,,,,,,,,,,,,,,,,,,,,,,,,,,,,,,,,,,,,,,,,,,,,,,,,,,,,,,,,,,,,AOC,,,,,,,,5,152394,M/S J.K ENGINEERING AND AGRO SERVICE,INR,0,5,151257,Trade Supply India,05-Jul-2022 08:42 PM,Accepted-AOC,Fixation of rate,12-Oct-2023 04:44 PM,,,,,,,,,,,,,,,,,,,,,,,,,,,,,AOC
