Organisation Chain,Tender Reference Number,Tender ID,Withdrawal Allowed,Tender Type,Form of contract,Tender Category,No. of Covers,General Technical Evaluation Allowed,ItemWise Technical Evaluation Allowed,Payment Mode,Is Multi Currency Allowed For BOQ,Is Multi Currency Allowed For Fee,Allow Two Stage Bidding,Cover No,Cover,Document Type,Description,Publish Date,Bid Opening Date,Document Download / Sale Start Date,Document Download / Sale End Date,Clarification Start Date,Clarification End Date,Bid Submission Start Date,Bid Submission End Date,Financial Bid Opening Date,EMD Amount in ₹,EMD Exemption Allowed,EMD Fee Type,EMD Percentage,EMD Payable To,EMD Payable At,S.No,Bank Name,Tender Fee in ₹,Fee Payable To,Fee Payable At,Tender Fee Exemption Allowed,Name,Address,Title,Work Description,Pre Qualification Details,Independent External Monitor/Remarks,Tender Value in ₹,Product Category,Sub category,Contract Type,Bid Validity(Days),Period Of Work(Days),Location,Pincode,Pre Bid Meeting Place,Pre Bid Meeting Address,Pre Bid Meeting Date,Bid Opening Place,Should Allow NDA Tender,Allow Preferential Bidder,Tender Stage,Contract Date :,Contract Value :,Work Completion Period in days :,Updated By :,Updated on :,AOC document :,S.No,Bid Number,Bidder Name,Awarded Currency,Awarded Value,S.No.1,Bid Number.1,Bidder Name.1,Submitted Date,Status,Remarks,Status Updated On,Type :,Summary :,Updated By :.1,Updated On :,Document :,BOQ Comparative Chart :,Committee Chairperson/Co-ordinator Name :,Committee Chairperson/Co-ordinator Type :,Committee Members :,Updated By :.2,Updated on :.1,Document :.1,Organisation Chain :,Tender ID :,Tender Ref No :,Tender Title :,Type :.1,Summary :.1,Updated By :.3,Updated On :.1,Document :.2,Committee Chairperson/Co-ordinator Name :.1,Committee Chairperson/Co-ordinator Type :.1,Committee Members :.1,Updated By :.4,Updated On :.2,Financial Bid Opening Date:,Document :.3,Tender Stage
Welfare of Plain Tribes and Backward Classes||Director - WPT and BC,"DW/NIT/77/2022-23/25-26, Dated, 7th of June/2022",2022_WPTBC_27725_1,Yes,Open Tender,Item Rate,Goods,2.0,No,No,Online,No,No,No,1.0,Fee/PreQual/Technical,.pdf,Technical Documents,11-Nov-2022 04:00 PM,02-Dec-2022 04:00 PM,11-Nov-2022 04:00 PM,02-Dec-2022 02:00 PM,NA ,NA ,11-Nov-2022 04:00 PM,02-Dec-2022 02:00 PM,14-Mar-2023 11:00 AM,"2,00,000",Yes,fixed,,Nil,Nil,1.0,SBI Bank,"5,000",Nil,Nil,Yes,Director of Tribal Affairs Plain,Directorate of Tribal Affairs Plain Rukmini Nagar Guwahati 6,Fixation of rate of Cotton Yarn,Fixation of rate of Cotton Yarn,Please refer Tender documents. ,NA ,,Supply of Materials,NA ,Rate Contract,365.0,90.0,Assam,781006.0,Directorate of Tribal Affairs Plain ,Directorate of Tribal Affairs Plain Rukmini Nagar Guwahati 6 ,16-Nov-2022 12:00 PM ,Directorate of Tribal Affairs Plain,No ,No,AOC,13-Oct-2023,INR 0,90.0,Darendra Singha,13-Oct-2023 04:13 PM,CONCLUSION.pdf (272.00 KB),1.0,163653.0,M/s. Eureka Trade,INR,0.0,1,164830,AGMECO FAUCETS PRIVATE LIMITED,30-Nov-2022 01:22 PM,Rejected-Technical,Technically Non Responsive,14-Mar-2023 10:36 AM,Finance,Technically Evaluated,Darendra Singha,12-Oct-2023 05:11 PM,finance_43095.pdf,BOQ Comparative Chart,Director Tribal Affairs Plain,Internal,Director Deputy Director FAO Joint Secretary Tribal Affairs Plain Representative of State GST Industries and Commerce Handloom and Textiles Deptt,Darendra Singha,13-Oct-2023 04:11 PM,finsummary_43095.pdf (271.60 KB),Welfare of Plain Tribes and Backward Classes||Director - WPT and BC,2022_WPTBC_27725_1,"DW/NIT/77/2022-23/25-26, Dated, 7th of June/2022",Fixation of rate of Cotton Yarn,Technical,Technical evaluation,Darendra Singha,14-Mar-2023 10:31 AM,technical_43095.pdf,"Director, Tribal Affairs Plain",Internal,"Director, Deputy Director, Finance and Accounts Officer, etc",Darendra Singha,14-Mar-2023 10:36 AM,14-Mar-2023 11:00 AM,techsummary_43095.pdf (271.60 KB),AOC
,,,,,,,,,,,,,,,,.pdf,Additional Documents,,,,,,,,,,,,,,,,,,,,,,,,,,,,,,,,,,,,,,,,,,AOC,,,,,,,2.0,164502.0,"Orient Processors Pvt Ltd, Unit-II (Textile Division)",INR,0.0,2,165022,Ashoka Yarn Store,02-Dec-2022 01:12 PM,Rejected-Technical,Technically Non Responsive,14-Mar-2023 10:36 AM,,,,,,,,,,,,,,,,,,,,,,,,,,,,,AOC
,,,,,,,,,,,,,,,,.pdf,Bid Document,,,,,,,,,,,,,,,,,,,,,,,,,,,,,,,,,,,,,,,,,,AOC,,,,,,,3.0,165015.0,ORIENT SPUN SILK AND PROCESSING MILLS LLP,INR,0.0,3,164931,M/S BALAJI TRADERS,02-Dec-2022 01:34 PM,Rejected-Technical,Technically Non Responsive,14-Mar-2023 10:36 AM,,,,,,,,,,,,,,,,,,,,,,,,,,,,,AOC
,,,,,,,,,,,,,,2.0,Finance,.xls,BoQ,,,,,,,,,,,,,,,,,,,,,,,,,,,,,,,,,,,,,,,,,,AOC,,,,,,,,,,,,4,163653,M/s. Eureka Trade,01-Dec-2022 04:52 PM,Accepted-AOC,Rate fixed,13-Oct-2023 04:14 PM,,,,,,,,,,,,,,,,,,,,,,,,,,,,,AOC
,,,,,,,,,,,,,,,,,,,,,,,,,,,,,,,,,,,,,,,,,,,,,,,,,,,,,,,,,,,AOC,,,,,,,,,,,,5,164953,M/s M. M Textile Industries,01-Dec-2022 07:49 PM,Rejected-Technical,Technically Non Responsive,14-Mar-2023 10:36 AM,,,,,,,,,,,,,,,,,,,,,,,,,,,,,AOC
,,,,,,,,,,,,,,,,,,,,,,,,,,,,,,,,,,,,,,,,,,,,,,,,,,,,,,,,,,,AOC,,,,,,,,,,,,6,163499,M/S SARADA CONSTRUCTION,02-Dec-2022 08:50 AM,Rejected-Technical,Technically Non Responsive,14-Mar-2023 10:36 AM,,,,,,,,,,,,,,,,,,,,,,,,,,,,,AOC
,,,,,,,,,,,,,,,,,,,,,,,,,,,,,,,,,,,,,,,,,,,,,,,,,,,,,,,,,,,AOC,,,,,,,,,,,,7,164502,"Orient Processors Pvt Ltd, Unit-II (Textile Division)",01-Dec-2022 12:09 PM,Accepted-AOC,Rate fixed,13-Oct-2023 04:14 PM,,,,,,,,,,,,,,,,,,,,,,,,,,,,,AOC
,,,,,,,,,,,,,,,,,,,,,,,,,,,,,,,,,,,,,,,,,,,,,,,,,,,,,,,,,,,AOC,,,,,,,,,,,,8,165015,ORIENT SPUN SILK AND PROCESSING MILLS LLP,01-Dec-2022 06:02 PM,Accepted-AOC,Rate fixed,13-Oct-2023 04:14 PM,,,,,,,,,,,,,,,,,,,,,,,,,,,,,AOC
,,,,,,,,,,,,,,,,,,,,,,,,,,,,,,,,,,,,,,,,,,,,,,,,,,,,,,,,,,,AOC,,,,,,,,,,,,9,164988,SYNCRO ENGINEERING PRIVATE LIMITED,01-Dec-2022 12:50 PM,Rejected-Technical,Technically Non Responsive,14-Mar-2023 10:36 AM,,,,,,,,,,,,,,,,,,,,,,,,,,,,,AOC
