Organisation Chain,Tender Reference Number,Tender ID,Withdrawal Allowed,Tender Type,Form of contract,Tender Category,No. of Covers,General Technical Evaluation Allowed,ItemWise Technical Evaluation Allowed,Payment Mode,Is Multi Currency Allowed For BOQ,Is Multi Currency Allowed For Fee,Allow Two Stage Bidding,Cover No,Cover,Document Type,Description,Publish Date,Bid Opening Date,Document Download / Sale Start Date,Document Download / Sale End Date,Clarification Start Date,Clarification End Date,Bid Submission Start Date,Bid Submission End Date,Financial Bid Opening Date,EMD Amount in ₹,EMD Exemption Allowed,EMD Fee Type,EMD Percentage,EMD Payable To,EMD Payable At,S.No,Bank Name,Tender Fee in ₹,Fee Payable To,Fee Payable At,Tender Fee Exemption Allowed,Name,Address,Title,Work Description,Pre Qualification Details,Independent External Monitor/Remarks,Tender Value in ₹,Product Category,Sub category,Contract Type,Bid Validity(Days),Period Of Work(Days),Location,Pincode,Pre Bid Meeting Place,Pre Bid Meeting Address,Pre Bid Meeting Date,Bid Opening Place,Should Allow NDA Tender,Allow Preferential Bidder,Tender Stage,Contract Date :,Contract Value :,Work Completion Period in days :,Updated By :,Updated on :,AOC document :,AOC Description :,S.No,Bid Number,Bidder Name,Awarded Currency,Awarded Value,S.No.1,Bid Number.1,Bidder Name.1,Submitted Date,Status,Remarks,Status Updated On,Type :,Summary :,Updated By :.1,Updated On :,Document :,BOQ Comparative Chart :,Committee Chairperson/Co-ordinator Name :,Committee Chairperson/Co-ordinator Type :,Committee Members :,Updated By :.2,Updated on :.1,Document :.1,Organisation Chain :,Tender ID :,Tender Ref No :,Tender Title :,Type :.1,Summary :.1,Updated By :.3,Updated On :.1,Document :.2,Committee Chairperson/Co-ordinator Name :.1,Committee Chairperson/Co-ordinator Type :.1,Committee Members :.1,Updated By :.4,Updated On :.2,Financial Bid Opening Date:,Document :.3,Tender Stage
National Health Mission||State Programme Management Unit - NHM,NHM-32034/33/2022-CON-NHM/363,2022_NHM_28056_40,Yes,Open Tender,Turn-key,Works,2.0,No,No,Online,No,No,No,1.0,Fee/PreQual/Technical,.pdf,SBD,07-Dec-2022 02:00 PM,28-Dec-2022 03:30 PM,07-Dec-2022 02:00 PM,27-Dec-2022 02:00 PM,NA ,NA ,07-Dec-2022 02:00 PM,27-Dec-2022 02:00 PM,01-Sep-2023 04:35 PM,"1,04,060",Yes,percentage,2.0%,Nil,Nil,1.0,SBI Bank,"1,500",Nil,Nil,No,"MD, NHM, ASSAM","O/O MD, NHM, ASSAM, CHRISTANBASTI, GUWAHATI-05",Construction of Buildingless Sub Health Centre in Kutayoni SC in Nagaon District under PM ABHIM for the FY 2021 22 under NHM on Turnkey Basis,Construction of Buildingless Sub Health Centre in Kutayoni SC in Nagaon District under PM ABHIM for the FY 2021 22 under NHM on Turnkey Basis,Please refer Tender documents. ,NA ,"52,03,000",Civil Works - Building,NA ,Tender,180.0,180.0,Nagaon,782001.0,NA ,NA ,NA ,"O/O MD, NHM, ASSAM",No ,No,AOC,17-Jul-2024,"INR 4,920,000",180.0,Dipjyoti Deka,17-Jul-2024 03:38 PM,WOKUTAYONI.pdf (201.00 KB),AOC,1.0,170658.0,MS Unique Construction,INR,"4,920,000",1.0,170487.0,Dilip Kumar Bora,26-Dec-2022 07:55 PM,Rejected-Finance,L2 bidder is not accepted,17-Jul-2024 03:35 PM,Finance,Financial bid is opened,Dipjyoti Deka,17-Jul-2024 03:28 PM,,BOQ Comparative Chart,OSD,Internal,,Dipjyoti Deka,17-Jul-2024 03:35 PM,finsummary_44601.pdf (32.80 KB),National Health Mission||State Programme Management Unit - NHM,2022_NHM_28056_40,NHM-32034/33/2022-CON-NHM/363,Construction of Buildingless Sub Health Centre in Kutayoni SC in Nagaon District under PM ABHIM for the FY 2021 22 under NHM on Turnkey Basis,Technical,TBER,Anupam Choudhury,01-Sep-2023 04:21 PM,technical_44601.pdf,ED,Internal,,Anupam Choudhury,01-Sep-2023 04:30 PM,01-Sep-2023 04:35 PM,techsummary_44601.pdf (372.94 KB),AOC
,,,,,,,,,,,,,,,,.pdf,TECHNICAL QUALIFICATION,,,,,,,,,,,,,,,,,,,,,,,,,,,,,,,,,,,,,,,,,,AOC,,,,,,,,,,,,,2.0,170658.0,MS Unique Construction,26-Dec-2022 08:12 PM,Accepted-AOC,L1 bidder is awarded,17-Jul-2024 03:38 PM,,,,,,,,,,,,,,,,,,,,,,,,,,,,,AOC
,,,,,,,,,,,,,,,,.pdf,EMD AND TENDER FEE,,,,,,,,,,,,,,,,,,,,,,,,,,,,,,,,,,,,,,,,,,AOC,,,,,,,,,,,,,3.0,170671.0,Nabajyoti Baruah,26-Dec-2022 10:20 PM,Not Admitted-Fee/PreQual/Technical,Not Complied with technical specification,01-Sep-2023 04:21 PM,,,,,,,,,,,,,,,,,,,,,,,,,,,,,AOC
,,,,,,,,,,,,,,2.0,Finance,.xls,BOQ,,,,,,,,,,,,,,,,,,,,,,,,,,,,,,,,,,,,,,,,,,AOC,,,,,,,,,,,,,4.0,170682.0,SAURAV PHUKAN,27-Dec-2022 12:21 PM,Rejected-Finance,L3 bidder is not accepted,17-Jul-2024 03:35 PM,,,,,,,,,,,,,,,,,,,,,,,,,,,,,AOC
,,,,,,,,,,,,,,,,.pdf,FOB,,,,,,,,,,,,,,,,,,,,,,,,,,,,,,,,,,,,,,,,,,AOC,,,,,,,,,,,,,,,,,,,,,,,,,,,,,,,,,,,,,,,,,,,,,,,,AOC
