Organisation Chain,Tender Reference Number,Tender ID,Withdrawal Allowed,Tender Type,Form of contract,Tender Category,No. of Covers,General Technical Evaluation Allowed,ItemWise Technical Evaluation Allowed,Payment Mode,Is Multi Currency Allowed For BOQ,Is Multi Currency Allowed For Fee,Allow Two Stage Bidding,Cover No,Cover,Document Type,Description,Publish Date,Bid Opening Date,Document Download / Sale Start Date,Document Download / Sale End Date,Clarification Start Date,Clarification End Date,Bid Submission Start Date,Bid Submission End Date,Financial Bid Opening Date,EMD Amount in ₹,EMD Exemption Allowed,EMD Fee Type,EMD Percentage,EMD Payable To,EMD Payable At,S.No,Bank Name,Tender Fee in ₹,Fee Payable To,Fee Payable At,Tender Fee Exemption Allowed,Name,Address,Title,Work Description,Pre Qualification Details,Independent External Monitor/Remarks,Tender Value in ₹,Product Category,Sub category,Contract Type,Bid Validity(Days),Period Of Work(Days),Location,Pincode,Pre Bid Meeting Place,Pre Bid Meeting Address,Pre Bid Meeting Date,Bid Opening Place,Should Allow NDA Tender,Allow Preferential Bidder,Tender Stage,Contract Date :,Contract Value :,Work Completion Period in days :,Updated By :,Updated on :,AOC document :,AOC Description :,S.No,Bid Number,Bidder Name,Awarded Currency,Awarded Value,S.No.1,Bid Number.1,Bidder Name.1,Submitted Date,Status,Remarks,Status Updated On,Type :,Summary :,Updated By :.1,Updated On :,Document :,BOQ Comparative Chart :,Committee Chairperson/Co-ordinator Name :,Committee Chairperson/Co-ordinator Type :,Committee Members :,Updated By :.2,Updated on :.1,Document :.1,Organisation Chain :,Tender ID :,Tender Ref No :,Tender Title :,Type :.1,Summary :.1,Updated By :.3,Updated On :.1,Document :.2,Committee Chairperson/Co-ordinator Name :.1,Committee Chairperson/Co-ordinator Type :.1,Committee Members :.1,Updated By :.4,Updated On :.2,Financial Bid Opening Date:,Document :.3,Tender Stage
Guwahati Metropolitan Development Authority||Guwahati Development Department - GMDA,GMDA/DEV/07/2024/16,2024_GMDA_35973_1,Yes,Open Tender,Item Rate,Works,2.0,No,No,Online,No,No,No,1.0,Fee/PreQual/Technical,.pdf,Tender Document,06-Feb-2024 12:00 PM,19-Feb-2024 03:00 PM,06-Feb-2024 12:00 PM,19-Feb-2024 02:00 PM,NA ,NA ,06-Feb-2024 12:00 PM,19-Feb-2024 02:00 PM,28-Feb-2024 03:00 PM,"5,25,697",Yes,percentage,2.0%,Nil,Nil,1.0,SBI Bank,"2,000",Nil,Nil,No,"CEO, GMDA","Bhangagarh, Guwahati-05",Excavation of Silsako Beel Part 1A to enhance its retention capacity for the FY 2023 24 Package2,Excavation of Silsako Beel Part 1A to enhance its retention capacity for the FY 2023 24 Package2,Please refer Tender documents. ,NA ,"2,62,84,859",Civil Works,NA ,Tender,120.0,90.0,Guwahati,781005.0,NA ,NA ,NA ,"Office of CEO, GMDA",No ,No,AOC,15-Mar-2024,"INR 23,656,373.1",90.0,Seema Rabha,11-Jul-2024 02:54 PM,WorkOrderExcavation1APack2.pdf (648.00 KB),Work order issued,1.0,225876.0,RAKESH KR. SINGH,INR,"23,656,373.1",1,226546,Bhaba Kanta Nath,19-Feb-2024 12:49 PM,Rejected-AOC,Technically qualified L2 bidder,11-Jul-2024 02:54 PM,Finance,MoM of Financial Bid Evaluation,Seema Rabha,15-Mar-2024 09:54 AM,finance_58873.pdf,BOQ Comparative Chart,"Chief Engineer, GMDA",Internal,"D.O., GMDA, CAO, GMDA, T.P., GMDA, S.E., GMDA",Seema Rabha,15-Mar-2024 10:01 AM,finsummary_58873.pdf (471.46 KB),Guwahati Metropolitan Development Authority||Guwahati Development Department - GMDA,2024_GMDA_35973_1,GMDA/DEV/07/2024/16,Excavation of Silsako Beel Part 1A to enhance its retention capacity for the FY 2023 24 Package2,Technical,MoM of bid evaluation committee meeting,Mantu Borah,28-Feb-2024 12:42 PM,technical_58873.pdf,"Chief Engineer, GMDA",Internal,"D.o., GMDA, CAO, GMDA, T.P. GMDA, S.E., GMDA",Mantu Borah,28-Feb-2024 12:56 PM,28-Feb-2024 03:00 PM,techsummary_58873.pdf (472.12 KB),AOC
,,,,,,,,,,,,,,,,.pdf,Technical Document,,,,,,,,,,,,,,,,,,,,,,,,,,,,,,,,,,,,,,,,,,AOC,,,,,,,,,,,,,2,226570,M/S DHANSIRI ASSOCIATES,19-Feb-2024 12:58 PM,Rejected-AOC,Technically qualified L3 bidder,11-Jul-2024 02:54 PM,,,,,,,,,,,,,,,,,,,,,,,,,,,,,AOC
,,,,,,,,,,,,,,2.0,Finance,.xls,BoQ,,,,,,,,,,,,,,,,,,,,,,,,,,,,,,,,,,,,,,,,,,AOC,,,,,,,,,,,,,3,225876,RAKESH KR. SINGH,19-Feb-2024 12:56 PM,Accepted-AOC,Technically qualified L1 bidder,11-Jul-2024 02:54 PM,,,,,,,,,,,,,,,,,,,,,,,,,,,,,AOC
,,,,,,,,,,,,,,,,.pdf,FoB,,,,,,,,,,,,,,,,,,,,,,,,,,,,,,,,,,,,,,,,,,AOC,,,,,,,,,,,,,4,226549,RICHCON ENGINEERING COMPANY,18-Feb-2024 09:41 PM,Not Admitted-Fee/PreQual/Technical,Not Complied with technical specification,28-Feb-2024 12:42 PM,,,,,,,,,,,,,,,,,,,,,,,,,,,,,AOC
,,,,,,,,,,,,,,,,,,,,,,,,,,,,,,,,,,,,,,,,,,,,,,,,,,,,,,,,,,,AOC,,,,,,,,,,,,,5,226547,SRI HITESH KALITA,19-Feb-2024 01:04 PM,Not Admitted-Fee/PreQual/Technical,Not Complied with technical specification,28-Feb-2024 12:42 PM,,,,,,,,,,,,,,,,,,,,,,,,,,,,,AOC
