Organisation Chain,Tender Reference Number,Tender ID,Withdrawal Allowed,Tender Type,Form of contract,Tender Category,No. of Covers,General Technical Evaluation Allowed,ItemWise Technical Evaluation Allowed,Payment Mode,Is Multi Currency Allowed For BOQ,Is Multi Currency Allowed For Fee,Allow Two Stage Bidding,Cover No,Cover,Document Type,Description,Publish Date,Bid Opening Date,Document Download / Sale Start Date,Document Download / Sale End Date,Clarification Start Date,Clarification End Date,Bid Submission Start Date,Bid Submission End Date,Financial Bid Opening Date,EMD Amount in ₹,EMD Exemption Allowed,EMD Fee Type,EMD Percentage,EMD Payable To,EMD Payable At,S.No,Bank Name,Tender Fee in ₹,Fee Payable To,Fee Payable At,Tender Fee Exemption Allowed,Name,Address,Title,Work Description,Pre Qualification Details,Independent External Monitor/Remarks,Tender Value in ₹,Product Category,Sub category,Contract Type,Bid Validity(Days),Period Of Work(Days),Location,Pincode,Pre Bid Meeting Place,Pre Bid Meeting Address,Pre Bid Meeting Date,Bid Opening Place,Should Allow NDA Tender,Allow Preferential Bidder,Tender Stage,Contract Date :,Contract Value :,Work Completion Period in days :,Updated By :,Updated on :,AOC document :,AOC Description :,S.No,Bid Number,Bidder Name,Awarded Currency,Awarded Value,S.No.1,Bid Number.1,Bidder Name.1,Submitted Date,Status,Remarks,Status Updated On,Type :,Summary :,Updated By :.1,Updated On :,Document :,BOQ Comparative Chart :,Committee Chairperson/Co-ordinator Name :,Committee Chairperson/Co-ordinator Type :,Committee Members :,Updated By :.2,Updated on :.1,Document :.1,Organisation Chain :,Tender ID :,Tender Ref No :,Tender Title :,Type :.1,Summary :.1,Updated By :.3,Updated On :.1,Document :.2,Committee Chairperson/Co-ordinator Name :.1,Committee Chairperson/Co-ordinator Type :.1,Committee Members :.1,Updated By :.4,Updated On :.2,Financial Bid Opening Date:,Document :.3,Tender Stage
National Health Mission||State Programme Management Unit - NHM,NHM-32034/17/2023ConstNHM/378,2023_NHM_32609_10,Yes,Open Tender,Turn-key,Works,2.0,No,No,Online,No,No,No,1.0,Fee/PreQual/Technical,.pdf,Technical qualification,21-Sep-2023 02:00 PM,04-Oct-2023 03:30 PM,21-Sep-2023 02:00 PM,03-Oct-2023 02:00 PM,NA ,NA ,21-Sep-2023 02:00 PM,03-Oct-2023 02:00 PM,14-Dec-2023 09:00 AM,"1,04,060",Yes,percentage,2.0%,Nil,Nil,1.0,SBI Bank,"1,500",Nil,Nil,No,"MD,NHM","Office of MD,NHM Christian Basti, Ghy-05","Construction of Buildingless Sub-Health Centres at various places of Assam under PM-ABHIM for FY 2022-23 48 nos. of Buildingless Sub-health Centres under NHM Assam on TURN KEY BASIS , At Borthol SC in West Karbi Anglong District","Construction of Buildingless Sub-Health Centres at various places of Assam under PM-ABHIM for FY 2022-23 48 nos. of Buildingless Sub-health Centres under NHM Assam on TURN KEY BASIS , At Borthol SC in West Karbi Anglong District",Please refer Tender documents. ,NA ,"52,03,000",Civil Works - Building,NA ,Tender,180.0,180.0,Borthol SC in West Karbi Anglong District,782462.0,NA ,NA ,NA ,"Office of MD,NHM",No ,No,AOC,17-Jul-2024,"INR 5,098,940",180.0,Himangshu Kalita,17-Jul-2024 05:40 PM,WOBORTHOL.pdf (196.00 KB),AOC,1.0,202713.0,LIZA KALITA,INR,"5,098,940",1,202656,A.B COMMERCIALS,02-Oct-2023 05:19 PM,Rejected-Finance,L3 rate is not accepted,17-Jul-2024 04:43 PM,Finance,Financial bid is opened,Himangshu Kalita,17-Jul-2024 04:20 PM,,BOQ Comparative Chart,OSD,Internal,,Himangshu Kalita,17-Jul-2024 04:43 PM,finsummary_52301.pdf (195.92 KB),National Health Mission||State Programme Management Unit - NHM,2023_NHM_32609_10,NHM-32034/17/2023ConstNHM/378,"Construction of Buildingless Sub-Health Centres at various places of Assam under PM-ABHIM for FY 2022-23 48 nos. of Buildingless Sub-health Centres under NHM Assam on TURN KEY BASIS , At Borthol SC in West Karbi Anglong District",Technical,Technical bid is opened.,Mousomi Goswami,28-Nov-2023 01:20 PM,,ED,Internal,,Himangshu Kalita,14-Dec-2023 12:33 AM,14-Dec-2023 09:00 AM,techsummary_52301.pdf (420.54 KB),AOC
,,,,,,,,,,,,,,,,.pdf,SBD,,,,,,,,,,,,,,,,,,,,,,,,,,,,,,,,,,,,,,,,,,AOC,,,,,,,,,,,,,2,202710,JOY SING RONGHANG,03-Oct-2023 03:38 AM,Not Admitted-Fee/PreQual/Technical,Not Complied with technical specification,28-Nov-2023 01:20 PM,,,,,,,,,,,,,,,,,,,,,,,,,,,,,AOC
,,,,,,,,,,,,,,,,.pdf,Cost of tender and bid security,,,,,,,,,,,,,,,,,,,,,,,,,,,,,,,,,,,,,,,,,,AOC,,,,,,,,,,,,,3,202713,LIZA KALITA,03-Oct-2023 01:02 PM,Accepted-AOC,L1 bidder is awarded,17-Jul-2024 05:40 PM,,,,,,,,,,,,,,,,,,,,,,,,,,,,,AOC
,,,,,,,,,,,,,,2.0,Finance,.xls,BOQ,,,,,,,,,,,,,,,,,,,,,,,,,,,,,,,,,,,,,,,,,,AOC,,,,,,,,,,,,,4,202706,MOHEN SING TERON,03-Oct-2023 04:20 AM,Rejected-Finance,L3 rate is not accepted,17-Jul-2024 04:43 PM,,,,,,,,,,,,,,,,,,,,,,,,,,,,,AOC
,,,,,,,,,,,,,,,,.pdf,FOB,,,,,,,,,,,,,,,,,,,,,,,,,,,,,,,,,,,,,,,,,,AOC,,,,,,,,,,,,,5,202703,SRI ROBISON TERON,03-Oct-2023 03:56 AM,Rejected-Finance,L2 rate is not accepted,17-Jul-2024 04:43 PM,,,,,,,,,,,,,,,,,,,,,,,,,,,,,AOC
