Organisation Chain,Tender Reference Number,Tender ID,Withdrawal Allowed,Tender Type,Form of contract,Tender Category,No. of Covers,General Technical Evaluation Allowed,ItemWise Technical Evaluation Allowed,Payment Mode,Is Multi Currency Allowed For BOQ,Is Multi Currency Allowed For Fee,Allow Two Stage Bidding,Cover No,Cover,Document Type,Description,Publish Date,Bid Opening Date,Document Download / Sale Start Date,Document Download / Sale End Date,Clarification Start Date,Clarification End Date,Bid Submission Start Date,Bid Submission End Date,Financial Bid Opening Date,EMD Amount in ₹,EMD Exemption Allowed,EMD Fee Type,EMD Percentage,EMD Payable To,EMD Payable At,S.No,Bank Name,Tender Fee in ₹,Fee Payable To,Fee Payable At,Tender Fee Exemption Allowed,Name,Address,Title,Work Description,Pre Qualification Details,Independent External Monitor/Remarks,Tender Value in ₹,Product Category,Sub category,Contract Type,Bid Validity(Days),Period Of Work(Days),Location,Pincode,Pre Bid Meeting Place,Pre Bid Meeting Address,Pre Bid Meeting Date,Bid Opening Place,Should Allow NDA Tender,Allow Preferential Bidder,Tender Stage,Contract Date :,Contract Value :,Work Completion Period in days :,Updated By :,Updated on :,AOC document :,AOC Description :,S.No,Bid Number,Bidder Name,Awarded Currency,Awarded Value,S.No.1,Bid Number.1,Bidder Name.1,Submitted Date,Status,Remarks,Status Updated On,Type :,Summary :,Updated By :.1,Updated On :,Document :,BOQ Comparative Chart :,Committee Chairperson/Co-ordinator Name :,Committee Chairperson/Co-ordinator Type :,Committee Members :,Updated By :.2,Updated on :.1,Document :.1,Organisation Chain :,Tender ID :,Tender Ref No :,Tender Title :,Type :.1,Summary :.1,Updated By :.3,Updated On :.1,Document :.2,Committee Chairperson/Co-ordinator Name :.1,Committee Chairperson/Co-ordinator Type :.1,Committee Members :.1,Updated By :.4,Updated On :.2,Financial Bid Opening Date:,Document :.3,Tender Stage
Department of Fisheries||Directorate of Fisheries Assam,AF(S)65/RIDF/2023-24/8450-53 Dtd. 13/03/2025,2025_FD_43487_1,Yes,Open Tender,Works,Works,2.0,No,No,Online,No,No,No,1.0,Fee/PreQual/Technical,.pdf,Technical documents as per bid document,17-Mar-2025 05:00 PM,08-Apr-2025 01:00 PM,17-Mar-2025 05:00 PM,07-Apr-2025 02:00 PM,NA ,NA ,21-Mar-2025 10:00 AM,07-Apr-2025 02:00 PM,30-May-2025 11:00 AM,"8,26,400",Yes,fixed,,Nil,Nil,1.0,SBI Bank,"8,300",Nil,Nil,No,"Director of Fisheries, Assam, Guwahati-16","Directorate of Fisheries, Meen Bhawan, Assam, Guwahati-16",Rejuvenation of Keotkuchi Departmental Fish Farm,23 Fishery Project Additional Infrastructure in Department Farm under RIDF XXVIII 2022 23 Rejuvenation of Keotkuchi Departmental Fish Farm,"Please, refer bid document ",NA ,"4,13,18,000",Civil Works,NA ,Tender,180.0,730.0,Assam,781016.0,NA ,NA ,NA ,"Directorate of Fisheries, Meen Bhawan, Assam, Guwa",No ,No,AOC,08-Sep-2025,"INR 41,318,000",730.0,Bobita Rani Medhi,08-Sep-2025 03:46 PM,keotkuchi.pdf (956.00 KB),Award of Contract,1.0,265078.0,Sri Bimal Jyoti Mahanta,INR,"36,152,844.73",1,265251,MANIK PAUL,06-Apr-2025 10:16 PM,Rejected-Technical,bid doc not signed and letter of bid not submitted,29-May-2025 10:50 AM,Finance,Bids under Evaluation,Sangita Bhattacharyya,30-May-2025 05:02 PM,,BOQ Comparative Chart,"Jt secretary to the Govt of Assam,Fishery Department",Internal,Members details mentioned in Mintues,Sangita Bhattacharyya,01-Aug-2025 04:00 PM,finsummary_69368.pdf (757.25 KB),Department of Fisheries||Directorate of Fisheries Assam,2025_FD_43487_1,AF(S)65/RIDF/2023-24/8450-53 Dtd. 13/03/2025,Rejuvenation of Keotkuchi Departmental Fish Farm,Technical,Bid Under Evaluation.,jugal Thakuria,09-Apr-2025 11:09 AM,,"Jt Secy to Govt of Assam, Fishery Deptt",Internal,As mentioned in the Meeting Minutes,jugal Thakuria,29-May-2025 10:50 AM,30-May-2025 11:00 AM,techsummary_69368.pdf (1194.98 KB),AOC
,,,,,,,,,,,,,,2.0,Finance,.xls,Price bid,,,,,,,,,,,,,,,,,,,,,,,,,,,,,,,,,,,,,,,,,,AOC,,,,,,,,,,,,,2,265288,M/S SUNRISE ENTERPRISE,07-Apr-2025 01:28 PM,Rejected-Technical,Original power of Attorney not submitted,29-May-2025 10:50 AM,,,,,,,,,,,,,,,,,,,,,,,,,,,,,AOC
,,,,,,,,,,,,,,,,,,,,,,,,,,,,,,,,,,,,,,,,,,,,,,,,,,,,,,,,,,,AOC,,,,,,,,,,,,,3,265078,Sri Bimal Jyoti Mahanta,07-Apr-2025 10:53 AM,Accepted-AOC,Most responsive bidder,08-Sep-2025 03:46 PM,,,,,,,,,,,,,,,,,,,,,,,,,,,,,AOC
,,,,,,,,,,,,,,,,,,,,,,,,,,,,,,,,,,,,,,,,,,,,,,,,,,,,,,,,,,,AOC,,,,,,,,,,,,,4,265210,UTPAL JYOTI KALITA,07-Apr-2025 01:52 PM,Rejected-Finance,L2 Bidder,01-Aug-2025 04:00 PM,,,,,,,,,,,,,,,,,,,,,,,,,,,,,AOC
,,,,,,,,,,,,,,,,,,,,,,,,,,,,,,,,,,,,,,,,,,,,,,,,,,,,,,,,,,,AOC,,,,,,,,,,,,,5,265146,YSM Construction & Co.,07-Apr-2025 12:32 PM,Rejected-Finance,L3 Bidder,01-Aug-2025 04:00 PM,,,,,,,,,,,,,,,,,,,,,,,,,,,,,AOC
