Organisation Chain,Tender Reference Number,Tender ID,Withdrawal Allowed,Tender Type,Form of contract,Tender Category,No. of Covers,General Technical Evaluation Allowed,ItemWise Technical Evaluation Allowed,Payment Mode,Is Multi Currency Allowed For BOQ,Is Multi Currency Allowed For Fee,Allow Two Stage Bidding,Cover No,Cover,Document Type,Description,Publish Date,Bid Opening Date,Document Download / Sale Start Date,Document Download / Sale End Date,Clarification Start Date,Clarification End Date,Bid Submission Start Date,Bid Submission End Date,Financial Bid Opening Date,EMD Amount in ₹,EMD Exemption Allowed,EMD Fee Type,EMD Percentage,EMD Payable To,EMD Payable At,S.No,Bank Name,Tender Fee in ₹,Fee Payable To,Fee Payable At,Tender Fee Exemption Allowed,Name,Address,Title,Work Description,Pre Qualification Details,Independent External Monitor/Remarks,Tender Value in ₹,Product Category,Sub category,Contract Type,Bid Validity(Days),Period Of Work(Days),Location,Pincode,Pre Bid Meeting Place,Pre Bid Meeting Address,Pre Bid Meeting Date,Bid Opening Place,Should Allow NDA Tender,Allow Preferential Bidder,Tender Stage,Contract Date :,Contract Value :,Work Completion Period in days :,Updated By :,Updated on :,AOC document :,AOC Description :,S.No,Bid Number,Bidder Name,Awarded Currency,Awarded Value,S.No.1,Bid Number.1,Bidder Name.1,Submitted Date,Status,Remarks,Status Updated On,Type :,Summary :,Updated By :.1,Updated On :,Document :,BOQ Comparative Chart :,Committee Chairperson/Co-ordinator Name :,Committee Chairperson/Co-ordinator Type :,Committee Members :,Updated By :.2,Updated on :.1,Document :.1,Organisation Chain :,Tender ID :,Tender Ref No :,Tender Title :,Type :.1,Summary :.1,Updated By :.3,Updated On :.1,Document :.2,Committee Chairperson/Co-ordinator Name :.1,Committee Chairperson/Co-ordinator Type :.1,Committee Members :.1,Updated By :.4,Updated On :.2,Financial Bid Opening Date:,Document :.3,Tender Stage
Irrigation Department||Chief Engineer(Major)-Irrigation Dept||Cachar Karimganj Circle,BVCI/IRRI/TB/04/2024/186 DATED 27/08/2025,2025_ID_47051_1,Yes,Open Tender,Item Rate,Works,2.0,No,No,Online,No,No,No,1.0,Fee/PreQual/Technical,.pdf,TENDER FEE AND BID SECURITY,28-Aug-2025 01:00 PM,18-Sep-2025 01:00 PM,28-Aug-2025 06:00 PM,17-Sep-2025 02:00 PM,NA ,NA ,28-Aug-2025 06:00 PM,17-Sep-2025 02:00 PM,20-Sep-2025 02:45 PM,"43,388",Yes,percentage,2.0%,Nil,Nil,1.0,SBI Bank,500.0,Nil,Nil,No,Superintending Engineer,O/O SE BVCI Silchar,Fabrication and Supply of Solar Powered Cart Mounted Multifunctional Irrigation Scheme 2HP with two nos of manual boring in Sonai LAC under SOPD G for the year 2025-26,Fabrication and Supply of Solar Powered Cart Mounted Multifunctional Irrigation Scheme 2HP with two nos of manual boring in Sonai LAC under SOPD G for the year 2025-26,please refer Tender document ,NA ,"21,69,394",Composite Works,NA ,Tender,180.0,NA ,sonai,788119.0,NA ,NA ,NA ,O/O SE BVCI Silchar,No ,No,AOC,24-Sep-2025,"INR 2,169,394",120.0,Sanjeev Kumar Patoa,24-Sep-2025 07:27 PM,work.pdf (586.00 KB),Technical and financial criteria fulfilled,1.0,281621.0,HIND CONSTRUCTION,INR,"2,169,394",1.0,281621.0,HIND CONSTRUCTION,17-Sep-2025 12:46 PM,Accepted-AOC,All Criteria Fulfilled,24-Sep-2025 07:27 PM,Finance,Admitted,Rajdeep Goon,20-Sep-2025 02:59 PM,finance_75015.pdf,BOQ Comparative Chart,EE TC,Internal,AE JE AO,Sanjeev Kumar Patoa,24-Sep-2025 07:17 PM,finsummary_75015.pdf (437.31 KB),Irrigation Department||Chief Engineer(Major)-Irrigation Dept||Cachar Karimganj Circle,2025_ID_47051_1,BVCI/IRRI/TB/04/2024/186 DATED 27/08/2025,Fabrication and Supply of Solar Powered Cart Mounted Multifunctional Irrigation Scheme 2HP with two nos of manual boring in Sonai LAC under SOPD G for the year 2025-26,Technical,Admitted,Sanjeev Kumar Patoa,18-Sep-2025 02:43 PM,technical_75015.pdf,EE TC,Internal,JE AO,Sanjeev Kumar Patoa,20-Sep-2025 02:39 PM,20-Sep-2025 02:45 PM,techsummary_75015.pdf (699.15 KB),AOC
,,,,,,,,,,,,,,,,.pdf,QUALIFYING DOCUMENT,,,,,,,,,,,,,,,,,,,,,,,,,,,,,,,,,,,,,,,,,,AOC,,,,,,,,,,,,,2.0,281423.0,RAMABATI SINHA,15-Sep-2025 02:44 PM,Rejected-AOC,All criteria not fulfilled,24-Sep-2025 07:27 PM,,,,,,,,,,,,,,,,,,,,,,,,,,,,,AOC
,,,,,,,,,,,,,,,,.pdf,SBD,,,,,,,,,,,,,,,,,,,,,,,,,,,,,,,,,,,,,,,,,,AOC,,,,,,,,,,,,,3.0,281636.0,S H CONSTRUCT SOLUTIONS,17-Sep-2025 01:21 PM,Rejected-AOC,All Criteria not fulfilled,24-Sep-2025 07:27 PM,,,,,,,,,,,,,,,,,,,,,,,,,,,,,AOC
,,,,,,,,,,,,,,2.0,Finance,.xls,BOQ,,,,,,,,,,,,,,,,,,,,,,,,,,,,,,,,,,,,,,,,,,AOC,,,,,,,,,,,,,,,,,,,,,,,,,,,,,,,,,,,,,,,,,,,,,,,,AOC
,,,,,,,,,,,,,,,,.pdf,FOB,,,,,,,,,,,,,,,,,,,,,,,,,,,,,,,,,,,,,,,,,,AOC,,,,,,,,,,,,,,,,,,,,,,,,,,,,,,,,,,,,,,,,,,,,,,,,AOC
