Organisation Chain,Tender Reference Number,Tender ID,Withdrawal Allowed,Tender Type,Form of contract,Tender Category,No. of Covers,General Technical Evaluation Allowed,ItemWise Technical Evaluation Allowed,Payment Mode,Is Multi Currency Allowed For BOQ,Is Multi Currency Allowed For Fee,Allow Two Stage Bidding,Cover No,Cover,Document Type,Description,Publish Date,Bid Opening Date,Document Download / Sale Start Date,Document Download / Sale End Date,Clarification Start Date,Clarification End Date,Bid Submission Start Date,Bid Submission End Date,Financial Bid Opening Date,EMD Amount in ₹,EMD Exemption Allowed,EMD Fee Type,EMD Percentage,EMD Payable To,EMD Payable At,S.No,Bank Name,Tender Fee in ₹,Fee Payable To,Fee Payable At,Tender Fee Exemption Allowed,Name,Address,Title,Work Description,Pre Qualification Details,Independent External Monitor/Remarks,Tender Value in ₹,Product Category,Sub category,Contract Type,Bid Validity(Days),Period Of Work(Days),Location,Pincode,Pre Bid Meeting Place,Pre Bid Meeting Address,Pre Bid Meeting Date,Bid Opening Place,Should Allow NDA Tender,Allow Preferential Bidder,Tender Stage,Contract Date :,Contract Value :,Work Completion Period in days :,Updated By :,Updated on :,AOC document :,S.No,Bid Number,Bidder Name,Awarded Currency,Awarded Value,S.No.1,Bid Number.1,Bidder Name.1,Submitted Date,Status,Remarks,Status Updated On,Type :,Summary :,Updated By :.1,Updated On :,Document :,BOQ Comparative Chart :,Committee Chairperson/Co-ordinator Name :,Committee Chairperson/Co-ordinator Type :,Committee Members :,Updated By :.2,Updated on :.1,Document :.1,Organisation Chain :,Tender ID :,Tender Ref No :,Tender Title :,Type :.1,Summary :.1,Updated By :.3,Updated On :.1,Document :.2,Committee Chairperson/Co-ordinator Name :.1,Committee Chairperson/Co-ordinator Type :.1,Committee Members :.1,Updated By :.4,Updated On :.2,Financial Bid Opening Date:,Document :.3,Tender Stage
Gauhati University,T/25-26/42 Dated 19.05.2025,2025_GU_44431_1,Yes,Open Tender,Percentage,Works,2.0,No,No,Online,No,No,No,1.0,Fee/PreQual/Technical,.pdf,Tender Document,21-May-2025 05:00 PM,13-Jun-2025 03:30 PM,21-May-2025 05:00 PM,13-Jun-2025 02:00 PM,NA ,NA ,21-May-2025 05:00 PM,13-Jun-2025 02:00 PM,11-Jul-2025 03:30 PM,"68,233",Yes,fixed,,Nil,Nil,1.0,SBI Bank,700.0,Nil,Nil,No,Superintending Engineer GU,Office of the Superintending Engineer GU,Improvement of Road from Prof. Qtr. No-3 to old V.C. Bungalow at Gauhati University under RUSA 2.0,Improvement of Road from Prof. Qtr. No-3 to old V.C. Bungalow at Gauhati University under RUSA 2.0,Please refer Tender documents. ,NA ,"34,11,672",Composite Works,NA ,Tender,180.0,45.0,Gauhati University,781014.0,Office of the Superintending Engineer GU ,Office of the Superintending Engineer GU ,06-Jun-2025 12:00 PM ,Office of the Superintending Engineer GU,No ,No,AOC,10-Sep-2025,"INR 2,541,695",45.0,Sazidur Rahman,10-Sep-2025 10:03 AM,workorder.pdf (533.00 KB),1.0,269807.0,SUNIT BAISHYA,INR,"2,541,695",1,269775,Atowar Rahman,13-Jun-2025 12:09 PM,Rejected-Finance,Not being the lowest bidder,19-Aug-2025 12:14 PM,Finance,The financial evaluation of the submitted price bids will be carried out and summary of the financial evaluation will be uploaded later,Sazidur Rahman,11-Jul-2025 04:35 PM,finance_70744.pdf,BOQ Comparative Chart,Superintending Engineer GU,Internal,,Sazidur Rahman,19-Aug-2025 12:14 PM,finsummary_70744.pdf (379.74 KB),Gauhati University,2025_GU_44431_1,T/25-26/42 Dated 19.05.2025,Improvement of Road from Prof. Qtr. No-3 to old V.C. Bungalow at Gauhati University under RUSA 2.0,Technical,Technical Evaluation of the submitted bid will be carried out and summary of Technical Evaluation will be uploaded later,Sazidur Rahman,13-Jun-2025 05:51 PM,technical_70744.pdf,Superintending Engineer i/c GU,Internal,,Sazidur Rahman,11-Jul-2025 03:23 PM,11-Jul-2025 03:30 PM,techsummary_70744.pdf (481.52 KB),AOC
,,,,,,,,,,,,,,,,.pdf,Technical Qualification Document,,,,,,,,,,,,,,,,,,,,,,,,,,,,,,,,,,,,,,,,,,AOC,,,,,,,,,,,,2,269861,Harunur Rashid,13-Jun-2025 12:13 PM,Rejected-Finance,Not being the lowest bidder,19-Aug-2025 12:14 PM,,,,,,,,,,,,,,,,,,,,,,,,,,,,,AOC
,,,,,,,,,,,,,,,,.pdf,Anneuxres,,,,,,,,,,,,,,,,,,,,,,,,,,,,,,,,,,,,,,,,,,AOC,,,,,,,,,,,,3,269271,HITESH MAZUMDAR,12-Jun-2025 04:52 PM,Rejected-Finance,Not being the lowest bidder,19-Aug-2025 12:14 PM,,,,,,,,,,,,,,,,,,,,,,,,,,,,,AOC
,,,,,,,,,,,,,,2.0,Finance,.xls,BOQ,,,,,,,,,,,,,,,,,,,,,,,,,,,,,,,,,,,,,,,,,,AOC,,,,,,,,,,,,4,269844,RANA CONSTRUCTION AND ENGINEERS PVT LTD,12-Jun-2025 09:58 PM,Rejected-Technical,Technically disqualified,11-Jul-2025 03:23 PM,,,,,,,,,,,,,,,,,,,,,,,,,,,,,AOC
,,,,,,,,,,,,,,,,.pdf,Form of Bid,,,,,,,,,,,,,,,,,,,,,,,,,,,,,,,,,,,,,,,,,,AOC,,,,,,,,,,,,5,268936,SRI JAHIRUL HAQUE,12-Jun-2025 05:23 PM,Rejected-Finance,Not being the lowest bidder,19-Aug-2025 12:14 PM,,,,,,,,,,,,,,,,,,,,,,,,,,,,,AOC
,,,,,,,,,,,,,,,,,,,,,,,,,,,,,,,,,,,,,,,,,,,,,,,,,,,,,,,,,,,AOC,,,,,,,,,,,,6,269807,SUNIT BAISHYA,13-Jun-2025 12:11 PM,Accepted-AOC,Being the lowest bidder,10-Sep-2025 10:03 AM,,,,,,,,,,,,,,,,,,,,,,,,,,,,,AOC
,,,,,,,,,,,,,,,,,,,,,,,,,,,,,,,,,,,,,,,,,,,,,,,,,,,,,,,,,,,AOC,,,,,,,,,,,,7,269629,Tonmoy Das,11-Jun-2025 06:44 PM,Rejected-Technical,Technically disqualified,11-Jul-2025 03:23 PM,,,,,,,,,,,,,,,,,,,,,,,,,,,,,AOC
