Organisation Chain,Tender Reference Number,Tender ID,Withdrawal Allowed,Tender Type,Form of contract,Tender Category,No. of Covers,General Technical Evaluation Allowed,ItemWise Technical Evaluation Allowed,Payment Mode,Is Multi Currency Allowed For BOQ,Is Multi Currency Allowed For Fee,Allow Two Stage Bidding,Cover No,Cover,Document Type,Description,Publish Date,Bid Opening Date,Document Download / Sale Start Date,Document Download / Sale End Date,Clarification Start Date,Clarification End Date,Bid Submission Start Date,Bid Submission End Date,Financial Bid Opening Date,EMD Amount in ₹,EMD Exemption Allowed,EMD Fee Type,EMD Percentage,EMD Payable To,EMD Payable At,S.No,Corrigendum Title,Corrigendum Type,View,S.No.1,Bank Name,Tender Fee in ₹,Fee Payable To,Fee Payable At,Tender Fee Exemption Allowed,Name,Address,Title,Work Description,Pre Qualification Details,Independent External Monitor/Remarks,Tender Value in ₹,Product Category,Sub category,Contract Type,Bid Validity(Days),Period Of Work(Days),Location,Pincode,Pre Bid Meeting Place,Pre Bid Meeting Address,Pre Bid Meeting Date,Bid Opening Place,Should Allow NDA Tender,Allow Preferential Bidder,Tender Stage,Contract Date :,Contract Value :,Work Completion Period in days :,Updated By :,Updated on :,AOC document :,S.No,Bid Number,Bidder Name,Awarded Currency,Awarded Value,S.No.1,Bid Number.1,Bidder Name.1,Submitted Date,Status,Remarks,Status Updated On,Type :,Summary :,Updated By :.1,Updated On :,Document :,BOQ Comparative Chart :,Committee Chairperson/Co-ordinator Name :,Committee Chairperson/Co-ordinator Type :,Committee Members :,Updated By :.2,Updated on :.1,Document :.1,Organisation Chain :,Tender ID :,Tender Ref No :,Tender Title :,Type :.1,Summary :.1,Updated By :.3,Updated On :.1,Document :.2,Committee Chairperson/Co-ordinator Name :.1,Committee Chairperson/Co-ordinator Type :.1,Committee Members :.1,Updated By :.4,Updated On :.2,Financial Bid Opening Date:,Document :.3,Tender Stage
Public Works Building and NH Department||Chief Engineer-Building - PWBNH,CE/TB-IV/32/2024/14 Dated Guwahati the 28/03/2025,2025_PWBNH_44081_1,Yes,Open Tender,Item Rate,Works,2.0,No,No,Online,No,No,No,1.0,Fee/PreQual/Technical,.pdf,BID COST_BID SECURITY,12-Apr-2025 09:00 AM,19-May-2025 02:00 PM,12-Apr-2025 09:00 AM,17-May-2025 02:00 PM,NA ,NA ,23-Apr-2025 02:00 PM,17-May-2025 02:00 PM,25-Jun-2025 04:05 PM,"40,88,164",Yes,percentage,2.0%,Nil,Nil,1.0,Extension Notice,Date,,1.0,SBI Bank,"20,000",Nil,Nil,No,"CE, PWD(Bldg), H And E, Assam, Chandmari, Ghy-3","O/O The CE PWD(Bldg), Assam, Chandmari, Ghy-3","Construction Of 50 bedded Critical Care (CCB) (G Plus 2) at Goalpara Civil Hospital in Goalpara District, Assam Under PM-ABHIM","Construction Of 50 bedded Critical Care (CCB) (G Plus 2) at Goalpara Civil Hospital in Goalpara District, Assam Under PM-ABHIM",Please refer Tender documents. ,NA ,"20,44,08,200",Civil Works - Building,NA ,Tender,180.0,545.0,Goalpara,783101.0,"O/O The CE PWD(Bldg), Assam, Chandmari, Ghy-3 ","O/O The CE PWD(Bldg), Assam, Chandmari, Ghy-3 ",22-Apr-2025 11:30 AM ,"O/O The CE PWD(Bldg), Assam, Chandmari, Ghy-3",No ,No,AOC,06-Sep-2025,"INR 183,766,360",545.0,Chandana Basumatary,06-Sep-2025 05:12 PM,WOCCBGOALPARA.pdf (678.00 KB),1.0,267961.0,Harunur Rashid,INR,"183,766,360",1,268137,golden traders,17-May-2025 01:33 PM,Rejected-Technical,Non-Responsive,25-Jun-2025 03:59 PM,Finance,Summary,Chandana Basumatary,25-Jun-2025 04:14 PM,finance_70306.pdf,BOQ Comparative Chart,CE PWD(Bldg),Internal,,Chandana Basumatary,06-Sep-2025 05:09 PM,finsummary_70306.pdf (678.17 KB),Public Works Building and NH Department||Chief Engineer-Building - PWBNH,2025_PWBNH_44081_1,CE/TB-IV/32/2024/14 Dated Guwahati the 28/03/2025,"Construction Of 50 bedded Critical Care (CCB) (G Plus 2) at Goalpara Civil Hospital in Goalpara District, Assam Under PM-ABHIM",Technical,Summary,ABIDUR RAHMAN,19-May-2025 03:02 PM,technical_70306.pdf,CE PWD(Bldg),Internal,,ABIDUR RAHMAN,25-Jun-2025 03:59 PM,25-Jun-2025 04:05 PM,techsummary_70306.pdf (630.28 KB),AOC
,,,,,,,,,,,,,,,,.pdf,BIDDING DOCUMENT,,,,,,,,,,,,,,,,2.0,Corrigendum,Technical Bid,,,,,,,,,,,,,,,,,,,,,,,,,,,,AOC,,,,,,,,,,,,2,267961,Harunur Rashid,17-May-2025 12:19 PM,Accepted-AOC,Work Order Issued,06-Sep-2025 05:12 PM,,,,,,,,,,,,,,,,,,,,,,,,,,,,,AOC
,,,,,,,,,,,,,,,,.pdf,TECHNICAL QUALIFICATIONS,,,,,,,,,,,,,,,,,,,,,,,,,,,,,,,,,,,,,,,,,,,,,,AOC,,,,,,,,,,,,3,268090,J C Infra corporation Limited,17-May-2025 01:44 PM,Rejected-AOC,L2,06-Sep-2025 05:12 PM,,,,,,,,,,,,,,,,,,,,,,,,,,,,,AOC
,,,,,,,,,,,,,,2.0,Finance,.xls,BOQ,,,,,,,,,,,,,,,,,,,,,,,,,,,,,,,,,,,,,,,,,,,,,,AOC,,,,,,,,,,,,4,268028,MID INDIA CIVIL ERECTORS PRIVATE LIMITED,17-May-2025 01:19 PM,Rejected-Technical,Non-Responsive,25-Jun-2025 03:59 PM,,,,,,,,,,,,,,,,,,,,,,,,,,,,,AOC
,,,,,,,,,,,,,,,,.pdf,FINANCIAL PROPOSAL,,,,,,,,,,,,,,,,,,,,,,,,,,,,,,,,,,,,,,,,,,,,,,AOC,,,,,,,,,,,,5,268154,M/s M.P. Khaitan,13-May-2025 10:13 AM,Rejected-AOC,L4,06-Sep-2025 05:12 PM,,,,,,,,,,,,,,,,,,,,,,,,,,,,,AOC
,,,,,,,,,,,,,,,,,,,,,,,,,,,,,,,,,,,,,,,,,,,,,,,,,,,,,,,,,,,,,,,AOC,,,,,,,,,,,,6,268072,VERSHA TECHNOTRADE PVT LTD,13-May-2025 10:28 AM,Rejected-AOC,L3,06-Sep-2025 05:12 PM,,,,,,,,,,,,,,,,,,,,,,,,,,,,,AOC
