Organisation Chain,Tender Reference Number,Tender ID,Withdrawal Allowed,Tender Type,Form of contract,Tender Category,No. of Covers,General Technical Evaluation Allowed,ItemWise Technical Evaluation Allowed,Payment Mode,Is Multi Currency Allowed For BOQ,Is Multi Currency Allowed For Fee,Allow Two Stage Bidding,Cover No,Cover,Document Type,Description,Publish Date,Bid Opening Date,Document Download / Sale Start Date,Document Download / Sale End Date,Clarification Start Date,Clarification End Date,Bid Submission Start Date,Bid Submission End Date,EMD Amount in ₹,EMD Exemption Allowed,EMD Fee Type,EMD Percentage,EMD Payable To,EMD Payable At,S.No,Corrigendum Title,Corrigendum Type,View,S.No.1,Bank Name,Tender Fee in ₹,Fee Payable To,Fee Payable At,Tender Fee Exemption Allowed,Name,Address,Title,Work Description,Pre Qualification Details,Independent External Monitor/Remarks,Tender Value in ₹,Product Category,Sub category,Contract Type,Bid Validity(Days),Period Of Work(Days),Location,Pincode,Pre Bid Meeting Place,Pre Bid Meeting Address,Pre Bid Meeting Date,Bid Opening Place,Should Allow NDA Tender,Allow Preferential Bidder,Organisation Chain,Tender Reference Number,Tender ID,Withdrawal Allowed,Tender Type,Form of contract,Tender Category,No. of Covers,General Technical Evaluation Allowed,ItemWise Technical Evaluation Allowed,Payment Mode,Is Multi Currency Allowed For BOQ,Is Multi Currency Allowed For Fee,Allow Two Stage Bidding,Cover No,Cover,Document Type,Description,Publish Date,Bid Opening Date,Document Download / Sale Start Date,Document Download / Sale End Date,Clarification Start Date,Clarification End Date,Bid Submission Start Date,Bid Submission End Date,EMD Amount in ₹,EMD Exemption Allowed,EMD Fee Type,EMD Percentage,EMD Payable To,EMD Payable At,S.No,Corrigendum Title,Corrigendum Type,View,S.No.1,Bank Name,Tender Fee in ₹,Fee Payable To,Fee Payable At,Tender Fee Exemption Allowed,Name,Address,Title,Work Description,Pre Qualification Details,Independent External Monitor/Remarks,Tender Value in ₹,Product Category,Sub category,Contract Type,Bid Validity(Days),Period Of Work(Days),Location,Pincode,Pre Bid Meeting Place,Pre Bid Meeting Address,Pre Bid Meeting Date,Bid Opening Place,Should Allow NDA Tender,Allow Preferential Bidder,Contract Date :,Contract Value :,Work Completion Period in days :,Updated By :,Updated on :,AOC document :,AOC Description :,S.No.2,Bid Number,Bidder Name,Awarded Currency,Awarded Value,S.No.3,Bid Number.1,Bidder Name.1,Submitted Date,Status,Remarks,Status Updated On,Type :,Summary :,Updated By :.1,Updated On :,Document :,BOQ Comparative Chart :,Committee Chairperson/Co-ordinator Name :,Committee Chairperson/Co-ordinator Type :,Committee Members :,Updated By :.2,Updated on :.1,Document :.1,S.No.4,Bid Number.2,Bidder Name.2,Value,Rank,Committee Chairperson/Co-ordinator Name :.1,Committee Chairperson/Co-ordinator Type :.1,Committee Members :.1,Updated By :.3,Updated On :.1,Document :.2,Tender ID :,Tender Ref No :,Tender Title :
Department of Water Resources-Externally Aided Project||WRD-ADB Funded Procurements,WRD/ADB/Quotations- Goods/01,2024_WREAP_38016_1,Yes,Open Tender,Supply,Goods,1.0,No,No,Online,No,No,No,1.0,Fee/PreQual/Technical/Finance,.pdf,QUOTATION DOCUMENTS,15-Jul-2024 03:00 PM,29-Jul-2024 04:15 PM,15-Jul-2024 03:00 PM,29-Jul-2024 04:00 PM,15-Jul-2024 03:00 PM ,20-Jul-2024 05:00 PM ,21-Jul-2024 12:00 PM,29-Jul-2024 04:00 PM,"4,00,000",Yes,fixed,,Nil,Nil,1.0,ADDENDUM II,Date,,1.0,SBI Bank,0.0,Nil,Nil,No,Chief Engineer Water Resources Department,"O/O Chief Engineer Water Resources Department, Basistha, Guwahati 29",Supply of Type B Geobags along with Type C and Type A Polyester Bags as Reserved Stocks to be used for Emergency Works (Dibrugarh and Tinsukia) Package No. G-11,Supply of Type B Geobags along with Type C and Type A Polyester Bags as Reserved Stocks to be used for Emergency Works (Dibrugarh and Tinsukia) Package No. G-11,Please refer Tender documents. ,NA ,,Supply of Materials,NA ,Tender,30.0,90.0,DIBRUGARH,786001.0,NA ,NA ,NA ,Guwahati,No ,No,Department of Water Resources-Externally Aided Project||WRD-ADB Funded Procurements,WRD/ADB/Quotations- Goods/01,2024_WREAP_38016_1,Yes,Open Tender,Supply,Goods,1.0,No,No,Online,No,No,No,1.0,Fee/PreQual/Technical/Finance,.pdf,QUOTATION DOCUMENTS,15-Jul-2024 03:00 PM,29-Jul-2024 04:15 PM,15-Jul-2024 03:00 PM,29-Jul-2024 04:00 PM,15-Jul-2024 03:00 PM ,20-Jul-2024 05:00 PM ,21-Jul-2024 12:00 PM,29-Jul-2024 04:00 PM,"4,00,000",Yes,fixed,,Nil,Nil,1.0,ADDENDUM II,Date,,1.0,SBI Bank,0.0,Nil,Nil,No,Chief Engineer Water Resources Department,"O/O Chief Engineer Water Resources Department, Basistha, Guwahati 29",Supply of Type B Geobags along with Type C and Type A Polyester Bags as Reserved Stocks to be used for Emergency Works (Dibrugarh and Tinsukia) Package No. G-11,Supply of Type B Geobags along with Type C and Type A Polyester Bags as Reserved Stocks to be used for Emergency Works (Dibrugarh and Tinsukia) Package No. G-11,Please refer Tender documents. ,NA ,,Supply of Materials,NA ,Tender,30.0,90.0,DIBRUGARH,786001.0,NA ,NA ,NA ,Guwahati,No ,No,16-Dec-2024,"INR 33,554,800",90.0,Jayanta Kumar Barman,16-Dec-2024 06:37 PM,final_result_dibrugarh.PDF (296.00 KB),Supply of Type B Geobags along with Type C and Type A Polyester Bags as Reserved Stocks to be used for Emergency Works (Dibrugarh and Tinsukia) Package No. G-11,1.0,235579.0,SUNTECH GEOTEXTILE PVT. LTD.,INR,"33,554,800",1.0,235653.0,HI TECH SPECIALITY FABRICS EXPORT PVT LTD,29-Jul-2024 03:19 PM,Rejected-Technical,Technical Bid not Evaluated,16-Dec-2024 04:41 PM,Finance,All Bids are opened.,Jayanta Kumar Barman,09-Aug-2024 02:09 PM,finance_61761.pdf,BOQ Comparative Chart,"Addl Chief Engineer, EAP",Internal,,Jayanta Kumar Barman,16-Dec-2024 06:29 PM,finsummary_61761.pdf (295.96 KB),1.0,235579.0,SUNTECH GEOTEXTILE PVT. LTD.,"3,35,54,800.00",L1,"Addl Chief Engineer, EAP",Internal,,Jayanta Kumar Barman,16-Dec-2024 04:41 PM,techsummary_61761.pdf (295.96 KB),,,
,,,,,,,,,,,,,,,,.xls,FINANCIAL QUOTATION,,,,,,,,,,,,,,,2.0,ADDENDUM I,Technical Bid,,,,,,,,,,,,,,,,,,,,,,,,,,,,,,,,,,,,,,,,,,,,.xls,FINANCIAL QUOTATION,,,,,,,,,,,,,,,2.0,ADDENDUM I,Technical Bid,,,,,,,,,,,,,,,,,,,,,,,,,,,,,,,,,,,,,,,,2.0,235578.0,SMILE NONWOVENS PVT. LTD.,26-Jul-2024 03:13 PM,Rejected-Technical,Technical Bid not Evaluated,16-Dec-2024 04:41 PM,,,,,,,,,,,,,,,,,,,,,,,,,,
,,,,,,,,,,,,,,,,,,,,,,,,,,,,,,,,,,,,,,,,,,,,,,,,,,,,,,,,,,,,,,,,,,,,,,,,,,,,,,,,,,,,,,,,,,,,,,,,,,,,,,,,,,,,,,,,,,,,,,,,,,,,,,,,,,,,,,,,3.0,235579.0,SUNTECH GEOTEXTILE PVT. LTD.,27-Jul-2024 04:39 PM,Accepted-AOC,AWARDED,16-Dec-2024 06:37 PM,,,,,,,,,,,,,,,,,,,,,,,,,,
,,,,,,,,,,,,,,,,,,,,,,,,,,,,,,,,,,,,,,,,,,,,,,,,,,,,,,,,,,,,,,,,,,,,,,,,,,,,,,,,,,,,,,,,,,,,,,,,,,,,,,,,,,,,,,,,,,,,,,,,,,,,,,,,,,,,,,,,4.0,235321.0,VIRENDERA TEXTILES,29-Jul-2024 11:58 AM,Rejected-Technical,Technical Bid not Evaluated,16-Dec-2024 04:41 PM,,,,,,,,,,,,,,,,,,,,,,,,,,
,,,,,,,,,,,,,,,,,,,,,,,,,,,,,,,,,,,,,,,,,,,,,,,,,,,,,,,,,,,,,,,,,,,,,,,,,,,,,,,,,,,,,,,,,,,,,,,,,,,,,,,,,,,,,,,,,,,,,,,,,,,,,,,,,,,,,,,,,,,,,,,,,,,,,,,,,,,,,,,,,,,,,,2024_WREAP_38016_1,WRD/ADB/Quotations- Goods/01,Supply of Type B Geobags along with Type C and Type A Polyester Bags as Reserved Stocks to be used for Emergency Works (Dibrugarh and Tinsukia) Package No. G-11
