Organisation Chain,Tender Reference Number,Tender ID,Withdrawal Allowed,Tender Type,Form of contract,Tender Category,No. of Covers,General Technical Evaluation Allowed,ItemWise Technical Evaluation Allowed,Payment Mode,Is Multi Currency Allowed For BOQ,Is Multi Currency Allowed For Fee,Allow Two Stage Bidding,Cover No,Cover,Document Type,Description,Publish Date,Bid Opening Date,Document Download / Sale Start Date,Document Download / Sale End Date,Clarification Start Date,Clarification End Date,Bid Submission Start Date,Bid Submission End Date,Financial Bid Opening Date,EMD Amount in ₹,EMD Exemption Allowed,EMD Fee Type,EMD Percentage,EMD Payable To,EMD Payable At,S.No,Corrigendum Title,Corrigendum Type,View,Tender Fee in ₹,Fee Payable To,Fee Payable At,Tender Fee Exemption Allowed,Name,Address,Title,Work Description,Pre Qualification Details,Independent External Monitor/Remarks,Tender Value in ₹,Product Category,Sub category,Contract Type,Bid Validity(Days),Period Of Work(Days),Location,Pincode,Pre Bid Meeting Place,Pre Bid Meeting Address,Pre Bid Meeting Date,Bid Opening Place,Should Allow NDA Tender,Allow Preferential Bidder,Organisation Chain,Tender Reference Number,Tender ID,Withdrawal Allowed,Tender Type,Form of contract,Tender Category,No. of Covers,General Technical Evaluation Allowed,ItemWise Technical Evaluation Allowed,Payment Mode,Is Multi Currency Allowed For BOQ,Is Multi Currency Allowed For Fee,Allow Two Stage Bidding,Cover No,Cover,Document Type,Description,Publish Date,Bid Opening Date,Document Download / Sale Start Date,Document Download / Sale End Date,Clarification Start Date,Clarification End Date,Bid Submission Start Date,Bid Submission End Date,Financial Bid Opening Date,EMD Amount in ₹,EMD Exemption Allowed,EMD Fee Type,EMD Percentage,EMD Payable To,EMD Payable At,S.No,Corrigendum Title,Corrigendum Type,View,Tender Fee in ₹,Fee Payable To,Fee Payable At,Tender Fee Exemption Allowed,Name,Address,Title,Work Description,Pre Qualification Details,Independent External Monitor/Remarks,Tender Value in ₹,Product Category,Sub category,Contract Type,Bid Validity(Days),Period Of Work(Days),Location,Pincode,Pre Bid Meeting Place,Pre Bid Meeting Address,Pre Bid Meeting Date,Bid Opening Place,Should Allow NDA Tender,Allow Preferential Bidder,Contract Date :,Contract Value :,Work Completion Period in days :,Updated By :,Updated on :,AOC document :,AOC Description :,S.No.1,Bid Number,Bidder Name,Awarded Currency,Awarded Value,S.No.2,Bid Number.1,Bidder Name.1,Submitted Date,Status,Remarks,Status Updated On,Type :,Summary :,Updated By :.1,Updated On :,Document :,BOQ Comparative Chart :,Committee Chairperson/Co-ordinator Name :,Committee Chairperson/Co-ordinator Type :,Committee Members :,Updated By :.2,Updated on :.1,Document :.1,S.No.3,Bid Number.2,Bidder Name.2,Value,Rank,Type :.1,Summary :.1,Updated By :.3,Updated On :.1,Document :.2,Committee Chairperson/Co-ordinator Name :.1,Committee Chairperson/Co-ordinator Type :.1,Committee Members :.1,Updated By :.4,Updated On :.2,Financial Bid Opening Date:,Document :.3,Tender ID :,Tender Ref No :,Tender Title :
Industries and Commerce Department||DNP Limited,MB/DNPL/2015/117/Pt.III/65,2024_ICD_40166_1,Yes,Open Tender,Works,Services,2.0,No,No,Not Applicable,No,No,No,1.0,Fee/PreQual/Technical,.pdf,NIT,02-Nov-2024 10:00 AM,15-Nov-2024 02:00 PM,02-Nov-2024 10:00 AM,14-Nov-2024 02:00 PM,02-Nov-2024 10:15 AM ,06-Nov-2024 02:00 PM ,02-Nov-2024 10:30 AM,14-Nov-2024 02:00 PM,21-Nov-2024 02:35 PM,0.0,No,fixed,,Nil,Nil,1.0,Corrigendum2,Date,,0.0,Nil,Nil,No,"Director and CEO, DNP Ltd","1 No Borpathar, Madhuban, Duliajan-786602",Group Mediclaim Policy for DNPL employees and their dependents,Group Mediclaim Policy for DNPL employees and their dependents,Please refer Tender documents. ,NA ,,Miscellaneous Services,NA ,Tender,90.0,365.0,Duliajan,786602.0,NA ,NA ,NA ,"DNP Ltd, Duliajan",No ,No,Industries and Commerce Department||DNP Limited,MB/DNPL/2015/117/Pt.III/65,2024_ICD_40166_1,Yes,Open Tender,Works,Services,2.0,No,No,Not Applicable,No,No,No,1.0,Fee/PreQual/Technical,.pdf,NIT,02-Nov-2024 10:00 AM,15-Nov-2024 02:00 PM,02-Nov-2024 10:00 AM,14-Nov-2024 02:00 PM,02-Nov-2024 10:15 AM ,06-Nov-2024 02:00 PM ,02-Nov-2024 10:30 AM,14-Nov-2024 02:00 PM,21-Nov-2024 02:35 PM,0.0,No,fixed,,Nil,Nil,1.0,Corrigendum2,Date,,0.0,Nil,Nil,No,"Director and CEO, DNP Ltd","1 No Borpathar, Madhuban, Duliajan-786602",Group Mediclaim Policy for DNPL employees and their dependents,Group Mediclaim Policy for DNPL employees and their dependents,Please refer Tender documents. ,NA ,,Miscellaneous Services,NA ,Tender,90.0,365.0,Duliajan,786602.0,NA ,NA ,NA ,"DNP Ltd, Duliajan",No ,No,12-Dec-2024,"INR 1,438,202",365.0,Bristi Bakul Barua,12-Dec-2024 03:15 PM,AOC.pdf (383.00 KB),Award of contract,1.0,248444.0,THE NEW INDIA ASSURANCE CO.LTD,INR,"1,438,202",1.0,248465.0,ICICI Lombard General Insurance Company Limited,12-Nov-2024 11:18 AM,Rejected-Finance,Disqualified as L2 bidder,12-Dec-2024 03:10 PM,Finance,Price Bid Summary,Bristi Bakul Barua,12-Dec-2024 03:03 PM,finance_65237.pdf,BOQ Comparative Chart,Kalpajit Das,Internal,"K. Das, G. Neog, B.B. Baruah D. Sarma",Bristi Bakul Barua,12-Dec-2024 03:10 PM,finsummary_65237.pdf (1837.53 KB),1.0,248444.0,THE NEW INDIA ASSURANCE CO.LTD,"14,38,202.00",L1,Technical,Technical summary,Bristi Bakul Barua,21-Nov-2024 02:28 PM,technical_65237.pdf,Kalpajit Das,Internal,"K.Das, M.K. Singha, G.Neog, B.B.Baruah, D. Sarma",Bristi Bakul Barua,21-Nov-2024 02:32 PM,21-Nov-2024 02:35 PM,techsummary_65237.pdf (1131.34 KB),,,
,,,,,,,,,,,,,,2.0,Finance,.xls,Price Bid,,,,,,,,,,,,,,,,2.0,Corrigendum1,Technical Bid,,,,,,,,,,,,,,,,,,,,,,,,,,,,,,,,,,,,,,,,2.0,Finance,.xls,Price Bid,,,,,,,,,,,,,,,,2.0,Corrigendum1,Technical Bid,,,,,,,,,,,,,,,,,,,,,,,,,,,,,,,,,,,,,,2.0,248585.0,IFFCO TOKIO GENERAL INSURANCE CO LTD,13-Nov-2024 01:27 PM,Rejected-Finance,Disqualified as L3 bidder,12-Dec-2024 03:10 PM,,,,,,,,,,,,,2.0,248465.0,ICICI Lombard General Insurance Company Limited,"23,91,403.00",L2,,,,,,,,,,,,,,,
,,,,,,,,,,,,,,,,,,,,,,,,,,,,,,,,,,,,,,,,,,,,,,,,,,,,,,,,,,,,,,,,,,,,,,,,,,,,,,,,,,,,,,,,,,,,,,,,,,,,,,,,,,,,,,,,,,,,,,,,,,,,,,,,,,,,,,3.0,248652.0,SBI GENERAL INSURANCE COMPANY LIMITED,14-Nov-2024 01:58 PM,Rejected-Finance,Disqualified as L4 bidder,12-Dec-2024 03:10 PM,,,,,,,,,,,,,3.0,248585.0,IFFCO TOKIO GENERAL INSURANCE CO LTD,"25,40,541.00",L3,,,,,,,,,,,,,,,
,,,,,,,,,,,,,,,,,,,,,,,,,,,,,,,,,,,,,,,,,,,,,,,,,,,,,,,,,,,,,,,,,,,,,,,,,,,,,,,,,,,,,,,,,,,,,,,,,,,,,,,,,,,,,,,,,,,,,,,,,,,,,,,,,,,,,,4.0,248444.0,THE NEW INDIA ASSURANCE CO.LTD,12-Nov-2024 11:17 AM,Accepted-AOC,Qualified as L1 Bidder,12-Dec-2024 03:15 PM,,,,,,,,,,,,,4.0,248652.0,SBI GENERAL INSURANCE COMPANY LIMITED,"26,81,094.00",L4,,,,,,,,,,,,,,,
,,,,,,,,,,,,,,,,,,,,,,,,,,,,,,,,,,,,,,,,,,,,,,,,,,,,,,,,,,,,,,,,,,,,,,,,,,,,,,,,,,,,,,,,,,,,,,,,,,,,,,,,,,,,,,,,,,,,,,,,,,,,,,,,,,,,,,,,,,,,,,,,,,,,,,,,,,,,,,,,,,,,,,,,,,2024_ICD_40166_1,MB/DNPL/2015/117/Pt.III/65,Group Mediclaim Policy for DNPL employees and their dependents
