Organisation Chain,Tender Reference Number,Tender ID,Withdrawal Allowed,Tender Type,Form of contract,Tender Category,No. of Covers,General Technical Evaluation Allowed,ItemWise Technical Evaluation Allowed,Payment Mode,Is Multi Currency Allowed For BOQ,Is Multi Currency Allowed For Fee,Allow Two Stage Bidding,Cover No,Cover,Document Type,Description,Publish Date,Bid Opening Date,Document Download / Sale Start Date,Document Download / Sale End Date,Clarification Start Date,Clarification End Date,Bid Submission Start Date,Bid Submission End Date,Financial Bid Opening Date,EMD Amount in ₹,EMD Exemption Allowed,EMD Fee Type,EMD Percentage,EMD Payable To,EMD Payable At,S.No,Bank Name,Tender Fee in ₹,Fee Payable To,Fee Payable At,Tender Fee Exemption Allowed,Name,Address,Title,Work Description,Pre Qualification Details,Independent External Monitor/Remarks,Tender Value in ₹,Product Category,Sub category,Contract Type,Bid Validity(Days),Period Of Work(Days),Location,Pincode,Pre Bid Meeting Place,Pre Bid Meeting Address,Pre Bid Meeting Date,Bid Opening Place,Should Allow NDA Tender,Allow Preferential Bidder,Organisation Chain,Tender Reference Number,Tender ID,Withdrawal Allowed,Tender Type,Form of contract,Tender Category,No. of Covers,General Technical Evaluation Allowed,ItemWise Technical Evaluation Allowed,Payment Mode,Is Multi Currency Allowed For BOQ,Is Multi Currency Allowed For Fee,Allow Two Stage Bidding,Cover No,Cover,Document Type,Description,Publish Date,Bid Opening Date,Document Download / Sale Start Date,Document Download / Sale End Date,Clarification Start Date,Clarification End Date,Bid Submission Start Date,Bid Submission End Date,Financial Bid Opening Date,EMD Amount in ₹,EMD Exemption Allowed,EMD Fee Type,EMD Percentage,EMD Payable To,EMD Payable At,S.No,Bank Name,Tender Fee in ₹,Fee Payable To,Fee Payable At,Tender Fee Exemption Allowed,Name,Address,Title,Work Description,Pre Qualification Details,Independent External Monitor/Remarks,Tender Value in ₹,Product Category,Sub category,Contract Type,Bid Validity(Days),Period Of Work(Days),Location,Pincode,Pre Bid Meeting Place,Pre Bid Meeting Address,Pre Bid Meeting Date,Bid Opening Place,Should Allow NDA Tender,Allow Preferential Bidder,Contract Date :,Contract Value :,Work Completion Period in days :,Updated By :,Updated on :,AOC document :,S.No.1,Bid Number,Bidder Name,Awarded Currency,Awarded Value,S.No.2,Bid Number.1,Bidder Name.1,Submitted Date,Status,Remarks,Status Updated On,Type :,Summary :,Updated By :.1,Updated On :,Document :,BOQ Comparative Chart :,Committee Chairperson/Co-ordinator Name :,Committee Chairperson/Co-ordinator Type :,Committee Members :,Updated By :.2,Updated on :.1,Document :.1,S.No.3,Bid Number.2,Bidder Name.2,Value,Rank,Type :.1,Summary :.1,Updated By :.3,Updated On :.1,Document :.2,Committee Chairperson/Co-ordinator Name :.1,Committee Chairperson/Co-ordinator Type :.1,Committee Members :.1,Updated By :.4,Updated On :.2,Financial Bid Opening Date:,Document :.3,Tender ID :,Tender Ref No :,Tender Title :
National Health Mission||State Programme Management Unit - NHM,NHM/ECF/139303,2024_NHM_38621_1,Yes,Open Tender,Turn-key,Works,2.0,No,No,Online,No,No,No,1.0,Fee/PreQual/Technical,.pdf,Technical Qualification,23-Aug-2024 09:00 AM,13-Sep-2024 03:30 PM,23-Aug-2024 09:00 AM,12-Sep-2024 02:00 PM,NA ,NA ,23-Aug-2024 12:00 PM,12-Sep-2024 02:00 PM,21-Oct-2024 09:00 AM,"8,09,540",Yes,percentage,2.0%,Nil,Nil,1.0,SBI Bank,"8,000",Nil,Nil,No,"Mission Director, NHM, Assam","Office of the Mission Director, NHM, Assam",Construction of Proposed Boys Hostel G2 at Diphu Medical College and Hospital Diphu Karbi Anglong under NHM Assam on Turn Key Basis,Construction of Proposed Boys Hostel G2 at Diphu Medical College and Hospital Diphu Karbi Anglong under NHM Assam on Turn Key Basis,Please refer Tender documents. ,NA ,"4,04,76,982",Civil Works - Building,NA ,Tender,180.0,730.0,Diphu,782460.0,NA ,NA ,NA ,"Office of the Mission Director, NHM, Assam",No ,No,National Health Mission||State Programme Management Unit - NHM,NHM/ECF/139303,2024_NHM_38621_1,Yes,Open Tender,Turn-key,Works,2.0,No,No,Online,No,No,No,1.0,Fee/PreQual/Technical,.pdf,Technical Qualification,23-Aug-2024 09:00 AM,13-Sep-2024 03:30 PM,23-Aug-2024 09:00 AM,12-Sep-2024 02:00 PM,NA ,NA ,23-Aug-2024 12:00 PM,12-Sep-2024 02:00 PM,21-Oct-2024 09:00 AM,"8,09,540",Yes,percentage,2.0%,Nil,Nil,1.0,SBI Bank,"8,000",Nil,Nil,No,"Mission Director, NHM, Assam","Office of the Mission Director, NHM, Assam",Construction of Proposed Boys Hostel G2 at Diphu Medical College and Hospital Diphu Karbi Anglong under NHM Assam on Turn Key Basis,Construction of Proposed Boys Hostel G2 at Diphu Medical College and Hospital Diphu Karbi Anglong under NHM Assam on Turn Key Basis,Please refer Tender documents. ,NA ,"4,04,76,982",Civil Works - Building,NA ,Tender,180.0,730.0,Diphu,782460.0,NA ,NA ,NA ,"Office of the Mission Director, NHM, Assam",No ,No,19-Dec-2024,"INR 34,931,635",730.0,Anupam Choudhury,19-Dec-2024 12:39 PM,WO_Boys_Hostel_DMCH.pdf (174.00 KB),1.0,238909.0,biswajit banik,INR,"34,931,635",1.0,238909.0,biswajit banik,10-Sep-2024 10:27 AM,Accepted-AOC,L 1,19-Dec-2024 12:40 PM,Finance,Financial Bid opened,Anupam Choudhury,21-Oct-2024 06:21 PM,finance_62474.pdf,BOQ Comparative Chart,OSD,Internal,,Anupam Choudhury,19-Dec-2024 12:35 PM,finsummary_62474.pdf (174.39 KB),1.0,238909.0,biswajit banik,"3,49,31,635.00",L 1,Technical,Technical Bid opened,Anupam Choudhury,24-Sep-2024 04:38 PM,None,OSD,Internal,,Anupam Choudhury,21-Oct-2024 01:04 AM,21-Oct-2024 09:00 AM,techsummary_62474.pdf (2500.18 KB),,,
,,,,,,,,,,,,,,,,.pdf,Standard Bid Document,,,,,,,,,,,,,,,,,,,,,,,,,,,,,,,,,,,,,,,,,,,,,,,,,,,,,,,,,,.pdf,Standard Bid Document,,,,,,,,,,,,,,,,,,,,,,,,,,,,,,,,,,,,,,,,,,,,,,,,,,,,,2.0,239164.0,GANESH TAMULI ENGINEERING PRIVATE LIMITED,12-Sep-2024 01:23 PM,Rejected-AOC,L 3,19-Dec-2024 12:40 PM,,,,,,,,,,,,,2.0,239033.0,MD. MUNNAF AHMED,"3,51,13,782.12",L 2,,,,,,,,,,,,,,,
,,,,,,,,,,,,,,2.0,Finance,.xls,BOQ,,,,,,,,,,,,,,,,,,,,,,,,,,,,,,,,,,,,,,,,,,,,,,,,,,,,,,,,2.0,Finance,.xls,BOQ,,,,,,,,,,,,,,,,,,,,,,,,,,,,,,,,,,,,,,,,,,,,,,,,,,,,,3.0,239033.0,MD. MUNNAF AHMED,12-Sep-2024 12:20 PM,Rejected-AOC,L 2,19-Dec-2024 12:40 PM,,,,,,,,,,,,,3.0,239109.0,RAKESH KUMAR SINGH,"3,78,45,970.00",4,,,,,,,,,,,,,,,
,,,,,,,,,,,,,,,,.pdf,FOB,,,,,,,,,,,,,,,,,,,,,,,,,,,,,,,,,,,,,,,,,,,,,,,,,,,,,,,,,,.pdf,FOB,,,,,,,,,,,,,,,,,,,,,,,,,,,,,,,,,,,,,,,,,,,,,,,,,,,,,4.0,239186.0,Rajen Chandra Das,12-Sep-2024 07:55 AM,Not Admitted-Finance,Others-The bidder is non responsive in Technical Bid.,21-Oct-2024 06:21 PM,,,,,,,,,,,,,4.0,239164.0,GANESH TAMULI ENGINEERING PRIVATE LIMITED,"3,54,17,300.00",L 3,,,,,,,,,,,,,,,
,,,,,,,,,,,,,,,,,,,,,,,,,,,,,,,,,,,,,,,,,,,,,,,,,,,,,,,,,,,,,,,,,,,,,,,,,,,,,,,,,,,,,,,,,,,,,,,,,,,,,,,,,,,,,,,,,,,,,,,,,,,,,,,,,5.0,239109.0,RAKESH KUMAR SINGH,11-Sep-2024 02:06 PM,Rejected-AOC,L 4,19-Dec-2024 12:40 PM,,,,,,,,,,,,,,,,,,,,,,,,,,,,,,,,
,,,,,,,,,,,,,,,,,,,,,,,,,,,,,,,,,,,,,,,,,,,,,,,,,,,,,,,,,,,,,,,,,,,,,,,,,,,,,,,,,,,,,,,,,,,,,,,,,,,,,,,,,,,,,,,,,,,,,,,,,,,,,,,,,,,,,,,,,,,,,,,,,,,,,,,,,,,,,,,,,,,,,2024_NHM_38621_1,NHM/ECF/139303,Construction of Proposed Boys Hostel G2 at Diphu Medical College and Hospital Diphu Karbi Anglong under NHM Assam on Turn Key Basis
