Organisation Chain,Tender Reference Number,Tender ID,Withdrawal Allowed,Tender Type,Form of contract,Tender Category,No. of Covers,General Technical Evaluation Allowed,ItemWise Technical Evaluation Allowed,Payment Mode,Is Multi Currency Allowed For BOQ,Is Multi Currency Allowed For Fee,Allow Two Stage Bidding,Cover No,Cover,Document Type,Description,Publish Date,Bid Opening Date,Document Download / Sale Start Date,Document Download / Sale End Date,Clarification Start Date,Clarification End Date,Bid Submission Start Date,Bid Submission End Date,Financial Bid Opening Date,EMD Amount in ₹,EMD Exemption Allowed,EMD Fee Type,EMD Percentage,EMD Payable To,EMD Payable At,S.No,Bank Name,Tender Fee in ₹,Fee Payable To,Fee Payable At,Tender Fee Exemption Allowed,Name,Address,Title,Work Description,Pre Qualification Details,Independent External Monitor/Remarks,Tender Value in ₹,Product Category,Sub category,Contract Type,Bid Validity(Days),Period Of Work(Days),Location,Pincode,Pre Bid Meeting Place,Pre Bid Meeting Address,Pre Bid Meeting Date,Bid Opening Place,Should Allow NDA Tender,Allow Preferential Bidder,Organisation Chain,Tender Reference Number,Tender ID,Withdrawal Allowed,Tender Type,Form of contract,Tender Category,No. of Covers,General Technical Evaluation Allowed,ItemWise Technical Evaluation Allowed,Payment Mode,Is Multi Currency Allowed For BOQ,Is Multi Currency Allowed For Fee,Allow Two Stage Bidding,Cover No,Cover,Document Type,Description,Publish Date,Bid Opening Date,Document Download / Sale Start Date,Document Download / Sale End Date,Clarification Start Date,Clarification End Date,Bid Submission Start Date,Bid Submission End Date,Financial Bid Opening Date,EMD Amount in ₹,EMD Exemption Allowed,EMD Fee Type,EMD Percentage,EMD Payable To,EMD Payable At,S.No,Bank Name,Tender Fee in ₹,Fee Payable To,Fee Payable At,Tender Fee Exemption Allowed,Name,Address,Title,Work Description,Pre Qualification Details,Independent External Monitor/Remarks,Tender Value in ₹,Product Category,Sub category,Contract Type,Bid Validity(Days),Period Of Work(Days),Location,Pincode,Pre Bid Meeting Place,Pre Bid Meeting Address,Pre Bid Meeting Date,Bid Opening Place,Should Allow NDA Tender,Allow Preferential Bidder,Contract Date :,Contract Value :,Work Completion Period in days :,Updated By :,Updated on :,AOC document :,AOC Description :,S.No.1,Bid Number,Bidder Name,Awarded Currency,Awarded Value,S.No.2,Bid Number.1,Bidder Name.1,Submitted Date,Status,Remarks,Status Updated On,Type :,Summary :,Updated By :.1,Updated On :,Document :,BOQ Comparative Chart :,Committee Chairperson/Co-ordinator Name :,Committee Chairperson/Co-ordinator Type :,Committee Members :,Updated By :.2,Updated on :.1,Document :.1,S.No.3,Bid Number.2,Bidder Name.2,Value,Rank,Type :.1,Summary :.1,Updated By :.3,Updated On :.1,Document :.2,Committee Chairperson/Co-ordinator Name :.1,Committee Chairperson/Co-ordinator Type :.1,Committee Members :.1,Updated By :.4,Updated On :.2,Financial Bid Opening Date:,Document :.3,Tender ID :,Tender Ref No :,Tender Title :
National Health Mission||State Programme Management Unit - NHM,NHM-32050/46/2021 Construction NHM 89,2023_NHM_31705_35,Yes,Open Tender,Item Rate,Works,2.0,No,No,Online,No,No,No,1.0,Fee/PreQual/Technical,.pdf,SBD,21-Jul-2023 06:00 PM,01-Aug-2023 03:30 PM,21-Jul-2023 06:00 PM,31-Jul-2023 02:00 PM,NA ,NA ,21-Jul-2023 06:00 PM,31-Jul-2023 02:00 PM,20-Feb-2024 04:00 PM,"83,952",Yes,percentage,2.0%,Nil,Nil,1.0,SBI Bank,"1,000",Nil,Nil,No,Mission Director NHM Assam,"o/o Mission Director, NHM, Assam",Repairing Renovation of 229 Nos of Sub Centre to upgrade them as Health n Wellness Centre at various places of Assam under NHM Assam Group 30 6 nos of schemes in Sivasagar district,Repairing Renovation of 229 Nos of Sub Centre to upgrade them as Health n Wellness Centre at various places of Assam under NHM Assam Group 30 6 nos of schemes in Sivasagar district,Please refer Tender documents. ,NA ,"41,97,620",Civil Works - Building,NA ,Tender,180.0,120.0,SivasagarDistrict,785640.0,NA ,NA ,NA ,"o/o Mission Director, NHM, Assam",No ,No,National Health Mission||State Programme Management Unit - NHM,NHM-32050/46/2021 Construction NHM 89,2023_NHM_31705_35,Yes,Open Tender,Item Rate,Works,2.0,No,No,Online,No,No,No,1.0,Fee/PreQual/Technical,.pdf,SBD,21-Jul-2023 06:00 PM,01-Aug-2023 03:30 PM,21-Jul-2023 06:00 PM,31-Jul-2023 02:00 PM,NA ,NA ,21-Jul-2023 06:00 PM,31-Jul-2023 02:00 PM,20-Feb-2024 04:00 PM,"83,952",Yes,percentage,2.0%,Nil,Nil,1.0,SBI Bank,"1,000",Nil,Nil,No,Mission Director NHM Assam,"o/o Mission Director, NHM, Assam",Repairing Renovation of 229 Nos of Sub Centre to upgrade them as Health n Wellness Centre at various places of Assam under NHM Assam Group 30 6 nos of schemes in Sivasagar district,Repairing Renovation of 229 Nos of Sub Centre to upgrade them as Health n Wellness Centre at various places of Assam under NHM Assam Group 30 6 nos of schemes in Sivasagar district,Please refer Tender documents. ,NA ,"41,97,620",Civil Works - Building,NA ,Tender,180.0,120.0,SivasagarDistrict,785640.0,NA ,NA ,NA ,"o/o Mission Director, NHM, Assam",No ,No,21-Dec-2024,"INR 4,173,619.97",120.0,Himangshu Kalita,21-Dec-2024 11:48 AM,WO_GROUP-30.pdf (385.00 KB),AOC,1.0,194160.0,SAFIKUL ISLAM,INR,"4,173,620",1.0,194182.0,LEENASHREE BARO,31-Jul-2023 11:10 AM,Rejected-AOC,L2 bidder is not awarded,21-Dec-2024 11:48 AM,Finance,Financial bid is opened,Himangshu Kalita,20-Dec-2024 07:46 PM,None,BOQ Comparative Chart,OSD,Internal,,Himangshu Kalita,21-Dec-2024 11:19 AM,finsummary_50891.pdf (374.52 KB),1.0,194160.0,SAFIKUL ISLAM,"41,73,619.97",L1,Technical,Technical bid is opened.,Himangshu Kalita,20-Feb-2024 03:06 PM,None,OSD,Internal,,Himangshu Kalita,20-Feb-2024 03:08 PM,20-Feb-2024 04:00 PM,techsummary_50891.pdf (395.93 KB),,,
,,,,,,,,,,,,,,,,.pdf,Technical Qualification,,,,,,,,,,,,,,,,,,,,,,,,,,,,,,,,,,,,,,,,,,,,,,,,,,,,,,,,,,.pdf,Technical Qualification,,,,,,,,,,,,,,,,,,,,,,,,,,,,,,,,,,,,,,,,,,,,,,,,,,,,,,2.0,193341.0,PRASANTA BORUAH,29-Jul-2023 04:56 PM,Not Admitted-Fee/PreQual/Technical,Not Complied with technical specification,20-Feb-2024 03:06 PM,,,,,,,,,,,,,2.0,194182.0,LEENASHREE BARO,"41,95,819.97",L2,,,,,,,,,,,,,,,
,,,,,,,,,,,,,,2.0,Finance,.xls,BOQ,,,,,,,,,,,,,,,,,,,,,,,,,,,,,,,,,,,,,,,,,,,,,,,,,,,,,,,,2.0,Finance,.xls,BOQ,,,,,,,,,,,,,,,,,,,,,,,,,,,,,,,,,,,,,,,,,,,,,,,,,,,,,,3.0,194160.0,SAFIKUL ISLAM,31-Jul-2023 09:42 AM,Accepted-AOC,L1 bidder is awarded,21-Dec-2024 11:48 AM,,,,,,,,,,,,,,,,,,,,,,,,,,,,,,,,
,,,,,,,,,,,,,,,,.pdf,FOB,,,,,,,,,,,,,,,,,,,,,,,,,,,,,,,,,,,,,,,,,,,,,,,,,,,,,,,,,,.pdf,FOB,,,,,,,,,,,,,,,,,,,,,,,,,,,,,,,,,,,,,,,,,,,,,,,,,,,,,,4.0,194161.0,SRI MANOJ BORAH,31-Jul-2023 01:56 PM,Not Admitted-Fee/PreQual/Technical,Not Complied with technical specification,20-Feb-2024 03:06 PM,,,,,,,,,,,,,,,,,,,,,,,,,,,,,,,,
,,,,,,,,,,,,,,,,,,,,,,,,,,,,,,,,,,,,,,,,,,,,,,,,,,,,,,,,,,,,,,,,,,,,,,,,,,,,,,,,,,,,,,,,,,,,,,,,,,,,,,,,,,,,,,,,,,,,,,,,,,,,,,,,,,,,,,,,,,,,,,,,,,,,,,,,,,,,,,,,,,,,,,2023_NHM_31705_35,NHM-32050/46/2021 Construction NHM 89,Repairing Renovation of 229 Nos of Sub Centre to upgrade them as Health n Wellness Centre at various places of Assam under NHM Assam Group 30 6 nos of schemes in Sivasagar district
