Organisation Chain,Tender Reference Number,Tender ID,Withdrawal Allowed,Tender Type,Form of contract,Tender Category,No. of Covers,General Technical Evaluation Allowed,ItemWise Technical Evaluation Allowed,Payment Mode,Is Multi Currency Allowed For BOQ,Is Multi Currency Allowed For Fee,Allow Two Stage Bidding,Cover No,Cover,Document Type,Description,Publish Date,Bid Opening Date,Document Download / Sale Start Date,Document Download / Sale End Date,Clarification Start Date,Clarification End Date,Bid Submission Start Date,Bid Submission End Date,Financial Bid Opening Date,EMD Amount in ₹,EMD Exemption Allowed,EMD Fee Type,EMD Percentage,EMD Payable To,EMD Payable At,S.No,Corrigendum Title,Corrigendum Type,View,S.No.1,Bank Name,Tender Fee in ₹,Fee Payable To,Fee Payable At,Tender Fee Exemption Allowed,Name,Address,Title,Work Description,Pre Qualification Details,Independent External Monitor/Remarks,Tender Value in ₹,Product Category,Sub category,Contract Type,Bid Validity(Days),Period Of Work(Days),Location,Pincode,Pre Bid Meeting Place,Pre Bid Meeting Address,Pre Bid Meeting Date,Bid Opening Place,Should Allow NDA Tender,Allow Preferential Bidder,Organisation Chain,Tender Reference Number,Tender ID,Withdrawal Allowed,Tender Type,Form of contract,Tender Category,No. of Covers,General Technical Evaluation Allowed,ItemWise Technical Evaluation Allowed,Payment Mode,Is Multi Currency Allowed For BOQ,Is Multi Currency Allowed For Fee,Allow Two Stage Bidding,Cover No,Cover,Document Type,Description,Publish Date,Bid Opening Date,Document Download / Sale Start Date,Document Download / Sale End Date,Clarification Start Date,Clarification End Date,Bid Submission Start Date,Bid Submission End Date,Financial Bid Opening Date,EMD Amount in ₹,EMD Exemption Allowed,EMD Fee Type,EMD Percentage,EMD Payable To,EMD Payable At,S.No,Corrigendum Title,Corrigendum Type,View,S.No.1,Bank Name,Tender Fee in ₹,Fee Payable To,Fee Payable At,Tender Fee Exemption Allowed,Name,Address,Title,Work Description,Pre Qualification Details,Independent External Monitor/Remarks,Tender Value in ₹,Product Category,Sub category,Contract Type,Bid Validity(Days),Period Of Work(Days),Location,Pincode,Pre Bid Meeting Place,Pre Bid Meeting Address,Pre Bid Meeting Date,Bid Opening Place,Should Allow NDA Tender,Allow Preferential Bidder,Contract Date :,Contract Value :,Work Completion Period in days :,Updated By :,Updated on :,AOC document :,S.No.2,Bid Number,Bidder Name,Awarded Currency,Awarded Value,S.No.3,Bid Number.1,Bidder Name.1,Submitted Date,Status,Remarks,Status Updated On,Type :,Summary :,Updated By :.1,Updated On :,Document :,BOQ Comparative Chart :,Committee Chairperson/Co-ordinator Name :,Committee Chairperson/Co-ordinator Type :,Committee Members :,Updated By :.2,Updated on :.1,Document :.1,S.No.4,Bid Number.2,Bidder Name.2,Value,Rank,Type :.1,Summary :.1,Updated By :.3,Updated On :.1,Document :.2,Committee Chairperson/Co-ordinator Name :.1,Committee Chairperson/Co-ordinator Type :.1,Committee Members :.1,Updated By :.4,Updated On :.2,Financial Bid Opening Date:,Document :.3,Tender ID :,Tender Ref No :,Tender Title :
Assam Electricity Grid Corporation Ltd||CGM (T and T),AEGCL/DGM/TTC/NLP/T3/54,2024_AEGCL_37740_1,Yes,Open Tender,Works,Works,2.0,No,No,Online,No,No,No,1.0,Fee/PreQual/Technical,.pdf,Tender Fee,26-Jun-2024 12:00 PM,28-Aug-2024 12:00 PM,26-Jun-2024 12:00 PM,27-Aug-2024 02:00 PM,NA ,NA ,26-Jun-2024 01:00 PM,27-Aug-2024 02:00 PM,10-Sep-2024 01:00 PM,"40,000",No,fixed,,Nil,Nil,1.0,TIME EXTENSION,Date,,1.0,SBI Bank,"1,000",Nil,Nil,No,DGM TNT Circle AEGCL North Lakhimpur,Office of the DGM TNT Circle AEGCL North Lakhimpur,Double jumpering of the angle points of NLP Dhemaji TL,Double jumpering of the angle points of 132kV North Lakhimpur Dhemaji TL,Please refer Tender documents. ,NA ,"18,91,324",Electrical Works,NA ,Tender,180.0,120.0,North Lakhimpur,787001.0,NA ,NA ,NA ,AEGCL North Lakhimpur Circle Office,No ,No,Assam Electricity Grid Corporation Ltd||CGM (T and T),AEGCL/DGM/TTC/NLP/T3/54,2024_AEGCL_37740_1,Yes,Open Tender,Works,Works,2.0,No,No,Online,No,No,No,1.0,Fee/PreQual/Technical,.pdf,Tender Fee,26-Jun-2024 12:00 PM,28-Aug-2024 12:00 PM,26-Jun-2024 12:00 PM,27-Aug-2024 02:00 PM,NA ,NA ,26-Jun-2024 01:00 PM,27-Aug-2024 02:00 PM,10-Sep-2024 01:00 PM,"40,000",No,fixed,,Nil,Nil,1.0,TIME EXTENSION,Date,,1.0,SBI Bank,"1,000",Nil,Nil,No,DGM TNT Circle AEGCL North Lakhimpur,Office of the DGM TNT Circle AEGCL North Lakhimpur,Double jumpering of the angle points of NLP Dhemaji TL,Double jumpering of the angle points of 132kV North Lakhimpur Dhemaji TL,Please refer Tender documents. ,NA ,"18,91,324",Electrical Works,NA ,Tender,180.0,120.0,North Lakhimpur,787001.0,NA ,NA ,NA ,AEGCL North Lakhimpur Circle Office,No ,No,04-Dec-2024,"INR 1,177,050",90.0,Pranjyoti Deka,03-Dec-2024 12:08 PM,WO.pdf (2065.00 KB),1.0,234493.0,PRODIPTA DEY,INR,"1,177,050",1.0,235860.0,MR.ATIN SAIKIA,30-Jul-2024 06:46 PM,Rejected-Technical,sign and seal bid documents not submitted,06-Sep-2024 02:40 PM,Finance,The price bid was evaluated on 10.09.2024,Pranjyoti Deka,13-Sep-2024 02:44 PM,None,BOQ Comparative Chart,Sri S K Daimary,Internal,,Pranjyoti Deka,03-Dec-2024 11:58 AM,finsummary_61372.pdf (4234.83 KB),1.0,234493.0,PRODIPTA DEY,"11,77,050.00",I,Technical,The Techno commercial bid was opened on 29.08.2024,Pranjyoti Deka,31-Aug-2024 02:40 PM,None,Sri S K Daimary,Internal,,Pranjyoti Deka,06-Sep-2024 02:40 PM,10-Sep-2024 01:00 PM,techsummary_61372.pdf (2173.68 KB),,,
,,,,,,,,,,,,,,,,.pdf,EMD Money receipt,,,,,,,,,,,,,,,,,,,,,,,,,,,,,,,,,,,,,,,,,,,,,,,,,,,,,,,,,,,,,,.pdf,EMD Money receipt,,,,,,,,,,,,,,,,,,,,,,,,,,,,,,,,,,,,,,,,,,,,,,,,,,,,,,,,,2.0,234493.0,PRODIPTA DEY,15-Jul-2024 11:23 AM,Accepted-AOC,Qualified,03-Dec-2024 12:08 PM,,,,,,,,,,,,,,,,,,,,,,,,,,,,,,,,
,,,,,,,,,,,,,,,,.pdf,Required all the documents for qualifying in technical bid,,,,,,,,,,,,,,,,,,,,,,,,,,,,,,,,,,,,,,,,,,,,,,,,,,,,,,,,,,,,,,.pdf,Required all the documents for qualifying in technical bid,,,,,,,,,,,,,,,,,,,,,,,,,,,,,,,,,,,,,,,,,,,,,,,,,,,,,,,,,,,,,,,,,,,,,,,,,,,,,,,,,,,,,,,,,,,,,,,
,,,,,,,,,,,,,,2.0,Finance,.xls,Price Bid,,,,,,,,,,,,,,,,,,,,,,,,,,,,,,,,,,,,,,,,,,,,,,,,,,,,,,,,,,,,2.0,Finance,.xls,Price Bid,,,,,,,,,,,,,,,,,,,,,,,,,,,,,,,,,,,,,,,,,,,,,,,,,,,,,,,,,,,,,,,,,,,,,,,,,,,,,,,,,,,,,,,,,,,,,,,
,,,,,,,,,,,,,,,,,,,,,,,,,,,,,,,,,,,,,,,,,,,,,,,,,,,,,,,,,,,,,,,,,,,,,,,,,,,,,,,,,,,,,,,,,,,,,,,,,,,,,,,,,,,,,,,,,,,,,,,,,,,,,,,,,,,,,,,,,,,,,,,,,,,,,,,,,,,,,,,,,,,,,,,,,,,,,2024_AEGCL_37740_1,AEGCL/DGM/TTC/NLP/T3/54,Double jumpering of the angle points of NLP Dhemaji TL
