Organisation Chain,Tender Reference Number,Tender ID,Withdrawal Allowed,Tender Type,Form of contract,Tender Category,No. of Covers,General Technical Evaluation Allowed,ItemWise Technical Evaluation Allowed,Payment Mode,Is Multi Currency Allowed For BOQ,Is Multi Currency Allowed For Fee,Allow Two Stage Bidding,Cover No,Cover,Document Type,Description,Publish Date,Bid Opening Date,Document Download / Sale Start Date,Document Download / Sale End Date,Clarification Start Date,Clarification End Date,Bid Submission Start Date,Bid Submission End Date,Financial Bid Opening Date,EMD Amount in ₹,EMD Exemption Allowed,EMD Fee Type,EMD Percentage,EMD Payable To,EMD Payable At,S.No,Bank Name,Tender Fee in ₹,Fee Payable To,Fee Payable At,Tender Fee Exemption Allowed,Name,Address,Title,Work Description,Pre Qualification Details,Independent External Monitor/Remarks,Tender Value in ₹,Product Category,Sub category,Contract Type,Bid Validity(Days),Period Of Work(Days),Location,Pincode,Pre Bid Meeting Place,Pre Bid Meeting Address,Pre Bid Meeting Date,Bid Opening Place,Should Allow NDA Tender,Allow Preferential Bidder,Organisation Chain,Tender Reference Number,Tender ID,Withdrawal Allowed,Tender Type,Form of contract,Tender Category,No. of Covers,General Technical Evaluation Allowed,ItemWise Technical Evaluation Allowed,Payment Mode,Is Multi Currency Allowed For BOQ,Is Multi Currency Allowed For Fee,Allow Two Stage Bidding,Cover No,Cover,Document Type,Description,Publish Date,Bid Opening Date,Document Download / Sale Start Date,Document Download / Sale End Date,Clarification Start Date,Clarification End Date,Bid Submission Start Date,Bid Submission End Date,Financial Bid Opening Date,EMD Amount in ₹,EMD Exemption Allowed,EMD Fee Type,EMD Percentage,EMD Payable To,EMD Payable At,S.No,Bank Name,Tender Fee in ₹,Fee Payable To,Fee Payable At,Tender Fee Exemption Allowed,Name,Address,Title,Work Description,Pre Qualification Details,Independent External Monitor/Remarks,Tender Value in ₹,Product Category,Sub category,Contract Type,Bid Validity(Days),Period Of Work(Days),Location,Pincode,Pre Bid Meeting Place,Pre Bid Meeting Address,Pre Bid Meeting Date,Bid Opening Place,Should Allow NDA Tender,Allow Preferential Bidder,Contract Date :,Contract Value :,Work Completion Period in days :,Updated By :,Updated on :,AOC document :,AOC Description :,S.No.1,Bid Number,Bidder Name,Awarded Currency,Awarded Value,S.No.2,Bid Number.1,Bidder Name.1,Submitted Date,Status,Remarks,Status Updated On,Type :,Summary :,Updated By :.1,Updated On :,Document :,BOQ Comparative Chart :,Committee Chairperson/Co-ordinator Name :,Committee Chairperson/Co-ordinator Type :,Committee Members :,Updated By :.2,Updated on :.1,Document :.1,S.No.3,Bid Number.2,Bidder Name.2,Value,Rank,Type :.1,Summary :.1,Updated By :.3,Updated On :.1,Document :.2,Committee Chairperson/Co-ordinator Name :.1,Committee Chairperson/Co-ordinator Type :.1,Committee Members :.1,Updated By :.4,Updated On :.2,Financial Bid Opening Date:,Document :.3,Tender ID :,Tender Ref No :,Tender Title :
Assam Agricultural University||Directorate of Physical Plants,Admin/Urgent/2024/16635 dtd 07-10-24,2024_AAU_39791_1,Yes,Open Tender,Percentage,Works,2.0,No,No,Online,No,No,No,1.0,Fee/PreQual/Technical,.pdf,GCC,08-Oct-2024 10:00 AM,29-Oct-2024 03:00 PM,08-Oct-2024 10:00 AM,29-Oct-2024 02:00 PM,NA ,NA ,08-Oct-2024 10:00 AM,29-Oct-2024 02:00 PM,04-Nov-2024 02:30 PM,"12,68,583",Yes,percentage,2.0%,Nil,Nil,1.0,SBI Bank,"20,000",Nil,Nil,No,"Director of Physical Plant, AAU, Jorhat","O/o the DPP, AAU, Jorhat","CONSTRUCTION OF VERTICAL CLINICAL COMPLEX G plus 3 AT CVSc, AAU, KHANAPARA","Construction of G plus 3 vertical clinical complex including civil, water supply and sanitary and electrical works",Please refer Tender documents. ,NA ,"6,34,29,150",Civil Works - Building,NA ,Tender,180.0,540.0,"At CVSc, Khanapara",781022.0,"O/o the DPP, AAU, Jorhat ","O/o the DPP, AAU, Jorhat ",18-Oct-2024 11:30 AM ,"O/o the DPP, AAU, Jorhat",No ,No,Assam Agricultural University||Directorate of Physical Plants,Admin/Urgent/2024/16635 dtd 07-10-24,2024_AAU_39791_1,Yes,Open Tender,Percentage,Works,2.0,No,No,Online,No,No,No,1.0,Fee/PreQual/Technical,.pdf,GCC,08-Oct-2024 10:00 AM,29-Oct-2024 03:00 PM,08-Oct-2024 10:00 AM,29-Oct-2024 02:00 PM,NA ,NA ,08-Oct-2024 10:00 AM,29-Oct-2024 02:00 PM,04-Nov-2024 02:30 PM,"12,68,583",Yes,percentage,2.0%,Nil,Nil,1.0,SBI Bank,"20,000",Nil,Nil,No,"Director of Physical Plant, AAU, Jorhat","O/o the DPP, AAU, Jorhat","CONSTRUCTION OF VERTICAL CLINICAL COMPLEX G plus 3 AT CVSc, AAU, KHANAPARA","Construction of G plus 3 vertical clinical complex including civil, water supply and sanitary and electrical works",Please refer Tender documents. ,NA ,"6,34,29,150",Civil Works - Building,NA ,Tender,180.0,540.0,"At CVSc, Khanapara",781022.0,"O/o the DPP, AAU, Jorhat ","O/o the DPP, AAU, Jorhat ",18-Oct-2024 11:30 AM ,"O/o the DPP, AAU, Jorhat",No ,No,03-Dec-2024,"INR 53,540,545",540.0,Smritom Podder,03-Dec-2024 11:30 AM,APCON_241203_112307.pdf (797.00 KB),Rupees five crore thirty five lakhs forty thousand five hundred forty five only,1.0,245899.0,APCON GROUP,INR,"53,540,545",1.0,246918.0,Amitabh Choudhury,28-Oct-2024 05:44 PM,Rejected-AOC,Financially responsive second lowest evaluated bidder,03-Dec-2024 11:30 AM,Finance,Financial bid opening summary,Smritom Podder,08-Nov-2024 04:28 PM,finance_64511.pdf,BOQ Comparative Chart,Pankaj Barua,Internal,,Smritom Podder,03-Dec-2024 11:15 AM,finsummary_64511.pdf (200.58 KB),1.0,245899.0,APCON GROUP,"5,35,40,545.52",1.0,Technical,Technical bid opening summary,Smritom Podder,30-Oct-2024 11:42 AM,technical_64511.pdf,Pankaj Barua,Internal,,Ashish Bora,02-Nov-2024 02:21 PM,04-Nov-2024 02:30 PM,techsummary_64511.pdf (546.90 KB),,,
,,,,,,,,,,,,,,,,.pdf,Bidder qualification documents,,,,,,,,,,,,,,,,,,,,,,,,,,,,,,,,,,,,,,,,,,,,,,,,,,,,,,,,,,.pdf,Bidder qualification documents,,,,,,,,,,,,,,,,,,,,,,,,,,,,,,,,,,,,,,,,,,,,,,,,,,,,,,2.0,245899.0,APCON GROUP,29-Oct-2024 12:37 PM,Accepted-AOC,Financially responsive lowest evaluated bidder,03-Dec-2024 11:30 AM,,,,,,,,,,,,,2.0,246652.0,PG CONSTRUCTION,"6,07,01,696.55",4.0,,,,,,,,,,,,,,,
,,,,,,,,,,,,,,,,.pdf,SCC,,,,,,,,,,,,,,,,,,,,,,,,,,,,,,,,,,,,,,,,,,,,,,,,,,,,,,,,,,.pdf,SCC,,,,,,,,,,,,,,,,,,,,,,,,,,,,,,,,,,,,,,,,,,,,,,,,,,,,,,3.0,247022.0,Dipen Ch. Das,29-Oct-2024 01:15 AM,Rejected-AOC,Financially responsive third lowest evaluated bidder,03-Dec-2024 11:30 AM,,,,,,,,,,,,,3.0,246918.0,Amitabh Choudhury,"5,47,39,356.45",2.0,,,,,,,,,,,,,,,
,,,,,,,,,,,,,,,,.pdf,Makelist,,,,,,,,,,,,,,,,,,,,,,,,,,,,,,,,,,,,,,,,,,,,,,,,,,,,,,,,,,.pdf,Makelist,,,,,,,,,,,,,,,,,,,,,,,,,,,,,,,,,,,,,,,,,,,,,,,,,,,,,,4.0,246652.0,PG CONSTRUCTION,28-Oct-2024 12:14 PM,Rejected-AOC,Financially responsive fourth lowest evaluated bidder,03-Dec-2024 11:30 AM,,,,,,,,,,,,,4.0,247022.0,Dipen Ch. Das,"5,88,62,251.20",3.0,,,,,,,,,,,,,,,
,,,,,,,,,,,,,,,,.pdf,BoQ in pdf,,,,,,,,,,,,,,,,,,,,,,,,,,,,,,,,,,,,,,,,,,,,,,,,,,,,,,,,,,.pdf,BoQ in pdf,,,,,,,,,,,,,,,,,,,,,,,,,,,,,,,,,,,,,,,,,,,,,,,,,,,,,,5.0,245900.0,SRI AJIT BAISHYA,28-Oct-2024 12:25 PM,Rejected-Technical,Technically disqualified,02-Nov-2024 02:21 PM,,,,,,,,,,,,,,,,,,,,,,,,,,,,,,,,
,,,,,,,,,,,,,,,,.pdf,Drawings,,,,,,,,,,,,,,,,,,,,,,,,,,,,,,,,,,,,,,,,,,,,,,,,,,,,,,,,,,.pdf,Drawings,,,,,,,,,,,,,,,,,,,,,,,,,,,,,,,,,,,,,,,,,,,,,,,,,,,,,,,,,,,,,,,,,,,,,,,,,,,,,,,,,,,,,,,,,,,,
,,,,,,,,,,,,,,2.0,Finance,.xls,BoQ,,,,,,,,,,,,,,,,,,,,,,,,,,,,,,,,,,,,,,,,,,,,,,,,,,,,,,,,2.0,Finance,.xls,BoQ,,,,,,,,,,,,,,,,,,,,,,,,,,,,,,,,,,,,,,,,,,,,,,,,,,,,,,,,,,,,,,,,,,,,,,,,,,,,,,,,,,,,,,,,,,,,
,,,,,,,,,,,,,,,,,,,,,,,,,,,,,,,,,,,,,,,,,,,,,,,,,,,,,,,,,,,,,,,,,,,,,,,,,,,,,,,,,,,,,,,,,,,,,,,,,,,,,,,,,,,,,,,,,,,,,,,,,,,,,,,,,,,,,,,,,,,,,,,,,,,,,,,,,,,,,,,,,,,,,,2024_AAU_39791_1,Admin/Urgent/2024/16635 dtd 07-10-24,"CONSTRUCTION OF VERTICAL CLINICAL COMPLEX G plus 3 AT CVSc, AAU, KHANAPARA"
