Organisation Chain,Tender Reference Number,Tender ID,Withdrawal Allowed,Tender Type,Form of contract,Tender Category,No. of Covers,General Technical Evaluation Allowed,ItemWise Technical Evaluation Allowed,Payment Mode,Is Multi Currency Allowed For BOQ,Is Multi Currency Allowed For Fee,Allow Two Stage Bidding,Cover No,Cover,Document Type,Description,Publish Date,Bid Opening Date,Document Download / Sale Start Date,Document Download / Sale End Date,Clarification Start Date,Clarification End Date,Bid Submission Start Date,Bid Submission End Date,Financial Bid Opening Date,EMD Amount in ₹,EMD Exemption Allowed,EMD Fee Type,EMD Percentage,EMD Payable To,EMD Payable At,S.No,Bank Name,Tender Fee in ₹,Fee Payable To,Fee Payable At,Tender Fee Exemption Allowed,Name,Address,Title,Work Description,Pre Qualification Details,Independent External Monitor/Remarks,Tender Value in ₹,Product Category,Sub category,Contract Type,Bid Validity(Days),Period Of Work(Days),Location,Pincode,Pre Bid Meeting Place,Pre Bid Meeting Address,Pre Bid Meeting Date,Bid Opening Place,Should Allow NDA Tender,Allow Preferential Bidder,Organisation Chain,Tender Reference Number,Tender ID,Withdrawal Allowed,Tender Type,Form of contract,Tender Category,No. of Covers,General Technical Evaluation Allowed,ItemWise Technical Evaluation Allowed,Payment Mode,Is Multi Currency Allowed For BOQ,Is Multi Currency Allowed For Fee,Allow Two Stage Bidding,Cover No,Cover,Document Type,Description,Publish Date,Bid Opening Date,Document Download / Sale Start Date,Document Download / Sale End Date,Clarification Start Date,Clarification End Date,Bid Submission Start Date,Bid Submission End Date,Financial Bid Opening Date,EMD Amount in ₹,EMD Exemption Allowed,EMD Fee Type,EMD Percentage,EMD Payable To,EMD Payable At,S.No,Bank Name,Tender Fee in ₹,Fee Payable To,Fee Payable At,Tender Fee Exemption Allowed,Name,Address,Title,Work Description,Pre Qualification Details,Independent External Monitor/Remarks,Tender Value in ₹,Product Category,Sub category,Contract Type,Bid Validity(Days),Period Of Work(Days),Location,Pincode,Pre Bid Meeting Place,Pre Bid Meeting Address,Pre Bid Meeting Date,Bid Opening Place,Should Allow NDA Tender,Allow Preferential Bidder,Contract Date :,Contract Value :,Work Completion Period in days :,Updated By :,Updated on :,AOC document :,S.No.1,Bid Number,Bidder Name,Awarded Currency,Awarded Value,S.No.2,Bid Number.1,Bidder Name.1,Submitted Date,Status,Remarks,Status Updated On,Type :,Summary :,Updated By :.1,Updated On :,Document :,BOQ Comparative Chart :,Committee Chairperson/Co-ordinator Name :,Committee Chairperson/Co-ordinator Type :,Committee Members :,Updated By :.2,Updated on :.1,Document :.1,S.No.3,Bid Number.2,Bidder Name.2,Value,Rank,Type :.1,Summary :.1,Updated By :.3,Updated On :.1,Document :.2,Committee Chairperson/Co-ordinator Name :.1,Committee Chairperson/Co-ordinator Type :.1,Committee Members :.1,Updated By :.4,Updated On :.2,Financial Bid Opening Date:,Document :.3,Tender ID :,Tender Ref No :,Tender Title :
Public Works Roads Department-Externally Aided Project||Public Works Road Department- World Bank Funded Tenders||Assam State Bridge Infrastructure Program,CE/EAP/ARRBP/111Tenders2023/15,2023_PWRDW_32425_1,Yes,Open Tender,Item Rate,Works,2.0,No,No,Online,No,No,No,1.0,Fee/PreQual/Technical,.pdf,Standard Bidding Document,08-Sep-2023 06:50 PM,10-Oct-2023 02:30 PM,08-Sep-2023 06:50 PM,10-Oct-2023 02:00 PM,08-Sep-2023 06:55 PM ,15-Sep-2023 11:00 AM ,08-Sep-2023 06:55 PM,10-Oct-2023 02:00 PM,21-Nov-2023 02:00 PM,"5,26,000",Yes,fixed,,Nil,Nil,1.0,SBI Bank,"5,000",Nil,Nil,Yes,"Chief Engineer (EAP), PWRD, Assam","O/o the Chief Engineer (EAP), PWRD Fatasil Ambari, Guwahati-25, Assam",Construction of Bridge in Darrang district i) Br. No. 1/1 on Neogpara Pariapara Connecting Road,Package No. CE/EAP/ARRBP/OCB/Bridge-1/Darrang/05 Construction of Bridge in Darrang district i) Br. No. 1/1 on Neogpara Pariapara Connecting Road,Please refer Tender documents. ,NA ,"2,63,22,000",Civil Works - Bridges,NA ,Tender,90.0,540.0,Darrang,784148.0,"O/o the Chief Engineer (EAP), PWRD, Ghy-25 ","O/o the Chief Engineer (EAP), PWRD Fatasil Ambari, Guwahati-25, Assam ",15-Sep-2023 11:00 AM ,"O/o the Chief Engineer (EAP), PWRD, Ghy-25",No ,No,Public Works Roads Department-Externally Aided Project||Public Works Road Department- World Bank Funded Tenders||Assam State Bridge Infrastructure Program,CE/EAP/ARRBP/111Tenders2023/15,2023_PWRDW_32425_1,Yes,Open Tender,Item Rate,Works,2.0,No,No,Online,No,No,No,1.0,Fee/PreQual/Technical,.pdf,Standard Bidding Document,08-Sep-2023 06:50 PM,10-Oct-2023 02:30 PM,08-Sep-2023 06:50 PM,10-Oct-2023 02:00 PM,08-Sep-2023 06:55 PM ,15-Sep-2023 11:00 AM ,08-Sep-2023 06:55 PM,10-Oct-2023 02:00 PM,21-Nov-2023 02:00 PM,"5,26,000",Yes,fixed,,Nil,Nil,1.0,SBI Bank,"5,000",Nil,Nil,Yes,"Chief Engineer (EAP), PWRD, Assam","O/o the Chief Engineer (EAP), PWRD Fatasil Ambari, Guwahati-25, Assam",Construction of Bridge in Darrang district i) Br. No. 1/1 on Neogpara Pariapara Connecting Road,Package No. CE/EAP/ARRBP/OCB/Bridge-1/Darrang/05 Construction of Bridge in Darrang district i) Br. No. 1/1 on Neogpara Pariapara Connecting Road,Please refer Tender documents. ,NA ,"2,63,22,000",Civil Works - Bridges,NA ,Tender,90.0,540.0,Darrang,784148.0,"O/o the Chief Engineer (EAP), PWRD, Ghy-25 ","O/o the Chief Engineer (EAP), PWRD Fatasil Ambari, Guwahati-25, Assam ",15-Sep-2023 11:00 AM ,"O/o the Chief Engineer (EAP), PWRD, Ghy-25",No ,No,03-Dec-2024,"INR 25,197,437",540.0,Sanjita Bodo,03-Dec-2024 05:17 PM,Darrang_05_Work_Order.pdf (73.00 KB),1.0,203257.0,Raju Choudhury,INR,"25,197,437",1.0,202842.0,KALPA SINGH BORDOLOI,10-Oct-2023 01:47 PM,Rejected-AOC,L2,03-Dec-2024 05:17 PM,Finance,Financial bid opened,Kampi Sonowal,21-Nov-2023 02:53 PM,None,BOQ Comparative Chart,"Chief Engineer (EAP), PWRD",Internal,,Sanjita Bodo,03-Dec-2024 05:15 PM,finsummary_52077.pdf (101.95 KB),1.0,202842.0,KALPA SINGH BORDOLOI,"2,78,02,300.00",L2,Technical,Technical Bid Opened,Sanjita Bodo,20-Oct-2023 03:11 PM,None,"Chief Engineer (EAP), PWRD,Assam",Internal,,Kampi Sonowal,18-Nov-2023 05:53 PM,21-Nov-2023 02:00 PM,techsummary_52077.pdf (171.99 KB),,,
,,,,,,,,,,,,,,,,.pdf,Technical Qualification Details,,,,,,,,,,,,,,,,,,,,,,,,,,,,,,,,,,,,,,,,,,,,,,,,,,,,,,,,,,.pdf,Technical Qualification Details,,,,,,,,,,,,,,,,,,,,,,,,,,,,,,,,,,,,,,,,,,,,,,,,,,,,,2.0,203288.0,M/S RAJ KUMAR JAIN,10-Oct-2023 01:56 PM,Rejected-Technical,Non-Responsive,18-Nov-2023 05:53 PM,,,,,,,,,,,,,2.0,203257.0,Raju Choudhury,"2,51,97,437.00",L1,,,,,,,,,,,,,,,
,,,,,,,,,,,,,,,,.pdf,Letter of Technical Bid,,,,,,,,,,,,,,,,,,,,,,,,,,,,,,,,,,,,,,,,,,,,,,,,,,,,,,,,,,.pdf,Letter of Technical Bid,,,,,,,,,,,,,,,,,,,,,,,,,,,,,,,,,,,,,,,,,,,,,,,,,,,,,3.0,203257.0,Raju Choudhury,09-Oct-2023 06:13 PM,Accepted-AOC,L1,03-Dec-2024 05:17 PM,,,,,,,,,,,,,,,,,,,,,,,,,,,,,,,,
,,,,,,,,,,,,,,2.0,Finance,.xls,BOQ,,,,,,,,,,,,,,,,,,,,,,,,,,,,,,,,,,,,,,,,,,,,,,,,,,,,,,,,2.0,Finance,.xls,BOQ,,,,,,,,,,,,,,,,,,,,,,,,,,,,,,,,,,,,,,,,,,,,,,,,,,,,,,,,,,,,,,,,,,,,,,,,,,,,,,,,,,,,,,,,,,,
,,,,,,,,,,,,,,,,.pdf,Letter of Financial Bid,,,,,,,,,,,,,,,,,,,,,,,,,,,,,,,,,,,,,,,,,,,,,,,,,,,,,,,,,,.pdf,Letter of Financial Bid,,,,,,,,,,,,,,,,,,,,,,,,,,,,,,,,,,,,,,,,,,,,,,,,,,,,,,,,,,,,,,,,,,,,,,,,,,,,,,,,,,,,,,,,,,,
,,,,,,,,,,,,,,,,,,,,,,,,,,,,,,,,,,,,,,,,,,,,,,,,,,,,,,,,,,,,,,,,,,,,,,,,,,,,,,,,,,,,,,,,,,,,,,,,,,,,,,,,,,,,,,,,,,,,,,,,,,,,,,,,,,,,,,,,,,,,,,,,,,,,,,,,,,,,,,,,,,,,,2023_PWRDW_32425_1,CE/EAP/ARRBP/111Tenders2023/15,Construction of Bridge in Darrang district i) Br. No. 1/1 on Neogpara Pariapara Connecting Road
