Organisation Chain,Tender Reference Number,Tender ID,Withdrawal Allowed,Tender Type,Form of contract,Tender Category,No. of Covers,General Technical Evaluation Allowed,ItemWise Technical Evaluation Allowed,Payment Mode,Is Multi Currency Allowed For BOQ,Is Multi Currency Allowed For Fee,Allow Two Stage Bidding,Cover No,Cover,Document Type,Description,Publish Date,Bid Opening Date,Document Download / Sale Start Date,Document Download / Sale End Date,Clarification Start Date,Clarification End Date,Bid Submission Start Date,Bid Submission End Date,Financial Bid Opening Date,EMD Amount in ₹,EMD Exemption Allowed,EMD Fee Type,EMD Percentage,EMD Payable To,EMD Payable At,S.No,Bank Name,Tender Fee in ₹,Fee Payable To,Fee Payable At,Tender Fee Exemption Allowed,Name,Address,Title,Work Description,Pre Qualification Details,Independent External Monitor/Remarks,Tender Value in ₹,Product Category,Sub category,Contract Type,Bid Validity(Days),Period Of Work(Days),Location,Pincode,Pre Bid Meeting Place,Pre Bid Meeting Address,Pre Bid Meeting Date,Bid Opening Place,Should Allow NDA Tender,Allow Preferential Bidder,Organisation Chain,Tender Reference Number,Tender ID,Withdrawal Allowed,Tender Type,Form of contract,Tender Category,No. of Covers,General Technical Evaluation Allowed,ItemWise Technical Evaluation Allowed,Payment Mode,Is Multi Currency Allowed For BOQ,Is Multi Currency Allowed For Fee,Allow Two Stage Bidding,Cover No,Cover,Document Type,Description,Publish Date,Bid Opening Date,Document Download / Sale Start Date,Document Download / Sale End Date,Clarification Start Date,Clarification End Date,Bid Submission Start Date,Bid Submission End Date,Financial Bid Opening Date,EMD Amount in ₹,EMD Exemption Allowed,EMD Fee Type,EMD Percentage,EMD Payable To,EMD Payable At,S.No,Bank Name,Tender Fee in ₹,Fee Payable To,Fee Payable At,Tender Fee Exemption Allowed,Name,Address,Title,Work Description,Pre Qualification Details,Independent External Monitor/Remarks,Tender Value in ₹,Product Category,Sub category,Contract Type,Bid Validity(Days),Period Of Work(Days),Location,Pincode,Pre Bid Meeting Place,Pre Bid Meeting Address,Pre Bid Meeting Date,Bid Opening Place,Should Allow NDA Tender,Allow Preferential Bidder,Contract Date :,Contract Value :,Work Completion Period in days :,Updated By :,Updated on :,AOC document :,AOC Description :,S.No.1,Bid Number,Bidder Name,Awarded Currency,Awarded Value,S.No.2,Bid Number.1,Bidder Name.1,Submitted Date,Status,Remarks,Status Updated On,Type :,Summary :,Updated By :.1,Updated On :,Document :,BOQ Comparative Chart :,Committee Chairperson/Co-ordinator Name :,Committee Chairperson/Co-ordinator Type :,Committee Members :,Updated By :.2,Updated on :.1,Document :.1,S.No.3,Bid Number.2,Bidder Name.2,Value,Rank,Type :.1,Summary :.1,Updated By :.3,Updated On :.1,Document :.2,Committee Chairperson/Co-ordinator Name :.1,Committee Chairperson/Co-ordinator Type :.1,Committee Members :.1,Updated By :.4,Updated On :.2,Financial Bid Opening Date:,Document :.3,Tender ID :,Tender Ref No :,Tender Title :
Assam Agricultural University||Directorate of Physical Plants,Urgent/2024/17039(Part-I) dated 28-10-2024,2024_AAU_40107_1,Yes,Open Tender,Percentage,Works,2.0,No,No,Online,No,No,No,1.0,Fee/PreQual/Technical,.pdf,GCC,29-Oct-2024 10:00 AM,19-Nov-2024 03:00 PM,29-Oct-2024 10:00 AM,19-Nov-2024 02:00 PM,NA ,NA ,29-Oct-2024 10:00 AM,19-Nov-2024 02:00 PM,07-Dec-2024 12:30 PM,"1,00,237",Yes,percentage,2.0%,Nil,Nil,1.0,SBI Bank,"2,000",Nil,Nil,No,"Superintending Engineer, DPP, AAU, Jorhat","O/o the DPP, AAU, Jorhat","Construction of Boundary Wall cum Chain link fencing at SCSCA, AAU, Dhubri",Civil works for construction of boundary fencing,Please refer Tender documents. ,NA ,"50,11,826",Civil Works - Others,NA ,Tender,180.0,180.0,"At SCSCA, Dhubri",783371.0,"O/o the DPP, AAU, Jorhat ","O/o the DPP, AAU, Jorhat ",05-Nov-2024 11:30 AM ,"O/o the DPP, AAU, Jorhat",No ,No,Assam Agricultural University||Directorate of Physical Plants,Urgent/2024/17039(Part-I) dated 28-10-2024,2024_AAU_40107_1,Yes,Open Tender,Percentage,Works,2.0,No,No,Online,No,No,No,1.0,Fee/PreQual/Technical,.pdf,GCC,29-Oct-2024 10:00 AM,19-Nov-2024 03:00 PM,29-Oct-2024 10:00 AM,19-Nov-2024 02:00 PM,NA ,NA ,29-Oct-2024 10:00 AM,19-Nov-2024 02:00 PM,07-Dec-2024 12:30 PM,"1,00,237",Yes,percentage,2.0%,Nil,Nil,1.0,SBI Bank,"2,000",Nil,Nil,No,"Superintending Engineer, DPP, AAU, Jorhat","O/o the DPP, AAU, Jorhat","Construction of Boundary Wall cum Chain link fencing at SCSCA, AAU, Dhubri",Civil works for construction of boundary fencing,Please refer Tender documents. ,NA ,"50,11,826",Civil Works - Others,NA ,Tender,180.0,180.0,"At SCSCA, Dhubri",783371.0,"O/o the DPP, AAU, Jorhat ","O/o the DPP, AAU, Jorhat ",05-Nov-2024 11:30 AM ,"O/o the DPP, AAU, Jorhat",No ,No,24-Dec-2024,"INR 4,214,945.67",180.0,Ashish Bora,24-Dec-2024 02:43 PM,PDENTERPRISE_241224_143959.pdf (410.00 KB),Rupees forty two lakhs fourteen thousand nine hundred forty five and sixty seven paise only,1.0,248433.0,M/s P D Enterprise,INR,"4,214,945.67",1.0,248654.0,Dhrubajyoti Deka,19-Nov-2024 01:36 PM,Rejected-Technical,Technically disqualified,06-Dec-2024 12:29 PM,Finance,Financial bid opening summary,Ashish Bora,09-Dec-2024 10:52 AM,finance_65158.pdf,BOQ Comparative Chart,Pankaj Barua,Internal,,Ashish Bora,24-Dec-2024 02:38 PM,finsummary_65158.pdf (197.91 KB),1.0,248433.0,M/s P D Enterprise,"42,14,945.67",1.0,Technical,Technical bid opening summary,Smritom Podder,06-Dec-2024 11:51 AM,technical_65158.pdf,Pankaj Barua,Internal,,Smritom Podder,06-Dec-2024 12:29 PM,07-Dec-2024 12:30 PM,techsummary_65158.pdf (493.85 KB),,,
,,,,,,,,,,,,,,,,.pdf,SCC,,,,,,,,,,,,,,,,,,,,,,,,,,,,,,,,,,,,,,,,,,,,,,,,,,,,,,,,,,.pdf,SCC,,,,,,,,,,,,,,,,,,,,,,,,,,,,,,,,,,,,,,,,,,,,,,,,,,,,,,2.0,248918.0,Hazarika Enterprise.,19-Nov-2024 11:32 AM,Rejected-AOC,Financially responsive third lowest evaluated bidder,24-Dec-2024 02:43 PM,,,,,,,,,,,,,2.0,248809.0,Kaustav Saikia,"46,40,950.88",2.0,,,,,,,,,,,,,,,
,,,,,,,,,,,,,,,,.pdf,Makelist,,,,,,,,,,,,,,,,,,,,,,,,,,,,,,,,,,,,,,,,,,,,,,,,,,,,,,,,,,.pdf,Makelist,,,,,,,,,,,,,,,,,,,,,,,,,,,,,,,,,,,,,,,,,,,,,,,,,,,,,,3.0,248809.0,Kaustav Saikia,19-Nov-2024 12:14 PM,Rejected-AOC,Financially responsive second lowest evaluated bidder,24-Dec-2024 02:43 PM,,,,,,,,,,,,,3.0,248918.0,Hazarika Enterprise.,"46,96,080.96",3.0,,,,,,,,,,,,,,,
,,,,,,,,,,,,,,,,.pdf,BoQ and drawings,,,,,,,,,,,,,,,,,,,,,,,,,,,,,,,,,,,,,,,,,,,,,,,,,,,,,,,,,,.pdf,BoQ and drawings,,,,,,,,,,,,,,,,,,,,,,,,,,,,,,,,,,,,,,,,,,,,,,,,,,,,,,4.0,248433.0,M/s P D Enterprise,19-Nov-2024 01:50 PM,Accepted-AOC,Financially responsive lowest evaluated bidder,24-Dec-2024 02:43 PM,,,,,,,,,,,,,,,,,,,,,,,,,,,,,,,,
,,,,,,,,,,,,,,,,.pdf,Bidder qualification documents,,,,,,,,,,,,,,,,,,,,,,,,,,,,,,,,,,,,,,,,,,,,,,,,,,,,,,,,,,.pdf,Bidder qualification documents,,,,,,,,,,,,,,,,,,,,,,,,,,,,,,,,,,,,,,,,,,,,,,,,,,,,,,,,,,,,,,,,,,,,,,,,,,,,,,,,,,,,,,,,,,,,
,,,,,,,,,,,,,,2.0,Finance,.xls,BoQ,,,,,,,,,,,,,,,,,,,,,,,,,,,,,,,,,,,,,,,,,,,,,,,,,,,,,,,,2.0,Finance,.xls,BoQ,,,,,,,,,,,,,,,,,,,,,,,,,,,,,,,,,,,,,,,,,,,,,,,,,,,,,,,,,,,,,,,,,,,,,,,,,,,,,,,,,,,,,,,,,,,,
,,,,,,,,,,,,,,,,,,,,,,,,,,,,,,,,,,,,,,,,,,,,,,,,,,,,,,,,,,,,,,,,,,,,,,,,,,,,,,,,,,,,,,,,,,,,,,,,,,,,,,,,,,,,,,,,,,,,,,,,,,,,,,,,,,,,,,,,,,,,,,,,,,,,,,,,,,,,,,,,,,,,,,2024_AAU_40107_1,Urgent/2024/17039(Part-I) dated 28-10-2024,"Construction of Boundary Wall cum Chain link fencing at SCSCA, AAU, Dhubri"
