Organisation Chain,Tender Reference Number,Tender ID,Withdrawal Allowed,Tender Type,Form of contract,Tender Category,No. of Covers,General Technical Evaluation Allowed,ItemWise Technical Evaluation Allowed,Payment Mode,Is Multi Currency Allowed For BOQ,Is Multi Currency Allowed For Fee,Allow Two Stage Bidding,Cover No,Cover,Document Type,Description,Publish Date,Bid Opening Date,Document Download / Sale Start Date,Document Download / Sale End Date,Clarification Start Date,Clarification End Date,Bid Submission Start Date,Bid Submission End Date,EMD Amount in ₹,EMD Exemption Allowed,EMD Fee Type,EMD Percentage,EMD Payable To,EMD Payable At,S.No,Corrigendum Title,Corrigendum Type,View,Tender Fee in ₹,Fee Payable To,Fee Payable At,Tender Fee Exemption Allowed,Name,Address,Title,Work Description,Pre Qualification Details,Independent External Monitor/Remarks,Tender Value in ₹,Product Category,Sub category,Contract Type,Bid Validity(Days),Period Of Work(Days),Location,Pincode,Pre Bid Meeting Place,Pre Bid Meeting Address,Pre Bid Meeting Date,Bid Opening Place,Should Allow NDA Tender,Allow Preferential Bidder,Organisation Chain,Tender Reference Number,Tender ID,Withdrawal Allowed,Tender Type,Form of contract,Tender Category,No. of Covers,General Technical Evaluation Allowed,ItemWise Technical Evaluation Allowed,Payment Mode,Is Multi Currency Allowed For BOQ,Is Multi Currency Allowed For Fee,Allow Two Stage Bidding,Cover No,Cover,Document Type,Description,Publish Date,Bid Opening Date,Document Download / Sale Start Date,Document Download / Sale End Date,Clarification Start Date,Clarification End Date,Bid Submission Start Date,Bid Submission End Date,EMD Amount in ₹,EMD Exemption Allowed,EMD Fee Type,EMD Percentage,EMD Payable To,EMD Payable At,S.No,Corrigendum Title,Corrigendum Type,View,Tender Fee in ₹,Fee Payable To,Fee Payable At,Tender Fee Exemption Allowed,Name,Address,Title,Work Description,Pre Qualification Details,Independent External Monitor/Remarks,Tender Value in ₹,Product Category,Sub category,Contract Type,Bid Validity(Days),Period Of Work(Days),Location,Pincode,Pre Bid Meeting Place,Pre Bid Meeting Address,Pre Bid Meeting Date,Bid Opening Place,Should Allow NDA Tender,Allow Preferential Bidder,Contract Date :,Contract Value :,Work Completion Period in days :,Updated By :,Updated on :,AOC document :,AOC Description :,S.No.1,Bid Number,Bidder Name,Awarded Currency,Awarded Value,S.No.2,Bid Number.1,Bidder Name.1,Submitted Date,Status,Remarks,Status Updated On,Type :,Summary :,Updated By :.1,Updated On :,Document :,BOQ Comparative Chart :,Committee Chairperson/Co-ordinator Name :,Committee Chairperson/Co-ordinator Type :,Committee Members :,Updated By :.2,Updated on :.1,Document :.1,S.No.3,Bid Number.2,Bidder Name.2,Value,Rank,Committee Chairperson/Co-ordinator Name :.1,Committee Chairperson/Co-ordinator Type :.1,Committee Members :.1,Updated By :.3,Updated On :.1,Document :.2,Tender ID :,Tender Ref No :,Tender Title :
Department of Water Resources||Flood and River Erosion Management Agency of Assam,FREMAA_CW5_CAR PARKING SHED,2023_DoWR_34900_1,Yes,Open Tender,Item Rate,Works,1.0,No,No,Not Applicable,No,No,No,1.0,Fee/PreQual/Technical/Finance,.pdf,Quotation - Technical Part,22-Dec-2023 03:00 PM,22-Jan-2024 03:00 PM,22-Dec-2023 03:00 PM,22-Jan-2024 02:00 PM,22-Dec-2023 03:00 PM ,28-Dec-2023 05:00 PM ,22-Dec-2023 04:00 PM,22-Jan-2024 02:00 PM,0.0,No,fixed,,Nil,Nil,1.0,Time Extension-II,Date,,0.0,Nil,Nil,No,"CEO, FREMAA","4th Floor, Assam Water Centre, Basistha Chariali, NH 27, Guwahati, Assam-781029","Construction of Car Parking Shed at Assam Water Centre, Basistha, Guwahati-29","Construction of Car Parking Shed at Assam Water Centre, Basistha, Guwahati-29",Please refer to Tender Documents ,NA ,"13,59,000",Civil Works,NA ,Tender,45.0,60.0,Guwahati,781029.0,Conference Hall of FREMAA ,"4th Floor, Assam Water Centre, Basistha Chariali, NH 27, Guwahati, Assam-781029 ",29-Dec-2023 01:00 PM ,FREMAA Office,No ,No,Department of Water Resources||Flood and River Erosion Management Agency of Assam,FREMAA_CW5_CAR PARKING SHED,2023_DoWR_34900_1,Yes,Open Tender,Item Rate,Works,1.0,No,No,Not Applicable,No,No,No,1.0,Fee/PreQual/Technical/Finance,.pdf,Quotation - Technical Part,22-Dec-2023 03:00 PM,22-Jan-2024 03:00 PM,22-Dec-2023 03:00 PM,22-Jan-2024 02:00 PM,22-Dec-2023 03:00 PM ,28-Dec-2023 05:00 PM ,22-Dec-2023 04:00 PM,22-Jan-2024 02:00 PM,0.0,No,fixed,,Nil,Nil,1.0,Time Extension-II,Date,,0.0,Nil,Nil,No,"CEO, FREMAA","4th Floor, Assam Water Centre, Basistha Chariali, NH 27, Guwahati, Assam-781029","Construction of Car Parking Shed at Assam Water Centre, Basistha, Guwahati-29","Construction of Car Parking Shed at Assam Water Centre, Basistha, Guwahati-29",Please refer to Tender Documents ,NA ,"13,59,000",Civil Works,NA ,Tender,45.0,60.0,Guwahati,781029.0,Conference Hall of FREMAA ,"4th Floor, Assam Water Centre, Basistha Chariali, NH 27, Guwahati, Assam-781029 ",29-Dec-2023 01:00 PM ,FREMAA Office,No ,No,20-Aug-2024,"INR 1,358,585.1",60.0,Bhaskar Jyoti Das,09-Dec-2024 02:10 PM,LOACarShed.pdf (397.00 KB),M/s Tikendrajit Moran is the lowest quoted substantially responsive bidder.,1.0,221082.0,Tikandrajit Moran,INR,"1,358,585.1",1.0,221771.0,PRABIR MANDAL,22-Jan-2024 01:54 PM,Rejected-Technical,Quoted price is more than lowest evaluated substantially responsive bidder,20-Aug-2024 05:31 PM,Finance,Bid Opening Summary,Bhaskar Jyoti Das,16-Feb-2024 12:30 PM,finance_56605.pdf,BOQ Comparative Chart,DEOT-FREMAA,Internal,,Bhaskar Jyoti Das,20-Aug-2024 05:33 PM,finsummary_56605.pdf (937.30 KB),1.0,221082.0,Tikandrajit Moran,"13,58,585.10",L1,DEOT-FREMAA,Internal,,Bhaskar Jyoti Das,20-Aug-2024 05:31 PM,techsummary_56605.pdf (937.30 KB),,,
,,,,,,,,,,,,,,,,.pdf,Quotation - Financial Part,,,,,,,,,,,,,,,,,,,,,,,,,,,,,,,,,,,,,,,,,,,,,,,,,,,,,,,,,,,.pdf,Quotation - Financial Part,,,,,,,,,,,,,,,,,,,,,,,,,,,,,,,,,,,,,,,,,,,,,,,,,,,,,,,2.0,221769.0,SULABH DOHUTIA,22-Jan-2024 01:41 PM,Rejected-Technical,Quoted price is more than lowest evaluated substantially responsive bidder,20-Aug-2024 05:31 PM,,,,,,,,,,,,,,,,,,,,,,,,,,
,,,,,,,,,,,,,,,,.pdf,Supporting Documents,,,,,,,,,,,,,,,,,,,,,,,,,,,,,,,,,,,,,,,,,,,,,,,,,,,,,,,,,,,.pdf,Supporting Documents,,,,,,,,,,,,,,,,,,,,,,,,,,,,,,,,,,,,,,,,,,,,,,,,,,,,,,,3.0,221082.0,Tikandrajit Moran,22-Jan-2024 01:59 PM,Accepted-AOC,M/s Tikendrajit Moran is lowest quoted substantially responsive Bidder.,09-Dec-2024 02:11 PM,,,,,,,,,,,,,,,,,,,,,,,,,,
,,,,,,,,,,,,,,,,.xls,BoQ Sheet,,,,,,,,,,,,,,,,,,,,,,,,,,,,,,,,,,,,,,,,,,,,,,,,,,,,,,,,,,,.xls,BoQ Sheet,,,,,,,,,,,,,,,,,,,,,,,,,,,,,,,,,,,,,,,,,,,,,,,,,,,,,,,,,,,,,,,,,,,,,,,,,,,,,,,,,,,,,,,
,,,,,,,,,,,,,,,,,,,,,,,,,,,,,,,,,,,,,,,,,,,,,,,,,,,,,,,,,,,,,,,,,,,,,,,,,,,,,,,,,,,,,,,,,,,,,,,,,,,,,,,,,,,,,,,,,,,,,,,,,,,,,,,,,,,,,,,,,,,,,,,,,,,,,,,,,,,,,,,,,,2023_DoWR_34900_1,FREMAA_CW5_CAR PARKING SHED,"Construction of Car Parking Shed at Assam Water Centre, Basistha, Guwahati-29"
