Organisation Chain,Tender Reference Number,Tender ID,Withdrawal Allowed,Tender Type,Form of contract,Tender Category,No. of Covers,General Technical Evaluation Allowed,ItemWise Technical Evaluation Allowed,Payment Mode,Is Multi Currency Allowed For BOQ,Is Multi Currency Allowed For Fee,Allow Two Stage Bidding,Cover No,Cover,Document Type,Description,Publish Date,Bid Opening Date,Document Download / Sale Start Date,Document Download / Sale End Date,Clarification Start Date,Clarification End Date,Bid Submission Start Date,Bid Submission End Date,Financial Bid Opening Date,EMD Amount in ₹,EMD Exemption Allowed,EMD Fee Type,EMD Percentage,EMD Payable To,EMD Payable At,S.No,Bank Name,Tender Fee in ₹,Fee Payable To,Fee Payable At,Tender Fee Exemption Allowed,Name,Address,Title,Work Description,Pre Qualification Details,Independent External Monitor/Remarks,Tender Value in ₹,Product Category,Sub category,Contract Type,Bid Validity(Days),Period Of Work(Days),Location,Pincode,Pre Bid Meeting Place,Pre Bid Meeting Address,Pre Bid Meeting Date,Bid Opening Place,Should Allow NDA Tender,Allow Preferential Bidder,Organisation Chain,Tender Reference Number,Tender ID,Withdrawal Allowed,Tender Type,Form of contract,Tender Category,No. of Covers,General Technical Evaluation Allowed,ItemWise Technical Evaluation Allowed,Payment Mode,Is Multi Currency Allowed For BOQ,Is Multi Currency Allowed For Fee,Allow Two Stage Bidding,Cover No,Cover,Document Type,Description,Publish Date,Bid Opening Date,Document Download / Sale Start Date,Document Download / Sale End Date,Clarification Start Date,Clarification End Date,Bid Submission Start Date,Bid Submission End Date,Financial Bid Opening Date,EMD Amount in ₹,EMD Exemption Allowed,EMD Fee Type,EMD Percentage,EMD Payable To,EMD Payable At,S.No,Bank Name,Tender Fee in ₹,Fee Payable To,Fee Payable At,Tender Fee Exemption Allowed,Name,Address,Title,Work Description,Pre Qualification Details,Independent External Monitor/Remarks,Tender Value in ₹,Product Category,Sub category,Contract Type,Bid Validity(Days),Period Of Work(Days),Location,Pincode,Pre Bid Meeting Place,Pre Bid Meeting Address,Pre Bid Meeting Date,Bid Opening Place,Should Allow NDA Tender,Allow Preferential Bidder,Contract Date :,Contract Value :,Work Completion Period in days :,Updated By :,Updated on :,AOC document :,S.No.1,Bid Number,Bidder Name,Awarded Currency,Awarded Value,S.No.2,Bid Number.1,Bidder Name.1,Submitted Date,Status,Remarks,Status Updated On,Type :,Summary :,Updated By :.1,Updated On :,Document :,BOQ Comparative Chart :,Committee Chairperson/Co-ordinator Name :,Committee Chairperson/Co-ordinator Type :,Committee Members :,Updated By :.2,Updated on :.1,Document :.1,S.No.3,Bid Number.2,Bidder Name.2,Value,Rank,Type :.1,Summary :.1,Updated By :.3,Updated On :.1,Document :.2,Committee Chairperson/Co-ordinator Name :.1,Committee Chairperson/Co-ordinator Type :.1,Committee Members :.1,Updated By :.4,Updated On :.2,Financial Bid Opening Date:,Document :.3,Tender ID :,Tender Ref No :,Tender Title :
General Administration Department||Directorate of Archives,298492/80 dated 08/08/2024,2024_GAD_38386_1,Yes,Open Tender,Works,Works,2.0,No,No,Online,No,No,No,1.0,Fee/PreQual/Technical,.pdf,Signed copy of RFP,08-Aug-2024 05:00 PM,28-Aug-2024 12:00 PM,08-Aug-2024 05:00 PM,27-Aug-2024 02:00 PM,08-Aug-2024 05:00 PM ,14-Aug-2024 12:30 PM ,20-Aug-2024 12:00 PM,27-Aug-2024 02:00 PM,13-Sep-2024 03:00 PM,"1,00,000",No,fixed,,Nil,Nil,1.0,SBI Bank,"2,000",Nil,Nil,No,The Director DASA,The Directorate of Archives Assam Dispur Guwahati 06,IT Solutions for Directorate of Archives Assam including scanning and Portal development and supply of Hardware Items,IT Solutions for Directorate of Archives Assam including scanning and Portal development and supply of Hardware Items,Refer RFP ,NA ,,Miscellaneous Works,IT solutions  ,Tender,180.0,365.0,Dispur,781006.0,NA ,NA ,NA ,Directorate of Archives Assam Dispur,No ,No,General Administration Department||Directorate of Archives,298492/80 dated 08/08/2024,2024_GAD_38386_1,Yes,Open Tender,Works,Works,2.0,No,No,Online,No,No,No,1.0,Fee/PreQual/Technical,.pdf,Signed copy of RFP,08-Aug-2024 05:00 PM,28-Aug-2024 12:00 PM,08-Aug-2024 05:00 PM,27-Aug-2024 02:00 PM,08-Aug-2024 05:00 PM ,14-Aug-2024 12:30 PM ,20-Aug-2024 12:00 PM,27-Aug-2024 02:00 PM,13-Sep-2024 03:00 PM,"1,00,000",No,fixed,,Nil,Nil,1.0,SBI Bank,"2,000",Nil,Nil,No,The Director DASA,The Directorate of Archives Assam Dispur Guwahati 06,IT Solutions for Directorate of Archives Assam including scanning and Portal development and supply of Hardware Items,IT Solutions for Directorate of Archives Assam including scanning and Portal development and supply of Hardware Items,Refer RFP ,NA ,,Miscellaneous Works,IT solutions  ,Tender,180.0,365.0,Dispur,781006.0,NA ,NA ,NA ,Directorate of Archives Assam Dispur,No ,No,05-Nov-2024,"INR 7,000,000",365.0,Mukul Das,13-Dec-2024 04:55 PM,WO.pdf (320.00 KB),1.0,237397.0,Assam Electronics Development Corporation Limited,INR,"7,000,000",1.0,237397.0,Assam Electronics Development Corporation Limited,23-Aug-2024 01:11 PM,Accepted-AOC,L1,13-Dec-2024 04:55 PM,Finance,Financial Bids opened,Paresh Chandra Brahma,13-Sep-2024 04:04 PM,None,BOQ Comparative Chart,"Binita Pegu, IAS",Internal,,Paresh Chandra Brahma,24-Sep-2024 04:46 PM,finsummary_62218.pdf (4346.97 KB),1.0,237397.0,Assam Electronics Development Corporation Limited,"19,47,193.23",1.0,Technical,Technical Bids opened,Paresh Chandra Brahma,28-Aug-2024 12:35 PM,None,"Binita Pegu, IAS",Internal,,Mukul Das,13-Sep-2024 02:57 PM,13-Sep-2024 03:00 PM,techsummary_62218.pdf (2690.57 KB),,,
,,,,,,,,,,,,,,,,.pdf,EMD and Tender Processing Fee Particulars,,,,,,,,,,,,,,,,,,,,,,,,,,,,,,,,,,,,,,,,,,,,,,,,,,,,,,,,,,.pdf,EMD and Tender Processing Fee Particulars,,,,,,,,,,,,,,,,,,,,,,,,,,,,,,,,,,,,,,,,,,,,,,,,,,,,,2.0,237863.0,Data Strategies Interchange India Private Limited,27-Aug-2024 12:50 PM,Rejected-Technical,Technically Disqualified,13-Sep-2024 02:57 PM,,,,,,,,,,,,,2.0,237426.0,SBL Knowledge Services Pvt Ltd,"16,00,788.00",2.0,,,,,,,,,,,,,,,
,,,,,,,,,,,,,,,,.pdf,Compliance and Technical Bid Documents,,,,,,,,,,,,,,,,,,,,,,,,,,,,,,,,,,,,,,,,,,,,,,,,,,,,,,,,,,.pdf,Compliance and Technical Bid Documents,,,,,,,,,,,,,,,,,,,,,,,,,,,,,,,,,,,,,,,,,,,,,,,,,,,,,3.0,237765.0,NEVAEH TECHNOLOGY PVT LTD,27-Aug-2024 01:39 PM,Rejected-Finance,L3 Bidder based on the Final Score,24-Sep-2024 04:46 PM,,,,,,,,,,,,,3.0,237765.0,NEVAEH TECHNOLOGY PVT LTD,"26,79,566.25",3.0,,,,,,,,,,,,,,,
,,,,,,,,,,,,,,2.0,Finance,.xls,Price Bid,,,,,,,,,,,,,,,,,,,,,,,,,,,,,,,,,,,,,,,,,,,,,,,,,,,,,,,,2.0,Finance,.xls,Price Bid,,,,,,,,,,,,,,,,,,,,,,,,,,,,,,,,,,,,,,,,,,,,,,,,,,,,,4.0,237426.0,SBL Knowledge Services Pvt Ltd,27-Aug-2024 01:25 PM,Rejected-Finance,L2 Bidder based on the Final Score,24-Sep-2024 04:46 PM,,,,,,,,,,,,,,,,,,,,,,,,,,,,,,,,
,,,,,,,,,,,,,,,,,,,,,,,,,,,,,,,,,,,,,,,,,,,,,,,,,,,,,,,,,,,,,,,,,,,,,,,,,,,,,,,,,,,,,,,,,,,,,,,,,,,,,,,,,,,,,,,,,,,,,,,,,,,,,,,,,,,,,,,,,,,,,,,,,,,,,,,,,,,,,,,,,,,,,2024_GAD_38386_1,298492/80 dated 08/08/2024,IT Solutions for Directorate of Archives Assam including scanning and Portal development and supply of Hardware Items
