Organisation Chain,Tender Reference Number,Tender ID,Withdrawal Allowed,Tender Type,Form of contract,Tender Category,No. of Covers,General Technical Evaluation Allowed,ItemWise Technical Evaluation Allowed,Payment Mode,Is Multi Currency Allowed For BOQ,Is Multi Currency Allowed For Fee,Allow Two Stage Bidding,Cover No,Cover,Document Type,Description,Publish Date,Bid Opening Date,Document Download / Sale Start Date,Document Download / Sale End Date,Clarification Start Date,Clarification End Date,Bid Submission Start Date,Bid Submission End Date,Financial Bid Opening Date,EMD Amount in ₹,EMD Exemption Allowed,EMD Fee Type,EMD Percentage,EMD Payable To,EMD Payable At,S.No,Bank Name,Tender Fee in ₹,Fee Payable To,Fee Payable At,Tender Fee Exemption Allowed,Name,Address,Title,Work Description,Pre Qualification Details,Independent External Monitor/Remarks,Tender Value in ₹,Product Category,Sub category,Contract Type,Bid Validity(Days),Period Of Work(Days),Location,Pincode,Pre Bid Meeting Place,Pre Bid Meeting Address,Pre Bid Meeting Date,Bid Opening Place,Should Allow NDA Tender,Allow Preferential Bidder,Organisation Chain,Tender Reference Number,Tender ID,Withdrawal Allowed,Tender Type,Form of contract,Tender Category,No. of Covers,General Technical Evaluation Allowed,ItemWise Technical Evaluation Allowed,Payment Mode,Is Multi Currency Allowed For BOQ,Is Multi Currency Allowed For Fee,Allow Two Stage Bidding,Cover No,Cover,Document Type,Description,Publish Date,Bid Opening Date,Document Download / Sale Start Date,Document Download / Sale End Date,Clarification Start Date,Clarification End Date,Bid Submission Start Date,Bid Submission End Date,Financial Bid Opening Date,EMD Amount in ₹,EMD Exemption Allowed,EMD Fee Type,EMD Percentage,EMD Payable To,EMD Payable At,S.No,Bank Name,Tender Fee in ₹,Fee Payable To,Fee Payable At,Tender Fee Exemption Allowed,Name,Address,Title,Work Description,Pre Qualification Details,Independent External Monitor/Remarks,Tender Value in ₹,Product Category,Sub category,Contract Type,Bid Validity(Days),Period Of Work(Days),Location,Pincode,Pre Bid Meeting Place,Pre Bid Meeting Address,Pre Bid Meeting Date,Bid Opening Place,Should Allow NDA Tender,Allow Preferential Bidder,Contract Date :,Contract Value :,Work Completion Period in days :,Updated By :,Updated on :,AOC document :,AOC Description :,S.No.1,Bid Number,Bidder Name,Awarded Currency,Awarded Value,S.No.2,Bid Number.1,Bidder Name.1,Submitted Date,Status,Remarks,Status Updated On,Type :,Summary :,Updated By :.1,Updated On :,Document :,BOQ Comparative Chart :,Committee Chairperson/Co-ordinator Name :,Committee Chairperson/Co-ordinator Type :,Committee Members :,Updated By :.2,Updated on :.1,Document :.1,S.No.3,Bid Number.2,Bidder Name.2,Value,Rank,Type :.1,Summary :.1,Updated By :.3,Updated On :.1,Document :.2,Committee Chairperson/Co-ordinator Name :.1,Committee Chairperson/Co-ordinator Type :.1,Committee Members :.1,Updated By :.4,Updated On :.2,Financial Bid Opening Date:,Document :.3,Tender ID :,Tender Ref No :,Tender Title :
Welfare of Plain Tribes and Backward Classes||Director - WPT and BC||Assam Plains Tribes Development Corporation Ltd.,PTDC/Engg/2023-24/244,2024_WPTBC_39878_1,Yes,Open Tender,Item Rate,Works,2.0,No,No,Online,No,No,No,1.0,Fee/PreQual/Technical,.pdf,Technical document,09-Oct-2024 06:00 PM,01-Nov-2024 03:30 PM,11-Oct-2024 11:00 AM,01-Nov-2024 03:00 PM,NA ,NA ,15-Oct-2024 11:00 AM,01-Nov-2024 03:00 PM,29-Nov-2024 04:45 PM,"1,00,000",Yes,fixed,,Nil,Nil,1.0,SBI Bank,"1,000",Nil,Nil,No,Managing Director,"Managing Director APTDC Ltd. Ganeshguri, Guwahati-5",Proposal for Administrative Approval of Rs.50.00 Lakh for construction of,"Proposal for Administrative Approval of Rs.50.00 Lakh for construction of additional classroom at Rangsina Collage, West Karbi Anglong.",Please refer Tender documents. ,NA ,"50,00,000",Civil Works,NA ,Tender,120.0,270.0,"Rangsina Collage, West Karbi Anglong.",782460.0,NA ,NA ,NA ,Online,No ,No,Welfare of Plain Tribes and Backward Classes||Director - WPT and BC||Assam Plains Tribes Development Corporation Ltd.,PTDC/Engg/2023-24/244,2024_WPTBC_39878_1,Yes,Open Tender,Item Rate,Works,2.0,No,No,Online,No,No,No,1.0,Fee/PreQual/Technical,.pdf,Technical document,09-Oct-2024 06:00 PM,01-Nov-2024 03:30 PM,11-Oct-2024 11:00 AM,01-Nov-2024 03:00 PM,NA ,NA ,15-Oct-2024 11:00 AM,01-Nov-2024 03:00 PM,29-Nov-2024 04:45 PM,"1,00,000",Yes,fixed,,Nil,Nil,1.0,SBI Bank,"1,000",Nil,Nil,No,Managing Director,"Managing Director APTDC Ltd. Ganeshguri, Guwahati-5",Proposal for Administrative Approval of Rs.50.00 Lakh for construction of,"Proposal for Administrative Approval of Rs.50.00 Lakh for construction of additional classroom at Rangsina Collage, West Karbi Anglong.",Please refer Tender documents. ,NA ,"50,00,000",Civil Works,NA ,Tender,120.0,270.0,"Rangsina Collage, West Karbi Anglong.",782460.0,NA ,NA ,NA ,Online,No ,No,16-Dec-2024,"INR 4,500,000",270.0,Jeena Gabison Ahmed,16-Dec-2024 03:08 PM,RangsinaAoc.pdf (1255.00 KB),AOC,1.0,246586.0,Devajit Kutum,INR,"4,500,000",1.0,246586.0,Devajit Kutum,29-Oct-2024 05:07 PM,Accepted-AOC,Awarded,16-Dec-2024 03:08 PM,Finance,Financial bid has been opened,Dipak Kumar Gayary,29-Nov-2024 04:54 PM,None,BOQ Comparative Chart,Chief Engineer,Internal,Chief Engineer,Jeena Gabison Ahmed,16-Dec-2024 02:59 PM,finsummary_64625.pdf (1255.21 KB),1.0,246586.0,Devajit Kutum,"45,00,000.00",L1,Technical,Technical bid has been opened,Dipak Kumar Gayary,20-Nov-2024 02:03 PM,None,Dilip Kr. Deka,Internal,Dilip Kr. Deka,Jeena Gabison Ahmed,29-Nov-2024 04:40 PM,29-Nov-2024 04:45 PM,techsummary_64625.pdf (920.42 KB),,,
,,,,,,,,,,,,,,,,.pdf,Bid documents to be downloaded from the portal,,,,,,,,,,,,,,,,,,,,,,,,,,,,,,,,,,,,,,,,,,,,,,,,,,,,,,,,,,.pdf,Bid documents to be downloaded from the portal,,,,,,,,,,,,,,,,,,,,,,,,,,,,,,,,,,,,,,,,,,,,,,,,,,,,,,2.0,246868.0,Jintu Kumar Deori,29-Oct-2024 07:01 PM,Rejected-AOC,Not Awarded,16-Dec-2024 03:08 PM,,,,,,,,,,,,,2.0,246868.0,Jintu Kumar Deori,"52,50,000.00",L3,,,,,,,,,,,,,,,
,,,,,,,,,,,,,,2.0,Finance,.xls,BOQ,,,,,,,,,,,,,,,,,,,,,,,,,,,,,,,,,,,,,,,,,,,,,,,,,,,,,,,,2.0,Finance,.xls,BOQ,,,,,,,,,,,,,,,,,,,,,,,,,,,,,,,,,,,,,,,,,,,,,,,,,,,,,,3.0,247451.0,MANISHA SAIKIA,30-Oct-2024 08:17 PM,Rejected-AOC,Not Awarded,16-Dec-2024 03:08 PM,,,,,,,,,,,,,3.0,247451.0,MANISHA SAIKIA,"45,00,000.00",L1,,,,,,,,,,,,,,,
,,,,,,,,,,,,,,,,,,,,,,,,,,,,,,,,,,,,,,,,,,,,,,,,,,,,,,,,,,,,,,,,,,,,,,,,,,,,,,,,,,,,,,,,,,,,,,,,,,,,,,,,,,,,,,,,,,,,,,,,,,,,,,,,,,4.0,247457.0,PRANJAL GOGOI,30-Oct-2024 08:05 PM,Rejected-AOC,Not Awarded,16-Dec-2024 03:08 PM,,,,,,,,,,,,,4.0,247457.0,PRANJAL GOGOI,"50,00,000.00",L2,,,,,,,,,,,,,,,
,,,,,,,,,,,,,,,,,,,,,,,,,,,,,,,,,,,,,,,,,,,,,,,,,,,,,,,,,,,,,,,,,,,,,,,,,,,,,,,,,,,,,,,,,,,,,,,,,,,,,,,,,,,,,,,,,,,,,,,,,,,,,,,,,,,,,,,,,,,,,,,,,,,,,,,,,,,,,,,,,,,,,,2024_WPTBC_39878_1,PTDC/Engg/2023-24/244,Proposal for Administrative Approval of Rs.50.00 Lakh for construction of
