Organisation Chain,Tender Reference Number,Tender ID,Withdrawal Allowed,Tender Type,Form of contract,Tender Category,No. of Covers,General Technical Evaluation Allowed,ItemWise Technical Evaluation Allowed,Payment Mode,Is Multi Currency Allowed For BOQ,Is Multi Currency Allowed For Fee,Allow Two Stage Bidding,Cover No,Cover,Document Type,Description,Publish Date,Bid Opening Date,Document Download / Sale Start Date,Document Download / Sale End Date,Clarification Start Date,Clarification End Date,Bid Submission Start Date,Bid Submission End Date,Financial Bid Opening Date,EMD Amount in ₹,EMD Exemption Allowed,EMD Fee Type,EMD Percentage,EMD Payable To,EMD Payable At,S.No,Bank Name,Tender Fee in ₹,Fee Payable To,Fee Payable At,Tender Fee Exemption Allowed,Name,Address,Title,Work Description,Pre Qualification Details,Independent External Monitor/Remarks,Tender Value in ₹,Product Category,Sub category,Contract Type,Bid Validity(Days),Period Of Work(Days),Location,Pincode,Pre Bid Meeting Place,Pre Bid Meeting Address,Pre Bid Meeting Date,Bid Opening Place,Should Allow NDA Tender,Allow Preferential Bidder,Organisation Chain,Tender Reference Number,Tender ID,Withdrawal Allowed,Tender Type,Form of contract,Tender Category,No. of Covers,General Technical Evaluation Allowed,ItemWise Technical Evaluation Allowed,Payment Mode,Is Multi Currency Allowed For BOQ,Is Multi Currency Allowed For Fee,Allow Two Stage Bidding,Cover No,Cover,Document Type,Description,Publish Date,Bid Opening Date,Document Download / Sale Start Date,Document Download / Sale End Date,Clarification Start Date,Clarification End Date,Bid Submission Start Date,Bid Submission End Date,Financial Bid Opening Date,EMD Amount in ₹,EMD Exemption Allowed,EMD Fee Type,EMD Percentage,EMD Payable To,EMD Payable At,S.No,Bank Name,Tender Fee in ₹,Fee Payable To,Fee Payable At,Tender Fee Exemption Allowed,Name,Address,Title,Work Description,Pre Qualification Details,Independent External Monitor/Remarks,Tender Value in ₹,Product Category,Sub category,Contract Type,Bid Validity(Days),Period Of Work(Days),Location,Pincode,Pre Bid Meeting Place,Pre Bid Meeting Address,Pre Bid Meeting Date,Bid Opening Place,Should Allow NDA Tender,Allow Preferential Bidder,Contract Date :,Contract Value :,Work Completion Period in days :,Updated By :,Updated on :,AOC document :,AOC Description :,S.No.1,Bid Number,Bidder Name,Awarded Currency,Awarded Value,S.No.2,Bid Number.1,Bidder Name.1,Submitted Date,Status,Remarks,Status Updated On,Type :,Summary :,Updated By :.1,Updated On :,Document :,BOQ Comparative Chart :,Committee Chairperson/Co-ordinator Name :,Committee Chairperson/Co-ordinator Type :,Committee Members :,Updated By :.2,Updated on :.1,Document :.1,S.No.3,Bid Number.2,Bidder Name.2,Value,Rank,Type :.1,Summary :.1,Updated By :.3,Updated On :.1,Document :.2,Committee Chairperson/Co-ordinator Name :.1,Committee Chairperson/Co-ordinator Type :.1,Committee Members :.1,Updated By :.4,Updated On :.2,Financial Bid Opening Date:,Document :.3,Tender ID :,Tender Ref No :,Tender Title :
Public Works Roads Department,T/CC/ETN/SIL/2024-25/311(T),2024_PWD_39902_1,Yes,Open Tender,Item Rate,Works,2.0,No,No,Online,No,No,No,1.0,Fee/PreQual/Technical,.pdf,Technical Qualification Document,15-Oct-2024 09:00 AM,25-Oct-2024 03:10 PM,15-Oct-2024 10:00 AM,25-Oct-2024 03:00 PM,15-Oct-2024 10:00 AM ,21-Oct-2024 03:00 PM ,15-Oct-2024 10:00 AM,25-Oct-2024 03:00 PM,26-Nov-2024 09:00 AM,"1,07,620",Yes,fixed,,Nil,Nil,1.0,SBI Bank,"1,080",Nil,Nil,No,"S.E., PWD(Roads) Cachar Circle, Silchar.","O/o The S.E., PWD(Roads) Cachar Circle, Silchar.","Construction of Road from SMC(OPD) to Tata Cancer Care Hospital under SOPD-G for the year 2023-24, Sonai LAC, Package No.SE/SONAI/SOPD-G/23-24/1","Construction of Road from SMC(OPD) to Tata Cancer Care Hospital under SOPD-G for the year 2023-24, Sonai LAC, Package No.SE/SONAI/SOPD-G/23-24/1",Please refer Tender documents. ,NA ,"53,81,000",Civil Works – Roads,NA ,Rate Contract,180.0,120.0,Cachar District,788119.0,NA ,NA ,NA ,"O/o The S.E., PWD(Roads) Cachar Circle, Silchar",No ,No,Public Works Roads Department,T/CC/ETN/SIL/2024-25/311(T),2024_PWD_39902_1,Yes,Open Tender,Item Rate,Works,2.0,No,No,Online,No,No,No,1.0,Fee/PreQual/Technical,.pdf,Technical Qualification Document,15-Oct-2024 09:00 AM,25-Oct-2024 03:10 PM,15-Oct-2024 10:00 AM,25-Oct-2024 03:00 PM,15-Oct-2024 10:00 AM ,21-Oct-2024 03:00 PM ,15-Oct-2024 10:00 AM,25-Oct-2024 03:00 PM,26-Nov-2024 09:00 AM,"1,07,620",Yes,fixed,,Nil,Nil,1.0,SBI Bank,"1,080",Nil,Nil,No,"S.E., PWD(Roads) Cachar Circle, Silchar.","O/o The S.E., PWD(Roads) Cachar Circle, Silchar.","Construction of Road from SMC(OPD) to Tata Cancer Care Hospital under SOPD-G for the year 2023-24, Sonai LAC, Package No.SE/SONAI/SOPD-G/23-24/1","Construction of Road from SMC(OPD) to Tata Cancer Care Hospital under SOPD-G for the year 2023-24, Sonai LAC, Package No.SE/SONAI/SOPD-G/23-24/1",Please refer Tender documents. ,NA ,"53,81,000",Civil Works – Roads,NA ,Rate Contract,180.0,120.0,Cachar District,788119.0,NA ,NA ,NA ,"O/o The S.E., PWD(Roads) Cachar Circle, Silchar",No ,No,06-Dec-2024,"INR 5,381,000",120.0,Hema Kanta Nath,06-Dec-2024 11:23 PM,CS.pdf (1642.00 KB),Accepted,1.0,246293.0,ANSARUL HOQUE LASKAR,INR,"5,381,000",1.0,246293.0,ANSARUL HOQUE LASKAR,25-Oct-2024 11:45 AM,Accepted-AOC,Being the lowest bidder,06-Dec-2024 11:24 PM,Finance,Accepted,Hema Kanta Nath,06-Dec-2024 11:12 PM,finance_64728.pdf,BOQ Comparative Chart,"Ajit Kr. Das, S.E.,PWD(Roads) Cachar Circle, Silchar.",Internal,"Mimi Chakraborty, AEE(T/C), O/o The ACE, PWRD Barak Valley, Hema Kanta Nath, i/c AEE(T/C) O/o The SE,PWD(Rd) Cachar Circle Silchar, Jayendu Sen, AE, O/o The SE,PWD(Rd) Cachar Circle Silchar",Hema Kanta Nath,06-Dec-2024 11:18 PM,finsummary_64728.pdf (1642.11 KB),1.0,246261.0,Titu Kumar Das,"56,10,000.00",L2,Technical,Accepted,Hema Kanta Nath,25-Nov-2024 07:51 PM,technical_64728.pdf,"Ajit Kr. Das, S.E.,PWD(Roads) Cachar Circle, Silchar.",Internal,"Mimi Chakraborty, AEE(T/C), O/o The ACE, PWRD Barak Valley, Hema Kanta Nath, i/c AEE(T/C) O/o The SE,PWD(Rd) Cachar Circle Silchar, Jayendu Sen, AE, O/o The SE,PWD(Rd) Cachar Circle Silchar",Hema Kanta Nath,25-Nov-2024 07:56 PM,26-Nov-2024 09:00 AM,techsummary_64728.pdf (2238.20 KB),,,
,,,,,,,,,,,,,,,,.pdf,SBD,,,,,,,,,,,,,,,,,,,,,,,,,,,,,,,,,,,,,,,,,,,,,,,,,,,,,,,,,,.pdf,SBD,,,,,,,,,,,,,,,,,,,,,,,,,,,,,,,,,,,,,,,,,,,,,,,,,,,,,,2.0,246261.0,Titu Kumar Das,24-Oct-2024 06:18 PM,Rejected-AOC,Not Accepted being not the lowest bidder,06-Dec-2024 11:24 PM,,,,,,,,,,,,,2.0,246293.0,ANSARUL HOQUE LASKAR,"53,81,000.00",L1,,,,,,,,,,,,,,,
,,,,,,,,,,,,,,2.0,Finance,.pdf,FOB,,,,,,,,,,,,,,,,,,,,,,,,,,,,,,,,,,,,,,,,,,,,,,,,,,,,,,,,2.0,Finance,.pdf,FOB,,,,,,,,,,,,,,,,,,,,,,,,,,,,,,,,,,,,,,,,,,,,,,,,,,,,,,,,,,,,,,,,,,,,,,,,,,,,,,,,,,,,,,,,,,,,
,,,,,,,,,,,,,,,,.xls,BOQ,,,,,,,,,,,,,,,,,,,,,,,,,,,,,,,,,,,,,,,,,,,,,,,,,,,,,,,,,,.xls,BOQ,,,,,,,,,,,,,,,,,,,,,,,,,,,,,,,,,,,,,,,,,,,,,,,,,,,,,,,,,,,,,,,,,,,,,,,,,,,,,,,,,,,,,,,,,,,,
,,,,,,,,,,,,,,,,,,,,,,,,,,,,,,,,,,,,,,,,,,,,,,,,,,,,,,,,,,,,,,,,,,,,,,,,,,,,,,,,,,,,,,,,,,,,,,,,,,,,,,,,,,,,,,,,,,,,,,,,,,,,,,,,,,,,,,,,,,,,,,,,,,,,,,,,,,,,,,,,,,,,,,2024_PWD_39902_1,T/CC/ETN/SIL/2024-25/311(T),"Construction of Road from SMC(OPD) to Tata Cancer Care Hospital under SOPD-G for the year 2023-24, Sonai LAC, Package No.SE/SONAI/SOPD-G/23-24/1"
