Organisation Chain,Tender Reference Number,Tender ID,Withdrawal Allowed,Tender Type,Form of contract,Tender Category,No. of Covers,General Technical Evaluation Allowed,ItemWise Technical Evaluation Allowed,Payment Mode,Is Multi Currency Allowed For BOQ,Is Multi Currency Allowed For Fee,Allow Two Stage Bidding,Cover No,Cover,Document Type,Description,Publish Date,Bid Opening Date,Document Download / Sale Start Date,Document Download / Sale End Date,Clarification Start Date,Clarification End Date,Bid Submission Start Date,Bid Submission End Date,Financial Bid Opening Date,EMD Amount in ₹,EMD Exemption Allowed,EMD Fee Type,EMD Percentage,EMD Payable To,EMD Payable At,S.No,Bank Name,Tender Fee in ₹,Fee Payable To,Fee Payable At,Tender Fee Exemption Allowed,Name,Address,Title,Work Description,Pre Qualification Details,Independent External Monitor/Remarks,Tender Value in ₹,Product Category,Sub category,Contract Type,Bid Validity(Days),Period Of Work(Days),Location,Pincode,Pre Bid Meeting Place,Pre Bid Meeting Address,Pre Bid Meeting Date,Bid Opening Place,Should Allow NDA Tender,Allow Preferential Bidder,Organisation Chain,Tender Reference Number,Tender ID,Withdrawal Allowed,Tender Type,Form of contract,Tender Category,No. of Covers,General Technical Evaluation Allowed,ItemWise Technical Evaluation Allowed,Payment Mode,Is Multi Currency Allowed For BOQ,Is Multi Currency Allowed For Fee,Allow Two Stage Bidding,Cover No,Cover,Document Type,Description,Publish Date,Bid Opening Date,Document Download / Sale Start Date,Document Download / Sale End Date,Clarification Start Date,Clarification End Date,Bid Submission Start Date,Bid Submission End Date,Financial Bid Opening Date,EMD Amount in ₹,EMD Exemption Allowed,EMD Fee Type,EMD Percentage,EMD Payable To,EMD Payable At,S.No,Bank Name,Tender Fee in ₹,Fee Payable To,Fee Payable At,Tender Fee Exemption Allowed,Name,Address,Title,Work Description,Pre Qualification Details,Independent External Monitor/Remarks,Tender Value in ₹,Product Category,Sub category,Contract Type,Bid Validity(Days),Period Of Work(Days),Location,Pincode,Pre Bid Meeting Place,Pre Bid Meeting Address,Pre Bid Meeting Date,Bid Opening Place,Should Allow NDA Tender,Allow Preferential Bidder,Contract Date :,Contract Value :,Work Completion Period in days :,Updated By :,Updated on :,AOC document :,S.No.1,Bid Number,Bidder Name,Awarded Currency,Awarded Value,S.No.2,Bid Number.1,Bidder Name.1,Submitted Date,Status,Remarks,Status Updated On,Type :,Summary :,Updated By :.1,Updated On :,Document :,BOQ Comparative Chart :,Committee Chairperson/Co-ordinator Name :,Committee Chairperson/Co-ordinator Type :,Committee Members :,Updated By :.2,Updated on :.1,Document :.1,S.No.3,Bid Number.2,Bidder Name.2,Value,Rank,Type :.1,Summary :.1,Updated By :.3,Updated On :.1,Document :.2,Committee Chairperson/Co-ordinator Name :.1,Committee Chairperson/Co-ordinator Type :.1,Committee Members :.1,Updated By :.4,Updated On :.2,Financial Bid Opening Date:,Document :.3,Tender ID :,Tender Ref No :,Tender Title :
Public Works Roads Department,"CE/DEV/TB/211/2024-25/01 Dtd. Guwahati, 5th September, 2024",2024_PWD_38909_1,Yes,Open Tender,Item Rate,Works,2.0,No,No,Online,No,No,No,1.0,Fee/PreQual/Technical,.pdf,BID COST_BID SECURITY,25-Jan-2025 12:10 AM,28-Sep-2024 02:30 PM,09-Sep-2024 02:00 PM,28-Sep-2024 02:00 PM,09-Sep-2024 02:00 PM ,20-Sep-2024 12:00 PM ,21-Sep-2024 02:00 PM,28-Sep-2024 02:00 PM,08-Oct-2024 11:35 AM,"20,00,000",Yes,fixed,,Nil,Nil,1.0,SBI Bank,"20,000",Nil,Nil,No,"CE, PWD(Roads), Assam, Chandmari, Ghy-3","O/O The CE, PWD(Roads), Assam, Chandmari, Ghy-3",MMUPPNA-SOPD-G-24-25-01 Improvement of Amlokhi Kathiatoli Kampur Chaparmukh Raha Road (Amoni Tiniali to Raha College Road) (Between 16th Km and 22nd Km) under Mukhya Mantrir Unnato Pakipath Nirman Achani under SOPD-G for the year 2024-25,MMUPPNA-SOPD-G-24-25-01 Improvement of Amlokhi Kathiatoli Kampur Chaparmukh Raha Road (Amoni Tiniali to Raha College Road) (Between 16th Km and 22nd Km) under Mukhya Mantrir Unnato Pakipath Nirman Achani under SOPD-G for the year 2024-25,Please refer Tender documents. ,NA ,"10,00,00,000",Civil Works – Roads,NA ,Tender,180.0,365.0,Barhampur,782102.0,NA ,NA ,NA ,"O/O The CE, PWD(Roads), Assam, Chandmari, Ghy-3",No ,No,Public Works Roads Department,"CE/DEV/TB/211/2024-25/01 Dtd. Guwahati, 5th September, 2024",2024_PWD_38909_1,Yes,Open Tender,Item Rate,Works,2.0,No,No,Online,No,No,No,1.0,Fee/PreQual/Technical,.pdf,BID COST_BID SECURITY,25-Jan-2025 12:10 AM,28-Sep-2024 02:30 PM,09-Sep-2024 02:00 PM,28-Sep-2024 02:00 PM,09-Sep-2024 02:00 PM ,20-Sep-2024 12:00 PM ,21-Sep-2024 02:00 PM,28-Sep-2024 02:00 PM,08-Oct-2024 11:35 AM,"20,00,000",Yes,fixed,,Nil,Nil,1.0,SBI Bank,"20,000",Nil,Nil,No,"CE, PWD(Roads), Assam, Chandmari, Ghy-3","O/O The CE, PWD(Roads), Assam, Chandmari, Ghy-3",MMUPPNA-SOPD-G-24-25-01 Improvement of Amlokhi Kathiatoli Kampur Chaparmukh Raha Road (Amoni Tiniali to Raha College Road) (Between 16th Km and 22nd Km) under Mukhya Mantrir Unnato Pakipath Nirman Achani under SOPD-G for the year 2024-25,MMUPPNA-SOPD-G-24-25-01 Improvement of Amlokhi Kathiatoli Kampur Chaparmukh Raha Road (Amoni Tiniali to Raha College Road) (Between 16th Km and 22nd Km) under Mukhya Mantrir Unnato Pakipath Nirman Achani under SOPD-G for the year 2024-25,Please refer Tender documents. ,NA ,"10,00,00,000",Civil Works – Roads,NA ,Tender,180.0,365.0,Barhampur,782102.0,NA ,NA ,NA ,"O/O The CE, PWD(Roads), Assam, Chandmari, Ghy-3",No ,No,24-Dec-2024,"INR 99,983,159",365.0,Kritika Langthasa,24-Dec-2024 11:57 AM,SOPD1A.pdf (453.00 KB),1.0,240938.0,Ramawtar Agarwala,INR,"99,983,159",1.0,240938.0,Ramawtar Agarwala,26-Sep-2024 05:20 PM,Accepted-AOC,Awarded to L1 Bidder,24-Dec-2024 11:57 AM,Finance,Admitted,Kritika Langthasa,24-Dec-2024 11:42 AM,None,BOQ Comparative Chart,CE PWRD,Internal,,Kritika Langthasa,24-Dec-2024 11:47 AM,finsummary_63045.pdf (437.60 KB),1.0,240938.0,Ramawtar Agarwala,"9,99,83,159.00",L1,Technical,Admitted,Bhanita Kakati,08-Oct-2024 11:29 AM,technical_63045.pdf,"CE (Roads), PWD, Assam",Internal,,Bhanita Kakati,08-Oct-2024 11:30 AM,08-Oct-2024 11:35 AM,techsummary_63045.pdf (255.02 KB),,,
,,,,,,,,,,,,,,,,.pdf,BIDDING DOCUMENT,,,,,,,,,,,,,,,,,,,,,,,,,,,,,,,,,,,,,,,,,,,,,,,,,,,,,,,,,,.pdf,BIDDING DOCUMENT,,,,,,,,,,,,,,,,,,,,,,,,,,,,,,,,,,,,,,,,,,,,,,,,,,,,,2.0,241127.0,Ramesh Kr. Agarwalla,27-Sep-2024 07:59 PM,Not Admitted-Fee/PreQual/Technical,Not Complied with technical specification,08-Oct-2024 11:29 AM,,,,,,,,,,,,,2.0,241049.0,SANWARMAL KHETAWAT,"10,15,22,489.00",L2,,,,,,,,,,,,,,,
,,,,,,,,,,,,,,,,.pdf,TECHNICAL QUALIFICATION,,,,,,,,,,,,,,,,,,,,,,,,,,,,,,,,,,,,,,,,,,,,,,,,,,,,,,,,,,.pdf,TECHNICAL QUALIFICATION,,,,,,,,,,,,,,,,,,,,,,,,,,,,,,,,,,,,,,,,,,,,,,,,,,,,,3.0,241049.0,SANWARMAL KHETAWAT,27-Sep-2024 06:29 PM,Rejected-Finance,Awarded to L1 Bidder,24-Dec-2024 11:47 AM,,,,,,,,,,,,,,,,,,,,,,,,,,,,,,,,
,,,,,,,,,,,,,,2.0,Finance,.xls,BOQ,,,,,,,,,,,,,,,,,,,,,,,,,,,,,,,,,,,,,,,,,,,,,,,,,,,,,,,,2.0,Finance,.xls,BOQ,,,,,,,,,,,,,,,,,,,,,,,,,,,,,,,,,,,,,,,,,,,,,,,,,,,,,,,,,,,,,,,,,,,,,,,,,,,,,,,,,,,,,,,,,,,
,,,,,,,,,,,,,,,,.pdf,FOB,,,,,,,,,,,,,,,,,,,,,,,,,,,,,,,,,,,,,,,,,,,,,,,,,,,,,,,,,,.pdf,FOB,,,,,,,,,,,,,,,,,,,,,,,,,,,,,,,,,,,,,,,,,,,,,,,,,,,,,,,,,,,,,,,,,,,,,,,,,,,,,,,,,,,,,,,,,,,
,,,,,,,,,,,,,,,,,,,,,,,,,,,,,,,,,,,,,,,,,,,,,,,,,,,,,,,,,,,,,,,,,,,,,,,,,,,,,,,,,,,,,,,,,,,,,,,,,,,,,,,,,,,,,,,,,,,,,,,,,,,,,,,,,,,,,,,,,,,,,,,,,,,,,,,,,,,,,,,,,,,,,2024_PWD_38909_1,"CE/DEV/TB/211/2024-25/01 Dtd. Guwahati, 5th September, 2024",MMUPPNA-SOPD-G-24-25-01 Improvement of Amlokhi Kathiatoli Kampur Chaparmukh Raha Road (Amoni Tiniali to Raha College Road) (Between 16th Km and 22nd Km) under Mukhya Mantrir Unnato Pakipath Nirman Achani under SOPD-G for the year 2024-25
