Organisation Chain,Tender Reference Number,Tender ID,Withdrawal Allowed,Tender Type,Form of contract,Tender Category,No. of Covers,General Technical Evaluation Allowed,ItemWise Technical Evaluation Allowed,Payment Mode,Is Multi Currency Allowed For BOQ,Is Multi Currency Allowed For Fee,Allow Two Stage Bidding,Cover No,Cover,Document Type,Description,Publish Date,Bid Opening Date,Document Download / Sale Start Date,Document Download / Sale End Date,Clarification Start Date,Clarification End Date,Bid Submission Start Date,Bid Submission End Date,Financial Bid Opening Date,EMD Amount in ₹,EMD Exemption Allowed,EMD Fee Type,EMD Percentage,EMD Payable To,EMD Payable At,S.No,Corrigendum Title,Corrigendum Type,View,S.No.1,Bank Name,Tender Fee in ₹,Fee Payable To,Fee Payable At,Tender Fee Exemption Allowed,Name,Address,Title,Work Description,Pre Qualification Details,Independent External Monitor/Remarks,Tender Value in ₹,Product Category,Sub category,Contract Type,Bid Validity(Days),Period Of Work(Days),Location,Pincode,Pre Bid Meeting Place,Pre Bid Meeting Address,Pre Bid Meeting Date,Bid Opening Place,Should Allow NDA Tender,Allow Preferential Bidder,Tender Stage,S.No,Bid Number,Bidder Name,Submitted Date,Status,Remarks,Status Updated On,Organisation Chain :,Tender ID :,Tender Ref No :,Tender Title :,Tender Stage
Animal Husbandry and Veterinary Department||Directorate of Dairy Development,ECF No. 348965/366,2023_AHVD_32094_1,Yes,Open Tender,Item Rate,Works,2.0,No,No,Online,No,No,No,1.0,Fee/PreQual/Technical,.pdf,Technical documents,14-Aug-2023 06:45 PM,02-Sep-2023 03:00 PM,14-Aug-2023 06:45 PM,02-Sep-2023 02:00 PM,NA ,NA ,28-Aug-2023 09:00 AM,02-Sep-2023 02:00 PM,12-Oct-2023 02:25 PM,"86,600",Yes,fixed,,Nil,Nil,1.0,BoQ,BOQ,,1.0,SBI Bank,"1,000",Nil,Nil,No,Director,"Directorate of Dairy Development Assam Khanapara, Guwahati-22",ESTABLISHMENT OF 10 M3 DAY 10 KLD CAPACITY EFFLUENT TREATMENT PLANT AT MILK PROCESSING PLANT BOKAKHAT AND DHEMAJI,ESTABLISHMENT OF 10 M3 DAY 10 KLD CAPACITY EFFLUENT TREATMENT PLANT AT MILK PROCESSING PLANT BOKAKHAT AND DHEMAJI,Please refer Tender documents. ,NA ,,Miscellaneous Works,NA ,Tender,180.0,120.0,Guwahati,781022.0,Online ,Google Meet ,23-Aug-2023 02:00 PM ,Directorate of Dairy Development Assam,No ,No,AOC,1,197415,EARTH ENVIROTECH SYSTEMS,02-Sep-2023 11:09 AM,Rejected-Technical,Technically disqualified. Refer to technical minutes,12-Oct-2023 02:23 PM,Animal Husbandry and Veterinary Department||Directorate of Dairy Development,2023_AHVD_32094_1,ECF No. 348965/366,ESTABLISHMENT OF 10 M3 DAY 10 KLD CAPACITY EFFLUENT TREATMENT PLANT AT MILK PROCESSING PLANT BOKAKHAT AND DHEMAJI,AOC
,,,,,,,,,,,,,,,,.pdf,Bid document downloaded from the portal,,,,,,,,,,,,,,,,,,,,,,,,,,,,,,,,,,,,,,,,,,,,,,AOC,2,197664,EASTERN ENVO PROTECT.,01-Sep-2023 06:34 PM,Rejected-Finance,Rejected. Refer to financial minutes,12-Dec-2023 03:14 PM,,,,,AOC
,,,,,,,,,,,,,,2.0,Finance,.xls,Price bid,,,,,,,,,,,,,,,,,,,,,,,,,,,,,,,,,,,,,,,,,,,,,,AOC,3,197405,Ecologics India Private Limited,31-Aug-2023 06:27 PM,Rejected-Technical,Technically disqualified. Refer to technical minutes,12-Oct-2023 02:23 PM,,,,,AOC
,,,,,,,,,,,,,,,,,,,,,,,,,,,,,,,,,,,,,,,,,,,,,,,,,,,,,,,,,,,,,,,AOC,4,197188,Emperia Energy Pvt Ltd,02-Sep-2023 01:52 PM,Accepted-AOC,Awarded,12-Dec-2023 03:15 PM,,,,,AOC
,,,,,,,,,,,,,,,,,,,,,,,,,,,,,,,,,,,,,,,,,,,,,,,,,,,,,,,,,,,,,,,AOC,5,197063,SBA EVIRO SYSTEMS PRIVATE LIMITED,02-Sep-2023 01:09 PM,Rejected-Technical,Technically disqualified. Refer to technical minutes,12-Oct-2023 02:23 PM,,,,,AOC
,,,,,,,,,,,,,,,,,,,,,,,,,,,,,,,,,,,,,,,,,,,,,,,,,,,,,,,,,,,,,,,AOC,6,197569,Solar Sewage Basic Infrastructure Pvt Ltd,02-Sep-2023 01:43 PM,Rejected-Technical,Technically disqualified. Refer to technical minutes,12-Oct-2023 02:23 PM,,,,,AOC
