Organisation Chain,Tender Reference Number,Tender ID,Withdrawal Allowed,Tender Type,Form of contract,Tender Category,No. of Covers,General Technical Evaluation Allowed,ItemWise Technical Evaluation Allowed,Payment Mode,Is Multi Currency Allowed For BOQ,Is Multi Currency Allowed For Fee,Allow Two Stage Bidding,Cover No,Cover,Document Type,Description,Publish Date,Bid Opening Date,Document Download / Sale Start Date,Document Download / Sale End Date,Clarification Start Date,Clarification End Date,Bid Submission Start Date,Bid Submission End Date,Financial Bid Opening Date,EMD Amount in ₹,EMD Exemption Allowed,EMD Fee Type,EMD Percentage,EMD Payable To,EMD Payable At,S.No,Bank Name,Tender Fee in ₹,Fee Payable To,Fee Payable At,Tender Fee Exemption Allowed,Name,Address,Title,Work Description,Pre Qualification Details,Independent External Monitor/Remarks,Tender Value in ₹,Product Category,Sub category,Contract Type,Bid Validity(Days),Period Of Work(Days),Location,Pincode,Pre Bid Meeting Place,Pre Bid Meeting Address,Pre Bid Meeting Date,Bid Opening Place,Should Allow NDA Tender,Allow Preferential Bidder,Tender Stage,Contract Date :,Contract Value :,Work Completion Period in days :,Updated By :,Updated on :,AOC document :,S.No,Bid Number,Bidder Name,Awarded Currency,Awarded Value,S.No.1,Bid Number.1,Bidder Name.1,Submitted Date,Status,Remarks,Status Updated On,Type :,Summary :,Updated By :.1,Updated On :,Document :,BOQ Comparative Chart :,Committee Chairperson/Co-ordinator Name :,Committee Chairperson/Co-ordinator Type :,Committee Members :,Updated By :.2,Updated on :.1,Document :.1,Organisation Chain :,Tender ID :,Tender Ref No :,Tender Title :,Type :.1,Summary :.1,Updated By :.3,Updated On :.1,Document :.2,Committee Chairperson/Co-ordinator Name :.1,Committee Chairperson/Co-ordinator Type :.1,Committee Members :.1,Updated By :.4,Updated On :.2,Financial Bid Opening Date:,Document :.3,Tender Stage
Animal Husbandry and Veterinary Department||Directorate of A.H. and Veterinary,-223/RIDF-XXVII (S)/Dhubri/2022-23/7,2023_AHVD_31750_1,Yes,Open Tender,Item Rate,Works,2.0,No,No,Online,No,No,No,1.0,Fee/PreQual/Technical,.pdf,TECHNICAL QUALIFICATION DOCUMENT,20-Jul-2023 06:00 PM,18-Aug-2023 02:30 PM,20-Jul-2023 06:00 PM,17-Aug-2023 02:00 PM,NA ,NA ,27-Jul-2023 03:00 PM,17-Aug-2023 02:00 PM,21-Sep-2023 09:00 AM,"67,420",Yes,percentage,2.0%,Nil,Nil,1.0,SBI Bank,"1,200",Nil,Nil,No,DIRECTOR,"OFFICE OF THE DIRECTOR, ANIMAL HUSBANDRY AND VETERINARY DEPARTMENT, ASSAM CHENIKUTHI, GUWAHATI -3","CONSTRUCTION OF ASSAM TYPE SUB-CENTRE BUILDING WITH ELECTRIFICATION, WATER SUPPLY AND SANITARY WORKS ETC. AT GAURIPUR SMC IN DHUBRIDISTRICT.","CONSTRUCTION OF ASSAM TYPE SUB-CENTRE BUILDING WITH ELECTRIFICATION, WATER SUPPLY AND SANITARY WORKS ETC. AT GAURIPUR SMC IN DHUBRIDISTRICT.",Please refer Tender documents. ,NA ,"33,71,000",Civil Works,NA ,Tender,180.0,180.0,DHUBRI,783301.0,"O/O THE AHVD, CHENIKUTHI, GUWAHATI-3 ","OFFICE OF THE DIRECTOR, ANIMAL HUSBANDRY AND VETERINARY DEPARTMENT, ASSAM CHENIKUTHI, GUWAHATI -3  ",26-Jul-2023 01:00 PM ,"O/O THE AHVD, CHENIKUTHI, GUWAHATI-3",No ,No,AOC,18-Dec-2023,"INR 3,371,000",180.0,ARIF AHMED,18-Dec-2023 05:18 PM,GauripurAOC.pdf (396.00 KB),1.0,194809.0,Jiban Gogoi,INR,"2,865,000",1,195489,Hiya Construction,17-Aug-2023 01:46 PM,Rejected-Technical,AS PER MINUTES OF TENDER,20-Sep-2023 07:16 PM,Finance,OPENED,NARESWAR THAKURIA,21-Sep-2023 01:25 PM,,BOQ Comparative Chart,Director,Internal,,NARESWAR THAKURIA,18-Dec-2023 04:46 PM,finsummary_50873.pdf (6684.44 KB),Animal Husbandry and Veterinary Department||Directorate of A.H. and Veterinary,2023_AHVD_31750_1,-223/RIDF-XXVII (S)/Dhubri/2022-23/7,"CONSTRUCTION OF ASSAM TYPE SUB-CENTRE BUILDING WITH ELECTRIFICATION, WATER SUPPLY AND SANITARY WORKS ETC. AT GAURIPUR SMC IN DHUBRIDISTRICT.",Technical,Technical bid has been opened,NARESWAR THAKURIA,25-Aug-2023 05:56 PM,,NARESWAR THAKURIA,Internal,,NARESWAR THAKURIA,20-Sep-2023 07:16 PM,21-Sep-2023 09:00 AM,techsummary_50873.pdf (10202.36 KB),AOC
,,,,,,,,,,,,,,,,.pdf,BID DOCUMENT DOWNLOADED FROM THE PORTAL,,,,,,,,,,,,,,,,,,,,,,,,,,,,,,,,,,,,,,,,,,AOC,,,,,,,,,,,,2,194809,Jiban Gogoi,09-Aug-2023 09:17 PM,Accepted-AOC,Awarded,18-Dec-2023 05:18 PM,,,,,,,,,,,,,,,,,,,,,,,,,,,,,AOC
,,,,,,,,,,,,,,2.0,Finance,.xls,BOQ,,,,,,,,,,,,,,,,,,,,,,,,,,,,,,,,,,,,,,,,,,AOC,,,,,,,,,,,,3,195368,Mantu Choudhury,16-Aug-2023 07:02 PM,Rejected-Finance,Rejected. Refer to financial minutes,18-Dec-2023 04:46 PM,,,,,,,,,,,,,,,,,,,,,,,,,,,,,AOC
,,,,,,,,,,,,,,,,.pdf,FORM OF BID,,,,,,,,,,,,,,,,,,,,,,,,,,,,,,,,,,,,,,,,,,AOC,,,,,,,,,,,,4,195248,NORTH EAST PRODUCTS,16-Aug-2023 10:21 PM,Rejected-Technical,AS PER MINUTES OF TENDER,20-Sep-2023 07:16 PM,,,,,,,,,,,,,,,,,,,,,,,,,,,,,AOC
,,,,,,,,,,,,,,,,.pdf,PROPER FINANCIAL RATE JUSTIFICATION WITH PROPER ANLYSIS IF REQUIRED,,,,,,,,,,,,,,,,,,,,,,,,,,,,,,,,,,,,,,,,,,AOC,,,,,,,,,,,,5,194258,Nur Alom,17-Aug-2023 12:37 PM,Rejected-Finance,Rejected. Refer to financial minutes,18-Dec-2023 04:46 PM,,,,,,,,,,,,,,,,,,,,,,,,,,,,,AOC
,,,,,,,,,,,,,,,,,,,,,,,,,,,,,,,,,,,,,,,,,,,,,,,,,,,,,,,,,,,AOC,,,,,,,,,,,,6,195422,SAFIKUL ISLAM,17-Aug-2023 10:11 AM,Rejected-Finance,Rejected. Refer to financial minutes,18-Dec-2023 04:46 PM,,,,,,,,,,,,,,,,,,,,,,,,,,,,,AOC
