Organisation Chain,Tender Reference Number,Tender ID,Withdrawal Allowed,Tender Type,Form of contract,Tender Category,No. of Covers,General Technical Evaluation Allowed,ItemWise Technical Evaluation Allowed,Payment Mode,Is Multi Currency Allowed For BOQ,Is Multi Currency Allowed For Fee,Allow Two Stage Bidding,Cover No,Cover,Document Type,Description,Publish Date,Bid Opening Date,Document Download / Sale Start Date,Document Download / Sale End Date,Clarification Start Date,Clarification End Date,Bid Submission Start Date,Bid Submission End Date,Financial Bid Opening Date,EMD Amount in ₹,EMD Exemption Allowed,EMD Fee Type,EMD Percentage,EMD Payable To,EMD Payable At,S.No,Bank Name,Tender Fee in ₹,Fee Payable To,Fee Payable At,Tender Fee Exemption Allowed,Name,Address,Title,Work Description,Pre Qualification Details,Independent External Monitor/Remarks,Tender Value in ₹,Product Category,Sub category,Contract Type,Bid Validity(Days),Period Of Work(Days),Location,Pincode,Pre Bid Meeting Place,Pre Bid Meeting Address,Pre Bid Meeting Date,Bid Opening Place,Should Allow NDA Tender,Allow Preferential Bidder,Tender Stage,Contract Date :,Contract Value :,Work Completion Period in days :,Updated By :,Updated on :,AOC document :,AOC Description :,S.No,Bid Number,Bidder Name,Awarded Currency,Awarded Value,S.No.1,Bid Number.1,Bidder Name.1,Submitted Date,Status,Remarks,Status Updated On,Type :,Summary :,Updated By :.1,Updated On :,Document :,BOQ Comparative Chart :,Committee Chairperson/Co-ordinator Name :,Committee Chairperson/Co-ordinator Type :,Committee Members :,Updated By :.2,Updated on :.1,Document :.1,Organisation Chain :,Tender ID :,Tender Ref No :,Tender Title :,Type :.1,Summary :.1,Updated By :.3,Updated On :.1,Document :.2,Committee Chairperson/Co-ordinator Name :.1,Committee Chairperson/Co-ordinator Type :.1,Committee Members :.1,Updated By :.4,Updated On :.2,Financial Bid Opening Date:,Document :.3,Tender Stage
National Health Mission||State Programme Management Unit - NHM,NHM-32023/11/2022-Cons-NHM/152,2023_NHM_31156_2,Yes,Open Tender,Turn-key,Works,2.0,No,No,Online,No,No,No,1.0,Fee/PreQual/Technical,.pdf,SBD,12-Jun-2023 11:00 AM,27-Jun-2023 03:30 PM,12-Jun-2023 11:00 AM,26-Jun-2023 02:00 PM,NA ,NA ,12-Jun-2023 11:00 AM,26-Jun-2023 02:00 PM,18-Jul-2023 03:00 PM,"1,04,060",Yes,percentage,2.0%,Nil,Nil,1.0,SBI Bank,"1,500",Nil,Nil,No,"MD,NHM,Assam","O/O MD,NHM Christian Basti,Ghy-781005",Construction of Buildingless Sub Health Centre at HABI GAON SC in Golaghat District under PM ABHIM for the FY 2021 22 under NHM Assam on Turn Key Basis.,Construction of Buildingless Sub Health Centre at HABI GAON SC in Golaghat District under PM ABHIM for the FY 2021 22 under NHM Assam on Turn Key Basis.,Please refer Tender documents. ,NA ,"52,03,000",Civil Works - Building,NA ,Tender,180.0,180.0,Golaghat,785621.0,NA ,NA ,NA ,"O/O MD,NHM",No ,No,AOC,27-Dec-2023,"INR 4,891,340",180.0,Himangshu Kalita,27-Dec-2023 05:33 PM,WOHABIGAON.pdf (495.00 KB),AOC,1.0,188304.0,DHANUKA CONSTRUCTION,INR,"4,891,340",1.0,188291.0,BIPIN HAZARIKA,26-Jun-2023 01:48 PM,Rejected-Finance,L2 rate is not accepted,27-Dec-2023 04:59 PM,Finance,Financial bid is opened,Himangshu Kalita,27-Dec-2023 04:11 PM,,BOQ Comparative Chart,ED,Internal,,Himangshu Kalita,27-Dec-2023 04:59 PM,finsummary_49873.pdf (411.08 KB),National Health Mission||State Programme Management Unit - NHM,2023_NHM_31156_2,NHM-32023/11/2022-Cons-NHM/152,Construction of Buildingless Sub Health Centre at HABI GAON SC in Golaghat District under PM ABHIM for the FY 2021 22 under NHM Assam on Turn Key Basis.,Technical,TBER,Himangshu Kalita,18-Jul-2023 02:53 PM,technical_49873.pdf,ED,Internal,,Himangshu Kalita,18-Jul-2023 02:55 PM,18-Jul-2023 03:00 PM,techsummary_49873.pdf (447.80 KB),AOC
,,,,,,,,,,,,,,,,.pdf,Tender fee and bid security,,,,,,,,,,,,,,,,,,,,,,,,,,,,,,,,,,,,,,,,,,AOC,,,,,,,,,,,,,2.0,188304.0,DHANUKA CONSTRUCTION,25-Jun-2023 11:26 PM,Accepted-AOC,L1 bidder is awarded,27-Dec-2023 05:33 PM,,,,,,,,,,,,,,,,,,,,,,,,,,,,,AOC
,,,,,,,,,,,,,,,,.pdf,Technical documents,,,,,,,,,,,,,,,,,,,,,,,,,,,,,,,,,,,,,,,,,,AOC,,,,,,,,,,,,,3.0,188218.0,DURLAV KALITA,23-Jun-2023 06:11 PM,Not Admitted-Fee/PreQual/Technical,Not Complied with technical specification,18-Jul-2023 02:53 PM,,,,,,,,,,,,,,,,,,,,,,,,,,,,,AOC
,,,,,,,,,,,,,,2.0,Finance,.xls,BOQ,,,,,,,,,,,,,,,,,,,,,,,,,,,,,,,,,,,,,,,,,,AOC,,,,,,,,,,,,,4.0,188295.0,Manash Boruah,25-Jun-2023 07:28 PM,Rejected-Finance,L3 rate is not accepted,27-Dec-2023 04:59 PM,,,,,,,,,,,,,,,,,,,,,,,,,,,,,AOC
,,,,,,,,,,,,,,,,.pdf,FOB,,,,,,,,,,,,,,,,,,,,,,,,,,,,,,,,,,,,,,,,,,AOC,,,,,,,,,,,,,,,,,,,,,,,,,,,,,,,,,,,,,,,,,,,,,,,,AOC
