Organisation Chain,Tender Reference Number,Tender ID,Withdrawal Allowed,Tender Type,Form of contract,Tender Category,No. of Covers,General Technical Evaluation Allowed,ItemWise Technical Evaluation Allowed,Payment Mode,Is Multi Currency Allowed For BOQ,Is Multi Currency Allowed For Fee,Allow Two Stage Bidding,Cover No,Cover,Document Type,Description,Publish Date,Bid Opening Date,Document Download / Sale Start Date,Document Download / Sale End Date,Clarification Start Date,Clarification End Date,Bid Submission Start Date,Bid Submission End Date,Financial Bid Opening Date,EMD Amount in ₹,EMD Exemption Allowed,EMD Fee Type,EMD Percentage,EMD Payable To,EMD Payable At,S.No,Bank Name,Tender Fee in ₹,Fee Payable To,Fee Payable At,Tender Fee Exemption Allowed,Name,Address,Title,Work Description,Pre Qualification Details,Independent External Monitor/Remarks,Tender Value in ₹,Product Category,Sub category,Contract Type,Bid Validity(Days),Period Of Work(Days),Location,Pincode,Pre Bid Meeting Place,Pre Bid Meeting Address,Pre Bid Meeting Date,Bid Opening Place,Should Allow NDA Tender,Allow Preferential Bidder,Tender Stage,Contract Date :,Contract Value :,Work Completion Period in days :,Updated By :,Updated on :,AOC document :,AOC Description :,S.No,Bid Number,Bidder Name,Awarded Currency,Awarded Value,S.No.1,Bid Number.1,Bidder Name.1,Submitted Date,Status,Remarks,Status Updated On,Type :,Summary :,Updated By :.1,Updated On :,Document :,BOQ Comparative Chart :,Committee Chairperson/Co-ordinator Name :,Committee Chairperson/Co-ordinator Type :,Committee Members :,Updated By :.2,Updated on :.1,Document :.1,Organisation Chain :,Tender ID :,Tender Ref No :,Tender Title :,Type :.1,Summary :.1,Updated By :.3,Updated On :.1,Document :.2,Committee Chairperson/Co-ordinator Name :.1,Committee Chairperson/Co-ordinator Type :.1,Committee Members :.1,Updated By :.4,Updated On :.2,Financial Bid Opening Date:,Document :.3,Tender Stage
Irrigation Department||Chief Engineer(Major)-Irrigation Dept,38 RIDF_XXIX NABARD 2023_24 Date_ 18_11_2023,2023_ID_34084_1,Yes,Open Tender,Item Rate,Works,2.0,No,No,Online,No,No,No,1.0,Fee/PreQual/Technical,.pdf,NIT,20-Nov-2023 06:00 PM,12-Dec-2023 03:00 PM,20-Nov-2023 06:15 PM,12-Dec-2023 02:00 PM,NA ,NA ,22-Nov-2023 10:00 AM,12-Dec-2023 02:00 PM,18-Dec-2023 03:10 PM,"2,18,887",Yes,percentage,2.0%,Nil,Nil,1.0,SBI Bank,"3,000",Nil,Nil,No,Addl Chief Engineer IMPL MI Assam,O_O the Chief Engineer Irrigation Assam,INSTALLATION OF SOLAR AND ELECTRICALLY OPERATED HYBRID TUBE WELL SCHEMES UNDER DHOLAI SONAI LAC 11 PTS UNDER RIDF_XXIX NABARD FOR THE YEAR 2023_24 UNDER DHOLAI SONAI DIVISION I DHOLAI,INSTALLATION OF SOLAR AND ELECTRICALLY OPERATED HYBRID TUBE WELL SCHEMES UNDER DHOLAI SONAI LAC 11 PTS UNDER RIDF_XXIX NABARD FOR THE YEAR 2023_24 UNDER DHOLAI SONAI DIVISION I DHOLAI,Please refer Tender documents. ,NA ,"1,09,44,348",Civil Works,NA ,Tender,180.0,180.0,Dholai Sonai,788114.0,NA ,NA ,NA ,ETendering Cell O_O the Addl CE Irrig Assam Ghy-3,No ,No,AOC,20-Dec-2023,"INR 9,849,913.2",180.0,Manisha Barua,20-Dec-2023 04:29 PM,finminnit38.pdf (967.00 KB),AOC,1.0,214781.0,RAMABATI SINHA,INR,"9,849,913.2",1,214773,ABDUL HAMID CHOUDHURY,12-Dec-2023 12:28 PM,Rejected-Finance,Not admitted,20-Dec-2023 04:28 PM,Finance,Financial evaluation is in process,Manisha Barua,18-Dec-2023 03:24 PM,,BOQ Comparative Chart,Chief Engineer Irrigation Assam,Internal,,Manisha Barua,20-Dec-2023 04:28 PM,finsummary_55184.pdf (967.16 KB),Irrigation Department||Chief Engineer(Major)-Irrigation Dept,2023_ID_34084_1,38 RIDF_XXIX NABARD 2023_24 Date_ 18_11_2023,INSTALLATION OF SOLAR AND ELECTRICALLY OPERATED HYBRID TUBE WELL SCHEMES UNDER DHOLAI SONAI LAC 11 PTS UNDER RIDF_XXIX NABARD FOR THE YEAR 2023_24 UNDER DHOLAI SONAI DIVISION I DHOLAI,Technical,Technical evaluation is in process,Manisha Barua,12-Dec-2023 03:27 PM,,Chief Engineer Irrigation Assam,Internal,,Manisha Barua,18-Dec-2023 03:04 PM,18-Dec-2023 03:10 PM,techsummary_55184.pdf (349.93 KB),AOC
,,,,,,,,,,,,,,,,.pdf,Bid document,,,,,,,,,,,,,,,,,,,,,,,,,,,,,,,,,,,,,,,,,,AOC,,,,,,,,,,,,,2,214811,HYDROVERVE TECHNOLOGIES INDIA PRIVATE LIMITED,12-Dec-2023 10:46 AM,Rejected-Technical,not admitted,18-Dec-2023 03:04 PM,,,,,,,,,,,,,,,,,,,,,,,,,,,,,AOC
,,,,,,,,,,,,,,,,.pdf,Pre-qualification,,,,,,,,,,,,,,,,,,,,,,,,,,,,,,,,,,,,,,,,,,AOC,,,,,,,,,,,,,3,214696,M. S. CONSTRUCTION,11-Dec-2023 08:10 PM,Rejected-Technical,not admitted,18-Dec-2023 03:04 PM,,,,,,,,,,,,,,,,,,,,,,,,,,,,,AOC
,,,,,,,,,,,,,,2.0,Finance,.xls,BOQ,,,,,,,,,,,,,,,,,,,,,,,,,,,,,,,,,,,,,,,,,,AOC,,,,,,,,,,,,,4,214888,M/S Pioneer Enterprise and JV,12-Dec-2023 10:28 AM,Rejected-Finance,Not admitted,20-Dec-2023 04:28 PM,,,,,,,,,,,,,,,,,,,,,,,,,,,,,AOC
,,,,,,,,,,,,,,,,,,,,,,,,,,,,,,,,,,,,,,,,,,,,,,,,,,,,,,,,,,,AOC,,,,,,,,,,,,,5,214781,RAMABATI SINHA,12-Dec-2023 11:53 AM,Accepted-AOC,Awarded,20-Dec-2023 04:29 PM,,,,,,,,,,,,,,,,,,,,,,,,,,,,,AOC
