Organisation Chain,Tender Reference Number,Tender ID,Withdrawal Allowed,Tender Type,Form of contract,Tender Category,No. of Covers,General Technical Evaluation Allowed,ItemWise Technical Evaluation Allowed,Payment Mode,Is Multi Currency Allowed For BOQ,Is Multi Currency Allowed For Fee,Allow Two Stage Bidding,Cover No,Cover,Document Type,Description,Publish Date,Bid Opening Date,Document Download / Sale Start Date,Document Download / Sale End Date,Clarification Start Date,Clarification End Date,Bid Submission Start Date,Bid Submission End Date,Financial Bid Opening Date,EMD Amount in ₹,EMD Exemption Allowed,EMD Fee Type,EMD Percentage,EMD Payable To,EMD Payable At,S.No,Bank Name,Tender Fee in ₹,Fee Payable To,Fee Payable At,Tender Fee Exemption Allowed,Name,Address,Title,Work Description,Pre Qualification Details,Independent External Monitor/Remarks,Tender Value in ₹,Product Category,Sub category,Contract Type,Bid Validity(Days),Period Of Work(Days),Location,Pincode,Pre Bid Meeting Place,Pre Bid Meeting Address,Pre Bid Meeting Date,Bid Opening Place,Should Allow NDA Tender,Allow Preferential Bidder,Tender Stage,Contract Date :,Contract Value :,Work Completion Period in days :,Updated By :,Updated on :,AOC document :,S.No,Bid Number,Bidder Name,Awarded Currency,Awarded Value,S.No.1,Bid Number.1,Bidder Name.1,Submitted Date,Status,Remarks,Status Updated On,Type :,Summary :,Updated By :.1,Updated On :,Document :,BOQ Comparative Chart :,Committee Chairperson/Co-ordinator Name :,Committee Chairperson/Co-ordinator Type :,Committee Members :,Updated By :.2,Updated on :.1,Document :.1,Organisation Chain :,Tender ID :,Tender Ref No :,Tender Title :,Type :.1,Summary :.1,Updated By :.3,Updated On :.1,Document :.2,Committee Chairperson/Co-ordinator Name :.1,Committee Chairperson/Co-ordinator Type :.1,Committee Members :.1,Updated By :.4,Updated On :.2,Financial Bid Opening Date:,Document :.3,Tender Stage
Irrigation Department||Chief Engineer(Major)-Irrigation Dept||Tezpur Circle,NIT/TCI/2/2023/545,2023_ID_33450_1,Yes,Open Tender,Percentage,Works,2.0,No,No,Online,No,No,No,1.0,Fee/PreQual/Technical,.pdf,Technical documents,04-Nov-2023 06:00 PM,28-Nov-2023 03:00 PM,04-Nov-2023 06:00 PM,28-Nov-2023 02:00 PM,NA ,NA ,05-Nov-2023 10:00 AM,28-Nov-2023 02:00 PM,12-Dec-2023 01:15 PM,"1,50,000",Yes,percentage,2.0%,Nil,Nil,1.0,SBI Bank,"1,500",Nil,Nil,No,Superintending Engineer,"OFFICE OF THE SUPERINTENDING ENGINEER TEZPUR CIRCLE IRRIGATION,TEZPUR","Solar Powered MDTW Scheme 2 no. Points at Behali LAC under RIDF-XXIX NABARD for the year 2023-24 under Biswanath-Behali Division Irrigation, Biswanath.","Solar Powered MDTW Scheme 2 no. Points at Behali LAC under RIDF-XXIX NABARD for the year 2023-24 under Biswanath-Behali Division Irrigation, Biswanath.",Please refer Tender documents. ,NA ,"75,00,000",Civil Works,NA ,Tender,180.0,90.0,Biswanath,784176.0,NA ,NA ,NA ,"O/o The SE TEZPUR CIRCLE,IRRIGATION,TEZPUR",No ,No,AOC,30-Dec-2023,"INR 6,683,825",90.0,Manik Nath,30-Dec-2023 12:27 PM,BiswanathAOC.pdf (627.00 KB),1.0,210512.0,NIKUNJA KUMAR BORAH,INR,"6,683,825",1,211063,Bubul Gogoi,25-Nov-2023 03:27 PM,Rejected-Technical,some documents didnot submitted,12-Dec-2023 01:04 PM,Finance,Admitted,Manik Nath,12-Dec-2023 01:22 PM,,BOQ Comparative Chart,ManikChandraNath,Internal,,Manik Nath,12-Dec-2023 03:34 PM,finsummary_54045.pdf (395.15 KB),Irrigation Department||Chief Engineer(Major)-Irrigation Dept||Tezpur Circle,2023_ID_33450_1,NIT/TCI/2/2023/545,"Solar Powered MDTW Scheme 2 no. Points at Behali LAC under RIDF-XXIX NABARD for the year 2023-24 under Biswanath-Behali Division Irrigation, Biswanath.",Technical,Admitted,Snigdha Gogoi,04-Dec-2023 02:30 PM,,ManikChandraNath,Internal,,Manik Nath,12-Dec-2023 01:04 PM,12-Dec-2023 01:15 PM,techsummary_54045.pdf (528.43 KB),AOC
,,,,,,,,,,,,,,,,.pdf,Bid documents downloaded from the portal,,,,,,,,,,,,,,,,,,,,,,,,,,,,,,,,,,,,,,,,,,AOC,,,,,,,,,,,,2,212776,Fareast Builders & Co.,27-Nov-2023 05:24 PM,Rejected-Technical,some documents didnot submitted,12-Dec-2023 01:04 PM,,,,,,,,,,,,,,,,,,,,,,,,,,,,,AOC
,,,,,,,,,,,,,,2.0,Finance,.xls,Price bid,,,,,,,,,,,,,,,,,,,,,,,,,,,,,,,,,,,,,,,,,,AOC,,,,,,,,,,,,3,210512,NIKUNJA KUMAR BORAH,22-Nov-2023 08:14 PM,Accepted-AOC,AOC is granted,30-Dec-2023 12:28 PM,,,,,,,,,,,,,,,,,,,,,,,,,,,,,AOC
,,,,,,,,,,,,,,,,,,,,,,,,,,,,,,,,,,,,,,,,,,,,,,,,,,,,,,,,,,,AOC,,,,,,,,,,,,4,212641,SIKHAMONI CHETIA BORUAH,28-Nov-2023 12:36 PM,Rejected-Technical,Some documents didnot submitted,12-Dec-2023 01:04 PM,,,,,,,,,,,,,,,,,,,,,,,,,,,,,AOC
,,,,,,,,,,,,,,,,,,,,,,,,,,,,,,,,,,,,,,,,,,,,,,,,,,,,,,,,,,,AOC,,,,,,,,,,,,5,212727,SM ENTERPRISE,28-Nov-2023 09:54 AM,Rejected-Technical,Some documents didnot submitted,12-Dec-2023 01:04 PM,,,,,,,,,,,,,,,,,,,,,,,,,,,,,AOC
