Organisation Chain,Tender Reference Number,Tender ID,Withdrawal Allowed,Tender Type,Form of contract,Tender Category,No. of Covers,General Technical Evaluation Allowed,ItemWise Technical Evaluation Allowed,Payment Mode,Is Multi Currency Allowed For BOQ,Is Multi Currency Allowed For Fee,Allow Two Stage Bidding,Cover No,Cover,Document Type,Description,Publish Date,Bid Opening Date,Document Download / Sale Start Date,Document Download / Sale End Date,Clarification Start Date,Clarification End Date,Bid Submission Start Date,Bid Submission End Date,Financial Bid Opening Date,EMD Amount in ₹,EMD Exemption Allowed,EMD Fee Type,EMD Percentage,EMD Payable To,EMD Payable At,S.No,Corrigendum Title,Corrigendum Type,View,S.No.1,Bank Name,Tender Fee in ₹,Fee Payable To,Fee Payable At,Tender Fee Exemption Allowed,Name,Address,Title,Work Description,Pre Qualification Details,Independent External Monitor/Remarks,Tender Value in ₹,Product Category,Sub category,Contract Type,Bid Validity(Days),Period Of Work(Days),Location,Pincode,Pre Bid Meeting Place,Pre Bid Meeting Address,Pre Bid Meeting Date,Bid Opening Place,Should Allow NDA Tender,Allow Preferential Bidder,Tender Stage,S.No,Bid Number,Bidder Name,Submitted Date,Status,Remarks,Status Updated On,Organisation Chain :,Tender ID :,Tender Ref No :,Tender Title :,Tender Stage
Cooperation Department||The west Assam Milk Producers Cooperative Union Limited,WAMUL/APART/ET/AMCSs/23-24/1,2023_CD_31537_1,Yes,Open Tender,Supply,Goods,2.0,No,No,Online,No,No,No,1.0,Fee/PreQual/Technical,.pdf,"General terms and condition, technical specification, EMD, Signed copy of RFQ",07-Jul-2023 12:30 PM,07-Aug-2023 12:30 PM,07-Jul-2023 12:35 PM,07-Aug-2023 12:00 PM,07-Jul-2023 12:40 PM ,12-Jul-2023 10:00 AM ,12-Jul-2023 03:00 PM,07-Aug-2023 12:00 PM,20-Oct-2023 11:00 AM,"7,61,000",No,fixed,,Nil,Nil,1.0,Technical Corrigendum,Technical Bid,,1.0,SBI Bank,0.0,Nil,Nil,No,"Managing Director, WAMUL","Purabi Dairy, Panjabari, Guwahati, Assam",Automatic Milk Collection Systems (AMCSs),"Supply,Installation, testing, configuration and commissioning of Automatic Milk Collection Systems",Please refer the published tender documents ,NA ,,Supply of Materials,NA ,Tender,120.0,400.0,"Purabi Dairy, Panjabari, Guwahati, Assam",781037.0,WAMUL Head Office  ,"Purabi Dairy, Panjabari, Guwahati, Assam ",12-Jul-2023 12:30 PM ,Guwahati,No ,No,AOC,1,193485,AGNEXT TECHNOLOGIES PRIVATE LIMITED,07-Aug-2023 10:40 AM,Rejected-Technical,Technically not eligible,19-Oct-2023 03:49 PM,Cooperation Department||The west Assam Milk Producers Cooperative Union Limited,2023_CD_31537_1,WAMUL/APART/ET/AMCSs/23-24/1,Automatic Milk Collection Systems (AMCSs),AOC
,,,,,,,,,,,,,,2.0,Finance,.xls,Financial Bid,,,,,,,,,,,,,,,,,,,,,,,,,,,,,,,,,,,,,,,,,,,,,,AOC,2,194491,Everest Instruments Pvt. Ltd.,07-Aug-2023 11:41 AM,Rejected-Finance,Financially not lowest bidder,27-Dec-2023 04:07 PM,,,,,AOC
,,,,,,,,,,,,,,,,.pdf,Letter of Quotation financial part,,,,,,,,,,,,,,,,,,,,,,,,,,,,,,,,,,,,,,,,,,,,,,AOC,3,191845,Kanha Milk Testing Equipments Pvt Ltd,06-Aug-2023 01:55 PM,Accepted-AOC,Financially lowest bidder,29-Dec-2023 05:31 PM,,,,,AOC
,,,,,,,,,,,,,,,,,,,,,,,,,,,,,,,,,,,,,,,,,,,,,,,,,,,,,,,,,,,,,,,AOC,4,192200,Prompt Equipments Pvt Ltd,05-Aug-2023 06:04 PM,Rejected-AOC,Financially not lowest bidder,29-Dec-2023 05:31 PM,,,,,AOC
,,,,,,,,,,,,,,,,,,,,,,,,,,,,,,,,,,,,,,,,,,,,,,,,,,,,,,,,,,,,,,,AOC,5,192844,Rajasthan Electronics and Instruments limited,07-Aug-2023 11:28 AM,Rejected-Technical,Technically not eligible,19-Oct-2023 03:49 PM,,,,,AOC
