Organisation Chain,Tender Reference Number,Tender ID,Withdrawal Allowed,Tender Type,Form of contract,Tender Category,No. of Covers,General Technical Evaluation Allowed,ItemWise Technical Evaluation Allowed,Payment Mode,Is Multi Currency Allowed For BOQ,Is Multi Currency Allowed For Fee,Allow Two Stage Bidding,Cover No,Cover,Document Type,Description,Publish Date,Bid Opening Date,Document Download / Sale Start Date,Document Download / Sale End Date,Clarification Start Date,Clarification End Date,Bid Submission Start Date,Bid Submission End Date,Financial Bid Opening Date,EMD Amount in ₹,EMD Exemption Allowed,EMD Fee Type,EMD Percentage,EMD Payable To,EMD Payable At,S.No,Bank Name,Tender Fee in ₹,Fee Payable To,Fee Payable At,Tender Fee Exemption Allowed,Name,Address,Title,Work Description,Pre Qualification Details,Independent External Monitor/Remarks,Tender Value in ₹,Product Category,Sub category,Contract Type,Bid Validity(Days),Period Of Work(Days),Location,Pincode,Pre Bid Meeting Place,Pre Bid Meeting Address,Pre Bid Meeting Date,Bid Opening Place,Should Allow NDA Tender,Allow Preferential Bidder,Tender Stage,S.No,Bid Number,Bidder Name,Submitted Date,Status,Remarks,Status Updated On,Organisation Chain :,Tender ID :,Tender Ref No :,Tender Title :,Tender Stage
Department of Water Resources||Chief Engineer - DoWR,MANGALDOI/2023-24/SDMF/I,2023_DoWR_31698_2,Yes,Open Tender,Works,Works,2.0,No,No,Online,No,No,No,1.0,Fee/PreQual/Technical,.pdf,TECHNICAL DOCUMENTS,22-Dec-2023 06:30 PM,29-Dec-2023 03:00 PM,22-Dec-2023 06:35 PM,29-Dec-2023 02:00 PM,NA ,NA ,24-Dec-2023 10:00 AM,29-Dec-2023 02:00 PM,19-Feb-2024 04:15 PM,"5,06,427",Yes,percentage,2.0%,Nil,Nil,1.0,SBI Bank,"5,000",Nil,Nil,No,Chief Engineer Water Resources Department,"O/O Chief Engineer Water Resources Department, Basistha, Guwahati 29",Mitigation of erosion of Mangaldoi town and its adjoining areas from the river Mangaldoi. Package 1 RETENDER,Mitigation of erosion of Mangaldoi town and its adjoining areas from the river Mangaldoi.,Please refer Tender documents. ,NA ,"2,53,21,357",Civil Works,NA ,Tender,180.0,90.0,MANGALDAI,784125.0,NA ,NA ,NA ,GUWAHATI,No ,No,AOC,1,217273,JYOTIRMOY SARMA,28-Dec-2023 06:41 PM,Accepted-AOC,PROPER,17-Apr-2024 09:09 PM,Department of Water Resources||Chief Engineer - DoWR,2023_DoWR_31698_2,MANGALDOI/2023-24/SDMF/I,Mitigation of erosion of Mangaldoi town and its adjoining areas from the river Mangaldoi. Package 1 RETENDER,AOC
,,,,,,,,,,,,,,2.0,Finance,.xls,BOQ,,,,,,,,,,,,,,,,,,,,,,,,,,,,,,,,,,,,,,,,,,AOC,2,217218,RAJENDRA CHAUDHURY,26-Dec-2023 07:27 PM,Rejected-Technical,Technically Non Responsive,19-Feb-2024 04:12 PM,,,,,AOC
,,,,,,,,,,,,,,,,,,,,,,,,,,,,,,,,,,,,,,,,,,,,,,,,,,,,,,,,,,,AOC,3,217159,RAJLOSON SARMA,27-Dec-2023 05:53 PM,Rejected-Technical,Technically Non Responsive,19-Feb-2024 04:12 PM,,,,,AOC
,,,,,,,,,,,,,,,,,,,,,,,,,,,,,,,,,,,,,,,,,,,,,,,,,,,,,,,,,,,AOC,4,217866,REZWAN ANSARI,29-Dec-2023 12:34 PM,Rejected-AOC,NOT QUALIFIED FOR AOC,17-Apr-2024 09:09 PM,,,,,AOC
,,,,,,,,,,,,,,,,,,,,,,,,,,,,,,,,,,,,,,,,,,,,,,,,,,,,,,,,,,,AOC,5,217564,Surajit Roy,29-Dec-2023 10:44 AM,Rejected-AOC,NOT QUALIFIED FOR AOC,17-Apr-2024 09:09 PM,,,,,AOC
