Organisation Chain,Tender Reference Number,Tender ID,Withdrawal Allowed,Tender Type,Form of contract,Tender Category,No. of Covers,General Technical Evaluation Allowed,ItemWise Technical Evaluation Allowed,Payment Mode,Is Multi Currency Allowed For BOQ,Is Multi Currency Allowed For Fee,Allow Two Stage Bidding,Cover No,Cover,Document Type,Description,Publish Date,Bid Opening Date,Document Download / Sale Start Date,Document Download / Sale End Date,Clarification Start Date,Clarification End Date,Bid Submission Start Date,Bid Submission End Date,Financial Bid Opening Date,EMD Amount in ₹,EMD Exemption Allowed,EMD Fee Type,EMD Percentage,EMD Payable To,EMD Payable At,S.No,Bank Name,Tender Fee in ₹,Fee Payable To,Fee Payable At,Tender Fee Exemption Allowed,Name,Address,Title,Work Description,Pre Qualification Details,Independent External Monitor/Remarks,Tender Value in ₹,Product Category,Sub category,Contract Type,Bid Validity(Days),Period Of Work(Days),Location,Pincode,Pre Bid Meeting Place,Pre Bid Meeting Address,Pre Bid Meeting Date,Bid Opening Place,Should Allow NDA Tender,Allow Preferential Bidder,Tender Stage,Contract Date :,Contract Value :,Work Completion Period in days :,Updated By :,Updated on :,AOC document :,S.No,Bid Number,Bidder Name,Awarded Currency,Awarded Value,S.No.1,Bid Number.1,Bidder Name.1,Submitted Date,Status,Remarks,Status Updated On,Type :,Summary :,Updated By :.1,Updated On :,Document :,BOQ Comparative Chart :,Committee Chairperson/Co-ordinator Name :,Committee Chairperson/Co-ordinator Type :,Committee Members :,Updated By :.2,Updated on :.1,Document :.1,Organisation Chain :,Tender ID :,Tender Ref No :,Tender Title :,Type :.1,Summary :.1,Updated By :.3,Updated On :.1,Document :.2,Committee Chairperson/Co-ordinator Name :.1,Committee Chairperson/Co-ordinator Type :.1,Committee Members :.1,Updated By :.4,Updated On :.2,Financial Bid Opening Date:,Document :.3,Tender Stage
"Pr. Chief Conservator of Forest and Head of Forest Force||Chief Conservator of Forests (Upper Assam Zone)||Northern Assam Circle, Tezpur||Dhemaji Division",FDMD/B/APFBC Phase II(JFMC)/2024/2751,2024_PCCF_40611_1,Yes,Open Tender,Percentage,Works,2.0,No,No,Online,No,No,No,1.0,Fee/PreQual/Technical,.pdf,Technical Documents,27-Nov-2024 12:30 PM,11-Dec-2024 03:30 PM,27-Nov-2024 12:30 PM,11-Dec-2024 03:00 PM,27-Nov-2024 12:30 PM ,11-Dec-2024 12:00 PM ,27-Nov-2024 12:30 PM,11-Dec-2024 03:00 PM,31-Dec-2024 02:30 PM,"40,000",Yes,percentage,2.0%,Nil,Nil,1.0,SBI Bank,"1,000",Nil,Nil,No,DFO Dhemaji,"Lachit Nagar, Khualia, Dhemaji",Construction of Community Hall at Sirung JFMC,Construction of Community Hall at Sirung JFMC under Jonai Range,Class I ,NA ,"20,00,000",Civil Works,NA ,Tender,90.0,NA ,Sirung JFMC under Jonai Range,787060.0,DFO Office Dhemaji ,"Lachit Nagar, Khualia, Dhemaji ",02-Dec-2024 02:00 PM ,DFO Office Dhemaji,No ,No,AOC,10-Feb-2025,"INR 2,000,000",90.0,Krishna Kamal Deuri,10-Feb-2025 12:23 PM,AOC_Sirung.pdf (635.00 KB),1.0,250007.0,Sri Bijoy Deori,INR,"1,800,000",1,250559,Benudhar Medok,11-Dec-2024 01:58 PM,Not Admitted-Fee/PreQual/Technical,Not Complied with technical specification,31-Dec-2024 01:32 PM,Finance,After detailed review of the financial bids of the bidders both the bidders have admitted.,Krishna Kamal Deuri,01-Feb-2025 03:12 PM,finance_65738.pdf,BOQ Comparative Chart,"Divisional Forest Officer, Dhemaji Division, Dhemaji",Internal,"1. Range Officer, Dhemaji Range, 2. Accountant, O/o the DFO, Dhemaji Division, Dhemaji",Krishna Kamal Deuri,10-Feb-2025 12:11 PM,finsummary_65738.pdf (525.08 KB),"Pr. Chief Conservator of Forest and Head of Forest Force||Chief Conservator of Forests (Upper Assam Zone)||Northern Assam Circle, Tezpur||Dhemaji Division",2024_PCCF_40611_1,FDMD/B/APFBC Phase II(JFMC)/2024/2751,Construction of Community Hall at Sirung JFMC,Technical,"After detail review of all the bidders document by the committee, it is found that out of 5 bidders, 2 bidders have compiled with all the necessary requirements of the technical bid.",Krishna Kamal Deuri,31-Dec-2024 01:32 PM,technical_65738.pdf,"Divisional Forest Officer, Dhemaji Division, Dhemaji",Internal,"1. Range Officer, Dhemaji Range, Dhemaji 2. accountant, O/o he DFO Dhemaji",Krishna Kamal Deuri,31-Dec-2024 01:39 PM,31-Dec-2024 02:30 PM,techsummary_65738.pdf (525.95 KB),AOC
,,,,,,,,,,,,,,,,.pdf,Bid documents to be downloaded from the portal,,,,,,,,,,,,,,,,,,,,,,,,,,,,,,,,,,,,,,,,,,AOC,,,,,,,,,,,,2,250477,DIMBESWAR BORAH,11-Dec-2024 02:28 PM,Not Admitted-Fee/PreQual/Technical,Not Complied with technical specification,31-Dec-2024 01:32 PM,,,,,,,,,,,,,,,,,,,,,,,,,,,,,AOC
,,,,,,,,,,,,,,2.0,Finance,.xls,BOQ,,,,,,,,,,,,,,,,,,,,,,,,,,,,,,,,,,,,,,,,,,AOC,,,,,,,,,,,,3,250287,Jiban Gogoi,07-Dec-2024 10:05 PM,Rejected-Finance,Tender amount is too low against the Government value,10-Feb-2025 12:11 PM,,,,,,,,,,,,,,,,,,,,,,,,,,,,,AOC
,,,,,,,,,,,,,,,,,,,,,,,,,,,,,,,,,,,,,,,,,,,,,,,,,,,,,,,,,,,AOC,,,,,,,,,,,,4,250358,PABITRA TAYUNG,09-Dec-2024 03:10 PM,Not Admitted-Fee/PreQual/Technical,Not Complied with technical specification,31-Dec-2024 01:32 PM,,,,,,,,,,,,,,,,,,,,,,,,,,,,,AOC
,,,,,,,,,,,,,,,,,,,,,,,,,,,,,,,,,,,,,,,,,,,,,,,,,,,,,,,,,,,AOC,,,,,,,,,,,,5,250007,Sri Bijoy Deori,06-Dec-2024 03:00 PM,Accepted-AOC,Awarded,10-Feb-2025 12:23 PM,,,,,,,,,,,,,,,,,,,,,,,,,,,,,AOC
