Organisation Chain,Tender Reference Number,Tender ID,Withdrawal Allowed,Tender Type,Form of contract,Tender Category,No. of Covers,General Technical Evaluation Allowed,ItemWise Technical Evaluation Allowed,Payment Mode,Is Multi Currency Allowed For BOQ,Is Multi Currency Allowed For Fee,Allow Two Stage Bidding,Cover No,Cover,Document Type,Description,Publish Date,Bid Opening Date,Document Download / Sale Start Date,Document Download / Sale End Date,Clarification Start Date,Clarification End Date,Bid Submission Start Date,Bid Submission End Date,Financial Bid Opening Date,EMD Amount in ₹,EMD Exemption Allowed,EMD Fee Type,EMD Percentage,EMD Payable To,EMD Payable At,S.No,Bank Name,Tender Fee in ₹,Fee Payable To,Fee Payable At,Tender Fee Exemption Allowed,Name,Address,Title,Work Description,Pre Qualification Details,Independent External Monitor/Remarks,Tender Value in ₹,Product Category,Sub category,Contract Type,Bid Validity(Days),Period Of Work(Days),Location,Pincode,Pre Bid Meeting Place,Pre Bid Meeting Address,Pre Bid Meeting Date,Bid Opening Place,Should Allow NDA Tender,Allow Preferential Bidder,Tender Stage,Contract Date :,Contract Value :,Work Completion Period in days :,Updated By :,Updated on :,AOC document :,AOC Description :,S.No,Bid Number,Bidder Name,Awarded Currency,Awarded Value,S.No.1,Bid Number.1,Bidder Name.1,Submitted Date,Status,Remarks,Status Updated On,Type :,Summary :,Updated By :.1,Updated On :,Document :,BOQ Comparative Chart :,Committee Chairperson/Co-ordinator Name :,Committee Chairperson/Co-ordinator Type :,Committee Members :,Updated By :.2,Updated on :.1,Document :.1,Organisation Chain :,Tender ID :,Tender Ref No :,Tender Title :,Type :.1,Summary :.1,Updated By :.3,Updated On :.1,Document :.2,Committee Chairperson/Co-ordinator Name :.1,Committee Chairperson/Co-ordinator Type :.1,Committee Members :.1,Updated By :.4,Updated On :.2,Financial Bid Opening Date:,Document :.3,Tender Stage
Dibrugarh University,DU/RG/B.01.13/2024/6463,2024_DU_35858_1,Yes,Open Tender,Supply,Goods,2.0,No,No,Online,No,No,No,1.0,Fee/PreQual/Technical,.pdf,"EMD, Tender Fee",02-Feb-2024 09:30 AM,01-Mar-2024 11:00 AM,02-Feb-2024 09:30 AM,29-Feb-2024 05:00 PM,NA ,NA ,02-Feb-2024 10:00 AM,29-Feb-2024 05:00 PM,01-Mar-2024 03:00 PM,"2,00,000",Yes,fixed,,Nil,Nil,1.0,SBI Bank,"1,000",Nil,Nil,Yes,Registrar Dibrugarh University,Office of the Registrar Dibrugarh University Dibrugarh Assam,"Supply, Installation and Commissioning of Furniture-Fixtures at Dibrugarh University","Supply, Installation and Commissioning of Furniture-Fixtures at Dibrugarh University",Please refer Tender documents. ,NA ,,Furniture/ Fixture,NA ,Tender,180.0,60.0,Dibrugarh University,786004.0,NA ,NA ,NA ,Dibrugarh University,No ,No,AOC,14-Feb-2025,"INR 3,951,168.36",60.0,Paramananda Sonowal,14-Feb-2025 01:36 PM,AOC.pdf (37444.00 KB),"Order placed to L1, Methodex system pvt. ltd. and B.N. Agarwalla co.",1.0,227850.0,M/S B. N. AGARWALLA & CO.,INR,"756,600",1,227570,Khaitan Carpet Corporation,29-Feb-2024 08:59 AM,Rejected-AOC,L2 L3,14-Feb-2025 01:36 PM,Finance,"6 bids received, 3 accepted",Diganta Saikia,14-Feb-2025 12:43 PM,finance_58613.pdf,BOQ Comparative Chart,Prof. S.C. Kakaty,Internal,"Asst. Registrar (admn), Technical officer, Junior Engineer (civil) Estate Officer, Deputy Registrar (admn)",Paramananda Sonowal,14-Feb-2025 01:25 PM,finsummary_58613.pdf (3841.39 KB),Dibrugarh University,2024_DU_35858_1,DU/RG/B.01.13/2024/6463,"Supply, Installation and Commissioning of Furniture-Fixtures at Dibrugarh University",Technical,"6 bids received, 3 qualified and 3 rejected",Karunakar Borah,01-Mar-2024 02:47 PM,technical_58613.pdf,Prof S C Kakoty,Internal,"Ruhini Kr. Buragohain, Umesh Kuli, Dwajen Sonowal, Bhaskar Jyoti Sonowal, Karunakar Borah",Karunakar Borah,01-Mar-2024 02:59 PM,01-Mar-2024 03:00 PM,techsummary_58613.pdf (482.85 KB),AOC
,,,,,,,,,,,,,,,,.pdf,Technical Bid,,,,,,,,,,,,,,,,,,,,,,,,,,,,,,,,,,,,,,,,,,AOC,,,,,,,,2.0,226971.0,METHODEX SYSTEMS PRIVATE LIMITED,INR,"2,851,512.36",2,224208,KHANDELWAL AND KHANDELWAL,10-Feb-2024 01:59 PM,Not Admitted-Fee/PreQual/Technical,Not Complied with technical specification,01-Mar-2024 02:47 PM,,,,,,,,,,,,,,,,,,,,,,,,,,,,,AOC
,,,,,,,,,,,,,,2.0,Finance,.xls,BoQ,,,,,,,,,,,,,,,,,,,,,,,,,,,,,,,,,,,,,,,,,,AOC,,,,,,,,,,,,,3,226971,METHODEX SYSTEMS PRIVATE LIMITED,29-Feb-2024 12:56 PM,Accepted-AOC,L1,14-Feb-2025 01:36 PM,,,,,,,,,,,,,,,,,,,,,,,,,,,,,AOC
,,,,,,,,,,,,,,,,,,,,,,,,,,,,,,,,,,,,,,,,,,,,,,,,,,,,,,,,,,,AOC,,,,,,,,,,,,,4,227850,M/S B. N. AGARWALLA & CO.,29-Feb-2024 04:18 PM,Accepted-AOC,L1,14-Feb-2025 01:36 PM,,,,,,,,,,,,,,,,,,,,,,,,,,,,,AOC
,,,,,,,,,,,,,,,,,,,,,,,,,,,,,,,,,,,,,,,,,,,,,,,,,,,,,,,,,,,AOC,,,,,,,,,,,,,5,227277,SOHAM IMPEX,24-Feb-2024 11:46 AM,Not Admitted-Fee/PreQual/Technical,Not Complied with technical specification,01-Mar-2024 02:47 PM,,,,,,,,,,,,,,,,,,,,,,,,,,,,,AOC
,,,,,,,,,,,,,,,,,,,,,,,,,,,,,,,,,,,,,,,,,,,,,,,,,,,,,,,,,,,AOC,,,,,,,,,,,,,6,228118,SPARKLING HUES GEMS PRIVATE LIMITED,29-Feb-2024 04:56 PM,Not Admitted-Fee/PreQual/Technical,Not Complied with technical specification,01-Mar-2024 02:47 PM,,,,,,,,,,,,,,,,,,,,,,,,,,,,,AOC
