Organisation Chain,Tender Reference Number,Tender ID,Withdrawal Allowed,Tender Type,Form of contract,Tender Category,No. of Covers,General Technical Evaluation Allowed,ItemWise Technical Evaluation Allowed,Payment Mode,Is Multi Currency Allowed For BOQ,Is Multi Currency Allowed For Fee,Allow Two Stage Bidding,Cover No,Cover,Document Type,Description,Publish Date,Bid Opening Date,Document Download / Sale Start Date,Document Download / Sale End Date,Clarification Start Date,Clarification End Date,Bid Submission Start Date,Bid Submission End Date,Financial Bid Opening Date,EMD Amount in ₹,EMD Exemption Allowed,EMD Fee Type,EMD Percentage,EMD Payable To,EMD Payable At,S.No,Bank Name,Tender Fee in ₹,Fee Payable To,Fee Payable At,Tender Fee Exemption Allowed,Name,Address,Title,Work Description,Pre Qualification Details,Independent External Monitor/Remarks,Tender Value in ₹,Product Category,Sub category,Contract Type,Bid Validity(Days),Period Of Work(Days),Location,Pincode,Pre Bid Meeting Place,Pre Bid Meeting Address,Pre Bid Meeting Date,Bid Opening Place,Should Allow NDA Tender,Allow Preferential Bidder,Tender Stage,Contract Date :,Contract Value :,Work Completion Period in days :,Updated By :,Updated on :,AOC document :,AOC Description :,S.No,Bid Number,Bidder Name,Awarded Currency,Awarded Value,S.No.1,Bid Number.1,Bidder Name.1,Submitted Date,Status,Remarks,Status Updated On,Type :,Summary :,Updated By :.1,Updated On :,Document :,BOQ Comparative Chart :,Committee Chairperson/Co-ordinator Name :,Committee Chairperson/Co-ordinator Type :,Committee Members :,Updated By :.2,Updated on :.1,Document :.1,Organisation Chain :,Tender ID :,Tender Ref No :,Tender Title :,Type :.1,Summary :.1,Updated By :.3,Updated On :.1,Document :.2,Committee Chairperson/Co-ordinator Name :.1,Committee Chairperson/Co-ordinator Type :.1,Committee Members :.1,Updated By :.4,Updated On :.2,Financial Bid Opening Date:,Document :.3,Tender Stage
Health and Family Welfare Department||Directorate of Medical Education-HFWD||Nagaon Medical College and Hospital-HFWD,NagaonMC/2023-24/075,2025_HFWD_41947_1,Yes,Open Tender,Item Wise,Services,2.0,No,Yes,Online,No,No,No,1.0,Fee/PreQual/Technical,.pdf,Detailed Information on the Tender,08-Jan-2025 02:00 PM,30-Jan-2025 02:00 PM,09-Jan-2025 02:00 PM,29-Jan-2025 05:00 PM,NA ,NA ,10-Jan-2025 11:00 AM,29-Jan-2025 05:00 PM,13-Feb-2025 05:00 PM,"2,00,000",Yes,fixed,,Nil,Nil,1.0,SBI Bank,"5,000",Nil,Nil,Yes,Principal cum Chief Superintendent,Principal cum Chief Superintendent of Nagaon Medical College,Annual Job Contract of Security Services in the premises of Nagaon Medical College and Hospital,Providing Security in and around Nagaon Medical College Campus including Hospital,Please refer Tender documents. ,NA ,,Manpower Supply,NA ,Tender,270.0,NA ,"Nagaon MCH at Diphalu, Nagaon",782003.0,NA ,NA ,NA ,Office of the Principal og Nagaon Medical College,No ,No,AOC,01-Mar-2025,"INR 73,936.1",365.0,Nayan Mani Pathak,14-Feb-2025 06:22 PM,AWC.pdf (353.00 KB),Contract value at per month per person basis.,1.0,256786.0,saraighat security and services,INR,"73,936.14",1,256375,BOMBAY INTEGRATED SECURITY (INDIA) LIMITD,29-Jan-2025 03:33 PM,Rejected-AOC,L2 bidder AOC not awarded,14-Feb-2025 06:22 PM,Finance,"Out of 7 technically qualified bidders, 5 bidders were rejected from financial evaluation for quoting less than the minimum required 10 percent agency charges. Remaining 2 bidders are accepted for financial evaluation.",Nayan Mani Pathak,14-Feb-2025 06:11 PM,finance_67475.pdf,BOQ Comparative Chart,Dr Uddip Talukdar,Internal,"Dr Nayan Mani Pathak, Dr Rajat Dutta Roy, Dr Kahua Das Thakuria, Dr Prasanjit Kumar Debnath, Dr Bipanchi Mahanta, Dr Mandeep Sarma Basistha",Nayan Mani Pathak,14-Feb-2025 06:18 PM,finsummary_67475.pdf (161.25 KB),Health and Family Welfare Department||Directorate of Medical Education-HFWD||Nagaon Medical College and Hospital-HFWD,2025_HFWD_41947_1,NagaonMC/2023-24/075,Annual Job Contract of Security Services in the premises of Nagaon Medical College and Hospital,Technical,Documents submitted by the parties have been checked and admitted accordingly.,Nayan Mani Pathak,13-Feb-2025 04:23 PM,technical_67475.pdf,Dr Uddip Talukdar,Internal,"Dr Nayan Mani Pathak, Dr Rajat Dutta Roy, Dr Kahua Das Thakuria, Dr Prasanjit Kumar Debnath, Dr Bipanchi Mahanta, Dr Mandeep Sarma Basistha",Nayan Mani Pathak,13-Feb-2025 04:30 PM,13-Feb-2025 05:00 PM,techsummary_67475.pdf (161.25 KB),AOC
,,,,,,,,,,,,,,2.0,Finance,.xls,BOQ submission socument,,,,,,,,,,,,,,,,,,,,,,,,,,,,,,,,,,,,,,,,,,AOC,,,,,,,,,,,,,2,256567,CFS MANAGEMENT PRIVATE LIMITED,28-Jan-2025 01:12 PM,Not Admitted-Finance,Others-Quoted Daily wage is less than current basic wage,14-Feb-2025 06:11 PM,,,,,,,,,,,,,,,,,,,,,,,,,,,,,AOC
,,,,,,,,,,,,,,,,,,,,,,,,,,,,,,,,,,,,,,,,,,,,,,,,,,,,,,,,,,,AOC,,,,,,,,,,,,,3,256891,Goswami Security Services Pvt. Ltd.,29-Jan-2025 04:36 PM,Not Admitted-Finance,Others-Quoted rate is less than the minimum agency charge of 10%,14-Feb-2025 06:11 PM,,,,,,,,,,,,,,,,,,,,,,,,,,,,,AOC
,,,,,,,,,,,,,,,,,,,,,,,,,,,,,,,,,,,,,,,,,,,,,,,,,,,,,,,,,,,AOC,,,,,,,,,,,,,4,255332,INNOVISION LIMITED,23-Jan-2025 11:40 AM,Not Admitted-Finance,Others-Quoted rate is less than the minimum agency charge of 10%,14-Feb-2025 06:11 PM,,,,,,,,,,,,,,,,,,,,,,,,,,,,,AOC
,,,,,,,,,,,,,,,,,,,,,,,,,,,,,,,,,,,,,,,,,,,,,,,,,,,,,,,,,,,AOC,,,,,,,,,,,,,5,255623,Legends Security and Placement Service,27-Jan-2025 07:54 PM,Not Admitted-Finance,Others-Quoted rate is less than the minimum agency charge of 10%,14-Feb-2025 06:11 PM,,,,,,,,,,,,,,,,,,,,,,,,,,,,,AOC
,,,,,,,,,,,,,,,,,,,,,,,,,,,,,,,,,,,,,,,,,,,,,,,,,,,,,,,,,,,AOC,,,,,,,,,,,,,6,255473,Metro family service,27-Jan-2025 06:15 PM,Not Admitted-Finance,Others-Quoted rate is less than the minimum agency charge of 10%,14-Feb-2025 06:11 PM,,,,,,,,,,,,,,,,,,,,,,,,,,,,,AOC
,,,,,,,,,,,,,,,,,,,,,,,,,,,,,,,,,,,,,,,,,,,,,,,,,,,,,,,,,,,AOC,,,,,,,,,,,,,7,256786,saraighat security and services,29-Jan-2025 02:50 PM,Accepted-AOC,Contract awarded to Lowest bidder.,14-Feb-2025 06:22 PM,,,,,,,,,,,,,,,,,,,,,,,,,,,,,AOC
