Organisation Chain,Tender Reference Number,Tender ID,Withdrawal Allowed,Tender Type,Form of contract,Tender Category,No. of Covers,General Technical Evaluation Allowed,ItemWise Technical Evaluation Allowed,Payment Mode,Is Multi Currency Allowed For BOQ,Is Multi Currency Allowed For Fee,Allow Two Stage Bidding,Cover No,Cover,Document Type,Description,Publish Date,Bid Opening Date,Document Download / Sale Start Date,Document Download / Sale End Date,Clarification Start Date,Clarification End Date,Bid Submission Start Date,Bid Submission End Date,Financial Bid Opening Date,EMD Amount in ₹,EMD Exemption Allowed,EMD Fee Type,EMD Percentage,EMD Payable To,EMD Payable At,S.No,Bank Name,Tender Fee in ₹,Fee Payable To,Fee Payable At,Tender Fee Exemption Allowed,Name,Address,Title,Work Description,Pre Qualification Details,Independent External Monitor/Remarks,Tender Value in ₹,Product Category,Sub category,Contract Type,Bid Validity(Days),Period Of Work(Days),Location,Pincode,Pre Bid Meeting Place,Pre Bid Meeting Address,Pre Bid Meeting Date,Bid Opening Place,Should Allow NDA Tender,Allow Preferential Bidder,Tender Stage,Contract Date :,Contract Value :,Work Completion Period in days :,Updated By :,Updated on :,AOC document :,S.No,Bid Number,Bidder Name,Awarded Currency,Awarded Value,S.No.1,Bid Number.1,Bidder Name.1,Submitted Date,Status,Remarks,Status Updated On,Type :,Summary :,Updated By :.1,Updated On :,Document :,BOQ Comparative Chart :,Committee Chairperson/Co-ordinator Name :,Committee Chairperson/Co-ordinator Type :,Committee Members :,Updated By :.2,Updated on :.1,Document :.1,Organisation Chain :,Tender ID :,Tender Ref No :,Tender Title :,Type :.1,Summary :.1,Updated By :.3,Updated On :.1,Document :.2,Committee Chairperson/Co-ordinator Name :.1,Committee Chairperson/Co-ordinator Type :.1,Committee Members :.1,Updated By :.4,Updated On :.2,Financial Bid Opening Date:,Document :.3,Tender Stage
Department of Housing and Urban Affairs||Guwahati Utilities Company Limited,GUCL/Elect/122/24/ 92 Date 29 / 08/ 2024,2024_DHUA_38691_1,Yes,Open Tender,Lump-sum,Services,2.0,No,No,Online,No,No,No,1.0,Fee/PreQual/Technical,.pdf,SBD,30-Aug-2024 02:00 PM,12-Sep-2024 03:00 PM,30-Aug-2024 02:00 PM,12-Sep-2024 02:00 PM,NA ,NA ,30-Aug-2024 02:00 PM,12-Sep-2024 02:00 PM,05-Nov-2024 12:00 PM,"1,03,820",Yes,fixed,,Nil,Nil,1.0,SBI Bank,"1,000",Nil,Nil,No,"The Managing Director, GUCL","OFFICE OF THE Managing Director, GUCL, GHY-05",Operation and Maintenance of High Mast Lights in Guwahati city,Operation and Maintenance of High Mast Lights in Guwahati city,Please refer Tender documents. ,NA ,"51,90,855",Miscellaneous Services,NA ,Tender,180.0,90.0,GUWAHATI,781006.0,NA ,NA ,NA ,"OFFICE OF THE Managing Director, GUCL, GHY-05",No ,No,AOC,17-Feb-2025,"INR 5,190,855",90.0,Bedanta Kalita,17-Feb-2025 01:56 PM,workorder.pdf (638.00 KB),1.0,238890.0,NEW SURJYA ELECTRICAL,INR,"3,581,689.95",1,238460,Global Enterprise,12-Sep-2024 01:43 PM,Rejected-Finance,As per committee evaluation,17-Feb-2025 01:37 PM,Finance,Financial Bids submitted by the bidders have been considered for further Evaluation.,Mugdhajyoti Dev Mahanta,05-Nov-2024 02:36 PM,finance_62560.pdf,BOQ Comparative Chart,MD GUCL,Internal,,Bedanta Kalita,17-Feb-2025 01:37 PM,finsummary_62560.pdf (551.76 KB),Department of Housing and Urban Affairs||Guwahati Utilities Company Limited,2024_DHUA_38691_1,GUCL/Elect/122/24/ 92 Date 29 / 08/ 2024,Operation and Maintenance of High Mast Lights in Guwahati city,Technical,Cost of Bid documents / Bid Security / Technical Bids submitted by the bidders have been considered for further Evaluation.,Mugdhajyoti Dev Mahanta,16-Sep-2024 03:05 PM,technical_62560.pdf,Managing Director GUCL,Internal,"Supdt. Engineer, GUCL, Technical Officer, GUCL, JM",Bedanta Kalita,05-Nov-2024 10:48 AM,05-Nov-2024 12:00 PM,techsummary_62560.pdf (3316.21 KB),AOC
,,,,,,,,,,,,,,,,.pdf,Technical Documents,,,,,,,,,,,,,,,,,,,,,,,,,,,,,,,,,,,,,,,,,,AOC,,,,,,,,,,,,2,239159,M/S Azad Constructions,11-Sep-2024 08:30 PM,Rejected-Technical,Details mentioned in the Minutes,05-Nov-2024 10:48 AM,,,,,,,,,,,,,,,,,,,,,,,,,,,,,AOC
,,,,,,,,,,,,,,2.0,Finance,.xls,BOQ,,,,,,,,,,,,,,,,,,,,,,,,,,,,,,,,,,,,,,,,,,AOC,,,,,,,,,,,,3,238890,NEW SURJYA ELECTRICAL,12-Sep-2024 01:56 PM,Accepted-AOC,As per Tender Committee,17-Feb-2025 01:56 PM,,,,,,,,,,,,,,,,,,,,,,,,,,,,,AOC
,,,,,,,,,,,,,,,,,,,,,,,,,,,,,,,,,,,,,,,,,,,,,,,,,,,,,,,,,,,AOC,,,,,,,,,,,,4,239194,Nipu Das,12-Sep-2024 12:17 PM,Rejected-Finance,As per committee evaluation,17-Feb-2025 01:37 PM,,,,,,,,,,,,,,,,,,,,,,,,,,,,,AOC
,,,,,,,,,,,,,,,,,,,,,,,,,,,,,,,,,,,,,,,,,,,,,,,,,,,,,,,,,,,AOC,,,,,,,,,,,,5,239125,ONE TO TEN SOLUTION PRIVATE LIMITED,11-Sep-2024 07:10 PM,Rejected-Finance,As per committee evaluation,17-Feb-2025 01:37 PM,,,,,,,,,,,,,,,,,,,,,,,,,,,,,AOC
,,,,,,,,,,,,,,,,,,,,,,,,,,,,,,,,,,,,,,,,,,,,,,,,,,,,,,,,,,,AOC,,,,,,,,,,,,6,239170,Sri Girin Chutia,12-Sep-2024 12:27 PM,Rejected-Finance,As per committee evaluation,17-Feb-2025 01:37 PM,,,,,,,,,,,,,,,,,,,,,,,,,,,,,AOC
