Organisation Chain,Tender Reference Number,Tender ID,Withdrawal Allowed,Tender Type,Form of contract,Tender Category,No. of Covers,General Technical Evaluation Allowed,ItemWise Technical Evaluation Allowed,Payment Mode,Is Multi Currency Allowed For BOQ,Is Multi Currency Allowed For Fee,Allow Two Stage Bidding,Cover No,Cover,Document Type,Description,Publish Date,Bid Opening Date,Document Download / Sale Start Date,Document Download / Sale End Date,Clarification Start Date,Clarification End Date,Bid Submission Start Date,Bid Submission End Date,Financial Bid Opening Date,EMD Amount in ₹,EMD Exemption Allowed,EMD Fee Type,EMD Percentage,EMD Payable To,EMD Payable At,S.No,Bank Name,Tender Fee in ₹,Fee Payable To,Fee Payable At,Tender Fee Exemption Allowed,Name,Address,Title,Work Description,Pre Qualification Details,Independent External Monitor/Remarks,Tender Value in ₹,Product Category,Sub category,Contract Type,Bid Validity(Days),Period Of Work(Days),Location,Pincode,Pre Bid Meeting Place,Pre Bid Meeting Address,Pre Bid Meeting Date,Bid Opening Place,Should Allow NDA Tender,Allow Preferential Bidder,Tender Stage,Contract Date :,Contract Value :,Work Completion Period in days :,Updated By :,Updated on :,AOC document :,AOC Description :,S.No,Bid Number,Bidder Name,Awarded Currency,Awarded Value,S.No.1,Bid Number.1,Bidder Name.1,Submitted Date,Status,Remarks,Status Updated On,Type :,Summary :,Updated By :.1,Updated On :,Document :,BOQ Comparative Chart :,Committee Chairperson/Co-ordinator Name :,Committee Chairperson/Co-ordinator Type :,Committee Members :,Updated By :.2,Updated on :.1,Document :.1,Organisation Chain :,Tender ID :,Tender Ref No :,Tender Title :,Type :.1,Summary :.1,Updated By :.3,Updated On :.1,Document :.2,Committee Chairperson/Co-ordinator Name :.1,Committee Chairperson/Co-ordinator Type :.1,Committee Members :.1,Updated By :.4,Updated On :.2,Financial Bid Opening Date:,Document :.3,Tender Stage
Department of Water Resources||Chief Engineer - DoWR,TAMULPUR/2024-25/RIDF/II,2024_DoWR_40313_1,Yes,Open Tender,Item Rate,Works,2.0,No,No,Online,No,No,No,1.0,Fee/PreQual/Technical,.pdf,Technical Documents,12-Nov-2024 06:30 PM,03-Dec-2024 03:00 PM,12-Nov-2024 06:35 PM,03-Dec-2024 02:00 PM,NA ,NA ,23-Nov-2024 10:00 AM,03-Dec-2024 02:00 PM,18-Dec-2024 02:10 PM,"11,47,975",Yes,percentage,2.0%,Nil,Nil,1.0,SBI Bank,"10,000",Nil,Nil,No,"Chief Engineer, Water Resources Department.","O/o the Chief Engineer, Assam Water Centre, 5th Floor, Basistha, Guwahati-29.",Construction of embankment on L/B of suklai river from Dikpar to Barpathar (Via Ghatirpam).,Construction of embankment on L/B of suklai river from Dikpar to Barpathar (Via Ghatirpam).,Please refer Tender documents. ,NA ,"5,73,98,759",Civil Works,NA ,Tender,180.0,NA ,"Dikpar to Barpathar (Via Ghatirpam),Tamulpur",781364.0,NA ,NA ,NA ,Guwahati,No ,No,AOC,19-Feb-2025,"INR 51,658,884",365.0,Jayanta Kumar Barman,19-Feb-2025 07:44 PM,tamulpur_ghatirpam.pdf (692.00 KB),Construction of embankment on L/B of suklai river from Dikpar to Barpathar (Via Ghatirpam).,1.0,249248.0,RWIRUP MUSHAHARY,INR,"51,658,884",1,249657,AVIGHNA ASSOCIATES,01-Dec-2024 08:22 PM,Rejected-AOC,Not Qualified for AOC,19-Feb-2025 07:44 PM,Finance,Updated CS may be prepared,Jayanta Kumar Barman,13-Jan-2025 12:17 PM,,BOQ Comparative Chart,Director Design,Internal,,Jayanta Kumar Barman,19-Feb-2025 07:39 PM,finsummary_65414.pdf (842.77 KB),Department of Water Resources||Chief Engineer - DoWR,2024_DoWR_40313_1,TAMULPUR/2024-25/RIDF/II,Construction of embankment on L/B of suklai river from Dikpar to Barpathar (Via Ghatirpam).,Technical,All Bids are opened for Technical Evaluation,Jayanta Kumar Barman,18-Dec-2024 01:58 PM,,Director Design,Internal,,Jayanta Kumar Barman,18-Dec-2024 02:05 PM,18-Dec-2024 02:10 PM,techsummary_65414.pdf (173.72 KB),AOC
,,,,,,,,,,,,,,2.0,Finance,.xls,B.O.Q.,,,,,,,,,,,,,,,,,,,,,,,,,,,,,,,,,,,,,,,,,,AOC,,,,,,,,,,,,,2,249834,BIRKHANG BASUMATARY,03-Dec-2024 01:37 PM,Rejected-Technical,Not admitted,18-Dec-2024 02:05 PM,,,,,,,,,,,,,,,,,,,,,,,,,,,,,AOC
,,,,,,,,,,,,,,,,,,,,,,,,,,,,,,,,,,,,,,,,,,,,,,,,,,,,,,,,,,,AOC,,,,,,,,,,,,,3,249728,K C INFRA PROJECTS PRIVATE LTD,02-Dec-2024 04:45 PM,Rejected-AOC,Not Qualified for AOC,19-Feb-2025 07:44 PM,,,,,,,,,,,,,,,,,,,,,,,,,,,,,AOC
,,,,,,,,,,,,,,,,,,,,,,,,,,,,,,,,,,,,,,,,,,,,,,,,,,,,,,,,,,,AOC,,,,,,,,,,,,,4,249588,Prasanta Bayan,02-Dec-2024 04:04 PM,Rejected-AOC,Not Qualified for AOC,19-Feb-2025 07:44 PM,,,,,,,,,,,,,,,,,,,,,,,,,,,,,AOC
,,,,,,,,,,,,,,,,,,,,,,,,,,,,,,,,,,,,,,,,,,,,,,,,,,,,,,,,,,,AOC,,,,,,,,,,,,,5,249591,PULIN BORGOHAIN,03-Dec-2024 01:56 PM,Rejected-AOC,Not Qualified for AOC,19-Feb-2025 07:44 PM,,,,,,,,,,,,,,,,,,,,,,,,,,,,,AOC
,,,,,,,,,,,,,,,,,,,,,,,,,,,,,,,,,,,,,,,,,,,,,,,,,,,,,,,,,,,AOC,,,,,,,,,,,,,6,249248,RWIRUP MUSHAHARY,26-Nov-2024 11:26 AM,Accepted-AOC,AWARDED,19-Feb-2025 07:44 PM,,,,,,,,,,,,,,,,,,,,,,,,,,,,,AOC
