Organisation Chain,Tender Reference Number,Tender ID,Withdrawal Allowed,Tender Type,Form of contract,Tender Category,No. of Covers,General Technical Evaluation Allowed,ItemWise Technical Evaluation Allowed,Payment Mode,Is Multi Currency Allowed For BOQ,Is Multi Currency Allowed For Fee,Allow Two Stage Bidding,Cover No,Cover,Document Type,Description,Publish Date,Bid Opening Date,Document Download / Sale Start Date,Document Download / Sale End Date,Clarification Start Date,Clarification End Date,Bid Submission Start Date,Bid Submission End Date,Financial Bid Opening Date,EMD Amount in ₹,EMD Exemption Allowed,EMD Fee Type,EMD Percentage,EMD Payable To,EMD Payable At,S.No,Bank Name,Tender Fee in ₹,Fee Payable To,Fee Payable At,Tender Fee Exemption Allowed,Name,Address,Title,Work Description,Pre Qualification Details,Independent External Monitor/Remarks,Tender Value in ₹,Product Category,Sub category,Contract Type,Bid Validity(Days),Period Of Work(Days),Location,Pincode,Pre Bid Meeting Place,Pre Bid Meeting Address,Pre Bid Meeting Date,Bid Opening Place,Should Allow NDA Tender,Allow Preferential Bidder,Tender Stage,Contract Date :,Total Contract Value :,Work Completion Period in days :,Updated By :,Updated on :,AOC document :,AOC Description :,S.No,Bid Number,Bidder Name,Awarded Currency,Awarded Value,S.No.1,Bid Number.1,Bidder Name.1,Submitted Date,Status,Remarks,Status Updated On,Type :,Summary :,Updated By :.1,Updated On :,Document :,BOQ Comparative Chart :,Committee Chairperson/Co-ordinator Name :,Committee Chairperson/Co-ordinator Type :,Committee Members :,Updated By :.2,Updated on :.1,Document :.1,Organisation Chain :,Tender ID :,Tender Ref No :,Tender Title :,Type :.1,Summary :.1,Updated By :.3,Updated On :.1,Document :.2,Committee Chairperson/Co-ordinator Name :.1,Committee Chairperson/Co-ordinator Type :.1,Committee Members :.1,Updated By :.4,Updated On :.2,Financial Bid Opening Date:,Document :.3,Tender Stage
Urban Development Department||Directorate of Municipality Administration - UDD||Dhubri Municipal Board,DM/PWD/15th F.C.(Tied)/2025-26/717,2025_UDD_48423_1,Yes,Open Tender,Item Rate,Works,2.0,No,Yes,Online,No,No,No,1.0,Fee/PreQual/Technical,.pdf,TENDER DOCUMENTS,04-Nov-2025 06:00 PM,27-Nov-2025 02:00 PM,05-Nov-2025 11:00 AM,26-Nov-2025 05:00 PM,NA ,NA ,06-Nov-2025 11:00 AM,26-Nov-2025 05:00 PM,05-Dec-2025 02:00 PM,"41,626",Yes,fixed,,Nil,Nil,1.0,SBI Bank,"2,000",Nil,Nil,Yes,"EXECUTIVE OFFICER, DHUBRI MUNICIPAL BOARD","EXECUTIVE OFFICER, DHUBRI MUNICIPAL BOARD",Construction of RCC drain with slab cover for waste water and culvert at College Road in front of BN College phase 1 at Ward No 15,Construction of RCC drain with slab cover for waste water and culvert at College Road in front of BN College phase 1 at Ward No 15,Please refer Tender documents. ,NA ,"20,81,281",Civil Works,NA ,Rate Contract,90.0,NA ,WARD NO 15 DHUBRI TOWN,783301.0,"MG STREET, WARD NO-1, DHUBRI MUNICIPAL BOARD ","MG STREET, WARD NO-1, DHUBRI MUNICIPAL BOARD ",21-Nov-2025 12:00 PM ,DHUBRI MUNICIPAL BOARD,No ,No,AOC,29-Jan-2026,"INR 1,873,153",120.0,Namrata Pradip Sarma,29-Jan-2026 01:52 PM,WOBNCJAYADUTTA.pdf (206.00 KB),WORK ORDER UPLOADED,1.0,286614.0,JAYA DUTTA,INR,"1,873,153",1,287094,CHAITANYA DAS,26-Nov-2025 10:42 AM,Rejected-AOC,REJECTED BY TENDER COMMITTEE,29-Jan-2026 01:52 PM,Finance,SUBMITTED FINANCIAL MINUTES,Namrata Pradip Sarma,03-Jan-2026 12:14 PM,finance_76977.pdf,BOQ Comparative Chart,DR D SANYAL,Internal,,Namrata Pradip Sarma,03-Jan-2026 12:31 PM,finsummary_76977.pdf (240.17 KB),Urban Development Department||Directorate of Municipality Administration - UDD||Dhubri Municipal Board,2025_UDD_48423_1,DM/PWD/15th F.C.(Tied)/2025-26/717,Construction of RCC drain with slab cover for waste water and culvert at College Road in front of BN College phase 1 at Ward No 15,Technical,ADMITTED FOR OPENING OF FINANCIAL BID,Namrata Pradip Sarma,04-Dec-2025 02:25 PM,,DR D SANYAL,Internal,,Namrata Pradip Sarma,04-Dec-2025 02:41 PM,05-Dec-2025 02:00 PM,techsummary_76977.pdf (224.63 KB),AOC
,,,,,,,,,,,,,,2.0,Finance,.xls,BILL OF QUANTITY,,,,,,,,,,,,,,,,,,,,,,,,,,,,,,,,,,,,,,,,,,AOC,,,,,,,,,,,,,2,286350,JAGANNATH PAUL,24-Nov-2025 07:46 PM,Rejected-AOC,REJECTED BY TENDER COMMITTEE,29-Jan-2026 01:52 PM,,,,,,,,,,,,,,,,,,,,,,,,,,,,,AOC
,,,,,,,,,,,,,,,,,,,,,,,,,,,,,,,,,,,,,,,,,,,,,,,,,,,,,,,,,,,AOC,,,,,,,,,,,,,3,286614,JAYA DUTTA,24-Nov-2025 10:35 PM,Accepted-AOC,ACCEPTED BY TENDER COMMITTEE AS L1,29-Jan-2026 01:52 PM,,,,,,,,,,,,,,,,,,,,,,,,,,,,,AOC
,,,,,,,,,,,,,,,,,,,,,,,,,,,,,,,,,,,,,,,,,,,,,,,,,,,,,,,,,,,AOC,,,,,,,,,,,,,4,287032,RADHESHYAM SINGH,26-Nov-2025 12:14 AM,Rejected-AOC,REJECTED BY TENDER COMMITTEE,29-Jan-2026 01:52 PM,,,,,,,,,,,,,,,,,,,,,,,,,,,,,AOC
,,,,,,,,,,,,,,,,,,,,,,,,,,,,,,,,,,,,,,,,,,,,,,,,,,,,,,,,,,,AOC,,,,,,,,,,,,,5,286365,SUBRATA NARAYAN PAUL,24-Nov-2025 11:42 PM,Rejected-AOC,REJECTED BY TENDER COMMITTEE,29-Jan-2026 01:52 PM,,,,,,,,,,,,,,,,,,,,,,,,,,,,,AOC
