Organisation Chain,Tender Reference Number,Tender ID,Withdrawal Allowed,Tender Type,Form of contract,Tender Category,No. of Covers,General Technical Evaluation Allowed,ItemWise Technical Evaluation Allowed,Payment Mode,Is Multi Currency Allowed For BOQ,Is Multi Currency Allowed For Fee,Allow Two Stage Bidding,Cover No,Cover,Document Type,Description,Publish Date,Bid Opening Date,Document Download / Sale Start Date,Document Download / Sale End Date,Clarification Start Date,Clarification End Date,Bid Submission Start Date,Bid Submission End Date,Financial Bid Opening Date,EMD Amount in ₹,EMD Exemption Allowed,EMD Fee Type,EMD Percentage,EMD Payable To,EMD Payable At,S.No,Corrigendum Title,Corrigendum Type,View,S.No.1,Bank Name,Tender Fee in ₹,Fee Payable To,Fee Payable At,Tender Fee Exemption Allowed,Name,Address,Title,Work Description,Pre Qualification Details,Independent External Monitor/Remarks,Tender Value in ₹,Product Category,Sub category,Contract Type,Bid Validity(Days),Period Of Work(Days),Location,Pincode,Pre Bid Meeting Place,Pre Bid Meeting Address,Pre Bid Meeting Date,Bid Opening Place,Should Allow NDA Tender,Allow Preferential Bidder,Tender Stage,Contract Date :,Contract Value :,Work Completion Period in days :,Updated By :,Updated on :,AOC document :,S.No,Bid Number,Bidder Name,Awarded Currency,Awarded Value,S.No.1,Bid Number.1,Bidder Name.1,Submitted Date,Status,Remarks,Status Updated On,Type :,Summary :,Updated By :.1,Updated On :,Document :,BOQ Comparative Chart :,Committee Chairperson/Co-ordinator Name :,Committee Chairperson/Co-ordinator Type :,Committee Members :,Updated By :.2,Updated on :.1,Document :.1,Organisation Chain :,Tender ID :,Tender Ref No :,Tender Title :,Type :.1,Summary :.1,Updated By :.3,Updated On :.1,Document :.2,Committee Chairperson/Co-ordinator Name :.1,Committee Chairperson/Co-ordinator Type :.1,Committee Members :.1,Updated By :.4,Updated On :.2,Financial Bid Opening Date:,Document :.3,Tender Stage
Public Works Roads Department,EE_(LKH)_ SOPD_14,2024_PWD_41590_1,Yes,Open Tender,Item Rate,Works,2.0,No,No,Online,No,No,No,1.0,Fee/PreQual/Technical,.pdf,Affidavit for Correctness of BID,23-Dec-2024 02:00 PM,04-Jan-2025 02:30 PM,23-Dec-2024 02:00 PM,04-Jan-2025 02:00 PM,23-Dec-2024 02:00 PM ,26-Dec-2024 12:00 PM ,23-Dec-2024 02:30 PM,04-Jan-2025 02:00 PM,09-Jan-2025 04:25 PM,"48,716",No,fixed,,Nil,Nil,1.0,Corrigendum for Date of Extention,Date,,1.0,SBI Bank,500.0,Nil,Nil,No,Executive Engineer,"PWRD, Goalpara West and Dudhnoi TRD, Lakhipur, Goalpara",Construction of road from Manilan Rabha house to Sayrap Rabha house of Kamarpara Village under SOPD (G) for the year 2024-25 of Goalpara District 13 Goalpara West LAC.,EE_(LKH)_SOPD_14,Please refer Tender documents. ,NA ,"24,35,786",Civil Works – Roads,NA ,Rate Contract,90.0,NA ,"PWRD, GW and DTRDiv,Goalpara",783129.0,NA ,NA ,NA ,"PWRD, GW and DTRDiv,Goalpara",No ,No,AOC,26-Mar-2025,"INR 2,435,786.45",90.0,Anjan Kumar Kalita,26-Mar-2025 03:38 PM,WO14.pdf (343.00 KB),1.0,253268.0,Zesmina Khatun,INR,"2,192,207.8",1.0,253073.0,Raghunath Rabha,01-Jan-2025 04:47 PM,Rejected-Finance,Quoted rate is beyond permissible limit,26-Mar-2025 03:36 PM,Finance,Technical Bid summary,SAMADRIT ADHIKARY,09-Jan-2025 04:41 PM,finance_66947.pdf,BOQ Comparative Chart,Nirmal Kowar EE,Internal,"Talebor Rahman (AO), Priyanka Chakraborty (AE), Anjan Kalita(JE)",Anjan Kumar Kalita,26-Mar-2025 03:36 PM,finsummary_66947.pdf (260.56 KB),Public Works Roads Department,2024_PWD_41590_1,EE_(LKH)_ SOPD_14,Construction of road from Manilan Rabha house to Sayrap Rabha house of Kamarpara Village under SOPD (G) for the year 2024-25 of Goalpara District 13 Goalpara West LAC.,Technical,Summary of Technical Bid,SAMADRIT ADHIKARY,09-Jan-2025 04:12 PM,technical_66947.pdf,Nirmal Kowar,Internal,"Talebor Rahman, Priyanka Kalita, Anjan Kalita, Samadrit Adhikary",Anjan Kumar Kalita,09-Jan-2025 04:18 PM,09-Jan-2025 04:25 PM,techsummary_66947.pdf (260.56 KB),AOC
,,,,,,,,,,,,,,,,.pdf,SBD,,,,,,,,,,,,,,,,2.0,SBD,Technical Bid,,,,,,,,,,,,,,,,,,,,,,,,,,,,AOC,,,,,,,,,,,,2.0,253405.0,SAHAR ALI,28-Dec-2024 06:56 PM,Rejected-Finance,Quoted rate is beyond permissible limit,26-Mar-2025 03:36 PM,,,,,,,,,,,,,,,,,,,,,,,,,,,,,AOC
,,,,,,,,,,,,,,,,.pdf,Technical Qualification Information,,,,,,,,,,,,,,,,,,,,,,,,,,,,,,,,,,,,,,,,,,,,,,AOC,,,,,,,,,,,,3.0,253268.0,Zesmina Khatun,04-Jan-2025 10:19 AM,Accepted-AOC,Quoted rate is within the permissible limit,26-Mar-2025 03:39 PM,,,,,,,,,,,,,,,,,,,,,,,,,,,,,AOC
,,,,,,,,,,,,,,2.0,Finance,.pdf,FoB,,,,,,,,,,,,,,,,,,,,,,,,,,,,,,,,,,,,,,,,,,,,,,AOC,,,,,,,,,,,,,,,,,,,,,,,,,,,,,,,,,,,,,,,,,,,,,,,AOC
,,,,,,,,,,,,,,,,.xls,BoQ,,,,,,,,,,,,,,,,,,,,,,,,,,,,,,,,,,,,,,,,,,,,,,AOC,,,,,,,,,,,,,,,,,,,,,,,,,,,,,,,,,,,,,,,,,,,,,,,AOC
