Organisation Chain,Tender Reference Number,Tender ID,Withdrawal Allowed,Tender Type,Form of contract,Tender Category,No. of Covers,General Technical Evaluation Allowed,ItemWise Technical Evaluation Allowed,Payment Mode,Is Multi Currency Allowed For BOQ,Is Multi Currency Allowed For Fee,Allow Two Stage Bidding,Cover No,Cover,Document Type,Description,Publish Date,Bid Opening Date,Document Download / Sale Start Date,Document Download / Sale End Date,Clarification Start Date,Clarification End Date,Bid Submission Start Date,Bid Submission End Date,Financial Bid Opening Date,EMD Amount in ₹,EMD Exemption Allowed,EMD Fee Type,EMD Percentage,EMD Payable To,EMD Payable At,S.No,Corrigendum Title,Corrigendum Type,View,S.No.1,Bank Name,Tender Fee in ₹,Fee Payable To,Fee Payable At,Tender Fee Exemption Allowed,Name,Address,Title,Work Description,Pre Qualification Details,Independent External Monitor/Remarks,Tender Value in ₹,Product Category,Sub category,Contract Type,Bid Validity(Days),Period Of Work(Days),Location,Pincode,Pre Bid Meeting Place,Pre Bid Meeting Address,Pre Bid Meeting Date,Bid Opening Place,Should Allow NDA Tender,Allow Preferential Bidder,Tender Stage,Contract Date :,Contract Value :,Work Completion Period in days :,Updated By :,Updated on :,AOC document :,S.No,Bid Number,Bidder Name,Awarded Currency,Awarded Value,S.No.1,Bid Number.1,Bidder Name.1,Submitted Date,Status,Remarks,Status Updated On,Type :,Summary :,Updated By :.1,Updated On :,Document :,BOQ Comparative Chart :,Committee Chairperson/Co-ordinator Name :,Committee Chairperson/Co-ordinator Type :,Committee Members :,Updated By :.2,Updated on :.1,Document :.1,Organisation Chain :,Tender ID :,Tender Ref No :,Tender Title :,Type :.1,Summary :.1,Updated By :.3,Updated On :.1,Document :.2,Committee Chairperson/Co-ordinator Name :.1,Committee Chairperson/Co-ordinator Type :.1,Committee Members :.1,Updated By :.4,Updated On :.2,Financial Bid Opening Date:,Document :.3,Tender Stage
Skill Employment and Entrepreneurship Department- Externally Aided Project||Assam Skill University Project- ADB Funded Tenders,GS02/ASU/ME/008,2024_SEEDE_40438_1,Yes,Open Tender,Item Rate,Goods,2.0,No,No,Online,No,No,No,1.0,Fee/PreQual/Technical,.pdf,Bidder Qualification Credentials,20-Nov-2024 09:00 AM,03-Jan-2025 02:30 PM,20-Nov-2024 09:00 AM,03-Jan-2025 02:00 PM,20-Nov-2024 09:00 AM ,29-Nov-2024 02:00 PM ,23-Dec-2024 09:00 AM,03-Jan-2025 02:00 PM,10-Feb-2025 02:15 PM,"5,40,000",Yes,fixed,,Nil,Nil,1.0,BOQ CORRIGENDUM,BOQ,,1.0,SBI Bank,0.0,Nil,Nil,No,"Chief Executive Officer, ASUP","Assam Skill University 3rd Floor, DECT Complex, Rehabari, Guwahati-08",Equipment for Central Workshop-Advance Machine Shop,Equipment for Central Workshop-Advance Machine Shop,Please refer Tender documents. ,NA ,,Mechanical Engg Items,NA ,Tender,150.0,90.0,"ASU Campus, Mangaldoi, Assam",784125.0,Guwahati ,"ASUP Conference Hall, 3rd Floor, DECT Complex, Rehabari, Guwahati-08 ",29-Nov-2024 02:30 PM ,"3rd Floor, DECT Complex, Rehabari, Guwahati-08",No ,No,AOC,13-Mar-2025,"INR 49,577,700",90.0,Mintu Sinha,13-Mar-2025 03:26 PM,ContractME008.pdf (1472.00 KB),1.0,253110.0,MAVERICK TECHNOLOGIES,INR,"49,577,700",1.0,253110.0,MAVERICK TECHNOLOGIES,03-Jan-2025 11:53 AM,Accepted-AOC,Lowest Evaluated Substantially Responsive Bid,13-Mar-2025 03:28 PM,Finance,Price Bid Opened,Mintu Sinha,10-Feb-2025 02:42 PM,,BOQ Comparative Chart,"CEO, ASUP",Internal,,Mintu Sinha,13-Mar-2025 03:18 PM,finsummary_65549.pdf (501.09 KB),Skill Employment and Entrepreneurship Department- Externally Aided Project||Assam Skill University Project- ADB Funded Tenders,2024_SEEDE_40438_1,GS02/ASU/ME/008,Equipment for Central Workshop-Advance Machine Shop,Technical,Technical Bid Opened,Mintu Sinha,03-Jan-2025 03:09 PM,,Registrar ASU,Internal,,Mintu Sinha,07-Feb-2025 05:38 PM,10-Feb-2025 02:15 PM,techsummary_65549.pdf (542.15 KB),AOC
,,,,,,,,,,,,,,,,.pdf,Technical Bid Submission Sheet and Country of Origin Declaration Form,,,,,,,,,,,,,,,,2.0,Corrigendum3,Date,,,,,,,,,,,,,,,,,,,,,,,,,,,,AOC,,,,,,,,,,,,2.0,254029.0,National Cooperative Consumer Federation of India Ltd.,02-Jan-2025 08:47 PM,Rejected-Finance,Rejected as L2 Bidder,13-Mar-2025 03:18 PM,,,,,,,,,,,,,,,,,,,,,,,,,,,,,AOC
,,,,,,,,,,,,,,,,.pdf,"Technical Specifications,Catalogues and any other documents",,,,,,,,,,,,,,,,3.0,Pre Bid Queries Response Sheet,Other,,,,,,,,,,,,,,,,,,,,,,,,,,,,AOC,,,,,,,,,,,,3.0,252854.0,VISHAL VYAPAR VIKASH,26-Dec-2024 04:39 PM,Rejected-Technical,Technically Non-responsive,07-Feb-2025 05:38 PM,,,,,,,,,,,,,,,,,,,,,,,,,,,,,AOC
,,,,,,,,,,,,,,2.0,Finance,.pdf,Price Bid Submission Sheet,,,,,,,,,,,,,,,,4.0,Corrigendum02,Technical Bid,,,,,,,,,,,,,,,,,,,,,,,,,,,,AOC,,,,,,,,,,,,,,,,,,,,,,,,,,,,,,,,,,,,,,,,,,,,,,,AOC
,,,,,,,,,,,,,,,,.pdf,All Price Schedules,,,,,,,,,,,,,,,,,,,,,,,,,,,,,,,,,,,,,,,,,,,,,,AOC,,,,,,,,,,,,,,,,,,,,,,,,,,,,,,,,,,,,,,,,,,,,,,,AOC
,,,,,,,,,,,,,,,,.xls,Item rate BoQ,,,,,,,,,,,,,,,,,,,,,,,,,,,,,,,,,,,,,,,,,,,,,,AOC,,,,,,,,,,,,,,,,,,,,,,,,,,,,,,,,,,,,,,,,,,,,,,,AOC
