Organisation Chain,Tender Reference Number,Tender ID,Withdrawal Allowed,Tender Type,Form of contract,Tender Category,No. of Covers,General Technical Evaluation Allowed,ItemWise Technical Evaluation Allowed,Payment Mode,Is Multi Currency Allowed For BOQ,Is Multi Currency Allowed For Fee,Allow Two Stage Bidding,Cover No,Cover,Document Type,Description,Publish Date,Bid Opening Date,Document Download / Sale Start Date,Document Download / Sale End Date,Clarification Start Date,Clarification End Date,Bid Submission Start Date,Bid Submission End Date,Financial Bid Opening Date,EMD Amount in ₹,EMD Exemption Allowed,EMD Fee Type,EMD Percentage,EMD Payable To,EMD Payable At,S.No,Bank Name,Tender Fee in ₹,Fee Payable To,Fee Payable At,Tender Fee Exemption Allowed,Name,Address,Title,Work Description,Pre Qualification Details,Independent External Monitor/Remarks,Tender Value in ₹,Product Category,Sub category,Contract Type,Bid Validity(Days),Period Of Work(Days),Location,Pincode,Pre Bid Meeting Place,Pre Bid Meeting Address,Pre Bid Meeting Date,Bid Opening Place,Should Allow NDA Tender,Allow Preferential Bidder,Tender Stage,Contract Date :,Contract Value :,Work Completion Period in days :,Updated By :,Updated on :,AOC document :,S.No,Bid Number,Bidder Name,Awarded Currency,Awarded Value,S.No.1,Bid Number.1,Bidder Name.1,Submitted Date,Status,Remarks,Status Updated On,Type :,Summary :,Updated By :.1,Updated On :,Document :,BOQ Comparative Chart :,Committee Chairperson/Co-ordinator Name :,Committee Chairperson/Co-ordinator Type :,Committee Members :,Updated By :.2,Updated on :.1,Document :.1,Organisation Chain :,Tender ID :,Tender Ref No :,Tender Title :,Type :.1,Summary :.1,Updated By :.3,Updated On :.1,Document :.2,Committee Chairperson/Co-ordinator Name :.1,Committee Chairperson/Co-ordinator Type :.1,Committee Members :.1,Updated By :.4,Updated On :.2,Financial Bid Opening Date:,Document :.3,Tender Stage
Inland Water Transport||I.W.T. Division Silchar,SWT / Misc-39 / Pt-XVIII / 2024-25 / 3158-3171,2024_IWT_38959_13,Yes,Open Tender,Item Wise,Services,2.0,No,No,Online,No,No,No,1.0,Fee/PreQual/Technical,.pdf,Tender Document,17-Sep-2024 10:00 AM,03-Oct-2024 03:00 PM,17-Sep-2024 11:00 AM,03-Oct-2024 02:00 PM,NA ,NA ,17-Sep-2024 12:00 PM,03-Oct-2024 02:00 PM,25-Oct-2024 04:15 PM,"45,000",Yes,fixed,,Nil,Nil,1.0,SBI Bank,500.0,Nil,Nil,No,Executive Engineer,"Office of the Executive Engineer, IWT Silchar Division",Leasing out of IWT ferry service at Lalacherra under IWT Silchar Division,Leasing out of IWT ferry service at Lalacherra under IWT Silchar Division,Please refer Tender documents. ,NA ,"9,00,000",Miscellaneous Services,NA ,Tender,180.0,180.0,Silchar,788003.0,NA ,NA ,NA ,"Office of the Executive Engineer, IWT Silchar Divi",No ,No,AOC,19-Mar-2025,"INR 1,126,552",180.0,Purnananda Das,19-Mar-2025 02:51 PM,Lala_settle_govt.pdf (104.00 KB),1.0,241647.0,SIRAJ UDDIN CHOUDHURY,INR,"1,126,552",1,241651,ABDUL LATIF BARBHUIYA,01-Oct-2024 11:53 PM,Rejected-Technical,Withdrawn his tender,25-Oct-2024 04:08 PM,Finance,Bids are forwarded to committee for evaluation,Rajashree Borah,25-Oct-2024 04:37 PM,,BOQ Comparative Chart,Director,Internal,,Purnananda Das,19-Mar-2025 02:44 PM,finsummary_63266.pdf (2080.21 KB),Inland Water Transport||I.W.T. Division Silchar,2024_IWT_38959_13,SWT / Misc-39 / Pt-XVIII / 2024-25 / 3158-3171,Leasing out of IWT ferry service at Lalacherra under IWT Silchar Division,Technical,Bids are forwarded to committee for evaluation,Purnananda Das,25-Oct-2024 03:58 PM,,Director,Internal,,Purnananda Das,25-Oct-2024 04:08 PM,25-Oct-2024 04:15 PM,techsummary_63266.pdf (271.57 KB),AOC
,,,,,,,,,,,,,,,,.pdf,Bid Document,,,,,,,,,,,,,,,,,,,,,,,,,,,,,,,,,,,,,,,,,,AOC,,,,,,,,,,,,2,241646,JUBAYER AHMED LASKAR,02-Oct-2024 01:05 PM,Rejected-Technical,Failed to submit proper financially sound Certificate,25-Oct-2024 04:08 PM,,,,,,,,,,,,,,,,,,,,,,,,,,,,,AOC
,,,,,,,,,,,,,,2.0,Finance,.xls,BOQ,,,,,,,,,,,,,,,,,,,,,,,,,,,,,,,,,,,,,,,,,,AOC,,,,,,,,,,,,3,241513,JUNAID AHMED LASKAR,03-Oct-2024 01:22 PM,Rejected-Finance,Lower Bidder,19-Mar-2025 02:44 PM,,,,,,,,,,,,,,,,,,,,,,,,,,,,,AOC
,,,,,,,,,,,,,,,,,,,,,,,,,,,,,,,,,,,,,,,,,,,,,,,,,,,,,,,,,,,AOC,,,,,,,,,,,,4,241647,SIRAJ UDDIN CHOUDHURY,01-Oct-2024 11:44 PM,Accepted-AOC,H1,19-Mar-2025 02:51 PM,,,,,,,,,,,,,,,,,,,,,,,,,,,,,AOC
,,,,,,,,,,,,,,,,,,,,,,,,,,,,,,,,,,,,,,,,,,,,,,,,,,,,,,,,,,,AOC,,,,,,,,,,,,5,241703,TAJ UDDIN LASKAR,02-Oct-2024 04:32 PM,Rejected-Technical,Failed to submit NOC of copattadar.,25-Oct-2024 04:08 PM,,,,,,,,,,,,,,,,,,,,,,,,,,,,,AOC
