Organisation Chain,Tender Reference Number,Tender ID,Withdrawal Allowed,Tender Type,Form of contract,Tender Category,No. of Covers,General Technical Evaluation Allowed,ItemWise Technical Evaluation Allowed,Payment Mode,Is Multi Currency Allowed For BOQ,Is Multi Currency Allowed For Fee,Allow Two Stage Bidding,Cover No,Cover,Document Type,Description,Publish Date,Bid Opening Date,Document Download / Sale Start Date,Document Download / Sale End Date,Clarification Start Date,Clarification End Date,Bid Submission Start Date,Bid Submission End Date,Financial Bid Opening Date,EMD Amount in ₹,EMD Exemption Allowed,EMD Fee Type,EMD Percentage,EMD Payable To,EMD Payable At,S.No,Corrigendum Title,Corrigendum Type,View,S.No.1,Bank Name,Tender Fee in ₹,Fee Payable To,Fee Payable At,Tender Fee Exemption Allowed,Name,Address,Title,Work Description,Pre Qualification Details,Independent External Monitor/Remarks,Tender Value in ₹,Product Category,Sub category,Contract Type,Bid Validity(Days),Period Of Work(Days),Location,Pincode,Pre Bid Meeting Place,Pre Bid Meeting Address,Pre Bid Meeting Date,Bid Opening Place,Should Allow NDA Tender,Allow Preferential Bidder,Tender Stage,Contract Date :,Contract Value :,Work Completion Period in days :,Updated By :,Updated on :,AOC document :,AOC Description :,S.No,Bid Number,Bidder Name,Awarded Currency,Awarded Value,S.No.1,Bid Number.1,Bidder Name.1,Submitted Date,Status,Remarks,Status Updated On,Type :,Summary :,Updated By :.1,Updated On :,Document :,BOQ Comparative Chart :,Committee Chairperson/Co-ordinator Name :,Committee Chairperson/Co-ordinator Type :,Committee Members :,Updated By :.2,Updated on :.1,Document :.1,Organisation Chain :,Tender ID :,Tender Ref No :,Tender Title :,Type :.1,Summary :.1,Updated By :.3,Updated On :.1,Document :.2,Committee Chairperson/Co-ordinator Name :.1,Committee Chairperson/Co-ordinator Type :.1,Committee Members :.1,Updated By :.4,Updated On :.2,Financial Bid Opening Date:,Document :.3,Tender Stage
Assam Agricultural University||Directorate of Physical Plants,Normal/2024/18221(ZRS North Lakhimpur) dated 06-12-2024,2024_AAU_40918_1,Yes,Open Tender,Percentage,Works,2.0,No,No,Online,No,No,No,1.0,Fee/PreQual/Technical,.pdf,Bidder qualification documents,07-Dec-2024 10:00 AM,07-Jan-2025 03:00 PM,07-Dec-2024 10:00 AM,07-Jan-2025 02:00 PM,NA ,NA ,07-Dec-2024 10:00 AM,07-Jan-2025 02:00 PM,05-Feb-2025 03:05 PM,"59,415",Yes,percentage,2.0%,Nil,Nil,1.0,Date Corrigendum,Date,,1.0,SBI Bank,"1,000",Nil,Nil,Yes,"Superintending Engineer, DPP","O/o DPP, AAU, Jorhat",Strengthening irrigation facilities in AAU Farm at ZRS North Lakhimpur,"Civil, water supply and electrical works",Please refer Tender documents. ,NA ,"29,70,746",Civil Works - Others,NA ,Tender,180.0,180.0,At ZRS North Lakhimpur,787001.0,"O/o DPP, AAU, Jorhat ","O/o DPP, AAU, Jorhat ",18-Dec-2024 11:30 AM ,"O/o DPP, AAU, Jorhat",No ,No,AOC,21-Mar-2025,"INR 2,815,630",180.0,Ashish Bora,21-Mar-2025 05:58 PM,AOC.pdf (1376.00 KB),Rupees twenty eight lakhs fifteen thousand six hundred thirty only,1.0,253457.0,NABAJIT KALITA,INR,"2,815,630",1.0,253366.0,Amritakshya Dutta,04-Jan-2025 09:45 PM,Rejected-AOC,Financially evaluated second lowest responsive bidder,21-Mar-2025 05:58 PM,Finance,Financial Bid Opening summary,Smritom Podder,06-Feb-2025 03:59 PM,finance_66094.pdf,BOQ Comparative Chart,Pankaj Barua,Internal,,Ashish Bora,21-Mar-2025 05:53 PM,finsummary_66094.pdf (197.48 KB),Assam Agricultural University||Directorate of Physical Plants,2024_AAU_40918_1,Normal/2024/18221(ZRS North Lakhimpur) dated 06-12-2024,Strengthening irrigation facilities in AAU Farm at ZRS North Lakhimpur,Technical,Technical bid opening summary,Smritom Podder,10-Jan-2025 01:34 PM,technical_66094.pdf,Pankaj Barua,Internal,,Ashish Bora,04-Feb-2025 03:02 PM,05-Feb-2025 03:05 PM,techsummary_66094.pdf (490.67 KB),AOC
,,,,,,,,,,,,,,,,.pdf,GCC,,,,,,,,,,,,,,,,2.0,SCC and BoQ Corrigendum,Other,,,,,,,,,,,,,,,,,,,,,,,,,,,,AOC,,,,,,,,,,,,,2.0,253512.0,M/S Aqua Treat,06-Jan-2025 07:21 PM,Rejected-Technical,Technically disqualified,04-Feb-2025 03:02 PM,,,,,,,,,,,,,,,,,,,,,,,,,,,,,AOC
,,,,,,,,,,,,,,,,.pdf,SCC,,,,,,,,,,,,,,,,,,,,,,,,,,,,,,,,,,,,,,,,,,,,,,AOC,,,,,,,,,,,,,3.0,253457.0,NABAJIT KALITA,02-Jan-2025 04:33 PM,Accepted-AOC,Financially evaluated lowest responsive bidder,21-Mar-2025 05:58 PM,,,,,,,,,,,,,,,,,,,,,,,,,,,,,AOC
,,,,,,,,,,,,,,,,.pdf,BoQ in pdf,,,,,,,,,,,,,,,,,,,,,,,,,,,,,,,,,,,,,,,,,,,,,,AOC,,,,,,,,,,,,,4.0,253306.0,RANJIT BHAGWATI,03-Jan-2025 08:48 PM,Not Admitted-Fee/PreQual/Technical,Others-Hard copy of documents not submitted,10-Jan-2025 01:34 PM,,,,,,,,,,,,,,,,,,,,,,,,,,,,,AOC
,,,,,,,,,,,,,,,,.pdf,Makelist,,,,,,,,,,,,,,,,,,,,,,,,,,,,,,,,,,,,,,,,,,,,,,AOC,,,,,,,,,,,,,,,,,,,,,,,,,,,,,,,,,,,,,,,,,,,,,,,,AOC
,,,,,,,,,,,,,,2.0,Finance,.xls,BoQ,,,,,,,,,,,,,,,,,,,,,,,,,,,,,,,,,,,,,,,,,,,,,,AOC,,,,,,,,,,,,,,,,,,,,,,,,,,,,,,,,,,,,,,,,,,,,,,,,AOC
