Organisation Chain,Tender Reference Number,Tender ID,Withdrawal Allowed,Tender Type,Form of contract,Tender Category,No. of Covers,General Technical Evaluation Allowed,ItemWise Technical Evaluation Allowed,Payment Mode,Is Multi Currency Allowed For BOQ,Is Multi Currency Allowed For Fee,Allow Two Stage Bidding,Cover No,Cover,Document Type,Description,Publish Date,Bid Opening Date,Document Download / Sale Start Date,Document Download / Sale End Date,Clarification Start Date,Clarification End Date,Bid Submission Start Date,Bid Submission End Date,Financial Bid Opening Date,EMD Amount in ₹,EMD Exemption Allowed,EMD Fee Type,EMD Percentage,EMD Payable To,EMD Payable At,S.No,Corrigendum Title,Corrigendum Type,View,S.No.1,Bank Name,Tender Fee in ₹,Fee Payable To,Fee Payable At,Tender Fee Exemption Allowed,Name,Address,Title,Work Description,Pre Qualification Details,Independent External Monitor/Remarks,Tender Value in ₹,Product Category,Sub category,Contract Type,Bid Validity(Days),Period Of Work(Days),Location,Pincode,Pre Bid Meeting Place,Pre Bid Meeting Address,Pre Bid Meeting Date,Bid Opening Place,Should Allow NDA Tender,Allow Preferential Bidder,Tender Stage,Contract Date :,Contract Value :,Work Completion Period in days :,Updated By :,Updated on :,AOC document :,S.No,Bid Number,Bidder Name,Awarded Currency,Awarded Value,S.No.1,Bid Number.1,Bidder Name.1,Submitted Date,Status,Remarks,Status Updated On,Type :,Summary :,Updated By :.1,Updated On :,Document :,BOQ Comparative Chart :,Committee Chairperson/Co-ordinator Name :,Committee Chairperson/Co-ordinator Type :,Committee Members :,Updated By :.2,Updated on :.1,Document :.1,Organisation Chain :,Tender ID :,Tender Ref No :,Tender Title :,Type :.1,Summary :.1,Updated By :.3,Updated On :.1,Document :.2,Committee Chairperson/Co-ordinator Name :.1,Committee Chairperson/Co-ordinator Type :.1,Committee Members :.1,Updated By :.4,Updated On :.2,Financial Bid Opening Date:,Document :.3,Tender Stage
Skill Employment and Entrepreneurship Department- Externally Aided Project||Assam Skill University Project- ADB Funded Tenders,GS/02/ASU/IT002,2024_SEEDE_40358_1,Yes,Open Tender,Item Rate,Goods,2.0,No,No,Online,No,No,No,1.0,Fee/PreQual/Technical,.pdf,Bidder Qualification Credentials,15-Nov-2024 09:00 AM,13-Dec-2024 02:30 PM,15-Nov-2024 09:00 AM,13-Dec-2024 02:00 PM,15-Nov-2024 09:00 AM ,22-Nov-2024 02:00 PM ,09-Dec-2024 09:00 AM,13-Dec-2024 02:00 PM,03-Feb-2025 03:00 PM,"1,00,000",Yes,fixed,,Nil,Nil,1.0,BOQ CORRIGENDUM,BOQ,,1.0,SBI Bank,0.0,Nil,Nil,No,"Chief Executive Officer,ASUP","Assam Skill University 3rd Floor, DECT Complex, Rehabari, Guwahati-08",UPS for ASU,UPS for ASU,Please refer Tender documents. ,NA ,,Computer- H/W,NA ,Tender,150.0,60.0,"ASU Campus, Mangaldoi, Assam",784125.0,Guwahati ,"ASUP Conference Hall, 3rd Floor, DECT Complex, Rehabari, Guwahati-08 ",22-Nov-2024 02:30 PM ,3rd Floor DECT Building Guwahati,No ,No,AOC,10-Mar-2025,"INR 5,913,049.2",60.0,Mintu Sinha,10-Mar-2025 04:52 PM,contract.pdf (1752.00 KB),1.0,250820.0,DS SYSTEMS PVT LTD,INR,"5,913,049.2",1,250407,AMRUTHA SYSTEMS AND SOLUTIONS PRIVATE LIMITE,12-Dec-2024 08:38 PM,Rejected-Technical,Technically Non-responsive,01-Feb-2025 03:00 PM,Finance,Price Bid Opened.,Paran Gogoi,03-Feb-2025 03:21 PM,,BOQ Comparative Chart,"CEO, ASUP",Internal,,Mintu Sinha,10-Mar-2025 04:37 PM,finsummary_65457.pdf (225.99 KB),Skill Employment and Entrepreneurship Department- Externally Aided Project||Assam Skill University Project- ADB Funded Tenders,2024_SEEDE_40358_1,GS/02/ASU/IT002,UPS for ASU,Technical,Technical Bid Opened,Paran Gogoi,13-Dec-2024 02:38 PM,,Registrar ASU,Internal,,Mintu Sinha,01-Feb-2025 03:00 PM,03-Feb-2025 03:00 PM,techsummary_65457.pdf (500.59 KB),AOC
,,,,,,,,,,,,,,,,.pdf,Technical Bid Submission Sheet and Country of Origin Declaration Form,,,,,,,,,,,,,,,,2.0,Response to the pre-Bid queries,Other,,,,,,,,,,,,,,,,,,,,,,,,,,,,AOC,,,,,,,,,,,,2,250779,Better Power Services Pvt. Ltd.,13-Dec-2024 11:44 AM,Rejected-Technical,Rejected due to non-submission of Bid Security Amount,01-Feb-2025 03:00 PM,,,,,,,,,,,,,,,,,,,,,,,,,,,,,AOC
,,,,,,,,,,,,,,,,.pdf,"Technical Specifications,Catalogues and any other documents",,,,,,,,,,,,,,,,3.0,Corrigendum 2,Technical Bid,,,,,,,,,,,,,,,,,,,,,,,,,,,,AOC,,,,,,,,,,,,3,250712,Corporate Infotech Pvt. Ltd.,13-Dec-2024 01:44 PM,Rejected-Finance,Rejected being L3 bidder.,10-Mar-2025 04:37 PM,,,,,,,,,,,,,,,,,,,,,,,,,,,,,AOC
,,,,,,,,,,,,,,2.0,Finance,.pdf,Price Bid Submission Sheet,,,,,,,,,,,,,,,,,,,,,,,,,,,,,,,,,,,,,,,,,,,,,,AOC,,,,,,,,,,,,4,250820,DS SYSTEMS PVT LTD,13-Dec-2024 01:58 PM,Accepted-AOC,Lowest Evaluated Responsive Bid,10-Mar-2025 04:52 PM,,,,,,,,,,,,,,,,,,,,,,,,,,,,,AOC
,,,,,,,,,,,,,,,,.pdf,All Price ScheduleS,,,,,,,,,,,,,,,,,,,,,,,,,,,,,,,,,,,,,,,,,,,,,,AOC,,,,,,,,,,,,5,250714,HUE Service Pvt Ltd,13-Dec-2024 12:07 PM,Rejected-Finance,Rejected being L2 bidder.,10-Mar-2025 04:37 PM,,,,,,,,,,,,,,,,,,,,,,,,,,,,,AOC
,,,,,,,,,,,,,,,,.xls,Item Rate BoQ,,,,,,,,,,,,,,,,,,,,,,,,,,,,,,,,,,,,,,,,,,,,,,AOC,,,,,,,,,,,,6,250811,Madry Technologies LLP,13-Dec-2024 01:34 PM,Rejected-Technical,Rejected due to non-submission of Bid Security Amount,01-Feb-2025 03:00 PM,,,,,,,,,,,,,,,,,,,,,,,,,,,,,AOC
,,,,,,,,,,,,,,,,,,,,,,,,,,,,,,,,,,,,,,,,,,,,,,,,,,,,,,,,,,,,,,,AOC,,,,,,,,,,,,7,250818,PRAYAKH INFOTECH,13-Dec-2024 01:59 PM,Rejected-Technical,Rejected due to non-submission of Bid Security Amount,01-Feb-2025 03:00 PM,,,,,,,,,,,,,,,,,,,,,,,,,,,,,AOC
,,,,,,,,,,,,,,,,,,,,,,,,,,,,,,,,,,,,,,,,,,,,,,,,,,,,,,,,,,,,,,,AOC,,,,,,,,,,,,8,250770,Prostarm Info Systesm Limited,13-Dec-2024 01:29 PM,Rejected-Technical,Technically Non-responsive,01-Feb-2025 03:00 PM,,,,,,,,,,,,,,,,,,,,,,,,,,,,,AOC
