Organisation Chain,Tender Reference Number,Tender ID,Withdrawal Allowed,Tender Type,Form of contract,Tender Category,No. of Covers,General Technical Evaluation Allowed,ItemWise Technical Evaluation Allowed,Payment Mode,Is Multi Currency Allowed For BOQ,Is Multi Currency Allowed For Fee,Allow Two Stage Bidding,Cover No,Cover,Document Type,Description,Publish Date,Bid Opening Date,Document Download / Sale Start Date,Document Download / Sale End Date,Clarification Start Date,Clarification End Date,Bid Submission Start Date,Bid Submission End Date,Financial Bid Opening Date,EMD Amount in ₹,EMD Exemption Allowed,EMD Fee Type,EMD Percentage,EMD Payable To,EMD Payable At,Tender Fee in ₹,Fee Payable To,Fee Payable At,Tender Fee Exemption Allowed,Name,Address,Title,Work Description,Pre Qualification Details,Independent External Monitor/Remarks,Tender Value in ₹,Product Category,Sub category,Contract Type,Bid Validity(Days),Period Of Work(Days),Location,Pincode,Pre Bid Meeting Place,Pre Bid Meeting Address,Pre Bid Meeting Date,Bid Opening Place,Should Allow NDA Tender,Allow Preferential Bidder,Tender Stage,Contract Date :,Contract Value :,Work Completion Period in days :,Updated By :,Updated on :,AOC document :,AOC Description :,S.No,Bid Number,Bidder Name,Awarded Currency,Awarded Value,S.No.1,Bid Number.1,Bidder Name.1,Submitted Date,Status,Remarks,Status Updated On,Type :,Summary :,Updated By :.1,Updated On :,Document :,BOQ Comparative Chart :,Committee Chairperson/Co-ordinator Name :,Committee Chairperson/Co-ordinator Type :,Committee Members :,Updated By :.2,Updated on :.1,Document :.1,Organisation Chain :,Tender ID :,Tender Ref No :,Tender Title :,Type :.1,Summary :.1,Updated By :.3,Updated On :.1,Document :.2,Committee Chairperson/Co-ordinator Name :.1,Committee Chairperson/Co-ordinator Type :.1,Committee Members :.1,Updated By :.4,Updated On :.2,Financial Bid Opening Date:,Document :.3,Tender Stage
Department of Water Resources||Flood and River Erosion Management Agency of Assam,FREMAA-CS-6-IEC CONSULTANCY,2024_DoWR_37475_1,Yes,Limited,Lump-sum,Services,2.0,No,No,Not Applicable,No,No,No,1.0,Fee/PreQual/Technical,.pdf,Technical Proposal,08-Apr-2024 06:30 PM,22-Apr-2024 04:00 PM,08-Apr-2024 06:30 PM,22-Apr-2024 02:00 PM,NA ,NA ,17-Apr-2024 03:00 PM,22-Apr-2024 02:00 PM,27-Jun-2024 03:30 PM,0.0,No,fixed,,Nil,Nil,0.0,Nil,Nil,No,Chief Executive Officer,"Flood and River Erosion Management Agency of Assam 4th Floor, Assam Water Centre Kundil Nagar, Basistha Chariali, Guwahati 781029, Assam, India, Phone 0361-2309896",Corrigendum IV for e-Tender ID - 2024_DoWR_36501_1 - Request for Proposal for Consulting Services for Developing Communication Strategies and Implementation of Mass media and IEC campaign under Assam Integrated River Basin Management Project,Corrigendum IV for e-Tender ID - 2024_DoWR_36501_1 - Request for Proposal for Consulting Services for Developing Communication Strategies and Implementation of Mass media and IEC campaign under Assam Integrated River Basin Management Project,Please refer Tender documents. ,NA ,"2,07,04,281",Consultancy,NA ,Tender,120.0,547.0,Assam,781029.0,NA ,NA ,NA ,Flood and River Erosion Management Agency of Assam,No ,No,AOC,04-Sep-2024,"INR 10,479,473",547.0,Bhaskar Jyoti Das,06-Mar-2025 04:23 PM,IECContract.pdf (1301.00 KB),Contract signed with M/s Exclusive Advertising Pvt. Ltd.,1.0,232547.0,Exclusive Advertising Private Limited,INR,"10,479,473",1.0,232624.0,All India Institute of Local Self Government,22-Apr-2024 01:48 PM,Rejected-Finance,3rd Ranked Consultant after combined technical and financial evaluation,02-Sep-2024 01:29 PM,Finance,Financial Proposal Opening Summary,Bhaskar Jyoti Das,02-Jul-2024 07:43 PM,finance_61006.pdf,BOQ Comparative Chart,CEO-FREMAA,Internal,,Bhaskar Jyoti Das,02-Sep-2024 01:29 PM,finsummary_61006.pdf (69.23 KB),Department of Water Resources||Flood and River Erosion Management Agency of Assam,2024_DoWR_37475_1,FREMAA-CS-6-IEC CONSULTANCY,Corrigendum IV for e-Tender ID - 2024_DoWR_36501_1 - Request for Proposal for Consulting Services for Developing Communication Strategies and Implementation of Mass media and IEC campaign under Assam Integrated River Basin Management Project,Technical,Proposal Opening Summary,Bhaskar Jyoti Das,04-Jun-2024 08:16 PM,technical_61006.pdf,"Dr. Jeevan B, IAS",Internal,,Bhaskar Jyoti Das,13-Jun-2024 07:40 PM,27-Jun-2024 03:30 PM,techsummary_61006.pdf (646.73 KB),AOC
,,,,,,,,,,,,,,,,.pdf,Any other documents,,,,,,,,,,,,,,,,,,,,,,,,,,,,,,,,,,,,,,,,AOC,,,,,,,,,,,,,2.0,232547.0,Exclusive Advertising Private Limited,18-Apr-2024 12:53 PM,Accepted-AOC,Highest ranked Consultant,06-Mar-2025 04:24 PM,,,,,,,,,,,,,,,,,,,,,,,,,,,,,AOC
,,,,,,,,,,,,,,,,.pdf,RFP Document with Corrigendums,,,,,,,,,,,,,,,,,,,,,,,,,,,,,,,,,,,,,,,,AOC,,,,,,,,,,,,,3.0,232519.0,Insight Brandcom Pvt Ltd,17-Apr-2024 06:50 PM,Rejected-Finance,2nd Ranked Consultant after combined technical and financial evaluation,02-Sep-2024 01:29 PM,,,,,,,,,,,,,,,,,,,,,,,,,,,,,AOC
,,,,,,,,,,,,,,2.0,Finance,.xls,Price Schedule,,,,,,,,,,,,,,,,,,,,,,,,,,,,,,,,,,,,,,,,AOC,,,,,,,,,,,,,4.0,232623.0,PRADIP ADVERTISING & CO.,22-Apr-2024 01:52 PM,Rejected-Technical,Non-Responsive as it did not receive qualifying marks,13-Jun-2024 07:40 PM,,,,,,,,,,,,,,,,,,,,,,,,,,,,,AOC
,,,,,,,,,,,,,,,,.pdf,Financial Proposal,,,,,,,,,,,,,,,,,,,,,,,,,,,,,,,,,,,,,,,,AOC,,,,,,,,,,,,,,,,,,,,,,,,,,,,,,,,,,,,,,,,,,,,,,,,AOC
