Organisation Chain,Tender Reference Number,Tender ID,Withdrawal Allowed,Tender Type,Form of contract,Tender Category,No. of Covers,General Technical Evaluation Allowed,ItemWise Technical Evaluation Allowed,Payment Mode,Is Multi Currency Allowed For BOQ,Is Multi Currency Allowed For Fee,Allow Two Stage Bidding,Cover No,Cover,Document Type,Description,Publish Date,Bid Opening Date,Document Download / Sale Start Date,Document Download / Sale End Date,Clarification Start Date,Clarification End Date,Bid Submission Start Date,Bid Submission End Date,Financial Bid Opening Date,EMD Amount in ₹,EMD Exemption Allowed,EMD Fee Type,EMD Percentage,EMD Payable To,EMD Payable At,S.No,Corrigendum Title,Corrigendum Type,View,S.No.1,Bank Name,Tender Fee in ₹,Fee Payable To,Fee Payable At,Tender Fee Exemption Allowed,Name,Address,Title,Work Description,Pre Qualification Details,Independent External Monitor/Remarks,Tender Value in ₹,Product Category,Sub category,Contract Type,Bid Validity(Days),Period Of Work(Days),Location,Pincode,Pre Bid Meeting Place,Pre Bid Meeting Address,Pre Bid Meeting Date,Bid Opening Place,Should Allow NDA Tender,Allow Preferential Bidder,Tender Stage,Contract Date :,Contract Value :,Work Completion Period in days :,Updated By :,Updated on :,AOC document :,AOC Description :,S.No,Bid Number,Bidder Name,Awarded Currency,Awarded Value,S.No.1,Bid Number.1,Bidder Name.1,Submitted Date,Status,Remarks,Status Updated On,Type :,Summary :,Updated By :.1,Updated On :,Document :,BOQ Comparative Chart :,Committee Chairperson/Co-ordinator Name :,Committee Chairperson/Co-ordinator Type :,Committee Members :,Updated By :.2,Updated on :.1,Document :.1,Organisation Chain :,Tender ID :,Tender Ref No :,Tender Title :,Type :.1,Summary :.1,Updated By :.3,Updated On :.1,Document :.2,Committee Chairperson/Co-ordinator Name :.1,Committee Chairperson/Co-ordinator Type :.1,Committee Members :.1,Updated By :.4,Updated On :.2,Financial Bid Opening Date:,Document :.3,Tender Stage
Department of Tourism||Assam Tourism Development Corporation Ltd. - DOT||HO-Guwahati-ATDCL - DOT,ATDC/3585/2023/3811 date 30.11.2023,2023_DOT_34556_1,Yes,Open Tender,Item Rate,Services,2.0,No,No,Online,No,No,No,1.0,Fee/PreQual/Technical,.pdf,Detail Notice Inviting Bid with seal and sign in each page,08-Dec-2023 04:00 PM,04-Jan-2024 01:00 PM,08-Dec-2023 04:05 PM,03-Jan-2024 02:00 PM,NA ,NA ,08-Dec-2023 04:05 PM,03-Jan-2024 02:00 PM,21-Feb-2024 11:00 AM,"4,800",Yes,fixed,,Nil,Nil,1.0,"Second Extension Notice for Development, Operation and Management Contract for running the Wayside Amenity Centre at Numaligarh",Date,,1.0,SBI Bank,"1,000",Nil,Nil,No,"Managing Director, ATDC Ltd.","Office of the Managing Director, ATDC Ltd., Paltanbazar, Guwahati-8","Development, Operation and Management Contract for running the Wayside Amenity Centre at Numaligarh","Development, Operation and Management Contract for running the Wayside Amenity Centre at Numaligarh",Please refer Tender documents. ,NA ,"20,000",Hotel/ Catering,NA ,Tender,180.0,3650.0,Numaligarh,785615.0,Guwahati ,"Office of the Managing Director, ATDC Ltd., Paltanbazar, Guwahati-8 ",12-Dec-2023 12:00 PM ,Guwahati,No ,No,AOC,04-Mar-2024,"INR 21,100",3650.0,Kishore Dutta,04-Mar-2025 03:09 PM,LOINumaligarh.pdf (196.00 KB),Letter of Intent,1.0,215661.0,NIBEDITA ENGINEERING,INR,"21,100",1.0,215661.0,NIBEDITA ENGINEERING,19-Dec-2023 03:58 PM,Accepted-AOC,Highest quoted rate,04-Mar-2025 03:09 PM,Finance,Report of Financial Evaluation Committee,SANJIB KUMAR DUTTA,23-Feb-2024 12:30 PM,finance_55877.pdf,BOQ Comparative Chart,Bhaskar Jyoti Baruah,Internal,Kishor Dutta Kushal Sarma,SANJIB KUMAR DUTTA,23-Feb-2024 12:33 PM,finsummary_55877.pdf (175.45 KB),Department of Tourism||Assam Tourism Development Corporation Ltd. - DOT||HO-Guwahati-ATDCL - DOT,2023_DOT_34556_1,ATDC/3585/2023/3811 date 30.11.2023,"Development, Operation and Management Contract for running the Wayside Amenity Centre at Numaligarh",Technical,Report of Technical Evaluation Committee,Kishore Dutta,20-Feb-2024 01:04 PM,technical_55877.pdf,Prabhash Ch. Sarma,Internal,R.L. Das Tina Mitra,Kishore Dutta,20-Feb-2024 01:07 PM,21-Feb-2024 11:00 AM,techsummary_55877.pdf (181.94 KB),AOC
,,,,,,,,,,,,,,,,.pdf,Technical Bid with seal and sign in each page,,,,,,,,,,,,,,,,,,,,,,,,,,,,,,,,,,,,,,,,,,,,,,AOC,,,,,,,,,,,,,,,,,,,,,,,,,,,,,,,,,,,,,,,,,,,,,,,,AOC
,,,,,,,,,,,,,,,,.pdf,Other Qualification of the Bidder,,,,,,,,,,,,,,,,,,,,,,,,,,,,,,,,,,,,,,,,,,,,,,AOC,,,,,,,,,,,,,,,,,,,,,,,,,,,,,,,,,,,,,,,,,,,,,,,,AOC
,,,,,,,,,,,,,,2.0,Finance,.xls,BOQ,,,,,,,,,,,,,,,,,,,,,,,,,,,,,,,,,,,,,,,,,,,,,,AOC,,,,,,,,,,,,,,,,,,,,,,,,,,,,,,,,,,,,,,,,,,,,,,,,AOC
,,,,,,,,,,,,,,,,.pdf,Form of Bid,,,,,,,,,,,,,,,,,,,,,,,,,,,,,,,,,,,,,,,,,,,,,,AOC,,,,,,,,,,,,,,,,,,,,,,,,,,,,,,,,,,,,,,,,,,,,,,,,AOC
