Organisation Chain,Tender Reference Number,Tender ID,Withdrawal Allowed,Tender Type,Form of contract,Tender Category,No. of Covers,General Technical Evaluation Allowed,ItemWise Technical Evaluation Allowed,Payment Mode,Is Multi Currency Allowed For BOQ,Is Multi Currency Allowed For Fee,Allow Two Stage Bidding,Cover No,Cover,Document Type,Description,Publish Date,Bid Opening Date,Document Download / Sale Start Date,Document Download / Sale End Date,Clarification Start Date,Clarification End Date,Bid Submission Start Date,Bid Submission End Date,Financial Bid Opening Date,EMD Amount in ₹,EMD Exemption Allowed,EMD Fee Type,EMD Percentage,EMD Payable To,EMD Payable At,S.No,Bank Name,Tender Fee in ₹,Fee Payable To,Fee Payable At,Tender Fee Exemption Allowed,Name,Address,Title,Work Description,Pre Qualification Details,Independent External Monitor/Remarks,Tender Value in ₹,Product Category,Sub category,Contract Type,Bid Validity(Days),Period Of Work(Days),Location,Pincode,Pre Bid Meeting Place,Pre Bid Meeting Address,Pre Bid Meeting Date,Bid Opening Place,Should Allow NDA Tender,Allow Preferential Bidder,Tender Stage,Contract Date :,Contract Value :,Work Completion Period in days :,Updated By :,Updated on :,AOC document :,AOC Description :,S.No,Bid Number,Bidder Name,Awarded Currency,Awarded Value,S.No.1,Bid Number.1,Bidder Name.1,Submitted Date,Status,Remarks,Status Updated On,Type :,Summary :,Updated By :.1,Updated On :,Document :,BOQ Comparative Chart :,Committee Chairperson/Co-ordinator Name :,Committee Chairperson/Co-ordinator Type :,Committee Members :,Updated By :.2,Updated on :.1,Document :.1,Organisation Chain :,Tender ID :,Tender Ref No :,Tender Title :,Type :.1,Summary :.1,Updated By :.3,Updated On :.1,Document :.2,Committee Chairperson/Co-ordinator Name :.1,Committee Chairperson/Co-ordinator Type :.1,Committee Members :.1,Updated By :.4,Updated On :.2,Financial Bid Opening Date:,Document :.3,Tender Stage
Bodoland Territorial Council||Education-BTC,DOE/BTC/Samagra Shiksha/09/23-24,2024_BoTC_35928_1,Yes,Open Tender,Works,Works,2.0,No,No,Online,No,No,No,1.0,Fee/PreQual/Technical,.pdf,Technical Documents,05-Feb-2024 10:00 AM,27-Feb-2024 03:00 PM,05-Feb-2024 10:00 AM,27-Feb-2024 02:00 PM,05-Feb-2024 10:00 AM ,27-Feb-2024 12:00 PM ,05-Feb-2024 10:00 AM,27-Feb-2024 02:00 PM,22-Aug-2024 03:30 PM,"1,06,198",Yes,percentage,2.0%,Nil,Nil,1.0,SBI Bank,"1,100",Nil,Nil,No,"Director Education, BTC, Kokrajhar","O/o the Director Education, BTC, Kokrajhar","Construction of 3 Nos. of ACR at Kalaguru Bishnu Rabha College (Jr), Udalguri under BTC, funded by Samagra Siksha, Assam for the year 2023-24.","Construction of 3 Nos. of ACR at Kalaguru Bishnu Rabha College (Jr), Udalguri under BTC, funded by Samagra Siksha, Assam for the year 2023-24.",Please refer Tender documents. ,NA ,"53,09,910",Civil Works - Building,NA ,Tender,180.0,365.0,Udalguri,784509.0,NA ,NA ,NA ,"O/o the Director Education, BTC, Kokrajhar",No ,No,AOC,03-Mar-2025,"INR 4,778,919",365.0,Jagadish P Brahma,03-Mar-2025 09:44 AM,WO.pdf (814.00 KB),WO,1.0,227475.0,KIRTIDHEERA ASSOCIATES,INR,"4,778,919",1,227616,Akhil Sarma,27-Feb-2024 09:47 AM,Rejected-AOC,L2,03-Mar-2025 09:44 AM,Finance,Financial Opeining,Jagadish P Brahma,03-Mar-2025 09:37 AM,finance_58798.pdf,BOQ Comparative Chart,"A. Barman, Secretary, BTC, Kokrajhar",Mixed,"JP Brahma, Member Secretary, J. Daimary, Member, K. Boro, Member, K.Samsukha, Member, P. Nandi, Member, V. Narzary, Member",Jagadish P Brahma,03-Mar-2025 09:39 AM,finsummary_58798.pdf (886.07 KB),Bodoland Territorial Council||Education-BTC,2024_BoTC_35928_1,DOE/BTC/Samagra Shiksha/09/23-24,"Construction of 3 Nos. of ACR at Kalaguru Bishnu Rabha College (Jr), Udalguri under BTC, funded by Samagra Siksha, Assam for the year 2023-24.",Technical,Technical Bid Opening Meeting,Jagadish P Brahma,22-Aug-2024 02:43 PM,technical_58798.pdf,"Amarjyoti Barman, Chairman",Mixed,"J.P. Brahma, Member Secretary Kanin Boro, Member Kanhayalal Samsukha, Member J. Daimary, Member P. Nandi, Member V. Narzary, Member",Jagadish P Brahma,22-Aug-2024 03:12 PM,22-Aug-2024 03:30 PM,techsummary_58798.pdf (1055.14 KB),AOC
,,,,,,,,,,,,,,,,.pdf,SBD,,,,,,,,,,,,,,,,,,,,,,,,,,,,,,,,,,,,,,,,,,AOC,,,,,,,,,,,,,2,227261,BICHOO BORO,24-Feb-2024 07:30 PM,Rejected-Technical,Not Complied with with technical Qualification,22-Aug-2024 03:12 PM,,,,,,,,,,,,,,,,,,,,,,,,,,,,,AOC
,,,,,,,,,,,,,,2.0,Finance,.xls,BOQ,,,,,,,,,,,,,,,,,,,,,,,,,,,,,,,,,,,,,,,,,,AOC,,,,,,,,,,,,,3,227475,KIRTIDHEERA ASSOCIATES,27-Feb-2024 01:48 PM,Accepted-AOC,L1,03-Mar-2025 09:44 AM,,,,,,,,,,,,,,,,,,,,,,,,,,,,,AOC
,,,,,,,,,,,,,,,,,,,,,,,,,,,,,,,,,,,,,,,,,,,,,,,,,,,,,,,,,,,AOC,,,,,,,,,,,,,4,227473,M/S M S Enterprise,27-Feb-2024 10:08 AM,Rejected-Technical,Not Complied with with technical Qualification,22-Aug-2024 03:12 PM,,,,,,,,,,,,,,,,,,,,,,,,,,,,,AOC
,,,,,,,,,,,,,,,,,,,,,,,,,,,,,,,,,,,,,,,,,,,,,,,,,,,,,,,,,,,AOC,,,,,,,,,,,,,5,227251,M/S R.B. Enterprise,24-Feb-2024 07:13 PM,Rejected-Technical,Not Complied with with technical Qualification,22-Aug-2024 03:12 PM,,,,,,,,,,,,,,,,,,,,,,,,,,,,,AOC
,,,,,,,,,,,,,,,,,,,,,,,,,,,,,,,,,,,,,,,,,,,,,,,,,,,,,,,,,,,AOC,,,,,,,,,,,,,6,227489,SANTOSH CHANDRA ROY,27-Feb-2024 01:26 AM,Rejected-Technical,Not Complied with with technical Qualification,22-Aug-2024 03:12 PM,,,,,,,,,,,,,,,,,,,,,,,,,,,,,AOC
