Organisation Chain,Tender Reference Number,Tender ID,Withdrawal Allowed,Tender Type,Form of contract,Tender Category,No. of Covers,General Technical Evaluation Allowed,ItemWise Technical Evaluation Allowed,Payment Mode,Is Multi Currency Allowed For BOQ,Is Multi Currency Allowed For Fee,Allow Two Stage Bidding,Cover No,Cover,Document Type,Description,Publish Date,Bid Opening Date,Document Download / Sale Start Date,Document Download / Sale End Date,Clarification Start Date,Clarification End Date,Bid Submission Start Date,Bid Submission End Date,Financial Bid Opening Date,EMD Amount in ₹,EMD Exemption Allowed,EMD Fee Type,EMD Percentage,EMD Payable To,EMD Payable At,S.No,Corrigendum Title,Corrigendum Type,View,S.No.1,Bank Name,Tender Fee in ₹,Fee Payable To,Fee Payable At,Tender Fee Exemption Allowed,Name,Address,Title,Work Description,Pre Qualification Details,Independent External Monitor/Remarks,Tender Value in ₹,Product Category,Sub category,Contract Type,Bid Validity(Days),Period Of Work(Days),Location,Pincode,Pre Bid Meeting Place,Pre Bid Meeting Address,Pre Bid Meeting Date,Bid Opening Place,Should Allow NDA Tender,Allow Preferential Bidder,Tender Stage,Contract Date :,Contract Value :,Work Completion Period in days :,Updated By :,Updated on :,AOC document :,AOC Description :,S.No,Bid Number,Bidder Name,Awarded Currency,Awarded Value,S.No.1,Bid Number.1,Bidder Name.1,Submitted Date,Status,Remarks,Status Updated On,Type :,Summary :,Updated By :.1,Updated On :,Document :,BOQ Comparative Chart :,Committee Chairperson/Co-ordinator Name :,Committee Chairperson/Co-ordinator Type :,Committee Members :,Updated By :.2,Updated on :.1,Document :.1,Organisation Chain :,Tender ID :,Tender Ref No :,Tender Title :,Type :.1,Summary :.1,Updated By :.3,Updated On :.1,Document :.2,Committee Chairperson/Co-ordinator Name :.1,Committee Chairperson/Co-ordinator Type :.1,Committee Members :.1,Updated By :.4,Updated On :.2,Financial Bid Opening Date:,Document :.3,Tender Stage
Health and Family Welfare Department||Assam Medical Services Corporation Limited,AMSC-ADMN0HR/1/2024-ADM HR/ECF523412,2024_HFWD_38750_1,Yes,Open Tender,Empanelment,Services,2.0,No,Yes,Online,No,No,No,1.0,Fee/PreQual/Technical,.pdf,"EMD scan Copy,IPO/STAMP fee, List of items quoted",03-Sep-2024 06:00 PM,27-Sep-2024 04:30 PM,03-Sep-2024 06:30 PM,27-Sep-2024 02:00 PM,NA ,NA ,13-Sep-2024 01:00 PM,27-Sep-2024 02:00 PM,18-Oct-2024 03:00 PM,"4,00,000",Yes,fixed,,Nil,Nil,1.0,extension,Date,,1.0,SBI Bank,"2,000",Nil,Nil,No,Managing Director,"Office of Managing Director Assam Medical Services Corporation Ltd Central Drug Ware House Campus, Patherquery, Narengi, Guwahati, Assam-781026",SUPPLY OF MANPOWER OF DIFFERENT CATEGORY AND SKILL LEVEL ON AS AND WHEN REQUIRED BASIS,SUPPLY OF MANPOWER OF DIFFERENT CATEGORY AND SKILL LEVEL ON AS AND WHEN REQUIRED BASIS,Please refer Tender documents. ,NA ,"2,00,00,000",Manpower Supply,NA ,Empanelment,180.0,30.0,Guwahati,781026.0,Narengi Guwahati ,"Office of Managing Director Assam Medical Services Corporation Ltd Central Drug Ware House Campus, Patherquery, Narengi, Guwahati, Assam-781026  ",10-Sep-2024 03:00 PM ,Guwahati,No ,No,AOC,18-Mar-2025,INR 1,30.0,Siddhartha Bahadur Singh,18-Mar-2025 06:01 PM,LOAMAN.pdf (327.00 KB),aoc,1.0,240678.0,CFS MANAGEMENT PRIVATE LIMITED,INR,1.0,1,240678,CFS MANAGEMENT PRIVATE LIMITED,25-Sep-2024 11:57 AM,Accepted-AOC,AOC,18-Mar-2025 06:01 PM,Finance,financial eval,Siddhartha Bahadur Singh,17-Nov-2024 05:33 PM,,BOQ Comparative Chart,GM,Internal,As per mom,Siddhartha Bahadur Singh,18-Mar-2025 05:58 PM,finsummary_62656.pdf (1898.24 KB),Health and Family Welfare Department||Assam Medical Services Corporation Limited,2024_HFWD_38750_1,AMSC-ADMN0HR/1/2024-ADM HR/ECF523412,SUPPLY OF MANPOWER OF DIFFERENT CATEGORY AND SKILL LEVEL ON AS AND WHEN REQUIRED BASIS,Technical,Technical evaluation,Siddhartha Bahadur Singh,16-Oct-2024 02:31 PM,technical_62656.pdf,CFO,Internal,As per MoM,Siddhartha Bahadur Singh,16-Oct-2024 02:36 PM,18-Oct-2024 03:00 PM,techsummary_62656.pdf (1889.13 KB),AOC
,,,,,,,,,,,,,,,,.pdf,Requisite documents as per Tender,,,,,,,,,,,,,,,,,,,,,,,,,,,,,,,,,,,,,,,,,,,,,,AOC,,,,,,,,,,,,,2,240989,Gajraj Security and Consultancy Services,27-Sep-2024 01:48 PM,Not Admitted-Fee/PreQual/Technical,Others-Bidder has not submitted the required EMD as per tender conditions.,16-Oct-2024 02:31 PM,,,,,,,,,,,,,,,,,,,,,,,,,,,,,AOC
,,,,,,,,,,,,,,2.0,Finance,.xls,BOQ,,,,,,,,,,,,,,,,,,,,,,,,,,,,,,,,,,,,,,,,,,,,,,AOC,,,,,,,,,,,,,3,240607,Goswami Security Services Pvt. Ltd.,23-Sep-2024 12:09 PM,Not Admitted-Fee/PreQual/Technical,Others-Bidder has not submitted the required EMD as per tender conditions.,16-Oct-2024 02:31 PM,,,,,,,,,,,,,,,,,,,,,,,,,,,,,AOC
,,,,,,,,,,,,,,,,,,,,,,,,,,,,,,,,,,,,,,,,,,,,,,,,,,,,,,,,,,,,,,,AOC,,,,,,,,,,,,,4,240883,HRD Commercial & Industrial Security Force Pvt Ltd,25-Sep-2024 01:27 PM,Not Admitted-Fee/PreQual/Technical,Others-1.Bidder has not submitted the required EMD as per tender conditions. 2.Bidders has not submitted the hard of the technical bid.,16-Oct-2024 02:31 PM,,,,,,,,,,,,,,,,,,,,,,,,,,,,,AOC
,,,,,,,,,,,,,,,,,,,,,,,,,,,,,,,,,,,,,,,,,,,,,,,,,,,,,,,,,,,,,,,AOC,,,,,,,,,,,,,5,240946,Jintumoni Das Security Agency,27-Sep-2024 01:51 PM,Not Admitted-Fee/PreQual/Technical,Others-Bidder has not submitted the required EMD as per tender conditions.,16-Oct-2024 02:31 PM,,,,,,,,,,,,,,,,,,,,,,,,,,,,,AOC
