Organisation Chain,Tender Reference Number,Tender ID,Withdrawal Allowed,Tender Type,Form of contract,Tender Category,No. of Covers,General Technical Evaluation Allowed,ItemWise Technical Evaluation Allowed,Payment Mode,Is Multi Currency Allowed For BOQ,Is Multi Currency Allowed For Fee,Allow Two Stage Bidding,Cover No,Cover,Document Type,Description,Publish Date,Bid Opening Date,Document Download / Sale Start Date,Document Download / Sale End Date,Clarification Start Date,Clarification End Date,Bid Submission Start Date,Bid Submission End Date,Financial Bid Opening Date,EMD Amount in ₹,EMD Exemption Allowed,EMD Fee Type,EMD Percentage,EMD Payable To,EMD Payable At,S.No,Corrigendum Title,Corrigendum Type,View,S.No.1,Bank Name,Tender Fee in ₹,Fee Payable To,Fee Payable At,Tender Fee Exemption Allowed,Name,Address,Title,Work Description,Pre Qualification Details,Independent External Monitor/Remarks,Tender Value in ₹,Product Category,Sub category,Contract Type,Bid Validity(Days),Period Of Work(Days),Location,Pincode,Pre Bid Meeting Place,Pre Bid Meeting Address,Pre Bid Meeting Date,Bid Opening Place,Should Allow NDA Tender,Allow Preferential Bidder,Tender Stage,Contract Date :,Contract Value :,Work Completion Period in days :,Updated By :,Updated on :,AOC document :,S.No,Bid Number,Bidder Name,Awarded Currency,Awarded Value,S.No.1,Bid Number.1,Bidder Name.1,Submitted Date,Status,Remarks,Status Updated On,Type :,Summary :,Updated By :.1,Updated On :,Document :,BOQ Comparative Chart :,Committee Chairperson/Co-ordinator Name :,Committee Chairperson/Co-ordinator Type :,Committee Members :,Updated By :.2,Updated on :.1,Document :.1,Organisation Chain :,Tender ID :,Tender Ref No :,Tender Title :,Type :.1,Summary :.1,Updated By :.3,Updated On :.1,Document :.2,Committee Chairperson/Co-ordinator Name :.1,Committee Chairperson/Co-ordinator Type :.1,Committee Members :.1,Updated By :.4,Updated On :.2,Financial Bid Opening Date:,Document :.3,Tender Stage
Skill Employment and Entrepreneurship Department- Externally Aided Project||Assam Skill University Project- ADB Funded Tenders,GS/02/ASU/IT/005,2024_SEEDE_40359_1,Yes,Open Tender,Item Rate,Goods,2.0,No,No,Online,No,No,No,1.0,Fee/PreQual/Technical,.pdf,Bidder Qualification Credentials,15-Nov-2024 09:00 AM,23-Dec-2024 02:30 PM,15-Nov-2024 09:00 AM,23-Dec-2024 02:00 PM,15-Nov-2024 09:00 AM ,25-Nov-2024 02:00 PM ,11-Dec-2024 09:00 AM,23-Dec-2024 02:00 PM,24-Jan-2025 12:30 PM,"1,00,000",Yes,fixed,,Nil,Nil,1.0,Corrigendum 2,Date,,1.0,SBI Bank,0.0,Nil,Nil,No,"Chief Executive Officer,ASUP","Assam Skill University 3rd Floor, DECT Complex, Rehabari, Guwahati-08",Printing Devices and Workstation for ASU,Printing Devices and Workstation for ASU,Please refer Tender documents. ,NA ,,Computer- H/W,NA ,Tender,150.0,60.0,"ASU Campus, Mangaldoi, Assam",784125.0,Guwahati ,"ASUP Conference Hall, 3rd Floor, DECT Complex, Rehabari, Guwahati-08 ",25-Nov-2024 02:30 PM ,3rd Floor DECT Building Guwahati,No ,No,AOC,01-Mar-2025,"INR 11,541,836.71",60.0,Mintu Sinha,01-Mar-2025 05:13 PM,AOC.pdf (1531.00 KB),1.0,251267.0,BMG Informatics Pvt Ltd,INR,"11,541,836.71",1.0,251267.0,BMG Informatics Pvt Ltd,20-Dec-2024 03:24 PM,Accepted-AOC,Accepted,01-Mar-2025 05:13 PM,Finance,Price Bid Openned,Mintu Sinha,24-Jan-2025 01:19 PM,,BOQ Comparative Chart,Registrar ASU,Internal,,Mintu Sinha,01-Mar-2025 05:07 PM,finsummary_65458.pdf (504.55 KB),Skill Employment and Entrepreneurship Department- Externally Aided Project||Assam Skill University Project- ADB Funded Tenders,2024_SEEDE_40359_1,GS/02/ASU/IT/005,Printing Devices and Workstation for ASU,Technical,Bid Opened.,Mintu Sinha,23-Dec-2024 02:54 PM,,Registrar ASU,Internal,,Mintu Sinha,22-Jan-2025 02:54 PM,24-Jan-2025 12:30 PM,techsummary_65458.pdf (115.04 KB),AOC
,,,,,,,,,,,,,,,,.pdf,Technical Bid Submission Sheet and Country of Origin Declaration Form,,,,,,,,,,,,,,,,2.0,Pre Bid Queries Response Sheet,Other,,,,,,,,,,,,,,,,,,,,,,,,,,,,AOC,,,,,,,,,,,,2.0,250868.0,Corporate Infotech Pvt. Ltd.,20-Dec-2024 05:13 PM,Rejected-Finance,L2 BIDDER,01-Mar-2025 05:07 PM,,,,,,,,,,,,,,,,,,,,,,,,,,,,,AOC
,,,,,,,,,,,,,,,,.pdf,"Technical Specifications, Catalogues and any other documents",,,,,,,,,,,,,,,,3.0,Corrigendum01_IT005,Technical Bid,,,,,,,,,,,,,,,,,,,,,,,,,,,,AOC,,,,,,,,,,,,3.0,250780.0,KOMAL ENTERPRISES,13-Dec-2024 03:25 PM,Rejected-Technical,Technically Non-responsive,22-Jan-2025 02:54 PM,,,,,,,,,,,,,,,,,,,,,,,,,,,,,AOC
,,,,,,,,,,,,,,2.0,Finance,.pdf,Price Bid Submission Sheet,,,,,,,,,,,,,,,,,,,,,,,,,,,,,,,,,,,,,,,,,,,,,,AOC,,,,,,,,,,,,4.0,252460.0,M/s Infotech Solution,23-Dec-2024 12:55 PM,Rejected-Technical,Technically Non-responsive,22-Jan-2025 02:54 PM,,,,,,,,,,,,,,,,,,,,,,,,,,,,,AOC
,,,,,,,,,,,,,,,,.pdf,All Price Schedules,,,,,,,,,,,,,,,,,,,,,,,,,,,,,,,,,,,,,,,,,,,,,,AOC,,,,,,,,,,,,5.0,251015.0,Variman Global Enterprises Limited,23-Dec-2024 12:41 PM,Rejected-Technical,Technically Non-responsive,22-Jan-2025 02:54 PM,,,,,,,,,,,,,,,,,,,,,,,,,,,,,AOC
,,,,,,,,,,,,,,,,.xls,Item rate BoQ,,,,,,,,,,,,,,,,,,,,,,,,,,,,,,,,,,,,,,,,,,,,,,AOC,,,,,,,,,,,,,,,,,,,,,,,,,,,,,,,,,,,,,,,,,,,,,,,AOC
