Organisation Chain,Tender Reference Number,Tender ID,Withdrawal Allowed,Tender Type,Form of contract,Tender Category,No. of Covers,General Technical Evaluation Allowed,ItemWise Technical Evaluation Allowed,Payment Mode,Is Multi Currency Allowed For BOQ,Is Multi Currency Allowed For Fee,Allow Two Stage Bidding,Cover No,Cover,Document Type,Description,Publish Date,Bid Opening Date,Document Download / Sale Start Date,Document Download / Sale End Date,Clarification Start Date,Clarification End Date,Bid Submission Start Date,Bid Submission End Date,Financial Bid Opening Date,EMD Amount in ₹,EMD Exemption Allowed,EMD Fee Type,EMD Percentage,EMD Payable To,EMD Payable At,S.No,Bank Name,Tender Fee in ₹,Fee Payable To,Fee Payable At,Tender Fee Exemption Allowed,Name,Address,Title,Work Description,Pre Qualification Details,Independent External Monitor/Remarks,Tender Value in ₹,Product Category,Sub category,Contract Type,Bid Validity(Days),Period Of Work(Days),Location,Pincode,Pre Bid Meeting Place,Pre Bid Meeting Address,Pre Bid Meeting Date,Bid Opening Place,Should Allow NDA Tender,Allow Preferential Bidder,Tender Stage,Contract Date :,Contract Value :,Work Completion Period in days :,Updated By :,Updated on :,AOC document :,AOC Description :,S.No,Bid Number,Bidder Name,Awarded Currency,Awarded Value,S.No.1,Bid Number.1,Bidder Name.1,Submitted Date,Status,Remarks,Status Updated On,Type :,Summary :,Updated By :.1,Updated On :,Document :,BOQ Comparative Chart :,Committee Chairperson/Co-ordinator Name :,Committee Chairperson/Co-ordinator Type :,Committee Members :,Updated By :.2,Updated on :.1,Document :.1,Organisation Chain :,Tender ID :,Tender Ref No :,Tender Title :,Type :.1,Summary :.1,Updated By :.3,Updated On :.1,Document :.2,Committee Chairperson/Co-ordinator Name :.1,Committee Chairperson/Co-ordinator Type :.1,Committee Members :.1,Updated By :.4,Updated On :.2,Financial Bid Opening Date:,Document :.3,Tender Stage
"Pr. Chief Conservator of Forest and Head of Forest Force||Chief Conservator of Forests (Upper Assam Zone)||Northern Assam Circle, Tezpur||Sonitpur East Division",FSET/B/APFBC/JFMC/2024/1445,2024_PCCF_38255_1,Yes,Open Tender,Works,Works,2.0,No,No,Online,No,No,No,1.0,Fee/PreQual/Technical,.pdf,Technical document,31-Jul-2024 12:00 PM,20-Aug-2024 04:30 PM,31-Jul-2024 12:00 PM,20-Aug-2024 02:00 PM,31-Jul-2024 12:00 PM ,05-Aug-2024 05:00 PM ,31-Jul-2024 12:00 PM,20-Aug-2024 02:00 PM,12-Sep-2024 02:00 PM,"40,000",Yes,percentage,2.0%,Nil,Nil,1.0,SBI Bank,"1,000",Nil,Nil,No,Divisional Forest Officer,"Sonitpur East Division, Biswanath Chariali",Construction of Weaving Centre under APFBC scheme (JFMC-EPA),Construction of Weaving Centre under APFBC scheme (JFMC-EPA) at Serelia JFMC under Borgang Range,Please refer Tender documents. ,NA ,"20,00,000",Civil Works,NA ,Tender,90.0,180.0,"Serelia, Borgang",784176.0,"Sonitpur East Division, Biswanath Chariali ","Sonitpur East Division, Biswanath Chariali ",02-Aug-2024 11:30 AM ,"Sonitpur East Division, Biswanath Chariali",No ,No,AOC,16-Feb-2025,"INR 1,900,000",180.0,Biswa Jyoti Das,07-Mar-2025 03:53 PM,workorderKalpana.pdf (685.00 KB),Contract awarded to Kalpana Construction,1.0,237002.0,M/S Kalpana Construction,INR,"1,900,000",1,237387,ABHIGYANAM DAS,20-Aug-2024 01:13 PM,Rejected-Technical,Technically not qualified due to Liquid Asset/FS less than 40 lakh,12-Sep-2024 01:43 PM,Finance,Financial bid open by the bid evaluation committee,Biswa Jyoti Das,20-Jan-2025 05:03 PM,,BOQ Comparative Chart,"Divisional Forest Officer, Sonitpur East Division",Internal,"Kumarjya Gogoi, FR, Bhupen Deori, HA, Babul Das, Accountant",Biswa Jyoti Das,27-Jan-2025 12:28 PM,finsummary_62042.pdf (293.02 KB),"Pr. Chief Conservator of Forest and Head of Forest Force||Chief Conservator of Forests (Upper Assam Zone)||Northern Assam Circle, Tezpur||Sonitpur East Division",2024_PCCF_38255_1,FSET/B/APFBC/JFMC/2024/1445,Construction of Weaving Centre under APFBC scheme (JFMC-EPA),Technical,bid opened by the bid evaluation committee,Biswa Jyoti Das,03-Sep-2024 12:53 PM,,"Divisional Forest Officer, Sonitpur East Division",Internal,"Kumarjya Gogoi, FR, Bhupen Deori, HA, Babul Das, Accountant",Biswa Jyoti Das,12-Sep-2024 01:43 PM,12-Sep-2024 02:00 PM,techsummary_62042.pdf (684.18 KB),AOC
,,,,,,,,,,,,,,2.0,Finance,.xls,BOQ,,,,,,,,,,,,,,,,,,,,,,,,,,,,,,,,,,,,,,,,,,AOC,,,,,,,,,,,,,2,237297,Biswaranjan Borah,20-Aug-2024 01:17 PM,Rejected-Technical,Technically not qualified due to contractor registration certificate expired on 31/03/2024,12-Sep-2024 01:43 PM,,,,,,,,,,,,,,,,,,,,,,,,,,,,,AOC
,,,,,,,,,,,,,,,,,,,,,,,,,,,,,,,,,,,,,,,,,,,,,,,,,,,,,,,,,,,AOC,,,,,,,,,,,,,3,237264,JAGADISH SONOWAL,19-Aug-2024 03:02 PM,Rejected-Technical,Technically not qualified due to non submission of signed SBD,12-Sep-2024 01:43 PM,,,,,,,,,,,,,,,,,,,,,,,,,,,,,AOC
,,,,,,,,,,,,,,,,,,,,,,,,,,,,,,,,,,,,,,,,,,,,,,,,,,,,,,,,,,,AOC,,,,,,,,,,,,,4,237223,JMT ENTERPRISE,19-Aug-2024 04:13 PM,Rejected-Technical,Technically not qualified due to 1. Liquid Asset/FS less than 40 lakhs. 2. ESIC not submitted,12-Sep-2024 01:43 PM,,,,,,,,,,,,,,,,,,,,,,,,,,,,,AOC
,,,,,,,,,,,,,,,,,,,,,,,,,,,,,,,,,,,,,,,,,,,,,,,,,,,,,,,,,,,AOC,,,,,,,,,,,,,5,236991,M/S A R ENTERPRISE,17-Aug-2024 04:47 PM,Rejected-Finance,On going project may affect the quality and lead to delays of the project,27-Jan-2025 12:28 PM,,,,,,,,,,,,,,,,,,,,,,,,,,,,,AOC
,,,,,,,,,,,,,,,,,,,,,,,,,,,,,,,,,,,,,,,,,,,,,,,,,,,,,,,,,,,AOC,,,,,,,,,,,,,6,237385,M/s Dina Bhuyan,20-Aug-2024 01:42 PM,Rejected-Technical,Technically not qualified,12-Sep-2024 01:43 PM,,,,,,,,,,,,,,,,,,,,,,,,,,,,,AOC
,,,,,,,,,,,,,,,,,,,,,,,,,,,,,,,,,,,,,,,,,,,,,,,,,,,,,,,,,,,AOC,,,,,,,,,,,,,7,237002,M/S Kalpana Construction,17-Aug-2024 06:55 PM,Accepted-AOC,Contract awarded to Kalpana Construction,07-Mar-2025 03:54 PM,,,,,,,,,,,,,,,,,,,,,,,,,,,,,AOC
,,,,,,,,,,,,,,,,,,,,,,,,,,,,,,,,,,,,,,,,,,,,,,,,,,,,,,,,,,,AOC,,,,,,,,,,,,,8,237328,Sri Dhrubajyoti Bora,19-Aug-2024 07:06 PM,Rejected-Finance,Less work experience among the financially qualified bidder,27-Jan-2025 12:28 PM,,,,,,,,,,,,,,,,,,,,,,,,,,,,,AOC
,,,,,,,,,,,,,,,,,,,,,,,,,,,,,,,,,,,,,,,,,,,,,,,,,,,,,,,,,,,AOC,,,,,,,,,,,,,9,237356,Sri Pranab Malakar,20-Aug-2024 01:49 PM,Rejected-Technical,Technically not qualified due to contractor registration certificate expired on 31/03/2024,12-Sep-2024 01:43 PM,,,,,,,,,,,,,,,,,,,,,,,,,,,,,AOC
