Organisation Chain,Tender Reference Number,Tender ID,Withdrawal Allowed,Tender Type,Form of contract,Tender Category,No. of Covers,General Technical Evaluation Allowed,ItemWise Technical Evaluation Allowed,Payment Mode,Is Multi Currency Allowed For BOQ,Is Multi Currency Allowed For Fee,Allow Two Stage Bidding,Cover No,Cover,Document Type,Description,Publish Date,Bid Opening Date,Document Download / Sale Start Date,Document Download / Sale End Date,Clarification Start Date,Clarification End Date,Bid Submission Start Date,Bid Submission End Date,Financial Bid Opening Date,EMD Amount in ₹,EMD Exemption Allowed,EMD Fee Type,EMD Percentage,EMD Payable To,EMD Payable At,S.No,Bank Name,Tender Fee in ₹,Fee Payable To,Fee Payable At,Tender Fee Exemption Allowed,Name,Address,Title,Work Description,Pre Qualification Details,Independent External Monitor/Remarks,Tender Value in ₹,Product Category,Sub category,Contract Type,Bid Validity(Days),Period Of Work(Days),Location,Pincode,Pre Bid Meeting Place,Pre Bid Meeting Address,Pre Bid Meeting Date,Bid Opening Place,Should Allow NDA Tender,Allow Preferential Bidder,Tender Stage,S.No,Bid Number,Bidder Name,Submitted Date,Status,Remarks,Status Updated On,Type :,Summary :,Updated By :,Updated On :,Document :,BOQ Comparative Chart :,Organisation Chain :,Tender ID :,Tender Ref No :,Tender Title :,Type :.1,Summary :.1,Updated By :.1,Updated On :.1,Document :.1,Committee Chairperson/Co-ordinator Name :,Committee Chairperson/Co-ordinator Type :,Committee Members :,Updated By :.2,Updated On :.2,Financial Bid Opening Date:,Document :.2,Tender Stage
Public Works Building and NH Department||Chief Engineer-Building - PWBNH,CE/BLDG/ARC-II/89/2022/08,2023_PWBNH_30827_1,Yes,Open Tender,Item Rate,Works,2.0,No,No,Online,No,No,No,1.0,Fee/PreQual/Technical,.pdf,BIDDING DOCUMENT,15-May-2023 04:00 PM,31-May-2023 04:00 PM,15-May-2023 04:00 PM,29-May-2023 02:00 PM,NA ,NA ,19-May-2023 02:00 PM,29-May-2023 02:00 PM,04-Jul-2023 03:30 PM,"2,08,140",No,fixed,,Nil,Nil,1.0,SBI Bank,"2,010",Nil,Nil,No,"Addl. CE, PWD (Bldg) (P), Assam, Chandmari, Ghy-3","O/O The CE, PWD (Bldg), Assam, Chandmari, Ghy-3",PMC services for Construction of District Sports Stadium Complex at Jorhat District of Assam,PMC services for Construction of District Sports Stadium Complex at Jorhat District of Assam,Please refer Tender documents. ,NA ,"88,19,000",Civil Works - Building,NA ,Tender,180.0,910.0,Jorhat,785001.0,"O/O The CE, PWD (Bldg), Assam, Chandmari, Ghy-3 ","O/O The CE, PWD (Bldg), Assam, Chandmari, Ghy-3  ",19-May-2023 12:30 PM ,"O/O The CE, PWD (Bldg), Assam, Chandmari, Ghy-3",No ,No,AOC,1,186551,AAKAR ABHINAV CONSULTANTS PVT. LTD.,29-May-2023 01:05 PM,Rejected-AOC,L5,05-Jan-2024 04:42 PM,Finance,Summary,Nayan Jyoti Barman,04-Jul-2023 03:58 PM,finance_49472.pdf,BOQ Comparative Chart,Public Works Building and NH Department||Chief Engineer-Building - PWBNH,2023_PWBNH_30827_1,CE/BLDG/ARC-II/89/2022/08,PMC services for Construction of District Sports Stadium Complex at Jorhat District of Assam,Technical,Summary,Chandana Basumatary,31-May-2023 05:35 PM,technical_49472.pdf,CE PWD (Bldg),Internal,,Chandana Basumatary,04-Jul-2023 02:19 PM,04-Jul-2023 03:30 PM,techsummary_49472.pdf (1595.11 KB),AOC
,,,,,,,,,,,,,,,,.pdf,TECHNICAL QUALIFICATIONS,,,,,,,,,,,,,,,,,,,,,,,,,,,,,,,,,,,,,,,,,,AOC,2,186564,Bureau Veritas (India) Pvt. Ltd.,29-May-2023 01:23 PM,Rejected-AOC,L3,05-Jan-2024 04:42 PM,,,,,,,,,,,,,,,,,,,,,,,AOC
,,,,,,,,,,,,,,2.0,Finance,.xls,BOQ,,,,,,,,,,,,,,,,,,,,,,,,,,,,,,,,,,,,,,,,,,AOC,3,186329,Collage Design Pvt. Ltd.,29-May-2023 01:48 PM,Rejected-AOC,L2,05-Jan-2024 04:42 PM,,,,,,,,,,,,,,,,,,,,,,,AOC
,,,,,,,,,,,,,,,,.pdf,FINANCIAL PROPOSAL,,,,,,,,,,,,,,,,,,,,,,,,,,,,,,,,,,,,,,,,,,AOC,4,186504,CP and DS Associates,27-May-2023 04:02 PM,Accepted-AOC,Work Order Issued,05-Jan-2024 04:42 PM,,,,,,,,,,,,,,,,,,,,,,,AOC
,,,,,,,,,,,,,,,,,,,,,,,,,,,,,,,,,,,,,,,,,,,,,,,,,,,,,,,,,,,AOC,5,186585,IRCLASS SYSTEMS AND SOLUTIONS PVT LTD,29-May-2023 01:13 PM,Rejected-AOC,L4,05-Jan-2024 04:42 PM,,,,,,,,,,,,,,,,,,,,,,,AOC
,,,,,,,,,,,,,,,,,,,,,,,,,,,,,,,,,,,,,,,,,,,,,,,,,,,,,,,,,,,AOC,6,186332,SOLUTUS CONSULTING ENGINEERS PRIVATE LIMITED,24-May-2023 06:52 PM,Rejected-Technical,Technically Not Qualified,04-Jul-2023 02:19 PM,,,,,,,,,,,,,,,,,,,,,,,AOC
