Organisation Chain,Tender Reference Number,Tender ID,Withdrawal Allowed,Tender Type,Form of contract,Tender Category,No. of Covers,General Technical Evaluation Allowed,ItemWise Technical Evaluation Allowed,Payment Mode,Is Multi Currency Allowed For BOQ,Is Multi Currency Allowed For Fee,Allow Two Stage Bidding,Cover No,Cover,Document Type,Description,Publish Date,Bid Opening Date,Document Download / Sale Start Date,Document Download / Sale End Date,Clarification Start Date,Clarification End Date,Bid Submission Start Date,Bid Submission End Date,Financial Bid Opening Date,EMD Amount in ₹,EMD Exemption Allowed,EMD Fee Type,EMD Percentage,EMD Payable To,EMD Payable At,S.No,Bank Name,Tender Fee in ₹,Fee Payable To,Fee Payable At,Tender Fee Exemption Allowed,Name,Address,Title,Work Description,Pre Qualification Details,Independent External Monitor/Remarks,Tender Value in ₹,Product Category,Sub category,Contract Type,Bid Validity(Days),Period Of Work(Days),Location,Pincode,Pre Bid Meeting Place,Pre Bid Meeting Address,Pre Bid Meeting Date,Bid Opening Place,Should Allow NDA Tender,Allow Preferential Bidder,Tender Stage,Contract Date :,Contract Value :,Work Completion Period in days :,Updated By :,Updated on :,AOC document :,AOC Description :,S.No,Bid Number,Bidder Name,Awarded Currency,Awarded Value,S.No.1,Bid Number.1,Bidder Name.1,Submitted Date,Status,Remarks,Status Updated On,Type :,Summary :,Updated By :.1,Updated On :,Document :,BOQ Comparative Chart :,Committee Chairperson/Co-ordinator Name :,Committee Chairperson/Co-ordinator Type :,Committee Members :,Updated By :.2,Updated on :.1,Document :.1,Organisation Chain :,Tender ID :,Tender Ref No :,Tender Title :,Type :.1,Summary :.1,Updated By :.3,Updated On :.1,Document :.2,Committee Chairperson/Co-ordinator Name :.1,Committee Chairperson/Co-ordinator Type :.1,Committee Members :.1,Updated By :.4,Updated On :.2,Financial Bid Opening Date:,Document :.3,Tender Stage
"Pr. Chief Conservator of Forest and Head of Forest Force||Chief Conservator of Forests (Upper Assam Zone)||Eastern Assam Circle, Jorhat||Digboi Division",DIG/NIT/102 dt. 26/05/2025,2025_PCCF_44623_1,Yes,Open Tender,Works,Works,2.0,No,No,Online,No,No,No,1.0,Fee/PreQual/Technical,.pdf,Scan copy of Eligibility Criteria Documents,29-May-2025 12:30 PM,19-Jun-2025 11:00 AM,29-May-2025 02:00 PM,18-Jun-2025 02:00 PM,03-Jun-2025 11:35 AM ,03-Jun-2025 02:00 PM ,04-Jun-2025 11:00 AM,18-Jun-2025 02:00 PM,21-Jun-2025 11:00 AM,"40,000",Yes,fixed,,Nil,Nil,1.0,SBI Bank,400.0,Nil,Nil,Yes,"Divisional Forest Officer, Digboi Division, Digboi","O/o the DFO, Digboi Division, Digboi",Construction of Community hall at Ulup,Construction of Community hall at Ulup,Please refer to the bid document ,NA ,"20,00,000",Civil Works - Building,NA ,Tender,60.0,60.0,Ulup,786181.0,"O/o the DFO, Digboi Division, Digboi ","O/o the DFO, Digboi Division, Digboi ",03-Jun-2025 11:30 AM ,"O/o the DFO, Digboi Division, Digboi",No ,No,AOC,16-Jul-2025,"INR 1,900,000",60.0,SANDEEP B V,16-Jul-2025 05:14 PM,WorkOrder.pdf (350.00 KB),Offline Work order has been given on 01/07/2025,1.0,270189.0,M/S VIJAY AGARWAL AND SONS,INR,"1,900,000",1,270279,DULAL CH MECH AND CO,17-Jun-2025 09:55 PM,Not Admitted-Fee/PreQual/Technical,Not Complied with technical specification,20-Jun-2025 08:23 PM,Finance,Financial cover has been opened.,SANDEEP B V,16-Jul-2025 05:02 PM,,BOQ Comparative Chart,HOD,Internal,,SANDEEP B V,16-Jul-2025 05:09 PM,finsummary_70937.pdf (752.25 KB),"Pr. Chief Conservator of Forest and Head of Forest Force||Chief Conservator of Forests (Upper Assam Zone)||Eastern Assam Circle, Jorhat||Digboi Division",2025_PCCF_44623_1,DIG/NIT/102 dt. 26/05/2025,Construction of Community hall at Ulup,Technical,Technical bid has been opened,SANDEEP B V,20-Jun-2025 08:23 PM,technical_70937.pdf,HOD,Internal,,SANDEEP B V,21-Jun-2025 10:29 AM,21-Jun-2025 11:00 AM,techsummary_70937.pdf (367.12 KB),AOC
,,,,,,,,,,,,,,,,.pdf,Additional Technical Qualification Documents,,,,,,,,,,,,,,,,,,,,,,,,,,,,,,,,,,,,,,,,,,AOC,,,,,,,,,,,,,2,270222,Ganesh Daimary,17-Jun-2025 07:24 PM,Rejected-Finance,Quoted below three percent on the estimated amount,16-Jul-2025 05:09 PM,,,,,,,,,,,,,,,,,,,,,,,,,,,,,AOC
,,,,,,,,,,,,,,,,.pdf,Tender Documents,,,,,,,,,,,,,,,,,,,,,,,,,,,,,,,,,,,,,,,,,,AOC,,,,,,,,,,,,,3,270270,J D ASSOCIATES,17-Jun-2025 07:04 PM,Not Admitted-Fee/PreQual/Technical,Not Complied with technical specification,20-Jun-2025 08:23 PM,,,,,,,,,,,,,,,,,,,,,,,,,,,,,AOC
,,,,,,,,,,,,,,,,.pdf,Others,,,,,,,,,,,,,,,,,,,,,,,,,,,,,,,,,,,,,,,,,,AOC,,,,,,,,,,,,,4,270235,KANAI CHETIA,18-Jun-2025 12:05 AM,Rejected-Finance,Quoted below ten percent on the estimated amount,16-Jul-2025 05:09 PM,,,,,,,,,,,,,,,,,,,,,,,,,,,,,AOC
,,,,,,,,,,,,,,2.0,Finance,.xls,Price Bid (BOQ),,,,,,,,,,,,,,,,,,,,,,,,,,,,,,,,,,,,,,,,,,AOC,,,,,,,,,,,,,5,270276,M/S A P S ENTERPRISE,17-Jun-2025 07:28 PM,Rejected-Finance,Zero percent below on the estimated cost.,16-Jul-2025 05:09 PM,,,,,,,,,,,,,,,,,,,,,,,,,,,,,AOC
,,,,,,,,,,,,,,,,,,,,,,,,,,,,,,,,,,,,,,,,,,,,,,,,,,,,,,,,,,,AOC,,,,,,,,,,,,,6,270165,M/S Azad Constructions,17-Jun-2025 08:35 PM,Not Admitted-Fee/PreQual/Technical,Not Complied with technical specification,20-Jun-2025 08:23 PM,,,,,,,,,,,,,,,,,,,,,,,,,,,,,AOC
,,,,,,,,,,,,,,,,,,,,,,,,,,,,,,,,,,,,,,,,,,,,,,,,,,,,,,,,,,,AOC,,,,,,,,,,,,,7,270189,M/S VIJAY AGARWAL AND SONS,17-Jun-2025 08:41 PM,Accepted-AOC,Comparatively highest amount of hundred percent of civil Works completed during last Five years as per submitted document,16-Jul-2025 05:14 PM,,,,,,,,,,,,,,,,,,,,,,,,,,,,,AOC
,,,,,,,,,,,,,,,,,,,,,,,,,,,,,,,,,,,,,,,,,,,,,,,,,,,,,,,,,,,AOC,,,,,,,,,,,,,8,270252,SANJAY KUMAR SHARMA,18-Jun-2025 11:36 AM,Not Admitted-Fee/PreQual/Technical,Not Complied with technical specification,20-Jun-2025 08:23 PM,,,,,,,,,,,,,,,,,,,,,,,,,,,,,AOC
,,,,,,,,,,,,,,,,,,,,,,,,,,,,,,,,,,,,,,,,,,,,,,,,,,,,,,,,,,,AOC,,,,,,,,,,,,,9,270289,Sri Girin Chutia,18-Jun-2025 10:48 AM,Not Admitted-Fee/PreQual/Technical,Not Complied with technical specification,20-Jun-2025 08:23 PM,,,,,,,,,,,,,,,,,,,,,,,,,,,,,AOC
