Organisation Chain,Tender Reference Number,Tender ID,Withdrawal Allowed,Tender Type,Form of contract,Tender Category,No. of Covers,General Technical Evaluation Allowed,ItemWise Technical Evaluation Allowed,Payment Mode,Is Multi Currency Allowed For BOQ,Is Multi Currency Allowed For Fee,Allow Two Stage Bidding,Cover No,Cover,Document Type,Description,Publish Date,Bid Opening Date,Document Download / Sale Start Date,Document Download / Sale End Date,Clarification Start Date,Clarification End Date,Bid Submission Start Date,Bid Submission End Date,Financial Bid Opening Date,EMD Amount in ₹,EMD Exemption Allowed,EMD Fee Type,EMD Percentage,EMD Payable To,EMD Payable At,S.No,Corrigendum Title,Corrigendum Type,View,S.No.1,Bank Name,Tender Fee in ₹,Fee Payable To,Fee Payable At,Tender Fee Exemption Allowed,Name,Address,Title,Work Description,Pre Qualification Details,Independent External Monitor/Remarks,Tender Value in ₹,Product Category,Sub category,Contract Type,Bid Validity(Days),Period Of Work(Days),Location,Pincode,Pre Bid Meeting Place,Pre Bid Meeting Address,Pre Bid Meeting Date,Bid Opening Place,Should Allow NDA Tender,Allow Preferential Bidder,Tender Stage,Contract Date :,Contract Value :,Work Completion Period in days :,Updated By :,Updated on :,AOC document :,AOC Description :,S.No,Bid Number,Bidder Name,Awarded Currency,Awarded Value,S.No.1,Bid Number.1,Bidder Name.1,Submitted Date,Status,Remarks,Status Updated On,Type :,Summary :,Updated By :.1,Updated On :,Document :,BOQ Comparative Chart :,Committee Chairperson/Co-ordinator Name :,Committee Chairperson/Co-ordinator Type :,Committee Members :,Updated By :.2,Updated on :.1,Document :.1,Organisation Chain :,Tender ID :,Tender Ref No :,Tender Title :,Type :.1,Summary :.1,Updated By :.3,Updated On :.1,Document :.2,Committee Chairperson/Co-ordinator Name :.1,Committee Chairperson/Co-ordinator Type :.1,Committee Members :.1,Updated By :.4,Updated On :.2,Financial Bid Opening Date:,Document :.3,Tender Stage
Office of the Chief Electoral Officer Assam,RFP No. ELE.1/2025/1,2025_CEO_42475_1,Yes,Open Tender,Item Rate,Services,2.0,No,No,Online,No,No,No,1.0,Fee/PreQual/Technical,.pdf,Technical documents,03-Feb-2025 02:00 PM,11-Mar-2025 04:30 PM,03-Feb-2025 02:00 PM,11-Mar-2025 04:00 PM,NA ,NA ,18-Feb-2025 10:00 AM,11-Mar-2025 04:00 PM,08-May-2025 09:00 AM,"2,00,000",No,fixed,,Nil,Nil,1.0,Technical Bid Corrigendum,Technical Bid,,1.0,SBI Bank,"2,000",Nil,Nil,No,Chief Electoral Officer,"OFFICE OF THE CHIEF ELECTORAL OFFICER, ASSAM GUWAHATI - 781006",TRANSPORTATION OF ELECTRONIC VOTING MACHINES,TRANSPORTATION OF ELECTRONIC VOTING MACHINES,Please refer Tender documents. ,NA ,,Shipping/ Transportation/ Vehicle,NA ,Tender,180.0,NA ,Guwahati,781006.0,NA ,NA ,NA ,"OFFICE OF THE CHIEF ELECTORAL OFFICER, ASSAM",No ,No,AOC,05-Jul-2025,INR 220,450.0,Anurag Goel,05-Jul-2025 04:41 PM,agreement.pdf (1381.00 KB),Contract value is the Agreed Rates as quoted by the Service Provider.,1.0,260759.0,AIR TRANSPORT CORPORATION,INR,220.0,1,260759,AIR TRANSPORT CORPORATION,10-Mar-2025 03:28 PM,Accepted-AOC,This contract is awarded on the rate of Rs.220 per KM. Only discovered the rate,05-Jul-2025 04:41 PM,Finance,Financial bid has been opened,MAMTAZ AHMED,08-May-2025 01:35 PM,,BOQ Comparative Chart,"Shri. Anurag Goel, IAS, Chief Electoral Officer, Assam (Chairperson)",Internal,,Anurag Goel,05-Jul-2025 04:31 PM,finsummary_68209.pdf (141.02 KB),Office of the Chief Electoral Officer Assam,2025_CEO_42475_1,RFP No. ELE.1/2025/1,TRANSPORTATION OF ELECTRONIC VOTING MACHINES,Technical,Technical bid has been opened,MAMTAZ AHMED,11-Mar-2025 05:11 PM,,CEO,Internal,,Anurag Goel,06-May-2025 03:40 PM,08-May-2025 09:00 AM,techsummary_68209.pdf (125.21 KB),AOC
,,,,,,,,,,,,,,,,.pdf,Bid document downloaded from the portal,,,,,,,,,,,,,,,,,,,,,,,,,,,,,,,,,,,,,,,,,,,,,,AOC,,,,,,,,,,,,,2,260775,EFC LogisticsIndia Pvt Ltd.,11-Mar-2025 11:31 AM,Rejected-Technical,Technically not Qualified,06-May-2025 03:40 PM,,,,,,,,,,,,,,,,,,,,,,,,,,,,,AOC
,,,,,,,,,,,,,,2.0,Finance,.xls,Price Bid,,,,,,,,,,,,,,,,,,,,,,,,,,,,,,,,,,,,,,,,,,,,,,AOC,,,,,,,,,,,,,3,260438,HERITAGE TRANSPORT ORGANISATION,10-Mar-2025 04:31 PM,Rejected-Finance,Refers to Financial Evaluation minutes,05-Jul-2025 04:31 PM,,,,,,,,,,,,,,,,,,,,,,,,,,,,,AOC
,,,,,,,,,,,,,,,,,,,,,,,,,,,,,,,,,,,,,,,,,,,,,,,,,,,,,,,,,,,,,,,AOC,,,,,,,,,,,,,4,261172,RADHIKA EXPRESS SERVICE,11-Mar-2025 03:31 PM,Rejected-Technical,Technically not Qualified,06-May-2025 03:40 PM,,,,,,,,,,,,,,,,,,,,,,,,,,,,,AOC
,,,,,,,,,,,,,,,,,,,,,,,,,,,,,,,,,,,,,,,,,,,,,,,,,,,,,,,,,,,,,,,AOC,,,,,,,,,,,,,5,260998,SUPER SONIC CARRIER PVT LTD,10-Mar-2025 05:06 PM,Rejected-Technical,Technically not Qualified,06-May-2025 03:40 PM,,,,,,,,,,,,,,,,,,,,,,,,,,,,,AOC
