Organisation Chain,Tender Reference Number,Tender ID,Withdrawal Allowed,Tender Type,Form of contract,Tender Category,No. of Covers,General Technical Evaluation Allowed,ItemWise Technical Evaluation Allowed,Payment Mode,Is Multi Currency Allowed For BOQ,Is Multi Currency Allowed For Fee,Allow Two Stage Bidding,Cover No,Cover,Document Type,Description,Publish Date,Bid Opening Date,Document Download / Sale Start Date,Document Download / Sale End Date,Clarification Start Date,Clarification End Date,Bid Submission Start Date,Bid Submission End Date,Financial Bid Opening Date,EMD Amount in ₹,EMD Exemption Allowed,EMD Fee Type,EMD Percentage,EMD Payable To,EMD Payable At,S.No,Corrigendum Title,Corrigendum Type,View,S.No.1,Bank Name,Tender Fee in ₹,Fee Payable To,Fee Payable At,Tender Fee Exemption Allowed,Name,Address,Title,Work Description,Pre Qualification Details,Independent External Monitor/Remarks,Tender Value in ₹,Product Category,Sub category,Contract Type,Bid Validity(Days),Period Of Work(Days),Location,Pincode,Pre Bid Meeting Place,Pre Bid Meeting Address,Pre Bid Meeting Date,Bid Opening Place,Should Allow NDA Tender,Allow Preferential Bidder,Tender Stage,Contract Date :,Contract Value :,Work Completion Period in days :,Updated By :,Updated on :,AOC document :,AOC Description :,S.No,Bid Number,Bidder Name,Awarded Currency,Awarded Value,S.No.1,Bid Number.1,Bidder Name.1,Submitted Date,Status,Remarks,Status Updated On,Type :,Summary :,Updated By :.1,Updated On :,Document :,BOQ Comparative Chart :,Committee Chairperson/Co-ordinator Name :,Committee Chairperson/Co-ordinator Type :,Committee Members :,Updated By :.2,Updated on :.1,Document :.1,Organisation Chain :,Tender ID :,Tender Ref No :,Tender Title :,Type :.1,Summary :.1,Updated By :.3,Updated On :.1,Document :.2,Committee Chairperson/Co-ordinator Name :.1,Committee Chairperson/Co-ordinator Type :.1,Committee Members :.1,Updated By :.4,Updated On :.2,Financial Bid Opening Date:,Document :.3,Tender Stage
Assam Police Housing Corporation Ltd,APHC/CS/86/2024-25_ OrangPS,2025_APHC_42729_1,Yes,Open Tender,Item Rate,Works,2.0,No,No,Online,No,No,No,1.0,Fee/PreQual/Technical,.pdf,DOCUMENT COST,27-Feb-2025 02:00 PM,24-Mar-2025 11:30 AM,27-Feb-2025 02:00 PM,21-Mar-2025 02:00 PM,NA ,NA ,27-Feb-2025 02:00 PM,21-Mar-2025 02:00 PM,10-Jun-2025 11:30 AM,"5,97,278",Yes,percentage,2.0%,Nil,Nil,1.0,Corrigendum2,Technical Bid,,1.0,SBI Bank,"5,973",Nil,Nil,No,Chief Engineer,Assam Police Housing Corporation Ltd Rehabari Guwahati 8,Construction of RCC G1 PS building at Orang PS of Udalguri District Assam under MOITRI Scheme on Engineering Procurement and Construction EPC mode 1 basis.,Construction of RCC G1 PS building at Orang PS of Udalguri District Assam under MOITRI Scheme on Engineering Procurement and Construction EPC mode 1 basis.,Please refer Tender documents. ,NA ,"2,98,63,923",Construction Works,NA ,Tender,180.0,450.0,"Orang PS, Udalguri",784114.0,Assam Police Housing Corporation Ltd. ,Assam Police Housing Corporation Ltd Rehabari Guwahati 8  ,05-Mar-2025 02:00 PM ,Assam Police Housing Corporation Ltd.,No ,No,AOC,24-Jul-2025,"INR 28,039,237",450.0,Manoranjan Thakur,24-Jul-2025 02:32 PM,081_OrangPS.pdf (864.00 KB),Formal Work Order,1.0,262317.0,M/s Macrocosm Builders,INR,"28,039,237",1.0,262555.0,HIGH-TECH ECOGREEN CONTRACTORS LLP,21-Mar-2025 12:46 PM,Rejected-Technical,Technically Non Responsive,06-Jun-2025 01:45 PM,Finance,Financial bid has been opened,Manoranjan Thakur,10-Jun-2025 02:21 PM,finance_68510.pdf,BOQ Comparative Chart,"Chief Engineer, APHC LTD",Internal,,Manoranjan Thakur,25-Jun-2025 07:22 PM,finsummary_68510.pdf (14994.46 KB),Assam Police Housing Corporation Ltd,2025_APHC_42729_1,APHC/CS/86/2024-25_ OrangPS,Construction of RCC G1 PS building at Orang PS of Udalguri District Assam under MOITRI Scheme on Engineering Procurement and Construction EPC mode 1 basis.,Technical,Summary,Manoranjan Thakur,26-Mar-2025 01:21 PM,technical_68510.pdf,"Chief Engineer, APHC LTD",Internal,Member list and minutes uploaded,Manoranjan Thakur,06-Jun-2025 01:45 PM,10-Jun-2025 11:30 AM,techsummary_68510.pdf (17689.32 KB),AOC
,,,,,,,,,,,,,,,,.pdf,BID SECURITY,,,,,,,,,,,,,,,,,,,,,,,,,,,,,,,,,,,,,,,,,,,,,,AOC,,,,,,,,,,,,,2.0,262331.0,JAI MAA KAMAKHYA INFRASTRUCTURE,21-Mar-2025 03:10 AM,Rejected-Technical,Technically Non Responsive,06-Jun-2025 01:45 PM,,,,,,,,,,,,,,,,,,,,,,,,,,,,,AOC
,,,,,,,,,,,,,,,,.pdf,TECHNICAL DOCUMENT,,,,,,,,,,,,,,,,,,,,,,,,,,,,,,,,,,,,,,,,,,,,,,AOC,,,,,,,,,,,,,3.0,262317.0,M/s Macrocosm Builders,21-Mar-2025 12:59 PM,Accepted-AOC,Awarded,24-Jul-2025 02:32 PM,,,,,,,,,,,,,,,,,,,,,,,,,,,,,AOC
,,,,,,,,,,,,,,,,.pdf,BID DOCUMENT,,,,,,,,,,,,,,,,,,,,,,,,,,,,,,,,,,,,,,,,,,,,,,AOC,,,,,,,,,,,,,4.0,262384.0,VERSHA TECHNOTRADE PVT LTD,20-Mar-2025 11:36 PM,Rejected-AOC,Not Awarded,24-Jul-2025 02:32 PM,,,,,,,,,,,,,,,,,,,,,,,,,,,,,AOC
,,,,,,,,,,,,,,2.0,Finance,.xls,BOQ,,,,,,,,,,,,,,,,,,,,,,,,,,,,,,,,,,,,,,,,,,,,,,AOC,,,,,,,,,,,,,,,,,,,,,,,,,,,,,,,,,,,,,,,,,,,,,,,,AOC
,,,,,,,,,,,,,,,,.pdf,Letter comprising the Financial BID,,,,,,,,,,,,,,,,,,,,,,,,,,,,,,,,,,,,,,,,,,,,,,AOC,,,,,,,,,,,,,,,,,,,,,,,,,,,,,,,,,,,,,,,,,,,,,,,,AOC
