Organisation Chain,Tender Reference Number,Tender ID,Withdrawal Allowed,Tender Type,Form of contract,Tender Category,No. of Covers,General Technical Evaluation Allowed,ItemWise Technical Evaluation Allowed,Payment Mode,Is Multi Currency Allowed For BOQ,Is Multi Currency Allowed For Fee,Allow Two Stage Bidding,Cover No,Cover,Document Type,Description,Publish Date,Bid Opening Date,Document Download / Sale Start Date,Document Download / Sale End Date,Clarification Start Date,Clarification End Date,Bid Submission Start Date,Bid Submission End Date,Financial Bid Opening Date,EMD Amount in ₹,EMD Exemption Allowed,EMD Fee Type,EMD Percentage,EMD Payable To,EMD Payable At,S.No,Bank Name,Tender Fee in ₹,Fee Payable To,Fee Payable At,Tender Fee Exemption Allowed,Name,Address,Title,Work Description,Pre Qualification Details,Independent External Monitor/Remarks,Tender Value in ₹,Product Category,Sub category,Contract Type,Bid Validity(Days),Period Of Work(Days),Location,Pincode,Pre Bid Meeting Place,Pre Bid Meeting Address,Pre Bid Meeting Date,Bid Opening Place,Should Allow NDA Tender,Allow Preferential Bidder,Tender Stage,Contract Date :,Contract Value :,Work Completion Period in days :,Updated By :,Updated on :,AOC document :,AOC Description :,S.No,Bid Number,Bidder Name,Awarded Currency,Awarded Value,S.No.1,Bid Number.1,Bidder Name.1,Submitted Date,Status,Remarks,Status Updated On,Type :,Summary :,Updated By :.1,Updated On :,Document :,BOQ Comparative Chart :,Committee Chairperson/Co-ordinator Name :,Committee Chairperson/Co-ordinator Type :,Committee Members :,Updated By :.2,Updated on :.1,Document :.1,Organisation Chain :,Tender ID :,Tender Ref No :,Tender Title :,Type :.1,Summary :.1,Updated By :.3,Updated On :.1,Document :.2,Committee Chairperson/Co-ordinator Name :.1,Committee Chairperson/Co-ordinator Type :.1,Committee Members :.1,Updated By :.4,Updated On :.2,Financial Bid Opening Date:,Document :.3,Tender Stage
Bodoland Territorial Council||Panchayat and Rural Development-BTC,SYW(SOPD)-06 of 2023-24,2025_BoTC_43575_1,Yes,Open Tender,Works,Works,2.0,No,No,Online,No,No,No,1.0,Fee/PreQual/Technical,.pdf,Notice Inviting Tender,19-Mar-2025 10:00 AM,09-Apr-2025 02:30 PM,19-Mar-2025 10:05 AM,09-Apr-2025 02:00 PM,19-Mar-2025 10:30 AM ,09-Apr-2025 02:00 PM ,19-Mar-2025 10:30 AM,09-Apr-2025 02:00 PM,10-Apr-2025 01:45 PM,"44,000",Yes,percentage,2.0%,Nil,Nil,1.0,SBI Bank,660.0,Nil,Nil,No,BDO Kokrajhar Development Block,BDO Kokrajhar Dev Block Titaguri,Const. of Store room,"Construction of Store room of the office of the Directorate of Sports and Youth Welfare, BTC, Kokrajhar at Titaguri under SOPD fund for the year 2023-24",Please refer Tender documents. ,NA ,"22,00,000",Civil Works,NA ,Tender,180.0,NA ,Office of the Directorate of Sports Youth Welfare,783370.0,NA ,NA ,NA ,BDO Kokrajhar Dev Block Titaguri,No ,No,AOC,09-May-2025,"INR 2,195,000",180.0,Thaneswar Brahma,10-May-2025 06:50 PM,AOC.pdf (473.00 KB),Formal work order,1.0,265440.0,Phukan Lahary,INR,"2,195,000",1.0,265440.0,Phukan Lahary,08-Apr-2025 09:36 PM,Accepted-AOC,Lowest amount quoted,10-May-2025 06:50 PM,Finance,Financial Bid Opening 2nd cover,Praksh Ch Chanda,10-Apr-2025 01:51 PM,finance_69466.pdf,BOQ Comparative Chart,Prakash Ch Chanda,Internal,Thaneswar Brahma Accountant cum sk Khanjan Nath Assistant Engineer,Praksh Ch Chanda,10-Apr-2025 01:58 PM,finsummary_69466.pdf (433.42 KB),Bodoland Territorial Council||Panchayat and Rural Development-BTC,2025_BoTC_43575_1,SYW(SOPD)-06 of 2023-24,Const. of Store room,Technical,Bid Opening Technical for 1st Cover (Technical),Khanjan Nath,10-Apr-2025 01:28 PM,technical_69466.pdf,Prakash Ch Chanda,Internal,Thaneswar Brahma Accountant cum SK Khanjan Nath Assistant Engineer,Khanjan Nath,10-Apr-2025 01:36 PM,10-Apr-2025 01:45 PM,techsummary_69466.pdf (374.39 KB),AOC
,,,,,,,,,,,,,,,,.pdf,Technical Document,,,,,,,,,,,,,,,,,,,,,,,,,,,,,,,,,,,,,,,,,,AOC,,,,,,,,,,,,,2.0,265439.0,Sashanka Narzary,08-Apr-2025 09:25 PM,Rejected-Finance,High amount rate quoted,10-Apr-2025 01:58 PM,,,,,,,,,,,,,,,,,,,,,,,,,,,,,AOC
,,,,,,,,,,,,,,,,.pdf,Standard Bid Document,,,,,,,,,,,,,,,,,,,,,,,,,,,,,,,,,,,,,,,,,,AOC,,,,,,,,,,,,,3.0,265468.0,Sri Sanswrang Basumatary,09-Apr-2025 11:44 AM,Rejected-Finance,Highest Amount rate quoted,10-Apr-2025 01:58 PM,,,,,,,,,,,,,,,,,,,,,,,,,,,,,AOC
,,,,,,,,,,,,,,2.0,Finance,.xls,Bill of quantity,,,,,,,,,,,,,,,,,,,,,,,,,,,,,,,,,,,,,,,,,,AOC,,,,,,,,,,,,,,,,,,,,,,,,,,,,,,,,,,,,,,,,,,,,,,,,AOC
,,,,,,,,,,,,,,,,.pdf,Form of Bid,,,,,,,,,,,,,,,,,,,,,,,,,,,,,,,,,,,,,,,,,,AOC,,,,,,,,,,,,,,,,,,,,,,,,,,,,,,,,,,,,,,,,,,,,,,,,AOC
