Organisation Chain,Tender Reference Number,Tender ID,Withdrawal Allowed,Tender Type,Form of contract,Tender Category,No. of Covers,General Technical Evaluation Allowed,ItemWise Technical Evaluation Allowed,Payment Mode,Is Multi Currency Allowed For BOQ,Is Multi Currency Allowed For Fee,Allow Two Stage Bidding,Cover No,Cover,Document Type,Description,Publish Date,Bid Opening Date,Document Download / Sale Start Date,Document Download / Sale End Date,Clarification Start Date,Clarification End Date,Bid Submission Start Date,Bid Submission End Date,Financial Bid Opening Date,EMD Amount in ₹,EMD Exemption Allowed,EMD Fee Type,EMD Percentage,EMD Payable To,EMD Payable At,S.No,Bank Name,Tender Fee in ₹,Fee Payable To,Fee Payable At,Tender Fee Exemption Allowed,Name,Address,Title,Work Description,Pre Qualification Details,Independent External Monitor/Remarks,Tender Value in ₹,Product Category,Sub category,Contract Type,Bid Validity(Days),Period Of Work(Days),Location,Pincode,Pre Bid Meeting Place,Pre Bid Meeting Address,Pre Bid Meeting Date,Bid Opening Place,Should Allow NDA Tender,Allow Preferential Bidder,Tender Stage,Contract Date :,Contract Value :,Work Completion Period in days :,Updated By :,Updated on :,AOC document :,AOC Description :,S.No,Bid Number,Bidder Name,Awarded Currency,Awarded Value,S.No.1,Bid Number.1,Bidder Name.1,Submitted Date,Status,Remarks,Status Updated On,Type :,Summary :,Updated By :.1,Updated On :,Document :,BOQ Comparative Chart :,Committee Chairperson/Co-ordinator Name :,Committee Chairperson/Co-ordinator Type :,Committee Members :,Updated By :.2,Updated on :.1,Document :.1,Organisation Chain :,Tender ID :,Tender Ref No :,Tender Title :,Type :.1,Summary :.1,Updated By :.3,Updated On :.1,Document :.2,Committee Chairperson/Co-ordinator Name :.1,Committee Chairperson/Co-ordinator Type :.1,Committee Members :.1,Updated By :.4,Updated On :.2,Financial Bid Opening Date:,Document :.3,Tender Stage
Irrigation Department||Chief Engineer(Major)-Irrigation Dept||Nagaon Circle||Morigaon Laharighat Jagiroad Division,MLJDI_TB_NIT_1_1_2022_23 dtd 30_12_2024,2024_ID_41772_1,Yes,Open Tender,Item Rate,Works,2.0,No,No,Online,No,No,No,1.0,Fee/PreQual/Technical,.pdf,NIT,30-Dec-2024 06:00 PM,20-Jan-2025 03:00 PM,30-Dec-2024 06:15 PM,20-Jan-2025 01:00 PM,NA ,NA ,31-Dec-2024 10:00 AM,20-Jan-2025 01:00 PM,26-Mar-2025 03:15 PM,"70,952",Yes,percentage,2.0%,Nil,Nil,1.0,SBI Bank,800.0,Nil,Nil,No,Executive EngineerMorigaon Laharighat JagiroadDiv,"Office of the EE, Morigaon Laharighat Jagiroad Div",Installation of MDTW Scheme SOLAR POWERED_1 Point at Dhigalbori GP Under Bhurbandha Development Block in Morigaon LAC under SOPDG for the year 2024_25,Installation of MDTW Scheme SOLAR POWERED_1 Point at Dhigalbori GP Under Bhurbandha Development Block in Morigaon LAC under SOPDG for the year 2024_25,Please refer Tender documents. ,NA ,"35,47,598",Civil Works,NA ,Tender,180.0,180.0,Morigaon,782105.0,"Office of the EE, Morigaon Laharighat Jagiroad Div ","Office of the EE, Morigaon Laharighat Jagiroad Div ",08-Jan-2025 02:00 PM ,"Office of the EE, Morigaon Laharighat Jagiroad Div",No ,No,AOC,16-May-2025,"INR 3,055,957",180.0,Angshuman Das,30-May-2025 02:12 PM,AOC_Dighalbori.pdf (10682.00 KB),Works have been allotted to Balaji Constructions as detailed in the body of the CS and recommendations of the tender committee,1.0,255634.0,BALAJI CONSTRUCTIONS,INR,"3,055,957",1,255634,BALAJI CONSTRUCTIONS,20-Jan-2025 11:41 AM,Accepted-AOC,Works have been allotted to Balaji Constructions as detailed in the body of the CS and recommendation of Tender Committee,30-May-2025 02:13 PM,Finance,Financial Evaluation is under process,Angshuman Das,26-Mar-2025 03:41 PM,,BOQ Comparative Chart,Ratul Borah AEE(TC),Internal,"Ratul Borah AEE(TC), Atul Ch Bordoloi AO, Angshuman Das AEE, Pompi Borah AE, Panchi Tamuly AE",Angshuman Das,27-Mar-2025 04:21 PM,finsummary_67242.pdf (934.78 KB),Irrigation Department||Chief Engineer(Major)-Irrigation Dept||Nagaon Circle||Morigaon Laharighat Jagiroad Division,2024_ID_41772_1,MLJDI_TB_NIT_1_1_2022_23 dtd 30_12_2024,Installation of MDTW Scheme SOLAR POWERED_1 Point at Dhigalbori GP Under Bhurbandha Development Block in Morigaon LAC under SOPDG for the year 2024_25,Technical,Technical Evaluation is under Process,Pompi Boaah,20-Jan-2025 03:22 PM,,Ratul Borah AEE(TC),Internal,"Atul Ch. Bordoloi AO, Ratul Borah AEE(TC) , Angshuman Das AEE, Panchi Tamuly AE, Pompi Borah AE",Pompi Boaah,26-Mar-2025 03:07 PM,26-Mar-2025 03:15 PM,techsummary_67242.pdf (575.21 KB),AOC
,,,,,,,,,,,,,,,,.pdf,Prequalification,,,,,,,,,,,,,,,,,,,,,,,,,,,,,,,,,,,,,,,,,,AOC,,,,,,,,,,,,,2,255433,BIPUL MEDHI,19-Jan-2025 06:21 PM,Rejected-Finance,The work has been proposed to be allotted to L1 Bidder- Balaji Construction as detailed in the attached MOM,27-Mar-2025 04:21 PM,,,,,,,,,,,,,,,,,,,,,,,,,,,,,AOC
,,,,,,,,,,,,,,,,.pdf,Bid Document,,,,,,,,,,,,,,,,,,,,,,,,,,,,,,,,,,,,,,,,,,AOC,,,,,,,,,,,,,3,255063,Gauri Constructions and Services,19-Jan-2025 03:13 PM,Rejected-Technical,Detailed in the MOM,26-Mar-2025 03:07 PM,,,,,,,,,,,,,,,,,,,,,,,,,,,,,AOC
,,,,,,,,,,,,,,2.0,Finance,.xls,BOQ,,,,,,,,,,,,,,,,,,,,,,,,,,,,,,,,,,,,,,,,,,AOC,,,,,,,,,,,,,4,255123,JAKIR HUSSAIN,20-Jan-2025 12:06 AM,Rejected-Technical,Detailed in the MOM,26-Mar-2025 03:07 PM,,,,,,,,,,,,,,,,,,,,,,,,,,,,,AOC
,,,,,,,,,,,,,,,,,,,,,,,,,,,,,,,,,,,,,,,,,,,,,,,,,,,,,,,,,,,AOC,,,,,,,,,,,,,5,255494,Pankaj Pratim Deka,20-Jan-2025 12:36 PM,Rejected-Technical,Detailed in the MOM,26-Mar-2025 03:07 PM,,,,,,,,,,,,,,,,,,,,,,,,,,,,,AOC
