Organisation Chain,Tender Reference Number,Tender ID,Withdrawal Allowed,Tender Type,Form of contract,Tender Category,No. of Covers,General Technical Evaluation Allowed,ItemWise Technical Evaluation Allowed,Payment Mode,Is Multi Currency Allowed For BOQ,Is Multi Currency Allowed For Fee,Allow Two Stage Bidding,Cover No,Cover,Document Type,Description,Publish Date,Bid Opening Date,Document Download / Sale Start Date,Document Download / Sale End Date,Clarification Start Date,Clarification End Date,Bid Submission Start Date,Bid Submission End Date,Financial Bid Opening Date,EMD Amount in ₹,EMD Exemption Allowed,EMD Fee Type,EMD Percentage,EMD Payable To,EMD Payable At,S.No,Bank Name,Tender Fee in ₹,Fee Payable To,Fee Payable At,Tender Fee Exemption Allowed,Name,Address,Title,Work Description,Pre Qualification Details,Independent External Monitor/Remarks,Tender Value in ₹,Product Category,Sub category,Contract Type,Bid Validity(Days),Period Of Work(Days),Location,Pincode,Pre Bid Meeting Place,Pre Bid Meeting Address,Pre Bid Meeting Date,Bid Opening Place,Should Allow NDA Tender,Allow Preferential Bidder,Tender Stage,Contract Date :,Contract Value :,Work Completion Period in days :,Updated By :,Updated on :,AOC document :,S.No,Bid Number,Bidder Name,Awarded Currency,Awarded Value,S.No.1,Bid Number.1,Bidder Name.1,Submitted Date,Status,Remarks,Status Updated On,Type :,Summary :,Updated By :.1,Updated On :,Document :,BOQ Comparative Chart :,Committee Chairperson/Co-ordinator Name :,Committee Chairperson/Co-ordinator Type :,Committee Members :,Updated By :.2,Updated on :.1,Document :.1,Organisation Chain :,Tender ID :,Tender Ref No :,Tender Title :,Type :.1,Summary :.1,Updated By :.3,Updated On :.1,Document :.2,Committee Chairperson/Co-ordinator Name :.1,Committee Chairperson/Co-ordinator Type :.1,Committee Members :.1,Updated By :.4,Updated On :.2,Financial Bid Opening Date:,Document :.3,Tender Stage
Public Works Roads Department,SE(GSSC)/TB-01/NIT/2021/69 dated 07.01.2025,2025_PWD_41972_8,Yes,Open Tender,Item Rate,Works,2.0,No,No,Online,No,No,No,1.0,Fee/PreQual/Technical,.pdf,Tender Processing Fees and Bid Security,08-Jan-2025 06:00 PM,28-Jan-2025 02:30 PM,08-Jan-2025 06:00 PM,28-Jan-2025 02:00 PM,NA ,NA ,08-Jan-2025 06:00 PM,28-Jan-2025 02:00 PM,03-Mar-2025 05:00 PM,"92,600",Yes,fixed,,Nil,Nil,1.0,SBI Bank,900.0,Nil,Nil,No,Superintending Engineer,"O/O The Superintending Engineer, PWD Goalpara and South Salmara Roads Circle, Goalpara",Improvement of Road (Type 2) of Aoidoba Pipulbari Singimari (APS) Road under SOPD(G) year 2024-25-Mankachar LAC. Package No. SOPD_GSSRC_SSDTR_22,Improvement of Road (Type 2) of Aoidoba Pipulbari Singimari (APS) Road under SOPD(G) year 2024-25-Mankachar LAC. Package No. SOPD_GSSRC_SSDTR_22,Please refer Tender documents. ,NA ,"46,30,887",Civil Works – Roads,NA ,Tender,90.0,NA ,Mankachar,783101.0,NA ,NA ,NA ,"O/O The S.E.PWD, Glp and SS Road Circle",No ,No,AOC,14-May-2025,"INR 4,630,887",90.0,Kulendra Boro,14-May-2025 06:17 PM,FWO_22.pdf (105.00 KB),1.0,256543.0,MR SHOBHAN KUMAR SAHA,INR,"4,399,342.65",1.0,256319.0,Foyzal Hoque,25-Jan-2025 12:52 PM,Rejected-AOC,Not qualify for AOC,14-May-2025 06:17 PM,Finance,4 Bids admitted,Kulendra Boro,14-May-2025 06:08 PM,finance_67531.pdf,BOQ Comparative Chart,SE,Internal,"SE, AEE, JE",Kulendra Boro,14-May-2025 06:12 PM,finsummary_67531.pdf (237.25 KB),Public Works Roads Department,2025_PWD_41972_8,SE(GSSC)/TB-01/NIT/2021/69 dated 07.01.2025,Improvement of Road (Type 2) of Aoidoba Pipulbari Singimari (APS) Road under SOPD(G) year 2024-25-Mankachar LAC. Package No. SOPD_GSSRC_SSDTR_22,Technical,4 nos bid admitted,Kulendra Boro,03-Mar-2025 04:56 PM,technical_67531.pdf,SE,Internal,"SE, AEE, JE",Kulendra Boro,03-Mar-2025 04:57 PM,03-Mar-2025 05:00 PM,techsummary_67531.pdf (391.90 KB),AOC
,,,,,,,,,,,,,,,,.pdf,Technical Qualification,,,,,,,,,,,,,,,,,,,,,,,,,,,,,,,,,,,,,,,,,,AOC,,,,,,,,,,,,2.0,256089.0,Gazibor Rahman Bhuyan,26-Jan-2025 02:32 PM,Rejected-AOC,Not qualify for AOC,14-May-2025 06:17 PM,,,,,,,,,,,,,,,,,,,,,,,,,,,,,AOC
,,,,,,,,,,,,,,,,.pdf,SBD,,,,,,,,,,,,,,,,,,,,,,,,,,,,,,,,,,,,,,,,,,AOC,,,,,,,,,,,,3.0,256543.0,MR SHOBHAN KUMAR SAHA,26-Jan-2025 11:18 PM,Accepted-AOC,L1,14-May-2025 06:17 PM,,,,,,,,,,,,,,,,,,,,,,,,,,,,,AOC
,,,,,,,,,,,,,,2.0,Finance,.xls,BOQ,,,,,,,,,,,,,,,,,,,,,,,,,,,,,,,,,,,,,,,,,,AOC,,,,,,,,,,,,4.0,256685.0,SHAHI MD. KARIM,27-Jan-2025 05:38 PM,Rejected-AOC,Not qualify for AOC,14-May-2025 06:17 PM,,,,,,,,,,,,,,,,,,,,,,,,,,,,,AOC
,,,,,,,,,,,,,,,,.pdf,Form of Bid,,,,,,,,,,,,,,,,,,,,,,,,,,,,,,,,,,,,,,,,,,AOC,,,,,,,,,,,,,,,,,,,,,,,,,,,,,,,,,,,,,,,,,,,,,,,AOC
