Organisation Chain,Tender Reference Number,Tender ID,Withdrawal Allowed,Tender Type,Form of contract,Tender Category,No. of Covers,General Technical Evaluation Allowed,ItemWise Technical Evaluation Allowed,Payment Mode,Is Multi Currency Allowed For BOQ,Is Multi Currency Allowed For Fee,Allow Two Stage Bidding,Cover No,Cover,Document Type,Description,Publish Date,Bid Opening Date,Document Download / Sale Start Date,Document Download / Sale End Date,Clarification Start Date,Clarification End Date,Bid Submission Start Date,Bid Submission End Date,Financial Bid Opening Date,EMD Amount in ₹,EMD Exemption Allowed,EMD Fee Type,EMD Percentage,EMD Payable To,EMD Payable At,S.No,Corrigendum Title,Corrigendum Type,View,Tender Fee in ₹,Fee Payable To,Fee Payable At,Tender Fee Exemption Allowed,Name,Address,Title,Work Description,Pre Qualification Details,Independent External Monitor/Remarks,Tender Value in ₹,Product Category,Sub category,Contract Type,Bid Validity(Days),Period Of Work(Days),Location,Pincode,Pre Bid Meeting Place,Pre Bid Meeting Address,Pre Bid Meeting Date,Bid Opening Place,Should Allow NDA Tender,Allow Preferential Bidder,Tender Stage,Contract Date :,Contract Value :,Work Completion Period in days :,Updated By :,Updated on :,AOC document :,AOC Description :,S.No,Bid Number,Bidder Name,Awarded Currency,Awarded Value,S.No.1,Bid Number.1,Bidder Name.1,Submitted Date,Status,Remarks,Status Updated On,Type :,Summary :,Updated By :.1,Updated On :,Document :,BOQ Comparative Chart :,Committee Chairperson/Co-ordinator Name :,Committee Chairperson/Co-ordinator Type :,Committee Members :,Updated By :.2,Updated on :.1,Document :.1,Organisation Chain :,Tender ID :,Tender Ref No :,Tender Title :,Type :.1,Summary :.1,Updated By :.3,Updated On :.1,Document :.2,Committee Chairperson/Co-ordinator Name :.1,Committee Chairperson/Co-ordinator Type :.1,Committee Members :.1,Updated By :.4,Updated On :.2,Financial Bid Opening Date:,Document :.3,Tender Stage
Assam State Disaster Management Authority- Externally Aided Project||Assam State Disaster Management Authority- World Bank Funded Tenders||Assam Integrated River Basin Management Programme,IN-ASDMA-374663-CS-QCBS,2023_DMEAP_34754_1,Yes,Limited,Item Rate,Services,2.0,No,No,Not Applicable,No,No,No,1.0,Fee/PreQual/Technical,.pdf,Technical Proposal,18-Dec-2023 09:00 AM,13-Feb-2024 03:00 PM,18-Dec-2023 03:00 PM,13-Feb-2024 03:00 PM,18-Dec-2023 03:00 PM ,08-Jan-2024 05:00 PM ,09-Feb-2024 09:00 AM,13-Feb-2024 03:00 PM,21-Jun-2024 03:00 PM,0.0,No,fixed,,Nil,Nil,1.0,Corrigendum 3,BOQ,,0.0,Nil,Nil,No,Chief Executive Officer,Assam Secretariat Ancillary Block Janata Bhawan Dispur Guwahati 781006 Assam India,Strengthening Assam State Disaster Management Authoritys capacity for Post Disaster Needs Assessment PDNA under Assam Integrated River Basin Management Project,Strengthening Assam State Disaster Management Authoritys capacity for Post Disaster Needs Assessment PDNA under Assam Integrated River Basin Management Project,Please refer Tender documents. ,NA ,"9,20,00,000",Consultancy,Post Disaster Need Assessment ,Tender,120.0,731.0,Services,781006.0,ASDMA ,Assam Secretariat Ancillary Block Janata Bhawan Dispur Guwahati 781006 Assam India ,02-Jan-2024 03:00 PM ,ASDMA,No ,No,AOC,31-May-2025,"INR 61,904,058",731.0,Alakananda Medhi,31-May-2025 02:09 PM,NoAPDNAscan.pdf (1805.00 KB),The above contract value is inclusive of GST. The contract Signing Date is 04th December 2024,1.0,225250.0,Grant Thornton India LLP,INR,"61,904,058",1,225060,ADARSH CONSULTANCY,12-Feb-2024 06:41 PM,Rejected-Technical,Technically non-responsive,07-Jun-2024 12:12 PM,Finance,Financial Opening done. Minutes of financial opening attached,Alakananda Medhi,17-Aug-2024 03:26 PM,finance_56263.pdf,BOQ Comparative Chart,CEO ASDMA,Internal,PO AIRBMP Procurement Officer Finance Officer Focal Person ASDMA Focal Person PIU,Alakananda Medhi,31-May-2025 01:48 PM,finsummary_56263.pdf (1961.54 KB),Assam State Disaster Management Authority- Externally Aided Project||Assam State Disaster Management Authority- World Bank Funded Tenders||Assam Integrated River Basin Management Programme,2023_DMEAP_34754_1,IN-ASDMA-374663-CS-QCBS,Strengthening Assam State Disaster Management Authoritys capacity for Post Disaster Needs Assessment PDNA under Assam Integrated River Basin Management Project,Technical,Technical Proposal Opening Done. MOM enclosed,Alakananda Medhi,22-Feb-2024 03:35 PM,technical_56263.pdf,Chief Executive Officer,Internal,Project Officer AIRBMP Finance Officer Expert 1 Expert 2 Procurement Officer Technical Summary Attached,Alakananda Medhi,07-Jun-2024 12:12 PM,21-Jun-2024 03:00 PM,techsummary_56263.pdf (751.57 KB),AOC
,,,,,,,,,,,,,,2.0,Finance,.xls,Financial Proposal in Excel Format,,,,,,,,,,,,,,,,2.0,Corrigendum 2,Date,,,,,,,,,,,,,,,,,,,,,,,,,,AOC,,,,,,,,,,,,,2,224493,C. E. INFO SYSTEMS LIMITED,09-Feb-2024 12:58 PM,Rejected-AOC,Not Selected,31-May-2025 02:09 PM,,,,,,,,,,,,,,,,,,,,,,,,,,,,,AOC
,,,,,,,,,,,,,,,,.pdf,Financial Proposal in PDF format,,,,,,,,,,,,,,,,,,,,,,,,,,,,,,,,,,,,,,,,,,,,AOC,,,,,,,,,,,,,3,224491,Ernst & Young LLP,13-Feb-2024 02:45 PM,Rejected-AOC,Not Selected,31-May-2025 02:09 PM,,,,,,,,,,,,,,,,,,,,,,,,,,,,,AOC
,,,,,,,,,,,,,,,,,,,,,,,,,,,,,,,,,,,,,,,,,,,,,,,,,,,,,,,,,,,,,AOC,,,,,,,,,,,,,4,225250,Grant Thornton India LLP,13-Feb-2024 02:46 PM,Accepted-AOC,Selected Consultant,31-May-2025 02:09 PM,,,,,,,,,,,,,,,,,,,,,,,,,,,,,AOC
,,,,,,,,,,,,,,,,,,,,,,,,,,,,,,,,,,,,,,,,,,,,,,,,,,,,,,,,,,,,,AOC,,,,,,,,,,,,,5,225239,SEEDS Technical Services Pvt. Ltd.,13-Feb-2024 01:46 PM,Rejected-Technical,Technically non-responsive,07-Jun-2024 12:12 PM,,,,,,,,,,,,,,,,,,,,,,,,,,,,,AOC
