Organisation Chain,Tender Reference Number,Tender ID,Withdrawal Allowed,Tender Type,Form of contract,Tender Category,No. of Covers,General Technical Evaluation Allowed,ItemWise Technical Evaluation Allowed,Payment Mode,Is Multi Currency Allowed For BOQ,Is Multi Currency Allowed For Fee,Allow Two Stage Bidding,Cover No,Cover,Document Type,Description,Publish Date,Bid Opening Date,Document Download / Sale Start Date,Document Download / Sale End Date,Clarification Start Date,Clarification End Date,Bid Submission Start Date,Bid Submission End Date,Financial Bid Opening Date,EMD Amount in ₹,EMD Exemption Allowed,EMD Fee Type,EMD Percentage,EMD Payable To,EMD Payable At,S.No,Bank Name,Tender Fee in ₹,Fee Payable To,Fee Payable At,Tender Fee Exemption Allowed,Name,Address,Title,Work Description,Pre Qualification Details,Independent External Monitor/Remarks,Tender Value in ₹,Product Category,Sub category,Contract Type,Bid Validity(Days),Period Of Work(Days),Location,Pincode,Pre Bid Meeting Place,Pre Bid Meeting Address,Pre Bid Meeting Date,Bid Opening Place,Should Allow NDA Tender,Allow Preferential Bidder,Tender Stage,Contract Date :,Contract Value :,Work Completion Period in days :,Updated By :,Updated on :,AOC document :,AOC Description :,S.No,Bid Number,Bidder Name,Awarded Currency,Awarded Value,S.No.1,Bid Number.1,Bidder Name.1,Submitted Date,Status,Remarks,Status Updated On,Type :,Summary :,Updated By :.1,Updated On :,Document :,BOQ Comparative Chart :,Committee Chairperson/Co-ordinator Name :,Committee Chairperson/Co-ordinator Type :,Committee Members :,Updated By :.2,Updated on :.1,Document :.1,Organisation Chain :,Tender ID :,Tender Ref No :,Tender Title :,Type :.1,Summary :.1,Updated By :.3,Updated On :.1,Document :.2,Committee Chairperson/Co-ordinator Name :.1,Committee Chairperson/Co-ordinator Type :.1,Committee Members :.1,Updated By :.4,Updated On :.2,Financial Bid Opening Date:,Document :.3,Tender Stage
"Pr. Chief Conservator of Forest and Head of Forest Force||Chief Conservator of Forests (Upper Assam Zone)||Eastern Assam Circle, Jorhat||Digboi Division",DIG/NIT/108 DATED 23/07/2024,2024_PCCF_38218_1,Yes,Open Tender,Works,Works,2.0,No,No,Online,No,No,No,1.0,Fee/PreQual/Technical,.pdf,Scan copy of Eligibility Criteria Documents,26-Jul-2024 06:00 PM,17-Aug-2024 11:00 AM,27-Jul-2024 11:00 AM,16-Aug-2024 03:00 PM,NA ,NA ,30-Jul-2024 11:00 AM,16-Aug-2024 03:00 PM,28-Aug-2024 12:15 PM,"10,000",Yes,percentage,2.0%,Nil,Nil,1.0,SBI Bank,100.0,Nil,Nil,Yes,"DIVISIONAL FOREST OFFICER, DIGBOI DIVISION, DIGBOI","Office of the DFO, Digboi Division, Digboi",Accurate fixing of GPS co-ordination of the ground using DGPS,Accurate fixing of GPS co-ordination of the ground using DGPS,please refer to the tender documents ,NA ,"5,00,000",Network /Communication Equipments,NA ,Tender,120.0,120.0,Under Digboi Division,786171.0,"Office of the DFO, Digboi Division, Digboi ","Office of the DFO, Digboi Division, Digboi ",29-Jul-2024 11:30 AM ,"Office of the DFO, Digboi Division, Digboi",No ,No,AOC,15-May-2025,"INR 450,000",120.0,Tc Ranjith Ram,15-May-2025 11:34 AM,GPSworkOrder.pdf (292.00 KB),Offline work order has been given on 13/09/2024,1.0,236927.0,VRISAG SERVICES PVT LTD,INR,"450,000",1.0,236918.0,FAR INFRASTRUCTURES PVT. LTD,16-Aug-2024 02:14 PM,Rejected-Finance,Quoted below 33 percentile,15-May-2025 11:30 AM,Finance,Financial bid has been opened,Tc Ranjith Ram,18-Oct-2024 04:33 PM,,BOQ Comparative Chart,HOD,Internal,,Tc Ranjith Ram,15-May-2025 11:30 AM,finsummary_61979.pdf (291.71 KB),"Pr. Chief Conservator of Forest and Head of Forest Force||Chief Conservator of Forests (Upper Assam Zone)||Eastern Assam Circle, Jorhat||Digboi Division",2024_PCCF_38218_1,DIG/NIT/108 DATED 23/07/2024,Accurate fixing of GPS co-ordination of the ground using DGPS,Technical,Technical bid has been opened,Tc Ranjith Ram,27-Aug-2024 01:02 PM,,HOD,Internal,,Tc Ranjith Ram,28-Aug-2024 12:04 PM,28-Aug-2024 12:15 PM,techsummary_61979.pdf (3337.93 KB),AOC
,,,,,,,,,,,,,,,,.pdf,Additional Technical Qualification Documents,,,,,,,,,,,,,,,,,,,,,,,,,,,,,,,,,,,,,,,,,,AOC,,,,,,,,,,,,,2.0,236932.0,RCHOBBYTECH SOLUTIONS PRIVATE LIMITED,16-Aug-2024 02:52 PM,Rejected-Finance,Quoted below 23 percentile,15-May-2025 11:30 AM,,,,,,,,,,,,,,,,,,,,,,,,,,,,,AOC
,,,,,,,,,,,,,,,,.pdf,Tender Documents,,,,,,,,,,,,,,,,,,,,,,,,,,,,,,,,,,,,,,,,,,AOC,,,,,,,,,,,,,3.0,236927.0,VRISAG SERVICES PVT LTD,16-Aug-2024 01:50 PM,Accepted-AOC,Approved from the competent authority in accordance with section 20 of Assam procurement Rules 2020,15-May-2025 11:34 AM,,,,,,,,,,,,,,,,,,,,,,,,,,,,,AOC
,,,,,,,,,,,,,,,,.pdf,Others,,,,,,,,,,,,,,,,,,,,,,,,,,,,,,,,,,,,,,,,,,AOC,,,,,,,,,,,,,,,,,,,,,,,,,,,,,,,,,,,,,,,,,,,,,,,,AOC
,,,,,,,,,,,,,,2.0,Finance,.xls,Price Bid (BOQ),,,,,,,,,,,,,,,,,,,,,,,,,,,,,,,,,,,,,,,,,,AOC,,,,,,,,,,,,,,,,,,,,,,,,,,,,,,,,,,,,,,,,,,,,,,,,AOC
