2024_PWD_35209_1,GCTRD/NIT24/2023-24/2818,GCTRD/SOPD(G)/23-24/OL/02,"Providing of Road Marking, Road Furniture and Installation of Road Signages as Road Safety measures at the identified Black Spot on Dinesh Goswami Road (from Bharalumukh to Kamakhya Gate via Santipur, Bhootnath and Kalipur) under SOPD(G) for 2023-24",Works,Open Tender,Item Rate,Civil Works – Roads,No,No,NA ,06-Jan-2024 09:00 AM,09-Jan-2024 09:00 AM ,180.0,No ,No,Online,29-Jan-2024 02:30 PM,Public Works Roads Department,Guwahati,781001.0,2.0,"36,20,000",Gajraj Enterprises,"3,619,056",Accepted-AOC,16-Feb-2024,AOC,Public Works Roads Department
2023_BoTC_30850_1,DE/BTC/RFID/BrmC/375/2022/30,Installation of Technology Enable Smart Class Room at Salbari College in Baksa District.,Installation of Technology Enable Smart Class Room at Salbari College in Baksa District.,Works,Open Tender,Works,Miscellaneous Works,No,No,NA ,17-May-2023 01:00 PM,NA ,90.0,No ,No,Online,01-Jun-2023 03:00 PM,Bodoland Territorial Council||Education-BTC,Salbari,734002.0,2.0,"42,37,284",DIGANTA BORO,"4,997,455",Rejected-AOC,23-Feb-2024,AOC,Bodoland Territorial Council||Education-BTC
2024_GMC_35325_5,GER/CE/2378/2023/35 DATED 08/01/2024,Package No. DSLT- 27,Cleaning and Desilting of 148 nos of Major city drains under Mitigation of Urban Flood in Guwahati City to be executed by Guwahati Municipal Corporation in following packages for the year 2024,Works,Open Tender,Lump-sum,Civil Works,No,No,NA ,08-Jan-2024 06:00 PM,NA ,180.0,No ,No,Online,29-Jan-2024 03:00 PM,Guwahati Municipal Corporation,GUWAHATI,781005.0,2.0,"30,92,992",MR DIPAK SARMA,"2,443,463.68",Accepted-AOC,17-Feb-2024,AOC,Guwahati Municipal Corporation
2023_PWBNH_32060_13,TECH-II/256/2022/46 Dated Guwahati 9th August 2023,"TGR-32 Construction of Model Secondary Schools in the Tea Garden Areas, Assam at Doloabari TGMS, Dist Kokrajhar","TGR-32 Construction of Model Secondary Schools in the Tea Garden Areas, Assam at Doloabari TGMS, Dist Kokrajhar",Works,Open Tender,Item Rate,Civil Works - Building,No,No,NA ,14-Aug-2023 09:00 AM,22-Aug-2023 11:00 AM ,180.0,No ,No,Online,02-Sep-2023 03:30 PM,Public Works Building and NH Department||Chief Engineer-Building - PWBNH,Kokrajhar,783370.0,2.0,"2,88,24,127",Biren Deka,,Accepted-AOC,,AOC,Public Works Building and NH Department||Chief Engineer-Building - PWBNH
2023_BoTC_35000_1,CHDI/ ET-24/2022-23/27,Ramchajhar FIS at over Bornadi Tributary at Ramchajhar under PMKSY_HKKP for the year 2021-22,Ramchajhar FIS at over Bornadi Tributary at Ramchajhar under PMKSY_HKKP for the year 2021-22,Works,Open Tender,Works,Civil Works,No,No,NA ,28-Dec-2023 11:00 AM,NA ,180.0,No ,No,Online,09-Jan-2024 11:00 AM,Bodoland Territorial Council||Irrigation-BTC,SIDLI,783373.0,2.0,"3,63,90,994",Badrul Islam,"36,390,993",Accepted-AOC,08-Feb-2024,AOC,Bodoland Territorial Council||Irrigation-BTC
2023_BoTC_34843_1,No. TECH- 05/SE(B)/E-Tender,Construction of Jagannath Community Hall and Skill Centre under Udalguri LAC. (AT PANERI TE) 530-2,Construction of Jagannath Community Hall and Skill Centre under Udalguri LAC. (AT PANERI TE) 530-2,Works,Open Tender,Item Rate,Civil Works - Building,No,No,NA ,20-Dec-2023 10:00 AM,NA ,180.0,No ,No,Online,11-Jan-2024 01:30 PM,Bodoland Territorial Council||PWD-BTC,udalguri,784509.0,2.0,"1,40,73,143",DHILAN BASUMATARY,"14,064,952",Rejected-AOC,23-Feb-2024,AOC,Bodoland Territorial Council||PWD-BTC
2023_BTC_33767_1,150/PWD/NIT/Goodwill/23-24/5,Construction of road from Kahibari Bhairabkunda road (near Ganda Bagan) to Khorka Basti via Goraibari under CMs Goodwill Mission Project for the financial year 2023- 24. (TN_26_152),Construction of road from Kahibari Bhairabkunda road (near Ganda Bagan) to Khorka Basti via Goraibari under CMs Goodwill Mission Project for the financial year 2023- 24.,Works,Open Tender,Works,Civil Works,No,No,NA ,09-Nov-2023 10:00 AM,NA ,180.0,No ,No,Online,29-Nov-2023 12:00 PM,Bodoland Territorial Council-PWD||Director Cum CHD - PWD BTC,Udalguri,784509.0,2.0,"2,55,89,877",MINON MOCHAHARI,"25,538,738",Rejected-AOC,01-Feb-2024,AOC,Bodoland Territorial Council-PWD||Director Cum CHD - PWD BTC
2024_DCA_35453_1,eCF.434147/05,"Arrangement of accommodation for Cultural Affairs Department for State Level Competitions of Assam Sanskritik Mahasangram, 2023-24.","Arrangement of accommodation for Cultural Affairs Department for State Level Competitions of Assam Sanskritik Mahasangram, 2023-24.",Services,Open Tender,Item Rate,Hotel/ Catering,No,No,NA ,13-Jan-2024 09:00 AM,NA ,365.0,No ,No,Online,24-Jan-2024 10:30 AM,Department of Cultural Affairs||Directorate of Cultural Affairs,Guwahati,781001.0,2.0,,Dalta Trade and Communications,,Rejected-AOC,,AOC,Department of Cultural Affairs||Directorate of Cultural Affairs
2023_PWBNH_31776_3,TECH/U_BDTD/BLDG/IFB/2023 24/02 Dated 21.07.2023,Infrastructure Development of Sonaigaon High School,"Infrastructure Development of Sonaigaon High School under Udalguri LAC, District-Udalguri.",Works,Open Tender,Item Rate,Civil Works - Building,No,No,NA ,25-Jul-2023 09:00 AM,NA ,180.0,No ,No,Online,02-Aug-2023 02:00 PM,Public Works Building and NH Department||Chief Engineer-Building - PWBNH,Udalguri,784509.0,2.0,"24,25,997",NELSON BASUMATARY,"2,493,921",Rejected-AOC,22-Feb-2024,AOC,Public Works Building and NH Department||Chief Engineer-Building - PWBNH
2023_HFWD_31152_1,AMSCL/Opthalmology and ENT Dept.Equipments/310513,SUPPLY OF OPTHALMOLOGY AND ENT DEPT. EQUIPMENTS,SUPPLY OF OPTHALMOLOGY AND ENT DEPT. EQUIPMENTS,Goods,Open Tender,Buy,Medical Equipments/Waste,No,No,NA ,10-Jun-2023 01:00 PM,23-Jun-2023 01:00 PM ,180.0,No ,No,Online,15-Jul-2023 04:30 PM,Health and Family Welfare Department||Assam Medical Services Corporation Limited,Guwahati,781026.0,2.0,"66,17,450",Auditivo Hearing Services Pvt Ltd.,1.0,Accepted-AOC,02-Feb-2024,AOC,Health and Family Welfare Department||Assam Medical Services Corporation Limited
2022_PWBNH_26179_1,T/TB-1/24/2022/21 dtd. 30-6-2022,"Construction of Old Age Home and Child Care Institutions at Bamunigaon (Camp) Boko, Dist. Kamrup, Assam under NIDA Engineering, Procurement and Construction (EPC) Mode-1 basis","Construction of Old Age Home and Child Care Institutions at Bamunigaon (Camp) Boko, Dist. Kamrup, Assam under NIDA Engineering, Procurement and Construction (EPC) Mode-1 basis",Works,Open Tender,Item Rate,Civil Works - Building,No,No,NA ,01-Jul-2022 06:00 PM,05-Jul-2022 11:30 AM ,180.0,No ,No,Online,21-Jul-2022 02:30 PM,Public Works Building and NH Department||Chief Engineer-Building - PWBNH,Boko,781123.0,2.0,"78,09,54,988",M/S KENGE CONSTRUCTION CO.,"825,859,900",Rejected-AOC,20-Feb-2024,AOC,Public Works Building and NH Department||Chief Engineer-Building - PWBNH
2023_BTC_33647_1,ACE-150/PWD/NIT/Goodwill/23-24,Construction of Road from Dash Mile Highway Chowk to Kalbari Dakhin Hati Kalbagan under CMs Goodwill Mission Project for the year 2023-24. TN_26_57,Construction of Road from Dash Mile Highway Chowk to Kalbari Dakhin Hati Kalbagan under CMs Goodwill Mission Project for the year 2023-24. TN_26_57,Works,Open Tender,Works,Civil Works – Roads,No,No,NA ,08-Nov-2023 10:00 AM,30-Nov-2023 01:00 PM ,180.0,No ,No,Online,01-Dec-2023 02:00 PM,Bodoland Territorial Council-PWD||Director Cum CHD - PWD BTC,Baksa,783217.0,2.0,"2,51,89,984",BISTI MUSHAHARY,"25,189,802.2",Not Admitted-Fee/PreQual/Technical,19-Feb-2024,AOC,Bodoland Territorial Council-PWD||Director Cum CHD - PWD BTC
2023_BoTC_29165_4,CHDI/ ET/2022-23/9,North Maligaon FIS (Canal System) under PMKSY_HKKP for the year 2021-22,North Maligaon FIS (Canal System) under PMKSY_HKKP for the year 2021-22,Works,Open Tender,Works,Civil Works,No,No,NA ,07-Feb-2023 10:10 AM,NA ,180.0,No ,No,Online,01-Mar-2023 02:00 PM,Bodoland Territorial Council||Irrigation-BTC,Kokrajhar East,783370.0,2.0,"1,58,03,752",BERPUNG RAJA BASUMATARY,"7,111,688.4",Accepted-AOC,14-Feb-2024,AOC,Bodoland Territorial Council||Irrigation-BTC
2023_PWD_34310_1,SE/MRC/TB/NIT/01/2023-24/08,Construction of road from Pukhuripar Village to Ganeshguri Pather Road,Construction of road from Pukhuripar Village to Ganeshguri Pather Road,Works,Open Tender,Item Rate,Civil Works – Roads,No,No,NA ,01-Dec-2023 10:00 AM,NA ,180.0,No ,No,Online,08-Dec-2023 11:00 AM,Public Works Roads Department||CE PWD(R) - PWD,Morigaon,782105.0,2.0,"80,32,000",ANJAN KUMAR NATH,"8,031,391",Accepted-AOC,09-Feb-2024,AOC,Public Works Roads Department||CE PWD(R) - PWD
2023_BoTC_34221_1,DPRD/BTC/(SOPD)Udl-02/2023/07,Const of road with EF and SG along with 2 Nos RCC Box culvert from Tikritola village to Sikaridanga Hadanguri village under SOPD for the year 2023-24,DPRD/BTC/(SOPD)Udl-02/2023/07,Works,Open Tender,Item Rate,Civil Works,No,No,NA ,27-Nov-2023 10:30 AM,NA ,180.0,No ,No,Online,19-Dec-2023 02:30 PM,Bodoland Territorial Council||Panchayat and Rural Development-BTC,Mazbat,784507.0,2.0,"41,92,893",HEMEN HAINARI,"4,192,892.5",Accepted-AOC,13-Jan-2024,AOC,Bodoland Territorial Council||Panchayat and Rural Development-BTC
2024_GMC_35280_21,GER/CE/2378/2023/26 DATED 05/01/2024,Package No. DSLT-21,Cleaning and Desilting of 143 nos of Major city drains under Mitigation of Urban Flood in Guwahati City to be executed by Guwahati Municipal Corporation in following packages for the year 2024,Works,Open Tender,Lump-sum,Civil Works,No,No,NA ,08-Jan-2024 09:00 AM,NA ,180.0,No ,No,Online,29-Jan-2024 03:00 PM,Guwahati Municipal Corporation,GUWAHATI,781005.0,2.0,"39,30,185",N H ASSOCIATES,"2,908,336.9",Rejected-Technical,20-Feb-2024,AOC,Guwahati Municipal Corporation
2023_PWD_34478_1,EE/PRKN/ETN/2023-24/1283,Periodic Renewal of road from Bunglowtilla to Bidyanagar road under Mukhya Mantrir Path Nabikaran Achani for the year 2023-24 under Ramkrishna Nagar LAC,"Periodic Renewal of road from Bunglowtilla to Bidyanagar road under Mukhya Mantrir Path Nabikaran Achani for the year 2023-24 under Ramkrishna Nagar LAC,P/No.EE/PRKN/MMPNA/23-24/RKN/1",Works,Open Tender,Item Rate,Civil Works – Roads,No,No,NA ,08-Dec-2023 09:00 AM,NA ,180.0,No ,No,Online,18-Dec-2023 03:10 PM,Public Works Roads Department,KARIMGANJ DISTRICT,788734.0,2.0,"32,87,823",Abdul Hasib,"3,287,823",Rejected-AOC,04-Feb-2024,AOC,Public Works Roads Department
2024_GMC_35280_20,GER/CE/2378/2023/26 DATED 05/01/2024,Package No. DSLT-20,Cleaning and Desilting of 143 nos of Major city drains under Mitigation of Urban Flood in Guwahati City to be executed by Guwahati Municipal Corporation in following packages for the year 2024,Works,Open Tender,Lump-sum,Civil Works,No,No,NA ,08-Jan-2024 09:00 AM,NA ,180.0,No ,No,Online,29-Jan-2024 03:00 PM,Guwahati Municipal Corporation,GUWAHATI,781005.0,2.0,"47,32,974",MAINUL HAQUE CHOUDHURY,,Rejected-Technical,,AOC,Guwahati Municipal Corporation
2023_BoTC_32717_3,CHDI/ ET-24/2022-23/21,Construction of Lakhinadi FIS at Bogulamari (H/W ) under PMKSY (HKKP) for the year 2021 - 2022,Construction of Lakhinadi FIS at Bogulamari (H/W ) under PMKSY (HKKP) for the year 2021 - 2022,Works,Open Tender,Works,Civil Works - Bridges,No,No,NA ,30-Sep-2023 10:20 AM,NA ,180.0,No ,No,Online,27-Oct-2023 11:00 AM,Bodoland Territorial Council||Irrigation-BTC,BARAMA CHAPAGURI DIVISION,781316.0,2.0,"3,36,56,586",LIZA KALITA,"30,290,927.4",Accepted-AOC,28-Feb-2024,AOC,Bodoland Territorial Council||Irrigation-BTC
2023_PWD_33480_1,LMRC/TENDER/2023-24/990,"Construction and Improvement of Roads under SOPD-G for the year 2023-24 in Lakhimpur District ,Bihpuria LAC","Construction and Improvement of Roads under SOPD-G for the year 2023-24 in Lakhimpur District ,Bihpuria LAC",Works,Open Tender,Item Rate,Civil Works,No,No,NA ,03-Nov-2023 01:00 PM,03-Nov-2023 04:00 PM ,180.0,No ,No,Online,15-Nov-2023 12:00 PM,Public Works Roads Department,Bihpura,784161.0,2.0,"8,01,73,582",Bharat Borah,"80,173,582.35",Accepted-AOC,08-Feb-2024,AOC,Public Works Roads Department
2023_WPTBC_35041_1,14.0,"Infrastructure Development of Muduki Anchalik Janajatiya High School of Palashbari LAC, Dist Kamrup","Infrastructure Development of Muduki Anchalik Janajatiya High School of Palashbari LAC, Dist Kamrup",Works,Limited,Item Rate,Civil Works,No,No,NA ,29-Dec-2023 03:05 PM,NA ,180.0,No ,No,Online,03-Jan-2024 04:00 PM,Welfare of Plain Tribes and Backward Classes||Directorate of Welfare of Scheduled Caste||Assam State Development Corporation for SC,KAMRUP,781006.0,2.0,"25,00,000",BISWAJIT DAS,"2,499,200",Rejected-AOC,12-Feb-2024,AOC,Welfare of Plain Tribes and Backward Classes||Directorate of Welfare of Scheduled Caste||Assam State Development Corporation for SC
2023_PWBNH_33115_3,TECH.I/256/2022/59 Dated 13/10/2023,"(TGR- 11) Construction of Model Secondary Schools in the Tea Garden Areas, Assam at Kopili TE, District Dima Hasao","(TGR- 11) Construction of Model Secondary Schools in the Tea Garden Areas, Assam at Kopili TE, District Dima Hasao",Works,Open Tender,Item Rate,Civil Works - Building,No,No,NA ,17-Oct-2023 06:00 PM,NA ,180.0,No ,No,Online,01-Nov-2023 03:30 PM,Public Works Building and NH Department||Chief Engineer-Building - PWBNH,Dima Hasao,788830.0,2.0,"2,88,24,000",SHRI RAJESH SHUKLA,"25,220,900",Rejected-AOC,26-Feb-2024,AOC,Public Works Building and NH Department||Chief Engineer-Building - PWBNH
2023_PWD_33321_26,CE/STBR/MMPNA/08/2022-23/1 Dated 28/09/2023,Package No.Karimganj/MMPNA/BUG/01 Repair/ Renovation of BUG Bridge No. 1/1 on Kaliganj Khagail Road at Ch. 727.00 m for the year 2023-24 under MMPNA,Package No.Karimganj/MMPNA/BUG/01 Repair/ Renovation of BUG Bridge No. 1/1 on Kaliganj Khagail Road at Ch. 727.00 m for the year 2023-24 under MMPNA,Works,Open Tender,Item Rate,Civil Works – Roads,No,No,NA ,28-Oct-2023 04:00 PM,NA ,180.0,No ,No,Online,10-Nov-2023 11:00 AM,Public Works Roads Department,Karimganj,788710.0,2.0,"12,77,000",Mastaque Ahmed,,Rejected-AOC,,AOC,Public Works Roads Department
2023_PWBNH_31776_2,TECH/U_BDTD/BLDG/IFB/2023 24/02 Dated 21.07.2023,Construction of Additional Classroom (Vertical Extension 2nd floor) at Udalguri College in Udalguri District,Construction of Additional Classroom (Vertical Extension 2nd floor) at Udalguri College in Udalguri District,Works,Open Tender,Item Rate,Civil Works - Building,No,No,NA ,25-Jul-2023 09:00 AM,NA ,180.0,No ,No,Online,02-Aug-2023 02:00 PM,Public Works Building and NH Department||Chief Engineer-Building - PWBNH,Udalguri,784509.0,2.0,"49,96,967",NELSON BASUMATARY,"4,993,636",Rejected-AOC,13-Feb-2024,AOC,Public Works Building and NH Department||Chief Engineer-Building - PWBNH
2023_PWBNH_30339_1,SE/BII_Pendal_AIIMS_Group-4,"Arrangement of Temporary Pandal, Dias, Barricading, Branding, Temporary V.V.I.P and V.I.P Toilets etc. in connection with Inauguration Ceremony of All India Institute of Medical Science, Guwahati (Group-4)","Arrangement of Temporary Pandal, Dias, Barricading, Branding, Temporary V.V.I.P and V.I.P Toilets etc. in connection with Inauguration Ceremony of All India Institute of Medical Science, Guwahati (Group-4)",Works,Open Tender,Item Wise,Civil Works - Building,No,No,NA ,04-Apr-2023 02:00 PM,05-Apr-2023 12:00 PM ,180.0,No ,No,Online,10-Apr-2023 04:30 PM,Public Works Building and NH Department||Chief Engineer-Building - PWBNH||SE-Guwahati Circle-2 - PWBNH,"Sansari, Guwahati",781032.0,2.0,"93,13,891",ACME EVENTS & EXPO,"11,916,795",Accepted-AOC,08-Feb-2024,AOC,Public Works Building and NH Department||Chief Engineer-Building - PWBNH||SE-Guwahati Circle-2 - PWBNH
2023_BTC_33626_1,150/PWD/NIT/Goodwill/23-24/03,Construction of road from BK PWD Road Patakata to New Gambaribil via Sinchilibari From Ch. 0.00m to Ch. 3000.00m by providing SDBC under CMs Goodwill Project for the year 2023-24. TN_26_15,Construction of road from BK PWD Road Patakata to New Gambaribil via Sinchilibari From Ch. 0.00m to Ch. 3000.00m by providing SDBC under CMs Goodwill Project for the year 2023-24. TN_26_15,Works,Open Tender,Item Rate,Civil Works – Roads,No,No,NA ,09-Nov-2023 10:30 AM,NA ,180.0,No ,No,Online,30-Nov-2023 12:00 PM,Bodoland Territorial Council-PWD||Director Cum CHD - PWD BTC,Kokrajhar,783370.0,2.0,"2,26,40,578",Arjun Saha,"22,640,484.36",Not Admitted-Fee/PreQual/Technical,13-Feb-2024,AOC,Bodoland Territorial Council-PWD||Director Cum CHD - PWD BTC
2024_IPRPS_35120_1,E-455901,"Printing and supply of Greetings Card alongwith Envelope, 2024","Printing and supply of Greetings Card alongwith Envelope, 2024",Goods,Open Tender,Item Wise,Supply of Materials,No,No,NA ,01-Jan-2024 03:00 PM,NA ,180.0,No ,No,Online,08-Jan-2024 02:00 PM,Information - Public Relations - Printing and Stationery Department||Directorate of Printing and Stationery-Assam,Directorate of Printing and Stationery,781021.0,2.0,"60,00,000",AM PUBLICATION,,Accepted-AOC,,AOC,Information - Public Relations - Printing and Stationery Department||Directorate of Printing and Stationery-Assam
2023_ID_34879_1,45 _RIDF_XXIX_NABARD_2023_24 Date_19_12_2023,3 Points Solar Powered MDTW Scheme at Jalukbari LAC under RIDF_XXIX_NABARD for the year 2023-24 under Hajo Jalukbari Division I Amingaon,3 Points Solar Powered MDTW Scheme at Jalukbari LAC under RIDF_XXIX_NABARD for the year 2023-24 under Hajo Jalukbari Division I Amingaon,Works,Open Tender,Item Rate,Civil Works,No,No,NA ,21-Dec-2023 02:00 PM,NA ,180.0,No ,No,Online,11-Jan-2024 03:00 PM,Irrigation Department||Chief Engineer(Major)-Irrigation Dept,Amingaon,781031.0,2.0,"1,10,74,966",M/S S.N. ENTERPRISE AND JV,"9,967,469",Accepted-AOC,01-Feb-2024,AOC,Irrigation Department||Chief Engineer(Major)-Irrigation Dept
2024_GMC_35280_4,GER/CE/2378/2023/26 DATED 05/01/2024,Package No. DSLT-04,Cleaning and Desilting of 143 nos of Major city drains under Mitigation of Urban Flood in Guwahati City to be executed by Guwahati Municipal Corporation in following packages for the year 2024,Works,Open Tender,Lump-sum,Civil Works,No,No,NA ,06-Jan-2024 05:00 PM,NA ,180.0,No ,No,Online,29-Jan-2024 03:00 PM,Guwahati Municipal Corporation,GUWAHATI,781005.0,2.0,"32,68,126",IMDADUL HAQUE,,Rejected-AOC,,AOC,Guwahati Municipal Corporation
2023_GMC_34916_10,GER/ CE/2016/2022/37 Dated 20/12/2023,Construction of BBC Colony Children Park Community Hall,under 2nd installment of Untied basic Grant under the award of 15th Finance Commission for the Year 2020-21 during the FY 2021-22.,Works,Open Tender,Lump-sum,Civil Works,No,No,NA ,22-Dec-2023 09:00 AM,NA ,180.0,No ,No,Online,10-Jan-2024 02:30 PM,Guwahati Municipal Corporation,GUWAHATI,781005.0,2.0,"22,00,000",ABU BAKKAR SIDDIK,"2,200,000",Rejected-Technical,09-Feb-2024,AOC,Guwahati Municipal Corporation
2023_PWD_34309_1,SE/MRC/TB/NIT/01/2023-24/08,Construction of road from Amarawati Junaki Market to Putakolong,Construction of road from Amarawati Junaki Market to Putakolong,Works,Open Tender,Item Rate,Civil Works – Roads,No,No,NA ,01-Dec-2023 10:00 AM,NA ,180.0,No ,No,Online,08-Dec-2023 11:00 AM,Public Works Roads Department||CE PWD(R) - PWD,Morigaon,782105.0,2.0,"77,73,000",ANIL KUMAR JAIN,"7,771,833",Accepted-AOC,09-Feb-2024,AOC,Public Works Roads Department||CE PWD(R) - PWD
2023_PWD_34955_65,CE/Maint/MMPNA/01/2023-24/13,MMPNA/2023-24/83,Periodic Renewal Convoy road to Banipur Rly Station via FCI Godown from Ch 0.00km to ch 1.00km (length 1.00km) and Sagunibari Road (Ch0.00m to Ch 300.00m) under MUKHYA MANTRI PATH NABIKARAN AACHANI for the year 2023-24 under Dibrugarh LAC,Works,Open Tender,Item Rate,Civil Works – Roads,No,No,NA ,26-Dec-2023 06:55 PM,28-Dec-2023 12:00 PM ,180.0,No ,No,Online,10-Jan-2024 11:00 AM,Public Works Roads Department,Dibrugarh,786001.0,2.0,"41,44,000",Anuj Saikia,"4,102,560",Accepted-AOC,21-Feb-2024,AOC,Public Works Roads Department
2023_PWBNH_34168_2,EE(N)/ITI-II/21/2023-24/Pt/02,Repair and Renovation works for existing Boys Hostel of ITI Nalbari (Part-II),Repair and Renovation works for existing Boys Hostel of ITI Nalbari (Part-II),Works,Open Tender,Item Wise,Civil Works - Building,No,No,NA ,23-Nov-2023 03:00 PM,07-Dec-2023 10:00 AM ,180.0,No ,No,Online,08-Dec-2023 03:00 PM,Public Works Building and NH Department||Chief Engineer-Building - PWBNH||SE-Nalbari Building Circle PWBNH||Nalbari District Teritorial Building Division,Nalbari,781335.0,2.0,"23,00,081",Brajen Das,"2,300,030",Rejected-Finance,12-Feb-2024,AOC,Public Works Building and NH Department||Chief Engineer-Building - PWBNH||SE-Nalbari Building Circle PWBNH||Nalbari District Teritorial Building Division
2023_PWBNH_32889_1,SE(B)/JHT/C/S/S-9/23-24/1464,Construction of Open air Auditorium at Bokakhat Dist Golaghat Phase II,Construction of Open air Auditorium at Bokakhat Dist Golaghat Phase II,Works,Open Tender,Item Rate,Civil Works - Building,No,No,NA ,09-Oct-2023 03:00 PM,17-Oct-2023 11:00 AM ,180.0,No ,No,Online,25-Oct-2023 03:00 PM,Public Works Building and NH Department||Chief Engineer-Building - PWBNH||SE-Jorhat Circle - PWBNH||EE-Jorhat Building Division - PWBNH,"Bokakhat,Golaghat",785612.0,2.0,"92,83,800",DHANUKA CONSTRUCTION,"9,280,679",Rejected-Technical,06-Feb-2024,AOC,Public Works Building and NH Department||Chief Engineer-Building - PWBNH||SE-Jorhat Circle - PWBNH||EE-Jorhat Building Division - PWBNH
2024_GMC_35325_4,GER/CE/2378/2023/35 DATED 08/01/2024,Package No. DSLT- 26,Cleaning and Desilting of 148 nos of Major city drains under Mitigation of Urban Flood in Guwahati City to be executed by Guwahati Municipal Corporation in following packages for the year 2024,Works,Open Tender,Lump-sum,Civil Works,No,No,NA ,08-Jan-2024 06:00 PM,NA ,180.0,No ,No,Online,29-Jan-2024 03:00 PM,Guwahati Municipal Corporation,GUWAHATI,781005.0,2.0,"24,48,705",M/S TRIKUTA ENTERPRISE,"1,843,140.25",Rejected-AOC,19-Feb-2024,AOC,Guwahati Municipal Corporation
2023_BTC_33743_1,ACE-150/PWD/NIT/Goodwill/23-24,Construction of road from RD road Jiten Rabha house to Sapkata ulubari road near Shotish Rabha house at Dalongpar village at Tamulpur under CMs Goodwill Project Mission for the year 2023-24. TN_26_80,Construction of road from RD road Jiten Rabha house to Sapkata ulubari road near Shotish Rabha house at Dalongpar village at Tamulpur under CMs Goodwill Project Mission for the year 2023-24. TN_26_80,Works,Open Tender,Works,Civil Works – Roads,No,No,NA ,09-Nov-2023 10:00 AM,30-Nov-2023 01:00 PM ,180.0,No ,No,Online,01-Dec-2023 02:00 PM,Bodoland Territorial Council-PWD||Director Cum CHD - PWD BTC,Baksa,783127.0,2.0,"2,78,49,946",DAYAL DAS,"27,849,160.29",Accepted-AOC,14-Feb-2024,AOC,Bodoland Territorial Council-PWD||Director Cum CHD - PWD BTC
2023_PWBNH_32989_4,SE/TB/TEN/03/2023-24/3892 Dated 07.10.2023,Jagannath Community and Skill Centre at Majuligarh T.E. under Biswanath LAC,Jagannath Community and Skill Centre at Majuligarh T.E. under Biswanath LAC,Works,Open Tender,Item Rate,Civil Works - Building,No,No,NA ,13-Oct-2023 02:00 PM,19-Oct-2023 12:00 PM ,180.0,No ,No,Online,04-Nov-2023 03:00 PM,Public Works Building and NH Department||Chief Engineer-Building - PWBNH||SE-Tezpur Circle - PWBNH,Biswanath,784176.0,2.0,"1,40,73,143",Bora Electricals,,Rejected-AOC,,AOC,Public Works Building and NH Department||Chief Engineer-Building - PWBNH||SE-Tezpur Circle - PWBNH
2023_PWBNH_32989_6,SE/TB/TEN/03/2023-24/3892 Dated 07.10.2023,Jagannath Community and Skill Centre at Borgang T.E. under Bihali LAC,Jagannath Community and Skill Centre at Borgang T.E. under Bihali LAC,Works,Open Tender,Item Rate,Civil Works - Building,No,No,NA ,13-Oct-2023 02:00 PM,19-Oct-2023 12:00 PM ,180.0,No ,No,Online,04-Nov-2023 03:00 PM,Public Works Building and NH Department||Chief Engineer-Building - PWBNH||SE-Tezpur Circle - PWBNH,Bihali,784166.0,2.0,"1,40,73,143",Dhruba Jyoti Saikia,"14,071,143",Rejected-AOC,26-Feb-2024,AOC,Public Works Building and NH Department||Chief Engineer-Building - PWBNH||SE-Tezpur Circle - PWBNH
2023_BTC_35008_1,ACE-27/KOJ/NIT/Pt-II/2023-24/,"Modification of file record room by providing file rack, fire alram system, fire extinguisher and ventilation at ground floor, B-Block, BTC Secretariat, Kokrajhar. (TN_50_3)","Modification of file record room by providing file rack, fire alram system, fire extinguisher and ventilation at ground floor, B-Block, BTC Secretariat, Kokrajhar.",Works,Open Tender,Works,Civil Works,No,No,NA ,28-Dec-2023 01:00 PM,NA ,180.0,No ,No,Online,17-Jan-2024 03:00 PM,Bodoland Territorial Council-PWD||Director Cum CHD - PWD BTC,Kokrajhar,783370.0,2.0,"36,98,000",BIPLAB CHANDA,"3,697,991.86",Accepted-AOC,09-Feb-2024,AOC,Bodoland Territorial Council-PWD||Director Cum CHD - PWD BTC
2024_BTC_35268_1,125/ACE/NIT/Infra/BTC/2022-23,"Construction of Bir Chilagang Basumatary Memorial Mini Stadium at Dwarkuchi, District Tamulpur. (TN_35_5_R)","Construction of Bir Chilagang Basumatary Memorial Mini Stadium at Dwarkuchi, District Tamulpur.",Works,Open Tender,Works,Civil Works - Building,No,No,NA ,06-Jan-2024 11:00 AM,NA ,180.0,No ,No,Online,02-Feb-2024 03:00 PM,Bodoland Territorial Council-PWD||Director Cum CHD - PWD BTC,Tamulpur,781367.0,2.0,"4,77,23,708",Ganesh Daimary,,Rejected-AOC,,AOC,Bodoland Territorial Council-PWD||Director Cum CHD - PWD BTC
2023_PWBNH_32060_38,TECH-II/256/2022/46 Dated Guwahati 9th August 2023,"TGR-69 Construction of Model Secondary Schools in the Tea Garden Areas, Assam at Mejenga TGMS, Dist Jorhat","TGR-69 Construction of Model Secondary Schools in the Tea Garden Areas, Assam at Mejenga TGMS, Dist Jorhat",Works,Open Tender,Item Rate,Civil Works - Building,No,No,NA ,16-Aug-2023 09:00 AM,22-Aug-2023 11:00 AM ,180.0,No ,No,Online,02-Sep-2023 03:30 PM,Public Works Building and NH Department||Chief Engineer-Building - PWBNH,Jorhat,785001.0,2.0,"2,88,24,127",M/S M.Bee Traders,"24,756,329",Accepted-AOC,19-Feb-2024,AOC,Public Works Building and NH Department||Chief Engineer-Building - PWBNH
