2023_AAU_34022_1,AAU/DPJ/97/2023-24,Development of AAU North Lakhimpur Campus under AAU under TG-EI for the year 2023-24,"Construction of G plus 2 staff quarters, gymnasium and Associate Dean quarter",Works,Open Tender,Percentage,Civil Works - Building,No,No,NA ,18-Nov-2023 10:00 AM,28-Nov-2023 11:30 AM ,180.0,No ,No,Online,11-Dec-2023 03:00 PM,Assam Agricultural University||Directorate of Physical Plants,"At LCVSc, Joyhing, North Lakhimpur",787051.0,2.0,"4,25,14,233",APCON GROUP,"37,880,182",Accepted-AOC,02-Feb-2024,AOC,Assam Agricultural University||Directorate of Physical Plants
2023_AHVD_32743_1,E-350002/2023-24/DFA/342061,"CONSTRUCTION OF ASSAM TYPE SUB-CENTRE BUILDING WITH ELECTRIFICATION, WATER SUPPLY AND SANITARY WORKS ETC. AT RAITKUCHI IN NALBARI DISTRICT","CONSTRUCTION OF ASSAM TYPE SUB-CENTRE BUILDING WITH ELECTRIFICATION, WATER SUPPLY AND SANITARY WORKS ETC. AT RAITKUCHI IN NALBARI DISTRICT",Works,Open Tender,Item Rate,Civil Works,No,No,NA ,03-Oct-2023 03:00 PM,06-Oct-2023 01:00 PM ,180.0,No ,No,Online,27-Oct-2023 02:30 PM,Animal Husbandry and Veterinary Department||Directorate of A.H. and Veterinary,RAITKUCHI,303877.0,2.0,"33,71,000",APURBA KUMAR DEKA,,Rejected-AOC,,AOC,Animal Husbandry and Veterinary Department||Directorate of A.H. and Veterinary
2023_GMDA_34838_1,GMDA/DEV/105/2023/5,"Consultancy service for Preparation of GIS based comprehensive drainage master plan and detailed project report for Guwahati city, Assam, India","Consultancy service for Preparation of GIS based comprehensive drainage master plan and detailed project report for Guwahati city, Assam, India",Services,Open Tender,EOI,Consultancy,No,No,NA ,19-Dec-2023 05:30 PM,02-Jan-2024 11:30 AM ,120.0,No ,No,Online,19-Jan-2024 03:00 PM,Guwahati Metropolitan Development Authority||Guwahati Development Department - GMDA,Guwahati,781005.0,1.0,0.0,TATA CONSULTING ENGINEERS LIMITED,0.0,Not Admitted-Fee/PreQual/Technical/Finance,15-Feb-2024,AOC,Guwahati Metropolitan Development Authority||Guwahati Development Department - GMDA
2023_WPTBC_35036_1,11.0,"Infrastructure Development of Ranjuli Higher Secondary School at Ranjuli,Dist Goalpara","Infrastructure Development of Ranjuli Higher Secondary School at Ranjuli,Dist Goalpara",Works,Limited,Item Rate,Civil Works,No,No,NA ,29-Dec-2023 11:40 AM,NA ,180.0,No ,No,Online,03-Jan-2024 04:00 PM,Welfare of Plain Tribes and Backward Classes||Directorate of Welfare of Scheduled Caste||Assam State Development Corporation for SC,goalpara,781006.0,2.0,"25,00,000",BISWAJIT DAS,"2,500,000",Accepted-AOC,02-Feb-2024,AOC,Welfare of Plain Tribes and Backward Classes||Directorate of Welfare of Scheduled Caste||Assam State Development Corporation for SC
2024_PWD_35434_2,CS/GCTRD/SOPD-G/7/2023-24,CRC-GCTRD -131- Kanaklata Road,"Improvement of Boragaon-Gakhirchowk-Kanaklata Road by cleaning of road surface and Jungles, Road Marking and Restoration of damaged portion of road under SOPD(G) for the year 2023-24 under 54-West Guwahati LAC in the district of Kamrup(M).",Works,Open Tender,Works,Civil Works,No,No,NA ,12-Jan-2024 02:00 PM,NA ,180.0,No ,No,Online,18-Jan-2024 02:00 PM,Public Works Roads Department,Kamrup,781021.0,2.0,"37,55,000",Hanuman Enterprise,,Accepted-AOC,,AOC,Public Works Roads Department
2023_NHM_31811_8,32034/17/2023-Const-NHM/372,Construction of Buildingless Sub-Health Centres at various places of Assam under PM-ABHIM for FY 2021-22 31 nos of Buildingless Sub-Health Centres under NHM on Turnkey Basis At UDAIPUR SC in Charaideo District,Construction of Buildingless Sub-Health Centres at various places of Assam under PM-ABHIM for FY 2021-22 31 nos of Buildingless Sub-Health Centres under NHM on Turnkey Basis At UDAIPUR SC in Charaideo District,Works,Open Tender,Turn-key,Civil Works - Building,No,No,NA ,31-Jul-2023 12:00 PM,NA ,180.0,No ,No,Online,22-Aug-2023 03:30 PM,National Health Mission||State Programme Management Unit - NHM,Charaideo,782445.0,2.0,"52,03,000",KAILYAN RAJKONWAR,"4,786,700",Not Admitted-Fee/PreQual/Technical,20-Feb-2024,AOC,National Health Mission||State Programme Management Unit - NHM
2023_NHM_32785_1,NHM 32019 18 2018 Construction NHM 161,Construction of 100 bedded MCH wing with accommodation for staff at existing Sivasagar Civil Hospital in Sivasagar district Addl work for covering the open to sky portion in hospital building,Construction of 100 bedded MCH wing with accommodation for staff at existing Sivasagar Civil Hospital in Sivasagar district Addl work for covering the open to sky portion in hospital building,Works,Open Tender,Item Rate,Civil Works - Building,No,No,NA ,06-Oct-2023 09:00 AM,NA ,180.0,No ,No,Online,11-Oct-2023 03:00 PM,National Health Mission||State Programme Management Unit - NHM,Sivasagar,781033.0,2.0,"49,99,064",Debabrata Gogoi,"4,680,399.8",Rejected-Technical,16-Feb-2024,AOC,National Health Mission||State Programme Management Unit - NHM
2023_PWBNH_35104_1,SE/BII_Pandal_Republic Day_2024_Khanapara,"Construction of Pandal, Saluting Base, Barricade and View Cutter etc. for Celebration of Republic Day for the year 2024 at Veterinary Play Ground, Khanapara, Guwahati-22 (Civil and Electrical works)","Construction of Pandal, Saluting Base, Barricade and View Cutter etc. for Celebration of Republic Day for the year 2024 at Veterinary Play Ground, Khanapara, Guwahati-22 (Civil and Electrical works)",Works,Open Tender,Item Wise,Civil Works - Building,No,No,NA ,30-Dec-2023 06:55 PM,02-Jan-2024 12:00 PM ,180.0,No ,No,Online,22-Jan-2024 11:30 AM,Public Works Building and NH Department||Chief Engineer-Building - PWBNH||SE-Guwahati Circle-2 - PWBNH,"Khanapara, Guwahati",781022.0,2.0,"99,94,000",ACME EVENTS & EXPO,"9,990,867",Accepted-AOC,01-Feb-2024,AOC,Public Works Building and NH Department||Chief Engineer-Building - PWBNH||SE-Guwahati Circle-2 - PWBNH
2023_PWBNH_32226_3,TECH.II/140/2023/3 Dated Guwahati 22nd August 2023,"CONSTRUCTION AND UP-GRADATION OF BHRINGESWAR HIGHER SECONDARY SCHOOL AT BONGSHAR, KAMRUP, ASSAM","CONSTRUCTION AND UP-GRADATION OF BHRINGESWAR HIGHER SECONDARY SCHOOL AT BONGSHAR, KAMRUP, ASSAM",Works,Open Tender,Item Rate,Civil Works - Building,No,No,NA ,25-Aug-2023 01:30 PM,NA ,180.0,No ,No,Online,22-Sep-2023 02:30 PM,Public Works Building and NH Department||Chief Engineer-Building - PWBNH,BONGSHAR,781103.0,2.0,"10,51,63,400",ANIL DAS CONSTRUCTION PVT LTD,"113,410,240",Accepted-AOC,14-Feb-2024,AOC,Public Works Building and NH Department||Chief Engineer-Building - PWBNH
2023_WPTBC_34995_1,PTDC/Engg/2022-23/38,"Repairing and Renovation of ATGTS Boys hostel at O lane Melan Nagar, near ATPPF office in Dibrugarh district, Assam.","Repairing and Renovation of ATGTS Boys hostel at O lane Melan Nagar, near ATPPF office in Dibrugarh district, Assam.",Works,Open Tender,Item Rate,Civil Works,No,No,NA ,28-Dec-2023 11:00 AM,NA ,120.0,No ,No,Online,08-Jan-2024 03:30 PM,Welfare of Plain Tribes and Backward Classes||Director - WPT and BC,Dibrugarh,786001.0,2.0,"72,52,000",Assam Traders,"6,526,800",Accepted-AOC,28-Feb-2024,AOC,Welfare of Plain Tribes and Backward Classes||Director - WPT and BC
2023_GMC_34916_3,GER/ CE/2016/2022/37 Dated 20/12/2023,Community Hall at Shyami Vivekananda Children Park Adabari Tarun Sangha Club,under 2nd installment of Untied basic Grant under the award of 15th Finance Commission for the Year 2020-21 during the FY 2021-22.,Works,Open Tender,Lump-sum,Civil Works,No,No,NA ,22-Dec-2023 09:00 AM,NA ,180.0,No ,No,Online,10-Jan-2024 02:30 PM,Guwahati Municipal Corporation,GUWAHATI,781005.0,2.0,"22,00,000",Nur Enterprise,,Rejected-Technical,,AOC,Guwahati Municipal Corporation
2023_PWBNH_34550_1,SE/TB/TEN/19/2023-24/4208 Dated- 01.12.2023,Jagannath Community and Skill Centre at Dekorai T.E. under Sootea LAC,Jagannath Community and Skill Centre at Dekorai T.E. under Sootea LAC,Works,Open Tender,Item Rate,Civil Works - Building,No,No,NA ,08-Dec-2023 03:00 PM,NA ,180.0,No ,No,Online,30-Dec-2023 02:00 PM,Public Works Building and NH Department||Chief Engineer-Building - PWBNH,Sootea,784175.0,2.0,"1,40,73,143",Md. Saduddin Ahmed,,Accepted-AOC,,AOC,Public Works Building and NH Department||Chief Engineer-Building - PWBNH
2023_APHC_32286_1,APHC/CS/18/2023-24_MangaldaiSA,"Construction of RCC S 4 L/S qtr 16 unit/bldg - Civil, Sanitary and water supply, Site development etc at Mangaldai PR under the scheme for Special Assistance to the States for Capital Investment 23 - 24 on EPC Mode.","Construction of RCC S 4 L/S qtr 16 unit/bldg - Civil, Sanitary and water supply, Site development etc at Mangaldai PR under the scheme for Special Assistance to the States for Capital Investment 23 - 24 on EPC Mode.",Works,Open Tender,Item Rate,Civil Works - Building,No,No,NA ,30-Aug-2023 02:00 PM,08-Sep-2023 02:00 PM ,180.0,No ,No,Online,10-Oct-2023 12:30 PM,Assam Police Housing Corporation Ltd,Mangaldai Police Reserve in Darang Dist.,784125.0,2.0,"7,02,02,550",VERSHA TECHNOTRADE PVT LTD,"65,990,397",Rejected-Technical,07-Feb-2024,AOC,Assam Police Housing Corporation Ltd
2023_PWD_33797_300,CE/Maint/MMPNA/01/2023-24/03,"MMPNA/2023-24/215_Periodic Renewal of R.D Road to Khatobari Anganbadi via Lakhi Mandir, Gurkuchi chowk of Rangia Dhamdhama Road to Gurkuchi L.P School and Bihapara to Barghuli Road under MMPNA for the year 2023-24 Under Rangia LAC","MMPNA/2023-24/215_Periodic Renewal of R.D Road to Khatobari Anganbadi via Lakhi Mandir, Gurkuchi chowk of Rangia Dhamdhama Road to Gurkuchi L.P School and Bihapara to Barghuli Road under MMPNA for the year 2023-24 Under Rangia LAC",Works,Open Tender,Item Rate,Civil Works – Roads,No,No,NA ,16-Nov-2023 02:00 PM,22-Nov-2023 12:00 PM ,180.0,No ,No,Online,01-Dec-2023 03:00 PM,Public Works Roads Department,Rangia,781003.0,2.0,"90,26,000",SRI AMAL CHANDRA BARO,"8,123,400",Rejected-Finance,28-Feb-2024,AOC,Public Works Roads Department
2023_CD_33174_2,NABARD-RIDF-XXI/Phase-II/161,"Renovation / Up-gradation and New Creation of Warehousing Facilities under Scheme of NABARDs RIDF phase-II for ICD, Amingaon","Renovation / Up-gradation and New Creation of Warehousing Facilities under Scheme of NABARDs RIDF phase-II for ICD, Amingaon",Works,Open Tender,Item Rate,Civil Works,No,No,NA ,20-Oct-2023 03:00 PM,25-Oct-2023 10:00 AM ,180.0,No ,No,Online,31-Oct-2023 03:30 PM,Cooperation Department||Assam State Warehousing Corporation,Guwahati,781005.0,2.0,"64,47,000",M/S AK ENTERPRISE,"6,440,000",Rejected-Technical,23-Feb-2024,AOC,Cooperation Department||Assam State Warehousing Corporation
2023_APGCL_31107_1,APGCL CSO ESSTT 209 PART I 222,SUPPLY OF OUTSOURCED SECURITY GUARDS,SUPPLY OF OUTSOURCED SECURITY GUARDS TO VARIOUS INSTALLATIONS OF APGCL FROM GOVT. REGISTERED SECURITY AGENCIES,Services,Open Tender,Works,Manpower Supply,No,No,NA ,06-Jun-2023 05:00 PM,NA ,180.0,No ,No,Online,04-Jul-2023 03:00 PM,Assam Power Generation Company Limited,APGCL Headquater and Power Plants,781001.0,2.0,,North Eastern Security Service (NESS) Pvt. Ltd.,"3,123,263.24",Rejected-AOC,01-Apr-2024,AOC,Assam Power Generation Company Limited
2024_BTC_35495_1,No. ACE- 106/PWD/IFB/2021-22/285,Construction of 10.00 m Span Slab Culvert on 11th Mile to Daugangpara road Over Laldong under SOPD for the year 2023-24. TN-59-1,Construction of 10.00 m Span Slab Culvert on 11th Mile to Daugangpara road Over Laldong under SOPD for the year 2023-24. TN-59-1,Works,Open Tender,Item Rate,Civil Works – Roads,No,No,NA ,16-Jan-2024 12:00 PM,NA ,180.0,No ,No,Online,30-Jan-2024 02:00 PM,Bodoland Territorial Council-PWD||Director Cum CHD - PWD BTC,baksa,781352.0,2.0,"39,99,620",JYOTISH GAYAN,"3,999,618",Rejected-Technical,08-Feb-2024,AOC,Bodoland Territorial Council-PWD||Director Cum CHD - PWD BTC
2023_PWBNH_34271_1,SE(B)/DIB/.../CS-19/23../624-A dtd. 09/11/23,Jagannath Community and Skill Centre under Tingkhong LAC at Lakribam T.E. (Sl. No. - 17),Jagannath Community and Skill Centre under Tingkhong LAC at Lakribam T.E. (Sl. No. - 17),Works,Open Tender,Item Rate,Civil Works - Building,No,No,NA ,29-Nov-2023 09:00 AM,29-Nov-2023 11:00 AM ,195.0,No ,No,Online,13-Dec-2023 10:00 AM,Public Works Building and NH Department||Chief Engineer-Building - PWBNH||SE-Jorhat Circle - PWBNH||EE-Dibrugarh Building Division - PWBNH,Lakribam T.E.,786612.0,2.0,"1,40,73,000",ABHIJIT SONOWAL,"14,354,830",Accepted-AOC,06-Feb-2024,AOC,Public Works Building and NH Department||Chief Engineer-Building - PWBNH||SE-Jorhat Circle - PWBNH||EE-Dibrugarh Building Division - PWBNH
2023_PWBNH_34234_1,SE(B)/DIB/JC../CS-19/../624-A dt09/11/23,Jagannath Community and Skill Centre under,"Jagannath Community and Skill Centre under Tingkhong LAC at Duliabam T.E., (Sl. No. - 8)",Works,Open Tender,Item Rate,Civil Works - Building,No,No,NA ,27-Nov-2023 06:00 PM,29-Nov-2023 11:00 AM ,180.0,No ,No,Online,13-Dec-2023 10:00 AM,Public Works Building and NH Department||Chief Engineer-Building - PWBNH||SE-Jorhat Circle - PWBNH||EE-Dibrugarh Building Division - PWBNH,Duliabam T.E,786612.0,2.0,"1,40,73,000",ABHIJIT SONOWAL,,Rejected-AOC,28-Feb-2024,AOC,Public Works Building and NH Department||Chief Engineer-Building - PWBNH||SE-Jorhat Circle - PWBNH||EE-Dibrugarh Building Division - PWBNH
2023_PWD_35073_1,CE/DEV/TB/733/2023-24/01,SOPD_G_23_24_33 (1) Improvement of Goroimari to Kalatoli PWD Road (2) PWD Road to Kalatoli Pathar (3) Construction of RCC drain and Improvement of Internal roads of Mirza Town Shipment (4) Improvement of Road from Barihat Barpratima Road to Saru Here,SOPD_G_23_24_33 (1) Improvement of Goroimari to Kalatoli PWD Road (2) PWD Road to Kalatoli Pathar (3) Construction of RCC drain and Improvement of Internal roads of Mirza Town Shipment (4) Improvement of Road from Barihat Barpratima Road to Saru Here,Works,Open Tender,Item Rate,Civil Works,No,No,NA ,29-Dec-2023 06:00 PM,10-Jan-2024 12:00 PM ,180.0,No ,No,Online,18-Jan-2024 02:00 PM,Public Works Roads Department,Kamrup,781003.0,2.0,"91,14,69,000",ANIL DAS CONSTRUCTION PVT LTD,"911,465,267",Accepted-AOC,12-Feb-2024,AOC,Public Works Roads Department
2023_BTC_33660_1,150/PWD/NIT/Goodwill/23-24/03,Construction of road from Narabari Daokibari Road to Bedlangmari via Silbari From Ch.0.00m to Ch. 3000.00m by providing ICBP under CMs Goodwill Project for the year 2023-24. TN_26_31,Construction of road from Narabari Daokibari Road to Bedlangmari via Silbari From Ch.0.00m to Ch. 3000.00m by providing ICBP under CMs Goodwill Project for the year 2023-24. TN_26_31,Works,Open Tender,Item Rate,Civil Works – Roads,No,No,NA ,09-Nov-2023 10:30 AM,NA ,180.0,No ,No,Online,30-Nov-2023 12:00 PM,Bodoland Territorial Council-PWD||Director Cum CHD - PWD BTC,Kokrajhar,783370.0,2.0,"2,54,13,753",Assam Agencies,"22,872,377.7",Rejected-AOC,01-Feb-2024,AOC,Bodoland Territorial Council-PWD||Director Cum CHD - PWD BTC
2023_BTC_33625_1,150/PWD/NIT/Goodwill/23-24/03,Construction of ICBP road from Bhowraguri Sapatgram PWD road from Rupsigaon No.2 to Rupsigaon No.1 Gali canal road under CMs Goodwill Project for the year 2023-24. TN_26_14,Construction of ICBP road from Bhowraguri Sapatgram PWD road from Rupsigaon No.2 to Rupsigaon No.1 Gali canal road under CMs Goodwill Project for the year 2023-24. TN_26_14,Works,Open Tender,Item Rate,Civil Works – Roads,No,No,NA ,09-Nov-2023 10:30 AM,NA ,180.0,No ,No,Online,30-Nov-2023 12:00 PM,Bodoland Territorial Council-PWD||Director Cum CHD - PWD BTC,Kokrajhar,783370.0,2.0,"2,32,53,516",Shyam Narayan Prasad,"23,253,500",Not Admitted-Fee/PreQual/Technical,16-Feb-2024,AOC,Bodoland Territorial Council-PWD||Director Cum CHD - PWD BTC
2023_GMC_32305_36,GER/ CE/1806/2019/Part-D/01 Dated 29/08/2023,"Road No-11, Beharbari ( near Cambridge International School)","Road No-11, Beharbari ( near Cambridge International School)",Works,Open Tender,Lump-sum,Civil Works,No,No,NA ,09-Nov-2023 02:00 PM,NA ,180.0,No ,No,Online,30-Nov-2023 02:00 PM,Guwahati Municipal Corporation,GUWAHATI,781005.0,2.0,"18,20,000",KAMAL DAS,"1,474,200",Accepted-AOC,13-Feb-2024,AOC,Guwahati Municipal Corporation
2023_PWBNH_34976_1,SE(N)/24/2023-24/Pt/318,Additional work for newly constructed Multi storied Judicial Court Buildings at Krishnanagar Barpeta Providing paver block and chain link fencing etc,Additional work for newly constructed Multi storied Judicial Court Buildings at Krishnanagar Barpeta Providing paver block and chain link fencing etc,Works,Open Tender,Item Wise,Civil Works - Building,No,No,NA ,26-Dec-2023 06:00 PM,03-Jan-2024 12:00 PM ,180.0,No ,No,Online,05-Jan-2024 03:00 PM,Public Works Building and NH Department||Chief Engineer-Building - PWBNH||SE-Nalbari Building Circle PWBNH||Nalbari District Teritorial Building Division,Barpeta,781301.0,2.0,"39,15,643",Ganesh Ch. Das,,Rejected-Finance,,AOC,Public Works Building and NH Department||Chief Engineer-Building - PWBNH||SE-Nalbari Building Circle PWBNH||Nalbari District Teritorial Building Division
2024_BoTC_35579_1,BTC/SCDB/05/2023(Re-Tender) -01,"Construction of RCC culvert at No. 2 Fakriguri, under 15th Finance for the year 2022-23 during 2023-24","Construction of RCC culvert at No. 2 Fakriguri, under 15th Finance for the year 2022-23 during 2023-24",Works,Open Tender,Works,Civil Works,No,No,NA ,20-Jan-2024 09:00 AM,NA ,180.0,No ,No,Online,01-Feb-2024 03:30 PM,Bodoland Territorial Council||Panchayat and Rural Development-BTC,Fakriguri - CHIRANG,783373.0,2.0,"24,74,285",PREMJIT BORO,"2,473,999.41",Accepted-AOC,12-Feb-2024,AOC,Bodoland Territorial Council||Panchayat and Rural Development-BTC
2023_SSA_31975_15,SS/CW/RETENDER/333/2023/39,"Construction of various civil work interventions for strengthening of existing secondary schools under Samagra Shiksha, Assam at Bhogdahar S.M. High School under Gauripur block in Dhubri district","Construction of various civil work interventions for strengthening of existing secondary schools under Samagra Shiksha, Assam at Bhogdahar S.M. High School under Gauripur block in Dhubri district",Works,Open Tender,Works,Civil Works - Building,No,No,NA ,08-Aug-2023 06:00 PM,10-Aug-2023 03:00 PM ,180.0,No ,No,Online,19-Aug-2023 03:00 PM,Axom Sarba Siksha Abhijan Mission,GAURIPUR,781019.0,2.0,"53,70,000",ANOWAR UZ ZAMAN AHMED,"5,133,000",Rejected-AOC,06-Feb-2024,AOC,Axom Sarba Siksha Abhijan Mission
2023_NHM_29878_2,NHM-32031/4/2021-Const-NHM/Pt 34/69,Establishment of Proposed 6 bedded ward at various SHCs and PHCs of Assam under ECRP II NHM Assam Group 79 5 nos scheme in Dibrugarh district,Establishment of Proposed 6 bedded ward at various SHCs and PHCs of Assam under ECRP II NHM Assam Group 79 5 nos scheme in Dibrugarh district,Works,Open Tender,Turn-key,Civil Works - Building,No,No,NA ,15-Mar-2023 10:00 AM,NA ,180.0,No ,No,Online,23-Mar-2023 03:30 PM,National Health Mission||State Programme Management Unit - NHM,Dibrugarh,786001.0,2.0,"57,99,785",B. N. GARODIA,"5,796,995",Accepted-AOC,12-Mar-2024,AOC,National Health Mission||State Programme Management Unit - NHM
2023_PCCF_32052_1,DBR/SOPD/2023-24/89,Supply and fitting of Communication Systems,"Supply and fitting Wireless base Radio Sets, Wireless Radio Handset , Li Ion Battery at Dehing Patkai National Park",Goods,Open Tender,Supply,Miscellaneous Goods,No,No,NA ,12-Aug-2023 09:00 AM,16-Aug-2023 11:30 AM ,180.0,No ,No,Online,01-Sep-2023 04:30 PM,"Pr. Chief Conservator of Forest and Head of Forest Force||Chief Conservator of Forests (Upper Assam Zone)||Eastern Assam Circle, Jorhat||Dibrugarh Division",DPNP,786614.0,1.0,"10,64,718",BHARTI COMMUNICATIONS,,Accepted-AOC,,AOC,"Pr. Chief Conservator of Forest and Head of Forest Force||Chief Conservator of Forests (Upper Assam Zone)||Eastern Assam Circle, Jorhat||Dibrugarh Division"
2023_SCD_32955_2,Tender/NIT/Pt/2023-24/6503,Gully Control and Water Distribution Project at Bhutankhuti under RIDF- XXVlll during 2022-23,Gully Control and Water Distribution Project at Bhutankhuti under RIDF- XXVlll during 2022-23,Works,Open Tender,Item Rate,Civil Works,No,No,NA ,11-Oct-2023 02:00 PM,NA ,180.0,No ,No,Online,06-Nov-2023 11:00 AM,Soil Conservation Department||Director - SCD,Baksa,781367.0,2.0,"1,06,47,214",CHIRANJIT CHOUDHURY,,Rejected-Finance,,AOC,Soil Conservation Department||Director - SCD
2023_CEO_34330_1,ELE.104/2023/137,EMPANELMENT FOR IT EQUIPMENT SUPPLY,EMPANELMENT FOR IT EQUIPMENT SUPPLY,Goods,Open Tender,Item Wise,Miscellaneous Goods,No,No,NA ,01-Dec-2023 04:30 PM,NA ,180.0,No ,No,Online,08-Jan-2024 12:00 PM,Office of the Chief Electoral Officer Assam,Guwahati,781006.0,2.0,,Asomi Enterprise,,Accepted-AOC,,AOC,Office of the Chief Electoral Officer Assam
2024_WPTBC_35636_1,1.0,"Construction of Boundary Wall and Main Gate at Jhargaon High School, Tamulpur","Construction of Boundary Wall and Main Gate at Jhargaon High School, Tamulpur",Works,Limited,Item Rate,Civil Works,No,No,NA ,22-Jan-2024 09:00 AM,NA ,180.0,No ,No,Online,24-Jan-2024 04:00 PM,Welfare of Plain Tribes and Backward Classes||Directorate of Welfare of Scheduled Caste||Assam State Development Corporation for SC,TAMULPUR,781006.0,2.0,"25,00,000",Dilip Kumar Bora,"2,500,000",Rejected-AOC,16-Feb-2024,AOC,Welfare of Plain Tribes and Backward Classes||Directorate of Welfare of Scheduled Caste||Assam State Development Corporation for SC
2023_PWBNH_33540_1,SE(B)/JHT/C/S/S-20/23-24/2815,Jagannath Community and Skill Centre under Khumtai LAC at Borfolong Tea Estate,Jagannath Community and Skill Centre under Khumtai LAC at Borfolong Tea Estate,Works,Open Tender,Item Rate,Civil Works - Building,No,No,NA ,06-Nov-2023 03:30 PM,15-Nov-2023 11:00 AM ,180.0,No ,No,Online,23-Nov-2023 03:00 PM,Public Works Building and NH Department||Chief Engineer-Building - PWBNH||SE-Jorhat Circle - PWBNH||EE-Jorhat Building Division - PWBNH,Borfolong Tea Estate Golaghat,785621.0,2.0,"1,40,73,000",MUNINDRA MOHAN GOGOI,"14,354,400",Rejected-AOC,06-Feb-2024,AOC,Public Works Building and NH Department||Chief Engineer-Building - PWBNH||SE-Jorhat Circle - PWBNH||EE-Jorhat Building Division - PWBNH
2024_PWD_35503_1,T-1/NIT/CDTRD/SNR/5551,Road safety measures on roads under Charaideo District Territorial Road Division for the year 2023-2024 for Sonari and Mahmora LAC,Road safety measures on roads under Charaideo District Territorial Road Division for the year 2023-2024 for Sonari and Mahmora LAC,Works,Open Tender,Item Rate,Civil Works – Roads,No,No,NA ,18-Jan-2024 10:00 AM,NA ,180.0,No ,No,Online,29-Jan-2024 01:00 PM,Public Works Roads Department,SONARI,785690.0,2.0,"49,85,995",Binanda Bora,"4,984,655",Rejected-AOC,20-Feb-2024,AOC,Public Works Roads Department
2023_PWD_33170_66,CE/DEV/TB/278/2023-24/01,MMUPPNA_RIDF_XXIX_23_24_86 Improvement of road Kharikotia to Gajpuria via Dhekiajuli and Soikota from Ch. 0.00 km to 7.00 km under Mukhya Mantrir Unnoto Pakipath Nirman Achani under RIDF-XXIX of NABARD for the year 2023-24,MMUPPNA_RIDF_XXIX_23_24_86 Improvement of road Kharikotia to Gajpuria via Dhekiajuli and Soikota from Ch. 0.00 km to 7.00 km under Mukhya Mantrir Unnoto Pakipath Nirman Achani under RIDF-XXIX of NABARD for the year 2023-24,Works,Open Tender,Item Rate,Civil Works,No,No,NA ,25-Oct-2023 12:30 PM,30-Oct-2023 12:00 PM ,180.0,No ,No,Online,07-Nov-2023 02:00 PM,Public Works Roads Department,Jorhat,781003.0,2.0,"8,70,48,000",JITU TAPAN GOGOI,,Rejected-AOC,,AOC,Public Works Roads Department
2023_PWBNH_35108_1,"TW-1/SE/GBC/2021-22/469-A, Dt. 28-12-2023","Repairing, renovation of Superintendent Quarter at 200 bedded Civil Hospital, Goalpara","Repairing, renovation of Superintendent Quarter at 200 bedded Civil Hospital, Goalpara",Works,Open Tender,Works,Civil Works - Building,No,No,NA ,30-Dec-2023 06:30 PM,11-Jan-2024 12:00 PM ,180.0,No ,No,Online,22-Jan-2024 12:00 PM,Public Works Building and NH Department||Chief Engineer-Building - PWBNH||SE-Guwahati Circle-1 - PWBNH||EE- Goalpara Building Division - PWBNH,"200 Bedded Civil Hospital, Bhalukdubi, Goalpara",783101.0,2.0,"23,91,503",BISHNU KUMAR CHETRY,,Rejected-AOC,,AOC,Public Works Building and NH Department||Chief Engineer-Building - PWBNH||SE-Guwahati Circle-1 - PWBNH||EE- Goalpara Building Division - PWBNH
2023_BoTC_30370_1,No. TECH- 05/SE(B)/E-Tender/2021-22/91,"Arrangement of Temporary Pandal, Dias, Barricading, Branding in connection with Inauguration Ceremony of Medical College, Kokrajhar (Electrical Work) 518, Group No. II","Arrangement of Temporary Pandal, Dias, Barricading, Branding in connection with Inauguration Ceremony of Medical College, Kokrajhar (Electrical Work) 518, Group No. II",Works,Open Tender,Item Rate,Civil Works - Building,No,No,NA ,05-Apr-2023 02:00 PM,NA ,180.0,No ,No,Online,10-Apr-2023 01:30 PM,Bodoland Territorial Council||PWD-BTC,kokrajhar,783370.0,2.0,"25,60,783",M/S CAPITAL OVERLAYS,"2,560,700",Accepted-AOC,15-Feb-2024,AOC,Bodoland Territorial Council||PWD-BTC
2022_PWBNH_27716_1,SE(B)/DIB/CS-09/22-23/895-A,Development of Astabhuj Prakalpa Phase II under One Time Special Grant for Development of Moran Community for the year 2021-22 Gr No 24,Development of Astabhuj Prakalpa Phase II under One Time Special Grant for Development of Moran Community for the year 2021-22 Gr No 24,Works,Open Tender,Item Rate,Civil Works - Building,No,No,NA ,11-Nov-2022 09:00 AM,11-Nov-2022 11:00 AM ,180.0,No ,No,Online,17-Nov-2022 03:00 PM,Public Works Building and NH Department||Chief Engineer-Building - PWBNH||SE-Jorhat Circle - PWBNH||EE-Dibrugarh Building Division - PWBNH,Astabhuj Prakalpa Phase II,786125.0,2.0,"38,28,400",B B Enterprise,"3,827,716",Accepted-AOC,28-Feb-2024,AOC,Public Works Building and NH Department||Chief Engineer-Building - PWBNH||SE-Jorhat Circle - PWBNH||EE-Dibrugarh Building Division - PWBNH
