Organisation Chain,Tender Reference Number,Tender ID,Withdrawal Allowed,Tender Type,Form of contract,Tender Category,No. of Covers,General Technical Evaluation Allowed,ItemWise Technical Evaluation Allowed,Payment Mode,Is Multi Currency Allowed For BOQ,Is Multi Currency Allowed For Fee,Allow Two Stage Bidding,Cover No,Cover,Document Type,Description,Publish Date,Bid Opening Date,Document Download / Sale Start Date,Document Download / Sale End Date,Clarification Start Date,Clarification End Date,Bid Submission Start Date,Bid Submission End Date,Financial Bid Opening Date,EMD Amount in ₹,EMD Exemption Allowed,EMD Fee Type,EMD Percentage,EMD Payable To,EMD Payable At,S.No,Bank Name,Tender Fee in ₹,Fee Payable To,Fee Payable At,Tender Fee Exemption Allowed,Name,Address,Title,Work Description,Pre Qualification Details,Independent External Monitor/Remarks,Tender Value in ₹,Product Category,Sub category,Contract Type,Bid Validity(Days),Period Of Work(Days),Location,Pincode,Pre Bid Meeting Place,Pre Bid Meeting Address,Pre Bid Meeting Date,Bid Opening Place,Should Allow NDA Tender,Allow Preferential Bidder,Tender Stage,Contract Date :,Total Contract Value :,Work Completion Period in days :,Updated By :,Updated on :,AOC document :,S.No,Bid Number,Bidder Name,Awarded Currency,Awarded Value,S.No.1,Bid Number.1,Bidder Name.1,Submitted Date,Status,Remarks,Status Updated On,Type :,Summary :,Updated By :.1,Updated On :,Document :,BOQ Comparative Chart :,Committee Chairperson/Co-ordinator Name :,Committee Chairperson/Co-ordinator Type :,Committee Members :,Updated By :.2,Updated on :.1,Document :.1,Organisation Chain :,Tender ID :,Tender Ref No :,Tender Title :,Type :.1,Summary :.1,Updated By :.3,Updated On :.1,Document :.2,Committee Chairperson/Co-ordinator Name :.1,Committee Chairperson/Co-ordinator Type :.1,Committee Members :.1,Updated By :.4,Updated On :.2,Financial Bid Opening Date:,Document :.3,Tender Stage
Public Works Roads Department,EE/LKH/ NDRF (PDNA 2022)/2025-26/11,2026_PWD_50314_1,Yes,Open Tender,Item Rate,Works,2.0,No,No,Online,No,No,No,1.0,Fee/PreQual/Technical,.pdf,SBD,17-Jan-2026 05:55 PM,02-Feb-2026 02:00 PM,17-Jan-2026 06:00 PM,29-Jan-2026 02:00 PM,19-Jan-2026 10:00 AM ,29-Jan-2026 02:00 PM ,19-Jan-2026 10:00 AM,29-Jan-2026 02:00 PM,10-Mar-2026 12:10 PM,"79,991",Yes,percentage,2.0%,Nil,Nil,1.0,SBI Bank,"1,200",Nil,Nil,Yes,Executive Engineer,"O/o the EE, PWRD Goalpara West and Dudhnoi TRD, Lakhipur,Goalpara Pin-783129",Recovery and Re-construction of Jhanjipara to Besorkona road under NDRF (PDNA 2022) for the year 2025-26 (Protection of Existing damaged embankment with Geo Bags and earthwork in Stretches) of Goalpara District (13-Goalpara West),Recovery and Re-construction of Jhanjipara to Besorkona road under NDRF (PDNA 2022) for the year 2025-26 (Protection of Existing damaged embankment with Geo Bags and earthwork in Stretches) of Goalpara District (13-Goalpara West),Refer to Tender Documents ,NA ,"39,99,553",Civil Works – Roads,NA ,Tender,180.0,NA ,Lakhipur Goalpara,783129.0,NA ,NA ,NA ,"O/o the EE, PWRD Goalpara West and Dudhnoi TRD",No ,No,AOC,21-May-2026,"INR 3,079,615.98",90.0,Anjan Kumar Kalita,21-May-2026 05:37 PM,WO.pdf (412.00 KB),1.0,295599.0,Dark Knight Consultancy & Research,INR,"3,079,615.98",1,295691,AKBOR ALI,29-Jan-2026 01:01 PM,Rejected-AOC,Work allotted to L1 Contractor,21-May-2026 05:37 PM,Finance,Financial Bid Opened,Anjan Kumar Kalita,21-May-2026 04:52 PM,,BOQ Comparative Chart,Nirmal Konwar,Internal,"Ranjit Sarkar AO, Arif Ahmed Asstt Engineer, Anjan Kalita JE, Brojo Iswari Jr Asstt",Anjan Kumar Kalita,21-May-2026 05:22 PM,finsummary_80160.pdf (361.75 KB),Public Works Roads Department,2026_PWD_50314_1,EE/LKH/ NDRF (PDNA 2022)/2025-26/11,Recovery and Re-construction of Jhanjipara to Besorkona road under NDRF (PDNA 2022) for the year 2025-26 (Protection of Existing damaged embankment with Geo Bags and earthwork in Stretches) of Goalpara District (13-Goalpara West),Technical,Bid technically open,Anjan Kumar Kalita,10-Mar-2026 11:33 AM,,Nirmal Konwar,Internal,"Ranjit Sarkar AO, Arif Ahmed Asstt Engineer, Anjan Kalita JE, Brojo Iswari Jr Asstt",Anjan Kumar Kalita,10-Mar-2026 12:03 PM,10-Mar-2026 12:10 PM,techsummary_80160.pdf (295.30 KB),AOC
,,,,,,,,,,,,,,2.0,Finance,.pdf,Form of Bid,,,,,,,,,,,,,,,,,,,,,,,,,,,,,,,,,,,,,,,,,,AOC,,,,,,,,,,,,2,295326,Bahadur Islam,27-Jan-2026 10:28 PM,Rejected-AOC,Work allotted to L1 Contractor,21-May-2026 05:37 PM,,,,,,,,,,,,,,,,,,,,,,,,,,,,,AOC
,,,,,,,,,,,,,,,,.xls,BOQ,,,,,,,,,,,,,,,,,,,,,,,,,,,,,,,,,,,,,,,,,,AOC,,,,,,,,,,,,3,295599,Dark Knight Consultancy & Research,28-Jan-2026 11:53 PM,Accepted-AOC,Acceptted,21-May-2026 05:37 PM,,,,,,,,,,,,,,,,,,,,,,,,,,,,,AOC
,,,,,,,,,,,,,,,,,,,,,,,,,,,,,,,,,,,,,,,,,,,,,,,,,,,,,,,,,,,AOC,,,,,,,,,,,,4,295274,Giyas Uddin Ahmed,28-Jan-2026 03:21 PM,Rejected-AOC,Work allotted to L1 Contractor,21-May-2026 05:37 PM,,,,,,,,,,,,,,,,,,,,,,,,,,,,,AOC
,,,,,,,,,,,,,,,,,,,,,,,,,,,,,,,,,,,,,,,,,,,,,,,,,,,,,,,,,,,AOC,,,,,,,,,,,,5,295607,SATYABAN HAJONG,29-Jan-2026 11:59 AM,Rejected-Technical,Rejected,10-Mar-2026 12:03 PM,,,,,,,,,,,,,,,,,,,,,,,,,,,,,AOC
