Organisation Chain,Tender Reference Number,Tender ID,Withdrawal Allowed,Tender Type,Form of contract,Tender Category,No. of Covers,General Technical Evaluation Allowed,ItemWise Technical Evaluation Allowed,Payment Mode,Is Multi Currency Allowed For BOQ,Is Multi Currency Allowed For Fee,Allow Two Stage Bidding,Cover No,Cover,Document Type,Description,Publish Date,Bid Opening Date,Document Download / Sale Start Date,Document Download / Sale End Date,Clarification Start Date,Clarification End Date,Bid Submission Start Date,Bid Submission End Date,Financial Bid Opening Date,EMD Amount in ₹,EMD Exemption Allowed,EMD Fee Type,EMD Percentage,EMD Payable To,EMD Payable At,S.No,Bank Name,Tender Fee in ₹,Fee Payable To,Fee Payable At,Tender Fee Exemption Allowed,Name,Address,Title,Work Description,Pre Qualification Details,Independent External Monitor/Remarks,Tender Value in ₹,Product Category,Sub category,Contract Type,Bid Validity(Days),Period Of Work(Days),Location,Pincode,Pre Bid Meeting Place,Pre Bid Meeting Address,Pre Bid Meeting Date,Bid Opening Place,Should Allow NDA Tender,Allow Preferential Bidder,Tender Stage,Contract Date :,Total Contract Value :,Work Completion Period in days :,Updated By :,Updated on :,AOC document :,S.No,Bid Number,Bidder Name,Awarded Currency,Awarded Value,S.No.1,Bid Number.1,Bidder Name.1,Submitted Date,Status,Remarks,Status Updated On,Type :,Summary :,Updated By :.1,Updated On :,Document :,BOQ Comparative Chart :,Committee Chairperson/Co-ordinator Name :,Committee Chairperson/Co-ordinator Type :,Committee Members :,Updated By :.2,Updated on :.1,Document :.1,Organisation Chain :,Tender ID :,Tender Ref No :,Tender Title :,Type :.1,Summary :.1,Updated By :.3,Updated On :.1,Document :.2,Committee Chairperson/Co-ordinator Name :.1,Committee Chairperson/Co-ordinator Type :.1,Committee Members :.1,Updated By :.4,Updated On :.2,Financial Bid Opening Date:,Document :.3,Tender Stage
Pr. Chief Conservator of Forest and Head of Forest Force||Principal Chief Conservator of Forests(Wildlife and Ch. Wildlife Warden)||Divisional Forest Officer - Assam Sate Zoo,ASZ/TENDER/APFBC/2025/04,2025_PCCF_48000_1,Yes,Open Tender,Supply,Goods,2.0,No,No,Online,No,No,No,1.0,Fee/PreQual/Technical,.pdf,Technical Bid,13-Oct-2025 03:00 PM,03-Nov-2025 01:00 PM,13-Oct-2025 03:00 PM,01-Nov-2025 06:00 PM,NA ,NA ,13-Oct-2025 03:00 PM,01-Nov-2025 06:00 PM,27-Nov-2025 12:25 PM,"76,603",Yes,fixed,,Nil,Nil,1.0,SBI Bank,766.0,Nil,Nil,No,Divisional Forest Officer,"Office of the Divisional Forest Officer, Assam State Zoo Division, Guwahati-05","Supply of Equipments and Logistics (Lot-2) for Rapid Response Team and Community Response Team at Assam State Zoo, Guwahati","Supply of Equipments and Logistics (Lot-2) for Rapid Response Team and Community Response Team at Assam State Zoo, Guwahati",Please refer Tender documents. ,NA ,,Miscellaneous Goods,NA ,Tender,60.0,180.0,Assasm State Zoo,781005.0,Assam State Zoo ,"Office of the Divisional Forest Officer, Assam State Zoo Division, Guwahati-05 ",22-Oct-2025 12:00 PM ,Assam State Zoo,No ,No,AOC,18-May-2026,"INR 2,954,200",180.0,ASHWINI KUMAR,18-May-2026 11:20 AM,FinalWOBiohabLot2.pdf (834.00 KB),1.0,284510.0,BIOHAB INC,INR,"2,954,200",1,285182,Adinath veterinary Products Pvt ltd,01-Nov-2025 12:27 PM,Rejected-Finance,as per PCCF WL approval,18-May-2026 11:15 AM,Finance,Financial Bid Opened for evaluation,ASHWINI KUMAR,27-Nov-2025 12:30 PM,,BOQ Comparative Chart,PCCF WL,Internal,,ASHWINI KUMAR,18-May-2026 11:15 AM,finsummary_76433.pdf (221.31 KB),Pr. Chief Conservator of Forest and Head of Forest Force||Principal Chief Conservator of Forests(Wildlife and Ch. Wildlife Warden)||Divisional Forest Officer - Assam Sate Zoo,2025_PCCF_48000_1,ASZ/TENDER/APFBC/2025/04,"Supply of Equipments and Logistics (Lot-2) for Rapid Response Team and Community Response Team at Assam State Zoo, Guwahati",Technical,Technical Bids opened for evaluation,ASHWINI KUMAR,03-Nov-2025 02:34 PM,,PCCF WL,External,,ASHWINI KUMAR,27-Nov-2025 12:20 PM,27-Nov-2025 12:25 PM,techsummary_76433.pdf (196.47 KB),AOC
,,,,,,,,,,,,,,2.0,Finance,.xls,Financial Bid,,,,,,,,,,,,,,,,,,,,,,,,,,,,,,,,,,,,,,,,,,AOC,,,,,,,,,,,,2,284510,BIOHAB INC,17-Oct-2025 03:59 PM,Accepted-AOC,accepted as per PCCF WL approval,18-May-2026 11:20 AM,,,,,,,,,,,,,,,,,,,,,,,,,,,,,AOC
,,,,,,,,,,,,,,,,,,,,,,,,,,,,,,,,,,,,,,,,,,,,,,,,,,,,,,,,,,,AOC,,,,,,,,,,,,3,284893,BMR WILDLIFE SERVICES,31-Oct-2025 11:23 PM,Rejected-Finance,as per PCCF WL approval,18-May-2026 11:15 AM,,,,,,,,,,,,,,,,,,,,,,,,,,,,,AOC
,,,,,,,,,,,,,,,,,,,,,,,,,,,,,,,,,,,,,,,,,,,,,,,,,,,,,,,,,,,AOC,,,,,,,,,,,,4,284902,DIA-VET BIOTECH PVT. LTD.,01-Nov-2025 02:36 PM,Rejected-Technical,Rejected by the Committee,27-Nov-2025 12:20 PM,,,,,,,,,,,,,,,,,,,,,,,,,,,,,AOC
,,,,,,,,,,,,,,,,,,,,,,,,,,,,,,,,,,,,,,,,,,,,,,,,,,,,,,,,,,,AOC,,,,,,,,,,,,5,285327,East India Consortium,01-Nov-2025 03:56 PM,Rejected-Finance,as per PCCF WL approval,18-May-2026 11:15 AM,,,,,,,,,,,,,,,,,,,,,,,,,,,,,AOC
,,,,,,,,,,,,,,,,,,,,,,,,,,,,,,,,,,,,,,,,,,,,,,,,,,,,,,,,,,,AOC,,,,,,,,,,,,6,285043,R2bytes,31-Oct-2025 04:35 PM,Rejected-Technical,Rejected by the Committee,27-Nov-2025 12:20 PM,,,,,,,,,,,,,,,,,,,,,,,,,,,,,AOC
,,,,,,,,,,,,,,,,,,,,,,,,,,,,,,,,,,,,,,,,,,,,,,,,,,,,,,,,,,,AOC,,,,,,,,,,,,7,285320,SPOKEHUB LLP,01-Nov-2025 02:19 PM,Rejected-Finance,as per PCCF WL approval,18-May-2026 11:15 AM,,,,,,,,,,,,,,,,,,,,,,,,,,,,,AOC
