Organisation Chain,Tender Reference Number,Tender ID,Withdrawal Allowed,Tender Type,Form of contract,Tender Category,No. of Covers,General Technical Evaluation Allowed,ItemWise Technical Evaluation Allowed,Payment Mode,Is Multi Currency Allowed For BOQ,Is Multi Currency Allowed For Fee,Allow Two Stage Bidding,Cover No,Cover,Document Type,Description,Publish Date,Bid Opening Date,Document Download / Sale Start Date,Document Download / Sale End Date,Clarification Start Date,Clarification End Date,Bid Submission Start Date,Bid Submission End Date,Financial Bid Opening Date,EMD Amount in ₹,EMD Exemption Allowed,EMD Fee Type,EMD Percentage,EMD Payable To,EMD Payable At,S.No,Corrigendum Title,Corrigendum Type,View,S.No.1,Bank Name,Tender Fee in ₹,Fee Payable To,Fee Payable At,Tender Fee Exemption Allowed,Name,Address,Title,Work Description,Pre Qualification Details,Independent External Monitor/Remarks,Tender Value in ₹,Product Category,Sub category,Contract Type,Bid Validity(Days),Period Of Work(Days),Location,Pincode,Pre Bid Meeting Place,Pre Bid Meeting Address,Pre Bid Meeting Date,Bid Opening Place,Should Allow NDA Tender,Allow Preferential Bidder,Organisation Chain,Tender Reference Number,Tender ID,Withdrawal Allowed,Tender Type,Form of contract,Tender Category,No. of Covers,General Technical Evaluation Allowed,ItemWise Technical Evaluation Allowed,Payment Mode,Is Multi Currency Allowed For BOQ,Is Multi Currency Allowed For Fee,Allow Two Stage Bidding,Cover No,Cover,Document Type,Description,Publish Date,Bid Opening Date,Document Download / Sale Start Date,Document Download / Sale End Date,Clarification Start Date,Clarification End Date,Bid Submission Start Date,Bid Submission End Date,Financial Bid Opening Date,EMD Amount in ₹,EMD Exemption Allowed,EMD Fee Type,EMD Percentage,EMD Payable To,EMD Payable At,S.No,Corrigendum Title,Corrigendum Type,View,S.No.1,Bank Name,Tender Fee in ₹,Fee Payable To,Fee Payable At,Tender Fee Exemption Allowed,Name,Address,Title,Work Description,Pre Qualification Details,Independent External Monitor/Remarks,Tender Value in ₹,Product Category,Sub category,Contract Type,Bid Validity(Days),Period Of Work(Days),Location,Pincode,Pre Bid Meeting Place,Pre Bid Meeting Address,Pre Bid Meeting Date,Bid Opening Place,Should Allow NDA Tender,Allow Preferential Bidder,Contract Date :,Contract Value :,Work Completion Period in days :,Updated By :,Updated on :,AOC document :,AOC Description :,S.No.2,Bid Number,Bidder Name,Awarded Currency,Awarded Value,S.No.3,Bid Number.1,Bidder Name.1,Submitted Date,Status,Remarks,Status Updated On,Type :,Summary :,Updated By :.1,Updated On :,Document :,BOQ Comparative Chart :,Committee Chairperson/Co-ordinator Name :,Committee Chairperson/Co-ordinator Type :,Committee Members :,Updated By :.2,Updated on :.1,Document :.1,S.No.4,Bid Number.2,Bidder Name.2,Value,Rank,Type :.1,Summary :.1,Updated By :.3,Updated On :.1,Document :.2,Committee Chairperson/Co-ordinator Name :.1,Committee Chairperson/Co-ordinator Type :.1,Committee Members :.1,Updated By :.4,Updated On :.2,Financial Bid Opening Date:,Document :.3,Tender ID :,Tender Ref No :,Tender Title :
Pr. Chief Conservator of Forest and Head of Forest Force||Principal Chief Conservator of Forests(Wildlife and Ch. Wildlife Warden)||Divisional Forest Officer - Assam Sate Zoo,Z/CAMPA/TENDER/A.S.ZOO/399,2024_PCCF_37239_1,Yes,Open Tender,Works,Works,2.0,No,No,Online,No,No,No,1.0,Fee/PreQual/Technical,.pdf,TECHNICAL BID,14-Mar-2024 04:00 PM,06-Apr-2024 12:00 PM,14-Mar-2024 04:00 PM,05-Apr-2024 06:00 PM,NA ,NA ,15-Mar-2024 09:00 AM,05-Apr-2024 06:00 PM,31-May-2024 05:05 PM,"51,060",Yes,percentage,2.0%,Nil,Nil,1.0,VULTURE ESTIMATE AND DRAWING,Other,,1.0,SBI Bank,510.0,Nil,Nil,Yes,"Divisional Forest Officer, Assam State Zoo Divisio","Office of the Divisional Forest Officer, Assam State Zoo Division, Guwahati-05",Construction of Release Aviary for Vulture at Nalapara under Rani Range,Construction of Release Aviary for Vulture at Nalapara under Rani Range,Please refer Tender documents. ,NA ,"25,53,000",Civil Works,NA ,Tender,120.0,180.0,Rani,781131.0,NA ,NA ,NA ,Assam State Zoo,No ,No,Pr. Chief Conservator of Forest and Head of Forest Force||Principal Chief Conservator of Forests(Wildlife and Ch. Wildlife Warden)||Divisional Forest Officer - Assam Sate Zoo,Z/CAMPA/TENDER/A.S.ZOO/399,2024_PCCF_37239_1,Yes,Open Tender,Works,Works,2.0,No,No,Online,No,No,No,1.0,Fee/PreQual/Technical,.pdf,TECHNICAL BID,14-Mar-2024 04:00 PM,06-Apr-2024 12:00 PM,14-Mar-2024 04:00 PM,05-Apr-2024 06:00 PM,NA ,NA ,15-Mar-2024 09:00 AM,05-Apr-2024 06:00 PM,31-May-2024 05:05 PM,"51,060",Yes,percentage,2.0%,Nil,Nil,1.0,VULTURE ESTIMATE AND DRAWING,Other,,1.0,SBI Bank,510.0,Nil,Nil,Yes,"Divisional Forest Officer, Assam State Zoo Divisio","Office of the Divisional Forest Officer, Assam State Zoo Division, Guwahati-05",Construction of Release Aviary for Vulture at Nalapara under Rani Range,Construction of Release Aviary for Vulture at Nalapara under Rani Range,Please refer Tender documents. ,NA ,"25,53,000",Civil Works,NA ,Tender,120.0,180.0,Rani,781131.0,NA ,NA ,NA ,Assam State Zoo,No ,No,04-Oct-2024,"INR 2,297,700",180.0,ASHWINI KUMAR,04-Oct-2024 12:53 PM,AOC.pdf (721.00 KB),Awarded the contract as per PCCF order,1.0,232061.0,J D ASSOCIATES,INR,"2,297,700",1.0,232111.0,Jahirul Aziz Ahmed,05-Apr-2024 04:22 PM,Rejected-Technical,REQUIRED DOCUMENTS NOT SUBMITTED,31-May-2024 05:02 PM,Finance,FINANCIAL BID OPENED FOR EVALUATION,ASHWINI KUMAR,31-May-2024 05:21 PM,None,BOQ Comparative Chart,JAYANTA KUMAR GOSWAMI,Internal,,ASHWINI KUMAR,04-Oct-2024 12:46 PM,finsummary_60662.pdf (521.96 KB),1.0,231758.0,STANDARD CREATION,"22,97,700.00",3rd,Technical,BID RECEIVED FOR EVALUATION,JAYANTA KUMAR GOSWAMI,06-Apr-2024 02:47 PM,None,JAYANTA KUMAR GOSWAMI,Internal,,JAYANTA KUMAR GOSWAMI,31-May-2024 05:02 PM,31-May-2024 05:05 PM,techsummary_60662.pdf (369.93 KB),,,
,,,,,,,,,,,,,,2.0,Finance,.xls,FINANCIAL BID,,,,,,,,,,,,,,,,,,,,,,,,,,,,,,,,,,,,,,,,,,,,,,,,,,,,,,,,,,,,2.0,Finance,.xls,FINANCIAL BID,,,,,,,,,,,,,,,,,,,,,,,,,,,,,,,,,,,,,,,,,,,,,,,,,,,,,,,,,,2.0,232061.0,J D ASSOCIATES,05-Apr-2024 02:26 PM,Accepted-AOC,Awarded,04-Oct-2024 12:53 PM,,,,,,,,,,,,,2.0,232026.0,RISHAV BARMAN,"22,97,700.00",2nd,,,,,,,,,,,,,,,
,,,,,,,,,,,,,,,,,,,,,,,,,,,,,,,,,,,,,,,,,,,,,,,,,,,,,,,,,,,,,,,,,,,,,,,,,,,,,,,,,,,,,,,,,,,,,,,,,,,,,,,,,,,,,,,,,,,,,,,,,,,,,,,,,,,,,,,,,,3.0,232108.0,Rajib Ahmed,05-Apr-2024 04:14 PM,Rejected-Technical,REQUIRED DOCUMENTS NOT SUBMITTED,31-May-2024 05:02 PM,,,,,,,,,,,,,3.0,232061.0,J D ASSOCIATES,"22,97,700.00",1st,,,,,,,,,,,,,,,
,,,,,,,,,,,,,,,,,,,,,,,,,,,,,,,,,,,,,,,,,,,,,,,,,,,,,,,,,,,,,,,,,,,,,,,,,,,,,,,,,,,,,,,,,,,,,,,,,,,,,,,,,,,,,,,,,,,,,,,,,,,,,,,,,,,,,,,,,,4.0,232026.0,RISHAV BARMAN,05-Apr-2024 03:25 PM,Rejected-Finance,Turnover lowest than the L1,04-Oct-2024 12:46 PM,,,,,,,,,,,,,,,,,,,,,,,,,,,,,,,,
,,,,,,,,,,,,,,,,,,,,,,,,,,,,,,,,,,,,,,,,,,,,,,,,,,,,,,,,,,,,,,,,,,,,,,,,,,,,,,,,,,,,,,,,,,,,,,,,,,,,,,,,,,,,,,,,,,,,,,,,,,,,,,,,,,,,,,,,,,5.0,231758.0,STANDARD CREATION,03-Apr-2024 04:29 PM,Rejected-Finance,Turnover lowest than the L1,04-Oct-2024 12:46 PM,,,,,,,,,,,,,,,,,,,,,,,,,,,,,,,,
,,,,,,,,,,,,,,,,,,,,,,,,,,,,,,,,,,,,,,,,,,,,,,,,,,,,,,,,,,,,,,,,,,,,,,,,,,,,,,,,,,,,,,,,,,,,,,,,,,,,,,,,,,,,,,,,,,,,,,,,,,,,,,,,,,,,,,,,,,,,,,,,,,,,,,,,,,,,,,,,,,,,,,,,,,,,,,2024_PCCF_37239_1,Z/CAMPA/TENDER/A.S.ZOO/399,Construction of Release Aviary for Vulture at Nalapara under Rani Range
