Organisation Chain,Tender Reference Number,Tender ID,Withdrawal Allowed,Tender Type,Form of contract,Tender Category,No. of Covers,General Technical Evaluation Allowed,ItemWise Technical Evaluation Allowed,Payment Mode,Is Multi Currency Allowed For BOQ,Is Multi Currency Allowed For Fee,Allow Two Stage Bidding,Cover No,Cover,Document Type,Description,Publish Date,Bid Opening Date,Document Download / Sale Start Date,Document Download / Sale End Date,Clarification Start Date,Clarification End Date,Bid Submission Start Date,Bid Submission End Date,Financial Bid Opening Date,EMD Amount in ₹,EMD Exemption Allowed,EMD Fee Type,EMD Percentage,EMD Payable To,EMD Payable At,S.No,Bank Name,Tender Fee in ₹,Fee Payable To,Fee Payable At,Tender Fee Exemption Allowed,Name,Address,Title,Work Description,Pre Qualification Details,Independent External Monitor/Remarks,Tender Value in ₹,Product Category,Sub category,Contract Type,Bid Validity(Days),Period Of Work(Days),Location,Pincode,Pre Bid Meeting Place,Pre Bid Meeting Address,Pre Bid Meeting Date,Bid Opening Place,Should Allow NDA Tender,Allow Preferential Bidder,Organisation Chain,Tender Reference Number,Tender ID,Withdrawal Allowed,Tender Type,Form of contract,Tender Category,No. of Covers,General Technical Evaluation Allowed,ItemWise Technical Evaluation Allowed,Payment Mode,Is Multi Currency Allowed For BOQ,Is Multi Currency Allowed For Fee,Allow Two Stage Bidding,Cover No,Cover,Document Type,Description,Publish Date,Bid Opening Date,Document Download / Sale Start Date,Document Download / Sale End Date,Clarification Start Date,Clarification End Date,Bid Submission Start Date,Bid Submission End Date,Financial Bid Opening Date,EMD Amount in ₹,EMD Exemption Allowed,EMD Fee Type,EMD Percentage,EMD Payable To,EMD Payable At,S.No,Bank Name,Tender Fee in ₹,Fee Payable To,Fee Payable At,Tender Fee Exemption Allowed,Name,Address,Title,Work Description,Pre Qualification Details,Independent External Monitor/Remarks,Tender Value in ₹,Product Category,Sub category,Contract Type,Bid Validity(Days),Period Of Work(Days),Location,Pincode,Pre Bid Meeting Place,Pre Bid Meeting Address,Pre Bid Meeting Date,Bid Opening Place,Should Allow NDA Tender,Allow Preferential Bidder,Contract Date :,Contract Value :,Work Completion Period in days :,Updated By :,Updated on :,AOC document :,S.No.1,Bid Number,Bidder Name,Awarded Currency,Awarded Value,S.No.2,Bid Number.1,Bidder Name.1,Submitted Date,Status,Remarks,Status Updated On,Type :,Summary :,Updated By :.1,Updated On :,Document :,BOQ Comparative Chart :,Committee Chairperson/Co-ordinator Name :,Committee Chairperson/Co-ordinator Type :,Committee Members :,Updated By :.2,Updated on :.1,Document :.1,S.No.3,Bid Number.2,Bidder Name.2,Value,Rank,Type :.1,Summary :.1,Updated By :.3,Updated On :.1,Document :.2,Committee Chairperson/Co-ordinator Name :.1,Committee Chairperson/Co-ordinator Type :.1,Committee Members :.1,Updated By :.4,Updated On :.2,Financial Bid Opening Date:,Document :.3,Tender ID :,Tender Ref No :,Tender Title :
Public Works Roads Department,T/DRC/MMPNA/2023-24/1094,2023_PWD_34328_2,Yes,Open Tender,Item Rate,Works,2.0,No,No,Online,No,No,No,1.0,Fee/PreQual/Technical,.pdf,Standard Bidding Document,01-Dec-2023 05:00 PM,11-Dec-2023 01:00 PM,01-Dec-2023 05:00 PM,08-Dec-2023 04:00 PM,01-Dec-2023 05:00 PM ,08-Dec-2023 04:00 PM ,01-Dec-2023 05:00 PM,08-Dec-2023 04:00 PM,09-Jan-2024 01:20 PM,"74,840",Yes,fixed,,Nil,Nil,1.0,SBI Bank,"1,200",Nil,Nil,No,"SE, PWD, Darrang Road Circle, Mangaldoi","O/o the SE, PWD, Darrang Road Circle, Mangaldoi",MMPNA_MLD_23_24_II Periodic Renewal of Na-Howly to NH15 Road under MMPNA for the year 2023-24 under Mangaldai LAC,MMPNA_MLD_23_24_II Periodic Renewal of Na-Howly to NH15 Road under MMPNA for the year 2023-24 under Mangaldai LAC,Please refer Tender documents. ,NA ,"37,42,000",Civil Works,NA ,Tender,180.0,180.0,Darrang,784125.0,NA ,NA ,NA ,"O/o the SE, PWD, Darrang Road Circle, Mangaldoi",No ,No,Public Works Roads Department,T/DRC/MMPNA/2023-24/1094,2023_PWD_34328_2,Yes,Open Tender,Item Rate,Works,2.0,No,No,Online,No,No,No,1.0,Fee/PreQual/Technical,.pdf,Standard Bidding Document,01-Dec-2023 05:00 PM,11-Dec-2023 01:00 PM,01-Dec-2023 05:00 PM,08-Dec-2023 04:00 PM,01-Dec-2023 05:00 PM ,08-Dec-2023 04:00 PM ,01-Dec-2023 05:00 PM,08-Dec-2023 04:00 PM,09-Jan-2024 01:20 PM,"74,840",Yes,fixed,,Nil,Nil,1.0,SBI Bank,"1,200",Nil,Nil,No,"SE, PWD, Darrang Road Circle, Mangaldoi","O/o the SE, PWD, Darrang Road Circle, Mangaldoi",MMPNA_MLD_23_24_II Periodic Renewal of Na-Howly to NH15 Road under MMPNA for the year 2023-24 under Mangaldai LAC,MMPNA_MLD_23_24_II Periodic Renewal of Na-Howly to NH15 Road under MMPNA for the year 2023-24 under Mangaldai LAC,Please refer Tender documents. ,NA ,"37,42,000",Civil Works,NA ,Tender,180.0,180.0,Darrang,784125.0,NA ,NA ,NA ,"O/o the SE, PWD, Darrang Road Circle, Mangaldoi",No ,No,28-Oct-2024,"INR 3,367,800",180.0,Supriya Baruah,28-Oct-2024 03:39 PM,AOC1.pdf (369.00 KB),1.0,214522.0,SRI MANOJ KUMAR SARMA,INR,"3,367,800",1.0,214382.0,M/s N B ENTERPRISE,07-Dec-2023 03:18 PM,Not Admitted-Fee/PreQual/Technical,Not Complied with technical specification,09-Jan-2024 12:16 PM,Finance,Verified,Pranab Kumar Sarmah,09-Jan-2024 03:22 PM,None,BOQ Comparative Chart,Dipak Kr Baishya,Internal,"Supriya Baruah AE, Pranab Kr Sarma AE",Supriya Baruah,28-Oct-2024 03:33 PM,finsummary_55498.pdf (115.13 KB),1.0,214522.0,SRI MANOJ KUMAR SARMA,"33,67,800.00",L1,Technical,Verified,Pranab Kumar Sarmah,09-Jan-2024 12:16 PM,None,Dipak Kr Baishya,Internal,,Pranab Kumar Sarmah,09-Jan-2024 01:15 PM,09-Jan-2024 01:20 PM,techsummary_55498.pdf (111.80 KB),,,
,,,,,,,,,,,,,,,,.pdf,Technical Qualification Details,,,,,,,,,,,,,,,,,,,,,,,,,,,,,,,,,,,,,,,,,,,,,,,,,,,,,,,,,,.pdf,Technical Qualification Details,,,,,,,,,,,,,,,,,,,,,,,,,,,,,,,,,,,,,,,,,,,,,,,,,,,,,2.0,214522.0,SRI MANOJ KUMAR SARMA,07-Dec-2023 10:20 PM,Accepted-AOC,accepted,28-Oct-2024 03:39 PM,,,,,,,,,,,,,2.0,214562.0,SRI TARUN DEKA,"33,67,800.00",L1,,,,,,,,,,,,,,,
,,,,,,,,,,,,,,2.0,Finance,.xls,Bill of Quantities,,,,,,,,,,,,,,,,,,,,,,,,,,,,,,,,,,,,,,,,,,,,,,,,,,,,,,,,2.0,Finance,.xls,Bill of Quantities,,,,,,,,,,,,,,,,,,,,,,,,,,,,,,,,,,,,,,,,,,,,,,,,,,,,,3.0,214562.0,SRI TARUN DEKA,08-Dec-2023 01:19 PM,Rejected-AOC,accepted,28-Oct-2024 03:39 PM,,,,,,,,,,,,,,,,,,,,,,,,,,,,,,,,
,,,,,,,,,,,,,,,,.pdf,Form of Bid,,,,,,,,,,,,,,,,,,,,,,,,,,,,,,,,,,,,,,,,,,,,,,,,,,,,,,,,,,.pdf,Form of Bid,,,,,,,,,,,,,,,,,,,,,,,,,,,,,,,,,,,,,,,,,,,,,,,,,,,,,,,,,,,,,,,,,,,,,,,,,,,,,,,,,,,,,,,,,,,
,,,,,,,,,,,,,,,,,,,,,,,,,,,,,,,,,,,,,,,,,,,,,,,,,,,,,,,,,,,,,,,,,,,,,,,,,,,,,,,,,,,,,,,,,,,,,,,,,,,,,,,,,,,,,,,,,,,,,,,,,,,,,,,,,,,,,,,,,,,,,,,,,,,,,,,,,,,,,,,,,,,,,2023_PWD_34328_2,T/DRC/MMPNA/2023-24/1094,MMPNA_MLD_23_24_II Periodic Renewal of Na-Howly to NH15 Road under MMPNA for the year 2023-24 under Mangaldai LAC
