Organisation Chain,Tender Reference Number,Tender ID,Withdrawal Allowed,Tender Type,Form of contract,Tender Category,No. of Covers,General Technical Evaluation Allowed,ItemWise Technical Evaluation Allowed,Payment Mode,Is Multi Currency Allowed For BOQ,Is Multi Currency Allowed For Fee,Allow Two Stage Bidding,Cover No,Cover,Document Type,Description,Publish Date,Bid Opening Date,Document Download / Sale Start Date,Document Download / Sale End Date,Clarification Start Date,Clarification End Date,Bid Submission Start Date,Bid Submission End Date,Financial Bid Opening Date,EMD Amount in ₹,EMD Exemption Allowed,EMD Fee Type,EMD Percentage,EMD Payable To,EMD Payable At,S.No,Bank Name,Tender Fee in ₹,Fee Payable To,Fee Payable At,Tender Fee Exemption Allowed,Name,Address,Title,Work Description,Pre Qualification Details,Independent External Monitor/Remarks,Tender Value in ₹,Product Category,Sub category,Contract Type,Bid Validity(Days),Period Of Work(Days),Location,Pincode,Pre Bid Meeting Place,Pre Bid Meeting Address,Pre Bid Meeting Date,Bid Opening Place,Should Allow NDA Tender,Allow Preferential Bidder,Organisation Chain,Tender Reference Number,Tender ID,Withdrawal Allowed,Tender Type,Form of contract,Tender Category,No. of Covers,General Technical Evaluation Allowed,ItemWise Technical Evaluation Allowed,Payment Mode,Is Multi Currency Allowed For BOQ,Is Multi Currency Allowed For Fee,Allow Two Stage Bidding,Cover No,Cover,Document Type,Description,Publish Date,Bid Opening Date,Document Download / Sale Start Date,Document Download / Sale End Date,Clarification Start Date,Clarification End Date,Bid Submission Start Date,Bid Submission End Date,Financial Bid Opening Date,EMD Amount in ₹,EMD Exemption Allowed,EMD Fee Type,EMD Percentage,EMD Payable To,EMD Payable At,S.No,Bank Name,Tender Fee in ₹,Fee Payable To,Fee Payable At,Tender Fee Exemption Allowed,Name,Address,Title,Work Description,Pre Qualification Details,Independent External Monitor/Remarks,Tender Value in ₹,Product Category,Sub category,Contract Type,Bid Validity(Days),Period Of Work(Days),Location,Pincode,Pre Bid Meeting Place,Pre Bid Meeting Address,Pre Bid Meeting Date,Bid Opening Place,Should Allow NDA Tender,Allow Preferential Bidder,Contract Date :,Contract Value :,Work Completion Period in days :,Updated By :,Updated on :,AOC document :,S.No.1,Bid Number,Bidder Name,Awarded Currency,Awarded Value,S.No.2,Bid Number.1,Bidder Name.1,Submitted Date,Status,Remarks,Status Updated On,Type :,Summary :,Updated By :.1,Updated On :,Document :,BOQ Comparative Chart :,Committee Chairperson/Co-ordinator Name :,Committee Chairperson/Co-ordinator Type :,Committee Members :,Updated By :.2,Updated on :.1,Document :.1,S.No.3,Bid Number.2,Bidder Name.2,Value,Rank,Type :.1,Summary :.1,Updated By :.3,Updated On :.1,Document :.2,Committee Chairperson/Co-ordinator Name :.1,Committee Chairperson/Co-ordinator Type :.1,Committee Members :.1,Updated By :.4,Updated On :.2,Financial Bid Opening Date:,Document :.3,Tender ID :,Tender Ref No :,Tender Title :
Public Works Roads Department-Externally Aided Project||Public Works Road Department- World Bank Funded Tenders||Assam State Bridge Infrastructure Program,CE/EAP/ARRBP/111TENDERS/2023/5,2023_PWRDW_32120_6,Yes,Open Tender,Item Rate,Works,2.0,No,No,Online,No,No,No,1.0,Fee/PreQual/Technical,.pdf,Standard Bidding Document,18-Aug-2023 04:40 PM,20-Sep-2023 02:30 PM,18-Aug-2023 04:40 PM,20-Sep-2023 02:00 PM,18-Aug-2023 04:45 PM ,23-Aug-2023 11:00 AM ,18-Aug-2023 04:45 PM,20-Sep-2023 02:00 PM,16-Dec-2023 11:00 AM,"6,57,000",Yes,fixed,,Nil,Nil,1.0,SBI Bank,"5,000",Nil,Nil,Yes,"Chief Engineer, (EAP) PWRD, Assam","O/o the Chief Engineer, (EAP) PWRD, Assam, Fatasil Ambari, Guwahati-25",Construction of Bridge in Sivasagar district i) Br. No. 1/1 on Chenimora to Nowjan,CE/EAP/ARRBP/OCB/Bridge-1/Sivasagar/04 Construction of Bridge in Sivasagar district i) Br. No. 1/1 on Chenimora to Nowjan,Please refer Tender documents. ,NA ,"3,28,29,000",Civil Works - Bridges,NA ,Tender,90.0,540.0,Sibsagar,785640.0,"O/o the Chief Engineer, (EAP) PWRD, Assam ","O/o the Chief Engineer, (EAP) PWRD, Assam, Fatasil Ambari, Guwahati-25 ",23-Aug-2023 11:00 AM ,"O/o the Chief Engineer, (EAP) PWRD, Assam",No ,No,Public Works Roads Department-Externally Aided Project||Public Works Road Department- World Bank Funded Tenders||Assam State Bridge Infrastructure Program,CE/EAP/ARRBP/111TENDERS/2023/5,2023_PWRDW_32120_6,Yes,Open Tender,Item Rate,Works,2.0,No,No,Online,No,No,No,1.0,Fee/PreQual/Technical,.pdf,Standard Bidding Document,18-Aug-2023 04:40 PM,20-Sep-2023 02:30 PM,18-Aug-2023 04:40 PM,20-Sep-2023 02:00 PM,18-Aug-2023 04:45 PM ,23-Aug-2023 11:00 AM ,18-Aug-2023 04:45 PM,20-Sep-2023 02:00 PM,16-Dec-2023 11:00 AM,"6,57,000",Yes,fixed,,Nil,Nil,1.0,SBI Bank,"5,000",Nil,Nil,Yes,"Chief Engineer, (EAP) PWRD, Assam","O/o the Chief Engineer, (EAP) PWRD, Assam, Fatasil Ambari, Guwahati-25",Construction of Bridge in Sivasagar district i) Br. No. 1/1 on Chenimora to Nowjan,CE/EAP/ARRBP/OCB/Bridge-1/Sivasagar/04 Construction of Bridge in Sivasagar district i) Br. No. 1/1 on Chenimora to Nowjan,Please refer Tender documents. ,NA ,"3,28,29,000",Civil Works - Bridges,NA ,Tender,90.0,540.0,Sibsagar,785640.0,"O/o the Chief Engineer, (EAP) PWRD, Assam ","O/o the Chief Engineer, (EAP) PWRD, Assam, Fatasil Ambari, Guwahati-25 ",23-Aug-2023 11:00 AM ,"O/o the Chief Engineer, (EAP) PWRD, Assam",No ,No,25-Oct-2024,"INR 34,467,491.86",540.0,Sanjita Bodo,25-Oct-2024 04:32 PM,Sivasagar_04_Work_Order.pdf (72.00 KB),1.0,201925.0,TARUN CHETIA,INR,"34,467,491.86",1.0,201896.0,Sri Jintu Dutta,20-Sep-2023 12:48 PM,Rejected-Technical,Non-Responsive,13-Dec-2023 06:46 PM,Finance,Financial Bid opened,Pallavi Chakravorty,16-Dec-2023 11:49 AM,None,BOQ Comparative Chart,"Chief Engineer (EAP), PWRD",Internal,,Sanjita Bodo,25-Oct-2024 04:27 PM,finsummary_51587.pdf (95.08 KB),1.0,201925.0,TARUN CHETIA,"3,44,67,491.86",L1,Technical,Technical Bid opened,Sanjita Bodo,21-Sep-2023 04:55 PM,None,"Chief Engineer (EAP), PWRD",Internal,,Sanjita Bodo,13-Dec-2023 06:46 PM,16-Dec-2023 11:00 AM,techsummary_51587.pdf (191.19 KB),,,
,,,,,,,,,,,,,,,,.pdf,Technical Qualification Details,,,,,,,,,,,,,,,,,,,,,,,,,,,,,,,,,,,,,,,,,,,,,,,,,,,,,,,,,,.pdf,Technical Qualification Details,,,,,,,,,,,,,,,,,,,,,,,,,,,,,,,,,,,,,,,,,,,,,,,,,,,,,2.0,201925.0,TARUN CHETIA,20-Sep-2023 01:56 PM,Accepted-AOC,L1,25-Oct-2024 04:32 PM,,,,,,,,,,,,,,,,,,,,,,,,,,,,,,,,
,,,,,,,,,,,,,,,,.pdf,Letter of Technical Bid,,,,,,,,,,,,,,,,,,,,,,,,,,,,,,,,,,,,,,,,,,,,,,,,,,,,,,,,,,.pdf,Letter of Technical Bid,,,,,,,,,,,,,,,,,,,,,,,,,,,,,,,,,,,,,,,,,,,,,,,,,,,,,,,,,,,,,,,,,,,,,,,,,,,,,,,,,,,,,,,,,,,
,,,,,,,,,,,,,,2.0,Finance,.xls,BOQ,,,,,,,,,,,,,,,,,,,,,,,,,,,,,,,,,,,,,,,,,,,,,,,,,,,,,,,,2.0,Finance,.xls,BOQ,,,,,,,,,,,,,,,,,,,,,,,,,,,,,,,,,,,,,,,,,,,,,,,,,,,,,,,,,,,,,,,,,,,,,,,,,,,,,,,,,,,,,,,,,,,
,,,,,,,,,,,,,,,,.pdf,"Letter of Bid, Financial",,,,,,,,,,,,,,,,,,,,,,,,,,,,,,,,,,,,,,,,,,,,,,,,,,,,,,,,,,.pdf,"Letter of Bid, Financial",,,,,,,,,,,,,,,,,,,,,,,,,,,,,,,,,,,,,,,,,,,,,,,,,,,,,,,,,,,,,,,,,,,,,,,,,,,,,,,,,,,,,,,,,,,
,,,,,,,,,,,,,,,,,,,,,,,,,,,,,,,,,,,,,,,,,,,,,,,,,,,,,,,,,,,,,,,,,,,,,,,,,,,,,,,,,,,,,,,,,,,,,,,,,,,,,,,,,,,,,,,,,,,,,,,,,,,,,,,,,,,,,,,,,,,,,,,,,,,,,,,,,,,,,,,,,,,,,2023_PWRDW_32120_6,CE/EAP/ARRBP/111TENDERS/2023/5,Construction of Bridge in Sivasagar district i) Br. No. 1/1 on Chenimora to Nowjan
