Organisation Chain,Tender Reference Number,Tender ID,Withdrawal Allowed,Tender Type,Form of contract,Tender Category,No. of Covers,General Technical Evaluation Allowed,ItemWise Technical Evaluation Allowed,Payment Mode,Is Multi Currency Allowed For BOQ,Is Multi Currency Allowed For Fee,Allow Two Stage Bidding,Cover No,Cover,Document Type,Description,Publish Date,Bid Opening Date,Document Download / Sale Start Date,Document Download / Sale End Date,Clarification Start Date,Clarification End Date,Bid Submission Start Date,Bid Submission End Date,Financial Bid Opening Date,EMD Amount in ₹,EMD Exemption Allowed,EMD Fee Type,EMD Percentage,EMD Payable To,EMD Payable At,S.No,Bank Name,Tender Fee in ₹,Fee Payable To,Fee Payable At,Tender Fee Exemption Allowed,Name,Address,Title,Work Description,Pre Qualification Details,Independent External Monitor/Remarks,Tender Value in ₹,Product Category,Sub category,Contract Type,Bid Validity(Days),Period Of Work(Days),Location,Pincode,Pre Bid Meeting Place,Pre Bid Meeting Address,Pre Bid Meeting Date,Bid Opening Place,Should Allow NDA Tender,Allow Preferential Bidder,Organisation Chain,Tender Reference Number,Tender ID,Withdrawal Allowed,Tender Type,Form of contract,Tender Category,No. of Covers,General Technical Evaluation Allowed,ItemWise Technical Evaluation Allowed,Payment Mode,Is Multi Currency Allowed For BOQ,Is Multi Currency Allowed For Fee,Allow Two Stage Bidding,Cover No,Cover,Document Type,Description,Publish Date,Bid Opening Date,Document Download / Sale Start Date,Document Download / Sale End Date,Clarification Start Date,Clarification End Date,Bid Submission Start Date,Bid Submission End Date,Financial Bid Opening Date,EMD Amount in ₹,EMD Exemption Allowed,EMD Fee Type,EMD Percentage,EMD Payable To,EMD Payable At,S.No,Bank Name,Tender Fee in ₹,Fee Payable To,Fee Payable At,Tender Fee Exemption Allowed,Name,Address,Title,Work Description,Pre Qualification Details,Independent External Monitor/Remarks,Tender Value in ₹,Product Category,Sub category,Contract Type,Bid Validity(Days),Period Of Work(Days),Location,Pincode,Pre Bid Meeting Place,Pre Bid Meeting Address,Pre Bid Meeting Date,Bid Opening Place,Should Allow NDA Tender,Allow Preferential Bidder,Contract Date :,Contract Value :,Work Completion Period in days :,Updated By :,Updated on :,AOC document :,AOC Description :,S.No.1,Bid Number,Bidder Name,Awarded Currency,Awarded Value,S.No.2,Bid Number.1,Bidder Name.1,Submitted Date,Status,Remarks,Status Updated On,Type :,Summary :,Updated By :.1,Updated On :,Document :,BOQ Comparative Chart :,Committee Chairperson/Co-ordinator Name :,Committee Chairperson/Co-ordinator Type :,Committee Members :,Updated By :.2,Updated on :.1,Document :.1,S.No.3,Bid Number.2,Bidder Name.2,Value,Rank,Type :.1,Summary :.1,Updated By :.3,Updated On :.1,Document :.2,Committee Chairperson/Co-ordinator Name :.1,Committee Chairperson/Co-ordinator Type :.1,Committee Members :.1,Updated By :.4,Updated On :.2,Financial Bid Opening Date:,Document :.3,Tender ID :,Tender Ref No :,Tender Title :
Bodoland Territorial Council||Agriculture-BTC,DA/BTC/K/e-Tender/2023-24/29,2023_BoTC_32453_1,Yes,Open Tender,Supply,Goods,2.0,No,No,Online,No,No,No,1.0,Fee/PreQual/Technical,.pdf,Scanned copy of Bid documents with sealed and signed wherever applicable,13-Sep-2023 10:00 AM,27-Sep-2023 03:00 PM,13-Sep-2023 10:00 AM,27-Sep-2023 02:00 PM,13-Sep-2023 10:00 AM ,27-Sep-2023 02:00 PM ,13-Sep-2023 10:00 AM,27-Sep-2023 02:00 PM,29-Sep-2023 12:00 PM,"98,410",Yes,percentage,2.0%,Nil,Nil,1.0,SBI Bank,"1,000",Nil,Nil,No,"Director of Agriculture, BTC, Kokrajhar","O/o the Director of Agriculture, BTC, Kokrajhar","Supply of Strawberry (Tissue Culture) Sapling under Horticulture and Vegetable crops, SOPD for the year 2023-24.","Supply of Strawberry (Tissue Culture) Sapling under Horticulture and Vegetable crops, SOPD for the year 2023-24.",Please refer Tender documents. ,NA ,"49,20,480",Crop Products,NA ,Tender,90.0,60.0,"O/o the Director of Agriculture, BTC, Kokrajhar",783370.0,NA ,NA ,NA ,"O/o the Director of Agriculture, BTC, Kokrajhar",No ,No,Bodoland Territorial Council||Agriculture-BTC,DA/BTC/K/e-Tender/2023-24/29,2023_BoTC_32453_1,Yes,Open Tender,Supply,Goods,2.0,No,No,Online,No,No,No,1.0,Fee/PreQual/Technical,.pdf,Scanned copy of Bid documents with sealed and signed wherever applicable,13-Sep-2023 10:00 AM,27-Sep-2023 03:00 PM,13-Sep-2023 10:00 AM,27-Sep-2023 02:00 PM,13-Sep-2023 10:00 AM ,27-Sep-2023 02:00 PM ,13-Sep-2023 10:00 AM,27-Sep-2023 02:00 PM,29-Sep-2023 12:00 PM,"98,410",Yes,percentage,2.0%,Nil,Nil,1.0,SBI Bank,"1,000",Nil,Nil,No,"Director of Agriculture, BTC, Kokrajhar","O/o the Director of Agriculture, BTC, Kokrajhar","Supply of Strawberry (Tissue Culture) Sapling under Horticulture and Vegetable crops, SOPD for the year 2023-24.","Supply of Strawberry (Tissue Culture) Sapling under Horticulture and Vegetable crops, SOPD for the year 2023-24.",Please refer Tender documents. ,NA ,"49,20,480",Crop Products,NA ,Tender,90.0,60.0,"O/o the Director of Agriculture, BTC, Kokrajhar",783370.0,NA ,NA ,NA ,"O/o the Director of Agriculture, BTC, Kokrajhar",No ,No,26-Oct-2023,"INR 4,920,480",60.0,Jaydhaj Narzary,25-Oct-2024 12:22 PM,AOC.pdf (656.00 KB),Award of Contract,1.0,202146.0,Anil Hardware and Nursery Enterprise,INR,"4,920,480",1.0,202146.0,Anil Hardware and Nursery Enterprise,26-Sep-2023 02:25 PM,Accepted-AOC,Lowest rate bidder,25-Oct-2024 12:22 PM,Finance,Financial Bid Opened,Jaydhaj Narzary,29-Sep-2023 02:25 PM,None,BOQ Comparative Chart,Sri Phanidhar Brahma,Internal,"Sri S. Ch. Das, Sri R. Kakati, Sri S.P. Verma, Sri M.N. Das",Jaydhaj Narzary,26-Oct-2023 01:59 PM,finsummary_52113.pdf (1603.56 KB),1.0,202145.0,M/s S. N Enterprise,76.0,L3,Technical,Technical Bid Opened,Jaydhaj Narzary,28-Sep-2023 06:26 AM,None,Sri Phanidhar Brahma,Internal,"Sri S. Ch. Das, Sri R. Kakati, Sri S.P. Verma, Sri M.N. Das",Jaydhaj Narzary,29-Sep-2023 11:38 AM,29-Sep-2023 12:00 PM,techsummary_52113.pdf (611.14 KB),,,
,,,,,,,,,,,,,,,,.pdf,Scanned copy of Technical qualification documents with sealed and signed in each document,,,,,,,,,,,,,,,,,,,,,,,,,,,,,,,,,,,,,,,,,,,,,,,,,,,,,,,,,,.pdf,Scanned copy of Technical qualification documents with sealed and signed in each document,,,,,,,,,,,,,,,,,,,,,,,,,,,,,,,,,,,,,,,,,,,,,,,,,,,,,,2.0,202147.0,M/S GLOBAL ENTERPRISE,26-Sep-2023 02:31 PM,Rejected-Finance,Quoted rate higher than L1,26-Oct-2023 01:59 PM,,,,,,,,,,,,,2.0,202146.0,Anil Hardware and Nursery Enterprise,73.0,L1,,,,,,,,,,,,,,,
,,,,,,,,,,,,,,2.0,Finance,.xls,BOQ,,,,,,,,,,,,,,,,,,,,,,,,,,,,,,,,,,,,,,,,,,,,,,,,,,,,,,,,2.0,Finance,.xls,BOQ,,,,,,,,,,,,,,,,,,,,,,,,,,,,,,,,,,,,,,,,,,,,,,,,,,,,,,3.0,202145.0,M/s S. N Enterprise,26-Sep-2023 02:42 PM,Rejected-Finance,Highest quoted rate bidder,26-Oct-2023 01:59 PM,,,,,,,,,,,,,3.0,202147.0,M/S GLOBAL ENTERPRISE,75.0,L2,,,,,,,,,,,,,,,
,,,,,,,,,,,,,,,,.pdf,Form of Bid,,,,,,,,,,,,,,,,,,,,,,,,,,,,,,,,,,,,,,,,,,,,,,,,,,,,,,,,,,.pdf,Form of Bid,,,,,,,,,,,,,,,,,,,,,,,,,,,,,,,,,,,,,,,,,,,,,,,,,,,,,,,,,,,,,,,,,,,,,,,,,,,,,,,,,,,,,,,,,,,,
,,,,,,,,,,,,,,,,,,,,,,,,,,,,,,,,,,,,,,,,,,,,,,,,,,,,,,,,,,,,,,,,,,,,,,,,,,,,,,,,,,,,,,,,,,,,,,,,,,,,,,,,,,,,,,,,,,,,,,,,,,,,,,,,,,,,,,,,,,,,,,,,,,,,,,,,,,,,,,,,,,,,,,2023_BoTC_32453_1,DA/BTC/K/e-Tender/2023-24/29,"Supply of Strawberry (Tissue Culture) Sapling under Horticulture and Vegetable crops, SOPD for the year 2023-24."
