Organisation Chain,Tender Reference Number,Tender ID,Withdrawal Allowed,Tender Type,Form of contract,Tender Category,No. of Covers,General Technical Evaluation Allowed,ItemWise Technical Evaluation Allowed,Payment Mode,Is Multi Currency Allowed For BOQ,Is Multi Currency Allowed For Fee,Allow Two Stage Bidding,Cover No,Cover,Document Type,Description,Publish Date,Bid Opening Date,Document Download / Sale Start Date,Document Download / Sale End Date,Clarification Start Date,Clarification End Date,Bid Submission Start Date,Bid Submission End Date,Financial Bid Opening Date,EMD Amount in ₹,EMD Exemption Allowed,EMD Fee Type,EMD Percentage,EMD Payable To,EMD Payable At,S.No,Bank Name,Tender Fee in ₹,Fee Payable To,Fee Payable At,Tender Fee Exemption Allowed,Name,Address,Title,Work Description,Pre Qualification Details,Independent External Monitor/Remarks,Tender Value in ₹,Product Category,Sub category,Contract Type,Bid Validity(Days),Period Of Work(Days),Location,Pincode,Pre Bid Meeting Place,Pre Bid Meeting Address,Pre Bid Meeting Date,Bid Opening Place,Should Allow NDA Tender,Allow Preferential Bidder,Organisation Chain,Tender Reference Number,Tender ID,Withdrawal Allowed,Tender Type,Form of contract,Tender Category,No. of Covers,General Technical Evaluation Allowed,ItemWise Technical Evaluation Allowed,Payment Mode,Is Multi Currency Allowed For BOQ,Is Multi Currency Allowed For Fee,Allow Two Stage Bidding,Cover No,Cover,Document Type,Description,Publish Date,Bid Opening Date,Document Download / Sale Start Date,Document Download / Sale End Date,Clarification Start Date,Clarification End Date,Bid Submission Start Date,Bid Submission End Date,Financial Bid Opening Date,EMD Amount in ₹,EMD Exemption Allowed,EMD Fee Type,EMD Percentage,EMD Payable To,EMD Payable At,S.No,Bank Name,Tender Fee in ₹,Fee Payable To,Fee Payable At,Tender Fee Exemption Allowed,Name,Address,Title,Work Description,Pre Qualification Details,Independent External Monitor/Remarks,Tender Value in ₹,Product Category,Sub category,Contract Type,Bid Validity(Days),Period Of Work(Days),Location,Pincode,Pre Bid Meeting Place,Pre Bid Meeting Address,Pre Bid Meeting Date,Bid Opening Place,Should Allow NDA Tender,Allow Preferential Bidder,Contract Date :,Contract Value :,Work Completion Period in days :,Updated By :,Updated on :,AOC document :,AOC Description :,S.No.1,Bid Number,Bidder Name,Awarded Currency,Awarded Value,S.No.2,Bid Number.1,Bidder Name.1,Submitted Date,Status,Remarks,Status Updated On,Type :,Summary :,Updated By :.1,Updated On :,Document :,BOQ Comparative Chart :,Committee Chairperson/Co-ordinator Name :,Committee Chairperson/Co-ordinator Type :,Committee Members :,Updated By :.2,Updated on :.1,Document :.1,S.No.3,Bid Number.2,Bidder Name.2,Value,Rank,Type :.1,Summary :.1,Updated By :.3,Updated On :.1,Document :.2,Committee Chairperson/Co-ordinator Name :.1,Committee Chairperson/Co-ordinator Type :.1,Committee Members :.1,Updated By :.4,Updated On :.2,Financial Bid Opening Date:,Document :.3,Tender ID :,Tender Ref No :,Tender Title :
Pr. Chief Conservator of Forest and Head of Forest Force||Principal Chief Conservator of Forests(Wildlife and Ch. Wildlife Warden)||Kaziranga National Park Bokakhat||Biswanath Wildlife Division,Assam Type Building Forester Quarter,2023_PCCF_32788_1,Yes,Open Tender,Works,Works,2.0,No,No,Online,No,No,No,1.0,Fee/PreQual/Technical,.pdf,EMD,06-Oct-2023 09:00 AM,30-Oct-2023 03:00 PM,06-Oct-2023 11:00 AM,28-Oct-2023 03:00 PM,NA ,NA ,06-Oct-2023 11:00 AM,28-Oct-2023 03:00 PM,30-Nov-2023 12:00 PM,"74,561",Yes,percentage,2.0%,Nil,Nil,1.0,SBI Bank,"1,000",Nil,Nil,No,"D.F.O, Biswanath Wildlife Division",Panibharal Biswanath Chariali Biswanath (Assam),Construction of Assam Type Building for Forester Quarter,"Construction of Assam Type Building for Forester Quarter at Eastern Range, Gamiri",Please refer Tender documents. ,NA ,"37,28,055",Civil Works,NA ,Tender,90.0,90.0,Work,784176.0,"O/o the DFO, Biswanath Wildlife Division ","O/o the DFO, Biswanath Wildlife Division ",20-Oct-2023 12:30 PM ,"O/o the DFO, Biswanath Wildlife Division",No ,No,Pr. Chief Conservator of Forest and Head of Forest Force||Principal Chief Conservator of Forests(Wildlife and Ch. Wildlife Warden)||Kaziranga National Park Bokakhat||Biswanath Wildlife Division,Assam Type Building Forester Quarter,2023_PCCF_32788_1,Yes,Open Tender,Works,Works,2.0,No,No,Online,No,No,No,1.0,Fee/PreQual/Technical,.pdf,EMD,06-Oct-2023 09:00 AM,30-Oct-2023 03:00 PM,06-Oct-2023 11:00 AM,28-Oct-2023 03:00 PM,NA ,NA ,06-Oct-2023 11:00 AM,28-Oct-2023 03:00 PM,30-Nov-2023 12:00 PM,"74,561",Yes,percentage,2.0%,Nil,Nil,1.0,SBI Bank,"1,000",Nil,Nil,No,"D.F.O, Biswanath Wildlife Division",Panibharal Biswanath Chariali Biswanath (Assam),Construction of Assam Type Building for Forester Quarter,"Construction of Assam Type Building for Forester Quarter at Eastern Range, Gamiri",Please refer Tender documents. ,NA ,"37,28,055",Civil Works,NA ,Tender,90.0,90.0,Work,784176.0,"O/o the DFO, Biswanath Wildlife Division ","O/o the DFO, Biswanath Wildlife Division ",20-Oct-2023 12:30 PM ,"O/o the DFO, Biswanath Wildlife Division",No ,No,15-Jan-2024,"INR 3,541,652.25",90.0,KHAGESH PEGU,07-Oct-2024 05:47 PM,CAMPA_Work_Order_AOC.pdf (371.00 KB),Construction of Assam Type Building for Forester Quarter under State CAMPA for the year 2023-24,1.0,204270.0,M/S A R ENTERPRISE,INR,"3,541,652.25",1.0,207053.0,Dibya Jyoti Borkakati,27-Oct-2023 07:11 PM,Rejected-Finance,Work Experience is less,12-Jan-2024 01:02 PM,Finance,All the obtained financial bids were evaluated by the tender committee and after scrutiny the report is enclosed.,KHAGESH PEGU,12-Jan-2024 12:44 PM,finance_52702.pdf,BOQ Comparative Chart,"Khagesh Pegu,IFS",Internal,"Pranjal Gogoi, FR Birkhang Goyari, Jr Asstt. and Uddipta Das, Jr. Asstt.",KHAGESH PEGU,12-Jan-2024 01:02 PM,finsummary_52702.pdf (356.47 KB),1.0,204270.0,M/S A R ENTERPRISE,"35,41,652.25",1.0,Technical,"After giving stipulated time to the bidders for re-submission of missing documents, all the obtained bids were evaluated once again by the tender committee and after scrutiny the report is enclosed herewith.",KHAGESH PEGU,29-Nov-2023 04:52 PM,technical_52702.pdf,"Pranjal Gogoi, FR, Eastern Range, Gamiri",Internal,"Birkhang Goyari, Jr. Asstt. Uddipta Das, Jr. Asstt.",KHAGESH PEGU,29-Nov-2023 05:18 PM,30-Nov-2023 12:00 PM,techsummary_52702.pdf (281.80 KB),,,
,,,,,,,,,,,,,,,,.pdf,Technical Bid Documents,,,,,,,,,,,,,,,,,,,,,,,,,,,,,,,,,,,,,,,,,,,,,,,,,,,,,,,,,,.pdf,Technical Bid Documents,,,,,,,,,,,,,,,,,,,,,,,,,,,,,,,,,,,,,,,,,,,,,,,,,,,,,,2.0,204270.0,M/S A R ENTERPRISE,28-Oct-2023 10:18 AM,Accepted-AOC,Highest Work Experience,07-Oct-2024 05:48 PM,,,,,,,,,,,,,2.0,205159.0,STANDARD CREATION,"35,41,652.25",2.0,,,,,,,,,,,,,,,
,,,,,,,,,,,,,,,,.pdf,IT Return/GST/Pan Card,,,,,,,,,,,,,,,,,,,,,,,,,,,,,,,,,,,,,,,,,,,,,,,,,,,,,,,,,,.pdf,IT Return/GST/Pan Card,,,,,,,,,,,,,,,,,,,,,,,,,,,,,,,,,,,,,,,,,,,,,,,,,,,,,,3.0,207198.0,PIJUSH DAS,28-Oct-2023 01:33 PM,Rejected-Finance,Work Experience is less,12-Jan-2024 01:02 PM,,,,,,,,,,,,,3.0,207053.0,Dibya Jyoti Borkakati,"35,41,652.25",4.0,,,,,,,,,,,,,,,
,,,,,,,,,,,,,,,,.pdf,Financial Turnover/Liquid Asset/Cancel Cheque,,,,,,,,,,,,,,,,,,,,,,,,,,,,,,,,,,,,,,,,,,,,,,,,,,,,,,,,,,.pdf,Financial Turnover/Liquid Asset/Cancel Cheque,,,,,,,,,,,,,,,,,,,,,,,,,,,,,,,,,,,,,,,,,,,,,,,,,,,,,,4.0,207239.0,Sri Beekey Agarwala,28-Oct-2023 02:01 PM,Not Admitted-Finance,Others-Bid is beyond acceptance limit of (-5% to 5%) as per Section-IV Evaluation and Qualification Criteria clause no. (2)(B) of bid Document,12-Jan-2024 12:44 PM,,,,,,,,,,,,,4.0,207198.0,PIJUSH DAS,"35,41,652.25",3.0,,,,,,,,,,,,,,,
,,,,,,,,,,,,,,,,.pdf,Past Experience/Cast certificate,,,,,,,,,,,,,,,,,,,,,,,,,,,,,,,,,,,,,,,,,,,,,,,,,,,,,,,,,,.pdf,Past Experience/Cast certificate,,,,,,,,,,,,,,,,,,,,,,,,,,,,,,,,,,,,,,,,,,,,,,,,,,,,,,5.0,205159.0,STANDARD CREATION,19-Oct-2023 03:58 PM,Rejected-Finance,Work Experience is less,12-Jan-2024 01:02 PM,,,,,,,,,,,,,,,,,,,,,,,,,,,,,,,,
,,,,,,,,,,,,,,,,.pdf,Labour License,,,,,,,,,,,,,,,,,,,,,,,,,,,,,,,,,,,,,,,,,,,,,,,,,,,,,,,,,,.pdf,Labour License,,,,,,,,,,,,,,,,,,,,,,,,,,,,,,,,,,,,,,,,,,,,,,,,,,,,,,,,,,,,,,,,,,,,,,,,,,,,,,,,,,,,,,,,,,,,
,,,,,,,,,,,,,,,,.pdf,Certificate of Technical person/Court Affidavit and Other documents,,,,,,,,,,,,,,,,,,,,,,,,,,,,,,,,,,,,,,,,,,,,,,,,,,,,,,,,,,.pdf,Certificate of Technical person/Court Affidavit and Other documents,,,,,,,,,,,,,,,,,,,,,,,,,,,,,,,,,,,,,,,,,,,,,,,,,,,,,,,,,,,,,,,,,,,,,,,,,,,,,,,,,,,,,,,,,,,,
,,,,,,,,,,,,,,2.0,Finance,.xls,Financial Bid Document BOQ,,,,,,,,,,,,,,,,,,,,,,,,,,,,,,,,,,,,,,,,,,,,,,,,,,,,,,,,2.0,Finance,.xls,Financial Bid Document BOQ,,,,,,,,,,,,,,,,,,,,,,,,,,,,,,,,,,,,,,,,,,,,,,,,,,,,,,,,,,,,,,,,,,,,,,,,,,,,,,,,,,,,,,,,,,,,
,,,,,,,,,,,,,,,,,,,,,,,,,,,,,,,,,,,,,,,,,,,,,,,,,,,,,,,,,,,,,,,,,,,,,,,,,,,,,,,,,,,,,,,,,,,,,,,,,,,,,,,,,,,,,,,,,,,,,,,,,,,,,,,,,,,,,,,,,,,,,,,,,,,,,,,,,,,,,,,,,,,,,,2023_PCCF_32788_1,Assam Type Building Forester Quarter,Construction of Assam Type Building for Forester Quarter
