Organisation Chain,Tender Reference Number,Tender ID,Withdrawal Allowed,Tender Type,Form of contract,Tender Category,No. of Covers,General Technical Evaluation Allowed,ItemWise Technical Evaluation Allowed,Payment Mode,Is Multi Currency Allowed For BOQ,Is Multi Currency Allowed For Fee,Allow Two Stage Bidding,Cover No,Cover,Document Type,Description,Publish Date,Bid Opening Date,Document Download / Sale Start Date,Document Download / Sale End Date,Clarification Start Date,Clarification End Date,Bid Submission Start Date,Bid Submission End Date,Financial Bid Opening Date,EMD Amount in ₹,EMD Exemption Allowed,EMD Fee Type,EMD Percentage,EMD Payable To,EMD Payable At,S.No,Corrigendum Title,Corrigendum Type,View,S.No.1,Bank Name,Tender Fee in ₹,Fee Payable To,Fee Payable At,Tender Fee Exemption Allowed,Name,Address,Title,Work Description,Pre Qualification Details,Independent External Monitor/Remarks,Tender Value in ₹,Product Category,Sub category,Contract Type,Bid Validity(Days),Period Of Work(Days),Location,Pincode,Pre Bid Meeting Place,Pre Bid Meeting Address,Pre Bid Meeting Date,Bid Opening Place,Should Allow NDA Tender,Allow Preferential Bidder,Organisation Chain,Tender Reference Number,Tender ID,Withdrawal Allowed,Tender Type,Form of contract,Tender Category,No. of Covers,General Technical Evaluation Allowed,ItemWise Technical Evaluation Allowed,Payment Mode,Is Multi Currency Allowed For BOQ,Is Multi Currency Allowed For Fee,Allow Two Stage Bidding,Cover No,Cover,Document Type,Description,Publish Date,Bid Opening Date,Document Download / Sale Start Date,Document Download / Sale End Date,Clarification Start Date,Clarification End Date,Bid Submission Start Date,Bid Submission End Date,Financial Bid Opening Date,EMD Amount in ₹,EMD Exemption Allowed,EMD Fee Type,EMD Percentage,EMD Payable To,EMD Payable At,S.No,Corrigendum Title,Corrigendum Type,View,S.No.1,Bank Name,Tender Fee in ₹,Fee Payable To,Fee Payable At,Tender Fee Exemption Allowed,Name,Address,Title,Work Description,Pre Qualification Details,Independent External Monitor/Remarks,Tender Value in ₹,Product Category,Sub category,Contract Type,Bid Validity(Days),Period Of Work(Days),Location,Pincode,Pre Bid Meeting Place,Pre Bid Meeting Address,Pre Bid Meeting Date,Bid Opening Place,Should Allow NDA Tender,Allow Preferential Bidder,Contract Date :,Contract Value :,Work Completion Period in days :,Updated By :,Updated on :,AOC document :,AOC Description :,S.No.2,Bid Number,Bidder Name,Awarded Currency,Awarded Value,S.No.3,Bid Number.1,Bidder Name.1,Submitted Date,Status,Remarks,Status Updated On,Type :,Summary :,Updated By :.1,Updated On :,Document :,BOQ Comparative Chart :,Committee Chairperson/Co-ordinator Name :,Committee Chairperson/Co-ordinator Type :,Committee Members :,Updated By :.2,Updated on :.1,Document :.1,S.No.4,Bid Number.2,Bidder Name.2,Value,Rank,Type :.1,Summary :.1,Updated By :.3,Updated On :.1,Document :.2,Committee Chairperson/Co-ordinator Name :.1,Committee Chairperson/Co-ordinator Type :.1,Committee Members :.1,Updated By :.4,Updated On :.2,Financial Bid Opening Date:,Document :.3,Tender ID :,Tender Ref No :,Tender Title :
Directorate of Agriculture and Assam Seed Corporation,Agri/Esstt./8662/Pt.II/Veh. Hiring/2022/415,2024_DAASC_38188_1,Yes,Open Tender,Item Wise,Services,2.0,No,No,Online,No,No,No,1.0,Fee/PreQual/Technical,.pdf,Scan Copy of Technical Qualification Documents,25-Jul-2024 05:00 PM,16-Aug-2024 02:30 PM,25-Jul-2024 05:00 PM,16-Aug-2024 02:00 PM,25-Jul-2024 05:00 PM ,01-Aug-2024 05:00 PM ,09-Aug-2024 05:00 PM,16-Aug-2024 02:00 PM,05-Sep-2024 05:00 PM,"2,00,000",Yes,fixed,,Nil,Nil,1.0,BoQ Corrigendum,BOQ,,1.0,SBI Bank,"4,000",Nil,Nil,No,Director,"Directorate of Agriculture, Assam, Khanapara",SERVICES OF TRAVEL AGENCY(S) FOR HIRING PASSENGER VEHICLES THROUGH RATE CONTRACT,SERVICES OF TRAVEL AGENCY(S) FOR HIRING PASSENGER VEHICLES THROUGH RATE CONTRACT,Please refer Tender documents. ,NA ,,Miscellaneous Services,Vehicle hiring services ,Rate Contract,180.0,365.0,"Khanapara, Guwahati",781022.0,Online ,meet.google.com/sqn-wndy-ffz ,02-Aug-2024 03:00 PM ,Online,No ,No,Directorate of Agriculture and Assam Seed Corporation,Agri/Esstt./8662/Pt.II/Veh. Hiring/2022/415,2024_DAASC_38188_1,Yes,Open Tender,Item Wise,Services,2.0,No,No,Online,No,No,No,1.0,Fee/PreQual/Technical,.pdf,Scan Copy of Technical Qualification Documents,25-Jul-2024 05:00 PM,16-Aug-2024 02:30 PM,25-Jul-2024 05:00 PM,16-Aug-2024 02:00 PM,25-Jul-2024 05:00 PM ,01-Aug-2024 05:00 PM ,09-Aug-2024 05:00 PM,16-Aug-2024 02:00 PM,05-Sep-2024 05:00 PM,"2,00,000",Yes,fixed,,Nil,Nil,1.0,BoQ Corrigendum,BOQ,,1.0,SBI Bank,"4,000",Nil,Nil,No,Director,"Directorate of Agriculture, Assam, Khanapara",SERVICES OF TRAVEL AGENCY(S) FOR HIRING PASSENGER VEHICLES THROUGH RATE CONTRACT,SERVICES OF TRAVEL AGENCY(S) FOR HIRING PASSENGER VEHICLES THROUGH RATE CONTRACT,Please refer Tender documents. ,NA ,,Miscellaneous Services,Vehicle hiring services ,Rate Contract,180.0,365.0,"Khanapara, Guwahati",781022.0,Online ,meet.google.com/sqn-wndy-ffz ,02-Aug-2024 03:00 PM ,Online,No ,No,01-Nov-2024,INR 0,365.0,Upasana Devi,24-Oct-2024 12:50 PM,Final_LoA.pdf (5747.00 KB),Work Order,1.0,236899.0,MOHAN MAHATO,INR,0.0,1.0,236865.0,Ambika Enterprise,16-Aug-2024 10:58 AM,Rejected-Technical,Due to non submission of bid security amount,05-Sep-2024 04:44 PM,Finance,Financial bid has been opened,Amal Sarma,05-Sep-2024 05:19 PM,None,BOQ Comparative Chart,"Director of Agriculture, Assam",Internal,,Upasana Devi,01-Oct-2024 05:05 PM,finsummary_61950.pdf (1136.91 KB),1.0,236868.0,SUNRISE TRADERS,0.0,L2,Technical,Technical bid has been opened,Amal Sarma,16-Aug-2024 03:07 PM,None,"Director of Agriculture, Assam",Internal,,Amal Sarma,05-Sep-2024 04:44 PM,05-Sep-2024 05:00 PM,techsummary_61950.pdf (585.01 KB),,,
,,,,,,,,,,,,,,,,.pdf,Signed Bidding Document,,,,,,,,,,,,,,,,2.0,Pre bid query response,Other,,,,,,,,,,,,,,,,,,,,,,,,,,,,,,,,,,,,,,,,,,,,.pdf,Signed Bidding Document,,,,,,,,,,,,,,,,2.0,Pre bid query response,Other,,,,,,,,,,,,,,,,,,,,,,,,,,,,,,,,,,,2.0,236869.0,D K Travels,INR,0.0,2.0,236869.0,D K Travels,16-Aug-2024 08:59 AM,Accepted-AOC,Awarded,24-Oct-2024 12:51 PM,,,,,,,,,,,,,2.0,236869.0,D K Travels,0.0,L1,,,,,,,,,,,,,,,
,,,,,,,,,,,,,,,,.pdf,Additional Technical document,,,,,,,,,,,,,,,,3.0,Technical Corrigendum,Technical Bid,,,,,,,,,,,,,,,,,,,,,,,,,,,,,,,,,,,,,,,,,,,,.pdf,Additional Technical document,,,,,,,,,,,,,,,,3.0,Technical Corrigendum,Technical Bid,,,,,,,,,,,,,,,,,,,,,,,,,,,,,,,,,,,3.0,236868.0,SUNRISE TRADERS,INR,0.0,3.0,236917.0,LEISURE LANE TOURS,16-Aug-2024 01:44 PM,Rejected-Technical,Due to non submission of bid security amount,05-Sep-2024 04:44 PM,,,,,,,,,,,,,3.0,236899.0,MOHAN MAHATO,0.0,L2,,,,,,,,,,,,,,,
,,,,,,,,,,,,,,2.0,Finance,.xls,Price Bid,,,,,,,,,,,,,,,,,,,,,,,,,,,,,,,,,,,,,,,,,,,,,,,,,,,,,,,,,,,,2.0,Finance,.xls,Price Bid,,,,,,,,,,,,,,,,,,,,,,,,,,,,,,,,,,,,,,,,,,,,,,,,,,,,,,,,,,4.0,236899.0,MOHAN MAHATO,16-Aug-2024 11:52 AM,Accepted-AOC,Awarded,24-Oct-2024 12:51 PM,,,,,,,,,,,,,,,,,,,,,,,,,,,,,,,,
,,,,,,,,,,,,,,,,,,,,,,,,,,,,,,,,,,,,,,,,,,,,,,,,,,,,,,,,,,,,,,,,,,,,,,,,,,,,,,,,,,,,,,,,,,,,,,,,,,,,,,,,,,,,,,,,,,,,,,,,,,,,,,,,,,,,,,,,,,5.0,236868.0,SUNRISE TRADERS,16-Aug-2024 11:23 AM,Accepted-AOC,Awarded,24-Oct-2024 12:51 PM,,,,,,,,,,,,,,,,,,,,,,,,,,,,,,,,
,,,,,,,,,,,,,,,,,,,,,,,,,,,,,,,,,,,,,,,,,,,,,,,,,,,,,,,,,,,,,,,,,,,,,,,,,,,,,,,,,,,,,,,,,,,,,,,,,,,,,,,,,,,,,,,,,,,,,,,,,,,,,,,,,,,,,,,,,,,,,,,,,,,,,,,,,,,,,,,,,,,,,,,,,,,,,,2024_DAASC_38188_1,Agri/Esstt./8662/Pt.II/Veh. Hiring/2022/415,SERVICES OF TRAVEL AGENCY(S) FOR HIRING PASSENGER VEHICLES THROUGH RATE CONTRACT
