Organisation Chain,Tender Reference Number,Tender ID,Withdrawal Allowed,Tender Type,Form of contract,Tender Category,No. of Covers,General Technical Evaluation Allowed,ItemWise Technical Evaluation Allowed,Payment Mode,Is Multi Currency Allowed For BOQ,Is Multi Currency Allowed For Fee,Allow Two Stage Bidding,Cover No,Cover,Document Type,Description,Publish Date,Bid Opening Date,Document Download / Sale Start Date,Document Download / Sale End Date,Clarification Start Date,Clarification End Date,Bid Submission Start Date,Bid Submission End Date,EMD Amount in ₹,EMD Exemption Allowed,EMD Fee Type,EMD Percentage,EMD Payable To,EMD Payable At,S.No,Corrigendum Title,Corrigendum Type,View,Tender Fee in ₹,Fee Payable To,Fee Payable At,Tender Fee Exemption Allowed,Name,Address,Title,Work Description,Pre Qualification Details,Independent External Monitor/Remarks,Tender Value in ₹,Product Category,Sub category,Contract Type,Bid Validity(Days),Period Of Work(Days),Location,Pincode,Pre Bid Meeting Place,Pre Bid Meeting Address,Pre Bid Meeting Date,Bid Opening Place,Should Allow NDA Tender,Allow Preferential Bidder,Organisation Chain,Tender Reference Number,Tender ID,Withdrawal Allowed,Tender Type,Form of contract,Tender Category,No. of Covers,General Technical Evaluation Allowed,ItemWise Technical Evaluation Allowed,Payment Mode,Is Multi Currency Allowed For BOQ,Is Multi Currency Allowed For Fee,Allow Two Stage Bidding,Cover No,Cover,Document Type,Description,Publish Date,Bid Opening Date,Document Download / Sale Start Date,Document Download / Sale End Date,Clarification Start Date,Clarification End Date,Bid Submission Start Date,Bid Submission End Date,EMD Amount in ₹,EMD Exemption Allowed,EMD Fee Type,EMD Percentage,EMD Payable To,EMD Payable At,S.No,Corrigendum Title,Corrigendum Type,View,Tender Fee in ₹,Fee Payable To,Fee Payable At,Tender Fee Exemption Allowed,Name,Address,Title,Work Description,Pre Qualification Details,Independent External Monitor/Remarks,Tender Value in ₹,Product Category,Sub category,Contract Type,Bid Validity(Days),Period Of Work(Days),Location,Pincode,Pre Bid Meeting Place,Pre Bid Meeting Address,Pre Bid Meeting Date,Bid Opening Place,Should Allow NDA Tender,Allow Preferential Bidder,Contract Date :,Contract Value :,Work Completion Period in days :,Updated By :,Updated on :,AOC document :,AOC Description :,S.No.1,Bid Number,Bidder Name,Awarded Currency,Awarded Value,S.No.2,Bid Number.1,Bidder Name.1,Submitted Date,Status,Remarks,Status Updated On,Type :,Summary :,Updated By :.1,Updated On :,Document :,BOQ Comparative Chart :,Committee Chairperson/Co-ordinator Name :,Committee Chairperson/Co-ordinator Type :,Committee Members :,Updated By :.2,Updated on :.1,Document :.1,S.No.3,Bid Number.2,Bidder Name.2,Value,Rank,Committee Chairperson/Co-ordinator Name :.1,Committee Chairperson/Co-ordinator Type :.1,Committee Members :.1,Updated By :.3,Updated On :.1,Document :.2,Tender ID :,Tender Ref No :,Tender Title :
Department of Water Resources-Externally Aided Project||Flood and River Erosion Management Agency of Assam||WRD- ADB Funded Tenders,FREMAA(P)PROJ/ADB/1/2022/3847,2022_WREAP_28132_1,Yes,Open Tender,Lump-sum,Services,1.0,No,No,Not Applicable,No,No,No,1.0,Fee/PreQual/Technical/Finance,.pdf,Quotation and supporting documents,09-Dec-2022 09:00 AM,02-Jan-2023 04:00 PM,09-Dec-2022 09:00 AM,02-Jan-2023 02:00 PM,09-Dec-2022 09:00 AM ,26-Dec-2022 06:00 PM ,19-Dec-2022 12:00 PM,02-Jan-2023 02:00 PM,0.0,No,fixed,,Nil,Nil,1.0,Corrigendum-I,Date,,0.0,Nil,Nil,No,Chief Executive Officer,"FLOOD AND RIVER EROSION MANAGEMENT AGENCY OF ASSAM (FREMAA) Address-4th Floor, Assam Water Center, Near Basistha Chariali, NH 27, Guwahati-781029",Data Collection for Assessment of Economic Benefits,Hiring of Service provider for Data Collection for Assessment of Economic Benefits,Please refer Tender documents. ,NA ,,Miscellaneous Services,NA ,Tender,30.0,125.0,Assam,781029.0,FLOOD AND RIVER EROSION MANAGEMENT AGENCY OF ASSAM ,"FLOOD AND RIVER EROSION MANAGEMENT AGENCY OF ASSAM (FREMAA) Address-4th Floor, Assam Water Center, Near Basistha Chariali, NH 27, Guwahati-781029  ",15-Dec-2022 01:00 PM ,"Conferance Hall,FREMAA",No ,No,Department of Water Resources-Externally Aided Project||Flood and River Erosion Management Agency of Assam||WRD- ADB Funded Tenders,FREMAA(P)PROJ/ADB/1/2022/3847,2022_WREAP_28132_1,Yes,Open Tender,Lump-sum,Services,1.0,No,No,Not Applicable,No,No,No,1.0,Fee/PreQual/Technical/Finance,.pdf,Quotation and supporting documents,09-Dec-2022 09:00 AM,02-Jan-2023 04:00 PM,09-Dec-2022 09:00 AM,02-Jan-2023 02:00 PM,09-Dec-2022 09:00 AM ,26-Dec-2022 06:00 PM ,19-Dec-2022 12:00 PM,02-Jan-2023 02:00 PM,0.0,No,fixed,,Nil,Nil,1.0,Corrigendum-I,Date,,0.0,Nil,Nil,No,Chief Executive Officer,"FLOOD AND RIVER EROSION MANAGEMENT AGENCY OF ASSAM (FREMAA) Address-4th Floor, Assam Water Center, Near Basistha Chariali, NH 27, Guwahati-781029",Data Collection for Assessment of Economic Benefits,Hiring of Service provider for Data Collection for Assessment of Economic Benefits,Please refer Tender documents. ,NA ,,Miscellaneous Services,NA ,Tender,30.0,125.0,Assam,781029.0,FLOOD AND RIVER EROSION MANAGEMENT AGENCY OF ASSAM ,"FLOOD AND RIVER EROSION MANAGEMENT AGENCY OF ASSAM (FREMAA) Address-4th Floor, Assam Water Center, Near Basistha Chariali, NH 27, Guwahati-781029  ",15-Dec-2022 01:00 PM ,"Conferance Hall,FREMAA",No ,No,03-Feb-2024,"INR 1,663,800",125.0,Diganta Sarma,01-Oct-2024 03:21 PM,LOAContractEconomicBenefits.pdf (8128.00 KB),"Awarded to Sutra Consulting Private Limited for Rs. 16,63,800/- inclusive of GST",1.0,170029.0,Sutra Consulting Pvt. Ltd.,INR,"1,663,800",1.0,170178.0,Consultants for Rural Area Development Linked Economy (CRADLE),02-Jan-2023 12:49 PM,Rejected-Technical,Not evaluated as quoted amount is higher than the lowest quoted bidder,27-Jan-2023 07:55 PM,Finance,RECORD OF QUOTATION OPENING,Jayanta Barman,19-Jan-2023 02:17 PM,finance_44832.pdf,BOQ Comparative Chart,"Dr. Jeevan B,IAS",Internal,"R K Mazumder IAS(Retd),Dy Chief Executive Officer, Bhaskar Jyoti Das Chief Technical Officer, Jayanta Kr Barman, Procurement Specialist,Papori Banikya Livelihood and Communication Specialist",Jayanta Barman,27-Jan-2023 08:08 PM,finsummary_44832.pdf (458.43 KB),1.0,170029.0,Sutra Consulting Pvt. Ltd.,"14,10,000.00",1.0,"Dr. Jeevan B,IAS",Internal,"R K Mazumder, Dy Chief Executive OfficerBhaskar Jyoti Das, Chief Technical Officer,Jayanta Kr Barman, Procurement Specialist ,Papori Banikya ,Communication and Livelihood Specialist",Jayanta Barman,27-Jan-2023 07:55 PM,techsummary_44832.pdf (458.43 KB),,,
,,,,,,,,,,,,,,,,.pdf,Additional supporting documents,,,,,,,,,,,,,,,2.0,Additional Replies of Queries,Technical Bid,,,,,,,,,,,,,,,,,,,,,,,,,,,,,,,,,,,,,,,,,,.pdf,Additional supporting documents,,,,,,,,,,,,,,,2.0,Additional Replies of Queries,Technical Bid,,,,,,,,,,,,,,,,,,,,,,,,,,,,,,,,,,,,,,2.0,171324.0,INFER DEVELOPMENT CONSULTING PRIVATE LIMITED,01-Jan-2023 05:39 PM,Rejected-Technical,Not evaluated as quoted amount is higher than the lowest quoted bidder,27-Jan-2023 07:55 PM,,,,,,,,,,,,,,,,,,,,,,,,,,
,,,,,,,,,,,,,,,,.pdf,Curriculum Vitaes (Cvs) of Key and Non Key Experts,,,,,,,,,,,,,,,,,,,,,,,,,,,,,,,,,,,,,,,,,,,,,,,,,,,,,,,,,,,.pdf,Curriculum Vitaes (Cvs) of Key and Non Key Experts,,,,,,,,,,,,,,,,,,,,,,,,,,,,,,,,,,,,,,,,,,,,,,,,,,,,,,,3.0,171215.0,LEA Associates South Asia Pvt. Ltd.,02-Jan-2023 11:28 AM,Rejected-Technical,Not evaluated as quoted amount is higher than the lowest quoted bidder,27-Jan-2023 07:55 PM,,,,,,,,,,,,,,,,,,,,,,,,,,
,,,,,,,,,,,,,,,,.xls,Financial,,,,,,,,,,,,,,,,,,,,,,,,,,,,,,,,,,,,,,,,,,,,,,,,,,,,,,,,,,,.xls,Financial,,,,,,,,,,,,,,,,,,,,,,,,,,,,,,,,,,,,,,,,,,,,,,,,,,,,,,,4.0,170115.0,NORTH EASTERN DEVELOPMENT FINANCE CORPORATION LIMITED (NEDFi),23-Dec-2022 11:51 AM,Rejected-Technical,Not evaluated as quoted amount is higher than the lowest quoted bidder,27-Jan-2023 07:55 PM,,,,,,,,,,,,,,,,,,,,,,,,,,
,,,,,,,,,,,,,,,,,,,,,,,,,,,,,,,,,,,,,,,,,,,,,,,,,,,,,,,,,,,,,,,,,,,,,,,,,,,,,,,,,,,,,,,,,,,,,,,,,,,,,,,,,,,,,,,,,,,,,,,,,,,,,,,,,,,,5.0,171364.0,SCORPION,02-Jan-2023 11:49 AM,Rejected-Technical,Not evaluated as quoted amount is higher than the lowest quoted bidder,27-Jan-2023 07:55 PM,,,,,,,,,,,,,,,,,,,,,,,,,,
,,,,,,,,,,,,,,,,,,,,,,,,,,,,,,,,,,,,,,,,,,,,,,,,,,,,,,,,,,,,,,,,,,,,,,,,,,,,,,,,,,,,,,,,,,,,,,,,,,,,,,,,,,,,,,,,,,,,,,,,,,,,,,,,,,,,6.0,169140.0,Social Network india,02-Jan-2023 11:14 AM,Rejected-Technical,Nonresponsive,27-Jan-2023 07:55 PM,,,,,,,,,,,,,,,,,,,,,,,,,,
,,,,,,,,,,,,,,,,,,,,,,,,,,,,,,,,,,,,,,,,,,,,,,,,,,,,,,,,,,,,,,,,,,,,,,,,,,,,,,,,,,,,,,,,,,,,,,,,,,,,,,,,,,,,,,,,,,,,,,,,,,,,,,,,,,,,7.0,170029.0,Sutra Consulting Pvt. Ltd.,02-Jan-2023 01:26 PM,Accepted-AOC,Lowest quoted substantially responsive Bidder,01-Oct-2024 03:22 PM,,,,,,,,,,,,,,,,,,,,,,,,,,
,,,,,,,,,,,,,,,,,,,,,,,,,,,,,,,,,,,,,,,,,,,,,,,,,,,,,,,,,,,,,,,,,,,,,,,,,,,,,,,,,,,,,,,,,,,,,,,,,,,,,,,,,,,,,,,,,,,,,,,,,,,,,,,,,,,,,,,,,,,,,,,,,,,,,,,,,,,,,,,,,,2022_WREAP_28132_1,FREMAA(P)PROJ/ADB/1/2022/3847,Data Collection for Assessment of Economic Benefits
