Organisation Chain,Tender Reference Number,Tender ID,Withdrawal Allowed,Tender Type,Form of contract,Tender Category,No. of Covers,General Technical Evaluation Allowed,ItemWise Technical Evaluation Allowed,Payment Mode,Is Multi Currency Allowed For BOQ,Is Multi Currency Allowed For Fee,Allow Two Stage Bidding,Cover No,Cover,Document Type,Description,Publish Date,Bid Opening Date,Document Download / Sale Start Date,Document Download / Sale End Date,Clarification Start Date,Clarification End Date,Bid Submission Start Date,Bid Submission End Date,Financial Bid Opening Date,EMD Amount in ₹,EMD Exemption Allowed,EMD Fee Type,EMD Percentage,EMD Payable To,EMD Payable At,S.No,Corrigendum Title,Corrigendum Type,View,S.No.1,Bank Name,Tender Fee in ₹,Fee Payable To,Fee Payable At,Tender Fee Exemption Allowed,Name,Address,Title,Work Description,Pre Qualification Details,Independent External Monitor/Remarks,Tender Value in ₹,Product Category,Sub category,Contract Type,Bid Validity(Days),Period Of Work(Days),Location,Pincode,Pre Bid Meeting Place,Pre Bid Meeting Address,Pre Bid Meeting Date,Bid Opening Place,Should Allow NDA Tender,Allow Preferential Bidder,Organisation Chain,Tender Reference Number,Tender ID,Withdrawal Allowed,Tender Type,Form of contract,Tender Category,No. of Covers,General Technical Evaluation Allowed,ItemWise Technical Evaluation Allowed,Payment Mode,Is Multi Currency Allowed For BOQ,Is Multi Currency Allowed For Fee,Allow Two Stage Bidding,Cover No,Cover,Document Type,Description,Publish Date,Bid Opening Date,Document Download / Sale Start Date,Document Download / Sale End Date,Clarification Start Date,Clarification End Date,Bid Submission Start Date,Bid Submission End Date,Financial Bid Opening Date,EMD Amount in ₹,EMD Exemption Allowed,EMD Fee Type,EMD Percentage,EMD Payable To,EMD Payable At,S.No,Corrigendum Title,Corrigendum Type,View,S.No.1,Bank Name,Tender Fee in ₹,Fee Payable To,Fee Payable At,Tender Fee Exemption Allowed,Name,Address,Title,Work Description,Pre Qualification Details,Independent External Monitor/Remarks,Tender Value in ₹,Product Category,Sub category,Contract Type,Bid Validity(Days),Period Of Work(Days),Location,Pincode,Pre Bid Meeting Place,Pre Bid Meeting Address,Pre Bid Meeting Date,Bid Opening Place,Should Allow NDA Tender,Allow Preferential Bidder,Contract Date :,Contract Value :,Work Completion Period in days :,Updated By :,Updated on :,AOC document :,AOC Description :,S.No.2,Bid Number,Bidder Name,Awarded Currency,Awarded Value,S.No.3,Bid Number.1,Bidder Name.1,Submitted Date,Status,Remarks,Status Updated On,Type :,Summary :,Updated By :.1,Updated On :,Document :,BOQ Comparative Chart :,Committee Chairperson/Co-ordinator Name :,Committee Chairperson/Co-ordinator Type :,Committee Members :,Updated By :.2,Updated on :.1,Document :.1,S.No.4,Bid Number.2,Bidder Name.2,Value,Rank,Type :.1,Summary :.1,Updated By :.3,Updated On :.1,Document :.2,Committee Chairperson/Co-ordinator Name :.1,Committee Chairperson/Co-ordinator Type :.1,Committee Members :.1,Updated By :.4,Updated On :.2,Financial Bid Opening Date:,Document :.3,Tender ID :,Tender Ref No :,Tender Title :
National Health Mission||State Programme Management Unit - NHM,NHM-32023/466/CONST-NHM,2024_NHM_35385_4,Yes,Open Tender,Turn-key,Works,2.0,No,No,Online,No,No,No,1.0,Fee/PreQual/Technical,.pdf,SBD,11-Jan-2024 09:00 AM,25-Jan-2024 03:30 PM,11-Jan-2024 09:00 AM,24-Jan-2024 02:00 PM,NA ,NA ,11-Jan-2024 09:00 AM,24-Jan-2024 02:00 PM,24-Apr-2024 12:30 PM,"1,04,060",Yes,percentage,2.0%,Nil,Nil,1.0,extension,Date,,1.0,SBI Bank,"1,500",Nil,Nil,No,MD NHM ASSAM,O/O MD NHM ASSAM,Construction of Buildingless Sub Health Centre in Lakhibazar SC in Karimganj District under PM ABHIM for FY 2021-22 under NHM Assam on Turnkey Basis,Construction of Buildingless Sub Health Centre in Lakhibazar SC in Karimganj District under PM ABHIM for FY 2021-22 under NHM Assam on Turnkey Basis,Please refer Tender documents. ,NA ,"52,03,000",Civil Works - Building,NA ,Tender,180.0,180.0,Krimganj,788710.0,NA ,NA ,NA ,O/O MD NHM ASSAM,No ,No,National Health Mission||State Programme Management Unit - NHM,NHM-32023/466/CONST-NHM,2024_NHM_35385_4,Yes,Open Tender,Turn-key,Works,2.0,No,No,Online,No,No,No,1.0,Fee/PreQual/Technical,.pdf,SBD,11-Jan-2024 09:00 AM,25-Jan-2024 03:30 PM,11-Jan-2024 09:00 AM,24-Jan-2024 02:00 PM,NA ,NA ,11-Jan-2024 09:00 AM,24-Jan-2024 02:00 PM,24-Apr-2024 12:30 PM,"1,04,060",Yes,percentage,2.0%,Nil,Nil,1.0,extension,Date,,1.0,SBI Bank,"1,500",Nil,Nil,No,MD NHM ASSAM,O/O MD NHM ASSAM,Construction of Buildingless Sub Health Centre in Lakhibazar SC in Karimganj District under PM ABHIM for FY 2021-22 under NHM Assam on Turnkey Basis,Construction of Buildingless Sub Health Centre in Lakhibazar SC in Karimganj District under PM ABHIM for FY 2021-22 under NHM Assam on Turnkey Basis,Please refer Tender documents. ,NA ,"52,03,000",Civil Works - Building,NA ,Tender,180.0,180.0,Krimganj,788710.0,NA ,NA ,NA ,O/O MD NHM ASSAM,No ,No,22-Oct-2024,"INR 5,200,000",180.0,Dipankar Barman,22-Oct-2024 05:39 PM,WOLakhibazarSC.pdf (198.00 KB),Contract awarded,1.0,221806.0,BILAL AHMED,INR,"5,200,000",1.0,221358.0,Ashok Kumar Das,23-Jan-2024 11:29 PM,Rejected-Technical,Not Admitted,24-Apr-2024 12:22 PM,Finance,Financial bid opened,Dipankar Barman,22-Oct-2024 05:34 PM,None,BOQ Comparative Chart,OSD,Internal,,Dipankar Barman,22-Oct-2024 05:38 PM,finsummary_57713.pdf (197.85 KB),1.0,221806.0,BILAL AHMED,"52,00,000.00",L1,Technical,Technical bid opened,Dipankar Barman,24-Apr-2024 12:17 PM,None,OSD,Internal,,Dipankar Barman,24-Apr-2024 12:22 PM,24-Apr-2024 12:30 PM,techsummary_57713.pdf (2845.43 KB),,,
,,,,,,,,,,,,,,,,.pdf,Details of EMD and tender fee,,,,,,,,,,,,,,,,,,,,,,,,,,,,,,,,,,,,,,,,,,,,,,,,,,,,,,,,,,,,,,.pdf,Details of EMD and tender fee,,,,,,,,,,,,,,,,,,,,,,,,,,,,,,,,,,,,,,,,,,,,,,,,,,,,,,,,,,2.0,221806.0,BILAL AHMED,22-Jan-2024 07:44 PM,Accepted-AOC,Awarded,22-Oct-2024 05:39 PM,,,,,,,,,,,,,,,,,,,,,,,,,,,,,,,,
,,,,,,,,,,,,,,,,.pdf,Technical Document,,,,,,,,,,,,,,,,,,,,,,,,,,,,,,,,,,,,,,,,,,,,,,,,,,,,,,,,,,,,,,.pdf,Technical Document,,,,,,,,,,,,,,,,,,,,,,,,,,,,,,,,,,,,,,,,,,,,,,,,,,,,,,,,,,3.0,221439.0,KRISHNA DEBNATH,19-Jan-2024 06:34 PM,Not Admitted-Fee/PreQual/Technical,Others-Insufficient bid security submitted,24-Apr-2024 12:17 PM,,,,,,,,,,,,,,,,,,,,,,,,,,,,,,,,
,,,,,,,,,,,,,,2.0,Finance,.xls,BOQ,,,,,,,,,,,,,,,,,,,,,,,,,,,,,,,,,,,,,,,,,,,,,,,,,,,,,,,,,,,,2.0,Finance,.xls,BOQ,,,,,,,,,,,,,,,,,,,,,,,,,,,,,,,,,,,,,,,,,,,,,,,,,,,,,,,,,,4.0,221355.0,NAZRUL HOQUE,24-Jan-2024 09:04 AM,Rejected-Technical,Not Admitted,24-Apr-2024 12:22 PM,,,,,,,,,,,,,,,,,,,,,,,,,,,,,,,,
,,,,,,,,,,,,,,,,.pdf,FOB,,,,,,,,,,,,,,,,,,,,,,,,,,,,,,,,,,,,,,,,,,,,,,,,,,,,,,,,,,,,,,.pdf,FOB,,,,,,,,,,,,,,,,,,,,,,,,,,,,,,,,,,,,,,,,,,,,,,,,,,,,,,,,,,5.0,221486.0,Sri Hirakjyoti Paul,21-Jan-2024 09:50 PM,Not Admitted-Fee/PreQual/Technical,Others-Insufficient bid security not submitted,24-Apr-2024 12:17 PM,,,,,,,,,,,,,,,,,,,,,,,,,,,,,,,,
,,,,,,,,,,,,,,,,,,,,,,,,,,,,,,,,,,,,,,,,,,,,,,,,,,,,,,,,,,,,,,,,,,,,,,,,,,,,,,,,,,,,,,,,,,,,,,,,,,,,,,,,,,,,,,,,,,,,,,,,,,,,,,,,,,,,,,,,,,6.0,221501.0,SUPRIYO DAS,19-Jan-2024 07:41 PM,Rejected-Technical,Not Admitted,24-Apr-2024 12:22 PM,,,,,,,,,,,,,,,,,,,,,,,,,,,,,,,,
,,,,,,,,,,,,,,,,,,,,,,,,,,,,,,,,,,,,,,,,,,,,,,,,,,,,,,,,,,,,,,,,,,,,,,,,,,,,,,,,,,,,,,,,,,,,,,,,,,,,,,,,,,,,,,,,,,,,,,,,,,,,,,,,,,,,,,,,,,,,,,,,,,,,,,,,,,,,,,,,,,,,,,,,,,,,,,2024_NHM_35385_4,NHM-32023/466/CONST-NHM,Construction of Buildingless Sub Health Centre in Lakhibazar SC in Karimganj District under PM ABHIM for FY 2021-22 under NHM Assam on Turnkey Basis
