Organisation Chain,Tender Reference Number,Tender ID,Withdrawal Allowed,Tender Type,Form of contract,Tender Category,No. of Covers,General Technical Evaluation Allowed,ItemWise Technical Evaluation Allowed,Payment Mode,Is Multi Currency Allowed For BOQ,Is Multi Currency Allowed For Fee,Allow Two Stage Bidding,Cover No,Cover,Document Type,Description,Publish Date,Bid Opening Date,Document Download / Sale Start Date,Document Download / Sale End Date,Clarification Start Date,Clarification End Date,Bid Submission Start Date,Bid Submission End Date,Financial Bid Opening Date,EMD Amount in ₹,EMD Exemption Allowed,EMD Fee Type,EMD Percentage,EMD Payable To,EMD Payable At,S.No,Bank Name,Tender Fee in ₹,Fee Payable To,Fee Payable At,Tender Fee Exemption Allowed,Name,Address,Title,Work Description,Pre Qualification Details,Independent External Monitor/Remarks,Tender Value in ₹,Product Category,Sub category,Contract Type,Bid Validity(Days),Period Of Work(Days),Location,Pincode,Pre Bid Meeting Place,Pre Bid Meeting Address,Pre Bid Meeting Date,Bid Opening Place,Should Allow NDA Tender,Allow Preferential Bidder,Organisation Chain,Tender Reference Number,Tender ID,Withdrawal Allowed,Tender Type,Form of contract,Tender Category,No. of Covers,General Technical Evaluation Allowed,ItemWise Technical Evaluation Allowed,Payment Mode,Is Multi Currency Allowed For BOQ,Is Multi Currency Allowed For Fee,Allow Two Stage Bidding,Cover No,Cover,Document Type,Description,Publish Date,Bid Opening Date,Document Download / Sale Start Date,Document Download / Sale End Date,Clarification Start Date,Clarification End Date,Bid Submission Start Date,Bid Submission End Date,Financial Bid Opening Date,EMD Amount in ₹,EMD Exemption Allowed,EMD Fee Type,EMD Percentage,EMD Payable To,EMD Payable At,S.No,Bank Name,Tender Fee in ₹,Fee Payable To,Fee Payable At,Tender Fee Exemption Allowed,Name,Address,Title,Work Description,Pre Qualification Details,Independent External Monitor/Remarks,Tender Value in ₹,Product Category,Sub category,Contract Type,Bid Validity(Days),Period Of Work(Days),Location,Pincode,Pre Bid Meeting Place,Pre Bid Meeting Address,Pre Bid Meeting Date,Bid Opening Place,Should Allow NDA Tender,Allow Preferential Bidder,Contract Date :,Contract Value :,Work Completion Period in days :,Updated By :,Updated on :,AOC document :,S.No.1,Bid Number,Bidder Name,Awarded Currency,Awarded Value,S.No.2,Bid Number.1,Bidder Name.1,Submitted Date,Status,Remarks,Status Updated On,Type :,Summary :,Updated By :.1,Updated On :,Document :,BOQ Comparative Chart :,Committee Chairperson/Co-ordinator Name :,Committee Chairperson/Co-ordinator Type :,Committee Members :,Updated By :.2,Updated on :.1,Document :.1,S.No.3,Bid Number.2,Bidder Name.2,Value,Rank,Type :.1,Summary :.1,Updated By :.3,Updated On :.1,Document :.2,Committee Chairperson/Co-ordinator Name :.1,Committee Chairperson/Co-ordinator Type :.1,Committee Members :.1,Updated By :.4,Updated On :.2,Financial Bid Opening Date:,Document :.3,Tender ID :,Tender Ref No :,Tender Title :
Guwahati Municipal Corporation,GER/MSWM(P)/100/2024/03 Dated 16/07/2024,2024_GMC_38060_1,Yes,Open Tender,Lump-sum,Works,2.0,No,No,Online,No,No,No,1.0,Fee/PreQual/Technical,.pdf,SBD,17-Jul-2024 02:00 PM,07-Aug-2024 03:00 PM,17-Jul-2024 02:00 PM,07-Aug-2024 02:00 PM,NA ,NA ,17-Jul-2024 02:00 PM,07-Aug-2024 02:00 PM,12-Sep-2024 01:00 PM,"98,720",Yes,fixed,,Nil,Nil,1.0,SBI Bank,"1,000",Nil,Nil,No,"THE COMMISSIONER, GMC","OFFICE OF THE COMMISSIONER, GMC,GANESHGURI, GHY-05",Construction of Paver Road on the embankment for movement of heavy motor vehicles leading from FSTP to Gerons project site.,Construction of Paver Road on the embankment for movement of heavy motor vehicles leading from FSTP to Gerons project site.,Please refer Tender documents. ,NA ,"49,36,000",Civil Works,NA ,Tender,180.0,90.0,GUWAHATI,781006.0,NA ,NA ,NA ,"OFFICE OF THE COMMISSIONER, GMC,GANESHGURI, GHY-05",No ,No,Guwahati Municipal Corporation,GER/MSWM(P)/100/2024/03 Dated 16/07/2024,2024_GMC_38060_1,Yes,Open Tender,Lump-sum,Works,2.0,No,No,Online,No,No,No,1.0,Fee/PreQual/Technical,.pdf,SBD,17-Jul-2024 02:00 PM,07-Aug-2024 03:00 PM,17-Jul-2024 02:00 PM,07-Aug-2024 02:00 PM,NA ,NA ,17-Jul-2024 02:00 PM,07-Aug-2024 02:00 PM,12-Sep-2024 01:00 PM,"98,720",Yes,fixed,,Nil,Nil,1.0,SBI Bank,"1,000",Nil,Nil,No,"THE COMMISSIONER, GMC","OFFICE OF THE COMMISSIONER, GMC,GANESHGURI, GHY-05",Construction of Paver Road on the embankment for movement of heavy motor vehicles leading from FSTP to Gerons project site.,Construction of Paver Road on the embankment for movement of heavy motor vehicles leading from FSTP to Gerons project site.,Please refer Tender documents. ,NA ,"49,36,000",Civil Works,NA ,Tender,180.0,90.0,GUWAHATI,781006.0,NA ,NA ,NA ,"OFFICE OF THE COMMISSIONER, GMC,GANESHGURI, GHY-05",No ,No,23-Oct-2024,"INR 3,546,516",90.0,Deepankar Kakati,29-Oct-2024 11:14 AM,GERON.pdf (302.00 KB),1.0,236213.0,P.S. ENTERPRISE,INR,"3,546,516",1.0,235993.0,Bedanta Choudhury,07-Aug-2024 12:29 PM,Rejected-Technical,As mentioned in the minutes,12-Sep-2024 12:41 PM,Finance,Financial Bids submitted by the bidders have been considered for further Evaluation.,Nabajyoti Bordoloi,20-Sep-2024 04:33 PM,finance_61810.pdf,BOQ Comparative Chart,"Joint Commissioner, GMC",Internal,"Chief Engineer, CAAO, Divisional Engineer, Procurement Officer, MIC Member PWD Works committee",Nabajyoti Bordoloi,07-Oct-2024 12:33 PM,finsummary_61810.pdf (1688.93 KB),1.0,235846.0,M/S. FH Construction,"41,65,984.00",L3,Technical,Cost of Bid documents / Bid Security / Technical Bids submitted by the bidders have been considered for further Evaluation.,Nabajyoti Bordoloi,09-Aug-2024 11:28 AM,technical_61810.pdf,"Joint Commissioner, GMC",Internal,"Chief Engineer, CAAO, Divisional Engineer, Procurement Officer, MIC Member PWD Works committee",Nabajyoti Bordoloi,12-Sep-2024 12:41 PM,12-Sep-2024 01:00 PM,techsummary_61810.pdf (1223.48 KB),,,
,,,,,,,,,,,,,,,,.pdf,Technical Document,,,,,,,,,,,,,,,,,,,,,,,,,,,,,,,,,,,,,,,,,,,,,,,,,,,,,,,,,,.pdf,Technical Document,,,,,,,,,,,,,,,,,,,,,,,,,,,,,,,,,,,,,,,,,,,,,,,,,,,,,2.0,236217.0,JAYANTA SARMAH,06-Aug-2024 06:34 PM,Rejected-AOC,Work allotted to the L1 Bidder,29-Oct-2024 11:14 AM,,,,,,,,,,,,,2.0,235891.0,M/S SAMIA CONSTRUCTION,"35,97,850.40",L2,,,,,,,,,,,,,,,
,,,,,,,,,,,,,,2.0,Finance,.xls,BOQ,,,,,,,,,,,,,,,,,,,,,,,,,,,,,,,,,,,,,,,,,,,,,,,,,,,,,,,,2.0,Finance,.xls,BOQ,,,,,,,,,,,,,,,,,,,,,,,,,,,,,,,,,,,,,,,,,,,,,,,,,,,,,3.0,235846.0,M/S. FH Construction,31-Jul-2024 12:28 PM,Rejected-AOC,Work allotted to the L1 Bidder,29-Oct-2024 11:14 AM,,,,,,,,,,,,,3.0,236213.0,P.S. ENTERPRISE,"35,46,516.00",L1,,,,,,,,,,,,,,,
,,,,,,,,,,,,,,,,,,,,,,,,,,,,,,,,,,,,,,,,,,,,,,,,,,,,,,,,,,,,,,,,,,,,,,,,,,,,,,,,,,,,,,,,,,,,,,,,,,,,,,,,,,,,,,,,,,,,,,,,,,,,,,,,,4.0,235891.0,M/S SAMIA CONSTRUCTION,07-Aug-2024 01:43 PM,Rejected-AOC,Work allotted to the L1 Bidder,29-Oct-2024 11:14 AM,,,,,,,,,,,,,4.0,236217.0,JAYANTA SARMAH,"45,11,504.00",L4,,,,,,,,,,,,,,,
,,,,,,,,,,,,,,,,,,,,,,,,,,,,,,,,,,,,,,,,,,,,,,,,,,,,,,,,,,,,,,,,,,,,,,,,,,,,,,,,,,,,,,,,,,,,,,,,,,,,,,,,,,,,,,,,,,,,,,,,,,,,,,,,,5.0,236222.0,ONE TO TEN SOLUTION PRIVATE LIMITED,07-Aug-2024 12:39 PM,Not Admitted-Finance,Others-The Bidder withdrawn the bid,20-Sep-2024 04:33 PM,,,,,,,,,,,,,,,,,,,,,,,,,,,,,,,,
,,,,,,,,,,,,,,,,,,,,,,,,,,,,,,,,,,,,,,,,,,,,,,,,,,,,,,,,,,,,,,,,,,,,,,,,,,,,,,,,,,,,,,,,,,,,,,,,,,,,,,,,,,,,,,,,,,,,,,,,,,,,,,,,,6.0,236213.0,P.S. ENTERPRISE,06-Aug-2024 11:01 PM,Accepted-AOC,Work allotted to the L1 Bidder,29-Oct-2024 11:14 AM,,,,,,,,,,,,,,,,,,,,,,,,,,,,,,,,
,,,,,,,,,,,,,,,,,,,,,,,,,,,,,,,,,,,,,,,,,,,,,,,,,,,,,,,,,,,,,,,,,,,,,,,,,,,,,,,,,,,,,,,,,,,,,,,,,,,,,,,,,,,,,,,,,,,,,,,,,,,,,,,,,7.0,236310.0,RAHUL KALITA,07-Aug-2024 12:53 PM,Rejected-Technical,As mentioned in the minutes,12-Sep-2024 12:41 PM,,,,,,,,,,,,,,,,,,,,,,,,,,,,,,,,
,,,,,,,,,,,,,,,,,,,,,,,,,,,,,,,,,,,,,,,,,,,,,,,,,,,,,,,,,,,,,,,,,,,,,,,,,,,,,,,,,,,,,,,,,,,,,,,,,,,,,,,,,,,,,,,,,,,,,,,,,,,,,,,,,,,,,,,,,,,,,,,,,,,,,,,,,,,,,,,,,,,,,2024_GMC_38060_1,GER/MSWM(P)/100/2024/03 Dated 16/07/2024,Construction of Paver Road on the embankment for movement of heavy motor vehicles leading from FSTP to Gerons project site.
