Organisation Chain,Tender Reference Number,Tender ID,Withdrawal Allowed,Tender Type,Form of contract,Tender Category,No. of Covers,General Technical Evaluation Allowed,ItemWise Technical Evaluation Allowed,Payment Mode,Is Multi Currency Allowed For BOQ,Is Multi Currency Allowed For Fee,Allow Two Stage Bidding,Cover No,Cover,Document Type,Description,Publish Date,Bid Opening Date,Document Download / Sale Start Date,Document Download / Sale End Date,Clarification Start Date,Clarification End Date,Bid Submission Start Date,Bid Submission End Date,Financial Bid Opening Date,EMD Amount in ₹,EMD Exemption Allowed,EMD Fee Type,EMD Percentage,EMD Payable To,EMD Payable At,S.No,Corrigendum Title,Corrigendum Type,View,S.No.1,Bank Name,Tender Fee in ₹,Fee Payable To,Fee Payable At,Tender Fee Exemption Allowed,Name,Address,Title,Work Description,Pre Qualification Details,Independent External Monitor/Remarks,Tender Value in ₹,Product Category,Sub category,Contract Type,Bid Validity(Days),Period Of Work(Days),Location,Pincode,Pre Bid Meeting Place,Pre Bid Meeting Address,Pre Bid Meeting Date,Bid Opening Place,Should Allow NDA Tender,Allow Preferential Bidder,Organisation Chain,Tender Reference Number,Tender ID,Withdrawal Allowed,Tender Type,Form of contract,Tender Category,No. of Covers,General Technical Evaluation Allowed,ItemWise Technical Evaluation Allowed,Payment Mode,Is Multi Currency Allowed For BOQ,Is Multi Currency Allowed For Fee,Allow Two Stage Bidding,Cover No,Cover,Document Type,Description,Publish Date,Bid Opening Date,Document Download / Sale Start Date,Document Download / Sale End Date,Clarification Start Date,Clarification End Date,Bid Submission Start Date,Bid Submission End Date,Financial Bid Opening Date,EMD Amount in ₹,EMD Exemption Allowed,EMD Fee Type,EMD Percentage,EMD Payable To,EMD Payable At,S.No,Corrigendum Title,Corrigendum Type,View,S.No.1,Bank Name,Tender Fee in ₹,Fee Payable To,Fee Payable At,Tender Fee Exemption Allowed,Name,Address,Title,Work Description,Pre Qualification Details,Independent External Monitor/Remarks,Tender Value in ₹,Product Category,Sub category,Contract Type,Bid Validity(Days),Period Of Work(Days),Location,Pincode,Pre Bid Meeting Place,Pre Bid Meeting Address,Pre Bid Meeting Date,Bid Opening Place,Should Allow NDA Tender,Allow Preferential Bidder,Contract Date :,Contract Value :,Work Completion Period in days :,Updated By :,Updated on :,AOC document :,AOC Description :,S.No.2,Bid Number,Bidder Name,Awarded Currency,Awarded Value,S.No.3,Bid Number.1,Bidder Name.1,Submitted Date,Status,Remarks,Status Updated On,Type :,Summary :,Updated By :.1,Updated On :,Document :,BOQ Comparative Chart :,Committee Chairperson/Co-ordinator Name :,Committee Chairperson/Co-ordinator Type :,Committee Members :,Updated By :.2,Updated on :.1,Document :.1,S.No.4,Bid Number.2,Bidder Name.2,Value,Rank,Type :.1,Summary :.1,Updated By :.3,Updated On :.1,Document :.2,Committee Chairperson/Co-ordinator Name :.1,Committee Chairperson/Co-ordinator Type :.1,Committee Members :.1,Updated By :.4,Updated On :.2,Financial Bid Opening Date:,Document :.3,S.No.5,Revocation Title,Revocation Description,Published Date,Document Name,Document Size(in KB),Revocated To,Tender ID :,Tender Ref No :,Tender Title :
Director- Fire and Emergency Services-Assam,FG/533/PT-II/2023-24/443 Dated. 02.03.2024,2024_FESA_36881_1,Yes,Open Tender,Item Rate,Works,2.0,No,No,Online,No,No,No,1.0,Fee/PreQual/Technical,.pdf,Seal Sign Tender Document,04-Mar-2024 05:00 PM,30-Mar-2024 05:00 PM,04-Mar-2024 05:00 PM,30-Mar-2024 04:00 PM,NA ,NA ,04-Mar-2024 05:00 PM,30-Mar-2024 04:00 PM,06-Jul-2024 04:00 PM,"4,19,997",Yes,percentage,2.0%,Nil,Nil,1.0,Date Extension Corrigendum 2,Date,,1.0,SBI Bank,"1,000",Nil,Nil,No,"Supdt. of Police cum F and ESA, Assam","Oo Director of F and ES Assam, Panbazar Ghy 01","Construction of RCC 3(three) storied Fire Station Building, Under Ground Water Reservoir (1.00 Lakh Ltr. Capacity), Boundary Wall and Security Fencing with Heavy Duty Iron Gate etc. at Borhola in Jorhat District,Assam","Construction of RCC 3(three) storied Fire Station Building, Under Ground Water Reservoir (1.00 Lakh Ltr. Capacity), Boundary Wall and Security Fencing with Heavy Duty Iron Gate etc. at Borhola in Jorhat District,Assam",Please refer to the Tender Document ,NA ,"2,09,99,857",Civil Works - Building,NA ,Tender,180.0,730.0,"Borhola in Jorhat District,Assam",785631.0,"Oo Director of F and ES Assam, Panbazar Ghy 01 ","Oo Director of F and ES Assam, Panbazar Ghy 01 ",12-Mar-2024 02:00 PM ,"Oo Director of F and ES Assam, Panbazar Ghy 01",No ,No,Director- Fire and Emergency Services-Assam,FG/533/PT-II/2023-24/443 Dated. 02.03.2024,2024_FESA_36881_1,Yes,Open Tender,Item Rate,Works,2.0,No,No,Online,No,No,No,1.0,Fee/PreQual/Technical,.pdf,Seal Sign Tender Document,04-Mar-2024 05:00 PM,30-Mar-2024 05:00 PM,04-Mar-2024 05:00 PM,30-Mar-2024 04:00 PM,NA ,NA ,04-Mar-2024 05:00 PM,30-Mar-2024 04:00 PM,06-Jul-2024 04:00 PM,"4,19,997",Yes,percentage,2.0%,Nil,Nil,1.0,Date Extension Corrigendum 2,Date,,1.0,SBI Bank,"1,000",Nil,Nil,No,"Supdt. of Police cum F and ESA, Assam","Oo Director of F and ES Assam, Panbazar Ghy 01","Construction of RCC 3(three) storied Fire Station Building, Under Ground Water Reservoir (1.00 Lakh Ltr. Capacity), Boundary Wall and Security Fencing with Heavy Duty Iron Gate etc. at Borhola in Jorhat District,Assam","Construction of RCC 3(three) storied Fire Station Building, Under Ground Water Reservoir (1.00 Lakh Ltr. Capacity), Boundary Wall and Security Fencing with Heavy Duty Iron Gate etc. at Borhola in Jorhat District,Assam",Please refer to the Tender Document ,NA ,"2,09,99,857",Civil Works - Building,NA ,Tender,180.0,730.0,"Borhola in Jorhat District,Assam",785631.0,"Oo Director of F and ES Assam, Panbazar Ghy 01 ","Oo Director of F and ES Assam, Panbazar Ghy 01 ",12-Mar-2024 02:00 PM ,"Oo Director of F and ES Assam, Panbazar Ghy 01",No ,No,18-Oct-2024,"INR 17,248,985",730.0,Mrinal Talukdar,18-Oct-2024 05:07 PM,WOBorhola.pdf (832.00 KB),Rate Quoted by Sri Rajen Chandra Das and select as L-1 Bidder,1.0,231044.0,Rajen Chandra Das,INR,"17,248,985",1.0,230944.0,M/S Metro Associates,26-Mar-2024 02:51 PM,Rejected-Finance,Financially Disqualified. Please refer to the Financial evaluation Minutes.,18-Oct-2024 04:37 PM,Finance,Financial Bid opened on 6 July 2024,Mrinal Talukdar,19-Sep-2024 02:18 PM,None,BOQ Comparative Chart,Dr Sadique Ali Ahmed APS,Internal,"Trailokya Das AFS, Mrinal Talukdar AEE, Himangshu Baruah APS, Biswajit Baishya APS",Mrinal Talukdar,18-Oct-2024 04:37 PM,finsummary_60204.pdf (359.55 KB),1.0,230931.0,R D Enterprise,"1,99,12,169.00",L-2,Technical,Technical Bid Opened,Nabajyoti Borah,27-Jun-2024 04:02 PM,technical_60204.pdf,Dr Sadique Ali Ahmed APS,Internal,"Trailokya Das AFS, Mrinal Talukdar AEE, Himangshu Baruah APS, Biswajit Baishya APS",Nabajyoti Borah,27-Jun-2024 04:04 PM,06-Jul-2024 04:00 PM,techsummary_60204.pdf (489.46 KB),1.0,Tender Revocation,Tender Revocation from Technical Evaluation to Technical Opening Stage.,27-Jun-2024 03:52 PM,BorholaCOOr.pdf ,156.83,Technical Opening,,,
,,,,,,,,,,,,,,,,.pdf,Technical Qualification,,,,,,,,,,,,,,,,2.0,Financial Bid Opening Date Corrigendum,Financial Bid Opening Date Corrigendum,,,,,,,,,,,,,,,,,,,,,,,,,,,,,,,,,,,,,,,,,,,,.pdf,Technical Qualification,,,,,,,,,,,,,,,,2.0,Financial Bid Opening Date Corrigendum,Financial Bid Opening Date Corrigendum,,,,,,,,,,,,,,,,,,,,,,,,,,,,,,,,,,,,,,,,2.0,230946.0,PRINT MASTER,26-Mar-2024 03:13 PM,Rejected-Technical,Technically Disqualified,27-Jun-2024 04:04 PM,,,,,,,,,,,,,2.0,230944.0,M/S Metro Associates,"2,08,49,736.00",L-3,,,,,,,,,,,,,,,,,,,,,,
,,,,,,,,,,,,,,,,.pdf,Tender paper cost and EMD,,,,,,,,,,,,,,,,,,,,,,,,,,,,,,,,,,,,,,,,,,,,,,,,,,,,,,,,,,,,,,.pdf,Tender paper cost and EMD,,,,,,,,,,,,,,,,,,,,,,,,,,,,,,,,,,,,,,,,,,,,,,,,,,,,,,,,,,3.0,231044.0,Rajen Chandra Das,26-Mar-2024 03:36 PM,Accepted-AOC,Rate Quoted by Sri Rajen Chandra Das and select as L-1 Bidder. Hence work order Issued.,18-Oct-2024 05:07 PM,,,,,,,,,,,,,3.0,231044.0,Rajen Chandra Das,"1,72,48,985.10",L-1,,,,,,,,,,,,,,,,,,,,,,
,,,,,,,,,,,,,,2.0,Finance,.xls,BOQ,,,,,,,,,,,,,,,,,,,,,,,,,,,,,,,,,,,,,,,,,,,,,,,,,,,,,,,,,,,,2.0,Finance,.xls,BOQ,,,,,,,,,,,,,,,,,,,,,,,,,,,,,,,,,,,,,,,,,,,,,,,,,,,,,,,,,,4.0,230931.0,R D Enterprise,29-Mar-2024 06:28 PM,Rejected-Finance,Financially Disqualified. Please refer to the Financial evaluation Minutes.,18-Oct-2024 04:37 PM,,,,,,,,,,,,,,,,,,,,,,,,,,,,,,,,,,,,,,,
,,,,,,,,,,,,,,,,.pdf,FOB,,,,,,,,,,,,,,,,,,,,,,,,,,,,,,,,,,,,,,,,,,,,,,,,,,,,,,,,,,,,,,.pdf,FOB,,,,,,,,,,,,,,,,,,,,,,,,,,,,,,,,,,,,,,,,,,,,,,,,,,,,,,,,,,,,,,,,,,,,,,,,,,,,,,,,,,,,,,,,,,,,,,,,,,,,,,,
,,,,,,,,,,,,,,,,,,,,,,,,,,,,,,,,,,,,,,,,,,,,,,,,,,,,,,,,,,,,,,,,,,,,,,,,,,,,,,,,,,,,,,,,,,,,,,,,,,,,,,,,,,,,,,,,,,,,,,,,,,,,,,,,,,,,,,,,,,,,,,,,,,,,,,,,,,,,,,,,,,,,,,,,,,,,,,,,,,,,,2024_FESA_36881_1,FG/533/PT-II/2023-24/443 Dated. 02.03.2024,"Construction of RCC 3(three) storied Fire Station Building, Under Ground Water Reservoir (1.00 Lakh Ltr. Capacity), Boundary Wall and Security Fencing with Heavy Duty Iron Gate etc. at Borhola in Jorhat District,Assam"
