Organisation Chain,Tender Reference Number,Tender ID,Withdrawal Allowed,Tender Type,Form of contract,Tender Category,No. of Covers,General Technical Evaluation Allowed,ItemWise Technical Evaluation Allowed,Payment Mode,Is Multi Currency Allowed For BOQ,Is Multi Currency Allowed For Fee,Allow Two Stage Bidding,Cover No,Cover,Document Type,Description,Publish Date,Bid Opening Date,Document Download / Sale Start Date,Document Download / Sale End Date,Clarification Start Date,Clarification End Date,Bid Submission Start Date,Bid Submission End Date,Financial Bid Opening Date,EMD Amount in ₹,EMD Exemption Allowed,EMD Fee Type,EMD Percentage,EMD Payable To,EMD Payable At,S.No,Corrigendum Title,Corrigendum Type,View,S.No.1,Bank Name,Tender Fee in ₹,Fee Payable To,Fee Payable At,Tender Fee Exemption Allowed,Name,Address,Title,Work Description,Pre Qualification Details,Independent External Monitor/Remarks,Tender Value in ₹,Product Category,Sub category,Contract Type,Bid Validity(Days),Period Of Work(Days),Location,Pincode,Pre Bid Meeting Place,Pre Bid Meeting Address,Pre Bid Meeting Date,Bid Opening Place,Should Allow NDA Tender,Allow Preferential Bidder,Organisation Chain,Tender Reference Number,Tender ID,Withdrawal Allowed,Tender Type,Form of contract,Tender Category,No. of Covers,General Technical Evaluation Allowed,ItemWise Technical Evaluation Allowed,Payment Mode,Is Multi Currency Allowed For BOQ,Is Multi Currency Allowed For Fee,Allow Two Stage Bidding,Cover No,Cover,Document Type,Description,Publish Date,Bid Opening Date,Document Download / Sale Start Date,Document Download / Sale End Date,Clarification Start Date,Clarification End Date,Bid Submission Start Date,Bid Submission End Date,Financial Bid Opening Date,EMD Amount in ₹,EMD Exemption Allowed,EMD Fee Type,EMD Percentage,EMD Payable To,EMD Payable At,S.No,Corrigendum Title,Corrigendum Type,View,S.No.1,Bank Name,Tender Fee in ₹,Fee Payable To,Fee Payable At,Tender Fee Exemption Allowed,Name,Address,Title,Work Description,Pre Qualification Details,Independent External Monitor/Remarks,Tender Value in ₹,Product Category,Sub category,Contract Type,Bid Validity(Days),Period Of Work(Days),Location,Pincode,Pre Bid Meeting Place,Pre Bid Meeting Address,Pre Bid Meeting Date,Bid Opening Place,Should Allow NDA Tender,Allow Preferential Bidder,Contract Date :,Contract Value :,Work Completion Period in days :,Updated By :,Updated on :,AOC document :,S.No.2,Bid Number,Bidder Name,Awarded Currency,Awarded Value,S.No.3,Bid Number.1,Bidder Name.1,Submitted Date,Status,Remarks,Status Updated On,Type :,Summary :,Updated By :.1,Updated On :,Document :,BOQ Comparative Chart :,Committee Chairperson/Co-ordinator Name :,Committee Chairperson/Co-ordinator Type :,Committee Members :,Updated By :.2,Updated on :.1,Document :.1,S.No.4,Bid Number.2,Bidder Name.2,Value,Rank,Type :.1,Summary :.1,Updated By :.3,Updated On :.1,Document :.2,Committee Chairperson/Co-ordinator Name :.1,Committee Chairperson/Co-ordinator Type :.1,Committee Members :.1,Updated By :.4,Updated On :.2,Financial Bid Opening Date:,Document :.3,Tender ID :,Tender Ref No :,Tender Title :
Public Works Roads Department-Externally Aided Project||Public Works Road Department- World Bank Funded Tenders||Assam State Bridge Infrastructure Program,CE/EAPARRBP111TENDERS2023PT1/7,2023_PWRDW_34829_2,Yes,Open Tender,Item Rate,Works,2.0,No,No,Online,No,No,No,1.0,Fee/PreQual/Technical,.pdf,SBD,19-Dec-2023 05:45 PM,18-Jan-2024 02:30 PM,19-Dec-2023 05:45 PM,18-Jan-2024 02:00 PM,19-Dec-2023 05:55 PM ,27-Dec-2023 11:00 AM ,19-Dec-2023 05:55 PM,18-Jan-2024 02:00 PM,23-Feb-2024 03:00 PM,"10,72,000",Yes,fixed,,Nil,Nil,1.0,Corrigendum -1,Technical Bid,,1.0,SBI Bank,"5,000",Nil,Nil,Yes,"CE (EAP), PWRD, ASSAM","CE(EAP), PWRD, FATASIL AMBARI GUWAHATI, ASSAM -25",Construction of Bridges in Charaideo district 1. Br. No. 2/2 on Kalakata Gohain Gaon 2. Br. No. 16/2 on Lahdoigarh Road 3. Br. No. 1/3 on Harudoi Bihua Ali,CE/EAP/ARRBP/OCB/Bridges3/Charaideo/03 Construction of Bridges in Charaideo district 1. Br. No. 2/2 on Kalakata Gohain Gaon 2. Br. No. 16/2 on Lahdoigarh Road 3. Br. No. 1/3 on Harudoi Bihua Ali,Please refer Tender documents. ,NA ,"5,35,98,000",Civil Works - Bridges,NA ,Tender,90.0,720.0,Charaideo,785692.0,"O/O CE(EAP), PWRD, GUWAHATI. ","CE(EAP), PWRD, FATASIL AMBARI GUWAHATI, ASSAM -25  ",27-Dec-2023 11:00 AM ,"O/O CE(EAP), PWRD, GUWAHATI.",No ,No,Public Works Roads Department-Externally Aided Project||Public Works Road Department- World Bank Funded Tenders||Assam State Bridge Infrastructure Program,CE/EAPARRBP111TENDERS2023PT1/7,2023_PWRDW_34829_2,Yes,Open Tender,Item Rate,Works,2.0,No,No,Online,No,No,No,1.0,Fee/PreQual/Technical,.pdf,SBD,19-Dec-2023 05:45 PM,18-Jan-2024 02:30 PM,19-Dec-2023 05:45 PM,18-Jan-2024 02:00 PM,19-Dec-2023 05:55 PM ,27-Dec-2023 11:00 AM ,19-Dec-2023 05:55 PM,18-Jan-2024 02:00 PM,23-Feb-2024 03:00 PM,"10,72,000",Yes,fixed,,Nil,Nil,1.0,Corrigendum -1,Technical Bid,,1.0,SBI Bank,"5,000",Nil,Nil,Yes,"CE (EAP), PWRD, ASSAM","CE(EAP), PWRD, FATASIL AMBARI GUWAHATI, ASSAM -25",Construction of Bridges in Charaideo district 1. Br. No. 2/2 on Kalakata Gohain Gaon 2. Br. No. 16/2 on Lahdoigarh Road 3. Br. No. 1/3 on Harudoi Bihua Ali,CE/EAP/ARRBP/OCB/Bridges3/Charaideo/03 Construction of Bridges in Charaideo district 1. Br. No. 2/2 on Kalakata Gohain Gaon 2. Br. No. 16/2 on Lahdoigarh Road 3. Br. No. 1/3 on Harudoi Bihua Ali,Please refer Tender documents. ,NA ,"5,35,98,000",Civil Works - Bridges,NA ,Tender,90.0,720.0,Charaideo,785692.0,"O/O CE(EAP), PWRD, GUWAHATI. ","CE(EAP), PWRD, FATASIL AMBARI GUWAHATI, ASSAM -25  ",27-Dec-2023 11:00 AM ,"O/O CE(EAP), PWRD, GUWAHATI.",No ,No,28-Oct-2024,"INR 52,250,096.5",720.0,Sanjita Bodo,28-Oct-2024 05:58 PM,Charaideo_03_Work_Order.pdf (65.00 KB),1.0,219402.0,Pulin Gayan,INR,"52,250,096.5",1.0,221003.0,Kuladhar Boruah,17-Jan-2024 08:12 PM,Rejected-Technical,Non-Responsive,21-Feb-2024 03:55 PM,Finance,Financial Bid opened,Sanjita Bodo,23-Feb-2024 06:05 PM,None,BOQ Comparative Chart,"Chief Engineer (EAP), PWRD",Internal,,Sanjita Bodo,28-Oct-2024 05:55 PM,finsummary_56452.pdf (93.98 KB),1.0,219402.0,Pulin Gayan,"5,22,50,096.50",L1,Technical,Technical Bid opened,Sanjita Bodo,21-Feb-2024 03:53 PM,None,"Chief Engineer (EAP), PWRD",Internal,,Sanjita Bodo,21-Feb-2024 03:55 PM,23-Feb-2024 03:00 PM,techsummary_56452.pdf (134.74 KB),,,
,,,,,,,,,,,,,,,,.pdf,EMD DETAILS,,,,,,,,,,,,,,,,,,,,,,,,,,,,,,,,,,,,,,,,,,,,,,,,,,,,,,,,,,,,,,.pdf,EMD DETAILS,,,,,,,,,,,,,,,,,,,,,,,,,,,,,,,,,,,,,,,,,,,,,,,,,,,,,,,,,2.0,220998.0,MS MANAB JYOTI GOGOI AND CO.,18-Jan-2024 12:32 AM,Rejected-Technical,Non-Responsive,21-Feb-2024 03:55 PM,,,,,,,,,,,,,,,,,,,,,,,,,,,,,,,,
,,,,,,,,,,,,,,,,.pdf,TECHNICAL QUALIFICATION,,,,,,,,,,,,,,,,,,,,,,,,,,,,,,,,,,,,,,,,,,,,,,,,,,,,,,,,,,,,,,.pdf,TECHNICAL QUALIFICATION,,,,,,,,,,,,,,,,,,,,,,,,,,,,,,,,,,,,,,,,,,,,,,,,,,,,,,,,,3.0,219402.0,Pulin Gayan,18-Jan-2024 01:50 PM,Accepted-AOC,L1,28-Oct-2024 05:58 PM,,,,,,,,,,,,,,,,,,,,,,,,,,,,,,,,
,,,,,,,,,,,,,,,,.pdf,LETTER OF TECHNICAL BID,,,,,,,,,,,,,,,,,,,,,,,,,,,,,,,,,,,,,,,,,,,,,,,,,,,,,,,,,,,,,,.pdf,LETTER OF TECHNICAL BID,,,,,,,,,,,,,,,,,,,,,,,,,,,,,,,,,,,,,,,,,,,,,,,,,,,,,,,,,,,,,,,,,,,,,,,,,,,,,,,,,,,,,,,,,,,,,,,
,,,,,,,,,,,,,,,,.pdf,ESMP,,,,,,,,,,,,,,,,,,,,,,,,,,,,,,,,,,,,,,,,,,,,,,,,,,,,,,,,,,,,,,.pdf,ESMP,,,,,,,,,,,,,,,,,,,,,,,,,,,,,,,,,,,,,,,,,,,,,,,,,,,,,,,,,,,,,,,,,,,,,,,,,,,,,,,,,,,,,,,,,,,,,,,
,,,,,,,,,,,,,,2.0,Finance,.xls,BOQ,,,,,,,,,,,,,,,,,,,,,,,,,,,,,,,,,,,,,,,,,,,,,,,,,,,,,,,,,,,,2.0,Finance,.xls,BOQ,,,,,,,,,,,,,,,,,,,,,,,,,,,,,,,,,,,,,,,,,,,,,,,,,,,,,,,,,,,,,,,,,,,,,,,,,,,,,,,,,,,,,,,,,,,,,,,
,,,,,,,,,,,,,,,,.pdf,LETTER OF FINANCIAL BID,,,,,,,,,,,,,,,,,,,,,,,,,,,,,,,,,,,,,,,,,,,,,,,,,,,,,,,,,,,,,,.pdf,LETTER OF FINANCIAL BID,,,,,,,,,,,,,,,,,,,,,,,,,,,,,,,,,,,,,,,,,,,,,,,,,,,,,,,,,,,,,,,,,,,,,,,,,,,,,,,,,,,,,,,,,,,,,,,
,,,,,,,,,,,,,,,,,,,,,,,,,,,,,,,,,,,,,,,,,,,,,,,,,,,,,,,,,,,,,,,,,,,,,,,,,,,,,,,,,,,,,,,,,,,,,,,,,,,,,,,,,,,,,,,,,,,,,,,,,,,,,,,,,,,,,,,,,,,,,,,,,,,,,,,,,,,,,,,,,,,,,,,,,,,,,2023_PWRDW_34829_2,CE/EAPARRBP111TENDERS2023PT1/7,Construction of Bridges in Charaideo district 1. Br. No. 2/2 on Kalakata Gohain Gaon 2. Br. No. 16/2 on Lahdoigarh Road 3. Br. No. 1/3 on Harudoi Bihua Ali
