Organisation Chain,Tender Reference Number,Tender ID,Withdrawal Allowed,Tender Type,Form of contract,Tender Category,No. of Covers,General Technical Evaluation Allowed,ItemWise Technical Evaluation Allowed,Payment Mode,Is Multi Currency Allowed For BOQ,Is Multi Currency Allowed For Fee,Allow Two Stage Bidding,Cover No,Cover,Document Type,Description,Publish Date,Bid Opening Date,Document Download / Sale Start Date,Document Download / Sale End Date,Clarification Start Date,Clarification End Date,Bid Submission Start Date,Bid Submission End Date,Financial Bid Opening Date,EMD Amount in ₹,EMD Exemption Allowed,EMD Fee Type,EMD Percentage,EMD Payable To,EMD Payable At,S.No,Corrigendum Title,Corrigendum Type,View,S.No.1,Bank Name,Tender Fee in ₹,Fee Payable To,Fee Payable At,Tender Fee Exemption Allowed,Name,Address,Title,Work Description,Pre Qualification Details,Independent External Monitor/Remarks,Tender Value in ₹,Product Category,Sub category,Contract Type,Bid Validity(Days),Period Of Work(Days),Location,Pincode,Pre Bid Meeting Place,Pre Bid Meeting Address,Pre Bid Meeting Date,Bid Opening Place,Should Allow NDA Tender,Allow Preferential Bidder,Organisation Chain,Tender Reference Number,Tender ID,Withdrawal Allowed,Tender Type,Form of contract,Tender Category,No. of Covers,General Technical Evaluation Allowed,ItemWise Technical Evaluation Allowed,Payment Mode,Is Multi Currency Allowed For BOQ,Is Multi Currency Allowed For Fee,Allow Two Stage Bidding,Cover No,Cover,Document Type,Description,Publish Date,Bid Opening Date,Document Download / Sale Start Date,Document Download / Sale End Date,Clarification Start Date,Clarification End Date,Bid Submission Start Date,Bid Submission End Date,Financial Bid Opening Date,EMD Amount in ₹,EMD Exemption Allowed,EMD Fee Type,EMD Percentage,EMD Payable To,EMD Payable At,S.No,Corrigendum Title,Corrigendum Type,View,S.No.1,Bank Name,Tender Fee in ₹,Fee Payable To,Fee Payable At,Tender Fee Exemption Allowed,Name,Address,Title,Work Description,Pre Qualification Details,Independent External Monitor/Remarks,Tender Value in ₹,Product Category,Sub category,Contract Type,Bid Validity(Days),Period Of Work(Days),Location,Pincode,Pre Bid Meeting Place,Pre Bid Meeting Address,Pre Bid Meeting Date,Bid Opening Place,Should Allow NDA Tender,Allow Preferential Bidder,Contract Date :,Contract Value :,Work Completion Period in days :,Updated By :,Updated on :,AOC document :,S.No.2,Bid Number,Bidder Name,Awarded Currency,Awarded Value,S.No.3,Bid Number.1,Bidder Name.1,Submitted Date,Status,Remarks,Status Updated On,Type :,Summary :,Updated By :.1,Updated On :,Document :,BOQ Comparative Chart :,Committee Chairperson/Co-ordinator Name :,Committee Chairperson/Co-ordinator Type :,Committee Members :,Updated By :.2,Updated on :.1,Document :.1,S.No.4,Bid Number.2,Bidder Name.2,Value,Rank,Type :.1,Summary :.1,Updated By :.3,Updated On :.1,Document :.2,Committee Chairperson/Co-ordinator Name :.1,Committee Chairperson/Co-ordinator Type :.1,Committee Members :.1,Updated By :.4,Updated On :.2,Financial Bid Opening Date:,Document :.3,Tender ID :,Tender Ref No :,Tender Title :
Public Works Roads Department-Externally Aided Project||Public Works Road Department- World Bank Funded Tenders||Assam State Bridge Infrastructure Program,RFB No. CEEAPARRBP111TENDERS2024-42,2024_PWRDW_36852_12,Yes,Open Tender,Item Rate,Works,2.0,No,No,Online,No,No,No,1.0,Fee/PreQual/Technical,.pdf,SBD,05-Mar-2024 05:30 PM,10-Apr-2024 02:30 PM,05-Mar-2024 05:30 PM,10-Apr-2024 02:00 PM,05-Mar-2024 05:30 PM ,08-Mar-2024 11:00 AM ,05-Mar-2024 05:30 PM,10-Apr-2024 02:00 PM,03-Jun-2024 01:00 PM,"6,63,000",Yes,fixed,,Nil,Nil,1.0,Date Corrigendum,Date,,1.0,SBI Bank,"5,000",Nil,Nil,No,"Chief Engineer(EAP), PWRD, Assam","O/o the Chief Engineer(EAP), PWRD, Assam, Fatasil Ambari, Guwahati-25",Construction of Bridge in Dhubri district i. Br. No. 2/1 on Howrapar Bazar to Dharmasala via Borbila Village Road,CE/EAP/ARRBP/OCB/Bridge-1/Dhubri/04 Construction of Bridge in Dhubri district i. Br. No. 2/1 on Howrapar Bazar to Dharmasala via Borbila Village Road,Please refer Tender documents. ,NA ,"3,31,30,000",Civil Works,NA ,Tender,90.0,540.0,Dhubri,783301.0,"O/o the Chief Engineer(EAP), PWRD, Assam ","O/o the Chief Engineer(EAP), PWRD, Assam, Fatasil Ambari, Guwahati-25 ",08-Mar-2024 11:00 AM ,"O/o the Chief Engineer(EAP), PWRD, Assam",No ,No,Public Works Roads Department-Externally Aided Project||Public Works Road Department- World Bank Funded Tenders||Assam State Bridge Infrastructure Program,RFB No. CEEAPARRBP111TENDERS2024-42,2024_PWRDW_36852_12,Yes,Open Tender,Item Rate,Works,2.0,No,No,Online,No,No,No,1.0,Fee/PreQual/Technical,.pdf,SBD,05-Mar-2024 05:30 PM,10-Apr-2024 02:30 PM,05-Mar-2024 05:30 PM,10-Apr-2024 02:00 PM,05-Mar-2024 05:30 PM ,08-Mar-2024 11:00 AM ,05-Mar-2024 05:30 PM,10-Apr-2024 02:00 PM,03-Jun-2024 01:00 PM,"6,63,000",Yes,fixed,,Nil,Nil,1.0,Date Corrigendum,Date,,1.0,SBI Bank,"5,000",Nil,Nil,No,"Chief Engineer(EAP), PWRD, Assam","O/o the Chief Engineer(EAP), PWRD, Assam, Fatasil Ambari, Guwahati-25",Construction of Bridge in Dhubri district i. Br. No. 2/1 on Howrapar Bazar to Dharmasala via Borbila Village Road,CE/EAP/ARRBP/OCB/Bridge-1/Dhubri/04 Construction of Bridge in Dhubri district i. Br. No. 2/1 on Howrapar Bazar to Dharmasala via Borbila Village Road,Please refer Tender documents. ,NA ,"3,31,30,000",Civil Works,NA ,Tender,90.0,540.0,Dhubri,783301.0,"O/o the Chief Engineer(EAP), PWRD, Assam ","O/o the Chief Engineer(EAP), PWRD, Assam, Fatasil Ambari, Guwahati-25 ",08-Mar-2024 11:00 AM ,"O/o the Chief Engineer(EAP), PWRD, Assam",No ,No,25-Oct-2024,"INR 32,989,008",540.0,Sanjita Bodo,25-Oct-2024 04:13 PM,Dhubri_04_Work_Order.pdf (77.00 KB),1.0,232107.0,Parihash Paul,INR,"32,989,008",1.0,232107.0,Parihash Paul,09-Apr-2024 08:59 PM,Accepted-AOC,L1,25-Oct-2024 04:14 PM,Finance,Financial Bid opened,Sharadi Borah,03-Jun-2024 07:30 PM,None,BOQ Comparative Chart,"Chief Engineer (EAP), PWRD",Internal,,Sanjita Bodo,25-Oct-2024 04:11 PM,finsummary_60278.pdf (100.54 KB),1.0,232107.0,Parihash Paul,"3,29,89,008.00",L1,Technical,Technical bid opened,Dilip Das,02-Jun-2024 01:27 PM,None,"Chief Engineer (EAP), PWRD, Assam",Internal,,Dilip Das,02-Jun-2024 02:31 PM,03-Jun-2024 01:00 PM,techsummary_60278.pdf (273.28 KB),,,
,,,,,,,,,,,,,,,,.pdf,Technical Qualification Details,,,,,,,,,,,,,,,,2.0,Corrigendum for Work Completion Period in days,Technical Bid,,,,,,,,,,,,,,,,,,,,,,,,,,,,,,,,,,,,,,,,,,,,.pdf,Technical Qualification Details,,,,,,,,,,,,,,,,2.0,Corrigendum for Work Completion Period in days,Technical Bid,,,,,,,,,,,,,,,,,,,,,,,,,,,,,,,,,,,,,,,,,,,,,,,,,,,,,,,,,,,,,,,,,,,,,,,,,,,,,
,,,,,,,,,,,,,,,,.pdf,Letter of Technical Bid,,,,,,,,,,,,,,,,,,,,,,,,,,,,,,,,,,,,,,,,,,,,,,,,,,,,,,,,,,,,,,.pdf,Letter of Technical Bid,,,,,,,,,,,,,,,,,,,,,,,,,,,,,,,,,,,,,,,,,,,,,,,,,,,,,,,,,,,,,,,,,,,,,,,,,,,,,,,,,,,,,,,,,,,,,,,
,,,,,,,,,,,,,,,,.pdf,EMD,,,,,,,,,,,,,,,,,,,,,,,,,,,,,,,,,,,,,,,,,,,,,,,,,,,,,,,,,,,,,,.pdf,EMD,,,,,,,,,,,,,,,,,,,,,,,,,,,,,,,,,,,,,,,,,,,,,,,,,,,,,,,,,,,,,,,,,,,,,,,,,,,,,,,,,,,,,,,,,,,,,,,
,,,,,,,,,,,,,,,,.pdf,EMP Document,,,,,,,,,,,,,,,,,,,,,,,,,,,,,,,,,,,,,,,,,,,,,,,,,,,,,,,,,,,,,,.pdf,EMP Document,,,,,,,,,,,,,,,,,,,,,,,,,,,,,,,,,,,,,,,,,,,,,,,,,,,,,,,,,,,,,,,,,,,,,,,,,,,,,,,,,,,,,,,,,,,,,,,
,,,,,,,,,,,,,,2.0,Finance,.xls,BoQ,,,,,,,,,,,,,,,,,,,,,,,,,,,,,,,,,,,,,,,,,,,,,,,,,,,,,,,,,,,,2.0,Finance,.xls,BoQ,,,,,,,,,,,,,,,,,,,,,,,,,,,,,,,,,,,,,,,,,,,,,,,,,,,,,,,,,,,,,,,,,,,,,,,,,,,,,,,,,,,,,,,,,,,,,,,
,,,,,,,,,,,,,,,,.pdf,Letter of Financial Bid,,,,,,,,,,,,,,,,,,,,,,,,,,,,,,,,,,,,,,,,,,,,,,,,,,,,,,,,,,,,,,.pdf,Letter of Financial Bid,,,,,,,,,,,,,,,,,,,,,,,,,,,,,,,,,,,,,,,,,,,,,,,,,,,,,,,,,,,,,,,,,,,,,,,,,,,,,,,,,,,,,,,,,,,,,,,
,,,,,,,,,,,,,,,,,,,,,,,,,,,,,,,,,,,,,,,,,,,,,,,,,,,,,,,,,,,,,,,,,,,,,,,,,,,,,,,,,,,,,,,,,,,,,,,,,,,,,,,,,,,,,,,,,,,,,,,,,,,,,,,,,,,,,,,,,,,,,,,,,,,,,,,,,,,,,,,,,,,,,,,,,,,,,2024_PWRDW_36852_12,RFB No. CEEAPARRBP111TENDERS2024-42,Construction of Bridge in Dhubri district i. Br. No. 2/1 on Howrapar Bazar to Dharmasala via Borbila Village Road
