Organisation Chain,Tender Reference Number,Tender ID,Withdrawal Allowed,Tender Type,Form of contract,Tender Category,No. of Covers,General Technical Evaluation Allowed,ItemWise Technical Evaluation Allowed,Payment Mode,Is Multi Currency Allowed For BOQ,Is Multi Currency Allowed For Fee,Allow Two Stage Bidding,Cover No,Cover,Document Type,Description,Publish Date,Bid Opening Date,Document Download / Sale Start Date,Document Download / Sale End Date,Clarification Start Date,Clarification End Date,Bid Submission Start Date,Bid Submission End Date,Financial Bid Opening Date,EMD Amount in ₹,EMD Exemption Allowed,EMD Fee Type,EMD Percentage,EMD Payable To,EMD Payable At,S.No,Bank Name,Tender Fee in ₹,Fee Payable To,Fee Payable At,Tender Fee Exemption Allowed,Name,Address,Title,Work Description,Pre Qualification Details,Independent External Monitor/Remarks,Tender Value in ₹,Product Category,Sub category,Contract Type,Bid Validity(Days),Period Of Work(Days),Location,Pincode,Pre Bid Meeting Place,Pre Bid Meeting Address,Pre Bid Meeting Date,Bid Opening Place,Should Allow NDA Tender,Allow Preferential Bidder,Organisation Chain,Tender Reference Number,Tender ID,Withdrawal Allowed,Tender Type,Form of contract,Tender Category,No. of Covers,General Technical Evaluation Allowed,ItemWise Technical Evaluation Allowed,Payment Mode,Is Multi Currency Allowed For BOQ,Is Multi Currency Allowed For Fee,Allow Two Stage Bidding,Cover No,Cover,Document Type,Description,Publish Date,Bid Opening Date,Document Download / Sale Start Date,Document Download / Sale End Date,Clarification Start Date,Clarification End Date,Bid Submission Start Date,Bid Submission End Date,Financial Bid Opening Date,EMD Amount in ₹,EMD Exemption Allowed,EMD Fee Type,EMD Percentage,EMD Payable To,EMD Payable At,S.No,Bank Name,Tender Fee in ₹,Fee Payable To,Fee Payable At,Tender Fee Exemption Allowed,Name,Address,Title,Work Description,Pre Qualification Details,Independent External Monitor/Remarks,Tender Value in ₹,Product Category,Sub category,Contract Type,Bid Validity(Days),Period Of Work(Days),Location,Pincode,Pre Bid Meeting Place,Pre Bid Meeting Address,Pre Bid Meeting Date,Bid Opening Place,Should Allow NDA Tender,Allow Preferential Bidder,Contract Date :,Contract Value :,Work Completion Period in days :,Updated By :,Updated on :,AOC document :,AOC Description :,S.No.1,Bid Number,Bidder Name,Awarded Currency,Awarded Value,S.No.2,Bid Number.1,Bidder Name.1,Submitted Date,Status,Remarks,Status Updated On,Type :,Summary :,Updated By :.1,Updated On :,Document :,BOQ Comparative Chart :,Committee Chairperson/Co-ordinator Name :,Committee Chairperson/Co-ordinator Type :,Committee Members :,Updated By :.2,Updated on :.1,Document :.1,S.No.3,Bid Number.2,Bidder Name.2,Value,Rank,Type :.1,Summary :.1,Updated By :.3,Updated On :.1,Document :.2,Committee Chairperson/Co-ordinator Name :.1,Committee Chairperson/Co-ordinator Type :.1,Committee Members :.1,Updated By :.4,Updated On :.2,Financial Bid Opening Date:,Document :.3,Tender ID :,Tender Ref No :,Tender Title :
Industries and Commerce Department||Assam Petro-Chemicals Ltd.||Head office Namrup||Materials Management Department,APL/CnP/Proj-Civil/2022-23/125,2023_ICD_29972_1,Yes,Open Limited,Item Rate,Works,2.0,No,No,Online,No,No,No,1.0,Fee/PreQual/Technical,.pdf,EMD and Unpriced Bid,20-Mar-2023 03:00 PM,28-Mar-2023 03:00 PM,20-Mar-2023 03:00 PM,27-Mar-2023 03:00 PM,NA ,NA ,20-Mar-2023 03:00 PM,27-Mar-2023 03:00 PM,04-Apr-2023 03:30 PM,"9,983",Yes,fixed,,Nil,Nil,1.0,SBI Bank,100.0,Nil,Nil,No,Dy General Manager C n P,APL Namrup,PAINTING WORK OF UTILITY BUILDING AND PART OF STRUCTURES AT 500 TPD METHANOL PLANT,PAINTING WORK OF UTILITY BUILDING AND PART OF STRUCTURES AT 500 TPD METHANOL PLANT,Please refer Tender documents. ,NA ,,Civil Works,NA ,Tender,180.0,15.0,Assam Petrochemicals Limited,786623.0,NA ,NA ,NA ,APL Namrup,No ,No,Industries and Commerce Department||Assam Petro-Chemicals Ltd.||Head office Namrup||Materials Management Department,APL/CnP/Proj-Civil/2022-23/125,2023_ICD_29972_1,Yes,Open Limited,Item Rate,Works,2.0,No,No,Online,No,No,No,1.0,Fee/PreQual/Technical,.pdf,EMD and Unpriced Bid,20-Mar-2023 03:00 PM,28-Mar-2023 03:00 PM,20-Mar-2023 03:00 PM,27-Mar-2023 03:00 PM,NA ,NA ,20-Mar-2023 03:00 PM,27-Mar-2023 03:00 PM,04-Apr-2023 03:30 PM,"9,983",Yes,fixed,,Nil,Nil,1.0,SBI Bank,100.0,Nil,Nil,No,Dy General Manager C n P,APL Namrup,PAINTING WORK OF UTILITY BUILDING AND PART OF STRUCTURES AT 500 TPD METHANOL PLANT,PAINTING WORK OF UTILITY BUILDING AND PART OF STRUCTURES AT 500 TPD METHANOL PLANT,Please refer Tender documents. ,NA ,,Civil Works,NA ,Tender,180.0,15.0,Assam Petrochemicals Limited,786623.0,NA ,NA ,NA ,APL Namrup,No ,No,15-Oct-2024,"INR 385,669.2",15.0,ANUPAM GAYAN,15-Oct-2024 11:09 AM,Image_348.pdf (2407.00 KB),work order awarded to Ganpati enterprise,1.0,181350.0,M/S GANPATI ENTERPRISE,INR,"385,669.2",1.0,181171.0,B.G. Enterprises,26-Mar-2023 09:10 PM,Rejected-AOC,L2,15-Oct-2024 11:09 AM,Finance,The Financial Bids have been admitted for further Technical Evaluation,Manob Borthakur,04-Apr-2023 05:01 PM,None,BOQ Comparative Chart,N B Bora,Internal,K B Chetri,ANUPAM GAYAN,15-Oct-2024 11:04 AM,finsummary_48201.pdf (1720.27 KB),1.0,181171.0,B.G. Enterprises,"4,12,710.50",L2,Technical,"The technical bid submitted by bidder B.G. Enterprises, CHETIA INFRACON PVT. LTD, M/S GANPATI ENTERPRISE, GAURI DIRIAL have been admitted for evaluation.",Manob Borthakur,28-Mar-2023 04:22 PM,None,N.B.Borah,Internal,"P.Barman, P.Hazarika, S.Khemani, K.B.Chetri, A.Gayan",Pranab Barman,04-Apr-2023 03:07 PM,04-Apr-2023 03:30 PM,techsummary_48201.pdf (441.53 KB),,,
,,,,,,,,,,,,,,,,.pdf,Unpriced Bid,,,,,,,,,,,,,,,,,,,,,,,,,,,,,,,,,,,,,,,,,,,,,,,,,,,,,,,,,,.pdf,Unpriced Bid,,,,,,,,,,,,,,,,,,,,,,,,,,,,,,,,,,,,,,,,,,,,,,,,,,,,,,2.0,181333.0,CHETIA INFRACON PVT. LTD,27-Mar-2023 11:28 AM,Rejected-AOC,L4,15-Oct-2024 11:09 AM,,,,,,,,,,,,,2.0,181333.0,CHETIA INFRACON PVT. LTD,"4,28,670.00",L4,,,,,,,,,,,,,,,
,,,,,,,,,,,,,,2.0,Finance,.xls,Price bID,,,,,,,,,,,,,,,,,,,,,,,,,,,,,,,,,,,,,,,,,,,,,,,,,,,,,,,,2.0,Finance,.xls,Price bID,,,,,,,,,,,,,,,,,,,,,,,,,,,,,,,,,,,,,,,,,,,,,,,,,,,,,,3.0,181373.0,GAURI DIRIAL,27-Mar-2023 02:48 PM,Rejected-AOC,L3,15-Oct-2024 11:09 AM,,,,,,,,,,,,,3.0,181350.0,M/S GANPATI ENTERPRISE,"3,85,669.20",L1,,,,,,,,,,,,,,,
,,,,,,,,,,,,,,,,,,,,,,,,,,,,,,,,,,,,,,,,,,,,,,,,,,,,,,,,,,,,,,,,,,,,,,,,,,,,,,,,,,,,,,,,,,,,,,,,,,,,,,,,,,,,,,,,,,,,,,,,,,,,,,,,,,4.0,181350.0,M/S GANPATI ENTERPRISE,27-Mar-2023 12:24 PM,Accepted-AOC,L1,15-Oct-2024 11:09 AM,,,,,,,,,,,,,4.0,181373.0,GAURI DIRIAL,"4,26,132.60",L3,,,,,,,,,,,,,,,
,,,,,,,,,,,,,,,,,,,,,,,,,,,,,,,,,,,,,,,,,,,,,,,,,,,,,,,,,,,,,,,,,,,,,,,,,,,,,,,,,,,,,,,,,,,,,,,,,,,,,,,,,,,,,,,,,,,,,,,,,,,,,,,,,,,,,,,,,,,,,,,,,,,,,,,,,,,,,,,,,,,,,,2023_ICD_29972_1,APL/CnP/Proj-Civil/2022-23/125,PAINTING WORK OF UTILITY BUILDING AND PART OF STRUCTURES AT 500 TPD METHANOL PLANT
