Organisation Chain,Tender Reference Number,Tender ID,Withdrawal Allowed,Tender Type,Form of contract,Tender Category,No. of Covers,General Technical Evaluation Allowed,ItemWise Technical Evaluation Allowed,Payment Mode,Is Multi Currency Allowed For BOQ,Is Multi Currency Allowed For Fee,Allow Two Stage Bidding,Cover No,Cover,Document Type,Description,Publish Date,Bid Opening Date,Document Download / Sale Start Date,Document Download / Sale End Date,Clarification Start Date,Clarification End Date,Bid Submission Start Date,Bid Submission End Date,Financial Bid Opening Date,EMD Amount in ₹,EMD Exemption Allowed,EMD Fee Type,EMD Percentage,EMD Payable To,EMD Payable At,S.No,Corrigendum Title,Corrigendum Type,View,S.No.1,Bank Name,Tender Fee in ₹,Fee Payable To,Fee Payable At,Tender Fee Exemption Allowed,Name,Address,Title,Work Description,Pre Qualification Details,Independent External Monitor/Remarks,Tender Value in ₹,Product Category,Sub category,Contract Type,Bid Validity(Days),Period Of Work(Days),Location,Pincode,Pre Bid Meeting Place,Pre Bid Meeting Address,Pre Bid Meeting Date,Bid Opening Place,Should Allow NDA Tender,Allow Preferential Bidder,Organisation Chain,Tender Reference Number,Tender ID,Withdrawal Allowed,Tender Type,Form of contract,Tender Category,No. of Covers,General Technical Evaluation Allowed,ItemWise Technical Evaluation Allowed,Payment Mode,Is Multi Currency Allowed For BOQ,Is Multi Currency Allowed For Fee,Allow Two Stage Bidding,Cover No,Cover,Document Type,Description,Publish Date,Bid Opening Date,Document Download / Sale Start Date,Document Download / Sale End Date,Clarification Start Date,Clarification End Date,Bid Submission Start Date,Bid Submission End Date,Financial Bid Opening Date,EMD Amount in ₹,EMD Exemption Allowed,EMD Fee Type,EMD Percentage,EMD Payable To,EMD Payable At,S.No,Corrigendum Title,Corrigendum Type,View,S.No.1,Bank Name,Tender Fee in ₹,Fee Payable To,Fee Payable At,Tender Fee Exemption Allowed,Name,Address,Title,Work Description,Pre Qualification Details,Independent External Monitor/Remarks,Tender Value in ₹,Product Category,Sub category,Contract Type,Bid Validity(Days),Period Of Work(Days),Location,Pincode,Pre Bid Meeting Place,Pre Bid Meeting Address,Pre Bid Meeting Date,Bid Opening Place,Should Allow NDA Tender,Allow Preferential Bidder,Contract Date :,Contract Value :,Work Completion Period in days :,Updated By :,Updated on :,AOC document :,AOC Description :,S.No.2,Bid Number,Bidder Name,Awarded Currency,Awarded Value,S.No.3,Bid Number.1,Bidder Name.1,Submitted Date,Status,Remarks,Status Updated On,Type :,Summary :,Updated By :.1,Updated On :,Document :,BOQ Comparative Chart :,Committee Chairperson/Co-ordinator Name :,Committee Chairperson/Co-ordinator Type :,Committee Members :,Updated By :.2,Updated on :.1,Document :.1,S.No.4,Bid Number.2,Bidder Name.2,Value,Rank,Type :.1,Summary :.1,Updated By :.3,Updated On :.1,Document :.2,Committee Chairperson/Co-ordinator Name :.1,Committee Chairperson/Co-ordinator Type :.1,Committee Members :.1,Updated By :.4,Updated On :.2,Financial Bid Opening Date:,Document :.3,Tender ID :,Tender Ref No :,Tender Title :
Industries and Commerce Department||Assam Gas Company Ltd - ICD,AGCL/PROJ/HAZOP and QRA/2022/01,2023_ICD_28868_1,Yes,Open Tender,Works,Services,2.0,No,No,Online,No,No,No,1.0,Fee/PreQual/Technical,.pdf,Commercial NIT,13-Jan-2023 05:00 PM,10-Feb-2023 03:00 PM,13-Jan-2023 05:30 PM,10-Feb-2023 02:30 PM,14-Jan-2023 09:00 AM ,20-Jan-2023 10:00 AM ,20-Jan-2023 03:00 PM,10-Feb-2023 02:30 PM,12-May-2023 11:20 AM,"90,000",Yes,fixed,,Nil,Nil,1.0,Corrigendum 1,Date,,1.0,SBI Bank,900.0,Nil,Nil,Yes,GM Projects,"GM Projects Assam Gas Company Limited Duliajan - 786602, Dibrugarh, Assam",ARC for HAZOP and QRA Studies,ANNUAL RATE CONTRACT FOR HAZARD AND OPERABILITY STUDY HAZOP AND QUANTITATIVE RISK ASSESSMENT QRA FOR VARIOUS UPCOMING PIPELINES OF AGCL,Please refer Tender documents. ,NA ,,Miscellaneous Services,NA ,Rate Contract,120.0,365.0,Various,786602.0,Online ,Online ,20-Jan-2023 11:30 AM ,Duliajan,No ,No,Industries and Commerce Department||Assam Gas Company Ltd - ICD,AGCL/PROJ/HAZOP and QRA/2022/01,2023_ICD_28868_1,Yes,Open Tender,Works,Services,2.0,No,No,Online,No,No,No,1.0,Fee/PreQual/Technical,.pdf,Commercial NIT,13-Jan-2023 05:00 PM,10-Feb-2023 03:00 PM,13-Jan-2023 05:30 PM,10-Feb-2023 02:30 PM,14-Jan-2023 09:00 AM ,20-Jan-2023 10:00 AM ,20-Jan-2023 03:00 PM,10-Feb-2023 02:30 PM,12-May-2023 11:20 AM,"90,000",Yes,fixed,,Nil,Nil,1.0,Corrigendum 1,Date,,1.0,SBI Bank,900.0,Nil,Nil,Yes,GM Projects,"GM Projects Assam Gas Company Limited Duliajan - 786602, Dibrugarh, Assam",ARC for HAZOP and QRA Studies,ANNUAL RATE CONTRACT FOR HAZARD AND OPERABILITY STUDY HAZOP AND QUANTITATIVE RISK ASSESSMENT QRA FOR VARIOUS UPCOMING PIPELINES OF AGCL,Please refer Tender documents. ,NA ,,Miscellaneous Services,NA ,Rate Contract,120.0,365.0,Various,786602.0,Online ,Online ,20-Jan-2023 11:30 AM ,Duliajan,No ,No,24-Oct-2024,"INR 501,500",365.0,Utpal Borgohain,24-Oct-2024 09:41 PM,AOC-HAZOP-QRA.pdf (381.00 KB),"The tender has been awarded to M/s Polite Engineering for an amount of Rs. 5,01,500.00 inclusive of GST",1.0,176264.0,POLITE ENGINEERING,INR,"501,500",1.0,176842.0,AURA SAFETY AND RISK CONSULTANTS,10-Feb-2023 01:36 PM,Rejected-AOC,Rejected as L4 Bidder,24-Oct-2024 09:41 PM,Finance,Total 6 nos. bid opened.,Utpal Borgohain,24-Oct-2024 09:17 PM,None,BOQ Comparative Chart,Managing Director,Internal,Approved by PC Members,Utpal Borgohain,24-Oct-2024 09:33 PM,finsummary_46478.pdf (380.67 KB),1.0,175754.0,iFluids Engineering,"6,39,999.00",L3,Technical,Total 08 nos bids received for the tender.,Utpal Borgohain,15-Feb-2023 02:33 PM,technical_46478.pdf,Managing Director,Internal,"G K Sarma, H C Mahanta, M K Baruah, J K Bora, J Gogoi, D Barman",Utpal Borgohain,12-May-2023 11:19 AM,12-May-2023 11:20 AM,techsummary_46478.pdf (1232.65 KB),,,
,,,,,,,,,,,,,,,,.pdf,Technical NIT,,,,,,,,,,,,,,,,2.0,Reply to bidders queries,Other,,,,,,,,,,,,,,,,,,,,,,,,,,,,,,,,,,,,,,,,,,,,.pdf,Technical NIT,,,,,,,,,,,,,,,,2.0,Reply to bidders queries,Other,,,,,,,,,,,,,,,,,,,,,,,,,,,,,,,,,,,,,,,,2.0,176780.0,DNV MES India Private Limited,09-Feb-2023 05:27 PM,Rejected-AOC,Rejected as L6 Bidder,24-Oct-2024 09:41 PM,,,,,,,,,,,,,2.0,176264.0,POLITE ENGINEERING,"4,25,000.00",L1,,,,,,,,,,,,,,,
,,,,,,,,,,,,,,2.0,Finance,.xls,BOQ Document,,,,,,,,,,,,,,,,,,,,,,,,,,,,,,,,,,,,,,,,,,,,,,,,,,,,,,,,,,,,2.0,Finance,.xls,BOQ Document,,,,,,,,,,,,,,,,,,,,,,,,,,,,,,,,,,,,,,,,,,,,,,,,,,,,,,,,,,3.0,176659.0,Edlipse Engineering Global Pvt Ltd,10-Feb-2023 01:53 PM,Rejected-Technical,Technically Disqualified,12-May-2023 11:19 AM,,,,,,,,,,,,,3.0,176548.0,TSM TheSafetymaster.com,"4,91,000.00",L2,,,,,,,,,,,,,,,
,,,,,,,,,,,,,,,,,,,,,,,,,,,,,,,,,,,,,,,,,,,,,,,,,,,,,,,,,,,,,,,,,,,,,,,,,,,,,,,,,,,,,,,,,,,,,,,,,,,,,,,,,,,,,,,,,,,,,,,,,,,,,,,,,,,,,,,,,,4.0,175754.0,iFluids Engineering,02-Feb-2023 01:18 PM,Rejected-AOC,Rejected as L3 Bidder,24-Oct-2024 09:41 PM,,,,,,,,,,,,,4.0,176568.0,Mantec Consultants Pvt. Ltd.,"10,80,000.00",L5,,,,,,,,,,,,,,,
,,,,,,,,,,,,,,,,,,,,,,,,,,,,,,,,,,,,,,,,,,,,,,,,,,,,,,,,,,,,,,,,,,,,,,,,,,,,,,,,,,,,,,,,,,,,,,,,,,,,,,,,,,,,,,,,,,,,,,,,,,,,,,,,,,,,,,,,,,5.0,176568.0,Mantec Consultants Pvt. Ltd.,09-Feb-2023 07:15 PM,Rejected-AOC,Rejected as L5 Bidder,24-Oct-2024 09:41 PM,,,,,,,,,,,,,5.0,176780.0,DNV MES India Private Limited,"62,59,400.00",L6,,,,,,,,,,,,,,,
,,,,,,,,,,,,,,,,,,,,,,,,,,,,,,,,,,,,,,,,,,,,,,,,,,,,,,,,,,,,,,,,,,,,,,,,,,,,,,,,,,,,,,,,,,,,,,,,,,,,,,,,,,,,,,,,,,,,,,,,,,,,,,,,,,,,,,,,,,6.0,176264.0,POLITE ENGINEERING,03-Feb-2023 10:53 AM,Accepted-AOC,As L1 Bidder,24-Oct-2024 09:41 PM,,,,,,,,,,,,,6.0,176842.0,AURA SAFETY AND RISK CONSULTANTS,"6,76,000.00",L4,,,,,,,,,,,,,,,
,,,,,,,,,,,,,,,,,,,,,,,,,,,,,,,,,,,,,,,,,,,,,,,,,,,,,,,,,,,,,,,,,,,,,,,,,,,,,,,,,,,,,,,,,,,,,,,,,,,,,,,,,,,,,,,,,,,,,,,,,,,,,,,,,,,,,,,,,,7.0,176666.0,Sonar Bharat Environment and Ecology Pvt. Ltd.,09-Feb-2023 05:50 PM,Rejected-Technical,Technically Disqualified,12-May-2023 11:19 AM,,,,,,,,,,,,,,,,,,,,,,,,,,,,,,,,
,,,,,,,,,,,,,,,,,,,,,,,,,,,,,,,,,,,,,,,,,,,,,,,,,,,,,,,,,,,,,,,,,,,,,,,,,,,,,,,,,,,,,,,,,,,,,,,,,,,,,,,,,,,,,,,,,,,,,,,,,,,,,,,,,,,,,,,,,,8.0,176548.0,TSM TheSafetymaster.com,10-Feb-2023 11:31 AM,Rejected-AOC,Rejected as L2 Bidder,24-Oct-2024 09:41 PM,,,,,,,,,,,,,,,,,,,,,,,,,,,,,,,,
,,,,,,,,,,,,,,,,,,,,,,,,,,,,,,,,,,,,,,,,,,,,,,,,,,,,,,,,,,,,,,,,,,,,,,,,,,,,,,,,,,,,,,,,,,,,,,,,,,,,,,,,,,,,,,,,,,,,,,,,,,,,,,,,,,,,,,,,,,,,,,,,,,,,,,,,,,,,,,,,,,,,,,,,,,,,,,2023_ICD_28868_1,AGCL/PROJ/HAZOP and QRA/2022/01,ARC for HAZOP and QRA Studies
