Organisation Chain,Tender Reference Number,Tender ID,Withdrawal Allowed,Tender Type,Form of contract,Tender Category,No. of Covers,General Technical Evaluation Allowed,ItemWise Technical Evaluation Allowed,Payment Mode,Is Multi Currency Allowed For BOQ,Is Multi Currency Allowed For Fee,Allow Two Stage Bidding,Cover No,Cover,Document Type,Description,Publish Date,Bid Opening Date,Document Download / Sale Start Date,Document Download / Sale End Date,Clarification Start Date,Clarification End Date,Bid Submission Start Date,Bid Submission End Date,Financial Bid Opening Date,EMD Amount in ₹,EMD Exemption Allowed,EMD Fee Type,EMD Percentage,EMD Payable To,EMD Payable At,S.No,Bank Name,Tender Fee in ₹,Fee Payable To,Fee Payable At,Tender Fee Exemption Allowed,Name,Address,Title,Work Description,Pre Qualification Details,Independent External Monitor/Remarks,Tender Value in ₹,Product Category,Sub category,Contract Type,Bid Validity(Days),Period Of Work(Days),Location,Pincode,Pre Bid Meeting Place,Pre Bid Meeting Address,Pre Bid Meeting Date,Bid Opening Place,Should Allow NDA Tender,Allow Preferential Bidder,Organisation Chain,Tender Reference Number,Tender ID,Withdrawal Allowed,Tender Type,Form of contract,Tender Category,No. of Covers,General Technical Evaluation Allowed,ItemWise Technical Evaluation Allowed,Payment Mode,Is Multi Currency Allowed For BOQ,Is Multi Currency Allowed For Fee,Allow Two Stage Bidding,Cover No,Cover,Document Type,Description,Publish Date,Bid Opening Date,Document Download / Sale Start Date,Document Download / Sale End Date,Clarification Start Date,Clarification End Date,Bid Submission Start Date,Bid Submission End Date,Financial Bid Opening Date,EMD Amount in ₹,EMD Exemption Allowed,EMD Fee Type,EMD Percentage,EMD Payable To,EMD Payable At,S.No,Bank Name,Tender Fee in ₹,Fee Payable To,Fee Payable At,Tender Fee Exemption Allowed,Name,Address,Title,Work Description,Pre Qualification Details,Independent External Monitor/Remarks,Tender Value in ₹,Product Category,Sub category,Contract Type,Bid Validity(Days),Period Of Work(Days),Location,Pincode,Pre Bid Meeting Place,Pre Bid Meeting Address,Pre Bid Meeting Date,Bid Opening Place,Should Allow NDA Tender,Allow Preferential Bidder,Contract Date :,Contract Value :,Work Completion Period in days :,Updated By :,Updated on :,AOC document :,AOC Description :,S.No.1,Bid Number,Bidder Name,Awarded Currency,Awarded Value,S.No.2,Bid Number.1,Bidder Name.1,Submitted Date,Status,Remarks,Status Updated On,Type :,Summary :,Updated By :.1,Updated On :,Document :,BOQ Comparative Chart :,Committee Chairperson/Co-ordinator Name :,Committee Chairperson/Co-ordinator Type :,Committee Members :,Updated By :.2,Updated on :.1,Document :.1,S.No.3,Bid Number.2,Bidder Name.2,Value,Rank,Type :.1,Summary :.1,Updated By :.3,Updated On :.1,Document :.2,Committee Chairperson/Co-ordinator Name :.1,Committee Chairperson/Co-ordinator Type :.1,Committee Members :.1,Updated By :.4,Updated On :.2,Financial Bid Opening Date:,Document :.3,Tender ID :,Tender Ref No :,Tender Title :
National Health Mission||State Programme Management Unit - NHM,NHM-32043/1/2024-CONS-NHM,2024_NHM_36526_7,Yes,Open Tender,Turn-key,Works,2.0,No,No,Online,No,No,No,1.0,Fee/PreQual/Technical,.pdf,sbd,22-Feb-2024 06:55 PM,05-Mar-2024 03:30 PM,22-Feb-2024 06:55 PM,04-Mar-2024 02:00 PM,NA ,NA ,22-Feb-2024 06:55 PM,04-Mar-2024 02:00 PM,28-May-2024 02:05 PM,"2,00,000",Yes,percentage,2.0%,Nil,Nil,1.0,SBI Bank,"2,000",Nil,Nil,No,"MD, NHM, Assam","O/o MD, NHM, Assam","Construction of BPHU at Jugijan Model Mospital and Odali MH in Hojai District under PM ABHIM for the FY 2024-25 under NHM, Assam on Turnkey Basis Group no-10 (2 nos. of Scheme in Hojai District)","Construction of BPHU at Jugijan Model Mospital and Odali MH in Hojai District under PM ABHIM for the FY 2024-25 under NHM, Assam on Turnkey Basis Group no-10 (2 nos. of Scheme in Hojai District)",Please refer Tender documents. ,NA ,"1,00,00,000",Civil Works - Building,NA ,Tender,180.0,270.0,Hojai,781005.0,NA ,NA ,NA ,"O/o MD, NHM, Assam",No ,No,National Health Mission||State Programme Management Unit - NHM,NHM-32043/1/2024-CONS-NHM,2024_NHM_36526_7,Yes,Open Tender,Turn-key,Works,2.0,No,No,Online,No,No,No,1.0,Fee/PreQual/Technical,.pdf,sbd,22-Feb-2024 06:55 PM,05-Mar-2024 03:30 PM,22-Feb-2024 06:55 PM,04-Mar-2024 02:00 PM,NA ,NA ,22-Feb-2024 06:55 PM,04-Mar-2024 02:00 PM,28-May-2024 02:05 PM,"2,00,000",Yes,percentage,2.0%,Nil,Nil,1.0,SBI Bank,"2,000",Nil,Nil,No,"MD, NHM, Assam","O/o MD, NHM, Assam","Construction of BPHU at Jugijan Model Mospital and Odali MH in Hojai District under PM ABHIM for the FY 2024-25 under NHM, Assam on Turnkey Basis Group no-10 (2 nos. of Scheme in Hojai District)","Construction of BPHU at Jugijan Model Mospital and Odali MH in Hojai District under PM ABHIM for the FY 2024-25 under NHM, Assam on Turnkey Basis Group no-10 (2 nos. of Scheme in Hojai District)",Please refer Tender documents. ,NA ,"1,00,00,000",Civil Works - Building,NA ,Tender,180.0,270.0,Hojai,781005.0,NA ,NA ,NA ,"O/o MD, NHM, Assam",No ,No,04-Oct-2024,"INR 9,330,000",270.0,Dipankar Barman,04-Oct-2024 02:43 PM,Document78.pdf (9868.00 KB),Work Order,1.0,228841.0,RAJENDRA MALLA,INR,"9,330,000",1.0,228736.0,AJ Enterprise,03-Mar-2024 10:08 PM,Not Admitted-Fee/PreQual/Technical,Not Complied with technical specification,28-May-2024 01:55 PM,Finance,Technical Submitted,Dipankar Barman,04-Oct-2024 02:37 PM,None,BOQ Comparative Chart,ED,Internal,,Dipankar Barman,04-Oct-2024 02:39 PM,finsummary_59745.pdf (7344.27 KB),1.0,228841.0,RAJENDRA MALLA,"93,30,000.00",L1,Technical,financial bid open,Manas Pratim Mahanta,28-May-2024 01:55 PM,None,ED,Internal,"SE,SPCON,CON,FA,DF,AMD",Manas Pratim Mahanta,28-May-2024 01:58 PM,28-May-2024 02:05 PM,techsummary_59745.pdf (9809.42 KB),,,
,,,,,,,,,,,,,,,,.pdf,emd and tender fee,,,,,,,,,,,,,,,,,,,,,,,,,,,,,,,,,,,,,,,,,,,,,,,,,,,,,,,,,,.pdf,emd and tender fee,,,,,,,,,,,,,,,,,,,,,,,,,,,,,,,,,,,,,,,,,,,,,,,,,,,,,,2.0,228867.0,M/S. LAXMI CONSTRUCTION,04-Mar-2024 01:59 PM,Not Admitted-Fee/PreQual/Technical,Not Complied with technical specification,28-May-2024 01:55 PM,,,,,,,,,,,,,,,,,,,,,,,,,,,,,,,,
,,,,,,,,,,,,,,,,.pdf,technical qualificaton,,,,,,,,,,,,,,,,,,,,,,,,,,,,,,,,,,,,,,,,,,,,,,,,,,,,,,,,,,.pdf,technical qualificaton,,,,,,,,,,,,,,,,,,,,,,,,,,,,,,,,,,,,,,,,,,,,,,,,,,,,,,3.0,228618.0,M/S SM ASSOCIATES,03-Mar-2024 01:53 AM,Not Admitted-Fee/PreQual/Technical,Not Complied with technical specification,28-May-2024 01:55 PM,,,,,,,,,,,,,,,,,,,,,,,,,,,,,,,,
,,,,,,,,,,,,,,2.0,Finance,.xls,boq,,,,,,,,,,,,,,,,,,,,,,,,,,,,,,,,,,,,,,,,,,,,,,,,,,,,,,,,2.0,Finance,.xls,boq,,,,,,,,,,,,,,,,,,,,,,,,,,,,,,,,,,,,,,,,,,,,,,,,,,,,,,4.0,228841.0,RAJENDRA MALLA,04-Mar-2024 01:30 PM,Accepted-AOC,L1,04-Oct-2024 02:43 PM,,,,,,,,,,,,,,,,,,,,,,,,,,,,,,,,
,,,,,,,,,,,,,,,,.pdf,fob,,,,,,,,,,,,,,,,,,,,,,,,,,,,,,,,,,,,,,,,,,,,,,,,,,,,,,,,,,.pdf,fob,,,,,,,,,,,,,,,,,,,,,,,,,,,,,,,,,,,,,,,,,,,,,,,,,,,,,,5.0,228808.0,SHAHJAHAN AHMED,04-Mar-2024 11:52 AM,Not Admitted-Fee/PreQual/Technical,Not Complied with technical specification,28-May-2024 01:55 PM,,,,,,,,,,,,,,,,,,,,,,,,,,,,,,,,
,,,,,,,,,,,,,,,,,,,,,,,,,,,,,,,,,,,,,,,,,,,,,,,,,,,,,,,,,,,,,,,,,,,,,,,,,,,,,,,,,,,,,,,,,,,,,,,,,,,,,,,,,,,,,,,,,,,,,,,,,,,,,,,,,,,,,,,,,,,,,,,,,,,,,,,,,,,,,,,,,,,,,,2024_NHM_36526_7,NHM-32043/1/2024-CONS-NHM,"Construction of BPHU at Jugijan Model Mospital and Odali MH in Hojai District under PM ABHIM for the FY 2024-25 under NHM, Assam on Turnkey Basis Group no-10 (2 nos. of Scheme in Hojai District)"
