Organisation Chain,Tender Reference Number,Tender ID,Withdrawal Allowed,Tender Type,Form of contract,Tender Category,No. of Covers,General Technical Evaluation Allowed,ItemWise Technical Evaluation Allowed,Payment Mode,Is Multi Currency Allowed For BOQ,Is Multi Currency Allowed For Fee,Allow Two Stage Bidding,Cover No,Cover,Document Type,Description,Publish Date,Bid Opening Date,Document Download / Sale Start Date,Document Download / Sale End Date,Clarification Start Date,Clarification End Date,Bid Submission Start Date,Bid Submission End Date,Financial Bid Opening Date,EMD Amount in ₹,EMD Exemption Allowed,EMD Fee Type,EMD Percentage,EMD Payable To,EMD Payable At,S.No,Bank Name,Tender Fee in ₹,Fee Payable To,Fee Payable At,Tender Fee Exemption Allowed,Name,Address,Title,Work Description,Pre Qualification Details,Independent External Monitor/Remarks,Tender Value in ₹,Product Category,Sub category,Contract Type,Bid Validity(Days),Period Of Work(Days),Location,Pincode,Pre Bid Meeting Place,Pre Bid Meeting Address,Pre Bid Meeting Date,Bid Opening Place,Should Allow NDA Tender,Allow Preferential Bidder,Organisation Chain,Tender Reference Number,Tender ID,Withdrawal Allowed,Tender Type,Form of contract,Tender Category,No. of Covers,General Technical Evaluation Allowed,ItemWise Technical Evaluation Allowed,Payment Mode,Is Multi Currency Allowed For BOQ,Is Multi Currency Allowed For Fee,Allow Two Stage Bidding,Cover No,Cover,Document Type,Description,Publish Date,Bid Opening Date,Document Download / Sale Start Date,Document Download / Sale End Date,Clarification Start Date,Clarification End Date,Bid Submission Start Date,Bid Submission End Date,Financial Bid Opening Date,EMD Amount in ₹,EMD Exemption Allowed,EMD Fee Type,EMD Percentage,EMD Payable To,EMD Payable At,S.No,Bank Name,Tender Fee in ₹,Fee Payable To,Fee Payable At,Tender Fee Exemption Allowed,Name,Address,Title,Work Description,Pre Qualification Details,Independent External Monitor/Remarks,Tender Value in ₹,Product Category,Sub category,Contract Type,Bid Validity(Days),Period Of Work(Days),Location,Pincode,Pre Bid Meeting Place,Pre Bid Meeting Address,Pre Bid Meeting Date,Bid Opening Place,Should Allow NDA Tender,Allow Preferential Bidder,Contract Date :,Contract Value :,Work Completion Period in days :,Updated By :,Updated on :,AOC document :,AOC Description :,S.No.1,Bid Number,Bidder Name,Awarded Currency,Awarded Value,S.No.2,Bid Number.1,Bidder Name.1,Submitted Date,Status,Remarks,Status Updated On,Type :,Summary :,Updated By :.1,Updated On :,Document :,BOQ Comparative Chart :,Committee Chairperson/Co-ordinator Name :,Committee Chairperson/Co-ordinator Type :,Committee Members :,Updated By :.2,Updated on :.1,Document :.1,S.No.3,Bid Number.2,Bidder Name.2,Value,Rank,Type :.1,Summary :.1,Updated By :.3,Updated On :.1,Document :.2,Committee Chairperson/Co-ordinator Name :.1,Committee Chairperson/Co-ordinator Type :.1,Committee Members :.1,Updated By :.4,Updated On :.2,Financial Bid Opening Date:,Document :.3,Tender ID :,Tender Ref No :,Tender Title :
Bodoland Territorial Council||Forests-BTC,No. FDW.114/FOREST/MMDRRF/2024,2024_BoTC_38889_1,Yes,Open Tender,Item Rate,Works,2.0,No,No,Online,No,No,No,1.0,Fee/PreQual/Technical,.pdf,Tech Doc,06-Sep-2024 06:00 PM,27-Sep-2024 03:30 PM,06-Sep-2024 06:00 PM,27-Sep-2024 03:00 PM,06-Sep-2024 06:00 PM ,27-Sep-2024 03:00 PM ,06-Sep-2024 06:00 PM,27-Sep-2024 03:00 PM,09-Oct-2024 10:00 AM,"3,20,000",Yes,fixed,,Nil,Nil,1.0,SBI Bank,"4,800",Nil,Nil,No,"Addl. PCCF cum CHD, BTC, Kokrajhar","O/o Addl. PCCF cum CHD, BTC, Kokrajhar","Construction of Boulder Pitching for protection of soil erosion at Kulsi River for Bhergaon (Paneri) Kulsi-Par (Pub-Paneri) village at Nunoi Range under Dhansiri Forest Division, Udalguri for a length of 400 meter on both sides","Construction of Boulder Pitching for protection of soil erosion at Kulsi River for Bhergaon (Paneri) Kulsi-Par (Pub-Paneri) village at Nunoi Range under Dhansiri Forest Division, Udalguri for a length of 400 meter on both sides",Please refer Tender documents. ,NA ,"1,60,00,000",Civil Works,NA ,Tender,180.0,180.0,udl,784327.0,NA ,NA ,NA ,"O/o Addl. PCCF cum CHD, BTC, Kokrajhar",No ,No,Bodoland Territorial Council||Forests-BTC,No. FDW.114/FOREST/MMDRRF/2024,2024_BoTC_38889_1,Yes,Open Tender,Item Rate,Works,2.0,No,No,Online,No,No,No,1.0,Fee/PreQual/Technical,.pdf,Tech Doc,06-Sep-2024 06:00 PM,27-Sep-2024 03:30 PM,06-Sep-2024 06:00 PM,27-Sep-2024 03:00 PM,06-Sep-2024 06:00 PM ,27-Sep-2024 03:00 PM ,06-Sep-2024 06:00 PM,27-Sep-2024 03:00 PM,09-Oct-2024 10:00 AM,"3,20,000",Yes,fixed,,Nil,Nil,1.0,SBI Bank,"4,800",Nil,Nil,No,"Addl. PCCF cum CHD, BTC, Kokrajhar","O/o Addl. PCCF cum CHD, BTC, Kokrajhar","Construction of Boulder Pitching for protection of soil erosion at Kulsi River for Bhergaon (Paneri) Kulsi-Par (Pub-Paneri) village at Nunoi Range under Dhansiri Forest Division, Udalguri for a length of 400 meter on both sides","Construction of Boulder Pitching for protection of soil erosion at Kulsi River for Bhergaon (Paneri) Kulsi-Par (Pub-Paneri) village at Nunoi Range under Dhansiri Forest Division, Udalguri for a length of 400 meter on both sides",Please refer Tender documents. ,NA ,"1,60,00,000",Civil Works,NA ,Tender,180.0,180.0,udl,784327.0,NA ,NA ,NA ,"O/o Addl. PCCF cum CHD, BTC, Kokrajhar",No ,No,21-Oct-2024,"INR 16,000,000",180.0,Swmkwr Basumatary,25-Oct-2024 04:48 PM,Newdoc1603.pdf (489.00 KB),Issue of Notice to Proceed with the work to Barun Basumatary,1.0,240727.0,BARUN BASUMATARY,INR,"16,000,000",1.0,240727.0,BARUN BASUMATARY,27-Sep-2024 11:25 AM,Accepted-AOC,Awarded Contract to Lowest Bidder,25-Oct-2024 04:48 PM,Finance,Financial Bid Evaluation,Swmkwr Basumatary,15-Oct-2024 12:56 PM,None,BOQ Comparative Chart,Ranjit Konwar DFO Baksa,Internal,,Swmkwr Basumatary,16-Oct-2024 08:34 AM,finsummary_63017.pdf (349.54 KB),1.0,240711.0,REJINA SWORGOWARI,"1,58,61,040.35",L2,Technical,Technical Bid Evaluation,Swmkwr Basumatary,08-Oct-2024 12:48 PM,None,Ranjit Konwar DFO Baksa,Internal,,Swmkwr Basumatary,08-Oct-2024 08:00 PM,09-Oct-2024 10:00 AM,techsummary_63017.pdf (419.55 KB),,,
,,,,,,,,,,,,,,,,.pdf,SBD,,,,,,,,,,,,,,,,,,,,,,,,,,,,,,,,,,,,,,,,,,,,,,,,,,,,,,,,,,.pdf,SBD,,,,,,,,,,,,,,,,,,,,,,,,,,,,,,,,,,,,,,,,,,,,,,,,,,,,,,2.0,240740.0,BISTI MUSHAHARY,27-Sep-2024 12:47 PM,Rejected-Technical,Not Regular,08-Oct-2024 08:00 PM,,,,,,,,,,,,,2.0,240727.0,BARUN BASUMATARY,"1,58,60,920.82",L1,,,,,,,,,,,,,,,
,,,,,,,,,,,,,,2.0,Finance,.xls,BOQ,,,,,,,,,,,,,,,,,,,,,,,,,,,,,,,,,,,,,,,,,,,,,,,,,,,,,,,,2.0,Finance,.xls,BOQ,,,,,,,,,,,,,,,,,,,,,,,,,,,,,,,,,,,,,,,,,,,,,,,,,,,,,,3.0,240968.0,Detsung Basumatary,27-Sep-2024 01:29 PM,Not Admitted-Fee/PreQual/Technical,Others-Hard Copy Not Received,08-Oct-2024 12:48 PM,,,,,,,,,,,,,,,,,,,,,,,,,,,,,,,,
,,,,,,,,,,,,,,,,.pdf,FOB,,,,,,,,,,,,,,,,,,,,,,,,,,,,,,,,,,,,,,,,,,,,,,,,,,,,,,,,,,.pdf,FOB,,,,,,,,,,,,,,,,,,,,,,,,,,,,,,,,,,,,,,,,,,,,,,,,,,,,,,4.0,241016.0,ILIAS IKBAL AHMED,26-Sep-2024 09:01 PM,Not Admitted-Fee/PreQual/Technical,Others-Hard Copy Not Received,08-Oct-2024 12:48 PM,,,,,,,,,,,,,,,,,,,,,,,,,,,,,,,,
,,,,,,,,,,,,,,,,,,,,,,,,,,,,,,,,,,,,,,,,,,,,,,,,,,,,,,,,,,,,,,,,,,,,,,,,,,,,,,,,,,,,,,,,,,,,,,,,,,,,,,,,,,,,,,,,,,,,,,,,,,,,,,,,,,5.0,241020.0,MIR NASIRUDDIN AHMED,26-Sep-2024 09:07 PM,Not Admitted-Fee/PreQual/Technical,Others-Hard Copy not Received,08-Oct-2024 12:48 PM,,,,,,,,,,,,,,,,,,,,,,,,,,,,,,,,
,,,,,,,,,,,,,,,,,,,,,,,,,,,,,,,,,,,,,,,,,,,,,,,,,,,,,,,,,,,,,,,,,,,,,,,,,,,,,,,,,,,,,,,,,,,,,,,,,,,,,,,,,,,,,,,,,,,,,,,,,,,,,,,,,,6.0,240966.0,Niran Ch Boro,27-Sep-2024 12:23 PM,Not Admitted-Fee/PreQual/Technical,Others-Hard Copy Not Received,08-Oct-2024 12:48 PM,,,,,,,,,,,,,,,,,,,,,,,,,,,,,,,,
,,,,,,,,,,,,,,,,,,,,,,,,,,,,,,,,,,,,,,,,,,,,,,,,,,,,,,,,,,,,,,,,,,,,,,,,,,,,,,,,,,,,,,,,,,,,,,,,,,,,,,,,,,,,,,,,,,,,,,,,,,,,,,,,,,7.0,240711.0,REJINA SWORGOWARI,27-Sep-2024 11:31 AM,Rejected-Finance,Second Bidder,16-Oct-2024 08:34 AM,,,,,,,,,,,,,,,,,,,,,,,,,,,,,,,,
,,,,,,,,,,,,,,,,,,,,,,,,,,,,,,,,,,,,,,,,,,,,,,,,,,,,,,,,,,,,,,,,,,,,,,,,,,,,,,,,,,,,,,,,,,,,,,,,,,,,,,,,,,,,,,,,,,,,,,,,,,,,,,,,,,,,,,,,,,,,,,,,,,,,,,,,,,,,,,,,,,,,,,2024_BoTC_38889_1,No. FDW.114/FOREST/MMDRRF/2024,"Construction of Boulder Pitching for protection of soil erosion at Kulsi River for Bhergaon (Paneri) Kulsi-Par (Pub-Paneri) village at Nunoi Range under Dhansiri Forest Division, Udalguri for a length of 400 meter on both sides"
