Organisation Chain,Tender Reference Number,Tender ID,Withdrawal Allowed,Tender Type,Form of contract,Tender Category,No. of Covers,General Technical Evaluation Allowed,ItemWise Technical Evaluation Allowed,Payment Mode,Is Multi Currency Allowed For BOQ,Is Multi Currency Allowed For Fee,Allow Two Stage Bidding,Cover No,Cover,Document Type,Description,Publish Date,Bid Opening Date,Document Download / Sale Start Date,Document Download / Sale End Date,Clarification Start Date,Clarification End Date,Bid Submission Start Date,Bid Submission End Date,Financial Bid Opening Date,EMD Amount in ₹,EMD Exemption Allowed,EMD Fee Type,EMD Percentage,EMD Payable To,EMD Payable At,S.No,Bank Name,Tender Fee in ₹,Fee Payable To,Fee Payable At,Tender Fee Exemption Allowed,Name,Address,Title,Work Description,Pre Qualification Details,Independent External Monitor/Remarks,Tender Value in ₹,Product Category,Sub category,Contract Type,Bid Validity(Days),Period Of Work(Days),Location,Pincode,Pre Bid Meeting Place,Pre Bid Meeting Address,Pre Bid Meeting Date,Bid Opening Place,Should Allow NDA Tender,Allow Preferential Bidder,Organisation Chain,Tender Reference Number,Tender ID,Withdrawal Allowed,Tender Type,Form of contract,Tender Category,No. of Covers,General Technical Evaluation Allowed,ItemWise Technical Evaluation Allowed,Payment Mode,Is Multi Currency Allowed For BOQ,Is Multi Currency Allowed For Fee,Allow Two Stage Bidding,Cover No,Cover,Document Type,Description,Publish Date,Bid Opening Date,Document Download / Sale Start Date,Document Download / Sale End Date,Clarification Start Date,Clarification End Date,Bid Submission Start Date,Bid Submission End Date,Financial Bid Opening Date,EMD Amount in ₹,EMD Exemption Allowed,EMD Fee Type,EMD Percentage,EMD Payable To,EMD Payable At,S.No,Bank Name,Tender Fee in ₹,Fee Payable To,Fee Payable At,Tender Fee Exemption Allowed,Name,Address,Title,Work Description,Pre Qualification Details,Independent External Monitor/Remarks,Tender Value in ₹,Product Category,Sub category,Contract Type,Bid Validity(Days),Period Of Work(Days),Location,Pincode,Pre Bid Meeting Place,Pre Bid Meeting Address,Pre Bid Meeting Date,Bid Opening Place,Should Allow NDA Tender,Allow Preferential Bidder,Contract Date :,Contract Value :,Work Completion Period in days :,Updated By :,Updated on :,AOC document :,AOC Description :,S.No.1,Bid Number,Bidder Name,Awarded Currency,Awarded Value,S.No.2,Bid Number.1,Bidder Name.1,Submitted Date,Status,Remarks,Status Updated On,Type :,Summary :,Updated By :.1,Updated On :,Document :,BOQ Comparative Chart :,Committee Chairperson/Co-ordinator Name :,Committee Chairperson/Co-ordinator Type :,Committee Members :,Updated By :.2,Updated on :.1,Document :.1,S.No.3,Bid Number.2,Bidder Name.2,Value,Rank,Type :.1,Summary :.1,Updated By :.3,Updated On :.1,Document :.2,Committee Chairperson/Co-ordinator Name :.1,Committee Chairperson/Co-ordinator Type :.1,Committee Members :.1,Updated By :.4,Updated On :.2,Financial Bid Opening Date:,Document :.3,Tender ID :,Tender Ref No :,Tender Title :
Industries and Commerce Department||Assam Petro-Chemicals Ltd.||Head office Namrup||Materials Management Department,APL/CnP/Mech/2023-24/141,2023_ICD_30571_1,Yes,Open Limited,Item Rate,Works,2.0,No,No,Online,No,No,No,1.0,Fee/PreQual/Technical,.pdf,EMD and Integrity Pact,21-Apr-2023 03:30 PM,03-May-2023 03:00 PM,21-Apr-2023 03:30 PM,02-May-2023 03:00 PM,NA ,NA ,21-Apr-2023 03:30 PM,02-May-2023 03:00 PM,11-May-2023 03:30 PM,"7,300",Yes,fixed,,Nil,Nil,1.0,SBI Bank,100.0,Nil,Nil,Yes,Dy. General Manager,"DGM Office , Assam Petro-chemicals Limited Namrup, PO Parbatpur 786623 Dist Dibrugarh Assam",Insulation Works of Piping and Euipments,"Supply of Skilled Manpower, Materials and Application of Thermal Insulation in Pipings, Flanges, Pipe Fittings, Valves and Equipments in M-II and F-II Plant for the FY 2023-24 on Annual Rate Contract Basis",As per Tender Documents  ,NA ,"3,65,418",Composite Works,NA ,Tender,180.0,365.0,APL Namrup,786623.0,NA ,NA ,NA ,APL Namrup,No ,No,Industries and Commerce Department||Assam Petro-Chemicals Ltd.||Head office Namrup||Materials Management Department,APL/CnP/Mech/2023-24/141,2023_ICD_30571_1,Yes,Open Limited,Item Rate,Works,2.0,No,No,Online,No,No,No,1.0,Fee/PreQual/Technical,.pdf,EMD and Integrity Pact,21-Apr-2023 03:30 PM,03-May-2023 03:00 PM,21-Apr-2023 03:30 PM,02-May-2023 03:00 PM,NA ,NA ,21-Apr-2023 03:30 PM,02-May-2023 03:00 PM,11-May-2023 03:30 PM,"7,300",Yes,fixed,,Nil,Nil,1.0,SBI Bank,100.0,Nil,Nil,Yes,Dy. General Manager,"DGM Office , Assam Petro-chemicals Limited Namrup, PO Parbatpur 786623 Dist Dibrugarh Assam",Insulation Works of Piping and Euipments,"Supply of Skilled Manpower, Materials and Application of Thermal Insulation in Pipings, Flanges, Pipe Fittings, Valves and Equipments in M-II and F-II Plant for the FY 2023-24 on Annual Rate Contract Basis",As per Tender Documents  ,NA ,"3,65,418",Composite Works,NA ,Tender,180.0,365.0,APL Namrup,786623.0,NA ,NA ,NA ,APL Namrup,No ,No,30-Oct-2024,"INR 428,460.3",365.0,Pranab Barman,30-Oct-2024 03:49 PM,WO_170.pdf (741.00 KB),Work order No APL/CnP/Mech/2023-24/170 dated 26.06.2023 of amount Rs 4428.460.00 plus GST extra at the rate 18 percent was awarded to Registance Works .,1.0,185061.0,REGISTANCE WORKS,INR,"428,460.3",1.0,185063.0,NAMRUP ENGINEERING COMPANY,29-Apr-2023 08:40 PM,Rejected-Technical,Documents not in order,11-May-2023 03:26 PM,Finance,The price bid submitted by the Bidder Thermo Engineers and Registance Works have been admitted for further evaluation .,Pranab Barman,23-May-2023 03:35 PM,None,BOQ Comparative Chart,N.B.Borah,Internal,"H.S.Shah, M.Bortakur, P.S.Paul, P.Barman",Pranab Barman,30-Oct-2024 03:38 PM,finsummary_49136.pdf (301.04 KB),1.0,184501.0,THERMO ENGINEERS,"5,08,660.00",L2,Technical,The technical Bid of all the bidders have been admitted for technical evaluation.,Manob Borthakur,04-May-2023 09:47 AM,None,N.B.Borah,Internal,"H.S.Shah , M.Borthakur, P.S.Paul, P.Barman",Pranab Barman,11-May-2023 03:26 PM,11-May-2023 03:30 PM,techsummary_49136.pdf (470.91 KB),,,
,,,,,,,,,,,,,,,,.pdf,Un Priced Bid,,,,,,,,,,,,,,,,,,,,,,,,,,,,,,,,,,,,,,,,,,,,,,,,,,,,,,,,,,.pdf,Un Priced Bid,,,,,,,,,,,,,,,,,,,,,,,,,,,,,,,,,,,,,,,,,,,,,,,,,,,,,,2.0,185061.0,REGISTANCE WORKS,29-Apr-2023 08:25 PM,Accepted-AOC,L1 Bidder,30-Oct-2024 03:50 PM,,,,,,,,,,,,,2.0,185061.0,REGISTANCE WORKS,"4,60,710.00",L1,,,,,,,,,,,,,,,
,,,,,,,,,,,,,,2.0,Finance,.xls,Price Bid,,,,,,,,,,,,,,,,,,,,,,,,,,,,,,,,,,,,,,,,,,,,,,,,,,,,,,,,2.0,Finance,.xls,Price Bid,,,,,,,,,,,,,,,,,,,,,,,,,,,,,,,,,,,,,,,,,,,,,,,,,,,,,,3.0,185062.0,STAR LIGHT,29-Apr-2023 08:31 PM,Rejected-Technical,Documents not in order,11-May-2023 03:26 PM,,,,,,,,,,,,,,,,,,,,,,,,,,,,,,,,
,,,,,,,,,,,,,,,,,,,,,,,,,,,,,,,,,,,,,,,,,,,,,,,,,,,,,,,,,,,,,,,,,,,,,,,,,,,,,,,,,,,,,,,,,,,,,,,,,,,,,,,,,,,,,,,,,,,,,,,,,,,,,,,,,,4.0,184501.0,THERMO ENGINEERS,27-Apr-2023 01:10 PM,Rejected-Finance,L2 Bidder,30-Oct-2024 03:38 PM,,,,,,,,,,,,,,,,,,,,,,,,,,,,,,,,
,,,,,,,,,,,,,,,,,,,,,,,,,,,,,,,,,,,,,,,,,,,,,,,,,,,,,,,,,,,,,,,,,,,,,,,,,,,,,,,,,,,,,,,,,,,,,,,,,,,,,,,,,,,,,,,,,,,,,,,,,,,,,,,,,,,,,,,,,,,,,,,,,,,,,,,,,,,,,,,,,,,,,,2023_ICD_30571_1,APL/CnP/Mech/2023-24/141,Insulation Works of Piping and Euipments
