2023_NHM_31528_17,NHM-32042/6/2022-CONS-NHM,Construction of Buildingless Sub Health Centre in DHITAIPUKHURI SC in SIVASAGAR District under PM ABHIM for the FY 2022 23 under NHM on Turnkey Basis,Construction of Buildingless Sub Health Centre in DHITAIPUKHURI SC in SIVASAGAR District under PM ABHIM for the FY 2022 23 under NHM on Turnkey Basis,Works,Open Tender,Turn-key,Civil Works - Building,No,No,NA ,06-Jul-2023 06:00 PM,NA ,180.0,No ,No,Online,25-Jul-2023 03:30 PM,National Health Mission||State Programme Management Unit - NHM,SIVASAGAR,785640.0,2.0,"52,03,000",M/S. K.P. MOZIKA,"4,807,805",Accepted-AOC,14-Dec-2023,AOC,National Health Mission||State Programme Management Unit - NHM
2023_NHM_31262_1,32023/326/2023-const-NHM,Construction of Buildingless Sub Health Centre in Naharjan SC in Golaghat District under PM ABHIM for FY 2021 22 under NHM Assam on Turnkey Basis,Construction of Buildingless Sub Health Centre in Naharjan SC in Golaghat District under PM ABHIM for FY 2021 22 under NHM Assam on Turnkey Basis,Works,Open Tender,Turn-key,Civil Works - Building,No,No,NA ,17-Jun-2023 02:30 PM,NA ,180.0,No ,No,Online,05-Jul-2023 03:30 PM,National Health Mission||State Programme Management Unit - NHM,Golaghat,785621.0,2.0,"52,03,000",DHANUKA CONSTRUCTION,"4,828,384",Rejected-Finance,06-Dec-2023,AOC,National Health Mission||State Programme Management Unit - NHM
2022_APDCL_27940_1,CGM_UAR_GEC2,CGM_UAR_GEC2,Outsourcing of sub station,Services,Open Tender,Turn-key,Manpower Supply,No,No,NA ,29-Nov-2022 01:50 PM,NA ,365.0,No ,No,Online,05-Dec-2022 12:00 PM,Assam Power Distribution Company Ltd||CGM(D) Upper Assam Region - APDCL,Golaghat,785601.0,2.0,,M/S DIPALI ENTERPRISE,"3,689,530",Rejected-AOC,22-Dec-2023,AOC,Assam Power Distribution Company Ltd||CGM(D) Upper Assam Region - APDCL
2022_NHM_28421_162,NHM-32023/11/2022-CONS-NHM/95,Construction of Buildingless Sub Health Centre in SABASPUR SC at Cachar District for FY 2022 23 under PM ABHIM on Turnkey Basis,Construction of Buildingless Sub Health Centre in SABASPUR SC at Cachar District for FY 2022 23 under PM ABHIM on Turnkey Basis,Works,Open Tender,Turn-key,Civil Works - Building,No,No,NA ,28-Dec-2022 10:55 AM,NA ,180.0,No ,No,Online,12-Jan-2023 03:30 PM,National Health Mission||State Programme Management Unit - NHM,Cachar,788101.0,2.0,"52,03,000",SAMIM AKHTER CHOUDHURY,"5,203,000",Rejected-Technical,30-Dec-2023,AOC,National Health Mission||State Programme Management Unit - NHM
2023_APDCL_32621_1,CGM_D_UAR_APDCL_Furkating Rly,CGM_D_UAR_APDCL_Furkating Rly,"ABT meter installation at 132KV Traction Sub-Station Furkating Railway Junction (receiving end), Indian Railway under Golaghat ESD I.",Works,Open Tender,Turn-key,Electrical Works,No,No,NA ,21-Sep-2023 05:30 PM,NA ,365.0,No ,No,Online,03-Nov-2023 05:00 PM,Assam Power Distribution Company Ltd||CGM(D) Upper Assam Region - APDCL,Golaghat,785610.0,2.0,,MR.ATIN SAIKIA,"2,480,000",Accepted-AOC,22-Dec-2023,AOC,Assam Power Distribution Company Ltd||CGM(D) Upper Assam Region - APDCL
2023_PWD_32496_1,No.GRC/NIT/510./2021-22/Pt.I/ 2629-36 Dtd.14.09.23,"KAM/KRC/SOPD(G)/2023-24/12 Construction of RCC Retaining wall at NG Mandakata Road to Pahar chuk Road Part-1(ch.373.00m to ch.588.00m) under SOPD-G for the year 2023-24,Jalukbari LAC","Construction of RCC Retaining wall at NG Mandakata Road to Pahar chuk Road Part-1(ch.373.00m to ch.588.00m) under SOPD-G for the year 2023-24,Jalukbari LAC",Works,Open Tender,Item Rate,Civil Works – Roads,No,No,NA ,18-Sep-2023 11:00 AM,NA ,180.0,No ,No,Online,26-Sep-2023 03:00 PM,Public Works Roads Department,Jalukbari,781013.0,2.0,,,,,04-Oct-2023,AOC,Public Works Roads Department
2023_PWBNH_33694_1,SE/BII_Marketing Complex_NERAMAC,"Construction of Marketing Complex Building of NERAMAC at Six-Mile, Guwahati, Assam","Construction of Marketing Complex Building of NERAMAC at Six-Mile, Guwahati, Assam",Works,Open Tender,Item Wise,Civil Works - Building,No,No,NA ,09-Nov-2023 12:00 PM,14-Nov-2023 12:00 PM ,180.0,No ,No,Online,01-Dec-2023 11:30 AM,Public Works Building and NH Department||Chief Engineer-Building - PWBNH||SE-Guwahati Circle-2 - PWBNH,"Six Mile, Guwahati",781022.0,2.0,"1,25,24,272",M/S S S ENTERPRISE,"12,900,000",Accepted-AOC,07-Dec-2023,AOC,Public Works Building and NH Department||Chief Engineer-Building - PWBNH||SE-Guwahati Circle-2 - PWBNH
2023_WPTBC_31575_1,SCDCTECHSTCH2,Construction of Community Hall at Runikhata Villge under 14 Chirang,Construction of Community Hall at Runikhata Villge under 14 Chirang,Works,Limited,Item Rate,Civil Works,No,No,NA ,07-Jul-2023 06:00 PM,NA ,180.0,No ,No,Online,12-Jul-2023 04:00 PM,Welfare of Plain Tribes and Backward Classes||Directorate of Welfare of Scheduled Caste||Assam State Development Corporation for SC,DISPUR,781006.0,2.0,,M/s. Eureka Trade,,Rejected-AOC,20-Jul-2023,AOC,Welfare of Plain Tribes and Backward Classes||Directorate of Welfare of Scheduled Caste||Assam State Development Corporation for SC
2023_ID_33579_1,JC (I)/Tech/E-Tender/2023/55,Solar Powered MDTWS at Phulani Lahan Gaon and Burhasenchowa 2 points under RIDF-XXIX NABARD for the year 2023-24 Package-4,Solar Powered MDTWS at Phulani Lahan Gaon and Burhasenchowa 2 points under RIDF-XXIX NABARD for the year 2023-24 Package-4,Works,Open Tender,Item Rate,Civil Works,No,No,NA ,07-Nov-2023 06:00 PM,NA ,180.0,No ,No,Online,04-Dec-2023 03:00 PM,Irrigation Department||Chief Engineer(Major)-Irrigation Dept||Jorhat Circle,Majuli,785106.0,2.0,"37,27,098",Bubul Gogoi,,Rejected-Finance,,AOC,Irrigation Department||Chief Engineer(Major)-Irrigation Dept||Jorhat Circle
2023_APDCL_29599_1,CGM_D_UAR_APDCL_panichakuaSS_3,CGM_D_UAR_APDCL_PanichakuaSS_3,"Supply and installation of 11kV 9 Unit VCB panel for replacement of the existing damaged panel at the 33/11KV Panichakua Sub-Station, Jorhat EC, APDCL",Works,Open Tender,Turn-key,Electrical Works,No,No,NA ,28-Feb-2023 11:55 AM,NA ,365.0,No ,No,Online,10-Mar-2023 03:00 PM,Assam Power Distribution Company Ltd||CGM(D) Upper Assam Region - APDCL,Jorhat,785631.0,2.0,,J.B.Engineers And Associates,"6,779,400",Accepted-AOC,21-Dec-2023,AOC,Assam Power Distribution Company Ltd||CGM(D) Upper Assam Region - APDCL
2023_PWBNH_34120_1,SE/BII_Dist_Sessions Judge_4th storied Court Bldg,"Outside painting and repairing of the 4th storied Court building situated in the Court premise of District Sessions Judge, Kamrup (M), Guwahati (Minor repairing an outside painting including replacement of old sanitary fittings water supply works","Outside painting and repairing of the 4th storied Court building situated in the Court premise of District Sessions Judge, Kamrup (M), Guwahati (Minor repairing an outside painting including replacement of old sanitary fittings water supply works)",Works,Open Tender,Item Wise,Civil Works - Building,No,No,NA ,22-Nov-2023 12:00 PM,23-Nov-2023 12:00 PM ,180.0,No ,No,Online,14-Dec-2023 11:30 AM,Public Works Building and NH Department||Chief Engineer-Building - PWBNH||SE-Guwahati Circle-2 - PWBNH,"Panbazar, Guwahati",781001.0,2.0,"20,06,805",PALASH MONI GOSWAMI,"2,090,124",Rejected-AOC,26-Dec-2023,AOC,Public Works Building and NH Department||Chief Engineer-Building - PWBNH||SE-Guwahati Circle-2 - PWBNH
2023_BoTC_30789_1,CHDI/ ET/2022-23/15,North Maligaon FIS (Headworks appurtenant works) under PMKSY_HKKP for the year 2021-22,North Maligaon FIS (Headworks appurtenant works) under PMKSY_HKKP for the year 2021-22,Works,Open Tender,Works,Civil Works,No,No,NA ,11-May-2023 05:00 PM,NA ,180.0,No ,No,Online,22-May-2023 01:00 PM,Bodoland Territorial Council||Irrigation-BTC,KOKRAJHAR EAST,783370.0,2.0,"82,89,360",SWRANG NARZARY,"7,460,424",Accepted-AOC,28-Dec-2023,AOC,Bodoland Territorial Council||Irrigation-BTC
2023_BTC_34021_1,27/KOJ/NIT/Pt-II/2023-24/48,"Construction Vertical Extension of 2nd Floor in the existing Office Building Oo the CHD, FCS and CA Office, BTC, Kokrajhar 1st Floor. TN No.31_03R","Construction Vertical Extension of 2nd Floor in the existing Office Building Oo the CHD, FCS and CA Office, BTC, Kokrajhar 1st Floor. TN No.31_03R",Works,Open Tender,Item Rate,Civil Works - Building,No,No,NA ,18-Nov-2023 10:30 AM,NA ,180.0,No ,No,Online,30-Nov-2023 11:00 AM,Bodoland Territorial Council-PWD||Director Cum CHD - PWD BTC,Kokrajhar,783370.0,2.0,"33,36,252",DHANAPATI ADHIKARY,,Rejected-AOC,,AOC,Bodoland Territorial Council-PWD||Director Cum CHD - PWD BTC
2023_CD_31790_1,WAMUL/ APART/ Walk-in-cooler/ 23-24/ 1,Walk in Coolers (Capacity- 5000 litre) with DG set,Supply Installation Testing and Commissioning of Walk in Coolers (Capacity- 5000 litre) with DG set,Goods,Open Tender,Supply,Supply of Materials,No,No,NA ,26-Jul-2023 12:25 PM,NA ,120.0,No ,No,Online,16-Aug-2023 12:30 PM,Cooperation Department||The west Assam Milk Producers Cooperative Union Limited,"Purabi Dairy, Panjabari, Guwahati, Assam",781037.0,2.0,,ICE MAKE REFRIGERATION LIMITED,,Rejected-Finance,,AOC,Cooperation Department||The west Assam Milk Producers Cooperative Union Limited
2023_PWD_33026_1,CS/JHTRD/SOPD-G/49/2023-24,Construction of Guard wall Stone Pitching Steel Railing Earthfilling Wall Tiles at Param Shivam Shiv Mandir under SOPD G 2022 23 Jalukabri LAC,Construction of Guard wall Stone Pitching Steel Railing Earthfilling Wall Tiles at Param Shivam Shiv Mandir under SOPD G 2022 23 Jalukabri LAC,Works,Open Tender,Item Rate,Civil Works – Roads,No,No,NA ,13-Oct-2023 10:00 AM,17-Oct-2023 02:00 PM ,180.0,No ,No,Online,20-Oct-2023 02:00 PM,Public Works Roads Department,North Guwahati,781031.0,2.0,"44,82,000",Mustaf Moinul Passa,"4,480,926.29",Rejected-Finance,11-Dec-2023,AOC,Public Works Roads Department
2023_GMC_32096_1,GER/CE/1806/2019/282 Dated 10/08/2023,"Improvement of Purbachal Path Odalbakara Kahilipara, Div-VI",Construction of various Roads and Drains under GMC area under the award of SoPD 2020-21.,Works,Open Tender,Lump-sum,Civil Works,No,No,NA ,16-Aug-2023 09:00 AM,23-Aug-2023 11:00 AM ,180.0,No ,No,Online,06-Sep-2023 02:00 PM,Guwahati Municipal Corporation,GUWAHATI,781005.0,2.0,"48,00,000",M/S DAS ENTERPRISE,"3,676,800",Rejected-AOC,13-Dec-2023,AOC,Guwahati Municipal Corporation
2023_ID_33932_1,NIT/TCI/2/2023/591,"SOLAR POWERED MDTW SCHEME AT MEGHAIATI VILLAGE (2 No. POINTS) UNDER RIDF-XXIX (NABARD) FOR THE YEAR,2023-24 UNDER DHEKIAJULI- BORCHALLA DIVISION (IRRIGATION), DHEKIAJULI.","SOLAR POWERED MDTW SCHEME AT MEGHAIATI VILLAGE (2 No. POINTS) UNDER RIDF-XXIX (NABARD) FOR THE YEAR,2023-24 UNDER DHEKIAJULI- BORCHALLA DIVISION (IRRIGATION), DHEKIAJULI",Works,Open Tender,Percentage,Civil Works,No,No,NA ,14-Nov-2023 06:00 PM,NA ,180.0,No ,No,Online,05-Dec-2023 03:00 PM,Irrigation Department||Chief Engineer(Major)-Irrigation Dept||Tezpur Circle,MEGHAIATI,784110.0,2.0,"75,00,000",HYDROVERVE TECHNOLOGIES INDIA PRIVATE LIMITED,"7,422,756",Rejected-Technical,18-Dec-2023,AOC,Irrigation Department||Chief Engineer(Major)-Irrigation Dept||Tezpur Circle
2023_PWBNH_32060_4,TECH-II/256/2022/46 Dated Guwahati 9th August 2023,"TGR-49 Construction of Model Secondary Schools in the Tea Garden Areas, Assam at Behali TGMS, Dist Biswanath","TGR-49 Construction of Model Secondary Schools in the Tea Garden Areas, Assam at Behali TGMS, Dist Biswanath",Works,Open Tender,Item Rate,Civil Works - Building,No,No,NA ,14-Aug-2023 09:00 AM,22-Aug-2023 11:00 AM ,180.0,No ,No,Online,02-Sep-2023 03:30 PM,Public Works Building and NH Department||Chief Engineer-Building - PWBNH,Biswanath,784176.0,2.0,"2,88,24,127",Sri Beekey Agarwala,"28,686,666",Rejected-AOC,15-Dec-2023,AOC,Public Works Building and NH Department||Chief Engineer-Building - PWBNH
2023_APDCL_29997_1,CGM_D_UAR_APDCL_SS_44_DIB5,CGM_D_UAR_APDCL_SS_44_DIB5,Outsoucing of operation and maintenance activities of 33/11 KV sub stations under UAR,Services,Open Tender,Turn-key,Manpower Supply,No,No,NA ,21-Mar-2023 02:00 PM,NA ,365.0,No ,No,Online,24-Mar-2023 12:00 PM,Assam Power Distribution Company Ltd||CGM(D) Upper Assam Region - APDCL,Dibrugarh,786001.0,2.0,,M/s Faith Enterprise,"5,187,912",Not Admitted-Finance,21-Dec-2023,AOC,Assam Power Distribution Company Ltd||CGM(D) Upper Assam Region - APDCL
2022_NHM_28421_90,NHM-32023/11/2022-CONS-NHM/95,Construction of Buildingless Sub Health Centre in GoreswarSC at Baksha District for FY 2022 23 under PM ABHIM on Turnkey Basis,Construction of Buildingless Sub Health Centre in GoreswarSC at Baksha District for FY 2022 23 under PM ABHIM on Turnkey Basis,Works,Open Tender,Turn-key,Civil Works - Building,No,No,NA ,26-Dec-2022 06:55 PM,NA ,180.0,No ,No,Online,02-Feb-2023 03:30 PM,National Health Mission||State Programme Management Unit - NHM,Baksha,781313.0,2.0,"52,03,000",BHARAT BORO,,Rejected-Technical,,AOC,National Health Mission||State Programme Management Unit - NHM
2023_APDCL_28912_1,CGM_D_UAR_APDCL_S/S_39_SIV2,CGM_D_UAR_APDCL_S/S_39_SIV2,"Outsourcing of Operation and maintenance of 33/11 KV sub station under UAR, APDCL",Services,Open Tender,Turn-key,Manpower Supply,No,No,NA ,18-Jan-2023 01:00 PM,NA ,365.0,No ,No,Online,27-Jan-2023 12:00 PM,Assam Power Distribution Company Ltd||CGM(D) Upper Assam Region - APDCL,Sivasagar,785640.0,2.0,,LAHON BANIJYIK ENTERPRISE,"3,550,478",Not Admitted-Fee/PreQual/Technical,22-Dec-2023,AOC,Assam Power Distribution Company Ltd||CGM(D) Upper Assam Region - APDCL
2023_PWBNH_32728_1,CE/TB-VII/22/2023/15 Dated Guwahati 29th Sept 2023,Jagannath Community and Skill Centre at Margherita TE under Margherita LAC (Pkg. No.- 20),Jagannath Community and Skill Centre at Margherita TE under Margherita LAC (Pkg. No.- 20),Works,Open Tender,Item Rate,Civil Works - Building,No,No,NA ,30-Sep-2023 06:00 PM,NA ,180.0,No ,No,Online,25-Oct-2023 03:00 PM,Public Works Building and NH Department||Chief Engineer-Building - PWBNH,Margherita,786181.0,2.0,"1,40,73,143",M/S R B ENTERPRISE,"14,068,193",Accepted-AOC,15-Dec-2023,AOC,Public Works Building and NH Department||Chief Engineer-Building - PWBNH
2023_NHM_31528_16,NHM-32042/6/2022-CONS-NHM,Construction of Buildingless Sub Health Centre in OUGURIJAAN SC in SIVASAGAR District under PM ABHIM for the FY 2022 23 under NHM on Turnkey Basis,Construction of Buildingless Sub Health Centre in OUGURIJAAN SC in SIVASAGAR District under PM ABHIM for the FY 2022 23 under NHM on Turnkey Basis,Works,Open Tender,Turn-key,Civil Works - Building,No,No,NA ,06-Jul-2023 06:00 PM,NA ,180.0,No ,No,Online,25-Jul-2023 03:30 PM,National Health Mission||State Programme Management Unit - NHM,SIVASAGAR,785640.0,2.0,"52,03,000",Sri Krishna Borah,"5,150,900",Rejected-Technical,14-Dec-2023,AOC,National Health Mission||State Programme Management Unit - NHM
2023_BTC_33470_1,ACE-27/KOJ/NIT/Pt-II/23-24/45,Construction of 20 Bedded Hospital at Khasibari under Gossaigaon Sub-Division at Kokrajhar District. TN No.33_01,Construction of 20 Bedded Hospital at Khasibari under Gossaigaon Sub-Division at Kokrajhar District. TN No.33_01,Works,Open Tender,Item Rate,Civil Works - Building,No,No,NA ,03-Nov-2023 10:30 AM,NA ,180.0,No ,No,Online,23-Nov-2023 02:30 PM,Bodoland Territorial Council-PWD||Director Cum CHD - PWD BTC,Kokrajhar,783370.0,2.0,"81,52,355",DHILAN BASUMATARY,"8,152,350",Rejected-AOC,12-Dec-2023,AOC,Bodoland Territorial Council-PWD||Director Cum CHD - PWD BTC
2023_BoTC_33293_1,DPRD/BTC/(6th ASFC)-191/2023/13/48_5,Improvement of road from connecting East Maligaon road to West Bhadranpur village under 6th ASFC for the year 2022-23 during the year 2023-24.,DPRD/BTC/(6th ASFC)-191/2023/13/48_5,Works,Open Tender,Item Rate,Civil Works,No,No,NA ,27-Oct-2023 10:30 AM,NA ,180.0,No ,No,Online,18-Nov-2023 02:30 PM,Bodoland Territorial Council||Panchayat and Rural Development-BTC,KOkrajhar,783370.0,2.0,"23,78,946",KANDALAL BRAHMA,"2,378,802.41",Rejected-AOC,22-Dec-2023,AOC,Bodoland Territorial Council||Panchayat and Rural Development-BTC
2023_PWBNH_29498_8,CE/ARC-I/07/2023/2 Dated Guwahati 15th Feb 2023,"Consultancy services for the work Transformation of School in Kamrup of Assam under PM-DevINE scheme for i. Uparhali H.S. School, Palashbari","Consultancy services for the work Transformation of School in Kamrup of Assam under PM-DevINE scheme for i. Uparhali H.S. School, Palashbari",Works,Open Tender,Item Rate,Civil Works - Building,No,No,NA ,22-Feb-2023 04:00 PM,23-Feb-2023 02:30 PM ,180.0,No ,No,Online,06-Mar-2023 03:30 PM,Public Works Building and NH Department||Chief Engineer-Building - PWBNH,Kamrup,781122.0,2.0,"23,70,300",Ks Design Cell,"2,365,000",Rejected-AOC,30-Dec-2023,AOC,Public Works Building and NH Department||Chief Engineer-Building - PWBNH
2023_PWBNH_29498_5,CE/ARC-I/07/2023/2 Dated Guwahati 15th Feb 2023,"Consultancy services for the work Transformation of School in Kamrup of Assam under PM-DevINE scheme for i. Ganesh Mandir Higher Secondary School, Sixmile","Consultancy services for the work Transformation of School in Kamrup of Assam under PM-DevINE scheme for i. Ganesh Mandir Higher Secondary School, Sixmile",Works,Open Tender,Item Rate,Civil Works - Building,No,No,NA ,22-Feb-2023 04:00 PM,23-Feb-2023 02:30 PM ,180.0,No ,No,Online,03-Mar-2023 03:00 PM,Public Works Building and NH Department||Chief Engineer-Building - PWBNH,Kamrup,781022.0,2.0,"17,60,500",Ks Design Cell,"1,714,000",Accepted-AOC,30-Dec-2023,AOC,Public Works Building and NH Department||Chief Engineer-Building - PWBNH
2023_HFWD_29186_1,0074/150630,SUPPLY OF ESSENTIAL DRUGS,SUPPLY OF ESSENTIAL DRUGS,Goods,Open Tender,Fixed-rate,Medicines,No,No,NA ,07-Feb-2023 02:00 PM,16-Feb-2023 02:00 PM ,180.0,No ,No,Online,28-Feb-2023 03:00 PM,Health and Family Welfare Department||Assam Medical Services Corporation Limited,GUWAHATI,781026.0,2.0,"20,00,000",M/s. Pfizer Products India Private Limited,1.0,Rejected-Finance,26-Dec-2023,AOC,Health and Family Welfare Department||Assam Medical Services Corporation Limited
2023_DoWR_31700_1,MANGALDOI/2023-24/SDMF/I,Mitigation of erosion of Mangaldoi town and its adjoining areas from the river Mangaldoi PACKAGE 3,Mitigation of erosion of Mangaldoi town and its adjoining areas from the river Mangaldoi.,Works,Open Tender,Works,Civil Works,No,No,NA ,17-Jul-2023 06:30 PM,NA ,180.0,No ,No,Online,10-Aug-2023 03:00 PM,Department of Water Resources||Chief Engineer - DoWR,MANGALDAI,784125.0,2.0,"2,91,88,070",DHILAN BASUMATARY,,Rejected-AOC,,AOC,Department of Water Resources||Chief Engineer - DoWR
2023_NHM_31270_17,NHM-32023/33/2023-CONS-NHM/413,Construction of Buildingless Sub Health Centre at DIGLI SC in Cachar District under PM ABHIM for the FY 2021-22 and FY 2022-23 under NHM on Turnkey Basis,Construction of Buildingless Sub Health Centre at DIGLI SC in Cachar District under PM ABHIM for the FY 2021-22 and FY 2022-23 under NHM on Turnkey Basis,Works,Open Tender,Turn-key,Civil Works - Building,No,No,NA ,19-Jun-2023 12:00 PM,NA ,180.0,No ,No,Online,11-Jul-2023 03:30 PM,National Health Mission||State Programme Management Unit - NHM,Cachar District,788114.0,2.0,"52,03,000",JAHAR PAUL,"4,682,700",Not Admitted-Fee/PreQual/Technical,04-Dec-2023,AOC,National Health Mission||State Programme Management Unit - NHM
2023_BoTC_33126_1,BTC/SCDB/03/2023 - 03,Construction of road with Sand Gravelling and Earth Filling at North Deulguri village,Construction of road with Sand Gravelling and Earth Filling at North Deulguri village under SOPD for the year during 2023-24,Works,Open Tender,Works,Civil Works,No,No,NA ,17-Oct-2023 03:00 PM,NA ,180.0,No ,No,Online,07-Nov-2023 10:30 AM,Bodoland Territorial Council||Panchayat and Rural Development-BTC,Sidli - North Deulguri,783373.0,2.0,"34,78,000",ANSUMWI NARZARY,"3,477,751.5",Rejected-Finance,23-Dec-2023,AOC,Bodoland Territorial Council||Panchayat and Rural Development-BTC
2023_NHM_31428_27,NHM-32031/4 2021 Construction NHM Part 75 13,Establishment of Proposed 6 bedded ward at various SHCs n PHCs of Assam under ECRP II NHM Assam Group 222 5 nos schemes in Udalguri district,Establishment of Proposed 6 bedded ward at various SHCs n PHCs of Assam under ECRP II NHM Assam Group 222 5 nos schemes in Udalguri district,Works,Open Tender,Turn-key,Civil Works - Building,No,No,NA ,29-Jun-2023 09:00 AM,NA ,180.0,No ,No,Online,10-Jul-2023 02:00 PM,National Health Mission||State Programme Management Unit - NHM,Udalguri District,784509.0,2.0,"57,99,785",Jintu Kumar Deori,"5,799,700",Rejected-AOC,06-Dec-2023,AOC,National Health Mission||State Programme Management Unit - NHM
2023_BTC_33481_1,ACE-27/KOJ/NIT/Pt-II/23-24/45,Repairing and Renovation of 2 Nos. of Gr.III Twin Quarter and Construction of CC Approach Road and Painting of front Boundary Wall at Dotma BPHC cum CHC in Kokrajhar District. TN No.33_06,Repairing and Renovation of 2 Nos. of Gr.III Twin Quarter and Construction of CC Approach Road and Painting of front Boundary Wall at Dotma BPHC cum CHC in Kokrajhar District. TN No.33_06,Works,Open Tender,Item Rate,Civil Works - Building,No,No,NA ,03-Nov-2023 10:30 AM,NA ,180.0,No ,No,Online,23-Nov-2023 02:30 PM,Bodoland Territorial Council-PWD||Director Cum CHD - PWD BTC,Kokrajhar,783370.0,2.0,"23,60,700",M/S MAA SARODA ENTERPRISE,"2,359,424.12",Rejected-AOC,18-Dec-2023,AOC,Bodoland Territorial Council-PWD||Director Cum CHD - PWD BTC
2022_PHED_26204_2,JJMA_46_LAB_2022_7370_76,PKG 2 Rate Contract for supply of Glasswares for laboratories under JJM Assam,PKG 2 Rate Contract for supply of different Glasswares for water sample test for various water testing laboratories under Jal Jeevan Mission Assam,Goods,Open Tender,Supply,Supply of Materials,No,No,NA ,05-Jul-2022 10:00 AM,NA ,90.0,No ,No,Online,02-Aug-2022 03:00 PM,Public Health Engineering Department||Chief Engineer PHE(P)-Assam-PHED||Lower Assam Zone-Guwahati-PHED||Guwahati Circle-Guwahati-PHED,Guwahati,781035.0,2.0,0.0,AMARENDRA NATH SARMA,1.0,Rejected-AOC,11-Dec-2023,AOC,Public Health Engineering Department||Chief Engineer PHE(P)-Assam-PHED||Lower Assam Zone-Guwahati-PHED||Guwahati Circle-Guwahati-PHED
2023_NHM_29826_1,NHM-32031/4/2021-Const-NHM/Pt 34/69,Establishment of Proposed 6 bedded ward at various SHCs and PHCs of Assam under ECRP-II NHM Assam Group 8 5 nos,Establishment of Proposed 6 bedded ward at various SHCs and PHCs of Assam under ECRP-II NHM Assam Group 8 5 nos schemes in Baksa district,Works,Open Tender,Turn-key,Civil Works - Building,No,No,NA ,11-Mar-2023 05:00 PM,NA ,180.0,No ,No,Online,23-Mar-2023 03:30 PM,National Health Mission||State Programme Management Unit - NHM,Baksa,781366.0,2.0,"57,99,785",ANIRBAN DEKA,,Rejected-Technical,,AOC,National Health Mission||State Programme Management Unit - NHM
2023_AHVD_30738_1,CVS/P-6/Tender/2023-24/21,"E-TENDER FOR ENTERING INTO RATE CONTRACT FOR SUPPLY OF VETERINARY MEDICINES, AID MATERIAL, AND SURGICAL ITEMS FOR THE YEAR 2023-24","E-TENDER FOR ENTERING INTO RATE CONTRACT FOR SUPPLY OF VETERINARY MEDICINES, AID MATERIAL, AND SURGICAL ITEMS FOR THE YEAR 2023-24",Goods,Open Tender,Item Wise,Medicines,No,No,NA ,09-May-2023 11:00 AM,12-May-2023 03:00 PM ,180.0,No ,No,Online,01-Jun-2023 11:00 AM,Animal Husbandry and Veterinary Department||Directorate of A.H. and Veterinary,Guwahati,781003.0,2.0,,Assam Manufacturer Repacking and Distributor,"712,800",Accepted-AOC,19-Dec-2023,AOC,Animal Husbandry and Veterinary Department||Directorate of A.H. and Veterinary
2023_PCCF_33273_1,DBR /CAMPA/2023-24/107,"Construction of Camp hut, Installation of Ring well/ Tube well and Inspection path and approach road UNDER CAMPA SCHEME","Construction of Camp hut, Installation of Ring well/ Tube well and Inspection path and approach road UNDER CAMPA SCHEME at Tangia of Jokai RF under Dibrugarh Range of Dibrugarh Division",Works,Open Tender,Works,Agricultural or Forestry,No,No,NA ,26-Oct-2023 12:00 PM,01-Nov-2023 11:30 AM ,180.0,No ,No,Online,30-Nov-2023 04:30 PM,"Pr. Chief Conservator of Forest and Head of Forest Force||Chief Conservator of Forests (Upper Assam Zone)||Eastern Assam Circle, Jorhat||Dibrugarh Division",Jokai RF,786003.0,1.0,"8,75,000",MS/APS ENTERPRISE,"787,500",Accepted-AOC,30-Dec-2023,AOC,"Pr. Chief Conservator of Forest and Head of Forest Force||Chief Conservator of Forests (Upper Assam Zone)||Eastern Assam Circle, Jorhat||Dibrugarh Division"
2023_ID_31835_1,SID-13032_779_2023_598,Repairing and Renovation of Ranipathar FIS under SOPD_G for the year 2022_23,"Raising of Brick Lined canal and Afflux Bundh, Resectioning of Earthen canal and CD.",Works,Open Tender,Item Rate,Civil Works,No,No,NA ,28-Jul-2023 04:00 PM,NA ,180.0,No ,No,Online,29-Aug-2023 03:00 PM,Irrigation Department||Chief Engineer(Major)-Irrigation Dept||Goalpara Circle||Dudhnoi Goalpara East Division,Dighali Village Under Rangjuli Block,783123.0,2.0,"43,77,833",Sri Rupmani Nath,"3,940,049.7",Rejected-AOC,21-Dec-2023,AOC,Irrigation Department||Chief Engineer(Major)-Irrigation Dept||Goalpara Circle||Dudhnoi Goalpara East Division
2022_PWBNH_26102_1,CE/ARC-I/08/2021/PT-I/09 Dated 23rd June 2022,PMC service for Construction of Proposed Sri Sri Aniruddhadeva Sports University at Chabua,PMC service for Construction of Proposed Sri Sri Aniruddhadeva Sports University at Chabua,Works,Open Tender,Item Rate,Civil Works - Building,No,No,NA ,24-Jun-2022 04:00 PM,29-Jun-2022 01:30 PM ,180.0,No ,No,Online,05-Jul-2022 03:00 PM,Public Works Building and NH Department||Chief Engineer-Building - PWBNH,Chabua,786184.0,2.0,"46,79,70,000",ARC Test House and Consultant LLP,"10,635,000",Rejected-AOC,30-Dec-2023,AOC,Public Works Building and NH Department||Chief Engineer-Building - PWBNH
