2023_AEGCL_32135_1,Tech-1062/APM Phase-I/SOPD-G/2023-24/Bid,"Supply, erection and commissioning including associated works for strengthening of the bus system at 132kV APM GSS","Supply, erection and commissioning including associated works for strengthening of the bus system at 132kV APM GSS",Works,Open Tender,Turn-key,Electrical Works,No,No,NA ,19-Aug-2023 02:00 PM,NA ,180.0,No ,No,Online,27-Sep-2023 02:00 PM,Assam Electricity Grid Corporation Ltd||CGM (T and T),"132/33 KV APM GSS (Jogighopa), Assam",783382.0,2.0,"1,44,55,516",ARADHANA AGENCY,"12,566,915",Accepted-AOC,11-Dec-2023,AOC,Assam Electricity Grid Corporation Ltd||CGM (T and T)
2023_GMC_32096_9,GER/CE/1806/2019/282 Dated 10/08/2023,"Improvement of Santi Nagar Path Paschim Boragaon, Div-VI",Construction of various Roads and Drains under GMC area under the award of SoPD 2020-21.,Works,Open Tender,Lump-sum,Civil Works,No,No,NA ,16-Aug-2023 09:00 AM,23-Aug-2023 11:00 AM ,180.0,No ,No,Online,06-Sep-2023 02:00 PM,Guwahati Municipal Corporation,GUWAHATI,781005.0,2.0,"95,00,000",HRIDAY JUGAL DAS,"7,666,500",Rejected-AOC,08-Dec-2023,AOC,Guwahati Municipal Corporation
2023_ID_33103_2,"NIT No.30 (RIDF-XXIX,NABARD) 2023-24 Date 16.10",Installation of MDTW Irrigation Scheme Powered by Solar Energy (3 Points) under RIDF-XXIX (NABARD) under Lakhimpur LAC for the year 2023-24 package 2,Installation of MDTW Irrigation Scheme Powered by Solar Energy (3 Points) under RIDF-XXIX (NABARD) under Lakhimpur LAC,Works,Open Tender,Item Rate,Civil Works,No,No,NA ,17-Oct-2023 06:00 PM,NA ,180.0,No ,No,Online,07-Nov-2023 03:00 PM,Irrigation Department||Chief Engineer(Major)-Irrigation Dept,North Lakhimpur,787001.0,2.0,"1,10,80,189",Chakra Bharali,"9,972,170",Rejected-Finance,30-Dec-2023,AOC,Irrigation Department||Chief Engineer(Major)-Irrigation Dept
2023_PWBNH_32490_11,CE/TB-VII/22/2023/9 Dated Guwahati 31st Aug 2023,Jagannath Community and Skill Centre at i) Rajgarh T.E. ii) Langkashi T.E. under Tinsukia LAC (Pkg. No.-16),Jagannath Community and Skill Centre at i) Rajgarh T.E. ii) Langkashi T.E. under Tinsukia LAC (Pkg. No.-16),Works,Open Tender,Item Rate,Civil Works - Building,No,No,NA ,14-Sep-2023 01:00 PM,NA ,180.0,No ,No,Online,03-Oct-2023 03:00 PM,Public Works Building and NH Department||Chief Engineer-Building - PWBNH,Tinsukia,786125.0,2.0,"2,81,46,286",S.B. ENTERPRISE,"27,420,212",Accepted-AOC,12-Dec-2023,AOC,Public Works Building and NH Department||Chief Engineer-Building - PWBNH
2023_PWBNH_34150_1,DGETBD_Boundary Wall_Bunglow No.1_2,"Increasing height of the boundary wall of Bungalow No-1 and Bungalow No-2 at M.G. Road, Guwahati","Increasing height of the boundary wall of Bungalow No-1 and Bungalow No-2 at M.G. Road, Guwahati",Works,Open Tender,Item Wise,Civil Works - Building,No,No,NA ,23-Nov-2023 12:00 PM,30-Nov-2023 12:00 PM ,180.0,No ,No,Online,14-Dec-2023 12:30 PM,Public Works Building and NH Department||Chief Engineer-Building - PWBNH||SE-Guwahati Circle-2 - PWBNH||Dispur Ghy East Teritorial Building Division,M G Road Guwahati,781001.0,2.0,"24,51,957",M/S J C Associates,"2,572,965",Rejected-AOC,27-Dec-2023,AOC,Public Works Building and NH Department||Chief Engineer-Building - PWBNH||SE-Guwahati Circle-2 - PWBNH||Dispur Ghy East Teritorial Building Division
2023_BTC_33485_1,ACE-27/KOJ/NIT/Pt-II/23-24/45,"Construction of DHS Office Staff Canteen, Beautification and Landscaping of DHS Office Premises and Construction of Main Gate of DHS Office. TN No.33_08","Construction of DHS Office Staff Canteen, Beautification and Landscaping of DHS Office Premises and Construction of Main Gate of DHS Office. TN No.33_08",Works,Open Tender,Item Rate,Civil Works - Building,No,No,NA ,03-Nov-2023 10:30 AM,NA ,180.0,No ,No,Online,23-Nov-2023 02:30 PM,Bodoland Territorial Council-PWD||Director Cum CHD - PWD BTC,Kokrajhar,783370.0,2.0,"65,99,000",M/S M.M. ENTERPRISE,"6,596,655.37",Rejected-AOC,18-Dec-2023,AOC,Bodoland Territorial Council-PWD||Director Cum CHD - PWD BTC
2023_PWBNH_32490_10,CE/TB-VII/22/2023/9 Dated Guwahati 31st Aug 2023,Jagannath Community and Skill Centre at i) Monkhushi T.E. ii) Derail T.E. under Tinsukia LAC (Pkg. No.-15),Jagannath Community and Skill Centre at i) Monkhushi T.E. ii) Derail T.E. under Tinsukia LAC (Pkg. No.-15),Works,Open Tender,Item Rate,Civil Works - Building,No,No,NA ,14-Sep-2023 12:00 PM,NA ,180.0,No ,No,Online,03-Oct-2023 03:00 PM,Public Works Building and NH Department||Chief Engineer-Building - PWBNH,Tinsukia,786125.0,2.0,"2,81,46,286",Kamal Singh Dugar,"28,041,665",Accepted-AOC,20-Dec-2023,AOC,Public Works Building and NH Department||Chief Engineer-Building - PWBNH
2023_ID_33103_3,"NIT No.30 (RIDF-XXIX,NABARD) 2023-24 Date 16.10","Construction of 3 Nos. Solar Powered MDTW Scheme at Balitara, Balikuria and Guwakuchi Village under RIDF-XXIX (NABARD) for the year 2023-24. package 3","Construction of 3 Nos. Solar Powered MDTW Scheme at Balitara, Balikuria and Guwakuchi Village under RIDF-XXIX (NABARD) for the year 2023-24",Works,Open Tender,Item Rate,Civil Works,No,No,NA ,17-Oct-2023 06:00 PM,NA ,180.0,No ,No,Online,07-Nov-2023 03:00 PM,Irrigation Department||Chief Engineer(Major)-Irrigation Dept,Nalbari,781335.0,2.0,"1,10,75,750",BIMAL KALITA,,Rejected-Finance,,AOC,Irrigation Department||Chief Engineer(Major)-Irrigation Dept
2023_GMC_32096_8,GER/CE/1806/2019/282 Dated 10/08/2023,"Improvement of Road and Drain at Bima Path bye lane 03, Six Mile Darndha, Div-V",Construction of various Roads and Drains under GMC area under the award of SoPD 2020-21.,Works,Open Tender,Lump-sum,Civil Works,No,No,NA ,16-Aug-2023 09:00 AM,23-Aug-2023 11:00 AM ,180.0,No ,No,Online,06-Sep-2023 02:00 PM,Guwahati Municipal Corporation,GUWAHATI,781005.0,2.0,"84,73,000",P.S. ENTERPRISE,"7,532,497",Rejected-AOC,04-Dec-2023,AOC,Guwahati Municipal Corporation
2023_PWD_33850_1,NIT/ACE/EZ/192/2021/23,Construction of Matak Bhawan at Dibrugarh (Phase-I),Construction of Matak Bhawan at Dibrugarh (Phase-I),Works,Open Tender,Item Rate,Civil Works - Building,No,No,NA ,13-Nov-2023 02:00 PM,NA ,180.0,No ,No,Online,28-Nov-2023 12:00 PM,Public Works Roads Department,Dibrugarh,786001.0,2.0,"1,44,99,968",KUSUMBAR GOGOI,"14,499,967",Rejected-AOC,30-Dec-2023,AOC,Public Works Roads Department
2023_PWBNH_33421_1,DDTBDS/Inspection Bunglow/2023-24/1542,"Construction of Inspection Bunglow at Silapathar, District Dhemaji Assam (For Furniture Work)","Construction of Inspection Bunglow at Silapathar, District Dhemaji Assam (For Furniture Work)",Goods,Open Tender,Item Rate,Furniture/ Fixture,No,No,NA ,01-Nov-2023 05:00 PM,NA ,180.0,No ,No,Online,17-Nov-2023 10:00 AM,Public Works Building and NH Department||Chief Engineer-Building - PWBNH||Lakhimpur Circle - PWBNH,Silapathar,787059.0,2.0,"27,62,210",Benudhar Medok,"2,734,590",Accepted-AOC,08-Dec-2023,AOC,Public Works Building and NH Department||Chief Engineer-Building - PWBNH||Lakhimpur Circle - PWBNH
2023_AHVD_30402_3,DVT-223/RIDF-XXVII (S)Nalbari/2022-23/9,"Construction of Assam Type Sub-Centre Building with electrification,Water supply and sanitary works etc. at BORMURIKONA in Nalbari District.","Construction of Assam Type Sub- Centre Building with electrification, Water supply and sanitary works etc. at BORMURIKONA in Nalbari District.",Works,Open Tender,Item Rate,Civil Works,No,No,NA ,06-Apr-2023 06:00 PM,11-Apr-2023 01:00 PM ,180.0,No ,No,Online,29-Apr-2023 02:30 PM,Animal Husbandry and Veterinary Department||Directorate of A.H. and Veterinary,NALBARI,781369.0,2.0,"33,71,000",Balen Roy Medhi,"2,519,136",Rejected-Finance,18-Dec-2023,AOC,Animal Husbandry and Veterinary Department||Directorate of A.H. and Veterinary
2023_BoTC_29165_25,CHDI/ ET/2022-23/9,Kakramari Sisubari F.I.S under PMKSY_HKKP for the year 2021-22,Kakramari Sisubari F.I.S under PMKSY_HKKP for the year 2021-22,Works,Open Tender,Works,Civil Works,No,No,NA ,07-Feb-2023 03:30 PM,NA ,180.0,No ,No,Online,01-Mar-2023 02:00 PM,Bodoland Territorial Council||Irrigation-BTC,Udalguri,784509.0,2.0,"2,24,40,700",Ajit Daimari,"20,196,630",Rejected-Technical,13-Dec-2023,AOC,Bodoland Territorial Council||Irrigation-BTC
2023_DoWR_30134_1,KOKRAJHAR/2022-23/SOPDG-II/IX,A/E measures to protect Tajpur Banglabari and its adjoining areas from the erosion of river Modati (Gurufela).,A/E measures to protect Tajpur Banglabari and its adjoining areas from the erosion of river Modati (Gurufela).,Works,Open Tender,Works,Civil Works,No,No,NA ,25-Mar-2023 06:00 PM,NA ,180.0,No ,No,Online,13-Apr-2023 03:00 PM,Department of Water Resources||Chief Engineer - DoWR,KOKRAJHAR,783370.0,2.0,"99,36,556",DHILAN BASUMATARY,"8,942,900",Rejected-AOC,15-Dec-2023,AOC,Department of Water Resources||Chief Engineer - DoWR
2023_BoTC_33881_1,No. TECH- 40/SE(RB)/E-Tender,Improvement of Mangaldoi Bhutiachang Road (Kalaigaon Town Portion) under PWD Udalguri (RB) Division under SOPD (BTC) for the year 2023-24. Pkg.183-1,Improvement of Mangaldoi Bhutiachang Road (Kalaigaon Town Portion) under PWD Udalguri (RB) Division under SOPD (BTC) for the year 2023-24. Pkg.183-1,Works,Open Tender,Item Rate,Civil Works – Roads,No,No,NA ,11-Nov-2023 10:00 AM,NA ,180.0,No ,No,Online,29-Nov-2023 01:30 PM,Bodoland Territorial Council||PWD-BTC,Udalguri,784521.0,2.0,"1,63,00,000",MOHAN CHANDRA BARO,"16,295,730",Rejected-Technical,08-Dec-2023,AOC,Bodoland Territorial Council||PWD-BTC
2023_NHM_32025_1,NHM-32040/7/2022 Construction NHM Part 1 67,Construction of 50 bedded New Critical Care Block CCB at Lakhimpur Medical College in Lakhimpur district under NHM Assam PM ABHIM 2022 23,Construction of 50 bedded New Critical Care Block CCB at Lakhimpur Medical College in Lakhimpur district under NHM Assam PM ABHIM 2022 23,Works,Open Tender,Turn-key,Civil Works - Building,No,No,NA ,10-Aug-2023 02:00 PM,NA ,180.0,No ,No,Online,29-Aug-2023 03:00 PM,National Health Mission||State Programme Management Unit - NHM,Lakhimpur District,787001.0,2.0,"19,13,08,152",HUSSAIN AHMED MAZUMDER,,Accepted-AOC,,AOC,National Health Mission||State Programme Management Unit - NHM
2023_PWD_30477_3,CE/STBR/II/22/2022-23/6 Date 18-03-2023,Construction of ROB at Rangia in replacement of Railway Level Crossing Gate No. SK-12 at Km-362/8-9 on Rangia Kendukona Road in Kamrup District under Construction of ROBs on 50_50 Cost Sharing Basis,Construction of ROB at Rangia in replacement of Railway Level Crossing Gate No. SK-12 at Km-362/8-9 on Rangia Kendukona Road in Kamrup District under Construction of ROBs on 50_50 Cost Sharing Basis,Works,Open Tender,Item Rate,Civil Works – Roads,No,No,NA ,12-Apr-2023 06:00 PM,18-Apr-2023 11:00 AM ,180.0,No ,No,Online,06-May-2023 10:00 AM,Public Works Roads Department,RANGIA,781354.0,2.0,"28,10,59,200",ANUPAM NIRMAN PVT. LTD.,,Rejected-AOC,,AOC,Public Works Roads Department
2023_PWBNH_32728_8,CE/TB-VII/22/2023/15 Dated Guwahati 29th Sept 2023,Jagannath Community and Skill Centre at Dirok TE under Margherita LAC (Pkg. No.-27),Jagannath Community and Skill Centre at Dirok TE under Margherita LAC (Pkg. No.-27),Works,Open Tender,Item Rate,Civil Works - Building,No,No,NA ,30-Sep-2023 06:00 PM,NA ,180.0,No ,No,Online,25-Oct-2023 03:00 PM,Public Works Building and NH Department||Chief Engineer-Building - PWBNH,Margherita,786181.0,2.0,"1,40,73,143",M/S R B ENTERPRISE,"14,068,193",Accepted-AOC,15-Dec-2023,AOC,Public Works Building and NH Department||Chief Engineer-Building - PWBNH
2023_PWBNH_32836_1,MTBD/SP OFFICE TENDER/168/966,"Construction of RCC 3-storied SP Office Building with RCC Garrage including Civil, Electrical, Sanitary (Internal External ),Site Development works ,Boundary wall etc at Majuli, Assam",Construction of Building,Works,Open Tender,Item Rate,Civil Works - Building,No,No,NA ,09-Oct-2023 06:00 PM,17-Oct-2023 11:00 AM ,180.0,No ,No,Online,03-Nov-2023 02:00 PM,Public Works Building and NH Department||Chief Engineer-Building - PWBNH||SE-Jorhat Circle - PWBNH||EE-Jorhat Building Division - PWBNH,Majuli,785104.0,2.0,"3,52,07,394",Bhabananda Nath,,Accepted-AOC,,AOC,Public Works Building and NH Department||Chief Engineer-Building - PWBNH||SE-Jorhat Circle - PWBNH||EE-Jorhat Building Division - PWBNH
2023_ICD_31486_2,310039/0951,"ETP plant shed at the Regional Food Testing Laboratory (RFTL), at IID Centre Nalbari","ETP plant shed at the Regional Food Testing Laboratory (RFTL), at IID Centre Nalbari",Works,Open Tender,Item Rate,Civil Works,No,No,NA ,05-Sep-2023 03:15 PM,NA ,120.0,No ,No,Online,21-Sep-2023 03:15 PM,Industries and Commerce Department||Assam Industrial Development Corporation Ltd - ICD,"RFTL, Nalbari, Assam",781335.0,2.0,"8,28,000",MS NB ENTERPRISE,"703,800",Rejected-AOC,18-Dec-2023,AOC,Industries and Commerce Department||Assam Industrial Development Corporation Ltd - ICD
2023_SSA_32174_35,CW/Tender/23-24/510/2023/130,Group no. 19,Construction of additional classroom in secondary schools under Dalgaon and Sipajhar block in Darrang district,Works,Open Tender,Works,Civil Works - Building,No,No,NA ,30-Aug-2023 05:00 PM,30-Aug-2023 06:00 PM ,180.0,No ,No,Online,11-Sep-2023 03:00 PM,Axom Sarba Siksha Abhijan Mission,Dalgaon and Sipajhar,781019.0,2.0,"2,32,70,000",ALHAZUDDIN AHMED,"23,264,999",Rejected-AOC,27-Dec-2023,AOC,Axom Sarba Siksha Abhijan Mission
2023_PWD_32176_1,CE/DEV/TB/85/2023-24/01,SOPD_G_23_24_14 Immediate attention requiring to ensure smooth communication of important roads of Hallidayganj Mankachar (HM) road for the year 2023-24 under SOPD-G for the year 2023-24.,SOPD_G_23_24_14 Immediate attention requiring to ensure smooth communication of important roads of Hallidayganj Mankachar (HM) road for the year 2023-24 under SOPD-G for the year 2023-24.,Works,Open Tender,Item Rate,Civil Works,No,No,NA ,22-Aug-2023 05:00 PM,05-Sep-2023 12:00 PM ,180.0,No ,No,Online,15-Sep-2023 02:00 PM,Public Works Roads Department,Mankachar,781003.0,2.0,"3,14,18,000",Nozrul Islam,"28,276,200",Rejected-AOC,02-Dec-2023,AOC,Public Works Roads Department
2023_BoTC_30429_18,CHDI/ ET-24/2022-23/11,Piplini FIS under PMKSY-HKKP for the year 2021-2022 (Afflux Bund and Guide Bund),Piplini FIS under PMKSY-HKKP for the year 2021-2022 (Afflux Bund and Guide Bund),Works,Open Tender,Works,Civil Works,No,No,NA ,10-Apr-2023 06:00 PM,NA ,180.0,No ,No,Online,04-May-2023 03:00 PM,Bodoland Territorial Council||Irrigation-BTC,Tamulpur,781367.0,2.0,"1,59,95,330",ASHOK KUMAR BAJAJ,"14,395,797",Rejected-Technical,28-Dec-2023,AOC,Bodoland Territorial Council||Irrigation-BTC
2023_BoTC_33047_1,BLM/2023-24/006/Goat/I/20 - C,Construction of Scientific Goat Shed using structural steel in Kokrajhar District.,Construction of Scientific Goat Shed using structural steel in Kokrajhar District.,Works,Open Tender,Works,Civil Works,No,No,NA ,13-Oct-2023 03:30 PM,NA ,180.0,No ,No,Online,08-Nov-2023 02:00 PM,Bodoland Territorial Council||Bodofa Livelihood Mission - BTC,Kokrajhar,783370.0,2.0,"1,40,00,000",Bimal Brahma,"13,992,078",Accepted-AOC,28-Dec-2023,AOC,Bodoland Territorial Council||Bodofa Livelihood Mission - BTC
2023_AHVD_31779_1,DD/RIDF-XXVII/2023-24/977-79,Supply of equipment and other logistics to be provided to each Milk Collection Center (MCC) under RIDF-XXVII.,Supply of equipment and other logistics to be provided to each Milk Collection Center (MCC) under RIDF-XXVII.,Goods,Open Tender,Item Rate,Miscellaneous Goods,No,No,NA ,25-Jul-2023 02:00 PM,04-Aug-2023 02:00 PM ,180.0,No ,No,Online,16-Aug-2023 03:00 PM,Animal Husbandry and Veterinary Department||Directorate of Dairy Development,Guwahati,781022.0,2.0,"27,67,000",Core Group,"2,373,034",Rejected-Technical,12-Dec-2023,AOC,Animal Husbandry and Veterinary Department||Directorate of Dairy Development
2022_APDCL_27951_1,CGM_UAR_TSK3,CGM_UAR_TSK3,Outsourcing of sub station,Services,Open Tender,Turn-key,Manpower Supply,No,No,NA ,29-Nov-2022 01:50 PM,NA ,365.0,No ,No,Online,05-Dec-2022 12:00 PM,Assam Power Distribution Company Ltd||CGM(D) Upper Assam Region - APDCL,Tinsukia,786125.0,2.0,,A.D. ENTERPRISE,,Not Admitted-Fee/PreQual/Technical,,AOC,Assam Power Distribution Company Ltd||CGM(D) Upper Assam Region - APDCL
2023_PWBNH_32294_1,CE/TB-VI/38/2023/3 Dated Guwahati 23rd Aug 2023,"Infrastructure Development at Shri Raghunath Mandir (Sastar) At Srijangram, Bongaigaon District(Construction of Boundary wall, drain, gate and earthfill /compound filling etc)","Infrastructure Development at Shri Raghunath Mandir (Sastar) At Srijangram, Bongaigaon District(Construction of Boundary wall, drain, gate and earthfill /compound filling etc)",Works,Open Tender,Item Rate,Civil Works - Building,No,No,NA ,29-Aug-2023 02:00 PM,NA ,180.0,No ,No,Online,28-Sep-2023 02:00 PM,Public Works Building and NH Department||Chief Engineer-Building - PWBNH,Bongaigaon,783380.0,2.0,"1,47,36,100",Pabitra Boro,"14,736,100",Rejected-AOC,19-Dec-2023,AOC,Public Works Building and NH Department||Chief Engineer-Building - PWBNH
2023_NHM_29959_1,NHM-32023/31/2023-CONST-NHM,"Construction of Buildingless Sub Health Centre in Galipathar SC in Dhemaji District under PM ABHIM for FY 2021-22 under NHM, Assam on Turnkey Basis","Construction of Buildingless Sub Health Centre in Galipathar SC in Dhemaji District under PM ABHIM for FY 2021-22 under NHM, Assam on Turnkey Basis",Works,Open Tender,Turn-key,Civil Works - Building,No,No,NA ,20-Mar-2023 09:00 AM,NA ,180.0,No ,No,Online,06-Apr-2023 03:30 PM,National Health Mission||State Programme Management Unit - NHM,DHEMAJI,787057.0,2.0,"52,03,000",BIKRAM SING PEGU,"4,499,333",Rejected-Technical,14-Dec-2023,AOC,National Health Mission||State Programme Management Unit - NHM
2023_HFWD_33846_1,MCH/HMS/2022/268/46,supply of reagents related to starting of new Biochemistry tests in the department of Biochemistry,supply of reagents related to starting of new Biochemistry tests in the department of Biochemistry,Goods,Open Tender,Item Wise,Lab Chemistry Reagents,No,No,NA ,10-Nov-2023 03:30 PM,14-Nov-2023 01:00 PM ,365.0,No ,No,Online,24-Nov-2023 04:00 PM,Health and Family Welfare Department||Directorate of Medical Education-HFWD||Guwahati Medical College Hospital-HFWD,GMCH Bhangagarh,781032.0,2.0,,Jyoti Pharmaceuticals,"165,609",Accepted-AOC,26-Dec-2023,AOC,Health and Family Welfare Department||Directorate of Medical Education-HFWD||Guwahati Medical College Hospital-HFWD
2023_PWD_34400_1,TB.198/DNTRD/ TRAFFIC/2023-24/1904-09,Traffic calming measure on NH/SH/MDR junctions in Dhakuakhana Territorial Road Division (Part-1) (112 Dhakuakhana LAC) for the year 2022-23.,Traffic calming measure on NH/SH/MDR junctions in Dhakuakhana Territorial Road Division (Part-1) (112 Dhakuakhana LAC) for the year 2022-23.,Works,Open Tender,Works,Civil Works – Roads,No,No,NA ,06-Dec-2023 10:00 AM,06-Dec-2023 12:00 PM ,90.0,No ,No,Online,18-Dec-2023 10:00 AM,Public Works Roads Department,Dhakuakhana,787055.0,2.0,"41,85,459",Bhabesh Saikia,"3,975,601.02",Rejected-AOC,30-Dec-2023,AOC,Public Works Roads Department
2023_ID_33576_1,JC (I)/Tech/E-Tender/2023/55,Solar Powered MDTWS at Kathalguri Central Development Block Area 2 points under RIDF-XXIX NABARD for the year 2023-24 Package-1,Solar Powered MDTWS at Kathalguri Central Development Block Area 2 points under RIDF-XXIX NABARD for the year 2023-24 Package-1,Works,Open Tender,Item Rate,Civil Works,No,No,NA ,07-Nov-2023 06:00 PM,NA ,180.0,No ,No,Online,04-Dec-2023 03:00 PM,Irrigation Department||Chief Engineer(Major)-Irrigation Dept||Jorhat Circle,bokakhat,785612.0,2.0,"74,54,197",Arnab Buragohain,"6,708,777.3",Accepted-AOC,15-Dec-2023,AOC,Irrigation Department||Chief Engineer(Major)-Irrigation Dept||Jorhat Circle
2023_PWD_31961_1,CE/NEC/NESIDS/QC/CUSB,CE/NEC/NESIDS/QC/CUSB,Third Party Quality Control and Monitoring for the work Improvement and widening of Road from Chaygaon to Ukium in the State of Assam under NESIDS,Works,Open Tender,Lump-sum,Civil Works,No,No,NA ,05-Aug-2023 05:00 PM,NA ,180.0,No ,No,Online,28-Aug-2023 02:30 PM,Public Works Roads Department,CHAYGAON,781003.0,2.0,,KAILASHNATH SONI,"8,250,000",Not Admitted-Fee/PreQual/Technical,13-Dec-2023,AOC,Public Works Roads Department
2023_BoTC_34000_1,No. TECH- 05/SE(B)/E-Tender,"Construction of Brick Drain Infront and North Side and R.C.C. Out let drain at South and West side of District Jail, Kokrajhar. PKg No.527-1","Construction of Brick Drain Infront and North Side and R.C.C. Out let drain at South and West side of District Jail, Kokrajhar. PKg No.527-1",Works,Open Tender,Item Rate,Civil Works - Building,No,No,NA ,17-Nov-2023 10:00 AM,NA ,180.0,No ,No,Online,04-Dec-2023 01:30 PM,Bodoland Territorial Council||PWD-BTC,Kokrajhar,783370.0,2.0,"62,98,908",DHARAMSING NARZARY,"6,298,853.78",Rejected-AOC,14-Dec-2023,AOC,Bodoland Territorial Council||PWD-BTC
2023_HFWD_32635_1,MCH/HMS/2023/306/16,"Supply of instruments in Urology O. T. under HMS, Gauhati Medical College Hospital, Guwahati","Supply of instruments in Urology O. T. under HMS, Gauhati Medical College Hospital, Guwahati",Goods,Open Tender,Item Wise,Supply of Materials,No,No,NA ,22-Sep-2023 05:00 PM,27-Sep-2023 01:00 PM ,365.0,No ,No,Online,12-Oct-2023 05:00 PM,Health and Family Welfare Department||Directorate of Medical Education-HFWD||Guwahati Medical College Hospital-HFWD,"GMCH, Bhagagarh, Guwahati",781032.0,2.0,,FAMA Marketing,"1,284,596",Accepted-AOC,26-Dec-2023,AOC,Health and Family Welfare Department||Directorate of Medical Education-HFWD||Guwahati Medical College Hospital-HFWD
2023_PWBNH_31611_1,CE/TB-IV/16/2023/2 Dated Guwahati 6th July 2023,Construction of 100 bedded Maternity Child Health wing with quarters at Dhubri Civil Hospital under National Health Mission for the year 2012-13 (Balance Work),Construction of 100 bedded Maternity Child Health wing with quarters at Dhubri Civil Hospital under National Health Mission for the year 2012-13 (Balance Work),Works,Open Tender,Item Rate,Civil Works - Building,No,No,NA ,11-Jul-2023 11:00 AM,20-Jul-2023 11:30 AM ,180.0,No ,No,Online,02-Aug-2023 02:00 PM,Public Works Building and NH Department||Chief Engineer-Building - PWBNH,Dhubri,783301.0,2.0,"12,39,30,832",JYOTSON CONSTRUCTION,"122,509,646",Accepted-AOC,06-Dec-2023,AOC,Public Works Building and NH Department||Chief Engineer-Building - PWBNH
2023_APDCL_32613_1,UAR/Majuli_Bridge/23_24/T_1,Construction of new 11 KV and LT composite line due to widening of road from No2 Gharphalia near NH-37 to Phukanorkhat (both sides of the road) connecting Majuli Bridge on the South Bank of the Brahmaputra River,Construction of new 11 KV and LT composite line due to widening of road from No2 Gharphalia near NH-37 to Phukanorkhat (both sides of the road) connecting Majuli Bridge on the South Bank of the Brahmaputra River against Deposit Work Scheme,Works,Open Tender,Turn-key,Electrical Works,No,No,NA ,21-Sep-2023 05:00 PM,26-Sep-2023 12:00 PM ,120.0,No ,No,Online,06-Oct-2023 02:00 PM,Assam Power Distribution Company Ltd||CGM(D) Upper Assam Region - APDCL,Majuli,785105.0,2.0,,M/S CHEROM TRADING COMPANY,"37,498,943.4",Rejected-Technical,22-Dec-2023,AOC,Assam Power Distribution Company Ltd||CGM(D) Upper Assam Region - APDCL
2023_NHM_29878_73,NHM-32031/4/2021-Const-NHM/Pt 34/69,Establishment of Proposed 6 bedded ward at various SHCs and PHCs of Assam under ECRP II NHM Assam Group 202 4 nos scheme in Sivasagar district,Establishment of Proposed 6 bedded ward at various SHCs and PHCs of Assam under ECRP II NHM Assam Group 202 4 nos scheme in Sivasagar district,Works,Open Tender,Turn-key,Civil Works - Building,No,No,NA ,16-Mar-2023 05:00 PM,NA ,180.0,No ,No,Online,01-Apr-2023 03:00 PM,National Health Mission||State Programme Management Unit - NHM,Sivasagar,785697.0,2.0,"46,39,828",BIKRAMJIT DUTTA,,Rejected-Technical,,AOC,National Health Mission||State Programme Management Unit - NHM
2023_GMDA_32997_1,GMDA/DEV/37/2023/21,Cleaning and de-siltation of Gauhati University Pond near Tikhor Park,Cleaning and de-siltation of Gauhati University Pond near Tikhor Park,Works,Open Tender,Item Rate,Civil Works,No,No,NA ,12-Oct-2023 02:00 PM,NA ,180.0,No ,No,Online,02-Nov-2023 03:00 PM,Guwahati Metropolitan Development Authority||Guwahati Development Department - GMDA,Jalukbari,781013.0,2.0,"55,63,502",Bhaba Kanta Nath,"19,800,000",Accepted-AOC,20-Dec-2023,AOC,Guwahati Metropolitan Development Authority||Guwahati Development Department - GMDA
2023_PWBNH_33232_1,"TW-1/SE/GBC/2021-22/336-A, Dt. 11-10-2023","Repairing and Renovation of ITI Building, Goalpara","Repairing and Renovation of ITI Building, Goalpara",Works,Open Tender,Works,Civil Works - Building,No,No,NA ,20-Oct-2023 06:00 PM,30-Oct-2023 12:00 PM ,180.0,No ,No,Online,13-Nov-2023 02:30 PM,Public Works Building and NH Department||Chief Engineer-Building - PWBNH||SE-Guwahati Circle-1 - PWBNH||EE- Goalpara Building Division - PWBNH,"Shastrinagar, Goalpara",783101.0,2.0,"26,73,191",Gautam Adhikary,"2,669,475",Accepted-AOC,07-Dec-2023,AOC,Public Works Building and NH Department||Chief Engineer-Building - PWBNH||SE-Guwahati Circle-1 - PWBNH||EE- Goalpara Building Division - PWBNH
2023_BoTC_30994_17,CHDI/ ET/2022-23/16,Construction of Headworks and other appurtenant structures at Keojhora F.I.S. under PMKSY-HKKP for the year 2021-22,Construction of Headworks and other appurtenant structures at Keojhora F.I.S. under PMKSY-HKKP for the year 2021-22,Works,Open Tender,Works,Civil Works,No,No,NA ,27-May-2023 06:55 PM,NA ,180.0,No ,No,Online,19-Jun-2023 02:00 PM,Bodoland Territorial Council||Irrigation-BTC,Under Kokrajhar Est Division,783370.0,2.0,"2,74,13,117",DHAJEN WARY,,Accepted-AOC,,AOC,Bodoland Territorial Council||Irrigation-BTC
