2024_ID_39149_35,01_RIDF_XXX_2024_25 Date_21_09_2024,MDTW scheme 3 pts. (Three Points) at Rangia LAC under RIDF-XXX (NABARD) for theyear 2024-25under Rangia-KamalpurDivision Package_35,MDTW scheme 3 pts. (Three Points) at Rangia LAC under RIDF-XXX (NABARD) for theyear 2024-25under Rangia-KamalpurDivision Package_35,Works,Open Tender,Item Rate,Civil Works,No,No,NA ,25-Sep-2024 06:00 PM,05-Oct-2024 02:00 PM ,180.0,No ,No,Online,19-Oct-2024 10:00 AM,Irrigation Department||Chief Engineer(Major)-Irrigation Dept,Rangia,781354.0,2.0,"1,06,42,896",PRASANTA KR DEKA,"3,175,134",Rejected-Technical,08-Mar-2025,Irrigation Department||Chief Engineer(Major)-Irrigation Dept
2024_ID_39149_42,01_RIDF_XXX_2024_25 Date_21_09_2024,Installation of Solar Shallow Tube Well scheme 4 Points at Karimganj South LAC under RIDF-XXX NABARD for the year 2024-25under Karimganj North-Karimganj South BadarpurDivision Package_42,Installation of Solar Shallow Tube Well scheme 4 Points at Karimganj South LAC under RIDF-XXX NABARD for the year 2024-25under Karimganj North-Karimganj South BadarpurDivision Package_42,Works,Open Tender,Item Rate,Civil Works,No,No,NA ,25-Sep-2024 06:00 PM,05-Oct-2024 02:00 PM ,180.0,No ,No,Online,19-Oct-2024 10:00 AM,Irrigation Department||Chief Engineer(Major)-Irrigation Dept,kariganj south,788710.0,2.0,"37,71,070",M/S CMC ASSOCIATES,"3,384,535",Rejected-Technical,10-Mar-2025,Irrigation Department||Chief Engineer(Major)-Irrigation Dept
2024_ID_39149_43,01_RIDF_XXX_2024_25 Date_21_09_2024,Installation of Solar Shallow Tube Well scheme 4 Points at Karimganj North LAC underRIDF-XXX NABARD for the year 2024-25 under Karimganj North-Karimganj South BadarpurDivision Package_43,Installation of Solar Shallow Tube Well scheme 4 Points at Karimganj North LAC underRIDF-XXX NABARD for the year 2024-25 under Karimganj North-Karimganj South BadarpurDivision Package_43,Works,Open Tender,Item Rate,Civil Works,No,No,NA ,25-Sep-2024 06:00 PM,05-Oct-2024 02:00 PM ,180.0,No ,No,Online,19-Oct-2024 10:00 AM,Irrigation Department||Chief Engineer(Major)-Irrigation Dept,kariganj north,788710.0,2.0,"37,71,070",M/S CMC ASSOCIATES,"3,384,535",Accepted-AOC,10-Mar-2025,Irrigation Department||Chief Engineer(Major)-Irrigation Dept
2024_ID_39149_44,01_RIDF_XXX_2024_25 Date_21_09_2024,Installation of Solar Shallow Tube Wells 8 Points in Patharkandi LAC under Ratabari- Patharkandi Division under RIDF-XXX NABARD for the year 2024-25under Ratabari-PatharkandiDivision Package_44,Installation of Solar Shallow Tube Wells 8 Points in Patharkandi LAC under Ratabari- Patharkandi Division under RIDF-XXX NABARD for the year 2024-25under Ratabari-PatharkandiDivision Package_44,Works,Open Tender,Item Rate,Civil Works,No,No,NA ,25-Sep-2024 06:00 PM,05-Oct-2024 02:00 PM ,180.0,No ,No,Online,19-Oct-2024 10:00 AM,Irrigation Department||Chief Engineer(Major)-Irrigation Dept,Patjarkandi,788710.0,2.0,"75,42,140",TAPAS BANIK,"6,787,926",Rejected-Technical,12-Mar-2025,Irrigation Department||Chief Engineer(Major)-Irrigation Dept
2024_ID_39149_45,01_RIDF_XXX_2024_25 Date_21_09_2024,"Installation of Solar Shallow Tube Wells (4 Points) in Ratabari LAC under Ratabari- Patharkandi Division, Irrigation underRIDF-XXX (NABARD) for the year 2024-25under Ratabari-PatharkandiDivision Package_45","Installation of Solar Shallow Tube Wells (4 Points) in Ratabari LAC under Ratabari- Patharkandi Division, Irrigation underRIDF-XXX (NABARD) for the year 2024-25under Ratabari-PatharkandiDivision Package_45",Works,Open Tender,Item Rate,Civil Works,No,No,NA ,25-Sep-2024 06:00 PM,05-Oct-2024 02:00 PM ,180.0,No ,No,Online,19-Oct-2024 10:00 AM,Irrigation Department||Chief Engineer(Major)-Irrigation Dept,Ratabari,788735.0,2.0,"37,71,070",RAMABATI SINHA,"3,393,963",Rejected-Technical,12-Mar-2025,Irrigation Department||Chief Engineer(Major)-Irrigation Dept
2024_ID_39149_47,01_RIDF_XXX_2024_25 Date_21_09_2024,Solar Powered MDTWS 3 Points at Gossaigaon LAC under RIDF-XXX NABARD for the year 2024-25under Gossaigaon-Kokrajhar West Division Package_47,Solar Powered MDTWS 3 Points at Gossaigaon LAC under RIDF-XXX NABARD for the year 2024-25under Gossaigaon-Kokrajhar West Division Package_47,Works,Open Tender,Item Rate,Civil Works,No,No,NA ,25-Sep-2024 06:00 PM,05-Oct-2024 02:00 PM ,180.0,No ,No,Online,19-Oct-2024 10:00 AM,Irrigation Department||Chief Engineer(Major)-Irrigation Dept,Gossaigaon,783360.0,2.0,"1,06,42,796",M/S ALOK FUTURISTIC GROUP,"6,184,075",Rejected-Technical,20-Mar-2025,Irrigation Department||Chief Engineer(Major)-Irrigation Dept
2024_ID_39149_54,01_RIDF_XXX_2024_25 Date_21_09_2024,Construction of 3 nos Solar Powered MDTW scheme at Thanpatkuchi Village Green Valley Society at Dhantola Village Dihjari Village under RIDF XXX NABARD for the year 2024_25 under Dharmapur Barkhetri Nalbari Division Package_54,Construction of 3 nos Solar Powered MDTW scheme at Thanpatkuchi Village Green Valley Society at Dhantola Village Dihjari Village under RIDF XXX NABARD for the year 2024_25 under Dharmapur Barkhetri Nalbari Division Package_54,Works,Open Tender,Item Rate,Civil Works,No,No,NA ,26-Sep-2024 06:00 PM,05-Oct-2024 02:00 PM ,180.0,No ,No,Online,19-Oct-2024 10:00 AM,Irrigation Department||Chief Engineer(Major)-Irrigation Dept,Nalbari,781335.0,2.0,"1,06,42,796",ABM AND JV,"3,095,066",Rejected-Finance,08-Mar-2025,Irrigation Department||Chief Engineer(Major)-Irrigation Dept
2024_ID_39149_57,01_RIDF_XXX_2024_25 Date_21_09_2024,Solar Shallow Tube Well Scheme 5 No. Points at Naduar Block in Sootea LAC under RIDF-XXX NABARD for the year 2024-25under SooteaDivision Package_57,Solar Shallow Tube Well Scheme 5 No. Points at Naduar Block in Sootea LAC under RIDF-XXX NABARD for the year 2024-25under Sootea Division Package_57,Works,Open Tender,Item Rate,Civil Works,No,No,NA ,26-Sep-2024 06:00 PM,05-Oct-2024 02:00 PM ,180.0,No ,No,Online,19-Oct-2024 10:00 AM,Irrigation Department||Chief Engineer(Major)-Irrigation Dept,Sootea,784175.0,2.0,"42,42,413",MADHURJYA BORAH,"4,239,277",Accepted-AOC,20-Mar-2025,Irrigation Department||Chief Engineer(Major)-Irrigation Dept
2024_ID_39149_58,01_RIDF_XXX_2024_25 Date_21_09_2024,Solar Powered MDTW IS at NatunSirajuli 3 Nos. Point) under IDF-XXX NABARD for the year 2024_25 under Dhekiajuli-Barchalla Division Package_58,Solar Powered MDTW IS at NatunSirajuli 3 Nos. Point) under IDF-XXX NABARD for the year 2024_25 under Dhekiajuli-Barchalla Division Package_58,Works,Open Tender,Item Rate,Civil Works,No,No,NA ,26-Sep-2024 06:00 PM,05-Oct-2024 02:00 PM ,180.0,No ,No,Online,19-Oct-2024 10:00 AM,Irrigation Department||Chief Engineer(Major)-Irrigation Dept,Sonitpur,782123.0,2.0,"1,06,42,796",M/S R R ENTERPRISE,"10,640,000",Rejected-Finance,20-Mar-2025,Irrigation Department||Chief Engineer(Major)-Irrigation Dept
2024_ID_39149_59,01_RIDF_XXX_2024_25 Date_21_09_2024,Solar Powered MDTW IS at Mizibari 3 Nos. Point under RIDF-XXX NABARD for the year 2024-25under Dhekiajuli-BarchallaDivision Package_59,Solar Powered MDTW IS at Mizibari 3 Nos. Point under RIDF-XXX NABARD for the year 2024-25under Dhekiajuli-BarchallaDivision Package_59,Works,Open Tender,Item Rate,Civil Works,No,No,NA ,26-Sep-2024 06:00 PM,05-Oct-2024 02:00 PM ,180.0,No ,No,Online,19-Oct-2024 10:00 AM,Irrigation Department||Chief Engineer(Major)-Irrigation Dept,Sonitpur,782123.0,2.0,"1,06,42,796",M/S CMC ASSOCIATES,"10,483,151",Rejected-Technical,13-Mar-2025,Irrigation Department||Chief Engineer(Major)-Irrigation Dept
2024_ID_39149_60,01_RIDF_XXX_2024_25 Date_21_09_2024,Solar Powered MDTW Irrigation Scheme under Bihaguri Development Block 3 Points under RIDF-XXX NABARD for the year 2024-25under Dhekiajuli-BarchallaDivision Package_60,Solar Powered MDTW Irrigation Scheme under Bihaguri Development Block 3 Points under RIDF-XXX NABARD for the year 2024-25under Dhekiajuli-BarchallaDivision Package_60,Works,Open Tender,Item Rate,Civil Works,No,No,NA ,26-Sep-2024 06:00 PM,05-Oct-2024 02:00 PM ,180.0,No ,No,Online,19-Oct-2024 10:00 AM,Irrigation Department||Chief Engineer(Major)-Irrigation Dept,Sonitpur,782123.0,2.0,"1,06,42,796",Khaneswar Boro,"9,578,516",Rejected-Technical,13-Mar-2025,Irrigation Department||Chief Engineer(Major)-Irrigation Dept
2024_ID_39149_61,01_RIDF_XXX_2024_25 Date_21_09_2024,Solar powered MDTW schem 2 Points at Naduar Block in Sootea LAC under RIDF-XXX (NABARD) for the year 2024-25 under Sootea Division Package_61,Solar powered MDTW schem 2 Points at Naduar Block in Sootea LAC under RIDF-XXX (NABARD) for the year 2024-25 under Sootea Division Package_61,Works,Open Tender,Item Rate,Civil Works,No,No,NA ,26-Sep-2024 06:00 PM,05-Oct-2024 02:00 PM ,180.0,No ,No,Online,19-Oct-2024 10:00 AM,Irrigation Department||Chief Engineer(Major)-Irrigation Dept,Sonitpur,782123.0,2.0,"70,95,193",MADHURJYA BORAH,"7,095,192.83",Accepted-AOC,13-Mar-2025,Irrigation Department||Chief Engineer(Major)-Irrigation Dept
2024_ID_39149_63,01_RIDF_XXX_2024_25 Date_21_09_2024,Solar Powered MDTW I/S at Doomdooma (3 nos. Points) under RIDF-XXX (NABARD) for the year 2024-25under Dhekiajuli-BarchallaDivision Package_63,Solar Powered MDTW I/S at Doomdooma (3 nos. Points) under RIDF-XXX (NABARD) for the year 2024-25under Dhekiajuli-BarchallaDivision Package_63,Works,Open Tender,Item Rate,Civil Works,No,No,NA ,26-Sep-2024 06:00 PM,05-Oct-2024 02:00 PM ,180.0,No ,No,Online,19-Oct-2024 10:00 AM,Irrigation Department||Chief Engineer(Major)-Irrigation Dept,Sonitpur,782123.0,2.0,"1,06,42,796",DHARMESWAR GAYARI,"10,642,795",Rejected-Technical,13-Mar-2025,Irrigation Department||Chief Engineer(Major)-Irrigation Dept
2024_ID_39149_64,01_RIDF_XXX_2024_25 Date_21_09_2024,Solar Powered MDTW 3 Pts in Tezpur LAC under RIDF-XXX NABARD for the year 2024-25under Tezpur-Rangapara Division Package_64,Solar Powered MDTW 3 Pts in Tezpur LAC under RIDF-XXX NABARD for the year 2024-25under Tezpur-Rangapara Division Package_64,Works,Open Tender,Item Rate,Civil Works,No,No,NA ,26-Sep-2024 06:00 PM,05-Oct-2024 02:00 PM ,180.0,No ,No,Online,19-Oct-2024 10:00 AM,Irrigation Department||Chief Engineer(Major)-Irrigation Dept,Sonitpur,782123.0,2.0,"1,06,42,796",TRIDIP KALITA,"6,385,673",Accepted-AOC,13-Mar-2025,Irrigation Department||Chief Engineer(Major)-Irrigation Dept
2024_ID_39149_65,01_RIDF_XXX_2024_25 Date_21_09_2024,Installation of Solar Powered MDTW Sheme 3 Points at Balipara Development Block under Rangapara LAC under RIDF-XXX NABARD for the year 2024-25under Tezpur-RangaparaDivision Package_65,Installation of Solar Powered MDTW Sheme 3 Points at Balipara Development Block under Rangapara LAC under RIDF-XXX NABARD for the year 2024-25under Tezpur-RangaparaDivision Package_65,Works,Open Tender,Item Rate,Civil Works,No,No,NA ,26-Sep-2024 06:00 PM,05-Oct-2024 02:00 PM ,180.0,No ,No,Online,19-Oct-2024 10:00 AM,Irrigation Department||Chief Engineer(Major)-Irrigation Dept,Sonitpur,782123.0,2.0,"1,06,42,796",M/S R R ENTERPRISE,"9,578,516",Rejected-Finance,13-Mar-2025,Irrigation Department||Chief Engineer(Major)-Irrigation Dept
2024_ID_39149_67,01_RIDF_XXX_2024_25 Date_21_09_2024,Construction of Solar Powered MDTWS 2 Points under RIDF-XXX NABARD for the year 2024-25under Tamulpur Division Package_67,Construction of Solar Powered MDTWS 2 Points under RIDF-XXX NABARD for the year 2024-25under Tamulpur Division Package_67,Works,Open Tender,Item Rate,Civil Works,No,No,NA ,26-Sep-2024 06:00 PM,05-Oct-2024 02:00 PM ,180.0,No ,No,Online,19-Oct-2024 10:00 AM,Irrigation Department||Chief Engineer(Major)-Irrigation Dept,Tamulpur,781367.0,2.0,"70,95,193",M/S SN ENTERPRISE,"3,081,797",Rejected-Finance,11-Mar-2025,Irrigation Department||Chief Engineer(Major)-Irrigation Dept
2024_ID_39149_68,01_RIDF_XXX_2024_25 Date_21_09_2024,"MDTW Solar powered Scheme at BadlabhetaKakojan GP (1 Point), Bishnupur Gabharubheti GP (1 Point) DhounkundaRongajan GP (1 Point) under RIDF-XXX (NABARD) for the year 2024-25under Sadiya-DoomdoomaDivision Package_68","MDTW Solar powered Scheme at BadlabhetaKakojan GP (1 Point), Bishnupur Gabharubheti GP (1 Point) DhounkundaRongajan GP (1 Point) under RIDF-XXX (NABARD) for the year 2024-25under Sadiya-DoomdoomaDivision Package_68",Works,Open Tender,Item Rate,Civil Works,No,No,NA ,26-Sep-2024 06:00 PM,05-Oct-2024 02:00 PM ,180.0,No ,No,Online,19-Oct-2024 10:00 AM,Irrigation Department||Chief Engineer(Major)-Irrigation Dept,Tinsukia,786125.0,2.0,"1,06,42,796",DNA INFRASTRUCTURE,"9,310,187",Accepted-AOC,20-Mar-2025,Irrigation Department||Chief Engineer(Major)-Irrigation Dept
2024_ID_39149_9,01_RIDF_XXX_2024_25 Date_21_09_2024,Installation of Solar Powered 4 No. STW scheme at Silchar LAC under RIDF-XXX NABARD for the year 2024-25under Silchar-Udharbond Division Package_9,Installation of Solar Powered 4 No. STW scheme at Silchar LAC under RIDF-XXX NABARD for the year 2024-25under Silchar-Udharbond Division Package_9,Works,Open Tender,Item Rate,Civil Works,No,No,NA ,25-Sep-2024 06:00 PM,05-Oct-2024 02:00 PM ,180.0,No ,No,Online,19-Oct-2024 10:00 AM,Irrigation Department||Chief Engineer(Major)-Irrigation Dept,Silchar,788001.0,2.0,"37,71,070",K. K. ENTERPRISE,"3,393,963",Accepted-AOC,05-Mar-2025,Irrigation Department||Chief Engineer(Major)-Irrigation Dept
2024_ID_41442_1,NIT No.09/LCI/NL/SOPD-G/2024-25 dt. 17/12/2024,"Arkep Bali Solar MDTWS under SOPD-G for the year 2024-25 under Dhakuakhana Division (Irrigation),Dhakuakhana","Arkep Bali Solar MDTWS under SOPD-G for the year 2024-25 under Dhakuakhana Division (Irrigation),Dhakuakhana",Works,Open Tender,Item Rate,Miscellaneous Works,No,No,NA ,21-Dec-2024 11:00 AM,NA ,180.0,No ,No,Online,10-Jan-2025 03:00 PM,Irrigation Department||Chief Engineer(Major)-Irrigation Dept||Lakhimpur Circle,Dhakuakhana,787055.0,2.0,"35,47,539",RAJ KUMAR JAIN,"3,192,785",Rejected-AOC,06-Mar-2025,Irrigation Department||Chief Engineer(Major)-Irrigation Dept||Lakhimpur Circle
2024_ID_41442_2,NIT No.09/LCI/NL/SOPD-G/2024-25 dt. 17/12/2024,Installation of Solar Shallow Tube Well Scheme under Dhakuakhana LAC in Lakhimpur District under SOPD-G for the year 2024-25(5 Points),Installation of Solar Shallow Tube Well Scheme under Dhakuakhana LAC in Lakhimpur District under SOPD-G for the year 2024-25(5 Points),Works,Open Tender,Item Rate,Miscellaneous Works,No,No,NA ,21-Dec-2024 11:00 AM,NA ,180.0,No ,No,Online,10-Jan-2025 03:00 PM,Irrigation Department||Chief Engineer(Major)-Irrigation Dept||Lakhimpur Circle,DhakuaKhana,787055.0,2.0,"42,42,406",T J Biswajit Mahengia,"1,527,266.3",Accepted-AOC,11-Mar-2025,Irrigation Department||Chief Engineer(Major)-Irrigation Dept||Lakhimpur Circle
2024_ID_41556_1,S-JDI/T/32/2024/1594 Dtd. 21.12.2024,Installation of Solar Powered STW Scheme (Five Points) at 40-Sorbhog LAC under SOPD-G for the year 2024-25,Installation of Solar Powered STW Scheme (Five Points) at 40-Sorbhog LAC under SOPD-G for the year 2024-25,Works,Open Tender,Item Rate,Civil Works,No,No,N/A ,23-Dec-2024 10:00 AM,08-Jan-2025 02:00 PM ,180.0,No ,No,Online,13-Jan-2025 03:00 PM,Irrigation Department||Chief Engineer(Major)-Irrigation Dept||Barpeta Circle||Sorbhog Jania Division,"Ketekibari, Barharid, Meda, Balapet, Sataradoha",781317.0,2.0,"42,42,496",SADANANDA TALUKDAR,"1,696,998",Accepted-AOC,18-Mar-2025,Irrigation Department||Chief Engineer(Major)-Irrigation Dept||Barpeta Circle||Sorbhog Jania Division
2024_ID_41692_1,BANDI/TQ-3/Pt-VI/2024/1876 dtd 24/12,Installation of Solar Shallow Tube Well Schemes Under 18 No. Bongaigaon Lac In Bogaigaon District Under Sopd-G (5 Point) For The Year 24-25,Installation of Solar Shallow Tube Well Schemes Under 18 No. Bongaigaon Lac In Bogaigaon District Under Sopd-G (5 Point) For The Year 2024-25 Under Bongaigaon- Abhayapuri North Division,Works,Open Tender,Item Rate,Construction Works,No,No,NA ,26-Dec-2024 04:00 PM,NA ,180.0,No ,No,Online,17-Jan-2025 03:00 PM,Irrigation Department||Chief Engineer(Major)-Irrigation Dept||Dhrubri Circle||Bangaigaon Abhayapuri North Division,Bangaigaon,783380.0,2.0,"42,42,412",SHRI DHANESH MEDHI,"3,818,170.8",Rejected-Technical,06-Mar-2025,Irrigation Department||Chief Engineer(Major)-Irrigation Dept||Dhrubri Circle||Bangaigaon Abhayapuri North Division
2024_ID_41713_1,HJDI(T)/118/2022/23 dated 26/12/2024,SOLAR POWERED MDTWS (1 POINT) AT JALUKBARI LAC UNDER SOPD-G FOR THE YEAR 2024-25,SOLAR POWERED MDTWS (1 POINT) AT JALUKBARI LAC UNDER SOPD-G FOR THE YEAR 2024-25,Works,Open Tender,Item Rate,Civil Works,No,No,NA ,26-Dec-2024 05:40 PM,NA ,180.0,No ,No,Online,17-Jan-2025 04:00 PM,Irrigation Department||Chief Engineer(Minor Irrigation)-Irrigation Dept||Kamrup Circle||Hajo Jalukbari Division,JALUKBARI,781031.0,2.0,"35,46,843",Nripen Ch Deka,"3,192,159",Rejected-AOC,12-Mar-2025,Irrigation Department||Chief Engineer(Minor Irrigation)-Irrigation Dept||Kamrup Circle||Hajo Jalukbari Division
2024_ID_41740_1,NIT/TCI/2/2023/2498,Installation of 2 pts MDTW scheme under Gohpur LAC under SCSP for the year 2024-25,Installation of 2 pts MDTW scheme under Gohpur LAC under SCSP for the year 2024-25,Works,Open Tender,Percentage,Civil Works,No,No,NA ,28-Dec-2024 10:00 AM,NA ,180.0,No ,No,Online,17-Jan-2025 03:00 PM,Irrigation Department||Chief Engineer(Major)-Irrigation Dept||Tezpur Circle,Gohpur,784168.0,2.0,"71,66,000",Khandelwal Construction,"7,099,890",Accepted-AOC,07-Mar-2025,Irrigation Department||Chief Engineer(Major)-Irrigation Dept||Tezpur Circle
2024_ID_41770_1,NIT No.10 LCI/NL/SOPD-G/2024-25 dt. 27/12/2024,"Installation of 2 Points MDTW Scheme at Jiyadhal Area under SOPD-G for the year 2024-25 under Dhemaji Jonai Division (Irrigation), Dhemaji.","Installation of 2 Points MDTW Scheme at Jiyadhal Area under SOPD-G for the year 2024-25 under Dhemaji Jonai Division (Irrigation), Dhemaji.",Works,Open Tender,Item Rate,Miscellaneous Works,No,No,NA ,01-Jan-2025 11:00 AM,NA ,180.0,No ,No,Online,21-Jan-2025 03:00 PM,Irrigation Department||Chief Engineer(Major)-Irrigation Dept||Lakhimpur Circle,"Jiyadhal,dhemaji",787057.0,2.0,"70,95,078",Bubul Gogoi,"6,385,570.12",Accepted-AOC,11-Mar-2025,Irrigation Department||Chief Engineer(Major)-Irrigation Dept||Lakhimpur Circle
2024_ID_41787_1,TC(I)/A-11/03/2024-25,Installation of 2 pts MDTW Scheme at Seuji Pam And Kakopathar Nav Nirman Bahumukhi Samabay Samity under SOPD-G For the year 2024-25,Installation and commissioning of 2 Solar MDTW I/S,Works,Open Tender,Item Rate,Civil Works,No,No,NA ,31-Dec-2024 02:00 PM,NA ,180.0,No ,No,Online,21-Jan-2025 02:00 PM,Irrigation Department||Chief Engineer(Major)-Irrigation Dept||Tinsukia Circle,Saikhowa,786154.0,2.0,"70,94,970",Rajen Singha,"3,547,485",Accepted-AOC,20-Feb-2025,Irrigation Department||Chief Engineer(Major)-Irrigation Dept||Tinsukia Circle
2024_IWT_36215_1,FC/222/Pt-XVII/22-24/1420-31,LEASING OUT OF IWT FERRY SERVICES AT DHING SINGRI UNDER IWT GUWAHATI DIVISION,LEASING OUT OF IWT FERRY SERVICES AT DHING SINGRI UNDER IWT GUWAHATI DIVISION,Services,Open Tender,Item Wise,Miscellaneous Services,No,No,NA ,13-Feb-2024 01:00 PM,NA ,180.0,No ,No,Online,29-Feb-2024 03:00 PM,Inland Water Transport||I.W.T. Division Guwahati,Guwahati,781007.0,2.0,"6,23,700",SUKLESWAR BORO,"716,000",Rejected-Finance,28-Mar-2025,Inland Water Transport||I.W.T. Division Guwahati
2024_IWT_36215_15,FC/222/Pt-XVII/22-24/1420-31,LEASING OUT OF IWT FERRY SERVICES AT SONTOLI-BOHARI-ALIKASH UNDER IWT GUWAHATI DIVISION,LEASING OUT OF IWT FERRY SERVICES AT SONTOLI-BOHARI-ALIKASH UNDER IWT GUWAHATI DIVISION,Services,Open Tender,Item Wise,Miscellaneous Services,No,No,NA ,13-Feb-2024 06:00 PM,NA ,180.0,No ,No,Online,29-Feb-2024 03:00 PM,Inland Water Transport||I.W.T. Division Guwahati,Guwahati,781007.0,2.0,"14,90,000",MD ABDUL KUDDUSH,"5,310,000",Rejected-Finance,07-Mar-2025,Inland Water Transport||I.W.T. Division Guwahati
2024_IWT_36263_4,FC / 222/ Pt- XVII / 22-24 / 1432-43,LEASING OUT OF IWT FERRY SERVICES AT HOUHUA -SOMBARIA-BHOGDIA-DIRECTORY UNDER IWT GUWAHATI DIVISION,LEASING OUT OF IWT FERRY SERVICES AT HOUHUA -SOMBARIA-BHOGDIA-DIRECTORY UNDER IWT GUWAHATI DIVISION,Services,Open Tender,Item Wise,Miscellaneous Services,No,No,NA ,14-Feb-2024 06:00 PM,NA ,180.0,No ,No,Online,01-Mar-2024 03:00 PM,Inland Water Transport||I.W.T. Division Guwahati,Guwahati,781007.0,2.0,"5,45,750",TAPAN DAS,"2,957,999",Rejected-Finance,17-Feb-2025,Inland Water Transport||I.W.T. Division Guwahati
2024_IWT_38959_13,SWT / Misc-39 / Pt-XVIII / 2024-25 / 3158-3171,Leasing out of IWT ferry service at Lalacherra under IWT Silchar Division,Leasing out of IWT ferry service at Lalacherra under IWT Silchar Division,Services,Open Tender,Item Wise,Miscellaneous Services,No,No,NA ,17-Sep-2024 10:00 AM,NA ,180.0,No ,No,Online,03-Oct-2024 03:00 PM,Inland Water Transport||I.W.T. Division Silchar,Silchar,788003.0,2.0,"9,00,000",SIRAJ UDDIN CHOUDHURY,"1,126,552",Rejected-Technical,19-Mar-2025,Inland Water Transport||I.W.T. Division Silchar
2024_NHM_38329_1,NHM-32049/2/2024-CONS,"Construction of BPHU at Behali BPHC , Helem SHC and Sootea MPHC (CHC under construction) in Biswanath District under PM ABHIM for the FY 2025-26 under NHM, Assam on Turnkey Basis","Construction of BPHU at Behali BPHC , Helem SHC and Sootea MPHC (CHC under construction) in Biswanath District under PM ABHIM for the FY 2025-26 under NHM, Assam on Turnkey Basis Group no-4 (3 nos. of Scheme in Biswanath District)",Works,Open Tender,Turn-key,Civil Works - Building,No,No,NA ,03-Aug-2024 06:00 PM,NA ,180.0,No ,No,Online,20-Aug-2024 03:30 PM,National Health Mission||State Programme Management Unit - NHM,Biswanath,781005.0,2.0,"1,50,00,000",M/S. FH Construction,"12,301,500",Rejected-Finance,19-Mar-2025,National Health Mission||State Programme Management Unit - NHM
2024_NHM_38329_13,NHM-32049/2/2024-CONS,"Construction of BPHU at Gaurisagar BPHC in Sivsagar District under PM ABHIM for the FY 2025-26 under NHM, Assam on Turnkey Basis Group no-19 (1 nos. of Scheme in Sivsagar District)","Construction of BPHU at Gaurisagar BPHC in Sivsagar District under PM ABHIM for the FY 2025-26 under NHM, Assam on Turnkey Basis Group no-19 (1 nos. of Scheme in Sivsagar District)",Works,Open Tender,Turn-key,Civil Works - Building,No,No,NA ,05-Aug-2024 06:00 PM,NA ,180.0,No ,No,Online,20-Aug-2024 03:30 PM,National Health Mission||State Programme Management Unit - NHM,Sivasagar,781005.0,2.0,"50,00,000",M/S MADHURJYA DUTTA,"4,150,000",Rejected-Technical,25-Mar-2025,National Health Mission||State Programme Management Unit - NHM
2024_NHM_38329_17,NHM-32049/2/2024-CONS,"Construction of BPHU at Dhing BPHC and Dagaon BPHC in Nagaon District under PM ABHIM for the FY 2025-26 under NHM, Assam on Turnkey Basis Group no-17 (2 nos. of Scheme in Nagaon District)","Construction of BPHU at Dhing BPHC and Dagaon BPHC in Nagaon District under PM ABHIM for the FY 2025-26 under NHM, Assam on Turnkey Basis Group no-17 (2 nos. of Scheme in Nagaon District)",Works,Open Tender,Turn-key,Civil Works - Building,No,No,NA ,07-Aug-2024 06:00 PM,NA ,180.0,No ,No,Online,20-Aug-2024 03:30 PM,National Health Mission||State Programme Management Unit - NHM,Nagaon,782001.0,2.0,"1,00,00,000",Ajijul Haque,"9,230,000",Rejected-Technical,29-Mar-2025,National Health Mission||State Programme Management Unit - NHM
2024_NHM_38329_18,NHM-32049/2/2024-CONS,"Construction of BPHU at Kakojan BPHC and Titabor BPHC/SDCH in Jorhat District under PM ABHIM for the FY 2025-26 under NHM, Assam on Turnkey Basis Group no-9 (2 nos. of Scheme in Jorhat District)","Construction of BPHU at Kakojan BPHC and Titabor BPHC/SDCH in Jorhat District under PM ABHIM for the FY 2025-26 under NHM, Assam on Turnkey Basis Group no-9 (2 nos. of Scheme in Jorhat District)",Works,Open Tender,Turn-key,Civil Works - Building,No,No,NA ,07-Aug-2024 06:55 PM,NA ,180.0,No ,No,Online,20-Aug-2024 03:30 PM,National Health Mission||State Programme Management Unit - NHM,Jorhat,785001.0,2.0,"1,00,00,000",M/S. FH Construction,"8,100,000",Rejected-AOC,29-Mar-2025,National Health Mission||State Programme Management Unit - NHM
2024_NHM_38329_4,NHM-32049/2/2024-CONS,"Construction of BPHU at Rupshi MPHC in Kokrajhar District under PM ABHIM for the FY 2025-26 under NHM, Assam on Turnkey Basis Group no-16 (1 nos. of Scheme in Kokrajhar District)","Construction of BPHU at Rupshi MPHC in Kokrajhar District under PM ABHIM for the FY 2025-26 under NHM, Assam on Turnkey Basis Group no-16 (1 nos. of Scheme in Kokrajhar District)",Works,Open Tender,Turn-key,Civil Works - Building,No,No,NA ,03-Aug-2024 06:00 PM,NA ,180.0,No ,No,Online,20-Aug-2024 03:30 PM,National Health Mission||State Programme Management Unit - NHM,Kokrajhar,781005.0,2.0,"50,00,000",MANOJ KUMAR MAZUMDER,"4,378,500",Rejected-Finance,28-Mar-2025,National Health Mission||State Programme Management Unit - NHM
2024_NHM_38329_9,NHM-32049/2/2024-CONS,"Construction of BPHU at Bazaricherra SHC and Girishganj MG Model Hospital in Karimganj District under PM ABHIM for the FY 2025-26 under NHM, Assam on Turnkey Basis Group no-8 (2 nos. of Scheme in Karimganj District)","Construction of BPHU at Bazaricherra SHC and Girishganj MG Model Hospital in Karimganj District under PM ABHIM for the FY 2025-26 under NHM, Assam on Turnkey Basis Group no-8 (2 nos. of Scheme in Karimganj District)",Works,Open Tender,Turn-key,Civil Works - Building,No,No,NA ,05-Aug-2024 06:00 PM,NA ,180.0,No ,No,Online,20-Aug-2024 03:30 PM,National Health Mission||State Programme Management Unit - NHM,Karimganj,781005.0,2.0,"1,00,00,000",M/S. EASTERN CONSTRUCTION COMPANY,"8,950,000",Not Admitted-Fee/PreQual/Technical,18-Mar-2025,National Health Mission||State Programme Management Unit - NHM
