2025_ID_46522_1,EE/BBD(I)BC/NIT 2/2025 26/281 Dtd 14/08/25,Renovation of New Ghiladhari ELIS under SOPD-G for the year 2025-26,Renovation of New Ghiladhari ELIS under SOPD-G for the year 2025-26,Works,Open Tender,Works,Civil Works,No,No,N/A ,14-Aug-2025 06:00 PM,NA ,180.0,No ,No,Online,04-Sep-2025 03:00 PM,Irrigation Department||Chief Engineer(Major)-Irrigation Dept||Tezpur Circle||Biswanath Behali Division,4 No Sootea,784175.0,2.0,"25,00,000",PRAKASH POUDEL,"2,470,050",Rejected-Technical,27-Oct-2025,Irrigation Department||Chief Engineer(Major)-Irrigation Dept||Tezpur Circle||Biswanath Behali Division
2025_ID_47018_1,SEI/T-27/ET-1/2025-26/634,Installation of 2 nos of MDTW Schemes at Kaliabor LAC under SOPD_G for the year 2025_26,Construction of underground PVC distribution system spout chamber boundary Fencing sign board Boring installation of TW Installation and commissioning Solar PV Module including mounting structures Construction of Control room,Works,Open Tender,Item Rate,Civil Works - Others,No,No,NA ,27-Aug-2025 04:00 PM,NA ,180.0,No ,No,Online,18-Sep-2025 03:00 PM,Irrigation Department||Chief Engineer(Major)-Irrigation Dept||Nagaon Circle,kaliabor,782136.0,2.0,"58,08,101",Kamal Uddin,"2,904,050",Accepted-AOC,15-Oct-2025,Irrigation Department||Chief Engineer(Major)-Irrigation Dept||Nagaon Circle
2025_ID_47113_1,Innovative Scheme at Dimoru FIS (Check Dam) under HojaiLumdingBinnakandi Division (Irrigation) 2025-,INNOVATIVE SCHEME AT DIMORU FIS UNDER HOJAI LUMDING BINNAKANDI DIVISION (IRRIGATION) HOJAI 2025-26.,"FABRICATION, supply AND INSTALLATION OF SOLAR POWERED CART MMOUNTED MULTIFUNCTIONALI/S (INNOVATIVE SCHEME) AT DIMORU FIS (CHECK DAM) UNDER HOJAI LUMDING BINNAKANDI DIVISION (IRRIGATION), HOJAI FOR THE YEAR 2025-26",Works,Open Tender,Works,Civil Works,No,No,NA ,29-Aug-2025 06:00 PM,NA ,180.0,No ,No,Online,22-Sep-2025 01:00 PM,Irrigation Department||Chief Engineer(Major)-Irrigation Dept||Hojai Circle||Jamunamukh-Hojai-Lumding Division,HOJAI,782435.0,1.0,"29,70,372",Mampi Nath,"1,782,222.834",Rejected-Finance,29-Oct-2025,Irrigation Department||Chief Engineer(Major)-Irrigation Dept||Hojai Circle||Jamunamukh-Hojai-Lumding Division
2025_ID_47162_1,SEI/T-27/ET-2/2025-26/660,Installation of 2 nos of MDTW Schemes at Samaguri LAC under SOPD_G for the year 2025_26,Construction of underground PVC distribution system spout chamber boundary Fencing sign board Boring and installation of TW Installation and commissioning Solar PV Module including mounting structures Construction of Control room,Works,Open Tender,Item Rate,Civil Works - Others,No,No,NA ,02-Sep-2025 10:00 AM,NA ,180.0,No ,No,Online,22-Sep-2025 03:00 PM,Irrigation Department||Chief Engineer(Major)-Irrigation Dept||Nagaon Circle,Samaguri,782140.0,2.0,"58,08,101",KUNTAL BARUAH,"2,816,929",Rejected-Technical,15-Oct-2025,Irrigation Department||Chief Engineer(Major)-Irrigation Dept||Nagaon Circle
2025_ID_47176_1,NIT 27/2025-26,MDTW Solar Irrigation Scheme at Telpani Bongaon and Panch Suti Borbali Gaon under Duliajan LAC (4 Points) under SOPD-G for the year 2025-26,MDTW Solar Irrigation Scheme at Telpani Bongaon and Panch Suti Borbali Gaon under Duliajan LAC (4 Points) under SOPD-G for the year 2025-26,Works,Open Tender,Item Rate,Civil Works,No,No,NA ,02-Sep-2025 10:00 AM,NA ,180.0,No ,No,Online,23-Sep-2025 02:30 PM,Irrigation Department||Chief Engineer(Minor Irrigation)-Irrigation Dept||Dibrugarh Circle,Duliajan,786602.0,2.0,"1,15,19,945",PRANJIT HAZARIKA,"11,514,043.15",Rejected-Finance,09-Oct-2025,Irrigation Department||Chief Engineer(Minor Irrigation)-Irrigation Dept||Dibrugarh Circle
2025_ID_47270_1,SEI/T-27/ET-3/2025-26/675,MDTW Schemes_Solar Powered_ 2 points at Boha Borjari GP and 1 point at Mayong GP under Jagiroad LAC in Morigaon District under SOPD_G for the year 2025_26,Construction of underground PVC distribution system spout chamber boundary Fencing sign board Boring and installation of TW Installation and commissioning Solar PV Module including mounting structures Construction of Control room,Works,Open Tender,Item Rate,Civil Works - Others,No,No,NA ,05-Sep-2025 10:00 AM,NA ,180.0,No ,No,Online,25-Sep-2025 03:00 PM,Irrigation Department||Chief Engineer(Major)-Irrigation Dept||Nagaon Circle,Jagiroad,782410.0,2.0,"86,39,075",LITAN KR CHANDA,"2,879,705",Accepted-AOC,14-Oct-2025,Irrigation Department||Chief Engineer(Major)-Irrigation Dept||Nagaon Circle
2025_ID_47339_1,SEI/T-27/ET-4/2025-26/691,Installation of 2 nos of MDTW Scheme under Raha LAC under SOPD_G for the year 2025_26,Construction of underground PVC distribution system spout chamber boundary Fencing sign board Boring and installation of TW Installation commissioning Solar PV Module including mounting structures Construction of Control room,Works,Open Tender,Item Rate,Civil Works - Others,No,No,NA ,06-Sep-2025 04:00 PM,NA ,180.0,No ,No,Online,26-Sep-2025 03:00 PM,Irrigation Department||Chief Engineer(Major)-Irrigation Dept||Nagaon Circle,Raha,782103.0,2.0,"57,59,300",BISWAJIT BORA,"1,016,244",Accepted-AOC,09-Oct-2025,Irrigation Department||Chief Engineer(Major)-Irrigation Dept||Nagaon Circle
2025_ID_47607_1,HKAD/IRRI/TSOPD/PT V/2025-26/403,Fabrication Supply and Installation of Solar Powered Cart Mounted Multifunctional I S at Algapur Katlicherra LAC under Hailakandi Algapur Katlicherra Division Irrigation Hailakandi,Fabrication Supply and Installation of Solar Powered Cart Mounted Multifunctional I S at Algapur Katlicherra LAC under Hailakandi Algapur Katlicherra Division Irrigation Hailakandi,Works,Open Tender,Item Rate,Composite Works,No,No,NA ,19-Sep-2025 03:00 PM,NA ,180.0,No ,No,Online,22-Oct-2025 03:30 PM,Irrigation Department||Chief Engineer(Minor Irrigation)-Irrigation Dept||Cachar-karimganj Circle||Hailakandi Katlicherra Algapur Division,HAILAKANDI,788151.0,2.0,"21,69,394",SPECTRUM ENTERPRISE,"2,169,394",Rejected-Technical,31-Oct-2025,Irrigation Department||Chief Engineer(Minor Irrigation)-Irrigation Dept||Cachar-karimganj Circle||Hailakandi Katlicherra Algapur Division
2025_ITFCD_43884_2,618650.0,"Renovation and Upgradation of Conference Room at Directorate of Museums, Guwahati -1","Renovation and Upgradation of Conference Room at Directorate of Museums, Guwahati -1",Works,Open Tender,Works,Civil Works - Others,No,No,NA ,15-May-2025 06:30 PM,23-May-2025 01:00 PM ,180.0,No ,No,Online,27-May-2025 02:00 PM,Indigenous and Tribal Faith and Culture Department||Directorate of Museums,DIrectorate of Museums Assam,781001.0,2.0,"33,60,503",AMIT KUMAR CHOUDHARY,"3,192,155",Accepted-AOC,13-Oct-2025,Indigenous and Tribal Faith and Culture Department||Directorate of Museums
2025_ITFCD_45834_2,E-670373,Proposed Cafeteria and Souvenir shop at Assam State Museum,Proposed Cafeteria and Souvenir shop at Assam State Museum,Works,Open Tender,Works,Composite Works,No,No,NA ,21-Aug-2025 12:00 PM,NA ,270.0,No ,No,Online,02-Sep-2025 02:00 PM,Indigenous and Tribal Faith and Culture Department||Directorate of Museums,Assam State Museum,781001.0,2.0,"5,52,676",AMIT KUMAR CHOUDHARY,"536,009",Accepted-AOC,13-Oct-2025,Indigenous and Tribal Faith and Culture Department||Directorate of Museums
2025_ITFCD_45835_2,E-666136,"Development of Creche at Assam State Museum, Guwahati-1","Development of Creche at Assam State Museum, Guwahati-1",Works,Open Tender,Works,Miscellaneous Works,No,No,NA ,21-Aug-2025 12:00 PM,NA ,225.0,No ,No,Online,02-Sep-2025 02:00 PM,Indigenous and Tribal Faith and Culture Department||Directorate of Museums,Assam State Museum,781001.0,2.0,"2,15,396",AMIT KUMAR CHOUDHARY,"208,115",Accepted-AOC,13-Oct-2025,Indigenous and Tribal Faith and Culture Department||Directorate of Museums
2025_ITFCD_45837_2,E-671722,"Development of Multipurpose Terrace Space at Admin Building Directorate of Museums, Assam","Development of Multipurpose Terrace Space at Admin Building Directorate of Museums, Assam",Works,Open Tender,Works,Miscellaneous Works,No,No,NA ,21-Aug-2025 12:00 PM,NA ,270.0,No ,No,Online,02-Sep-2025 02:00 PM,Indigenous and Tribal Faith and Culture Department||Directorate of Museums,Assam State Museum,781001.0,2.0,"6,13,126",AMIT KUMAR CHOUDHARY,"594,712",Accepted-AOC,13-Oct-2025,Indigenous and Tribal Faith and Culture Department||Directorate of Museums
2025_KAAC_46362_1,NoACEH/CS/SSA/03/2025-26/SL07,Construction of 50 bedded hostel separately for boys and girls under Dharti Aaba Janjatiya Gram Utkarsh Abhiyan at Hidipi High School.,Construction of 50 bedded hostel separately for boys and girls under Dharti Aaba Janjatiya Gram Utkarsh Abhiyan at Hidipi High School.,Works,Open Tender,Item Rate,Civil Works - Building,No,No,NA ,18-Aug-2025 11:00 AM,20-Aug-2025 11:00 AM ,180.0,No ,No,Online,30-Aug-2025 11:00 AM,Karbi Anglong Autonomous Council||PWD||Addl. Chief Engineer Diphu,Bokajan,782480.0,2.0,"3,78,75,000",OSIA TRADE AND SUPPLY,"37,823,079.78",Rejected-Technical,24-Oct-2025,Karbi Anglong Autonomous Council||PWD||Addl. Chief Engineer Diphu
2025_KAAC_46460_1,NoACEH/CS/SSA/03/2025-26/SL20,Construction of 50 bedded hostel separately for boys and girls under Dharti Aaba Janjatiya Gram Utkarsh Abhiyan at Dokmoka H.S. School.,Construction of 50 bedded hostel separately for boys and girls under Dharti Aaba Janjatiya Gram Utkarsh Abhiyan at Dokmoka H.S. School.,Works,Open Tender,Item Rate,Civil Works - Building,No,No,NA ,18-Aug-2025 11:00 AM,20-Aug-2025 12:00 PM ,180.0,No ,No,Online,30-Aug-2025 11:00 AM,Karbi Anglong Autonomous Council||PWD||Addl. Chief Engineer Diphu,Samelangso,782441.0,2.0,"3,78,75,000",Chiranjiv Agarwal,"37,685,624.81",Accepted-AOC,23-Oct-2025,Karbi Anglong Autonomous Council||PWD||Addl. Chief Engineer Diphu
2025_KAAC_46543_1,NoACEH/CS/SSA/03/2025-26/SL61,Construction of 50 bedded hostel separately for boys and girls under Dharti Aaba Janjatiya Gram Utkarsh Abhiyan at Rangsina High School,Construction of 50 bedded hostel separately for boys and girls under Dharti Aaba Janjatiya Gram Utkarsh Abhiyan at Rangsina High School,Works,Open Tender,Item Rate,Civil Works - Building,No,No,NA ,18-Aug-2025 11:00 AM,20-Aug-2025 11:00 AM ,180.0,No ,No,Online,30-Aug-2025 11:00 AM,Karbi Anglong Autonomous Council||PWD||Addl. Chief Engineer Diphu,Rongkhang,782485.0,2.0,"3,78,75,000",Chiranjiv Agarwal,"37,874,999.99",Accepted-AOC,29-Oct-2025,Karbi Anglong Autonomous Council||PWD||Addl. Chief Engineer Diphu
2025_KAAC_46549_1,NoACEH/CS/SSA/03/2025-26/SL65,Construction of 50 bedded hostel separately for boys and girls under Dharti Aaba Janjatiya Gram Utkarsh Abhiyan at Jirikinding English ME School (Upgraded to High School),Construction of 50 bedded hostel separately for boys and girls under Dharti Aaba Janjatiya Gram Utkarsh Abhiyan at Jirikinding English ME School (Upgraded to High School),Works,Open Tender,Item Rate,Civil Works - Building,No,No,NA ,18-Aug-2025 11:00 AM,NA ,180.0,No ,No,Online,30-Aug-2025 11:00 AM,Karbi Anglong Autonomous Council||PWD||Addl. Chief Engineer Diphu,Socheng,782485.0,2.0,"3,78,75,000",Chiranjiv Agarwal,"37,874,999.99",Accepted-AOC,29-Oct-2025,Karbi Anglong Autonomous Council||PWD||Addl. Chief Engineer Diphu
2025_KAAC_46589_1,ACEH/CS/SSA/03/2025-26/NSL56,Construction of 50 bedded hostel separately for boys and girls at Dongkamukh High School Pvn under the scheme Dharti Aaba Janjatiya Gram Utkarsh Abhiyan,Construction of 50 bedded hostel separately for boys and girls at Dongkamukh High School Pvn under the scheme Dharti Aaba Janjatiya Gram Utkarsh Abhiyan,Works,Open Tender,Item Rate,Civil Works - Building,No,No,NA ,18-Aug-2025 11:00 AM,20-Aug-2025 12:00 PM ,180.0,No ,No,Online,30-Aug-2025 11:00 AM,Karbi Anglong Autonomous Council||PWD||Addl. Chief Engineer Diphu,Rongkhang,782485.0,2.0,"3,78,75,000",M/S P.H. ENTERPRISE,"37,874,999.99",Accepted-AOC,31-Oct-2025,Karbi Anglong Autonomous Council||PWD||Addl. Chief Engineer Diphu
2025_KAAC_46958_1,NIT 3 of 2025-26 of DIPHU RURAL W/S DIVISION,Water supply arrangement for work upgradation of existing sub centre to Primary health centre at Koilamati under Chowkihola BPHC (Under Bokajan LAC) in Karbi Anglong District,Water supply arrangement for work upgradation of existing sub centre to Primary health centre at Koilamati under Chowkihola BPHC (Under Bokajan LAC) in Karbi Anglong District,Works,Open Tender,Item Rate,Civil Works - Water Works,No,No,NA ,25-Aug-2025 11:30 AM,05-Sep-2025 02:00 PM ,90.0,No ,No,Online,17-Sep-2025 03:00 PM,Karbi Anglong Autonomous Council,"Chowkihola BPHC, Koilamati",782470.0,3.0,"21,96,079",Rupam Kataki,"2,169,920",Accepted-AOC,14-Oct-2025,Karbi Anglong Autonomous Council
2025_KAAC_47184_1,NoACEH/CS/SSA/03/2025-26/RE 12,Construction of 50 bedded hostel separately for boys and girls under Dharti Aaba Janjatiya Gram Utkarsh Abhiyan Howraghat English Medium High School.,Construction of 50 bedded hostel separately for boys and girls under Dharti Aaba Janjatiya Gram Utkarsh Abhiyan Howraghat English Medium High School.,Works,Open Tender,Item Rate,Civil Works - Building,No,No,NA ,03-Sep-2025 11:00 AM,05-Sep-2025 12:00 PM ,180.0,No ,No,Online,15-Sep-2025 03:00 PM,Karbi Anglong Autonomous Council||PWD||Addl. Chief Engineer Diphu,Howraghat,782461.0,2.0,"3,78,75,000",MAHENDRA KONWAR,"37,875,000",Accepted-AOC,16-Oct-2025,Karbi Anglong Autonomous Council||PWD||Addl. Chief Engineer Diphu
2025_KAAC_47186_1,NoACEH/CS/SSA/03/2025-26/RE 16,Construction of 50 bedded hostel separately for boys and girls under Dharti Aaba Janjatiya Gram Utkarsh Abhiyan at Langhin Manikpue B.M. High School.,Construction of 50 bedded hostel separately for boys and girls under Dharti Aaba Janjatiya Gram Utkarsh Abhiyan at Langhin Manikpue B.M. High School.,Works,Open Tender,Item Rate,Civil Works - Building,No,No,NA ,03-Sep-2025 11:00 AM,05-Sep-2025 12:00 PM ,180.0,No ,No,Online,15-Sep-2025 11:00 AM,Karbi Anglong Autonomous Council||PWD||Addl. Chief Engineer Diphu,Samelangso,782441.0,2.0,"3,78,75,000",KIRON TOKBI,"37,801,502.14",Accepted-AOC,21-Oct-2025,Karbi Anglong Autonomous Council||PWD||Addl. Chief Engineer Diphu
2025_NHM_43953_4,NHM/32023/67/Cons-NHM,"Construction of Buildingless Sub Health Centre in Motirchar SC in Dhubri District under PM ABHIM for FY 2022-23 under NHM, Assam on Turnkey Basis","Construction of Buildingless Sub Health Centre in Motirchar SC in Dhubri District under PM ABHIM for FY 2022-23 under NHM, Assam on Turnkey Basis",Works,Open Tender,Turn-key,Civil Works - Building,No,No,NA ,03-Apr-2025 06:00 PM,NA ,180.0,No ,No,Online,24-Apr-2025 03:30 PM,National Health Mission||State Programme Management Unit - NHM,Dhubri,783301.0,2.0,"52,03,000",KANGKAN NATH,"5,170,000",Accepted-AOC,15-Oct-2025,National Health Mission||State Programme Management Unit - NHM
2025_NHM_45549_1,NHM/ECF/630786,Construction of New Urban PHC Building for Batahghuli UPHC in Kamrup Metro District Assam,Construction of New Urban PHC Building for Batahghuli UPHC in Kamrup Metro District Assam,Works,Open Tender,Turn-key,Civil Works - Building,No,No,NA ,14-Jul-2025 09:00 AM,NA ,180.0,No ,No,Online,02-Aug-2025 03:00 PM,National Health Mission||State Programme Management Unit - NHM,Batahghuli,781022.0,2.0,"1,31,71,887",PABITRA SAIKIA,"13,171,880",Accepted-AOC,15-Oct-2025,National Health Mission||State Programme Management Unit - NHM
2025_PCCF_46507_1,FS/Tender/SOPD/2025-26,"Construction of Approach Road from Main gate to Drill Sheet at Assam Forest Protection Force, Basistha, Guwahati-29","Construction of Approach Road from Main gate to Drill Sheet at Assam Forest Protection Force, Basistha, Guwahati-29",Works,Open Tender,Percentage,Civil Works,No,No,NA ,14-Aug-2025 05:00 PM,21-Aug-2025 01:00 PM ,180.0,No ,No,Online,08-Sep-2025 05:30 PM,Pr. Chief Conservator of Forest and Head of Forest Force||1st Assam Forest Protection Force,"Basistha, Guwahati",781029.0,2.0,"22,16,694",JAYANTA DUTTA,"2,216,472.33",Accepted-AOC,30-Oct-2025,Pr. Chief Conservator of Forest and Head of Forest Force||1st Assam Forest Protection Force
2025_PCCF_46519_1,FS/Tender/SOPD/2025-26,"Construction of Staff Quarter of RCC Building 2nd Floor 4 Unit at Assam Forest Protection Force, Basistha, Guwahati-29","Construction of Staff Quarter of RCC Building 2nd Floor 4 Unit at Assam Forest Protection Force, Basistha, Guwahati-29",Works,Open Tender,Percentage,Civil Works,No,No,NA ,14-Aug-2025 05:00 PM,21-Aug-2025 01:00 PM ,180.0,No ,No,Online,08-Sep-2025 05:30 PM,Pr. Chief Conservator of Forest and Head of Forest Force||1st Assam Forest Protection Force,"Basistha, Guwahati",781029.0,2.0,"40,00,000",MINTU KUMAR BHUYAN,"3,999,600",Rejected-Finance,30-Oct-2025,Pr. Chief Conservator of Forest and Head of Forest Force||1st Assam Forest Protection Force
2025_PCCF_47284_1,FNST/B/MPA/Sale/2025/4270,Execution of Roadside/AvenuePlantation and Maintenance of Doboka to Lanka section of NH-27,Execution of Roadside/Avenue Plantation and Maintenance of Doboka to Lanka section of NH-27,Works,Open Tender,Lump-sum,Agricultural or Forestry,No,No,NA ,05-Sep-2025 09:00 AM,05-Sep-2025 10:00 AM ,45.0,No ,No,Online,12-Sep-2025 12:00 PM,"Pr. Chief Conservator of Forest and Head of Forest Force||Chief Conservator of Forests (Upper Assam Zone)||Northern Assam Circle, Tezpur||Nagaon South Division",Doboka to Lanka NH-27 (7 km),782440.0,2.0,"1,63,86,060",M/S BHOWMIK ENTERPRISE,"17,401,995.9",Accepted-AOC,15-Sep-2025,"Pr. Chief Conservator of Forest and Head of Forest Force||Chief Conservator of Forests (Upper Assam Zone)||Northern Assam Circle, Tezpur||Nagaon South Division"
2025_PHED_45782_1,SEPH/GC/TB-152/Vol-XI/2025-26,"Implementation Of Water Supply Project At Sri Sri Jagadhatri Mandir, Muktapur, Mukundapur","Implementation Of Water Supply Project At Sri Sri Jagadhatri Mandir, Muktapur, Mukundapur",Works,Open Tender,Item Rate,Civil Works,No,No,NA ,19-Jul-2025 04:00 PM,28-Jul-2025 01:00 PM ,90.0,No ,No,Online,12-Aug-2025 03:00 PM,Public Health Engineering Department||Chief Engineer PHE(P)-Assam-PHED||Lower Assam Zone-Guwahati-PHED||Guwahati Circle-Guwahati-PHED,Muktapur,781344.0,2.0,"21,95,458",SRI NILAM JYOTI DAS,"2,195,058",Rejected-Technical,09-Oct-2025,Public Health Engineering Department||Chief Engineer PHE(P)-Assam-PHED||Lower Assam Zone-Guwahati-PHED||Guwahati Circle-Guwahati-PHED
2025_PHED_45854_1,SEPH/GC/TB-152/Vol-XII/2025-26,"IMPLEMENTATION OF WATER SUPPLY PROJECT AT GOPAL THAN DOUL MANDIR, NIZ MADARTOLA","IMPLEMENTATION OF WATER SUPPLY PROJECT AT GOPAL THAN DOUL MANDIR, NIZ MADARTOLA",Works,Open Tender,Item Rate,Civil Works,No,No,NA ,24-Jul-2025 04:00 PM,31-Jul-2025 01:00 PM ,90.0,No ,No,Online,16-Aug-2025 03:00 PM,Public Health Engineering Department||Chief Engineer PHE(P)-Assam-PHED||Lower Assam Zone-Guwahati-PHED||Guwahati Circle-Guwahati-PHED,"GOPAL THAN DOUL MANDIR, NIZ MADARTOLA",781380.0,2.0,"21,54,726",SRI NILAM JYOTI DAS,"2,154,322",Rejected-Technical,09-Oct-2025,Public Health Engineering Department||Chief Engineer PHE(P)-Assam-PHED||Lower Assam Zone-Guwahati-PHED||Guwahati Circle-Guwahati-PHED
2025_PHED_45857_1,SEPH/GC/TB-152/Vol-XIV/2025-26,"Implementation Of Water Supply Project at Shiva Naliya Than, Soula","Implementation Of Water Supply Project at Shiva Naliya Than, Soula under Rangia Division,Rangia under SOPD-G for the year 2024-25",Works,Open Tender,Item Rate,Civil Works,No,No,NA ,24-Jul-2025 04:00 PM,31-Jul-2025 01:00 PM ,90.0,No ,No,Online,16-Aug-2025 03:00 PM,Public Health Engineering Department||Chief Engineer PHE(P)-Assam-PHED||Lower Assam Zone-Guwahati-PHED||Guwahati Circle-Guwahati-PHED,"Shiva Naliya Than, Soula",781380.0,2.0,"22,67,743",SRI NILAM JYOTI DAS,"2,267,366",Rejected-Technical,09-Oct-2025,Public Health Engineering Department||Chief Engineer PHE(P)-Assam-PHED||Lower Assam Zone-Guwahati-PHED||Guwahati Circle-Guwahati-PHED
2025_PHED_45928_1,SEPH/GC/TB-152/Vol-VII/2025-26,Providing water supply facility for Chandubi Lodge under Assam Tourism,Providing water supply facility for Chandubi Lodge under Assam Tourismunder Guwahati Division No.-I under SOPD-G the year 2024-25,Works,Open Tender,Item Rate,Civil Works,No,No,NA ,28-Jul-2025 04:00 PM,05-Aug-2025 01:00 PM ,90.0,No ,No,Online,20-Aug-2025 03:00 PM,Public Health Engineering Department||Chief Engineer PHE(P)-Assam-PHED||Lower Assam Zone-Guwahati-PHED||Guwahati Circle-Guwahati-PHED,Chandubi,781120.0,2.0,"58,19,000",YSM Construction & Co.,"5,818,233",Accepted-AOC,26-Sep-2025,Public Health Engineering Department||Chief Engineer PHE(P)-Assam-PHED||Lower Assam Zone-Guwahati-PHED||Guwahati Circle-Guwahati-PHED
2025_PHED_46050_2,SE (PHE) JOR/TB-190/2025-26/ 196 dated 30/07/2025,Restoration of Distribution Network of HDPE Pipeline Damaged during Road Widening under Charigaon Zone PWSS of Jorhat (PHE) Division under SOPD-G,Restoration of Distribution Network of HDPE Pipeline Damaged during Road Widening under Charigaon Zone PWSS of Jorhat (PHE) Division under SOPD-G,Works,Open Tender,Item Rate,Civil Works,No,No,NA ,19-Aug-2025 04:00 PM,22-Aug-2025 03:00 PM ,90.0,No ,No,Online,29-Aug-2025 03:00 PM,Public Health Engineering Department||Chief Engineer PHE(P)-Assam-PHED||Upper Assam Zone-Nagaon-PHED||Jorhat Circle-Jorhat-PHED,Jorhat,785010.0,2.0,"22,50,000",GLOBAL ENGINEERING,"2,250,448",Accepted-AOC,26-Sep-2025,Public Health Engineering Department||Chief Engineer PHE(P)-Assam-PHED||Upper Assam Zone-Nagaon-PHED||Jorhat Circle-Jorhat-PHED
2025_PHED_46116_1,SEPH/GC/TB-152/Vol-XVI/2025-26,RENOVATION OF TRINAYAN PWSS,RENOVATION OF TRINAYAN PWSS UNDER GUWAHATI DIVISION NO-I UNDER SOPD-G FOR THE YEAR 2024-25,Works,Open Tender,Item Rate,Civil Works,No,No,NA ,04-Aug-2025 04:00 PM,11-Aug-2025 01:00 PM ,90.0,No ,No,Online,05-Sep-2025 03:00 PM,Public Health Engineering Department||Chief Engineer PHE(P)-Assam-PHED||Lower Assam Zone-Guwahati-PHED||Guwahati Circle-Guwahati-PHED,"krishnapur, Beltola Tiniali",781028.0,2.0,"67,84,000",BISWAJIT SARMA,"6,782,923",Accepted-AOC,09-Oct-2025,Public Health Engineering Department||Chief Engineer PHE(P)-Assam-PHED||Lower Assam Zone-Guwahati-PHED||Guwahati Circle-Guwahati-PHED
2025_PHED_46118_1,SEPH/GC/TB-152/Vol-XVII/25-26,RENOVATION OF LALMATI NO-I PWSS,RENOVATION OF LALMATI NO-I PWSS UNDER GUWAHATI DIVISION NO-I UNDER SOPD-G FOR THE YEAR 2024-25,Works,Open Tender,Item Rate,Civil Works,No,No,NA ,04-Aug-2025 04:00 PM,11-Aug-2025 01:00 PM ,90.0,No ,No,Online,05-Sep-2025 03:00 PM,Public Health Engineering Department||Chief Engineer PHE(P)-Assam-PHED||Lower Assam Zone-Guwahati-PHED||Guwahati Circle-Guwahati-PHED,"Game Village,Guwahati",781029.0,2.0,"57,43,000",Raijul Ali,"5,736,548",Rejected-Technical,10-Oct-2025,Public Health Engineering Department||Chief Engineer PHE(P)-Assam-PHED||Lower Assam Zone-Guwahati-PHED||Guwahati Circle-Guwahati-PHED
2025_PHED_46213_1,IFB NO 16 OF 2025-26,Detailed estimate for utility shifting of Greater Bhawanipur PWSS,Detailed estimate for utility shifting of Greater Bhawanipur PWSS,Works,Open Tender,Works,Civil Works,No,No,NA ,08-Aug-2025 02:00 PM,NA ,30.0,No ,No,Online,06-Sep-2025 11:30 AM,Public Health Engineering Department||Chief Engineer PHE(P)-Assam-PHED||Lower Assam Zone-Guwahati-PHED||Nalbari Circle-Nalbari-PHED,Greater Bhawanipur PWSS,781352.0,2.0,"24,90,000",Biswa Jyoti Kalita,"2,489,751",Accepted-AOC,18-Sep-2025,Public Health Engineering Department||Chief Engineer PHE(P)-Assam-PHED||Lower Assam Zone-Guwahati-PHED||Nalbari Circle-Nalbari-PHED
2025_PHED_46216_1,IFB NO 19 OF 2025-26,Detailed estimate for utility shifting of Nakuchi Gaon PWSS,Detailed estimate for utility shifting of Nakuchi Gaon PWSS,Works,Open Tender,Works,Civil Works,No,No,NA ,08-Aug-2025 02:00 PM,NA ,30.0,No ,No,Online,06-Sep-2025 11:30 AM,Public Health Engineering Department||Chief Engineer PHE(P)-Assam-PHED||Lower Assam Zone-Guwahati-PHED||Nalbari Circle-Nalbari-PHED,Nakuchi Gaon PWSS,781352.0,2.0,"38,50,000",PARAG TALUKDAR,"3,849,230",Rejected-Finance,15-Sep-2025,Public Health Engineering Department||Chief Engineer PHE(P)-Assam-PHED||Lower Assam Zone-Guwahati-PHED||Nalbari Circle-Nalbari-PHED
2025_PHED_46321_1,SEPH/GC/TB-152/Vol-XXV/25-26,"UPGRADATION AND LAYING OF 200 MM DIA MS DRINKING WATER BOOSTING PUMPING PIPE LINE FROM JAYANAGAR CHARIALI TO SENIOR OFFICERS COLONY KHANAPARA, GHY-22","UPGRADATION AND LAYING OF 200 MM DIA MS DRINKING WATER BOOSTING PUMPING PIPE LINE FROM JAYANAGAR CHARIALI TO SENIOR OFFICERS COLONY KHANAPARA, GHY-22 UNDER GUWAHATI DIVISION NO.-II UNDER SOPD-G THE YEAR 2024-25",Works,Open Tender,Item Rate,Civil Works,No,No,NA ,12-Aug-2025 04:00 PM,19-Aug-2025 01:00 PM ,90.0,No ,No,Online,04-Sep-2025 03:00 PM,Public Health Engineering Department||Chief Engineer PHE(P)-Assam-PHED||Lower Assam Zone-Guwahati-PHED||Guwahati Circle-Guwahati-PHED,jayanagar Chariali,781022.0,2.0,"1,77,11,000",JATIN CHANDRA BARUAH,"17,708,819",Accepted-AOC,09-Oct-2025,Public Health Engineering Department||Chief Engineer PHE(P)-Assam-PHED||Lower Assam Zone-Guwahati-PHED||Guwahati Circle-Guwahati-PHED
2025_PHED_46638_1,IFB NO 21 OF 2025-26,Utility shifting of PWSS (JJM) under SOPD-Jagara PWSS under Belsor(PHE) Division,Utility shifting of PWSS (JJM) under SOPD-Jagara PWSS under Belsor(PHE) Division,Works,Open Tender,Works,Civil Works,No,No,NA ,20-Aug-2025 02:00 PM,NA ,30.0,No ,No,Online,11-Sep-2025 11:30 AM,Public Health Engineering Department||Chief Engineer PHE(P)-Assam-PHED||Lower Assam Zone-Guwahati-PHED||Nalbari Circle-Nalbari-PHED,Jagara PWSS,781310.0,2.0,"28,92,343",HEMEN DEKA,"2,892,343",Accepted-AOC,09-Oct-2025,Public Health Engineering Department||Chief Engineer PHE(P)-Assam-PHED||Lower Assam Zone-Guwahati-PHED||Nalbari Circle-Nalbari-PHED
