2024_PWD_39025_34,CE/DEV/TB/45/2024-25/10,MMUPPNA_RIDF_XXX_24_25_128 Upgradation of road starting from 29th Km of NH-154 (Paschim Kitterbond) to Lala Town (Gudamghat to Umed nagar) from Ch. 5336.00m to Ch. 7336.00munder Mukhya Mantrir Unnoto Pakipath Nirman Aachani (MMUPPNA) under RIDF-XXX,MMUPPNA_RIDF_XXX_24_25_128 Upgradation of road starting from 29th Km of NH-154 (Paschim Kitterbond) to Lala Town (Gudamghat to Umed nagar) from Ch. 5336.00m to Ch. 7336.00munder Mukhya Mantrir Unnoto Pakipath Nirman Aachani (MMUPPNA) under RIDF-XXX,Works,Open Tender,Item Rate,Civil Works,No,No,NA ,20-Sep-2024 05:00 PM,27-Sep-2024 12:00 PM ,180.0,No ,No,Online,07-Oct-2024 02:30 PM,Public Works Roads Department,Hailakandi,781003.0,2.0,"2,05,88,000",Jahangir Alahi Laskar,"18,529,200",Accepted-AOC,07-Mar-2025,Public Works Roads Department
2024_PWD_39025_37,CE/DEV/TB/45/2024-25/10,MMUPPNA_RIDF_XXX_24_25_138 Improvement and upgradation of Road From Odali Tinali Bazar (NH27) to Pub Odali from Ch. 0.00 m to 6710.00 m with Cross Drainage works at Itabhata Gas Nala Roadunder Mukhya Mantrir Unnoto Pakipath Nirman Aachani (MMUPPNA),MMUPPNA_RIDF_XXX_24_25_138 Improvement and upgradation of Road From Odali Tinali Bazar (NH27) to Pub Odali from Ch. 0.00 m to 6710.00 m with Cross Drainage works at Itabhata Gas Nala Roadunder Mukhya Mantrir Unnoto Pakipath Nirman Aachani (MMUPPNA),Works,Open Tender,Item Rate,Civil Works,No,No,NA ,20-Sep-2024 06:00 PM,27-Sep-2024 12:00 PM ,180.0,No ,No,Online,07-Oct-2024 02:30 PM,Public Works Roads Department,Hojai,781003.0,2.0,"10,00,00,000",Rishabh Jain,"99,987,777",Rejected-Finance,18-Mar-2025,Public Works Roads Department
2024_PWD_39025_43,CE/DEV/TB/45/2024-25/10,MMUPPNA_RIDF_XXX_24_25_147 Improvement of road from Akhra Tiniali to Tukrakuchi via Betbariunder Mukhya Mantrir Unnoto Pakipath Nirman Aachani (MMUPPNA) under RIDF-XXX of NABARD for the year 2024-25,MMUPPNA_RIDF_XXX_24_25_147 Improvement of road from Akhra Tiniali to Tukrakuchi via Betbariunder Mukhya Mantrir Unnoto Pakipath Nirman Aachani (MMUPPNA) under RIDF-XXX of NABARD for the year 2024-25,Works,Open Tender,Item Rate,Civil Works,No,No,NA ,21-Sep-2024 04:00 PM,27-Sep-2024 12:00 PM ,180.0,No ,No,Online,07-Oct-2024 02:30 PM,Public Works Roads Department,Baksa,781003.0,2.0,"4,83,89,000",Pradip Narzary,"43,550,100",Rejected-Finance,20-Mar-2025,Public Works Roads Department
2024_PWD_39025_5,CE/DEV/TB/45/2024-25/10,"MMUPPNA_RIDF_XXX_24_25_120 Construction of Road from Teteliguri to Sarthe Enghi Gaon via Kongjuk Athoi HS School and Ranjit Bey gaon, from Ch 0.00 m to 3900.00m, L3.900 Kmunder Mukhya Mantrir Unnoto Pakipath Nirman Aachani (MMUPPNA) under RIDF-XXX","MMUPPNA_RIDF_XXX_24_25_120 Construction of Road from Teteliguri to Sarthe Enghi Gaon via Kongjuk Athoi HS School and Ranjit Bey gaon, from Ch 0.00 m to 3900.00m, L3.900 Kmunder Mukhya Mantrir Unnoto Pakipath Nirman Aachani (MMUPPNA) under RIDF-XXX",Works,Open Tender,Item Rate,Civil Works,No,No,NA ,16-Sep-2024 04:00 PM,27-Sep-2024 12:00 PM ,180.0,No ,No,Online,07-Oct-2024 02:30 PM,Public Works Roads Department,Karbi Anglong,781003.0,2.0,"3,85,00,000",Benudhar Pegu,"34,650,000",Not Admitted-Fee/PreQual/Technical,24-Mar-2025,Public Works Roads Department
2024_PWD_39071_1,CE/STBR/ SOPD-G/NIT/71/2024-25/2 Dtd. 16-09-2024,STBR/SOPD-G/Dholai/01 Reconstruction and Rehabilitation of BUG Bridge Super-Structure of Br. No. 1/1 on Bagha Sherkhan Road under Dholai and Sonai Territorial Road Division under SOPG-G for the year 2024-25,STBR/SOPD-G/Dholai/01 Reconstruction and Rehabilitation of BUG Bridge Super-Structure of Br. No. 1/1 on Bagha Sherkhan Road under Dholai and Sonai Territorial Road Division under SOPG-G for the year 2024-25,Works,Open Tender,Item Rate,Civil Works – Roads,No,No,NA ,19-Sep-2024 10:30 AM,NA ,180.0,No ,No,Online,27-Sep-2024 11:00 AM,Public Works Roads Department,Dholai,788114.0,2.0,"3,24,61,000",Sri Purnam Deb,"32,460,900",Rejected-AOC,01-Mar-2025,Public Works Roads Department
2024_PWD_39093_1,GCTRD/NT-24/2023-24/1845,GCTRD/P-II/2024-25/10,GCTRD/P-II/2024-25/10_Improvement of College hostel Road Haren Barua Road under SOPD-G for the year 2024-25,Works,Open Tender,Item Rate,Civil Works,No,No,NA ,20-Sep-2024 01:00 PM,21-Sep-2024 12:00 PM ,180.0,No ,No,Online,24-Sep-2024 03:00 PM,Public Works Roads Department,Fancy Bazar,781001.0,2.0,"29,69,000",KAMAL THAKURIA,"2,968,510",Accepted-AOC,14-Feb-2025,Public Works Roads Department
2024_PWD_39143_120,"CE/DEV/TB/213/2024-25/01 Dtd. Guwahati, 05th September, 2024",TE_RIDF_XXX_24_25_102 Construction of road from D.K. road at Fajpur to Mornoi ME school (L 1.21 Km) under RIDF-XXX of NABARD for the year 2024-25,TE_RIDF_XXX_24_25_102 Construction of road from D.K. road at Fajpur to Mornoi ME school (L 1.21 Km) under RIDF-XXX of NABARD for the year 2024-25,Works,Open Tender,Item Rate,Civil Works – Roads,No,No,NA ,26-Sep-2024 02:00 PM,30-Sep-2024 12:00 PM ,180.0,No ,No,Online,09-Oct-2024 02:30 PM,Public Works Roads Department,Kokrajhar,783370.0,2.0,"1,00,00,000",Fazlul Hoque Sheikh,"9,000,000",Rejected-Finance,29-Mar-2025,Public Works Roads Department
2024_PWD_39143_23,"CE/DEV/TB/213/2024-25/01 Dtd. Guwahati, 05th September, 2024",TE_RIDF_XXX_24_25_90 Contruction of Road from sector 5 to sector 6 via graveyard at Maijonga Tea Estate under RIDF-XXX of NABARD for the year 2024-25,TE_RIDF_XXX_24_25_90 Contruction of Road from sector 5 to sector 6 via graveyard at Maijonga Tea Estate under RIDF-XXX of NABARD for the year 2024-25,Works,Open Tender,Item Rate,Civil Works – Roads,No,No,NA ,24-Sep-2024 10:00 AM,30-Sep-2024 12:00 PM ,180.0,No ,No,Online,09-Oct-2024 02:30 PM,Public Works Roads Department,Goalpara,783101.0,2.0,"1,00,00,000",Dipa Basumatary,"90,000,000",Rejected-Finance,20-Mar-2025,Public Works Roads Department
2024_PWD_39143_28,"CE/DEV/TB/213/2024-25/01 Dtd. Guwahati, 05th September, 2024","TE_RIDF_XXX_24_25_12 Construction of ICBP Road from Ambika TE to Dodhgarh Sunday Market Road (from Ch. 0.00 m to Ch. 1140.00 m, L-1.14 Km) under RIDF-XXX of NABARD for the year 2024-25","TE_RIDF_XXX_24_25_12 Construction of ICBP Road from Ambika TE to Dodhgarh Sunday Market Road (from Ch. 0.00 m to Ch. 1140.00 m, L-1.14 Km) under RIDF-XXX of NABARD for the year 2024-25",Works,Open Tender,Item Rate,Civil Works – Roads,No,No,NA ,24-Sep-2024 05:00 PM,30-Sep-2024 12:00 PM ,180.0,No ,No,Online,09-Oct-2024 02:30 PM,Public Works Roads Department,Udalguri,784509.0,2.0,"1,00,00,000",MOHAN CHANDRA BARO,"9,000,000",Accepted-AOC,29-Mar-2025,Public Works Roads Department
2024_PWD_39143_29,"CE/DEV/TB/213/2024-25/01 Dtd. Guwahati, 05th September, 2024","TE_RIDF_XXX_24_25_13 Construction of ICBP Road from Attarekhat TE Hospital to Dharamjuli TE (from Ch. 0.00 m to Ch. 1360.00 m, L 1.36 Km) under RIDF-XXX of NABARD for the year 2024-25","TE_RIDF_XXX_24_25_13 Construction of ICBP Road from Attarekhat TE Hospital to Dharamjuli TE (from Ch. 0.00 m to Ch. 1360.00 m, L 1.36 Km) under RIDF-XXX of NABARD for the year 2024-25",Works,Open Tender,Item Rate,Civil Works – Roads,No,No,NA ,24-Sep-2024 06:00 PM,30-Sep-2024 12:00 PM ,180.0,No ,No,Online,09-Oct-2024 02:30 PM,Public Works Roads Department,Cachar,784509.0,2.0,"1,00,00,000",M/S Saturn Electricals,"9,000,000",Accepted-AOC,26-Mar-2025,Public Works Roads Department
2024_PWD_39143_31,"CE/DEV/TB/213/2024-25/01 Dtd. Guwahati, 05th September, 2024","TE_RIDF_XXX_24_25_15 Construction of ICBP road from Nonaipara TE Gate to Nonaipara TE Factory (from Ch. 0.00m to 1700.00m, L 1.7 km) under RIDF-XXX of NABARD for the year 2024-25","TE_RIDF_XXX_24_25_15 Construction of ICBP road from Nonaipara TE Gate to Nonaipara TE Factory (from Ch. 0.00m to 1700.00m, L 1.7 km) under RIDF-XXX of NABARD for the year 2024-25",Works,Open Tender,Item Rate,Civil Works – Roads,No,No,NA ,24-Sep-2024 06:00 PM,30-Sep-2024 12:00 PM ,180.0,No ,No,Online,09-Oct-2024 02:30 PM,Public Works Roads Department,Udalguri,784509.0,2.0,"1,00,00,000",NRIPEN KALITA,"9,000,000",Rejected-AOC,26-Mar-2025,Public Works Roads Department
2024_PWD_39143_35,"CE/DEV/TB/213/2024-25/01 Dtd. Guwahati, 05th September, 2024","TE_RIDF_XXX_24_25_19 Construction of ICBP road from Shyamabari Chowk to Krishna Sushaibini T.E. (from Ch. 0.00m to 1350.00m, L 1.35 km) under RIDF-XXX of NABARD for the year 2024-25","TE_RIDF_XXX_24_25_19 Construction of ICBP road from Shyamabari Chowk to Krishna Sushaibini T.E. (from Ch. 0.00m to 1350.00m, L 1.35 km) under RIDF-XXX of NABARD for the year 2024-25",Works,Open Tender,Item Rate,Civil Works – Roads,No,No,NA ,24-Sep-2024 06:00 PM,30-Sep-2024 12:00 PM ,180.0,No ,No,Online,09-Oct-2024 02:30 PM,Public Works Roads Department,Udalguri,784509.0,2.0,"1,00,00,000",NRIPEN KALITA,"9,000,000",Rejected-AOC,26-Mar-2025,Public Works Roads Department
2024_PWD_39143_36,"CE/DEV/TB/213/2024-25/01 Dtd. Guwahati, 05th September, 2024","TE_RIDF_XXX_24_25_20 Construction of ICBP road from UT road to Dimakuchi TE (from Ch. 0.00m to Ch. 1015.00 m, L 1.015 km) under RIDF-XXX of NABARD for the year 2024-25","TE_RIDF_XXX_24_25_20 Construction of ICBP road from UT road to Dimakuchi TE (from Ch. 0.00m to Ch. 1015.00 m, L 1.015 km) under RIDF-XXX of NABARD for the year 2024-25",Works,Open Tender,Item Rate,Civil Works – Roads,No,No,NA ,24-Sep-2024 06:00 PM,30-Sep-2024 12:00 PM ,180.0,No ,No,Online,09-Oct-2024 02:30 PM,Public Works Roads Department,Udalguri,784509.0,2.0,"1,00,00,000",Rahul Beria,"9,000,000",Rejected-AOC,29-Mar-2025,Public Works Roads Department
2024_PWD_39143_37,"CE/DEV/TB/213/2024-25/01 Dtd. Guwahati, 05th September, 2024","TE_RIDF_XXX_24_25_21 Construction of ICBP road from Budlapara TE Factory road to Tankibasti (from Ch. 0.00m to 1250.00m, L 1.25 km) under RIDF-XXX of NABARD for the year 2024-25","TE_RIDF_XXX_24_25_21 Construction of ICBP road from Budlapara TE Factory road to Tankibasti (from Ch. 0.00m to 1250.00m, L 1.25 km) under RIDF-XXX of NABARD for the year 2024-25",Works,Open Tender,Item Rate,Civil Works – Roads,No,No,NA ,24-Sep-2024 06:00 PM,30-Sep-2024 12:00 PM ,180.0,No ,No,Online,09-Oct-2024 02:30 PM,Public Works Roads Department,Udalguri,784509.0,2.0,"1,00,00,000",Prasanna Das,"9,000,000",Accepted-AOC,26-Mar-2025,Public Works Roads Department
2024_PWD_39143_40,"CE/DEV/TB/213/2024-25/01 Dtd. Guwahati, 05th September, 2024",TE_RIDF_XXX_24_25_34 Construction of Pratapgarh Tea Estate Line Road under Pratapgarh Tea Estate under RIDF-XXX of NABARD for the year 2024-25,TE_RIDF_XXX_24_25_34 Construction of Pratapgarh Tea Estate Line Road under Pratapgarh Tea Estate under RIDF-XXX of NABARD for the year 2024-25,Works,Open Tender,Item Rate,Civil Works – Roads,No,No,NA ,24-Sep-2024 06:00 PM,30-Sep-2024 12:00 PM ,180.0,No ,No,Online,09-Oct-2024 02:30 PM,Public Works Roads Department,Biswanath,784176.0,2.0,"99,98,000",HANUMAN INFRA WORKS,"8,998,200",Accepted-AOC,27-Mar-2025,Public Works Roads Department
2024_PWD_39143_73,"CE/DEV/TB/213/2024-25/01 Dtd. Guwahati, 05th September, 2024",TE_RIDF_XXX_24_25_26 Construction of Dhulli Tea Estate Line Road under Dhulli Tea Estate under RIDF-XXX of NABARD for the year 2024-25,TE_RIDF_XXX_24_25_26 Construction of Dhulli Tea Estate Line Road under Dhulli Tea Estate under RIDF-XXX of NABARD for the year 2024-25,Works,Open Tender,Item Rate,Civil Works – Roads,No,No,NA ,25-Sep-2024 01:00 PM,30-Sep-2024 12:00 PM ,180.0,No ,No,Online,09-Oct-2024 02:30 PM,Public Works Roads Department,Biswanath,784177.0,2.0,"99,99,000",HANUMAN INFRA WORKS,"8,999,100",Accepted-AOC,27-Mar-2025,Public Works Roads Department
2024_PWD_39253_1,No. CE/DEV/TB/45/2024-25/13,MMUPPNA_RIDF_XXX_24_25_165 Improvement of road from Maizgram Bazar to Pathu High School under Mukhya Mantrir Unnoto Pakipath Nirman Achani for the year 2024-25 of Karimganj District (North Karimganj LAC).,MMUPPNA_RIDF_XXX_24_25_165 Improvement of road from Maizgram Bazar to Pathu High School under Mukhya Mantrir Unnoto Pakipath Nirman Achani for the year 2024-25 of Karimganj District (North Karimganj LAC).,Works,Open Tender,Item Rate,Civil Works,No,No,NA ,25-Sep-2024 05:00 PM,07-Oct-2024 12:00 PM ,180.0,No ,No,Online,15-Oct-2024 02:30 PM,Public Works Roads Department,Karimganj,781003.0,2.0,"3,32,88,000",SAMSUL HOQUE CHOUDHURY,"29,959,200",Rejected-Finance,25-Mar-2025,Public Works Roads Department
2024_PWD_39253_2,No. CE/DEV/TB/45/2024-25/13,MMUPPNA_RIDF_XXX_24_25_166 Improvement of road from L.C. Road at Kathakhal to Aylabari under Mukhya Mantrir Unnoto Pakipath Nirman Achani for the year 2024-25 of Karimganj District (North Karimganj LAC),MMUPPNA_RIDF_XXX_24_25_166 Improvement of road from L.C. Road at Kathakhal to Aylabari under Mukhya Mantrir Unnoto Pakipath Nirman Achani for the year 2024-25 of Karimganj District (North Karimganj LAC),Works,Open Tender,Item Rate,Civil Works,No,No,NA ,25-Sep-2024 05:00 PM,07-Oct-2024 12:00 PM ,180.0,No ,No,Online,15-Oct-2024 02:30 PM,Public Works Roads Department,Karimganj,781003.0,2.0,"2,90,58,000",NANDAN DAS,"26,152,200",Rejected-Finance,27-Mar-2025,Public Works Roads Department
2024_PWD_39253_5,No. CE/DEV/TB/45/2024-25/13,MMUPPNA_RIDF_XXX_24_25_169 Upgradation of road from Manipur (Near Nagacherra) to Jhalnacherra under Mukhya Mantrir Unnoto Pakipath Nirman Aachani (MMUPPNA) under RIDF-XXX of NABARD for the year 2024-25,MMUPPNA_RIDF_XXX_24_25_169 Upgradation of road from Manipur (Near Nagacherra) to Jhalnacherra under Mukhya Mantrir Unnoto Pakipath Nirman Aachani (MMUPPNA) under RIDF-XXX of NABARD for the year 2024-25,Works,Open Tender,Item Rate,Civil Works,No,No,NA ,25-Sep-2024 05:00 PM,07-Oct-2024 12:00 PM ,180.0,No ,No,Online,15-Oct-2024 02:30 PM,Public Works Roads Department,Hailakandi,781003.0,2.0,"4,99,52,000",SKYLINE ENTERPRISE,"44,956,800",Rejected-Finance,17-Mar-2025,Public Works Roads Department
2024_PWD_39340_5,CE/STBR/RIDF-XXX/NIT/28/2024 25/6 Dated 10-09-2024,STBR/RIDF-XXX/Mandia/02 Construction of RCC Bridge No. 1/1 and 2/2 on Silochi Pathar Tiniali to Niz Baghbar under MMUPPNA under RIDF-XXX of NABARD for the year 2024-25,STBR/RIDF-XXX/Mandia/02 Construction of RCC Bridge No. 1/1 and 2/2 on Silochi Pathar Tiniali to Niz Baghbar under MMUPPNA under RIDF-XXX of NABARD for the year 2024-25,Works,Open Tender,Item Rate,Civil Works – Roads,No,No,NA ,26-Sep-2024 06:00 PM,NA ,180.0,No ,No,Online,19-Oct-2024 11:00 AM,Public Works Roads Department,Mandia,781308.0,2.0,"3,43,38,500",PRADIPTA CHOUDHURY,"30,904,650",Rejected-AOC,29-Mar-2025,Public Works Roads Department
2024_PWD_39340_6,CE/STBR/RIDF-XXX/NIT/28/2024 25/6 Dated 10-09-2024,STBR/RIDF-XXX/Bilasipara/01 Construction of RCC Br.No.1/1 on Lakhiganj to Kamakhya Mandir road via Borai Bari under Mukhya Mantrir Unnoto Pakipath Nirman Achani (MMUPPNA) under RIDF-XXX of NABARD for the year 2024-25 under Bilasipara LAC,STBR/RIDF-XXX/Bilasipara/01 Construction of RCC Br.No.1/1 on Lakhiganj to Kamakhya Mandir road via Borai Bari under Mukhya Mantrir Unnoto Pakipath Nirman Achani (MMUPPNA) under RIDF-XXX of NABARD for the year 2024-25 under Bilasipara LAC,Works,Open Tender,Item Rate,Civil Works – Roads,No,No,NA ,26-Sep-2024 06:00 PM,NA ,180.0,No ,No,Online,19-Oct-2024 11:00 AM,Public Works Roads Department,Bilasipara,783348.0,2.0,"3,07,82,000",Suniti Construction Private Limited,"27,703,800",Rejected-AOC,24-Mar-2025,Public Works Roads Department
2024_PWD_39340_7,CE/STBR/RIDF-XXX/NIT/28/2024 25/6 Dated 10-09-2024,STBR/RIDF-XXX/Bilasipara/02 Construction of RCC Br.No.4/1 on Udmari to Salkocha Road under Mukhya Mantrir Unnoto Pakipath Nirman Achani (MMUPPNA) under RIDF-XXX of NABARD for the year 2024-25 under Bilasipara LAC,STBR/RIDF-XXX/Bilasipara/02 Construction of RCC Br.No.4/1 on Udmari to Salkocha Road under Mukhya Mantrir Unnoto Pakipath Nirman Achani (MMUPPNA) under RIDF-XXX of NABARD for the year 2024-25 under Bilasipara LAC,Works,Open Tender,Item Rate,Civil Works – Roads,No,No,NA ,26-Sep-2024 06:00 PM,NA ,180.0,No ,No,Online,19-Oct-2024 11:00 AM,Public Works Roads Department,Bilasipara,783348.0,2.0,"3,87,61,000",Dhaneswar Kalita,"34,884,900",Rejected-AOC,12-Mar-2025,Public Works Roads Department
2024_PWD_39454_1,CE/CW/17/2024-25Maligaon to Brahmaputra,Maligaon to river Brahmaputra,Construction of Storm water cover drain from Maligaon to river Brahmaputra under SOPD-G for the year 2024-25,Works,Open Tender,Item Rate,Civil Works – Roads,No,No,NA ,30-Sep-2024 09:00 AM,NA ,180.0,No ,No,Online,08-Oct-2024 02:30 PM,Public Works Roads Department,Jalukbari,781014.0,2.0,"7,37,57,800",RICHCON ENGINEERING COMPANY,"73,757,800",Accepted-AOC,18-Mar-2025,Public Works Roads Department
2024_PWD_39700_21,CE/MAINT/RIDF-XXX/TE/01/24-25,Maint/RIDF/TE/2024-25/21,"Construction of Neghreting Kali Mandir to Jurbari, Neghreting Shivdol to 12 No LP School connecting Road from of Neghreting Tea Estate under Bokakhat and Dergaon Territorial Road Division of Dergaon LAC",Works,Open Tender,Item Rate,Civil Works – Roads,No,No,NA ,07-Oct-2024 09:00 AM,07-Oct-2024 12:00 PM ,180.0,No ,No,Online,25-Oct-2024 03:00 PM,Public Works Roads Department,Dergaon,785614.0,2.0,"99,99,000",DHIREN KUTUM,"8,999,100",Rejected-Finance,24-Mar-2025,Public Works Roads Department
2024_PWD_39704_1,SE/MRC/TB/NIT/01/2023-24/17,Package No. MRC/TAC/2024-25/04 (Gr-XIII),"1.Bitupan Dewri house to Santiram Dewri house at Ramjangati, 2.Namghar Chariali to Jayanta Konwar house at Katahguri, 3.Gandhibori Ramjangati PWD road to Biren Deka house at Pub",Works,Open Tender,Item Rate,Civil Works – Roads,No,No,NA ,07-Oct-2024 10:00 AM,NA ,180.0,No ,No,Online,16-Oct-2024 10:00 AM,Public Works Roads Department||CE PWD(R) - PWD,Morigaon,782105.0,2.0,"88,45,600",KISHORE KUMAR BEZBARUAH,"8,845,597",Accepted-AOC,24-Mar-2025,Public Works Roads Department||CE PWD(R) - PWD
2024_PWD_39721_1,SE/MRC/TB/NIT/01/2023-24/17,Package No.MRC/TAC/2024-25/06 (Gr-VIII),1.Sarubori PWD road to Ghuran Das house via Bishnu Bordoloi house 2.North East Flood Relief camp to Joyful Bordoloi house via Amrit Bordoloi house at Bhalukaguri 3.Dhineswar Patar house to Gopal Patar house via Babul Bordoloi house via Mukundra Patar,Works,Open Tender,Item Rate,Civil Works – Roads,No,No,NA ,07-Oct-2024 10:00 AM,NA ,180.0,No ,No,Online,16-Oct-2024 10:00 AM,Public Works Roads Department||CE PWD(R) - PWD,Morigaon,782105.0,2.0,"73,68,000",SRI BUBUL KONWAR,"7,367,673",Rejected-Finance,24-Mar-2025,Public Works Roads Department||CE PWD(R) - PWD
2024_PWD_39820_218,"CE/DEV/TB/213/2024-25/04 Dtd. Guwahati, 20th September, 2024",TE_RIDF_XXX_24_25_358 Construction of (1) Gatonga 24 No line to Nadipar (GatangaT.E.) (2) Gatanga Hospital Road. (Gatanga T.E.) (3) Bamunibari Masjid Path(Bamunbari T.E.) (4) Bamunibari Staff Line Rd. (Bamunibari T.E.) under RIDF XXX for the year 202,TE_RIDF_XXX_24_25_358 Construction of (1) Gatonga 24 No line to Nadipar (GatangaT.E.) (2) Gatanga Hospital Road. (Gatanga T.E.) (3) Bamunibari Masjid Path(Bamunbari T.E.) (4) Bamunibari Staff Line Rd. (Bamunibari T.E.) under RIDF XXX for the year 202,Works,Open Tender,Item Rate,Civil Works – Roads,No,No,NA ,21-Oct-2024 12:30 PM,22-Oct-2024 12:00 PM ,180.0,No ,No,Online,30-Oct-2024 02:30 PM,Public Works Roads Department,Jorhat,785630.0,2.0,"92,05,000",BHASKAR JYOTI GOGOI,"8,284,500",Accepted-AOC,29-Mar-2025,Public Works Roads Department
2024_PWD_39820_220,"CE/DEV/TB/213/2024-25/04 Dtd. Guwahati, 20th September, 2024","TE_RIDF_XXX_24_25_365 Construction of (1) Ratanpur Line Rd and Ratanpur Line No. 3 (PanbariT.E.) ,(2) Pabari T.E Borline Path (Pabari T.E.), (3) Ratanpur Ganju Line(PanbariT.E.) ,(4)Kathiabari Line.( PanbariT.E.) under RIDF XXX for the year 2024-25","TE_RIDF_XXX_24_25_365 Construction of (1) Ratanpur Line Rd and Ratanpur Line No. 3 (PanbariT.E.) ,(2) Pabari T.E Borline Path (Pabari T.E.), (3) Ratanpur Ganju Line(PanbariT.E.) ,(4)Kathiabari Line.( PanbariT.E.) under RIDF XXX for the year 2024-25",Works,Open Tender,Item Rate,Civil Works – Roads,No,No,NA ,21-Oct-2024 12:40 PM,22-Oct-2024 12:00 PM ,180.0,No ,No,Online,30-Oct-2024 02:30 PM,Public Works Roads Department,Jorhat,785630.0,2.0,"1,57,69,000",Amal Hazarika,"14,192,100",Accepted-AOC,29-Mar-2025,Public Works Roads Department
2024_PWD_40106_1,CE/STBR/RIDF-XXX/NIT/28/2024 25/15 Dated 24-10-2024,STBR/RIDF-XXX/Mankachar/02 Construction of Road cum Bund from Tengnamari to Hazirhat via Khopatia Bazar under Mukhya Mantrir Unnoto Paki Path Nirman Achani (MMUPPNA) under RIDF-XXX of NABARD for the year 2024-25,STBR/RIDF-XXX/Mankachar/02 Construction of Road cum Bund from Tengnamari to Hazirhat via Khopatia Bazar under Mukhya Mantrir Unnoto Paki Path Nirman Achani (MMUPPNA) under RIDF-XXX of NABARD for the year 2024-25,Works,Open Tender,Item Rate,Civil Works – Roads,No,No,NA ,28-Oct-2024 04:00 PM,NA ,180.0,No ,No,Online,04-Nov-2024 03:00 PM,Public Works Roads Department,Mankachar,783131.0,2.0,"5,27,19,000",Foyzal Hoque,"47,447,100",Accepted-AOC,05-Mar-2025,Public Works Roads Department
2024_PWD_40216_1,CE/STBR/ RIDF-XXX/NIT/28/2024-25/17 Dtd. 30 - 10 - 2024,STBR/RIDF-XXX/Mandia/01 Widening and Strengthening of road from (1) Howly Jania Road and (2) Kalgachia-Karekur Parghat via Amguri under MMUPPNA under RIDF-XXX of NABARD for the year 2024-25,STBR/RIDF-XXX/Mandia/01 Widening and Strengthening of road from (1) Howly Jania Road and (2) Kalgachia-Karekur Parghat via Amguri under MMUPPNA under RIDF-XXX of NABARD for the year 2024-25,Works,Open Tender,Item Rate,Civil Works – Roads,No,No,NA ,05-Nov-2024 02:00 PM,NA ,180.0,No ,No,Online,12-Nov-2024 11:00 AM,Public Works Roads Department,Mandia,781308.0,2.0,"6,46,86,700",M/S Royal Smart Construction,"58,218,030",Rejected-Technical,12-Mar-2025,Public Works Roads Department
2024_PWD_40276_1,"CE/DEV/TB/45/2024-25/23 Dtd. Guwahati, 04th November, 2024.",MMUPPNA_RIDF_XXX_24_25_53 Improvement of Hojai Jugijan Road (From Ch. 0.00M to Ch. 7020.00M) Under Mukhya Mantrir Unnoto Pakipath Nirman Aachani (MMUPPNA) under RIDF-XXX of NABARD for the year 2024-25,MMUPPNA_RIDF_XXX_24_25_53 Improvement of Hojai Jugijan Road (From Ch. 0.00M to Ch. 7020.00M) Under Mukhya Mantrir Unnoto Pakipath Nirman Aachani (MMUPPNA) under RIDF-XXX of NABARD for the year 2024-25,Works,Open Tender,Item Rate,Civil Works – Roads,No,No,NA ,09-Nov-2024 05:00 PM,11-Nov-2024 12:00 PM ,180.0,No ,No,Online,16-Nov-2024 02:30 PM,Public Works Roads Department,Hojai,782435.0,2.0,"9,89,12,000",MS TRIRANV ASSOCIATES,"89,020,800",Accepted-AOC,20-Mar-2025,Public Works Roads Department
2024_PWD_40276_4,"CE/DEV/TB/45/2024-25/23 Dtd. Guwahati, 04th November, 2024.",MMUPPNA_RIDF_XXX_24_25_135 Improvement of road from Kayasthagran Singaria Road (Part-1 from Ch. 2300.00m to Ch. 6600.00m and Part-II from Ch. 0.00m to Ch. 1000.00m)under Mukhya Mantrir Unnoto Pakipath Nirman Aachani (MMUPPNA) under RIDF-XXX of NABARD,MMUPPNA_RIDF_XXX_24_25_135 Improvement of road from Kayasthagran Singaria Road (Part-1 from Ch. 2300.00m to Ch. 6600.00m and Part-II from Ch. 0.00m to Ch. 1000.00m)under Mukhya Mantrir Unnoto Pakipath Nirman Aachani (MMUPPNA) under RIDF-XXX of NABARD,Works,Open Tender,Item Rate,Civil Works – Roads,No,No,NA ,09-Nov-2024 05:00 PM,11-Nov-2024 12:00 PM ,180.0,No ,No,Online,16-Nov-2024 02:30 PM,Public Works Roads Department,Karimganj,788710.0,2.0,"6,67,08,000",GLOBAL CONSTRUCTION,"66,686,652",Accepted-AOC,21-Mar-2025,Public Works Roads Department
2024_PWD_40276_5,"CE/DEV/TB/45/2024-25/23 Dtd. Guwahati, 04th November, 2024.",MMUPPNA_RIDF_XXX_24_25_159 Construction of road from Dimlaplar Chowk to Salmara villageunder Mukhya Mantrir Unnoto Pakipath Nirman Aachani (MMUPPNA) under RIDF-XXX of NABARD for the year 2024-25,MMUPPNA_RIDF_XXX_24_25_159 Construction of road from Dimlaplar Chowk to Salmara villageunder Mukhya Mantrir Unnoto Pakipath Nirman Aachani (MMUPPNA) under RIDF-XXX of NABARD for the year 2024-25,Works,Open Tender,Item Rate,Civil Works – Roads,No,No,NA ,09-Nov-2024 05:30 PM,11-Nov-2024 12:00 PM ,180.0,No ,No,Online,16-Nov-2024 02:30 PM,Public Works Roads Department,Baksa,781367.0,2.0,"1,80,84,000",MAINUL HAQUE CHOUDHURY,"16,275,600",Rejected-AOC,29-Mar-2025,Public Works Roads Department
2024_PWD_40276_9,"CE/DEV/TB/45/2024-25/23 Dtd. Guwahati, 04th November, 2024.",MMUPPNA_RIDF_XXX_24_25_179 Widening of N.H-27 Kadamtala to Ronakuchi (Tihu Barama link road) (Ch. 0.00 m to 3400.00m) under Mukhya Mantri Unnata Paki Path Nirman Aachani for the year 2024-25,MMUPPNA_RIDF_XXX_24_25_179 Widening of N.H-27 Kadamtala to Ronakuchi (Tihu Barama link road) (Ch. 0.00 m to 3400.00m) under Mukhya Mantri Unnata Paki Path Nirman Aachani for the year 2024-25,Works,Open Tender,Item Rate,Civil Works – Roads,No,No,NA ,09-Nov-2024 05:35 PM,11-Nov-2024 12:00 PM ,180.0,No ,No,Online,16-Nov-2024 02:30 PM,Public Works Roads Department,Baksa,781346.0,2.0,"3,86,91,000",Sri Hiten Deka,"34,821,900",Rejected-Finance,29-Mar-2025,Public Works Roads Department
2024_PWD_40302_1,SE/MRC/TB/NIT/01/2023-24/33,Package No. MRC/TAC/2024-25/04 (Gr-IV),(1) Construcrtion of RCC Foot Bridge with Sand Gravel at the Kacharigaon Road via Sonibazar to Jamunala (2) Construction of C C block (Paver block) from Mamoriya Samabay road at Mamoriya,Works,Open Tender,Item Rate,Civil Works – Roads,No,No,NA ,12-Nov-2024 12:00 PM,NA ,180.0,No ,No,Online,16-Nov-2024 03:00 PM,Public Works Roads Department||CE PWD(R) - PWD,Morigaon,782105.0,2.0,"49,12,000",Rubul Mudoi,"4,911,000",Accepted-AOC,25-Mar-2025,Public Works Roads Department||CE PWD(R) - PWD
