2025_BTC_44231_1,ACE-35/TECH/UDL(RB)/IFB/18-19,"Construction of Boundary Wall, Iron gate and Repairing of Roof at Shekher Sankardev Mission H.S. School, Dimakuchi in Udalguri District. TN_64_2_R","Construction of Boundary Wall, Iron gate and Repairing of Roof at Shekher Sankardev Mission H.S. School, Dimakuchi in Udalguri District.",Works,Open Tender,Item Rate,Civil Works - Building,No,No,NA ,07-May-2025 10:00 AM,NA ,180.0,No ,No,Online,27-May-2025 03:00 PM,Bodoland Territorial Council-PWD||Director Cum CHD - PWD BTC,Udalguri,784509.0,2.0,"35,00,000",PANKAJ BARO,"3,499,910",Rejected-AOC,17-Jun-2025,Bodoland Territorial Council-PWD||Director Cum CHD - PWD BTC
2024_PWD_41308_17,"CE/DEV/TB/213/2024-25/19 Dtd. Guwahati, 11th December, 2024.","TE_RIDF_XXX_24_25_289 Improvement of New Sonowal TE, Hunwal TE and Nagadhali TE Labour Lines under RIDF-XXX of NABARD for the year 2024-25","TE_RIDF_XXX_24_25_289 Improvement of New Sonowal TE, Hunwal TE and Nagadhali TE Labour Lines under RIDF-XXX of NABARD for the year 2024-25",Works,Open Tender,Item Rate,Civil Works – Roads,No,No,NA ,17-Dec-2024 01:55 PM,17-Dec-2024 02:00 PM ,180.0,No ,No,Online,23-Dec-2024 02:30 PM,Public Works Roads Department,Jorhat,785001.0,2.0,"1,86,79,000",RUPANJAL BORBORUAH,"16,811,100",Rejected-Finance,04-Jun-2025,Public Works Roads Department
2024_ICD_37701_1,APL/CnP/Civil/2024-25/310,Construction of new boundary wall running parallel to,"Construction of new boundary wall running parallel to Dhodar Ali(APWD road) from Gate No-1 to towards Sonari Tinali (Phase-I) at APL , Namrup",Works,Open Tender,Item Rate,Civil Works - Water Works,No,No,NA ,22-Jun-2024 10:00 AM,NA ,180.0,No ,No,Online,12-Jul-2024 03:00 PM,Industries and Commerce Department||Assam Petro-Chemicals Ltd.||Head office Namrup||Materials Management Department,Assam Petrochemicals Limited,786623.0,2.0,,SHRI NITU SONOWAL,"6,482,842.48",Rejected-Finance,17-Jun-2025,Industries and Commerce Department||Assam Petro-Chemicals Ltd.||Head office Namrup||Materials Management Department
2025_GMDA_43965_1,GMDA/DEV/34/2025/2,Illumination of Metal Art Installation at Bhangagarh and B. Baruah Road and illumination of Ulubari Flyover and Bhangagarh Flyover,Illumination of Metal Art Installation at Bhangagarh and B. Baruah Road and illumination of Ulubari Flyover and Bhangagarh Flyover,Works,Open Tender,Item Rate,Electrical Works,No,No,NA ,04-Apr-2025 03:45 PM,NA ,180.0,No ,No,Online,25-Apr-2025 03:00 PM,Guwahati Metropolitan Development Authority||Guwahati Development Department - GMDA,Ulubari and Bhangagarh,781005.0,2.0,"35,28,941",SUMIT CHACHAN,"3,518,941",Rejected-Finance,06-Jun-2025,Guwahati Metropolitan Development Authority||Guwahati Development Department - GMDA
2024_PWD_39820_56,"CE/DEV/TB/213/2024-25/04 Dtd. Guwahati, 20th September, 2024",TE_RIDF_XXX_24_25_279 Construction of Gabhoru TE Pahar Line (Munda Line) and Boisahabi Purna Line road under RIDF-XXX of NABARD for the year 2024-25,TE_RIDF_XXX_24_25_279 Construction of Gabhoru TE Pahar Line (Munda Line) and Boisahabi Purna Line road under RIDF-XXX of NABARD for the year 2024-25,Works,Open Tender,Item Rate,Civil Works – Roads,No,No,NA ,14-Oct-2024 05:00 PM,22-Oct-2024 12:00 PM ,180.0,No ,No,Online,30-Oct-2024 02:30 PM,Public Works Roads Department,Mariani,785634.0,2.0,"1,41,26,000",Sandeep Dugar,"14,121,000",Rejected-Finance,30-Jun-2025,Public Works Roads Department
2025_PWBNH_42546_1,SE/BII/SJN_HOMOEOPATHIC,"Construction and Vertical extension above the 2nd floor of the Administrative Building of S.J.N. Homoeopathic Medical College and Hospital, Guwahati-37","Construction and Vertical extension above the 2nd floor of the Administrative Building of S.J.N. Homoeopathic Medical College and Hospital, Guwahati-37",Works,Open Tender,Item Wise,Civil Works - Building,No,No,NA ,07-Feb-2025 12:00 PM,10-Feb-2025 12:00 PM ,180.0,No ,No,Online,28-Feb-2025 04:30 PM,Public Works Building and NH Department||Chief Engineer-Building - PWBNH||SE-Guwahati Circle-2 - PWBNH,"Panjabari, Guwahati",781037.0,2.0,"1,81,66,747",Sri Rajdeep Bezbaruah,"15,442,620",Rejected-AOC,10-Jun-2025,Public Works Building and NH Department||Chief Engineer-Building - PWBNH||SE-Guwahati Circle-2 - PWBNH
2024_PWD_39700_12,CE/MAINT/RIDF-XXX/TE/01/24-25,Maint/RIDF/TE/2024-25/12,Construction of NH-37 to Borjuri Maj line and Five Bye lane of Methoni T.E. under RIDF-XXX of NABARD for the Year 2024-25 under Bokakhat and Dergaon Territorial Road Division of Bokakhat LAC,Works,Open Tender,Item Rate,Civil Works – Roads,No,No,NA ,07-Oct-2024 09:00 AM,07-Oct-2024 12:00 PM ,180.0,No ,No,Online,25-Oct-2024 03:00 PM,Public Works Roads Department,Bokakhat,785612.0,2.0,"99,71,000",Umananda Thakur,"8,973,900",Rejected-Finance,04-Jun-2025,Public Works Roads Department
2024_PWD_39820_81,"CE/DEV/TB/213/2024-25/04 Dtd. Guwahati, 20th September, 2024",TE_RIDF_XXX_24_25_275 Improvement of Tea Garden Roads at (i) Lepetkata TE (Length 1.37 Km) (ii) Jamirah Te (Length -1.37 Km) and(iii) Borbarua TE (Length - 1.60 Km) under RIDF-XXX for the year 2024-25,TE_RIDF_XXX_24_25_275 Improvement of Tea Garden Roads at (i) Lepetkata TE (Length 1.37 Km) (ii) Jamirah Te (Length -1.37 Km) and(iii) Borbarua TE (Length - 1.60 Km) under RIDF-XXX for the year 2024-25,Works,Open Tender,Item Rate,Civil Works – Roads,No,No,NA ,15-Oct-2024 10:00 AM,22-Oct-2024 12:00 PM ,180.0,No ,No,Online,30-Oct-2024 02:30 PM,Public Works Roads Department,Dibrugarh,785669.0,2.0,"2,99,90,000",KAJAL HORE,"29,994,126",Accepted-AOC,02-Jun-2025,Public Works Roads Department
2024_PWD_39820_95,"CE/DEV/TB/213/2024-25/04 Dtd. Guwahati, 20th September, 2024",TE_RIDF_XXX_24_25_285 Construction of Lahing TE Link road and TBN to Tirual TE Market connecting road under RIDF-XXX of NABARD for the year 2024-25,TE_RIDF_XXX_24_25_285 Construction of Lahing TE Link road and TBN to Tirual TE Market connecting road under RIDF-XXX of NABARD for the year 2024-25,Works,Open Tender,Item Rate,Civil Works – Roads,No,No,NA ,15-Oct-2024 12:00 PM,22-Oct-2024 12:00 PM ,180.0,No ,No,Online,30-Oct-2024 02:30 PM,Public Works Roads Department,Mariani,785634.0,2.0,"1,32,00,000",MOON DAS,"13,191,000",Rejected-Finance,30-Jun-2025,Public Works Roads Department
2025_UDD_43944_1,DMC/TECH/MFF-SWD/POCLN.BRG/583,Operation and Maintenance of Existing Inventories for Super Sucker Machineries,Operation and Maintenance of Existing Inventories for Super Sucker Machineries,Works,Open Tender,Works,Civil Works,No,No,NA ,02-Apr-2025 06:00 PM,NA ,180.0,No ,No,Online,23-Apr-2025 03:00 PM,Urban Development Department||Directorate of Municipality Administration - UDD||Dibrugarh Municipal Board,Dibrugarh,786001.0,2.0,,Manan Enterprises,"2,754",Accepted-AOC,03-Jun-2025,Urban Development Department||Directorate of Municipality Administration - UDD||Dibrugarh Municipal Board
2025_WREAP_42423_1,WRD/ADB/OCB-Goods/14,"G-23 Supply of Geo-bags Type-C and Sewing Thread for additional high priority works in Lakhimpur (Dhakuwakhana, Bonpuroi), Biswanath and Sonitpur Districts LOT 1","G-23 Supply of Geo-bags Type-C and Sewing Thread for additional high priority works in Lakhimpur (Dhakuwakhana, Bonpuroi), Biswanath and Sonitpur Districts LOT 1",Goods,Open Tender,Supply,Supply of Materials,Yes,No,NA ,30-Jan-2025 06:30 PM,13-Feb-2025 02:00 PM ,120.0,No ,No,Online,04-Mar-2025 04:30 PM,Department of Water Resources-Externally Aided Project||WRD-ADB Funded Procurements,LAKHIMPUR,787001.0,2.0,,SKAPS INDIA USA JV,"457,293,933.2",Accepted-AOC,23-Jun-2025,Department of Water Resources-Externally Aided Project||WRD-ADB Funded Procurements
2025_AAU_43913_1,Normal/2024/17238 dtd 02-04-25,"Retrofitting works of DEE building at AAU, Jorhat","Civil retrofitting works of DEE building at AAU, Jorhat",Works,Open Tender,Percentage,Civil Works - Building,No,No,NA ,02-Apr-2025 11:00 AM,10-Apr-2025 11:30 AM ,180.0,No ,No,Online,10-May-2025 03:00 PM,Assam Agricultural University||Directorate of Physical Plants,"AAU, Jorhat",785013.0,2.0,"99,95,986",DIPAK SAIKIA,"8,186,713",Rejected-AOC,20-Jun-2025,Assam Agricultural University||Directorate of Physical Plants
2025_PWD_44111_1,ACEH/TECH/CS/21/2024-25/11 Dated Haflong the 17th April 2025,Construction of Teachers Quarter at Kasturba Gandhi Balika Vidyalaya (UDISE 18200104902),Construction of Teachers Quarter at Kasturba Gandhi Balika Vidyalaya (UDISE 18200104902),Works,Open Tender,Item Rate,Civil Works - Building,No,No,NA ,23-Apr-2025 10:00 AM,24-Apr-2025 11:00 AM ,180.0,No ,No,Online,06-May-2025 03:00 PM,Public Works Roads Department,Dima Hasao,788107.0,2.0,"1,19,74,896",David Phonglo,"11,974,500",Accepted-AOC,30-Jun-2025,Public Works Roads Department
2024_PWD_39820_221,"CE/DEV/TB/213/2024-25/04 Dtd. Guwahati, 20th September, 2024",TE_RIDF_XXX_24_25_382 Construction of Road under Cossipore Tea Garden (From main Road Cossipore Factory to Digar Cossipore Nach Ghar (Ph-II) under RIDF-XXX of NABARD for the year 2024-25.,TE_RIDF_XXX_24_25_382 Construction of Road under Cossipore Tea Garden (From main Road Cossipore Factory to Digar Cossipore Nach Ghar (Ph-II) under RIDF-XXX of NABARD for the year 2024-25.,Works,Open Tender,Item Rate,Civil Works – Roads,No,No,NA ,21-Oct-2024 12:45 PM,22-Oct-2024 12:00 PM ,180.0,No ,No,Online,30-Oct-2024 02:30 PM,Public Works Roads Department,Cachar,788030.0,2.0,"1,00,00,000",JOYDEB DAS,"9,990,001",Not Admitted-Fee/PreQual/Technical,21-Jun-2025,Public Works Roads Department
2023_NHM_31602_7,NHM-32023/469/2022-CONS-NHM/92,Construction of Buildingless Sub Health Centre in Murgapur SC in Karimganj District for FY 2022 23 under PM AHBIM on Turnkey Basis,Construction of Buildingless Sub Health Centre in Murgapur SC in Karimganj District for FY 2022 23 under PM AHBIM on Turnkey Basis,Works,Open Tender,Turn-key,Civil Works - Building,No,No,NA ,10-Jul-2023 05:00 PM,NA ,180.0,No ,No,Online,29-Jul-2023 03:30 PM,National Health Mission||State Programme Management Unit - NHM,Karimganj,788710.0,2.0,"52,03,000",M/S A K ENTERPRISE,"5,192,594",Rejected-Finance,02-Jun-2025,National Health Mission||State Programme Management Unit - NHM
2025_AGIHF_44334_1,AGIHF/RFB/SUPPLY/2025-26/002,SUPPLY OF INTEGRATED MOTOR UNITS AND ACCESSORIES,SUPPLY OF INTEGRATED MOTOR UNITS AND ACCESSORIES,Goods,Open Tender,Supply,Electronics Equipment,No,No,NA ,17-May-2025 11:00 AM,23-May-2025 11:00 AM ,120.0,No ,No,Online,12-Jun-2025 04:00 PM,Assam Government IITG Healthcare Foundation,AGIHF,781039.0,2.0,,Daimer Industrial Solutions,"8,389,401.38",Accepted-AOC,30-Jun-2025,Assam Government IITG Healthcare Foundation
2024_BoTC_41220_1,CHD-62/15th FC/tied/2nd Inst./22-23,"Const. of additional works of Unloading Ramp, Roof Shed, ICBP road, Beautification and Misc works at FSTP Paroura Kokrajhar Under Tied Grant (2nd Installment) for the year 2022-23 during 2024-25 under the Award of 15th FC","Const. of additional works of Unloading Ramp, Roof Shed, ICBP road, Beautification and Misc works at FSTP Paroura Kokrajhar Under Tied Grant (2nd Installment) for the year 2022-23 during 2024-25 under the Award of 15th FC.",Works,Open Tender,Works,Civil Works,No,No,NA ,14-Dec-2024 10:00 AM,NA ,180.0,No ,No,Online,30-Dec-2024 04:00 PM,Bodoland Territorial Council||Urban Development Town and Country Planning-BTC,Kokrajhar,783370.0,2.0,"20,00,000",M/S. DWIMWILU ENTERPRISE,"1,999,600",Accepted-AOC,03-Jun-2025,Bodoland Territorial Council||Urban Development Town and Country Planning-BTC
2024_PWBNH_40615_1,EE/NKTBD_Concertina Wire Fencing_Law University,"Installation of Concertina Wire Fencing at Existing Boundary Wall at National Law University and Judicial Academy, Assam, Amingaon. (Main Campus and Residential Campus)","Installation of Concertina Wire Fencing at Existing Boundary Wall at National Law University and Judicial Academy, Assam, Amingaon. (Main Campus and Residential Campus)",Works,Open Tender,Item Wise,Civil Works - Building,No,No,NA ,26-Nov-2024 06:55 PM,27-Nov-2024 12:00 PM ,180.0,No ,No,Online,18-Dec-2024 11:30 AM,Public Works Building and NH Department||Chief Engineer-Building - PWBNH,Amingaon Guwahati,781031.0,2.0,"37,73,162",SRI PRABIN KALITA,"3,961,714",Rejected-Technical,30-May-2025,Public Works Building and NH Department||Chief Engineer-Building - PWBNH
2024_PWD_40729_14,CE/Maint/RIDF-XXX/TE/01/24_25_,Maint/RIDF/TE/2024-25/72,Maint/RIDF/TE/2024-25/72_Improvement of Bhuyankhat Bagisha Line 1 Bagisha Line 2 Bagisha Line 3 Bagisha Line No 4 AND Joboka TE Roads Mondir line Maj line Tin Line Upor line and Sonari Namtula Road to Khamlong under RIDF_XXX of NABARD for the year,Works,Open Tender,Item Rate,Civil Works – Roads,No,No,NA ,30-Nov-2024 09:00 AM,03-Dec-2024 12:00 PM ,180.0,No ,No,Online,20-Dec-2024 03:00 PM,Public Works Roads Department,Charaideo,781003.0,2.0,"1,28,36,000",MR HEMANTA DUWARAH,"12,836,000",Rejected-Finance,18-Jun-2025,Public Works Roads Department
2024_PWD_39211_12,CE/Comn9/RIDF-30/24-25/1_TGRd,TG/Lakhimpur/1,Construction of Road No 1 Cinnatolliah TE Factory to Seajuli PWD Road via Cinnatolliah Medical Line and Road No.2- Purona line to Factory line Road in Cinnatolliah Tea Estate Under RIDF-XXX of NABARD for the year 2024-25 of Lakhimpur LAC,Works,Open Tender,Item Rate,Civil Works – Roads,No,No,NA ,25-Sep-2024 06:00 PM,NA ,180.0,No ,No,Online,16-Oct-2024 11:00 AM,Public Works Roads Department||CE PWD(R) - PWD||Traffic Engineering Cell - PWD,Lakhimpur,787001.0,2.0,"99,97,000",SANJIB DAS,"8,997,300",Accepted-AOC,30-Jun-2025,Public Works Roads Department||CE PWD(R) - PWD||Traffic Engineering Cell - PWD
2025_PWD_43440_5,CE/DEV/TB/213/2024-25/23 Dtd. 07/03/2025,TE_RIDF_XXX_24_25_152 Improvement of Tea Garden roads in Kenduguri Tea Estate Road under RIDF-XXX of NABARD for the year 2024-25,TE_RIDF_XXX_24_25_152 Improvement of Tea Garden roads in Kenduguri Tea Estate Road under RIDF-XXX of NABARD for the year 2024-25,Works,Open Tender,Item Rate,Civil Works – Roads,No,No,NA ,12-Mar-2025 06:00 PM,15-Mar-2025 12:00 PM ,180.0,No ,No,Online,21-Mar-2025 02:30 PM,Public Works Roads Department,Tingkhong,786612.0,2.0,"1,00,00,000",SRI NIPUL KR BORTHAKUR,"10,000,000",Rejected-Finance,18-Jun-2025,Public Works Roads Department
2025_PWBNH_43937_1,CS/316/2024-2025,"Providing bamboo wall panels in the boundary wall for Govt. Residential Quarter No. M 21 at Ministers Colony, Dispur, Guwahati6","Providing bamboo wall panels in the boundary wall for Govt. Residential Quarter No. M 21 at Ministers Colony, Dispur, Guwahati6",Works,Open Tender,Item Rate,Civil Works - Building,No,No,NA ,05-Apr-2025 12:00 PM,17-Apr-2025 12:00 PM ,180.0,No ,No,Online,29-Apr-2025 02:00 PM,Public Works Building and NH Department||Chief Engineer-Building - PWBNH||SE-Guwahati Circle-1 - PWBNH||EE- PCC Division-Dispur - PWBNH,Dispur,781006.0,2.0,"49,94,544",M/S AK ENTERPRISE,"5,308,699",Rejected-AOC,26-Jun-2025,Public Works Building and NH Department||Chief Engineer-Building - PWBNH||SE-Guwahati Circle-1 - PWBNH||EE- PCC Division-Dispur - PWBNH
2025_DoWR_42438_1,GOLAGHAT/2024-25/RIDF-II/II,Protection measure works at Salmora Dhansiripar under Khumtai LAC of Golaghat District.,Protection measure works at Salmora Dhansiripar under Khumtai LAC of Golaghat District.,Works,Open Tender,Works,Civil Works,No,No,NA ,01-Feb-2025 06:30 PM,NA ,180.0,No ,No,Online,21-Feb-2025 03:00 PM,Department of Water Resources||Chief Engineer - DoWR,GOLAGHAT,785621.0,2.0,"3,46,80,273",NK AGARWALLA,"34,648,116.65",Rejected-AOC,25-Jun-2025,Department of Water Resources||Chief Engineer - DoWR
2025_PWBNH_43094_1,CE/TB-VII/116/2024/9,"Construction of Co-District Office (G Plus 4) at Mahmora, Charaideo District, Assam","Construction of Co-District Office (G Plus 4) at Mahmora, Charaideo District, Assam",Works,Open Tender,Item Rate,Civil Works - Building,No,No,NA ,24-Feb-2025 06:00 PM,25-Feb-2025 11:00 AM ,180.0,No ,No,Online,03-Mar-2025 03:00 PM,Public Works Building and NH Department||Chief Engineer-Building - PWBNH,Charaideo,785691.0,2.0,"17,39,21,368",M/s Pawan Communications Private Limited,"182,443,515",Accepted-AOC,21-Jun-2025,Public Works Building and NH Department||Chief Engineer-Building - PWBNH
2025_DoWR_42051_1,ACE (Mech) WR/G-17/ 2024/430,Repairing and Maintenance of 6(six) nos. Sluice Gates in Morigaon District under Guwahati Mechanical W.R. Division for the year 2024-25.,Repairing and Maintenance of 6(six) nos. Sluice Gates in Morigaon District under Guwahati Mechanical W.R. Division for the year 2024-25.,Works,Open Tender,Works,Civil Works,No,No,NA ,10-Jan-2025 06:35 PM,NA ,180.0,No ,No,Online,04-Feb-2025 03:00 PM,Department of Water Resources||Chief Engineer - DoWR,MORIGAON,782105.0,2.0,"39,35,531",M/S SHIVAM ENTERPRISE,"504,254",Accepted-AOC,21-Jun-2025,Department of Water Resources||Chief Engineer - DoWR
2025_DoWR_42812_1,TINSUKIA/2024-25/M and R/II,M and R to protect Budlabheta and its adjoining areas from the erosion of river Doomdoma for 2024-25.,M and R to protect Budlabheta and its adjoining areas from the erosion of river Doomdoma for 2024-25.,Works,Open Tender,Works,Civil Works,No,No,NA ,17-Feb-2025 06:30 PM,NA ,180.0,No ,No,Online,10-Mar-2025 03:00 PM,Department of Water Resources||Chief Engineer - DoWR,"At Budlabheta, Tinsukia",786151.0,2.0,"24,99,472",Ram Swarup Yadav,"2,497,778",Accepted-AOC,16-Jun-2025,Department of Water Resources||Chief Engineer - DoWR
2025_BoTC_44229_1,ACE/CHDI/10/2025/3,Re-Construction of LBC-7 of Champamati Irrigation Project (Major) and R.C.C. Canal of Choulmari Baragaon FIS at Kamardanga village under Contingency fund,Re-Construction of LBC-7 of Champamati Irrigation Project (Major) and R.C.C. Canal of Choulmari Baragaon FIS at Kamardanga village under Contingency fund,Works,Open Tender,Works,Civil Works,No,No,NA ,06-May-2025 09:00 AM,NA ,180.0,No ,No,Online,30-May-2025 03:30 PM,Bodoland Territorial Council||Irrigation-BTC,Sidli,783385.0,2.0,"1,65,84,668",ACHINTA NARZARY,"14,926,201.2",Accepted-AOC,23-Jun-2025,Bodoland Territorial Council||Irrigation-BTC
2024_PWD_39211_7,CE/Comn9/RIDF-30/24-25/1_TGRd,TG/Digboi/1,Construction of Road From Duarmora No.2 Line Reserve to Duarmora TE Factory Gate of Duarmora TE in the State of ASSAM under RIDF-XXX of NABARD for the year of 2024-25 of Digboi LAC,Works,Open Tender,Item Rate,Civil Works – Roads,No,No,NA ,25-Sep-2024 04:00 PM,NA ,180.0,No ,No,Online,16-Oct-2024 11:00 AM,Public Works Roads Department||CE PWD(R) - PWD||Traffic Engineering Cell - PWD,Digboi,786171.0,2.0,"99,66,100",SULABH DOHUTIA,"9,961,254",Accepted-AOC,10-Jun-2025,Public Works Roads Department||CE PWD(R) - PWD||Traffic Engineering Cell - PWD
2024_PWD_39211_13,CE/Comn9/RIDF-30/24-25/1_TGRd,TG/Margherita/ 02,Construction of road from NH 38 to Masa Gaon of Dehing T.E under RIDF-XXX for the year 2024-25 at Margherita LAC,Works,Open Tender,Item Rate,Civil Works – Roads,No,No,NA ,26-Sep-2024 09:00 AM,NA ,180.0,No ,No,Online,16-Oct-2024 11:00 AM,Public Works Roads Department||CE PWD(R) - PWD||Traffic Engineering Cell - PWD,Margherita,786171.0,2.0,"99,58,100",Kalyan Chetia,"8,962,290",Accepted-AOC,10-Jun-2025,Public Works Roads Department||CE PWD(R) - PWD||Traffic Engineering Cell - PWD
2025_PCCF_44141_1,FS/Tender/APFBC/2024-25/10,"Renovation of Existing Boys Hostel Building at Assam Forest School, Jalukbari","Renovation of Existing Boys Hostel Building at Assam Forest School, Jalukbari",Works,Open Tender,Percentage,Civil Works - Building,No,No,NA ,29-Apr-2025 10:00 AM,07-May-2025 01:00 PM ,120.0,No ,No,Online,20-May-2025 11:00 AM,Pr. Chief Conservator of Forest and Head of Forest Force||Research Education and Working Plans||Research and Education Circle||Assam Forest School,Jalukbari,781014.0,2.0,"31,63,000",DIGI PRINTERS,"2,846,700",Rejected-Technical,16-Jun-2025,Pr. Chief Conservator of Forest and Head of Forest Force||Research Education and Working Plans||Research and Education Circle||Assam Forest School
2025_PWBNH_43461_1,SE(B)/DIB/LHL-PHC/24-25/866,"Construction of Lahowal Block Primary Health Centre G Plus 1 at Lahowal, Dibrugarh with future provision of G PLUS 2","Construction of Lahowal Block Primary Health Centre G Plus 1 at Lahowal, Dibrugarh with future provision of G PLUS 2",Works,Open Tender,Item Rate,Civil Works - Building,No,No,NA ,13-Mar-2025 03:05 PM,18-Mar-2025 11:00 AM ,180.0,No ,No,Online,29-Mar-2025 03:00 PM,Public Works Building and NH Department||Chief Engineer-Building - PWBNH,LAHOWAL,786010.0,2.0,"1,89,82,513",Niranjan Saikia,"18,981,720",Rejected-AOC,03-Jun-2025,Public Works Building and NH Department||Chief Engineer-Building - PWBNH
2024_PWD_39143_48,"CE/DEV/TB/213/2024-25/01 Dtd. Guwahati, 05th September, 2024",TE_RIDF_XXX_24_25_08 Construction of Road from Dafflagarh TE Durga Mandir to 3 No. Line Connecting Road under RIDF-XXX of NABARD for the year 2024-25,TE_RIDF_XXX_24_25_08 Construction of Road from Dafflagarh TE Durga Mandir to 3 No. Line Connecting Road under RIDF-XXX of NABARD for the year 2024-25,Works,Open Tender,Item Rate,Civil Works – Roads,No,No,NA ,25-Sep-2024 10:00 AM,30-Sep-2024 12:00 PM ,180.0,No ,No,Online,09-Oct-2024 02:30 PM,Public Works Roads Department,Biswanath,784177.0,2.0,"99,98,000",M/S UDAARSIL CONSTRUCTIONS PVT. LTD,"8,998,200",Rejected-Finance,30-Jun-2025,Public Works Roads Department
2024_PWD_39820_195,"CE/DEV/TB/213/2024-25/04 Dtd. Guwahati, 20th September, 2024","TE_RIDF_XXX_24_25_307 Construction of Roads (1) Borbam TE Tipua Madgi Path , (2) Borbam TE NH-61 to Haluwating Hospital Connecting Road under RIDF-XXX of NABARD for the year 2024-25.","TE_RIDF_XXX_24_25_307 Construction of Roads (1) Borbam TE Tipua Madgi Path , (2) Borbam TE NH-61 to Haluwating Hospital Connecting Road under RIDF-XXX of NABARD for the year 2024-25.",Works,Open Tender,Item Rate,Civil Works – Roads,No,No,NA ,19-Oct-2024 04:00 PM,22-Oct-2024 12:00 PM ,180.0,No ,No,Online,30-Oct-2024 02:30 PM,Public Works Roads Department,Nazira,785685.0,2.0,"99,75,000",M/S BARUAH TRADERS,"8,977,500",Rejected-Finance,11-Jun-2025,Public Works Roads Department
2024_PWD_39700_2,CE/MAINT/RIDF-XXX/TE/01/24-25,Maint/RIDF/TE/2024-25/2,Construction of 1 no labour line and Hospital Connecting Road at Bor-Chapori T.Eunder RIDF-XXX of NABARD for the Year 2024-25 under Bokakhat and Dergaon Territorial Road Division of Bokakhat LAC,Works,Open Tender,Item Rate,Civil Works – Roads,No,No,NA ,07-Oct-2024 09:00 AM,07-Oct-2024 12:00 PM ,180.0,No ,No,Online,25-Oct-2024 03:00 PM,Public Works Roads Department,Bokakhat,785612.0,2.0,"1,00,00,000",PRABITRA BORA,"9,000,000",Rejected-Finance,24-Jun-2025,Public Works Roads Department
2024_PWD_39143_128,"CE/DEV/TB/213/2024-25/01 Dtd. Guwahati, 05th September, 2024",TE_RIDF_XXX_24_25_83 Construction of road in Mahunbaree Tea Estate under RIDF-XXX of NABARD for the year 2024-25,TE_RIDF_XXX_24_25_83 Construction of road in Mahunbaree Tea Estate under RIDF-XXX of NABARD for the year 2024-25,Works,Open Tender,Item Rate,Civil Works – Roads,No,No,NA ,27-Sep-2024 10:00 AM,30-Sep-2024 12:00 PM ,180.0,No ,No,Online,09-Oct-2024 02:30 PM,Public Works Roads Department,Dibrugarh,786001.0,2.0,"1,00,00,000",KUSHAL HAZARIKA,"9,996,002",Rejected-Finance,23-Jun-2025,Public Works Roads Department
2024_HFWD_39936_1,AMSC-EQUI0PROC/67/ECF558022/1,SUPPLY OF SPECTACLES,SUPPLY OF SPECTACLES,Goods,Open Tender,Buy,Medical Equipments/Waste,No,No,NA ,19-Oct-2024 05:00 PM,29-Oct-2024 04:30 PM ,180.0,No ,No,Online,11-Nov-2024 04:30 PM,Health and Family Welfare Department||Assam Medical Services Corporation Limited,"AMSCL, Guwahati, Assam",781026.0,2.0,"1,30,68,800",Stylrite Optical Industries,1.0,Rejected-Technical,15-Feb-2025,Health and Family Welfare Department||Assam Medical Services Corporation Limited
2025_UDD_44079_1,DMB/PW/15FC/2025/2730,"Work of providing ceiling, D.G Generator set, A.C., Fire Hydrant System and furniture etc at the newly constructed Town Hall for Dhekiajuli Municipal Board, Dhekiajuli in Sonitpur District under 15th Finance Commission Untied Grant for the year 2nd I","Work of providing ceiling, D.G Generator set, A.C., Fire Hydrant System and furniture etc at the newly constructed Town Hall for Dhekiajuli Municipal Board, Dhekiajuli in Sonitpur District under 15th Finance Commission Untied Grant for the year 2nd I",Works,Open Tender,Item Rate,Civil Works - Others,No,No,NA ,25-Apr-2025 05:00 PM,05-May-2025 12:00 PM ,180.0,No ,No,Online,15-May-2025 03:00 PM,Urban Development Department||Directorate of Municipality Administration - UDD||Dhekiajuli Municipal Board,"O/o of The Chairperson/Executive Officer, Dhekiaju",784110.0,2.0,"2,26,42,466",MANOJ TALUKDAR,"25,015,518.3",Rejected-Finance,17-Jun-2025,Urban Development Department||Directorate of Municipality Administration - UDD||Dhekiajuli Municipal Board
2024_PWRDW_35862_1,CEEAPARRBP111TENDERS2023ptII13,Construction of Bridge in Nagaon district i.Br. No. 2/1 on 16 No. Dijuvelly Road,CE/EAP/ARRBP/OCB/Bridge-1/Nagaon/11 Construction of Bridge in Nagaon district i.Br. No. 2/1 on 16 No. Dijuvelly Road,Works,Open Tender,Item Rate,Civil Works,No,No,NA ,02-Feb-2024 06:00 PM,09-Feb-2024 11:00 AM ,90.0,No ,No,Online,04-Mar-2024 02:30 PM,Public Works Roads Department-Externally Aided Project||Public Works Road Department- World Bank Funded Tenders||Assam State Bridge Infrastructure Program,Nagaon,782001.0,2.0,"1,30,84,000",Competent Infrastructure and consulting(CICON) Pvt.Ltd,"13,671,919.51",Accepted-AOC,06-Jun-2025,Public Works Roads Department-Externally Aided Project||Public Works Road Department- World Bank Funded Tenders||Assam State Bridge Infrastructure Program
