Organisation Chain,Tender Reference Number,Tender ID,Withdrawal Allowed,Tender Type,Form of contract,Tender Category,No. of Covers,General Technical Evaluation Allowed,ItemWise Technical Evaluation Allowed,Payment Mode,Is Multi Currency Allowed For BOQ,Is Multi Currency Allowed For Fee,Allow Two Stage Bidding,Cover No,Cover,Document Type,Description,Publish Date,Bid Opening Date,Document Download / Sale Start Date,Document Download / Sale End Date,Clarification Start Date,Clarification End Date,Bid Submission Start Date,Bid Submission End Date,Financial Bid Opening Date,EMD Amount in ₹,EMD Exemption Allowed,EMD Fee Type,EMD Percentage,EMD Payable To,EMD Payable At,S.No,Bank Name,Tender Fee in ₹,Fee Payable To,Fee Payable At,Tender Fee Exemption Allowed,Name,Address,Title,Work Description,Pre Qualification Details,Independent External Monitor/Remarks,Tender Value in ₹,Product Category,Sub category,Contract Type,Bid Validity(Days),Period Of Work(Days),Location,Pincode,Pre Bid Meeting Place,Pre Bid Meeting Address,Pre Bid Meeting Date,Bid Opening Place,Should Allow NDA Tender,Allow Preferential Bidder,Tender Stage,Contract Date :,Contract Value :,Work Completion Period in days :,Updated By :,Updated on :,AOC document :,S.No,Bid Number,Bidder Name,Awarded Currency,Awarded Value,S.No.1,Bid Number.1,Bidder Name.1,Submitted Date,Status,Remarks,Status Updated On,Type :,Summary :,Updated By :.1,Updated On :,Document :,BOQ Comparative Chart :,Committee Chairperson/Co-ordinator Name :,Committee Chairperson/Co-ordinator Type :,Committee Members :,Updated By :.2,Updated on :.1,Document :.1,Organisation Chain :,Tender ID :,Tender Ref No :,Tender Title :,Type :.1,Summary :.1,Updated By :.3,Updated On :.1,Document :.2,Committee Chairperson/Co-ordinator Name :.1,Committee Chairperson/Co-ordinator Type :.1,Committee Members :.1,Updated By :.4,Updated On :.2,Financial Bid Opening Date:,Document :.3,Tender Stage
Irrigation Department||Chief Engineer(Minor Irrigation)-Irrigation Dept||Kamrup Circle||Boko Chayagaon Division,NIT No 1 of 2025-26,2025_ID_44696_1,Yes,Open Tender,Works,Works,2.0,No,No,Online,No,No,No,1.0,Fee/PreQual/Technical,.pdf,EMD,10-Jun-2025 10:00 AM,02-Jul-2025 03:00 PM,10-Jun-2025 06:00 PM,02-Jul-2025 02:00 PM,NA ,NA ,10-Jun-2025 06:00 PM,02-Jul-2025 02:00 PM,16-Jul-2025 03:00 PM,"67,279",Yes,fixed,,Nil,Nil,1.0,SBI Bank,"1,000",Nil,Nil,No,"Executive Engineer, BCDI, Boko",Boko-Chaygaygaon Chamaria Division Irrigatiion Boko,Construction of solar operated ring well scheme along with RCC check dam at Hilly Terrain of Lampi under Boko Development Block under SOPD-G for the year 2024-25,Construction of solar operated ring well scheme along with RCC check dam at Hilly Terrain of Lampi under Boko Development Block,Please refer Tender documents. ,NA ,"33,63,941",Civil Works,NA ,Tender,180.0,NA ,Lampi,781129.0,NA ,NA ,NA ,BokoChaygaygaon Chamaria Division Irrigatiion Boko,No ,No,AOC,01-Aug-2025,"INR 3,362,000",180.0,Maharshi Kalita,01-Aug-2025 10:22 PM,fwo.pdf (352.00 KB),1.0,271021.0,BALAJI CONSTRUCTIONS,INR,"3,362,000",1.0,271021.0,BALAJI CONSTRUCTIONS,01-Jul-2025 07:28 PM,Accepted-AOC,Accepted,01-Aug-2025 10:22 PM,Finance,Admitted,Maharshi Kalita,31-Jul-2025 06:59 PM,finance_71023.pdf,BOQ Comparative Chart,Annie Pegu,Internal,,Maharshi Kalita,31-Jul-2025 07:03 PM,finsummary_71023.pdf (453.89 KB),Irrigation Department||Chief Engineer(Minor Irrigation)-Irrigation Dept||Kamrup Circle||Boko Chayagaon Division,2025_ID_44696_1,NIT No 1 of 2025-26,Construction of solar operated ring well scheme along with RCC check dam at Hilly Terrain of Lampi under Boko Development Block under SOPD-G for the year 2024-25,Technical,Accepted,Dhrubajyoti Baishya,16-Jul-2025 02:01 PM,,Annie Pegu,Internal,,Dhrubajyoti Baishya,16-Jul-2025 02:08 PM,16-Jul-2025 03:00 PM,techsummary_71023.pdf (835.17 KB),AOC
,,,,,,,,,,,,,,,,.pdf,Tender Fee,,,,,,,,,,,,,,,,,,,,,,,,,,,,,,,,,,,,,,,,,,AOC,,,,,,,,,,,,2.0,271024.0,Sumato Globaltech Pvt. Ltd.,02-Jul-2025 12:09 PM,Rejected-Technical,Disqualified in Tech Evalauation,16-Jul-2025 02:08 PM,,,,,,,,,,,,,,,,,,,,,,,,,,,,,AOC
,,,,,,,,,,,,,,,,.pdf,Technical Bid,,,,,,,,,,,,,,,,,,,,,,,,,,,,,,,,,,,,,,,,,,AOC,,,,,,,,,,,,,,,,,,,,,,,,,,,,,,,,,,,,,,,,,,,,,,,AOC
,,,,,,,,,,,,,,,,.pdf,Signed copy of Bid Document,,,,,,,,,,,,,,,,,,,,,,,,,,,,,,,,,,,,,,,,,,AOC,,,,,,,,,,,,,,,,,,,,,,,,,,,,,,,,,,,,,,,,,,,,,,,AOC
,,,,,,,,,,,,,,2.0,Finance,.xls,BoQ,,,,,,,,,,,,,,,,,,,,,,,,,,,,,,,,,,,,,,,,,,AOC,,,,,,,,,,,,,,,,,,,,,,,,,,,,,,,,,,,,,,,,,,,,,,,AOC
