Organisation Chain,Tender Reference Number,Tender ID,Withdrawal Allowed,Tender Type,Form of contract,Tender Category,No. of Covers,General Technical Evaluation Allowed,ItemWise Technical Evaluation Allowed,Payment Mode,Is Multi Currency Allowed For BOQ,Is Multi Currency Allowed For Fee,Allow Two Stage Bidding,Cover No,Cover,Document Type,Description,Publish Date,Bid Opening Date,Document Download / Sale Start Date,Document Download / Sale End Date,Clarification Start Date,Clarification End Date,Bid Submission Start Date,Bid Submission End Date,Financial Bid Opening Date,EMD Amount in ₹,EMD Exemption Allowed,EMD Fee Type,EMD Percentage,EMD Payable To,EMD Payable At,S.No,Bank Name,Tender Fee in ₹,Fee Payable To,Fee Payable At,Tender Fee Exemption Allowed,Name,Address,Title,Work Description,Pre Qualification Details,Independent External Monitor/Remarks,Tender Value in ₹,Product Category,Sub category,Contract Type,Bid Validity(Days),Period Of Work(Days),Location,Pincode,Pre Bid Meeting Place,Pre Bid Meeting Address,Pre Bid Meeting Date,Bid Opening Place,Should Allow NDA Tender,Allow Preferential Bidder,Tender Stage,Contract Date :,Contract Value :,Work Completion Period in days :,Updated By :,Updated on :,AOC document :,S.No,Bid Number,Bidder Name,Awarded Currency,Awarded Value,S.No.1,Bid Number.1,Bidder Name.1,Submitted Date,Status,Remarks,Status Updated On,Type :,Summary :,Updated By :.1,Updated On :,Document :,BOQ Comparative Chart :,Committee Chairperson/Co-ordinator Name :,Committee Chairperson/Co-ordinator Type :,Committee Members :,Updated By :.2,Updated on :.1,Document :.1,Organisation Chain :,Tender ID :,Tender Ref No :,Tender Title :,Type :.1,Summary :.1,Updated By :.3,Updated On :.1,Document :.2,Committee Chairperson/Co-ordinator Name :.1,Committee Chairperson/Co-ordinator Type :.1,Committee Members :.1,Updated By :.4,Updated On :.2,Financial Bid Opening Date:,Document :.3,Tender Stage
Public Works Building and NH Department||Chief Engineer-Building - PWBNH,"Tech-II/144/2024/19 Dated 3rd February, 2025",2025_PWBNH_42586_2,Yes,Open Tender,Item Rate,Works,2.0,No,No,Online,No,No,No,1.0,Fee/PreQual/Technical,.pdf,BID COST_BID SECURITY,07-Feb-2025 03:00 PM,28-Feb-2025 03:30 PM,07-Feb-2025 03:00 PM,28-Feb-2025 02:00 PM,NA ,NA ,07-Feb-2025 03:00 PM,28-Feb-2025 02:00 PM,15-May-2025 03:40 PM,"18,79,750",Yes,percentage,2.0%,Nil,Nil,1.0,SBI Bank,"18,800",Nil,Nil,No,"CE, PWD(B), H AND E, Assam, Chandmari, Ghy-3","O/O The CE, PWD(Bldg), Assam, Chandmari, Ghy-3","Bongaigaon College, Bongaigaon for Infrastructure Development for elevation as Universities under TNEIF on Engineering, Procurement and Construction (EPC) Mode-I Basis. (Package No.-III)","Bongaigaon College, Bongaigaon for Infrastructure Development for elevation as Universities under TNEIF on Engineering, Procurement and Construction (EPC) Mode-I Basis. (Package No.-III)",Please refer Tender documents. ,NA ,"9,39,87,504",Civil Works - Building,NA ,Tender,180.0,545.0,Bongaigaon,783380.0,"O/O The CE, PWD(Bldg), Assam, Chandmari, Ghy-3 ","O/O The CE, PWD(Bldg), Assam, Chandmari, Ghy-3 ",14-Feb-2025 11:30 AM ,"O/O The CE, PWD(Bldg), Assam, Chandmari, Ghy-3",No ,No,AOC,04-Aug-2025,"INR 87,852,760",545.0,Chandana Basumatary,04-Aug-2025 04:13 PM,WOBNGN.pdf (779.00 KB),1.0,260003.0,M/S BIMAL KUMAR AGARWALA,INR,"87,852,760",1,259005,ASM BROTHERS,28-Feb-2025 01:56 PM,Rejected-AOC,L4,04-Aug-2025 04:13 PM,Finance,Summary,ABIDUR RAHMAN,15-May-2025 04:02 PM,finance_68350.pdf,BOQ Comparative Chart,CE PWD(Bldg),Internal,,Chandana Basumatary,04-Aug-2025 04:09 PM,finsummary_68350.pdf (778.71 KB),Public Works Building and NH Department||Chief Engineer-Building - PWBNH,2025_PWBNH_42586_2,"Tech-II/144/2024/19 Dated 3rd February, 2025","Bongaigaon College, Bongaigaon for Infrastructure Development for elevation as Universities under TNEIF on Engineering, Procurement and Construction (EPC) Mode-I Basis. (Package No.-III)",Technical,Summary,ABIDUR RAHMAN,28-Feb-2025 04:04 PM,technical_68350.pdf,CE PWD(Bldg),Internal,,Chandana Basumatary,15-May-2025 03:37 PM,15-May-2025 03:40 PM,techsummary_68350.pdf (260.33 KB),AOC
,,,,,,,,,,,,,,,,.pdf,BIDING DOCUMENT,,,,,,,,,,,,,,,,,,,,,,,,,,,,,,,,,,,,,,,,,,AOC,,,,,,,,,,,,2,260003,M/S BIMAL KUMAR AGARWALA,27-Feb-2025 07:57 PM,Accepted-AOC,Work Order Issued,04-Aug-2025 04:13 PM,,,,,,,,,,,,,,,,,,,,,,,,,,,,,AOC
,,,,,,,,,,,,,,,,.pdf,TECHNICAL QUALIFICATIONS,,,,,,,,,,,,,,,,,,,,,,,,,,,,,,,,,,,,,,,,,,AOC,,,,,,,,,,,,3,259844,M/s Macrocosm Builders,28-Feb-2025 12:27 PM,Rejected-AOC,L5,04-Aug-2025 04:13 PM,,,,,,,,,,,,,,,,,,,,,,,,,,,,,AOC
,,,,,,,,,,,,,,2.0,Finance,.xls,BOQ,,,,,,,,,,,,,,,,,,,,,,,,,,,,,,,,,,,,,,,,,,AOC,,,,,,,,,,,,4,259182,Puberun Real Estate Pvt. Ltd.,25-Feb-2025 12:38 AM,Rejected-AOC,L2,04-Aug-2025 04:13 PM,,,,,,,,,,,,,,,,,,,,,,,,,,,,,AOC
,,,,,,,,,,,,,,,,.pdf,APPENDIX-IB,,,,,,,,,,,,,,,,,,,,,,,,,,,,,,,,,,,,,,,,,,AOC,,,,,,,,,,,,5,259319,Rudra Kumar Pathak,27-Feb-2025 10:17 PM,Rejected-AOC,L6,04-Aug-2025 04:13 PM,,,,,,,,,,,,,,,,,,,,,,,,,,,,,AOC
,,,,,,,,,,,,,,,,,,,,,,,,,,,,,,,,,,,,,,,,,,,,,,,,,,,,,,,,,,,AOC,,,,,,,,,,,,6,260000,VERSHA TECHNOTRADE PVT LTD,28-Feb-2025 01:05 PM,Rejected-AOC,L3,04-Aug-2025 04:13 PM,,,,,,,,,,,,,,,,,,,,,,,,,,,,,AOC
