Organisation Chain,Tender Reference Number,Tender ID,Withdrawal Allowed,Tender Type,Form of contract,Tender Category,No. of Covers,General Technical Evaluation Allowed,ItemWise Technical Evaluation Allowed,Payment Mode,Is Multi Currency Allowed For BOQ,Is Multi Currency Allowed For Fee,Allow Two Stage Bidding,Cover No,Cover,Document Type,Description,Publish Date,Bid Opening Date,Document Download / Sale Start Date,Document Download / Sale End Date,Clarification Start Date,Clarification End Date,Bid Submission Start Date,Bid Submission End Date,Financial Bid Opening Date,EMD Amount in ₹,EMD Exemption Allowed,EMD Fee Type,EMD Percentage,EMD Payable To,EMD Payable At,S.No,Bank Name,Tender Fee in ₹,Fee Payable To,Fee Payable At,Tender Fee Exemption Allowed,Name,Address,Title,Work Description,Pre Qualification Details,Independent External Monitor/Remarks,Tender Value in ₹,Product Category,Sub category,Contract Type,Bid Validity(Days),Period Of Work(Days),Location,Pincode,Pre Bid Meeting Place,Pre Bid Meeting Address,Pre Bid Meeting Date,Bid Opening Place,Should Allow NDA Tender,Allow Preferential Bidder,Tender Stage,Contract Date :,Contract Value :,Work Completion Period in days :,Updated By :,Updated on :,AOC document :,S.No,Bid Number,Bidder Name,Awarded Currency,Awarded Value,S.No.1,Bid Number.1,Bidder Name.1,Submitted Date,Status,Remarks,Status Updated On,Type :,Summary :,Updated By :.1,Updated On :,Document :,BOQ Comparative Chart :,Committee Chairperson/Co-ordinator Name :,Committee Chairperson/Co-ordinator Type :,Committee Members :,Updated By :.2,Updated on :.1,Document :.1,Organisation Chain :,Tender ID :,Tender Ref No :,Tender Title :,Type :.1,Summary :.1,Updated By :.3,Updated On :.1,Document :.2,Committee Chairperson/Co-ordinator Name :.1,Committee Chairperson/Co-ordinator Type :.1,Committee Members :.1,Updated By :.4,Updated On :.2,Financial Bid Opening Date:,Document :.3,Tender Stage
Public Works Roads Department,CE/DEV/TB/788/2024 -25 /02 Dtd- 4/03/2025.,2025_PWD_43420_1,Yes,Open Tender,Item Rate,Works,2.0,No,No,Online,No,No,No,1.0,Fee/PreQual/Technical,.pdf,BID COST_BID SECURITY,11-Mar-2025 06:50 PM,28-Mar-2025 02:30 PM,11-Mar-2025 06:50 PM,28-Mar-2025 02:00 PM,11-Mar-2025 06:50 PM ,13-Mar-2025 12:00 PM ,11-Mar-2025 06:55 PM,28-Mar-2025 02:00 PM,02-Apr-2025 11:55 AM,"34,96,000",Yes,fixed,,Nil,Nil,1.0,SBI Bank,"20,000",Nil,Nil,No,"CE, PWD(Roads), Assam, Chandmari, Ghy-3","CE, PWD(Roads), Assam, Chandmari, Ghy-3",SOPD_G_24_25_41 Widening and Strengthening including Construction of RCC Drain and Beautification of road from Court Tiniali to Gurutag Bahadur School under SOPD-Gfor the year 2024-25.,SOPD_G_24_25_41 Widening and Strengthening including Construction of RCC Drain and Beautification of road from Court Tiniali to Gurutag Bahadur School under SOPD-Gfor the year 2024-25.,Please refer Tender Documents ,NA ,"17,48,05,000",Civil Works – Roads,NA ,Tender,180.0,540.0,Tinsukia,786125.0,"CE, PWD(Roads), Assam, Chandmari, Ghy-3 ","CE, PWD(Roads), Assam, Chandmari, Ghy-3 ",17-Mar-2025 12:00 PM ,"CE, PWD(Roads), Assam, Chandmari, Ghy-3",No ,No,AOC,26-Aug-2025,"INR 157,324,500",540.0,Utpal Chakravarty,26-Aug-2025 03:44 PM,SOPD41A.pdf (414.00 KB),1.0,263067.0,M/S PRADIP KUMAR ADHYAPAK,INR,"157,324,500",1,263148,Dulal Dutta,28-Mar-2025 12:23 PM,Rejected-Finance,Rejected,26-Aug-2025 02:58 PM,Finance,Admitted,Utpal Chakravarty,26-Aug-2025 02:53 PM,,BOQ Comparative Chart,"CE (Roads), PWD, Assam",Internal,,Utpal Chakravarty,26-Aug-2025 02:58 PM,finsummary_69291.pdf (324.26 KB),Public Works Roads Department,2025_PWD_43420_1,CE/DEV/TB/788/2024 -25 /02 Dtd- 4/03/2025.,SOPD_G_24_25_41 Widening and Strengthening including Construction of RCC Drain and Beautification of road from Court Tiniali to Gurutag Bahadur School under SOPD-Gfor the year 2024-25.,Technical,Admitted,Utpal Chakravarty,02-Apr-2025 11:52 AM,technical_69291.pdf,"CE (Roads), PWD, Assam",Internal,,Utpal Chakravarty,02-Apr-2025 11:53 AM,02-Apr-2025 11:55 AM,techsummary_69291.pdf (262.93 KB),AOC
,,,,,,,,,,,,,,,,.pdf,BIDDING DOCUMENTS,,,,,,,,,,,,,,,,,,,,,,,,,,,,,,,,,,,,,,,,,,AOC,,,,,,,,,,,,2,263653,JKM INFRA WORKS LLP,28-Mar-2025 12:14 PM,Rejected-Finance,Rejected,26-Aug-2025 02:58 PM,,,,,,,,,,,,,,,,,,,,,,,,,,,,,AOC
,,,,,,,,,,,,,,,,.pdf,TECHNICAL QUALIFICATION,,,,,,,,,,,,,,,,,,,,,,,,,,,,,,,,,,,,,,,,,,AOC,,,,,,,,,,,,3,263067,M/S PRADIP KUMAR ADHYAPAK,26-Mar-2025 06:08 PM,Accepted-AOC,Awarded,26-Aug-2025 03:44 PM,,,,,,,,,,,,,,,,,,,,,,,,,,,,,AOC
,,,,,,,,,,,,,,2.0,Finance,.xls,BOQ,,,,,,,,,,,,,,,,,,,,,,,,,,,,,,,,,,,,,,,,,,AOC,,,,,,,,,,,,4,263504,M/S VIJAY AGARWAL AND SONS,27-Mar-2025 06:17 PM,Rejected-Finance,Rejected,26-Aug-2025 02:58 PM,,,,,,,,,,,,,,,,,,,,,,,,,,,,,AOC
,,,,,,,,,,,,,,,,.pdf,FOB,,,,,,,,,,,,,,,,,,,,,,,,,,,,,,,,,,,,,,,,,,AOC,,,,,,,,,,,,5,263645,Ram Swarup Yadav,27-Mar-2025 07:15 PM,Rejected-Finance,Rejected,26-Aug-2025 02:58 PM,,,,,,,,,,,,,,,,,,,,,,,,,,,,,AOC
,,,,,,,,,,,,,,,,,,,,,,,,,,,,,,,,,,,,,,,,,,,,,,,,,,,,,,,,,,,AOC,,,,,,,,,,,,6,263104,Ranjan Dutta,27-Mar-2025 08:20 PM,Rejected-Finance,Rejected,26-Aug-2025 02:58 PM,,,,,,,,,,,,,,,,,,,,,,,,,,,,,AOC
