Organisation Chain,Tender Reference Number,Tender ID,Withdrawal Allowed,Tender Type,Form of contract,Tender Category,No. of Covers,General Technical Evaluation Allowed,ItemWise Technical Evaluation Allowed,Payment Mode,Is Multi Currency Allowed For BOQ,Is Multi Currency Allowed For Fee,Allow Two Stage Bidding,Cover No,Cover,Document Type,Description,Publish Date,Bid Opening Date,Document Download / Sale Start Date,Document Download / Sale End Date,Clarification Start Date,Clarification End Date,Bid Submission Start Date,Bid Submission End Date,Financial Bid Opening Date,EMD Amount in ₹,EMD Exemption Allowed,EMD Fee Type,EMD Percentage,EMD Payable To,EMD Payable At,S.No,Bank Name,Tender Fee in ₹,Fee Payable To,Fee Payable At,Tender Fee Exemption Allowed,Name,Address,Title,Work Description,Pre Qualification Details,Independent External Monitor/Remarks,Tender Value in ₹,Product Category,Sub category,Contract Type,Bid Validity(Days),Period Of Work(Days),Location,Pincode,Pre Bid Meeting Place,Pre Bid Meeting Address,Pre Bid Meeting Date,Bid Opening Place,Should Allow NDA Tender,Allow Preferential Bidder,Tender Stage,Contract Date :,Contract Value :,Work Completion Period in days :,Updated By :,Updated on :,AOC document :,S.No,Bid Number,Bidder Name,Awarded Currency,Awarded Value,S.No.1,Bid Number.1,Bidder Name.1,Submitted Date,Status,Remarks,Status Updated On,Type :,Summary :,Updated By :.1,Updated On :,Document :,BOQ Comparative Chart :,Committee Chairperson/Co-ordinator Name :,Committee Chairperson/Co-ordinator Type :,Committee Members :,Updated By :.2,Updated on :.1,Document :.1,Organisation Chain :,Tender ID :,Tender Ref No :,Tender Title :,Type :.1,Summary :.1,Updated By :.3,Updated On :.1,Document :.2,Committee Chairperson/Co-ordinator Name :.1,Committee Chairperson/Co-ordinator Type :.1,Committee Members :.1,Updated By :.4,Updated On :.2,Financial Bid Opening Date:,Document :.3,Tender Stage
Axom Sarba Siksha Abhijan Mission,PM-SHRI/CW/Tender/24-25/86/,2025_SSA_42875_7,Yes,Open Tender,Works,Works,2.0,No,No,Online,No,No,No,1.0,Fee/PreQual/Technical,.pdf,Qualification Documents,24-Feb-2025 09:00 AM,11-Mar-2025 03:00 PM,24-Feb-2025 09:00 AM,11-Mar-2025 02:00 PM,24-Feb-2025 09:00 AM ,24-Feb-2025 03:00 PM ,24-Feb-2025 09:00 AM,11-Mar-2025 02:00 PM,06-Jun-2025 03:00 PM,"1,89,700",Yes,percentage,2.0%,Nil,Nil,1.0,SBI Bank,"1,897",Nil,Nil,Yes,"MISSION DIRECTOR, SAMAGRA SHIKSHA, ASSAM","Kahilipara Guwahati, 19",Group-8,"Strengthening of PM-Shri schools 1 Construction of 1 Science laboratory, 1 Library at PM-Shri Sital Pathar High School in Golaghat district, 2 Construction of 2 Additional classroom and 1 Biology laboratory at PM-Shri Kuralguri HS School in",Please refer Tender documents. ,NA ,"94,85,000",Civil Works - Building,NA ,Tender,180.0,180.0,Golaghat,781019.0,"O/O THE MD, SS, ASSAM ","Kahilipara Guwahati, 19 ",24-Feb-2025 03:00 PM ,"O/O THE MD, SS, ASSAM",No ,No,AOC,29-Aug-2025,"INR 8,536,500",180.0,Kamal Das,29-Aug-2025 04:59 PM,Group8.pdf (445.00 KB),1.0,261108.0,Bidyut Jyoti Khand,INR,"8,536,500",1,261108,Bidyut Jyoti Khand,11-Mar-2025 12:51 PM,Accepted-AOC,Lowest evaluated responsive bid,29-Aug-2025 04:59 PM,Finance,Admitted for financial evaluation,Kamal Das,06-Jun-2025 06:36 PM,,BOQ Comparative Chart,Executive Director,Internal,,Kamal Das,29-Aug-2025 04:57 PM,finsummary_68889.pdf (1313.60 KB),Axom Sarba Siksha Abhijan Mission,2025_SSA_42875_7,PM-SHRI/CW/Tender/24-25/86/,Group-8,Technical,Admitted for technical evaluation,Kamal Das,14-Mar-2025 02:33 PM,,Executive Director,Internal,,Azim Hussain,05-Jun-2025 10:57 AM,06-Jun-2025 03:00 PM,techsummary_68889.pdf (2502.16 KB),AOC
,,,,,,,,,,,,,,,,.pdf,Signed tender document,,,,,,,,,,,,,,,,,,,,,,,,,,,,,,,,,,,,,,,,,,AOC,,,,,,,,,,,,2,261046,GLOBAL POWER AND ENGINEERS,10-Mar-2025 06:40 PM,Rejected-Technical,Technically non-responsive as per clause 4.3 (vi) of ITB (E),05-Jun-2025 10:57 AM,,,,,,,,,,,,,,,,,,,,,,,,,,,,,AOC
,,,,,,,,,,,,,,,,.pdf,Tender fee and bid security,,,,,,,,,,,,,,,,,,,,,,,,,,,,,,,,,,,,,,,,,,AOC,,,,,,,,,,,,3,261104,IMPERIAL CORPORATION,11-Mar-2025 10:14 AM,Rejected-Technical,Technically non-responsive as per clause 4.3 (vi) of ITB (E),05-Jun-2025 10:57 AM,,,,,,,,,,,,,,,,,,,,,,,,,,,,,AOC
,,,,,,,,,,,,,,2.0,Finance,.xls,BOQ,,,,,,,,,,,,,,,,,,,,,,,,,,,,,,,,,,,,,,,,,,AOC,,,,,,,,,,,,4,260720,INTAZ ALI,09-Mar-2025 02:14 PM,Rejected-Technical,Technically non-responsive as per clause 4.3 (vi) of ITB (E),05-Jun-2025 10:57 AM,,,,,,,,,,,,,,,,,,,,,,,,,,,,,AOC
,,,,,,,,,,,,,,,,,,,,,,,,,,,,,,,,,,,,,,,,,,,,,,,,,,,,,,,,,,,AOC,,,,,,,,,,,,5,261038,M/s. Ashirvad Associates,11-Mar-2025 11:18 AM,Rejected-Finance,Non-responsive,29-Aug-2025 04:57 PM,,,,,,,,,,,,,,,,,,,,,,,,,,,,,AOC
,,,,,,,,,,,,,,,,,,,,,,,,,,,,,,,,,,,,,,,,,,,,,,,,,,,,,,,,,,,AOC,,,,,,,,,,,,6,260986,Navadeep Pegu,10-Mar-2025 01:32 PM,Rejected-Technical,Technically non-responsive as per clause 4.3 (vi) of ITB (E)Technically non-responsive as per clause 4.3 (vi) of ITB (E),05-Jun-2025 10:57 AM,,,,,,,,,,,,,,,,,,,,,,,,,,,,,AOC
,,,,,,,,,,,,,,,,,,,,,,,,,,,,,,,,,,,,,,,,,,,,,,,,,,,,,,,,,,,AOC,,,,,,,,,,,,7,261118,Shyamal Saikia,11-Mar-2025 12:59 PM,Rejected-Technical,Technically non-responsive as per clause 4.3 (vi) of ITB (E),05-Jun-2025 10:57 AM,,,,,,,,,,,,,,,,,,,,,,,,,,,,,AOC
,,,,,,,,,,,,,,,,,,,,,,,,,,,,,,,,,,,,,,,,,,,,,,,,,,,,,,,,,,,AOC,,,,,,,,,,,,8,260825,Sri Surjya Kumar Bhuyan,11-Mar-2025 11:12 AM,Rejected-Technical,Technically non-responsive as per clause 4.3 (vi) of ITB (E),05-Jun-2025 10:57 AM,,,,,,,,,,,,,,,,,,,,,,,,,,,,,AOC
,,,,,,,,,,,,,,,,,,,,,,,,,,,,,,,,,,,,,,,,,,,,,,,,,,,,,,,,,,,AOC,,,,,,,,,,,,9,261097,TAPAN DUTTA,10-Mar-2025 10:28 PM,Rejected-Technical,Technically non-responsive as per clause 4.3 (vi) of ITB (E),05-Jun-2025 10:57 AM,,,,,,,,,,,,,,,,,,,,,,,,,,,,,AOC
