Organisation Chain,Tender Reference Number,Tender ID,Withdrawal Allowed,Tender Type,Form of contract,Tender Category,No. of Covers,General Technical Evaluation Allowed,ItemWise Technical Evaluation Allowed,Payment Mode,Is Multi Currency Allowed For BOQ,Is Multi Currency Allowed For Fee,Allow Two Stage Bidding,Cover No,Cover,Document Type,Description,Publish Date,Bid Opening Date,Document Download / Sale Start Date,Document Download / Sale End Date,Clarification Start Date,Clarification End Date,Bid Submission Start Date,Bid Submission End Date,Financial Bid Opening Date,EMD Amount in ₹,EMD Exemption Allowed,EMD Fee Type,EMD Percentage,EMD Payable To,EMD Payable At,S.No,Bank Name,Tender Fee in ₹,Fee Payable To,Fee Payable At,Tender Fee Exemption Allowed,Name,Address,Title,Work Description,Pre Qualification Details,Independent External Monitor/Remarks,Tender Value in ₹,Product Category,Sub category,Contract Type,Bid Validity(Days),Period Of Work(Days),Location,Pincode,Pre Bid Meeting Place,Pre Bid Meeting Address,Pre Bid Meeting Date,Bid Opening Place,Should Allow NDA Tender,Allow Preferential Bidder,Tender Stage,Contract Date :,Contract Value :,Work Completion Period in days :,Updated By :,Updated on :,AOC document :,S.No,Bid Number,Bidder Name,Awarded Currency,Awarded Value,S.No.1,Bid Number.1,Bidder Name.1,Submitted Date,Status,Remarks,Status Updated On,Type :,Summary :,Updated By :.1,Updated On :,Document :,BOQ Comparative Chart :,Committee Chairperson/Co-ordinator Name :,Committee Chairperson/Co-ordinator Type :,Committee Members :,Updated By :.2,Updated on :.1,Document :.1,Organisation Chain :,Tender ID :,Tender Ref No :,Tender Title :,Type :.1,Summary :.1,Updated By :.3,Updated On :.1,Document :.2,Committee Chairperson/Co-ordinator Name :.1,Committee Chairperson/Co-ordinator Type :.1,Committee Members :.1,Updated By :.4,Updated On :.2,Financial Bid Opening Date:,Document :.3,Tender Stage
Public Works Building and NH Department||Chief Engineer-Building - PWBNH,Tech-II/27/2025/8 dated Guwahati the 17th May 2025,2025_PWBNH_44392_1,Yes,Open Tender,Item Rate,Works,2.0,No,No,Online,No,No,No,1.0,Fee/PreQual/Technical,.pdf,BID COST_BID SECURITY,20-May-2025 06:00 PM,29-May-2025 03:30 PM,20-May-2025 06:00 PM,29-May-2025 02:00 PM,NA ,NA ,22-May-2025 03:30 PM,29-May-2025 02:00 PM,03-Jun-2025 11:30 AM,"56,52,363",Yes,percentage,2.0%,Nil,Nil,1.0,SBI Bank,"20,000",Nil,Nil,No,"CE, PWD(Bldg), H And E, Assam, Chandmari, Ghy-3","O/O The CE, PWD(Bldg), Assam, Chandmari, Ghy-3","Construction and development of Boundary wall, Gate and External road at Assam Engineering College campus, Jalukbari, Guwahati, Assam","Construction and development of Boundary wall, Gate and External road at Assam Engineering College campus, Jalukbari, Guwahati, Assam",Please refer Tender documents. ,NA ,"28,26,18,173",Civil Works - Building,NA ,Tender,180.0,545.0,Jalukbari,781013.0,"O/O The CE, PWD(Bldg), Assam, Chandmari, Ghy-3 ","O/O The CE, PWD(Bldg), Assam, Chandmari, Ghy-3 ",22-May-2025 12:30 PM ,"O/O The CE, PWD(Bldg), Assam, Chandmari, Ghy-3",No ,No,AOC,01-Aug-2025,"INR 293,335,200",545.0,ABIDUR RAHMAN,01-Aug-2025 02:40 PM,WOJalukbari.pdf (575.00 KB),1.0,268693.0,ANIL DAS CONSTRUCTION PVT LTD,INR,"293,335,200",1.0,268693.0,ANIL DAS CONSTRUCTION PVT LTD,28-May-2025 07:07 PM,Accepted-AOC,Work Order Issued,01-Aug-2025 02:40 PM,Finance,Summary,ABIDUR RAHMAN,03-Jun-2025 11:59 AM,finance_70698.pdf,BOQ Comparative Chart,CE PWD(Bldg),Internal,,ABIDUR RAHMAN,01-Aug-2025 02:37 PM,finsummary_70698.pdf (575.29 KB),Public Works Building and NH Department||Chief Engineer-Building - PWBNH,2025_PWBNH_44392_1,Tech-II/27/2025/8 dated Guwahati the 17th May 2025,"Construction and development of Boundary wall, Gate and External road at Assam Engineering College campus, Jalukbari, Guwahati, Assam",Technical,Summary,ABIDUR RAHMAN,29-May-2025 05:21 PM,technical_70698.pdf,CE PWD(Bldg) H and E,Internal,,ABIDUR RAHMAN,02-Jun-2025 05:22 PM,03-Jun-2025 11:30 AM,techsummary_70698.pdf (261.91 KB),AOC
,,,,,,,,,,,,,,,,.pdf,BIDDING DOCUMENT,,,,,,,,,,,,,,,,,,,,,,,,,,,,,,,,,,,,,,,,,,AOC,,,,,,,,,,,,2.0,269006.0,ANUPAM NIRMAN PVT. LTD.,29-May-2025 12:26 PM,Rejected-AOC,L2,01-Aug-2025 02:40 PM,,,,,,,,,,,,,,,,,,,,,,,,,,,,,AOC
,,,,,,,,,,,,,,,,.pdf,TECHNICAL QUALIFICATIONS,,,,,,,,,,,,,,,,,,,,,,,,,,,,,,,,,,,,,,,,,,AOC,,,,,,,,,,,,3.0,268983.0,M/S KENGE CONSTRUCTION CO.,29-May-2025 01:37 PM,Rejected-Technical,Non-Responsive,02-Jun-2025 05:22 PM,,,,,,,,,,,,,,,,,,,,,,,,,,,,,AOC
,,,,,,,,,,,,,,2.0,Finance,.xls,BOQ,,,,,,,,,,,,,,,,,,,,,,,,,,,,,,,,,,,,,,,,,,AOC,,,,,,,,,,,,,,,,,,,,,,,,,,,,,,,,,,,,,,,,,,,,,,,AOC
,,,,,,,,,,,,,,,,.pdf,APPENDIX-IB,,,,,,,,,,,,,,,,,,,,,,,,,,,,,,,,,,,,,,,,,,AOC,,,,,,,,,,,,,,,,,,,,,,,,,,,,,,,,,,,,,,,,,,,,,,,AOC
