Organisation Chain,Tender Reference Number,Tender ID,Withdrawal Allowed,Tender Type,Form of contract,Tender Category,No. of Covers,General Technical Evaluation Allowed,ItemWise Technical Evaluation Allowed,Payment Mode,Is Multi Currency Allowed For BOQ,Is Multi Currency Allowed For Fee,Allow Two Stage Bidding,Cover No,Cover,Document Type,Description,Publish Date,Bid Opening Date,Document Download / Sale Start Date,Document Download / Sale End Date,Clarification Start Date,Clarification End Date,Bid Submission Start Date,Bid Submission End Date,Financial Bid Opening Date,EMD Amount in ₹,EMD Exemption Allowed,EMD Fee Type,EMD Percentage,EMD Payable To,EMD Payable At,S.No,Bank Name,Tender Fee in ₹,Fee Payable To,Fee Payable At,Tender Fee Exemption Allowed,Name,Address,Title,Work Description,Pre Qualification Details,Independent External Monitor/Remarks,Tender Value in ₹,Product Category,Sub category,Contract Type,Bid Validity(Days),Period Of Work(Days),Location,Pincode,Pre Bid Meeting Place,Pre Bid Meeting Address,Pre Bid Meeting Date,Bid Opening Place,Should Allow NDA Tender,Allow Preferential Bidder,Tender Stage,Contract Date :,Contract Value :,Work Completion Period in days :,Updated By :,Updated on :,AOC document :,S.No,Bid Number,Bidder Name,Awarded Currency,Awarded Value,S.No.1,Bid Number.1,Bidder Name.1,Submitted Date,Status,Remarks,Status Updated On,Type :,Summary :,Updated By :.1,Updated On :,Document :,BOQ Comparative Chart :,Committee Chairperson/Co-ordinator Name :,Committee Chairperson/Co-ordinator Type :,Committee Members :,Updated By :.2,Updated on :.1,Document :.1,Organisation Chain :,Tender ID :,Tender Ref No :,Tender Title :,Type :.1,Summary :.1,Updated By :.3,Updated On :.1,Document :.2,Committee Chairperson/Co-ordinator Name :.1,Committee Chairperson/Co-ordinator Type :.1,Committee Members :.1,Updated By :.4,Updated On :.2,Financial Bid Opening Date:,Document :.3,Tender Stage
Excise Department||Commissioner of Excise - ED||O/o SE-Sonitpur-Tezpur - ED,SNEX.173/18thMile/2023,2023_ED_33804_1,Yes,Open Tender,Item Wise,Services,2.0,No,No,Online,No,No,No,1.0,Fee/PreQual/Technical,.pdf,Technical Qualification Documents,14-Nov-2023 03:00 PM,27-Dec-2023 12:00 PM,15-Nov-2023 09:00 AM,26-Dec-2023 05:00 PM,15-Nov-2023 10:00 AM ,21-Nov-2023 05:00 PM ,23-Nov-2023 10:00 AM,26-Dec-2023 05:00 PM,19-Feb-2024 03:00 PM,"3,00,000",Yes,fixed,,Nil,Nil,1.0,SBI Bank,0.0,Nil,Nil,No,DISTRICT COLLECTOR SONITPUR,OFFICE OF THE DISTRICT COLLECTOR SONITPUR,GRANT OF IMFL OFF RETAIL SHOP NO SNP7 18TH MILE UNDER SILONI GP SONITPUR,GRANT OF IMFL OFF RETAIL SHOP NO SNP7 18TH MILE UNDER SILONI GP SONITPUR,REFER TO THE BID DOCUMENT ,NA ,,Miscellaneous Services,NA ,Tender,180.0,NA ,18TH MILE UNDER SILONI GP,784001.0,VIA ONLINE MODE ,VIA ONLINE MODE ,22-Nov-2023 01:00 PM ,OFFICE OF THE DISTRICT COLLECTOR SONITPUR,No ,No,AOC,13-Mar-2024,"INR 1,455,000",365.0,Boris Borkakoty,16-Mar-2024 10:46 AM,grant18thmile.pdf (270.00 KB),1.0,216272.0,MAHESWAR GOUR,INR,"1,455,000",1,216860,ABHIJIT BORUAH,26-Dec-2023 03:54 PM,Rejected-Technical,Technical Bid not considered,19-Feb-2024 02:13 PM,Finance,Finance bid opened,Boris Borkakoty,01-Mar-2024 11:19 AM,,BOQ Comparative Chart,ADC EXCISE,Mixed,"ADC EXCISE, FAO, DC OFFICE, TEZPUR AND SE, SONITPUR",Boris Borkakoty,01-Mar-2024 11:31 AM,finsummary_54772.pdf (242.64 KB),Excise Department||Commissioner of Excise - ED||O/o SE-Sonitpur-Tezpur - ED,2023_ED_33804_1,SNEX.173/18thMile/2023,GRANT OF IMFL OFF RETAIL SHOP NO SNP7 18TH MILE UNDER SILONI GP SONITPUR,Technical,Technical Bid has been opened,Boris Borkakoty,07-Feb-2024 04:14 PM,,Additional District Commissioner Excise,Mixed,"Finance and Accounts Officer DC Office Sonitpur , Superintendent of Excise, Sonitpur",Boris Borkakoty,19-Feb-2024 02:13 PM,19-Feb-2024 03:00 PM,techsummary_54772.pdf (2122.64 KB),AOC
,,,,,,,,,,,,,,,,.pdf,BID document downloaded from the portal,,,,,,,,,,,,,,,,,,,,,,,,,,,,,,,,,,,,,,,,,,AOC,,,,,,,,,,,,2,216020,BIKI SAHA,24-Dec-2023 04:08 PM,Rejected-Technical,Technical Bid not considered,19-Feb-2024 02:13 PM,,,,,,,,,,,,,,,,,,,,,,,,,,,,,AOC
,,,,,,,,,,,,,,2.0,Finance,.xls,BOQ,,,,,,,,,,,,,,,,,,,,,,,,,,,,,,,,,,,,,,,,,,AOC,,,,,,,,,,,,3,215875,DINESH MILI,26-Dec-2023 03:53 PM,Rejected-Technical,Technical Bid not considered,19-Feb-2024 02:13 PM,,,,,,,,,,,,,,,,,,,,,,,,,,,,,AOC
,,,,,,,,,,,,,,,,,,,,,,,,,,,,,,,,,,,,,,,,,,,,,,,,,,,,,,,,,,,AOC,,,,,,,,,,,,4,216272,MAHESWAR GOUR,26-Dec-2023 01:44 PM,Accepted-AOC,govt sanction received,16-Mar-2024 10:47 AM,,,,,,,,,,,,,,,,,,,,,,,,,,,,,AOC
,,,,,,,,,,,,,,,,,,,,,,,,,,,,,,,,,,,,,,,,,,,,,,,,,,,,,,,,,,,AOC,,,,,,,,,,,,5,216088,PRABODH SAHA,26-Dec-2023 04:12 PM,Rejected-Technical,Technical Bid not considered,19-Feb-2024 02:13 PM,,,,,,,,,,,,,,,,,,,,,,,,,,,,,AOC
,,,,,,,,,,,,,,,,,,,,,,,,,,,,,,,,,,,,,,,,,,,,,,,,,,,,,,,,,,,AOC,,,,,,,,,,,,6,216002,RAJU HUSSAIN,25-Dec-2023 06:05 PM,Rejected-Technical,Technical Bid not considered,19-Feb-2024 02:13 PM,,,,,,,,,,,,,,,,,,,,,,,,,,,,,AOC
