Organisation Chain,Tender Reference Number,Tender ID,Withdrawal Allowed,Tender Type,Form of contract,Tender Category,No. of Covers,General Technical Evaluation Allowed,ItemWise Technical Evaluation Allowed,Payment Mode,Is Multi Currency Allowed For BOQ,Is Multi Currency Allowed For Fee,Allow Two Stage Bidding,Cover No,Cover,Document Type,Description,Publish Date,Bid Opening Date,Document Download / Sale Start Date,Document Download / Sale End Date,Clarification Start Date,Clarification End Date,Bid Submission Start Date,Bid Submission End Date,Financial Bid Opening Date,EMD Amount in ₹,EMD Exemption Allowed,EMD Fee Type,EMD Percentage,EMD Payable To,EMD Payable At,S.No,Bank Name,Tender Fee in ₹,Fee Payable To,Fee Payable At,Tender Fee Exemption Allowed,Name,Address,Title,Work Description,Pre Qualification Details,Independent External Monitor/Remarks,Tender Value in ₹,Product Category,Sub category,Contract Type,Bid Validity(Days),Period Of Work(Days),Location,Pincode,Pre Bid Meeting Place,Pre Bid Meeting Address,Pre Bid Meeting Date,Bid Opening Place,Should Allow NDA Tender,Allow Preferential Bidder,Tender Stage,S.No,Bid Number,Bidder Name,Submitted Date,Status,Remarks,Status Updated On,Type :,Summary :,Updated By :,Updated On :,Document :,BOQ Comparative Chart :,Committee Chairperson/Co-ordinator Name :,Committee Chairperson/Co-ordinator Type :,Committee Members :,Updated By :.1,Updated on :,Document :.1,Organisation Chain :,Tender ID :,Tender Ref No :,Tender Title :,Type :.1,Summary :.1,Updated By :.2,Updated On :.1,Document :.2,Committee Chairperson/Co-ordinator Name :.1,Committee Chairperson/Co-ordinator Type :.1,Committee Members :.1,Updated By :.3,Updated On :.2,Financial Bid Opening Date:,Document :.3,Tender Stage
National Health Mission||State Programme Management Unit - NHM,NHM-32023/466/2023-CON-NHM/104,2023_NHM_31739_3,Yes,Open Tender,Turn-key,Works,2.0,No,No,Online,No,No,No,1.0,Fee/PreQual/Technical,.pdf,SBD,20-Jul-2023 05:00 PM,09-Aug-2023 03:30 PM,20-Jul-2023 05:00 PM,08-Aug-2023 02:00 PM,NA ,NA ,20-Jul-2023 05:00 PM,08-Aug-2023 02:00 PM,03-Oct-2023 01:25 PM,"1,04,060",Yes,percentage,2.0%,Nil,Nil,1.0,SBI Bank,"1,500",Nil,Nil,No,"MD, NHM, ASSAM","O/O MD, NHM, ASSAM, CHRISTAN BASTI, GUWAHATI-05",Construction of Buildingless Sub Health Centre in GHATURADAM SC in KARIMGANJ District under PM ABHIM for the FY 2021 22 under NHM on Turnkey Basis,Construction of Buildingless Sub Health Centre in GHATURADAM SC in KARIMGANJ District under PM ABHIM for the FY 2021 22 under NHM on Turnkey Basis,Please refer Tender documents. ,NA ,"52,03,000",Civil Works - Building,NA ,Tender,180.0,180.0,KARIMGANJ,788710.0,NA ,NA ,NA ,"O/O MD, NHM, ASSAM",No ,No,AOC,1,194436,ABDUL WAHAB KHAN,05-Aug-2023 11:57 PM,Not Admitted-Fee/PreQual/Technical,Not Complied with technical specification,03-Oct-2023 01:19 PM,Finance,FINANCIAL BID OPENED,Anupam Choudhury,08-Mar-2024 01:28 PM,,BOQ Comparative Chart,ED,Internal,SE CON SP FA DF AMD,Anupam Choudhury,08-Mar-2024 01:32 PM,finsummary_50846.pdf (2356.50 KB),National Health Mission||State Programme Management Unit - NHM,2023_NHM_31739_3,NHM-32023/466/2023-CON-NHM/104,Construction of Buildingless Sub Health Centre in GHATURADAM SC in KARIMGANJ District under PM ABHIM for the FY 2021 22 under NHM on Turnkey Basis,Technical,OFFICE ORDER,Anupam Choudhury,03-Oct-2023 01:19 PM,technical_50846.pdf,ED,Internal,SE CONSLT FA DF AMD,Anupam Choudhury,03-Oct-2023 01:21 PM,03-Oct-2023 01:25 PM,techsummary_50846.pdf (15781.45 KB),AOC
,,,,,,,,,,,,,,,,.pdf,TECHNICAL QUALIFICATION,,,,,,,,,,,,,,,,,,,,,,,,,,,,,,,,,,,,,,,,,,AOC,2,194606,BAHARUL ISLAM MOZUMDER,07-Aug-2023 01:22 PM,Not Admitted-Fee/PreQual/Technical,Not Complied with technical specification,03-Oct-2023 01:19 PM,,,,,,,,,,,,,,,,,,,,,,,,,,,,,AOC
,,,,,,,,,,,,,,,,.pdf,EMD AND TENDER FEE,,,,,,,,,,,,,,,,,,,,,,,,,,,,,,,,,,,,,,,,,,AOC,3,194713,DILWAR HUSSAIN,08-Aug-2023 12:08 PM,Rejected-Finance,L2,08-Mar-2024 01:32 PM,,,,,,,,,,,,,,,,,,,,,,,,,,,,,AOC
,,,,,,,,,,,,,,2.0,Finance,.xls,BOQ,,,,,,,,,,,,,,,,,,,,,,,,,,,,,,,,,,,,,,,,,,AOC,4,194697,HABU UDDIN TAPADAR,08-Aug-2023 12:04 PM,Accepted-AOC,L1,08-Mar-2024 01:34 PM,,,,,,,,,,,,,,,,,,,,,,,,,,,,,AOC
,,,,,,,,,,,,,,,,.pdf,FOB,,,,,,,,,,,,,,,,,,,,,,,,,,,,,,,,,,,,,,,,,,AOC,5,194591,SAMSUL HOQUE CHOUDHURY,07-Aug-2023 10:35 PM,Not Admitted-Fee/PreQual/Technical,Not Complied with technical specification,03-Oct-2023 01:19 PM,,,,,,,,,,,,,,,,,,,,,,,,,,,,,AOC
