Organisation Chain,Tender Reference Number,Tender ID,Withdrawal Allowed,Tender Type,Form of contract,Tender Category,No. of Covers,General Technical Evaluation Allowed,ItemWise Technical Evaluation Allowed,Payment Mode,Is Multi Currency Allowed For BOQ,Is Multi Currency Allowed For Fee,Allow Two Stage Bidding,Cover No,Cover,Document Type,Description,Publish Date,Bid Opening Date,Document Download / Sale Start Date,Document Download / Sale End Date,Clarification Start Date,Clarification End Date,Bid Submission Start Date,Bid Submission End Date,Financial Bid Opening Date,EMD Amount in ₹,EMD Exemption Allowed,EMD Fee Type,EMD Percentage,EMD Payable To,EMD Payable At,S.No,Corrigendum Title,Corrigendum Type,View,S.No.1,Bank Name,Tender Fee in ₹,Fee Payable To,Fee Payable At,Tender Fee Exemption Allowed,Name,Address,Title,Work Description,Pre Qualification Details,Independent External Monitor/Remarks,Tender Value in ₹,Product Category,Sub category,Contract Type,Bid Validity(Days),Period Of Work(Days),Location,Pincode,Pre Bid Meeting Place,Pre Bid Meeting Address,Pre Bid Meeting Date,Bid Opening Place,Should Allow NDA Tender,Allow Preferential Bidder,Tender Stage,S.No,Bid Number,Bidder Name,Submitted Date,Status,Remarks,Status Updated On,Type :,Summary :,Updated By :,Updated On :,Document :,BOQ Comparative Chart :,Committee Chairperson/Co-ordinator Name :,Committee Chairperson/Co-ordinator Type :,Committee Members :,Updated By :.1,Updated on :,Document :.1,Organisation Chain :,Tender ID :,Tender Ref No :,Tender Title :,Type :.1,Summary :.1,Updated By :.2,Updated On :.1,Document :.2,Committee Chairperson/Co-ordinator Name :.1,Committee Chairperson/Co-ordinator Type :.1,Committee Members :.1,Updated By :.3,Updated On :.2,Financial Bid Opening Date:,Document :.3,Tender Stage
"Pr. Chief Conservator of Forest and Head of Forest Force||Chief Conservator of Forests (Upper Assam Zone)||Northern Assam Circle, Tezpur||Nagaon Division",O.O. NO.171 Dtd.30/11/2023,2023_PCCF_34390_1,Yes,Open Tender,Percentage,Works,2.0,No,No,Online,No,No,No,1.0,Fee/PreQual/Technical,.pdf,Technical Qualification Documents,04-Dec-2023 05:00 PM,04-Jan-2024 01:00 PM,04-Dec-2023 05:00 PM,03-Jan-2024 05:00 PM,NA ,NA ,11-Dec-2023 10:00 AM,03-Jan-2024 05:00 PM,17-Feb-2024 06:50 PM,"63,118",Yes,percentage,2.0%,Nil,Nil,1.0,Correction of Appellate Authority Column in the Bid document.,Technical Bid,,1.0,SBI Bank,"1,000",Nil,Nil,No,Divisional Forest Officer,"Divisional Forest Officer, Nagaon Division, Nagaon",Construction of Boundary Fencing with RCC post and chain linked fencing (Perimeter of fencing will vary as per the shape of the plot),Construction of Boundary Fencing with RCC post and chain linked fencing (Perimeter of fencing will vary as per the shape of the plot),Please refer Tender documents. ,NA ,"31,55,900",Civil Works,NA ,Tender,180.0,180.0,Nagaon,782001.0,NA ,NA ,NA ,"Divisional Forest Officer, Nagaon Division, Nagaon",No ,No,AOC,1,218536,Anurag Baishya,03-Jan-2024 12:39 PM,Accepted-AOC,L1 bidder. Highest value of Assessed avaible bid Capacity,13-Mar-2024 06:07 PM,Finance,Total accepted 3 Total Rejected 2,Suhas Kadam,17-Feb-2024 07:15 PM,finance_55593.pdf,BOQ Comparative Chart,Kadam Suhas Tarachand,Internal,"Dipankar Deb, ACF and Kalyani Malakar, FR",Suhas Kadam,13-Mar-2024 05:57 PM,finsummary_55593.pdf (2614.36 KB),"Pr. Chief Conservator of Forest and Head of Forest Force||Chief Conservator of Forests (Upper Assam Zone)||Northern Assam Circle, Tezpur||Nagaon Division",2023_PCCF_34390_1,O.O. NO.171 Dtd.30/11/2023,Construction of Boundary Fencing with RCC post and chain linked fencing (Perimeter of fencing will vary as per the shape of the plot),Technical,Technical bid has been opened.,Dipankar Deb,04-Jan-2024 03:44 PM,,Kadam Suhas Tarachand,Internal,"Dipankar Deb, ACF and Kalyani Malakar, FR",Dipankar Deb,17-Feb-2024 06:43 PM,17-Feb-2024 06:50 PM,techsummary_55593.pdf (1047.17 KB),AOC
,,,,,,,,,,,,,,,,.pdf,BID document downloaded from the portal,,,,,,,,,,,,,,,,,,,,,,,,,,,,,,,,,,,,,,,,,,,,,,AOC,2,218566,biswajit banik,03-Jan-2024 02:57 PM,Rejected-Technical,Failed to submit Liquid Asset Certificate,17-Feb-2024 06:43 PM,,,,,,,,,,,,,,,,,,,,,,,,,,,,,AOC
,,,,,,,,,,,,,,2.0,Finance,.xls,BOQ,,,,,,,,,,,,,,,,,,,,,,,,,,,,,,,,,,,,,,,,,,,,,,AOC,3,218485,M/s B. B. Enterprise,02-Jan-2024 06:10 PM,Rejected-Finance,L2 Bidder. Assessed available bid capacity is not the highest,13-Mar-2024 05:57 PM,,,,,,,,,,,,,,,,,,,,,,,,,,,,,AOC
,,,,,,,,,,,,,,,,,,,,,,,,,,,,,,,,,,,,,,,,,,,,,,,,,,,,,,,,,,,,,,,AOC,4,218008,Paresh Kalita,03-Jan-2024 12:31 PM,Rejected-Technical,Failed to submit ESIC certificate,17-Feb-2024 06:43 PM,,,,,,,,,,,,,,,,,,,,,,,,,,,,,AOC
,,,,,,,,,,,,,,,,,,,,,,,,,,,,,,,,,,,,,,,,,,,,,,,,,,,,,,,,,,,,,,,AOC,5,218505,STANDARD CREATION,02-Jan-2024 07:10 PM,Rejected-Finance,Assessed available bid capacity is not the highest,13-Mar-2024 05:57 PM,,,,,,,,,,,,,,,,,,,,,,,,,,,,,AOC
