Organisation Chain,Tender Reference Number,Tender ID,Withdrawal Allowed,Tender Type,Form of contract,Tender Category,No. of Covers,General Technical Evaluation Allowed,ItemWise Technical Evaluation Allowed,Payment Mode,Is Multi Currency Allowed For BOQ,Is Multi Currency Allowed For Fee,Allow Two Stage Bidding,Cover No,Cover,Document Type,Description,Publish Date,Bid Opening Date,Document Download / Sale Start Date,Document Download / Sale End Date,Clarification Start Date,Clarification End Date,Bid Submission Start Date,Bid Submission End Date,EMD Amount in ₹,EMD Exemption Allowed,EMD Fee Type,EMD Percentage,EMD Payable To,EMD Payable At,S.No,Corrigendum Title,Corrigendum Type,View,S.No.1,Bank Name,Tender Fee in ₹,Fee Payable To,Fee Payable At,Tender Fee Exemption Allowed,Name,Address,Title,Work Description,Pre Qualification Details,Independent External Monitor/Remarks,Tender Value in ₹,Product Category,Sub category,Contract Type,Bid Validity(Days),Period Of Work(Days),Location,Pincode,Pre Bid Meeting Place,Pre Bid Meeting Address,Pre Bid Meeting Date,Bid Opening Place,Should Allow NDA Tender,Allow Preferential Bidder,Tender Stage,S.No,Bid Number,Bidder Name,Submitted Date,Status,Remarks,Status Updated On,Organisation Chain :,Tender ID :,Tender Ref No :,Tender Title :,Tender Stage
Skill Employment and Entrepreneurship Department||Assam Skill Development Mission,ASDM-558/2018/295,2024_SEED_36113_1,Yes,Open Tender,Empanelment,Services,1.0,No,No,Online,No,No,No,1.0,Fee/PreQual/Technical/Finance,.pdf,RFP,09-Feb-2024 05:00 PM,04-Mar-2024 03:00 PM,09-Feb-2024 05:00 PM,02-Mar-2024 05:00 PM,09-Feb-2024 05:00 PM ,16-Feb-2024 02:00 PM ,20-Feb-2024 09:00 AM,02-Mar-2024 05:00 PM,"3,66,600",No,fixed,,Nil,Nil,1.0,Corrigendum of Karagar Se Karigar,Financial Bid,,1.0,SBI Bank,"5,000",Nil,Nil,No,Mission Director,Mission Director Assam Skill Development Mission Garchuk Guwahati 781035,Karagar Se Karigar project Under Placement Linked Skill Development Training Program (PLSDTP),Karagar Se Karigar project Under Placement Linked Skill Development Training Program (PLSDTP),Reffer RFP ,NA ,"1,83,30,000",Miscellaneous Services,NA ,Tender,180.0,365.0,Assam Skill Development Mission,781035.0,NA ,NA ,NA ,Mission Director Assam Skill Development Mission G,No ,No,AOC,1,228227,AITMC Ventures Limited,02-Mar-2024 02:22 PM,Not Admitted-Fee/PreQual/Technical/Finance,Not qualified for AOC,16-Mar-2024 02:01 PM,Skill Employment and Entrepreneurship Department||Assam Skill Development Mission,2024_SEED_36113_1,ASDM-558/2018/295,Karagar Se Karigar project Under Placement Linked Skill Development Training Program (PLSDTP),AOC
,,,,,,,,,,,,,,,,,,,,,,,,,,,,,,,,,,,,,,,,,,,,,,,,,,,,,,,,,,,,,,AOC,2,228492,Ajitaaksh Ventures Pvt Ltd,02-Mar-2024 04:19 PM,Accepted-AOC,Qualified,16-Mar-2024 02:08 PM,,,,,AOC
,,,,,,,,,,,,,,,,,,,,,,,,,,,,,,,,,,,,,,,,,,,,,,,,,,,,,,,,,,,,,,AOC,3,227199,CARE EDUCATIONAL AND WELFARE SOCIETY,02-Mar-2024 11:50 AM,Not Admitted-Fee/PreQual/Technical/Finance,Not qualified for AOC,16-Mar-2024 02:01 PM,,,,,AOC
,,,,,,,,,,,,,,,,,,,,,,,,,,,,,,,,,,,,,,,,,,,,,,,,,,,,,,,,,,,,,,AOC,4,228282,INNOVISION LIMITED,02-Mar-2024 04:20 PM,Not Admitted-Fee/PreQual/Technical/Finance,Not qualified for AOC,16-Mar-2024 02:01 PM,,,,,AOC
,,,,,,,,,,,,,,,,,,,,,,,,,,,,,,,,,,,,,,,,,,,,,,,,,,,,,,,,,,,,,,AOC,5,227702,NRDS Management Private Limited,01-Mar-2024 04:11 PM,Accepted-AOC,Qualified,16-Mar-2024 02:08 PM,,,,,AOC
,,,,,,,,,,,,,,,,,,,,,,,,,,,,,,,,,,,,,,,,,,,,,,,,,,,,,,,,,,,,,,AOC,6,228482,Smartskills Bits and Bytes Private Limited,02-Mar-2024 02:48 PM,Not Admitted-Fee/PreQual/Technical/Finance,Not qualified for AOC,16-Mar-2024 02:01 PM,,,,,AOC
,,,,,,,,,,,,,,,,,,,,,,,,,,,,,,,,,,,,,,,,,,,,,,,,,,,,,,,,,,,,,,AOC,7,228493,Thredz Information TEchnology Pvt Ltd,02-Mar-2024 04:33 PM,Not Admitted-Fee/PreQual/Technical/Finance,Not qualified for AOC,16-Mar-2024 02:01 PM,,,,,AOC
,,,,,,,,,,,,,,,,,,,,,,,,,,,,,,,,,,,,,,,,,,,,,,,,,,,,,,,,,,,,,,AOC,8,227589,Valeur Fabtex Private Limited,02-Mar-2024 04:51 PM,Accepted-AOC,Qualified,16-Mar-2024 02:08 PM,,,,,AOC
