Organisation Chain,Tender Reference Number,Tender ID,Withdrawal Allowed,Tender Type,Form of contract,Tender Category,No. of Covers,General Technical Evaluation Allowed,ItemWise Technical Evaluation Allowed,Payment Mode,Is Multi Currency Allowed For BOQ,Is Multi Currency Allowed For Fee,Allow Two Stage Bidding,Cover No,Cover,Document Type,Description,Publish Date,Bid Opening Date,Document Download / Sale Start Date,Document Download / Sale End Date,Clarification Start Date,Clarification End Date,Bid Submission Start Date,Bid Submission End Date,Financial Bid Opening Date,EMD Amount in ₹,EMD Exemption Allowed,EMD Fee Type,EMD Percentage,EMD Payable To,EMD Payable At,S.No,Bank Name,Tender Fee in ₹,Fee Payable To,Fee Payable At,Tender Fee Exemption Allowed,Name,Address,Title,Work Description,Pre Qualification Details,Independent External Monitor/Remarks,Tender Value in ₹,Product Category,Sub category,Contract Type,Bid Validity(Days),Period Of Work(Days),Location,Pincode,Pre Bid Meeting Place,Pre Bid Meeting Address,Pre Bid Meeting Date,Bid Opening Place,Should Allow NDA Tender,Allow Preferential Bidder,Tender Stage,Contract Date :,Contract Value :,Work Completion Period in days :,Updated By :,Updated on :,AOC document :,S.No,Bid Number,Bidder Name,Awarded Currency,Awarded Value,S.No.1,Bid Number.1,Bidder Name.1,Submitted Date,Status,Remarks,Status Updated On,Type :,Summary :,Updated By :.1,Updated On :,Document :,BOQ Comparative Chart :,Committee Chairperson/Co-ordinator Name :,Committee Chairperson/Co-ordinator Type :,Committee Members :,Updated By :.2,Updated on :.1,Document :.1,Organisation Chain :,Tender ID :,Tender Ref No :,Tender Title :,Type :.1,Summary :.1,Updated By :.3,Updated On :.1,Document :.2,Committee Chairperson/Co-ordinator Name :.1,Committee Chairperson/Co-ordinator Type :.1,Committee Members :.1,Updated By :.4,Updated On :.2,Financial Bid Opening Date:,Document :.3,Tender Stage
Assam Police||Special Branch HQ,SB(R)MT/SPARE PARTS/REPAIRING OF GOVT VEHICLES/2025,2025_AP_44011_1,Yes,Open Tender,Item Wise,Goods,2.0,No,No,Online,No,No,No,1.0,Fee/PreQual/Technical,.pdf,Technical documents,05-Apr-2025 01:00 PM,29-Apr-2025 11:00 AM,05-Apr-2025 02:00 PM,25-Apr-2025 05:00 PM,NA ,NA ,07-Apr-2025 10:00 AM,25-Apr-2025 05:00 PM,06-May-2025 11:30 AM,"4,00,000",No,percentage,2.0%,Nil,Nil,1.0,SBI Bank,0.0,Nil,Nil,No,"Special Additional Director General of Police, SB","Special Branch Headquarters, Assam Police, Kahilipara, Guwahati-19","Procurement of Spare Motor parts and Repairing wors of vehicles under SB, Assam","Procurement of Spare Motor parts and Repairing wors of vehicles under SB, Assam",Please refer Tender documents. ,NA ,"2,00,00,000",Miscellaneous Goods,NA ,Tender,180.0,NA ,"SB Heaquarter, Kahlipara, Guwahati",781019.0,NA ,NA ,NA ,Online,No ,No,AOC,26-Jun-2025,"INR 20,000,000",365.0,Diganta Basumatary,26-Jun-2025 12:16 PM,AOC.pdf (275.00 KB),1,267321,Shree Ganesh Tyre Service,INR,1,1,266084,AMIT MOTORS,19-Apr-2025 10:37 PM,Accepted-AOC,Awarded,26-Jun-2025 12:17 PM,Finance,Financial bid has been opened,Diganta Basumatary,06-May-2025 11:47 AM,,BOQ Comparative Chart,"DIG, SB",Internal,,Diganta Basumatary,26-Jun-2025 12:13 PM,finsummary_70163.pdf (807.22 KB),Assam Police||Special Branch HQ,2025_AP_44011_1,SB(R)MT/SPARE PARTS/REPAIRING OF GOVT VEHICLES/2025,"Procurement of Spare Motor parts and Repairing wors of vehicles under SB, Assam",Technical,Technical bid has been opened,Ripul Das,29-Apr-2025 03:38 PM,,"DIGP, SB",Internal,,Ripul Das,06-May-2025 11:21 AM,06-May-2025 11:30 AM,techsummary_70163.pdf (647.05 KB),AOC
,,,,,,,,,,,,,,,,.pdf,Bid documents to be downloaded from the portal,,,,,,,,,,,,,,,,,,,,,,,,,,,,,,,,,,,,,,,,,,AOC,,,,,,,2,266537,M/S S.S AUTO ENGINEERING WORKS,INR,1,2,266068,AUTO SPARES,19-Apr-2025 05:19 PM,Accepted-AOC,Awarded,26-Jun-2025 12:17 PM,,,,,,,,,,,,,,,,,,,,,,,,,,,,,AOC
,,,,,,,,,,,,,,2.0,Finance,.xls,BoQ,,,,,,,,,,,,,,,,,,,,,,,,,,,,,,,,,,,,,,,,,,AOC,,,,,,,3,266448,SHREE AMBA ENTERPRISES,INR,1,3,266102,CHETAN ENTERPRISES,20-Apr-2025 02:18 PM,Accepted-AOC,Awarded,26-Jun-2025 12:17 PM,,,,,,,,,,,,,,,,,,,,,,,,,,,,,AOC
,,,,,,,,,,,,,,,,,,,,,,,,,,,,,,,,,,,,,,,,,,,,,,,,,,,,,,,,,,,AOC,,,,,,,4,266102,CHETAN ENTERPRISES,INR,1,4,266537,M/S S.S AUTO ENGINEERING WORKS,25-Apr-2025 04:20 PM,Accepted-AOC,Awarded,26-Jun-2025 12:17 PM,,,,,,,,,,,,,,,,,,,,,,,,,,,,,AOC
,,,,,,,,,,,,,,,,,,,,,,,,,,,,,,,,,,,,,,,,,,,,,,,,,,,,,,,,,,,AOC,,,,,,,5,266084,AMIT MOTORS,INR,1,5,266448,SHREE AMBA ENTERPRISES,23-Apr-2025 09:12 PM,Accepted-AOC,Awarded,26-Jun-2025 12:17 PM,,,,,,,,,,,,,,,,,,,,,,,,,,,,,AOC
,,,,,,,,,,,,,,,,,,,,,,,,,,,,,,,,,,,,,,,,,,,,,,,,,,,,,,,,,,,AOC,,,,,,,6,266068,AUTO SPARES,INR,1,6,267321,Shree Ganesh Tyre Service,25-Apr-2025 04:19 PM,Accepted-AOC,Awarded,26-Jun-2025 12:17 PM,,,,,,,,,,,,,,,,,,,,,,,,,,,,,AOC
