Organisation Chain,Tender Reference Number,Tender ID,Withdrawal Allowed,Tender Type,Form of contract,Tender Category,No. of Covers,General Technical Evaluation Allowed,ItemWise Technical Evaluation Allowed,Payment Mode,Is Multi Currency Allowed For BOQ,Is Multi Currency Allowed For Fee,Allow Two Stage Bidding,Cover No,Cover,Document Type,Description,Publish Date,Bid Opening Date,Document Download / Sale Start Date,Document Download / Sale End Date,Clarification Start Date,Clarification End Date,Bid Submission Start Date,Bid Submission End Date,Financial Bid Opening Date,EMD Amount in ₹,EMD Exemption Allowed,EMD Fee Type,EMD Percentage,EMD Payable To,EMD Payable At,S.No,Bank Name,Tender Fee in ₹,Fee Payable To,Fee Payable At,Tender Fee Exemption Allowed,Name,Address,Title,Work Description,Pre Qualification Details,Independent External Monitor/Remarks,Tender Value in ₹,Product Category,Sub category,Contract Type,Bid Validity(Days),Period Of Work(Days),Location,Pincode,Pre Bid Meeting Place,Pre Bid Meeting Address,Pre Bid Meeting Date,Bid Opening Place,Should Allow NDA Tender,Allow Preferential Bidder,Tender Stage,Contract Date :,Contract Value :,Work Completion Period in days :,Updated By :,Updated on :,AOC document :,S.No,Bid Number,Bidder Name,Awarded Currency,Awarded Value,S.No.1,Bid Number.1,Bidder Name.1,Submitted Date,Status,Remarks,Status Updated On,Type :,Summary :,Updated By :.1,Updated On :,Document :,BOQ Comparative Chart :,Committee Chairperson/Co-ordinator Name :,Committee Chairperson/Co-ordinator Type :,Committee Members :,Updated By :.2,Updated on :.1,Document :.1,Organisation Chain :,Tender ID :,Tender Ref No :,Tender Title :,Type :.1,Summary :.1,Updated By :.3,Updated On :.1,Document :.2,Committee Chairperson/Co-ordinator Name :.1,Committee Chairperson/Co-ordinator Type :.1,Committee Members :.1,Updated By :.4,Updated On :.2,Financial Bid Opening Date:,Document :.3,Tender Stage
Public Works Roads Department,"CE/DEV/TB/213/2024-25/04 Dtd. Guwahati, 20th September, 2024",2024_PWD_39820_82,Yes,Open Tender,Item Rate,Works,2.0,No,No,Online,No,No,No,1.0,Fee/PreQual/Technical,.pdf,BID COST_BID SECURITY,15-Oct-2024 10:00 AM,30-Oct-2024 02:30 PM,15-Oct-2024 10:00 AM,30-Oct-2024 02:00 PM,15-Oct-2024 10:00 AM ,22-Oct-2024 12:00 PM ,23-Oct-2024 02:30 PM,30-Oct-2024 02:00 PM,24-Dec-2024 01:00 PM,"6,00,000",Yes,fixed,,Nil,Nil,1.0,SBI Bank,"6,000",Nil,Nil,No,"CE, PWD(Roads), Assam, Chandmari, Ghy-3","CE, PWD(Roads), Assam, Chandmari, Ghy-3",TE_RIDF_XXX_24_25_276 Improvement of Tea Garden Road at (i) Ida TE (Length - 1.40 Km) (ii) Sessa TE (Length - 1.46 Km) and (iii) Tempto TE (Length - 1.45 Km) and under RIDF-XXX for the year 2024-25,TE_RIDF_XXX_24_25_276 Improvement of Tea Garden Road at (i) Ida TE (Length - 1.40 Km) (ii) Sessa TE (Length - 1.46 Km) and (iii) Tempto TE (Length - 1.45 Km) and under RIDF-XXX for the year 2024-25,Please refer Tender documents. ,NA ,"2,99,81,000",Civil Works – Roads,NA ,Tender,180.0,270.0,Dibrugarh,785669.0,"CE, PWD(Roads), Assam, Chandmari, Ghy-3 ","CE, PWD(Roads), Assam, Chandmari, Ghy-3 ",22-Oct-2024 12:00 PM ,"CE, PWD(Roads), Assam, Chandmari, Ghy-3",No ,No,AOC,06-Jun-2025,"INR 29,982,326",270.0,BHABANANDA DEKA,06-Jun-2025 12:48 PM,276A.pdf (413.00 KB),1.0,246733.0,KUSHAL HAZARIKA,INR,"29,982,326",1.0,246735.0,ANIL MAKRARY,30-Oct-2024 06:31 AM,Rejected-Finance,Rejected,06-Jun-2025 12:45 PM,Finance,Admitted,BHABANANDA DEKA,06-Jun-2025 12:43 PM,,BOQ Comparative Chart,CE PWRD,Internal,,BHABANANDA DEKA,06-Jun-2025 12:45 PM,finsummary_64726.pdf (645.77 KB),Public Works Roads Department,2024_PWD_39820_82,"CE/DEV/TB/213/2024-25/04 Dtd. Guwahati, 20th September, 2024",TE_RIDF_XXX_24_25_276 Improvement of Tea Garden Road at (i) Ida TE (Length - 1.40 Km) (ii) Sessa TE (Length - 1.46 Km) and (iii) Tempto TE (Length - 1.45 Km) and under RIDF-XXX for the year 2024-25,Technical,Admitted,Kritika Langthasa,24-Dec-2024 12:30 PM,,CE PWRD,Internal,,Kritika Langthasa,24-Dec-2024 12:36 PM,24-Dec-2024 01:00 PM,techsummary_64726.pdf (229.83 KB),AOC
,,,,,,,,,,,,,,,,.pdf,BIDDING DOCUMENTS,,,,,,,,,,,,,,,,,,,,,,,,,,,,,,,,,,,,,,,,,,AOC,,,,,,,,,,,,2.0,246733.0,KUSHAL HAZARIKA,29-Oct-2024 09:58 AM,Accepted-AOC,Awarded to L1 Bidder,06-Jun-2025 12:48 PM,,,,,,,,,,,,,,,,,,,,,,,,,,,,,AOC
,,,,,,,,,,,,,,,,.pdf,TECHNICAL QUALIFICATION,,,,,,,,,,,,,,,,,,,,,,,,,,,,,,,,,,,,,,,,,,AOC,,,,,,,,,,,,3.0,246734.0,SRI MANAB JYOTI GOGOI,29-Oct-2024 10:15 AM,Not Admitted-Fee/PreQual/Technical,Others-Withdrawn,24-Dec-2024 12:30 PM,,,,,,,,,,,,,,,,,,,,,,,,,,,,,AOC
,,,,,,,,,,,,,,2.0,Finance,.xls,BOQ,,,,,,,,,,,,,,,,,,,,,,,,,,,,,,,,,,,,,,,,,,AOC,,,,,,,,,,,,,,,,,,,,,,,,,,,,,,,,,,,,,,,,,,,,,,,AOC
,,,,,,,,,,,,,,,,.pdf,FOB,,,,,,,,,,,,,,,,,,,,,,,,,,,,,,,,,,,,,,,,,,AOC,,,,,,,,,,,,,,,,,,,,,,,,,,,,,,,,,,,,,,,,,,,,,,,AOC
