Organisation Chain,Tender Reference Number,Tender ID,Withdrawal Allowed,Tender Type,Form of contract,Tender Category,No. of Covers,General Technical Evaluation Allowed,ItemWise Technical Evaluation Allowed,Payment Mode,Is Multi Currency Allowed For BOQ,Is Multi Currency Allowed For Fee,Allow Two Stage Bidding,Cover No,Cover,Document Type,Description,Publish Date,Bid Opening Date,Document Download / Sale Start Date,Document Download / Sale End Date,Clarification Start Date,Clarification End Date,Bid Submission Start Date,Bid Submission End Date,Financial Bid Opening Date,EMD Amount in ₹,EMD Exemption Allowed,EMD Fee Type,EMD Percentage,EMD Payable To,EMD Payable At,S.No,Bank Name,Tender Fee in ₹,Fee Payable To,Fee Payable At,Tender Fee Exemption Allowed,Name,Address,Title,Work Description,Pre Qualification Details,Independent External Monitor/Remarks,Tender Value in ₹,Product Category,Sub category,Contract Type,Bid Validity(Days),Period Of Work(Days),Location,Pincode,Pre Bid Meeting Place,Pre Bid Meeting Address,Pre Bid Meeting Date,Bid Opening Place,Should Allow NDA Tender,Allow Preferential Bidder,Tender Stage,Contract Date :,Contract Value :,Work Completion Period in days :,Updated By :,Updated on :,AOC document :,S.No,Bid Number,Bidder Name,Awarded Currency,Awarded Value,S.No.1,Bid Number.1,Bidder Name.1,Submitted Date,Status,Remarks,Status Updated On,Type :,Summary :,Updated By :.1,Updated On :,Document :,BOQ Comparative Chart :,Committee Chairperson/Co-ordinator Name :,Committee Chairperson/Co-ordinator Type :,Committee Members :,Updated By :.2,Updated on :.1,Document :.1,Organisation Chain :,Tender ID :,Tender Ref No :,Tender Title :,Type :.1,Summary :.1,Updated By :.3,Updated On :.1,Document :.2,Committee Chairperson/Co-ordinator Name :.1,Committee Chairperson/Co-ordinator Type :.1,Committee Members :.1,Updated By :.4,Updated On :.2,Financial Bid Opening Date:,Document :.3,Tender Stage
Public Works Building and NH Department||Chief Engineer-Building - PWBNH||SE-Planning - PWBNH,NHC/BR/17/2024/Pt/25 Dated Guwahati the 30th Dec 2024,2025_PWBNH_41824_1,Yes,Open Tender,Item Rate,Works,2.0,No,No,Online,No,No,No,1.0,Fee/PreQual/Technical,.pdf,BID COST_BID SECURITY,03-Jan-2025 02:00 PM,04-Feb-2025 02:00 PM,03-Jan-2025 02:00 PM,03-Feb-2025 02:00 PM,NA ,NA ,03-Jan-2025 02:00 PM,03-Feb-2025 02:00 PM,20-Feb-2025 04:35 PM,"12,09,000",No,fixed,,Nil,Nil,1.0,SBI Bank,"12,500",Nil,Nil,No,"CE PWD NH Works Assam, Chandmari, Ghy-3","O/O the CE PWD NH Works Assam, Chandmari, Guwahati-781003","PWD-NH(BR)/RAN/SOPD/2024-25/01 Construction of New Bridge over river Mangoldoi (Br.no 35/1) including approaches, service road and drain in place of the abandoned Bailey bridge on NH-15 under SOPD for the year 2024-25 under PWD Rangia NH Division in","PWD-NH(BR)/RAN/SOPD/2024-25/01 Construction of New Bridge over river Mangoldoi (Br.no 35/1) including approaches, service road and drain in place of the abandoned Bailey bridge on NH-15 under SOPD for the year 2024-25 under PWD Rangia NH Division in",Please refer Tender documents. ,NA ,"12,08,79,000",Civil Works – Highways,NA ,Tender,180.0,545.0,Mangoldoi,784125.0,NA ,NA ,NA ,"O/O the CE PWD NH Works Assam, Chandmari, Ghy-3",No ,No,AOC,19-Jun-2025,"INR 113,637,226.57",545.0,Ranjita Rani Singha,19-Jun-2025 02:33 PM,NoticeSOPD.pdf (765.00 KB),1.0,257431.0,PRABHU AGARWALLA CONSTRUCTION PVT LTD,INR,"113,637,226.57",1,257066,KALPA SINGH BORDOLOI,03-Feb-2025 01:42 PM,Rejected-Technical,Technically Non-Responsive,20-Feb-2025 04:34 PM,Finance,Summary,Hiranya Kumar Dutta,20-Feb-2025 04:48 PM,finance_67296.pdf,BOQ Comparative Chart,The Chief Engineer PWD NH Works Assam,Internal,,Ranjita Rani Singha,19-Jun-2025 02:31 PM,finsummary_67296.pdf (764.78 KB),Public Works Building and NH Department||Chief Engineer-Building - PWBNH||SE-Planning - PWBNH,2025_PWBNH_41824_1,NHC/BR/17/2024/Pt/25 Dated Guwahati the 30th Dec 2024,"PWD-NH(BR)/RAN/SOPD/2024-25/01 Construction of New Bridge over river Mangoldoi (Br.no 35/1) including approaches, service road and drain in place of the abandoned Bailey bridge on NH-15 under SOPD for the year 2024-25 under PWD Rangia NH Division in",Technical,Summary,Ranjita Rani Singha,04-Feb-2025 04:13 PM,technical_67296.pdf,CE PWD(NH WORKS),Internal,,Ranjita Rani Singha,20-Feb-2025 04:34 PM,20-Feb-2025 04:35 PM,techsummary_67296.pdf (1094.92 KB),AOC
,,,,,,,,,,,,,,,,.pdf,BIDDING DOCUMENT,,,,,,,,,,,,,,,,,,,,,,,,,,,,,,,,,,,,,,,,,,AOC,,,,,,,,,,,,2,256333,KULEN HAZARIKA,03-Feb-2025 01:33 PM,Rejected-Technical,Technically Non-Responsive,20-Feb-2025 04:34 PM,,,,,,,,,,,,,,,,,,,,,,,,,,,,,AOC
,,,,,,,,,,,,,,,,.pdf,TECHNICAL QUALIFICATIONS,,,,,,,,,,,,,,,,,,,,,,,,,,,,,,,,,,,,,,,,,,AOC,,,,,,,,,,,,3,254451,M/S RAJSHEKHAR CONSTRUCTIONS PVT LTD,03-Feb-2025 10:42 AM,Rejected-Technical,Technically Non-Responsive,20-Feb-2025 04:34 PM,,,,,,,,,,,,,,,,,,,,,,,,,,,,,AOC
,,,,,,,,,,,,,,2.0,Finance,.xls,BOQ,,,,,,,,,,,,,,,,,,,,,,,,,,,,,,,,,,,,,,,,,,AOC,,,,,,,,,,,,4,257431,PRABHU AGARWALLA CONSTRUCTION PVT LTD,03-Feb-2025 11:15 AM,Accepted-AOC,Being L1,19-Jun-2025 02:33 PM,,,,,,,,,,,,,,,,,,,,,,,,,,,,,AOC
,,,,,,,,,,,,,,,,.pdf,FORM OF BID,,,,,,,,,,,,,,,,,,,,,,,,,,,,,,,,,,,,,,,,,,AOC,,,,,,,,,,,,5,256767,SAILAJA COMMERCIAL CONSTRUCTION PVT LTD,28-Jan-2025 05:47 PM,Rejected-Finance,Being L2,19-Jun-2025 02:31 PM,,,,,,,,,,,,,,,,,,,,,,,,,,,,,AOC
