Organisation Chain,Tender Reference Number,Tender ID,Withdrawal Allowed,Tender Type,Form of contract,Tender Category,No. of Covers,General Technical Evaluation Allowed,ItemWise Technical Evaluation Allowed,Payment Mode,Is Multi Currency Allowed For BOQ,Is Multi Currency Allowed For Fee,Allow Two Stage Bidding,Cover No,Cover,Document Type,Description,Publish Date,Bid Opening Date,Document Download / Sale Start Date,Document Download / Sale End Date,Clarification Start Date,Clarification End Date,Bid Submission Start Date,Bid Submission End Date,Financial Bid Opening Date,EMD Amount in ₹,EMD Exemption Allowed,EMD Fee Type,EMD Percentage,EMD Payable To,EMD Payable At,S.No,Corrigendum Title,Corrigendum Type,View,S.No.1,Bank Name,Tender Fee in ₹,Fee Payable To,Fee Payable At,Tender Fee Exemption Allowed,Name,Address,Title,Work Description,Pre Qualification Details,Independent External Monitor/Remarks,Tender Value in ₹,Product Category,Sub category,Contract Type,Bid Validity(Days),Period Of Work(Days),Location,Pincode,Pre Bid Meeting Place,Pre Bid Meeting Address,Pre Bid Meeting Date,Bid Opening Place,Should Allow NDA Tender,Allow Preferential Bidder,Tender Stage,Contract Date :,Contract Value :,Work Completion Period in days :,Updated By :,Updated on :,AOC document :,AOC Description :,S.No,Bid Number,Bidder Name,Awarded Currency,Awarded Value,S.No.1,Bid Number.1,Bidder Name.1,Submitted Date,Status,Remarks,Status Updated On,Type :,Summary :,Updated By :.1,Updated On :,Document :,BOQ Comparative Chart :,Committee Chairperson/Co-ordinator Name :,Committee Chairperson/Co-ordinator Type :,Committee Members :,Updated By :.2,Updated on :.1,Document :.1,Organisation Chain :,Tender ID :,Tender Ref No :,Tender Title :,Type :.1,Summary :.1,Updated By :.3,Updated On :.1,Document :.2,Committee Chairperson/Co-ordinator Name :.1,Committee Chairperson/Co-ordinator Type :.1,Committee Members :.1,Updated By :.4,Updated On :.2,Financial Bid Opening Date:,Document :.3,Tender Stage
Industries and Commerce Department||Assam Industrial Development Corporation Ltd - ICD,ECF No.598214/4 dated 01.01.2025,2025_ICD_41821_1,Yes,Open Tender,Item Rate,Works,2.0,No,No,Online,No,No,No,1.0,Fee/PreQual/Technical,.pdf,"Cost of e-Tender Processing Fee, EMD and Cost of Tender Documents",02-Jan-2025 01:00 PM,21-Jan-2025 11:30 AM,02-Jan-2025 01:00 PM,20-Jan-2025 05:00 PM,02-Jan-2025 01:00 PM ,09-Jan-2025 01:00 PM ,02-Jan-2025 01:00 PM,20-Jan-2025 05:00 PM,03-Feb-2025 06:05 PM,"80,320",No,fixed,,Nil,Nil,1.0,Date Corrigendum-II,Date,,1.0,SBI Bank,810.0,Nil,Nil,No,"Managing Director, AIDC","RG Baruah Road, Guwahati-781024",Design and decoration of both interior and exterior of AIDC Exhibition Stall for Advantage Assam 2.0 Summit 2025 at Guwahati,Design and decoration of both interior and exterior of AIDC Exhibition Stall for Advantage Assam 2.0 Summit 2025 at Guwahati,Please refer the Tender Documents ,NA ,"40,15,795",Architecture/Interior Design,NA ,Tender,180.0,10.0,"Khanapara, Guwahati",781022.0,"Conference Hall, AIDC ","RG Baruah Road, Guwahati-781024 ",09-Jan-2025 03:30 PM ,"AIDC, RG Baruah Road, Guwahati-781024",No ,No,AOC,16-Jun-2025,"INR 13,023,750",10.0,Md Hassan Ahmed Choudhury,16-Jun-2025 06:18 PM,LoAAcmeEventsExpo.pdf (1247.00 KB),Work Order Value,1.0,255392.0,ACME EVENTS & EXPO,INR,"13,023,750",1,255392,ACME EVENTS & EXPO,20-Jan-2025 03:24 PM,Accepted-AOC,Awarded Contract Value,16-Jun-2025 06:19 PM,Finance,Financial Bid Opening Summary,Md Hassan Ahmed Choudhury,16-Jun-2025 06:02 PM,finance_67293.pdf,BOQ Comparative Chart,M K Borah,Internal,"M K Borah, T Sarma, A Sarma, H A Choudhury, C Barman, S M Abrar",Md Hassan Ahmed Choudhury,16-Jun-2025 06:10 PM,finsummary_67293.pdf (221.71 KB),Industries and Commerce Department||Assam Industrial Development Corporation Ltd - ICD,2025_ICD_41821_1,ECF No.598214/4 dated 01.01.2025,Design and decoration of both interior and exterior of AIDC Exhibition Stall for Advantage Assam 2.0 Summit 2025 at Guwahati,Technical,Technical Bid Opening Summary,Md Hassan Ahmed Choudhury,21-Jan-2025 01:16 PM,technical_67293.pdf,B C Deori,Internal,BC Deori T Sarma A Sarma H A Choudhury,Sanjeeb Das,03-Feb-2025 06:00 PM,03-Feb-2025 06:05 PM,techsummary_67293.pdf (109.04 KB),AOC
,,,,,,,,,,,,,,,,.pdf,Technical Bid,,,,,,,,,,,,,,,,,,,,,,,,,,,,,,,,,,,,,,,,,,,,,,AOC,,,,,,,,,,,,,2,255750,DIBANG SOLUTION INDIA PRIVATE,20-Jan-2025 03:40 PM,Rejected-Technical,Rejected due to NIT/RFP criteria not fulfilled,03-Feb-2025 06:00 PM,,,,,,,,,,,,,,,,,,,,,,,,,,,,,AOC
,,,,,,,,,,,,,,2.0,Finance,.xls,Financial Bid,,,,,,,,,,,,,,,,,,,,,,,,,,,,,,,,,,,,,,,,,,,,,,AOC,,,,,,,,,,,,,3,255809,MAGNUM ENTERPRISE,20-Jan-2025 04:23 PM,Rejected-Technical,Rejected due to NIT/RFP criteria not fulfilled,03-Feb-2025 06:00 PM,,,,,,,,,,,,,,,,,,,,,,,,,,,,,AOC
,,,,,,,,,,,,,,,,,,,,,,,,,,,,,,,,,,,,,,,,,,,,,,,,,,,,,,,,,,,,,,,AOC,,,,,,,,,,,,,4,255412,PRADIP ADVERTISING & CO.,20-Jan-2025 02:40 PM,Rejected-Technical,Rejected due to NIT/RFP criteria not fulfilled,03-Feb-2025 06:00 PM,,,,,,,,,,,,,,,,,,,,,,,,,,,,,AOC
,,,,,,,,,,,,,,,,,,,,,,,,,,,,,,,,,,,,,,,,,,,,,,,,,,,,,,,,,,,,,,,AOC,,,,,,,,,,,,,5,255572,Prodigy Communications And Marketing Pvt. Ltd.,20-Jan-2025 04:30 PM,Rejected-Technical,Rejected due to NIT/RFP criteria not fulfilled,03-Feb-2025 06:00 PM,,,,,,,,,,,,,,,,,,,,,,,,,,,,,AOC
